library/src/hcc_detail/rocsparselt/src/spmm/Tensile/Logic/aquavanjaram/gfx942/aquavanjaram_Cijk_Ailk_Bjlk_I8I8S_BH_Bias_SPA_AS.yaml
- {MinimumRequiredVersion: 4.33.0}
- aquavanjaram
- gfx942
- [Device 0049, Device 0050]
    SolutionIndex: 0
    SolutionNameMin: Cijk_Ailk_Bjlk_I8I8S_BH_Bias_SPA_AS_MT32x32x64_MI32x32x1_SN_AFC1_AFEM8_DTVSM0_GSU1_LPM2_MIWT1_1_PLR1_SU0_SUS0_VWA1_VWB1_WG32_2_1
    SolutionIndex: 1
    SolutionNameMin: Cijk_Ailk_Bjlk_I8I8S_BH_Bias_SPA_AS_MT32x32x64_MI32x32x1_SN_AFC1_AFEM8_DTVSM1_GSU1_LPMn1_MIWT1_1_PLR1_SU0_SUS0_VWA1_VWB1_WG32_2_1
    SolutionIndex: 2
    SolutionNameMin: Cijk_Ailk_Bjlk_I8I8S_BH_Bias_SPA_AS_MT32x32x64_MI32x32x1_SN_AFC1_AFEM1_DTVSM1_GSU1_LPMn1_MIWT1_1_PLR1_SU4_SUS256_VWA1_VWB1_WG32_2_1
    SolutionIndex: 3
    SolutionNameMin: Cijk_Ailk_Bjlk_I8I8S_BH_Bias_SPA_AS_MT32x32x64_MI32x32x1_SN_AFC1_AFEM8_DTVSM0_GSU1_LPM2_MIWT1_1_PLR1_SU4_SUS256_VWA1_VWB1_WG32_2_1
    SolutionIndex: 4
    SolutionNameMin: Cijk_Ailk_Bjlk_I8I8S_BH_Bias_SPA_AS_MT128x128x64_MI32x32x1_SN_AFC1_AFEM8_DTVSM0_GSU1_LPM2_MIWT2_2_PLR1_SU4_SUS256_VWA2_VWB1_WG64_4_1
    SolutionIndex: 5
    SolutionNameMin: Cijk_Ailk_Bjlk_I8I8S_BH_Bias_SPA_AS_MT128x128x64_MI32x32x1_SN_AFC1_AFEM8_DTVSM0_GSU1_LPM2_MIWT2_2_PLR1_SU4_SUS256_VWA1_VWB2_WG64_4_1
    SolutionIndex: 6
    SolutionNameMin: Cijk_Ailk_Bjlk_I8I8S_BH_Bias_SPA_AS_MT32x32x128_MI32x32x1_SN_AFC1_AFEM1_DTVSM0_GSU1_LPM2_MIWT1_1_PLR3_SU0_SUS0_VWA1_VWB1_WG32_2_1
    SolutionIndex: 7
    SolutionNameMin: Cijk_Ailk_Bjlk_I8I8S_BH_Bias_SPA_AS_MT32x32x128_MI32x32x1_SN_AFC1_AFEM1_DTVSM1_GSU1_LPMn1_MIWT1_1_PLR1_SU0_SUS0_VWA1_VWB1_WG32_2_1
    SolutionIndex: 8
    SolutionNameMin: Cijk_Ailk_Bjlk_I8I8S_BH_Bias_SPA_AS_MT32x32x128_MI32x32x1_SN_AFC1_AFEM8_DTVSM1_GSU1_LPMn1_MIWT1_1_PLR1_SU0_SUS0_VWA1_VWB1_WG32_2_1
    SolutionIndex: 9
    SolutionNameMin: Cijk_Ailk_Bjlk_I8I8S_BH_Bias_SPA_AS_MT32x32x128_MI32x32x1_SN_AFC1_AFEM8_DTVSM1_GSU1_LPMn1_MIWT1_1_PLR3_SU0_SUS0_VWA1_VWB1_WG32_2_1
    SolutionIndex: 10
    SolutionNameMin: Cijk_Ailk_Bjlk_I8I8S_BH_Bias_SPA_AS_MT32x32x128_MI32x32x1_SN_AFC1_AFEM8_DTVSM0_GSU1_LPM2_MIWT1_1_PLR1_SU4_SUS256_VWA1_VWB1_WG32_2_1
    SolutionIndex: 11
    SolutionNameMin: Cijk_Ailk_Bjlk_I8I8S_BH_Bias_SPA_AS_MT32x32x128_MI32x32x1_SN_AFC1_AFEM8_DTVSM0_GSU1_LPM2_MIWT1_1_PLR3_SU4_SUS256_VWA1_VWB1_WG32_2_1
    SolutionIndex: 12
    SolutionNameMin: Cijk_Ailk_Bjlk_I8I8S_BH_Bias_SPA_AS_MT32x32x128_MI32x32x1_SN_AFC1_AFEM8_DTVSM1_GSU1_LPMn1_MIWT1_1_PLR1_SU4_SUS256_VWA1_VWB1_WG32_2_1
    SolutionIndex: 13
    SolutionNameMin: Cijk_Ailk_Bjlk_I8I8S_BH_Bias_SPA_AS_MT32x32x128_MI32x32x1_SN_AFC1_AFEM8_DTVSM1_GSU1_LPMn1_MIWT1_1_PLR3_SU4_SUS256_VWA1_VWB1_WG32_2_1
    SolutionIndex: 14
    SolutionNameMin: Cijk_Ailk_Bjlk_I8I8S_BH_Bias_SPA_AS_MT32x32x128_MI32x32x1_SN_AFC0_AFEM8_DTVSM0_GSU2_LPM2_MIWT1_1_PLR3_SU0_SUS0_VWA1_VWB1_WG32_2_1
    SolutionIndex: 15
    SolutionNameMin: Cijk_Ailk_Bjlk_I8I8S_BH_Bias_SPA_AS_MT32x32x128_MI32x32x1_SN_AFC0_AFEM1_DTVSM1_GSU2_LPMn1_MIWT1_1_PLR3_SU4_SUS256_VWA1_VWB1_WG32_2_1
    SolutionIndex: 16
    SolutionNameMin: Cijk_Ailk_Bjlk_I8I8S_BH_Bias_SPA_AS_MT256x64x128_MI32x32x32x1_SN_1LDSB0_AFC1_AF0EM8_GRVWA8_GRVWB16_GSU1_LBSPPA0_LBSPPB0_LBSPPM0_LPA0_LPB0_LPM2_MIWT2_2_NLCA1_NLCB1_PLR3_SUS256_WG128_2_1
    SolutionIndex: 17
    SolutionNameMin: Cijk_Ailk_Bjlk_I8I8S_BH_Bias_SPA_AS_MT256x160x64_MI32x32x32x1_SN_1LDSB0_AFC0_AF0EM8_GRVWA8_GRVWB8_GSU2_LBSPPA0_LBSPPB0_LBSPPM0_LPA0_LPB0_LPM2_MIWT2_5_NLCA1_NLCB5_PLR1_SUS256_WG128_2_1
    SolutionIndex: 18
    SolutionNameMin: Cijk_Ailk_Bjlk_I8I8S_BH_Bias_SPA_AS_MT256x64x128_MI32x32x32x1_SN_1LDSB0_AFC0_AF0EM8_GRVWA8_GRVWB16_GSU3_LBSPPA0_LBSPPB0_LBSPPM0_LPA0_LPB0_LPM2_MIWT2_2_NLCA1_NLCB1_PLR3_SUS128_WG128_2_1
    SolutionIndex: 19
    SolutionNameMin: Cijk_Ailk_Bjlk_I8I8S_BH_Bias_SPA_AS_MT128x64x128_MI32x32x32x1_SN_1LDSB0_AFC1_AF0EM8_GRVWA8_GRVWB16_GSU1_LBSPPA0_LBSPPB0_LBSPPM0_LPA0_LPB0_LPM2_MIWT1_2_NLCA1_NLCB1_PLR3_SUS128_WG128_2_1
    SolutionIndex: 20
    SolutionNameMin: Cijk_Ailk_Bjlk_I8I8S_BH_Bias_SPA_AS_MT128x48x64_MI16x16x64x1_SN_1LDSB1_AFC1_AF0EM8_GRVWA16_GRVWB4_GSU1_LBSPPA2048_LBSPPB768_LBSPPM2048_LPA16_LPB16_LPM4_MIWT2_3_NLCA1_NLCB3_PLR1_SUS128_WG64_4_1
    SolutionIndex: 21
    SolutionNameMin: Cijk_Ailk_Bjlk_I8I8S_BH_Bias_SPA_AS_MT256x48x64_MI16x16x64x1_SN_1LDSB1_AFC1_AF0EM8_GRVWA16_GRVWB4_GSU1_LBSPPA4096_LBSPPB768_LBSPPM4096_LPA16_LPB16_LPM4_MIWT4_3_NLCA1_NLCB3_PLR1_SUS256_WG64_4_1
    SolutionIndex: 22
    SolutionNameMin: Cijk_Ailk_Bjlk_I8I8S_BH_Bias_SPA_AS_MT256x48x64_MI16x16x64x1_SN_1LDSB1_AFC1_AF0EM8_GRVWA16_GRVWB4_GSU1_LBSPPA4096_LBSPPB768_LBSPPM4096_LPA16_LPB16_LPM4_MIWT4_3_NLCA1_NLCB3_PLR1_SUS128_WG64_4_1
    SolutionIndex: 23
    SolutionNameMin: Cijk_Ailk_Bjlk_I8I8S_BH_Bias_SPA_AS_MT256x96x64_MI16x16x64x1_SN_1LDSB1_AFC1_AF0EM8_GRVWA16_GRVWB8_GSU1_LBSPPA4096_LBSPPB1536_LBSPPM4096_LPA16_LPB16_LPM4_MIWT4_6_NLCA1_NLCB3_PLR1_SUS128_WG64_4_1
    SolutionIndex: 24
    SolutionNameMin: Cijk_Ailk_Bjlk_I8I8S_BH_Bias_SPA_AS_MT256x96x64_MI16x16x64x1_SN_1LDSB1_AFC1_AF0EM8_GRVWA16_GRVWB8_GSU1_LBSPPA4096_LBSPPB1536_LBSPPM4096_LPA16_LPB16_LPM4_MIWT4_6_NLCA1_NLCB3_PLR1_SUS256_WG64_4_1
    SolutionIndex: 25
    SolutionNameMin: Cijk_Ailk_Bjlk_I8I8S_BH_Bias_SPA_AS_MT256x96x64_MI16x16x64x1_SN_1LDSB0_AFC1_AF0EM8_GRVWA16_GRVWB8_GSU1_LBSPPA4096_LBSPPB1536_LBSPPM4096_LPA16_LPB16_LPM4_MIWT4_6_NLCA1_NLCB3_PLR1_SUS128_WG64_4_1
    SolutionIndex: 26
    SolutionNameMin: Cijk_Ailk_Bjlk_I8I8S_BH_Bias_SPA_AS_MT256x96x64_MI16x16x64x1_SN_1LDSB1_AFC1_AF0EM1_GRVWA16_GRVWB8_GSU1_LBSPPA4096_LBSPPB1536_LBSPPM4096_LPA16_LPB16_LPM4_MIWT4_6_NLCA1_NLCB3_PLR1_SUS256_WG64_4_1
    SolutionIndex: 27
    SolutionNameMin: Cijk_Ailk_Bjlk_I8I8S_BH_Bias_SPA_AS_MT256x96x64_MI16x16x64x1_SN_1LDSB0_AFC1_AF0EM8_GRVWA16_GRVWB8_GSU1_LBSPPA4096_LBSPPB1536_LBSPPM4096_LPA16_LPB16_LPM4_MIWT4_6_NLCA1_NLCB3_PLR1_SUS256_WG64_4_1
    SolutionIndex: 28
    SolutionNameMin: Cijk_Ailk_Bjlk_I8I8S_BH_Bias_SPA_AS_MT256x256x64_MI32x32x32x1_SN_1LDSB0_AFC1_AF0EM1_GRVWA8_GRVWB16_GSU1_LBSPPA0_LBSPPB0_LBSPPM0_LPA0_LPB0_LPM2_MIWT4_4_NLCA1_NLCB1_PLR1_SUS256_WG64_4_1
    SolutionIndex: 29
    SolutionNameMin: Cijk_Ailk_Bjlk_I8I8S_BH_Bias_SPA_AS_MT256x256x64_MI32x32x32x1_SN_1LDSB0_AFC1_AF0EM8_GRVWA8_GRVWB16_GSU1_LBSPPA0_LBSPPB0_LBSPPM0_LPA0_LPB0_LPM2_MIWT4_4_NLCA1_NLCB1_PLR1_SUS128_WG64_4_1
    SolutionIndex: 30
    SolutionNameMin: Cijk_Ailk_Bjlk_I8I8S_BH_Bias_SPA_AS_MT256x256x64_MI32x32x32x1_SN_1LDSB0_AFC1_AF0EM8_GRVWA8_GRVWB16_GSU1_LBSPPA0_LBSPPB0_LBSPPM0_LPA0_LPB0_LPM2_MIWT4_4_NLCA1_NLCB1_PLR1_SUS256_WG64_4_1
- - - [16, 16, 1, 16]
    - [1, 0.0]
  - - [16, 16, 1, 32]
    - [1, 0.0]
  - - [16, 16, 1, 64]
    - [0, 0.0]
  - - [16, 16, 1, 96]
    - [2, 0.0]
  - - [16, 16, 1, 128]
    - [12, 0.0]
  - - [16, 16, 1, 136]
    - [3, 0.0]
  - - [16, 16, 1, 256]
    - [10, 0.0]
  - - [16, 16, 1, 264]
    - [3, 0.0]
  - - [256, 256, 1, 16]
    - [9, 0.003]
  - - [256, 256, 1, 24]
    - [12, 0.005]
  - - [256, 256, 1, 32]
    - [9, 0.007]
  - - [256, 256, 1, 64]
    - [11, 0.012]
  - - [256, 256, 1, 96]
    - [13, 0.018]
  - - [256, 256, 1, 128]
    - [9, 0.03]
  - - [256, 256, 1, 136]
    - [8, 0.027]
  - - [256, 256, 1, 256]
    - [15, 0.038]
  - - [384, 384, 1, 16]
    - [7, 0.007]
  - - [384, 384, 1, 24]
    - [13, 0.008]
  - - [384, 384, 1, 32]
    - [14, 0.008]
  - - [384, 384, 1, 64]
    - [6, 0.026]
  - - [384, 384, 1, 96]
    - [4, 0.03]
  - - [384, 384, 1, 128]
    - [5, 0.046]
  - - [384, 384, 1, 136]
    - [6, 0.052]
  - - [384, 384, 1, 256]
    - [9, 0.109]
  - - [3072, 1024, 1, 16384]
    - [16, 10.72]
  - - [4096, 1024, 1, 16384]
    - [17, 13.423]
  - - [1024, 1024, 1, 16384]
    - [18, 7.997]
  - - [1024, 4096, 1, 16384]
    - [17, 14.18]
  - - [3072, 3072, 1, 1024]
    - [19, 3.454]
  - - [4096, 4096, 1, 1024]
    - [20, 6.16]
  - - [5120, 5120, 1, 1024]
    - [21, 8.111]
  - - [6144, 6144, 1, 1024]
    - [21, 8.571]
  - - [7168, 7168, 1, 1024]
    - [22, 8.812]
  - - [8192, 8192, 1, 1024]
    - [21, 9.134]
  - - [9216, 9216, 1, 1024]
    - [22, 9.136]
  - - [10240, 10240, 1, 1024]
    - [23, 9.414]
  - - [11264, 11264, 1, 1024]
    - [24, 9.554]
  - - [12288, 12288, 1, 1024]
    - [23, 9.694]
  - - [13312, 13312, 1, 1024]
    - [23, 9.692]
  - - [14336, 14336, 1, 1024]
    - [23, 9.785]
  - - [15360, 15360, 1, 1024]
    - [23, 9.746]
  - - [16384, 16384, 1, 1024]
    - [25, 10.023]
  - - [17408, 17408, 1, 1024]
    - [25, 9.835]
  - - [18432, 18432, 1, 1024]
    - [26, 9.956]
  - - [19456, 19456, 1, 1024]
    - [27, 9.963]
  - - [20480, 20480, 1, 1024]
    - [25, 9.926]
  - - [10240, 10240, 1, 2560]
    - [28, 13.64]
  - - [10240, 10240, 1, 3840]
    - [28, 16.487]
  - - [10240, 10240, 1, 5120]
    - [28, 18.234]
  - - [10240, 10240, 1, 6400]
    - [29, 19.746]
  - - [10240, 10240, 1, 7680]
    - [30, 20.593]
  - - [10240, 10240, 1, 8960]
    - [29, 20.183]
  - - [10240, 10240, 1, 10240]
    - [29, 22.125]
  - - [10240, 10240, 1, 11520]
    - [28, 21.626]
  - - [10240, 10240, 1, 12800]
    - [29, 22.187]
  - - [10240, 10240, 1, 14080]
    - [29, 22.658]
  - - [10240, 10240, 1, 15360]
    - [29, 23.052]
  - - [10240, 10240, 1, 16640]
    - [29, 23.331]
  - - [10240, 10240, 1, 17920]
    - [29, 23.661]
  - - [10240, 10240, 1, 19200]
    - [29, 23.92]
  - - [10240, 10240, 1, 20480]
    - [29, 24.102]
- null
- null
- DeviceEfficiency
- null
- Euclidean
