library/src/hcc_detail/rocsparselt/src/spmm/Tensile/Logic/aquavanjaram/gfx942/aquavanjaram_Cijk_Alik_Bljk_I8I8S_BH_Bias_SPA_AS.yaml
- {MinimumRequiredVersion: 4.33.0}
- aquavanjaram
- gfx942
- [Device 0049, Device 0050]
    SolutionIndex: 0
    SolutionNameMin: Cijk_Alik_Bljk_I8I8S_BH_Bias_SPA_AS_MT32x32x64_MI32x32x1_SN_LDSB0_AFC1_AFEM1_DTVSM0_GRVWA8_GSU1_LPA8_LPB16_LPM2_MIWT1_1_PLR1_SU0_SUS0_TLDS1_VWA1_VWB1_WG32_2_1
    SolutionIndex: 1
    SolutionNameMin: Cijk_Alik_Bljk_I8I8S_BH_Bias_SPA_AS_MT32x32x64_MI32x32x1_SN_LDSB0_AFC1_AFEM1_DTVSM1_GRVWA8_GSU1_LPA8_LPB16_LPMn1_MIWT1_1_PLR1_SU0_SUS0_TLDS1_VWA1_VWB1_WG32_2_1
    SolutionIndex: 2
    SolutionNameMin: Cijk_Alik_Bljk_I8I8S_BH_Bias_SPA_AS_MT32x32x64_MI32x32x1_SN_LDSB0_AFC1_AFEM1_DTVSM1_GRVWA16_GSU1_LPA16_LPB16_LPMn1_MIWT1_1_PLR1_SU0_SUS0_TLDS1_VWA1_VWB1_WG32_2_1
    SolutionIndex: 3
    SolutionNameMin: Cijk_Alik_Bljk_I8I8S_BH_Bias_SPA_AS_MT32x32x64_MI32x32x1_SN_LDSB0_AFC1_AFEM8_DTVSM0_GRVWA8_GSU1_LPA8_LPB16_LPM2_MIWT1_1_PLR1_SU0_SUS0_TLDS1_VWA1_VWB1_WG32_2_1
    SolutionIndex: 4
    SolutionNameMin: Cijk_Alik_Bljk_I8I8S_BH_Bias_SPA_AS_MT32x32x64_MI32x32x1_SN_LDSB0_AFC1_AFEM8_DTVSM1_GRVWA8_GSU1_LPA8_LPB16_LPMn1_MIWT1_1_PLR1_SU0_SUS0_TLDS1_VWA1_VWB1_WG32_2_1
    SolutionIndex: 5
    SolutionNameMin: Cijk_Alik_Bljk_I8I8S_BH_Bias_SPA_AS_MT32x32x64_MI32x32x1_SN_LDSB0_AFC1_AFEM8_DTVSM1_GRVWA16_GSU1_LPA16_LPB16_LPMn1_MIWT1_1_PLR1_SU0_SUS0_TLDS1_VWA1_VWB1_WG32_2_1
    SolutionIndex: 6
    SolutionNameMin: Cijk_Alik_Bljk_I8I8S_BH_Bias_SPA_AS_MT32x32x64_MI32x32x1_SN_LDSB0_AFC1_AFEM1_DTVSM1_GRVWA16_GSU1_LPA16_LPB16_LPMn1_MIWT1_1_PLR1_SU4_SUS256_TLDS1_VWA1_VWB1_WG32_2_1
    SolutionIndex: 7
    SolutionNameMin: Cijk_Alik_Bljk_I8I8S_BH_Bias_SPA_AS_MT32x32x64_MI32x32x1_SN_LDSB0_AFC1_AFEM8_DTVSM0_GRVWA8_GSU1_LPA8_LPB16_LPM2_MIWT1_1_PLR1_SU4_SUS256_TLDS1_VWA1_VWB1_WG32_2_1
    SolutionIndex: 8
    SolutionNameMin: Cijk_Alik_Bljk_I8I8S_BH_Bias_SPA_AS_MT32x32x64_MI32x32x1_SN_LDSB0_AFC0_AFEM8_DTVSM1_GRVWA16_GSU2_LPA16_LPB16_LPMn1_MIWT1_1_PLR1_SU0_SUS0_TLDS1_VWA1_VWB1_WG32_2_1
    SolutionIndex: 9
    SolutionNameMin: Cijk_Alik_Bljk_I8I8S_BH_Bias_SPA_AS_MT256x256x64_MI32x32x1_SN_LDSB0_AFC1_AFEM8_DTVSM1_GRVWA16_GSU1_LPA16_LPB16_LPMn1_MIWT4_2_PLR1_SU4_SUS256_TLDS1_VWA1_VWB1_WG64_8_1
    SolutionIndex: 10
    SolutionNameMin: Cijk_Alik_Bljk_I8I8S_BH_Bias_SPA_AS_MT32x32x128_MI32x32x1_SN_LDSB0_AFC1_AFEM1_DTVSM1_GRVWA8_GSU1_LPA8_LPB16_LPMn1_MIWT1_1_PLR3_SU0_SUS0_TLDS1_VWA1_VWB1_WG32_2_1
    SolutionIndex: 11
    SolutionNameMin: Cijk_Alik_Bljk_I8I8S_BH_Bias_SPA_AS_MT32x32x128_MI32x32x1_SN_LDSB0_AFC1_AFEM1_DTVSM1_GRVWA16_GSU1_LPA16_LPB16_LPMn1_MIWT1_1_PLR3_SU0_SUS0_TLDS1_VWA1_VWB1_WG32_2_1
    SolutionIndex: 12
    SolutionNameMin: Cijk_Alik_Bljk_I8I8S_BH_Bias_SPA_AS_MT32x32x128_MI32x32x1_SN_LDSB0_AFC1_AFEM8_DTVSM1_GRVWA16_GSU1_LPA16_LPB16_LPMn1_MIWT1_1_PLR1_SU0_SUS0_TLDS1_VWA1_VWB1_WG32_2_1
    SolutionIndex: 13
    SolutionNameMin: Cijk_Alik_Bljk_I8I8S_BH_Bias_SPA_AS_MT32x32x128_MI32x32x1_SN_LDSB0_AFC1_AFEM1_DTVSM1_GRVWA8_GSU1_LPA0_LPB0_LPMn1_MIWT1_1_PLR1_SU4_SUS256_TLDS0_VWA1_VWB1_WG32_2_1
    SolutionIndex: 14
    SolutionNameMin: Cijk_Alik_Bljk_I8I8S_BH_Bias_SPA_AS_MT32x32x128_MI32x32x1_SN_LDSB0_AFC1_AFEM8_DTVSM0_GRVWA16_GSU1_LPA16_LPB16_LPM4_MIWT1_1_PLR1_SU4_SUS256_TLDS1_VWA1_VWB1_WG32_2_1
    SolutionIndex: 15
    SolutionNameMin: Cijk_Alik_Bljk_I8I8S_BH_Bias_SPA_AS_MT32x32x128_MI32x32x1_SN_LDSB0_AFC1_AFEM8_DTVSM1_GRVWA8_GSU1_LPA8_LPB16_LPMn1_MIWT1_1_PLR1_SU4_SUS256_TLDS1_VWA1_VWB1_WG32_2_1
    SolutionIndex: 16
    SolutionNameMin: Cijk_Alik_Bljk_I8I8S_BH_Bias_SPA_AS_MT128x256x128_MI32x32x32x1_SN_1LDSB1_AFC0_AF0EM8_GRVWB16_GSU2_LPB16_MIWT2_4_PLR1_SUS128_WG64_4_1
    SolutionIndex: 17
    SolutionNameMin: Cijk_Alik_Bljk_I8I8S_BH_Bias_SPA_AS_MT192x256x128_MI16x16x64x1_SN_1LDSB1_AFC0_AF0EM1_GRVWB16_GSU2_LPB32_MIWT6_8_PLR1_SUS256_WG32_8_1
    SolutionIndex: 18
    SolutionNameMin: Cijk_Alik_Bljk_I8I8S_BH_Bias_SPA_AS_MT128x128x128_MI32x32x32x1_SN_1LDSB0_AFC0_AF0EM8_GRVWB16_GSU3_LPB16_MIWT4_1_PLR3_SUS128_WG32_8_1
    SolutionIndex: 19
    SolutionNameMin: Cijk_Alik_Bljk_I8I8S_BH_Bias_SPA_AS_MT128x192x128_MI16x16x64x1_SN_1LDSB1_AFC1_AF0EM8_GRVWB16_GSU1_LPB32_MIWT4_6_PLR1_SUS256_WG32_8_1
    SolutionIndex: 20
    SolutionNameMin: Cijk_Alik_Bljk_I8I8S_BH_Bias_SPA_AS_MT128x128x128_MI32x32x32x1_SN_1LDSB0_AFC1_AF0EM8_GRVWB16_GSU1_LPB16_MIWT1_4_PLR1_SUS128_WG128_2_1
    SolutionIndex: 21
    SolutionNameMin: Cijk_Alik_Bljk_I8I8S_BH_Bias_SPA_AS_MT128x48x64_MI16x16x64x1_SN_1LDSB0_AFC1_AF0EM1_GRVWB4_GSU1_LPB32_MIWT2_3_PLR1_SUS128_WG64_4_1
    SolutionIndex: 22
    SolutionNameMin: Cijk_Alik_Bljk_I8I8S_BH_Bias_SPA_AS_MT256x96x128_MI16x16x64x1_SN_1LDSB1_AFC1_AF0EM8_GRVWB16_GSU1_LPB32_MIWT8_3_PLR1_SUS128_WG32_8_1
    SolutionIndex: 23
    SolutionNameMin: Cijk_Alik_Bljk_I8I8S_BH_Bias_SPA_AS_MT256x96x128_MI16x16x64x1_SN_1LDSB1_AFC1_AF0EM1_GRVWB16_GSU1_LPB32_MIWT4_6_PLR1_SUS128_WG64_4_1
    SolutionIndex: 24
    SolutionNameMin: Cijk_Alik_Bljk_I8I8S_BH_Bias_SPA_AS_MT256x224x128_MI16x16x64x1_SN_1LDSB1_AFC1_AF0EM8_GRVWB16_GSU1_LPB32_MIWT8_7_PLR1_SUS128_WG32_8_1
    SolutionIndex: 25
    SolutionNameMin: Cijk_Alik_Bljk_I8I8S_BH_Bias_SPA_AS_MT256x96x128_MI16x16x64x1_SN_1LDSB1_AFC1_AF0EM8_GRVWB16_GSU1_LPB32_MIWT4_6_PLR1_SUS128_WG64_4_1
    SolutionIndex: 26
    SolutionNameMin: Cijk_Alik_Bljk_I8I8S_BH_Bias_SPA_AS_MT256x96x128_MI16x16x64x1_SN_1LDSB1_AFC1_AF0EM8_GRVWB16_GSU1_LPB32_MIWT4_6_PLR1_SUS256_WG64_4_1
    SolutionIndex: 27
    SolutionNameMin: Cijk_Alik_Bljk_I8I8S_BH_Bias_SPA_AS_MT192x256x128_MI16x16x64x1_SN_1LDSB1_AFC1_AF0EM8_GRVWB16_GSU1_LPB32_MIWT6_8_PLR1_SUS128_WG32_8_1
    SolutionIndex: 28
    SolutionNameMin: Cijk_Alik_Bljk_I8I8S_BH_Bias_SPA_AS_MT256x192x128_MI16x16x64x1_SN_1LDSB1_AFC1_AF0EM8_GRVWB16_GSU1_LPB32_MIWT8_6_PLR1_SUS256_WG32_8_1
    SolutionIndex: 29
    SolutionNameMin: Cijk_Alik_Bljk_I8I8S_BH_Bias_SPA_AS_MT256x192x128_MI16x16x64x1_SN_1LDSB1_AFC1_AF0EM8_GRVWB16_GSU1_LPB32_MIWT8_6_PLR1_SUS128_WG32_8_1
    SolutionIndex: 30
    SolutionNameMin: Cijk_Alik_Bljk_I8I8S_BH_Bias_SPA_AS_MT192x256x128_MI16x16x64x1_SN_1LDSB1_AFC1_AF0EM1_GRVWB16_GSU1_LPB32_MIWT6_8_PLR1_SUS256_WG32_8_1
    SolutionIndex: 31
    SolutionNameMin: Cijk_Alik_Bljk_I8I8S_BH_Bias_SPA_AS_MT192x256x128_MI16x16x64x1_SN_1LDSB1_AFC1_AF0EM8_GRVWB16_GSU1_LPB32_MIWT6_8_PLR1_SUS256_WG32_8_1
- - - [16, 16, 1, 16]
    - [4, 0.0]
  - - [16, 16, 1, 32]
    - [4, 0.0]
  - - [16, 16, 1, 64]
    - [4, 0.0]
  - - [16, 16, 1, 96]
    - [4, 0.0]
  - - [16, 16, 1, 128]
    - [4, 0.0]
  - - [16, 16, 1, 136]
    - [4, 0.0]
  - - [16, 16, 1, 256]
    - [4, 0.0]
  - - [16, 16, 1, 264]
    - [8, 0.0]
  - - [256, 256, 1, 16]
    - [2, 0.004]
  - - [256, 256, 1, 24]
    - [5, 0.006]
  - - [256, 256, 1, 32]
    - [3, 0.008]
  - - [256, 256, 1, 64]
    - [5, 0.018]
  - - [256, 256, 1, 96]
    - [4, 0.024]
  - - [256, 256, 1, 128]
    - [10, 0.035]
  - - [256, 256, 1, 136]
    - [1, 0.032]
  - - [256, 256, 1, 256]
    - [0, 0.066]
  - - [384, 384, 1, 16]
    - [12, 0.007]
  - - [384, 384, 1, 24]
    - [13, 0.009]
  - - [384, 384, 1, 32]
    - [11, 0.014]
  - - [384, 384, 1, 64]
    - [9, 0.017]
  - - [384, 384, 1, 96]
    - [15, 0.042]
  - - [384, 384, 1, 128]
    - [7, 0.054]
  - - [384, 384, 1, 136]
    - [6, 0.057]
  - - [384, 384, 1, 256]
    - [14, 0.124]
  - - [3072, 1024, 1, 16384]
    - [16, 17.941]
  - - [4096, 1024, 1, 16384]
    - [17, 20.443]
  - - [1024, 1024, 1, 16384]
    - [18, 12.35]
  - - [1024, 4096, 1, 16384]
    - [19, 22.176]
  - - [3072, 3072, 1, 1024]
    - [20, 5.775]
  - - [4096, 4096, 1, 1024]
    - [21, 6.908]
  - - [5120, 5120, 1, 1024]
    - [22, 11.103]
  - - [6144, 6144, 1, 1024]
    - [23, 13.534]
  - - [7168, 7168, 1, 1024]
    - [24, 14.126]
  - - [8192, 8192, 1, 1024]
    - [25, 14.652]
  - - [9216, 9216, 1, 1024]
    - [23, 15.154]
  - - [10240, 10240, 1, 1024]
    - [26, 15.224]
  - - [11264, 11264, 1, 1024]
    - [25, 15.441]
  - - [12288, 12288, 1, 1024]
    - [23, 15.882]
  - - [13312, 13312, 1, 1024]
    - [27, 16.132]
  - - [14336, 14336, 1, 1024]
    - [27, 16.368]
  - - [15360, 15360, 1, 1024]
    - [28, 16.573]
  - - [16384, 16384, 1, 1024]
    - [27, 17.305]
  - - [17408, 17408, 1, 1024]
    - [29, 16.779]
  - - [18432, 18432, 1, 1024]
    - [30, 17.04]
  - - [19456, 19456, 1, 1024]
    - [24, 17.075]
  - - [20480, 20480, 1, 1024]
    - [29, 17.04]
  - - [10240, 10240, 1, 2560]
    - [31, 24.921]
  - - [10240, 10240, 1, 3840]
    - [27, 29.45]
  - - [10240, 10240, 1, 5120]
    - [27, 31.424]
  - - [10240, 10240, 1, 6400]
    - [31, 34.256]
  - - [10240, 10240, 1, 7680]
    - [27, 35.599]
  - - [10240, 10240, 1, 8960]
    - [29, 36.557]
  - - [10240, 10240, 1, 10240]
    - [27, 35.28]
  - - [10240, 10240, 1, 11520]
    - [28, 37.946]
  - - [10240, 10240, 1, 12800]
    - [27, 38.276]
  - - [10240, 10240, 1, 14080]
    - [27, 38.041]
  - - [10240, 10240, 1, 15360]
    - [27, 36.951]
  - - [10240, 10240, 1, 16640]
    - [27, 38.968]
  - - [10240, 10240, 1, 17920]
    - [31, 39.06]
  - - [10240, 10240, 1, 19200]
    - [28, 38.87]
  - - [10240, 10240, 1, 20480]
    - [29, 33.854]
- null
- null
- DeviceEfficiency
- null
- Euclidean
