library/src/hcc_detail/rocsparselt/src/spmm/Tensile/Logic/aquavanjaram/gfx942/aquavanjaram_Cijk_Ailk_Bljk_I8I8S_BH_Bias_SPA_AS.yaml
- {MinimumRequiredVersion: 4.33.0}
- aquavanjaram
- gfx942
- [Device 0049, Device 0050]
    SolutionIndex: 0
    SolutionNameMin: Cijk_Ailk_Bljk_I8I8S_BH_Bias_SPA_AS_MT32x32x64_MI32x32x1_SN_LDSB0_AFC1_AFEM8_DTVSM0_GSU1_LPB0_LPM2_MIWT1_1_PLR1_SU0_SUS0_TLDS0_VWA1_VWB1_WG32_2_1
    SolutionIndex: 1
    SolutionNameMin: Cijk_Ailk_Bljk_I8I8S_BH_Bias_SPA_AS_MT32x32x64_MI32x32x1_SN_LDSB0_AFC1_AFEM8_DTVSM0_GSU1_LPB16_LPM2_MIWT1_1_PLR1_SU0_SUS0_TLDS1_VWA1_VWB1_WG32_2_1
    SolutionIndex: 2
    SolutionNameMin: Cijk_Ailk_Bljk_I8I8S_BH_Bias_SPA_AS_MT32x32x64_MI32x32x1_SN_LDSB0_AFC1_AFEM8_DTVSM1_GSU1_LPB0_LPMn1_MIWT1_1_PLR1_SU0_SUS0_TLDS0_VWA1_VWB1_WG32_2_1
    SolutionIndex: 3
    SolutionNameMin: Cijk_Ailk_Bljk_I8I8S_BH_Bias_SPA_AS_MT32x32x64_MI32x32x1_SN_LDSB0_AFC1_AFEM8_DTVSM1_GSU1_LPB16_LPMn1_MIWT1_1_PLR1_SU0_SUS0_TLDS1_VWA1_VWB1_WG32_2_1
    SolutionIndex: 4
    SolutionNameMin: Cijk_Ailk_Bljk_I8I8S_BH_Bias_SPA_AS_MT32x32x64_MI32x32x1_SN_LDSB0_AFC1_AFEM1_DTVSM0_GSU1_LPB16_LPM2_MIWT1_1_PLR1_SU4_SUS256_TLDS1_VWA1_VWB1_WG32_2_1
    SolutionIndex: 5
    SolutionNameMin: Cijk_Ailk_Bljk_I8I8S_BH_Bias_SPA_AS_MT32x32x64_MI32x32x1_SN_LDSB0_AFC1_AFEM1_DTVSM1_GSU1_LPB0_LPMn1_MIWT1_1_PLR1_SU4_SUS256_TLDS0_VWA1_VWB1_WG32_2_1
    SolutionIndex: 6
    SolutionNameMin: Cijk_Ailk_Bljk_I8I8S_BH_Bias_SPA_AS_MT32x32x64_MI32x32x1_SN_LDSB0_AFC1_AFEM8_DTVSM0_GSU1_LPB0_LPM2_MIWT1_1_PLR1_SU4_SUS256_TLDS0_VWA1_VWB1_WG32_2_1
    SolutionIndex: 7
    SolutionNameMin: Cijk_Ailk_Bljk_I8I8S_BH_Bias_SPA_AS_MT32x32x64_MI32x32x1_SN_LDSB0_AFC1_AFEM8_DTVSM0_GSU1_LPB16_LPM2_MIWT1_1_PLR1_SU4_SUS256_TLDS1_VWA1_VWB1_WG32_2_1
    SolutionIndex: 8
    SolutionNameMin: Cijk_Ailk_Bljk_I8I8S_BH_Bias_SPA_AS_MT32x32x64_MI32x32x1_SN_LDSB0_AFC1_AFEM8_DTVSM1_GSU1_LPB16_LPMn1_MIWT1_1_PLR1_SU4_SUS256_TLDS1_VWA1_VWB1_WG32_2_1
    SolutionIndex: 9
    SolutionNameMin: Cijk_Ailk_Bljk_I8I8S_BH_Bias_SPA_AS_MT32x32x64_MI32x32x1_SN_LDSB0_AFC0_AFEM8_DTVSM0_GSU2_LPB16_LPM2_MIWT1_1_PLR1_SU0_SUS0_TLDS1_VWA1_VWB1_WG32_2_1
    SolutionIndex: 10
    SolutionNameMin: Cijk_Ailk_Bljk_I8I8S_BH_Bias_SPA_AS_MT32x32x64_MI32x32x1_SN_LDSB0_AFC0_AFEM8_DTVSM1_GSU2_LPB16_LPMn1_MIWT1_1_PLR1_SU0_SUS0_TLDS1_VWA1_VWB1_WG32_2_1
    SolutionIndex: 11
    SolutionNameMin: Cijk_Ailk_Bljk_I8I8S_BH_Bias_SPA_AS_MT128x128x64_MI32x32x1_SN_LDSB0_AFC1_AFEM1_DTVSM0_GSU1_LPB16_LPM2_MIWT2_2_PLR1_SU0_SUS0_TLDS1_VWA2_VWB1_WG64_4_1
    SolutionIndex: 12
    SolutionNameMin: Cijk_Ailk_Bljk_I8I8S_BH_Bias_SPA_AS_MT128x128x64_MI32x32x1_SN_LDSB0_AFC1_AFEM1_DTVSM0_GSU1_LPB16_LPM2_MIWT2_2_PLR1_SU4_SUS256_TLDS1_VWA1_VWB2_WG64_4_1
    SolutionIndex: 13
    SolutionNameMin: Cijk_Ailk_Bljk_I8I8S_BH_Bias_SPA_AS_MT32x32x128_MI32x32x1_SN_LDSB0_AFC1_AFEM1_DTVSM0_GSU1_LPB16_LPM2_MIWT1_1_PLR3_SU0_SUS0_TLDS1_VWA1_VWB1_WG32_2_1
    SolutionIndex: 14
    SolutionNameMin: Cijk_Ailk_Bljk_I8I8S_BH_Bias_SPA_AS_MT32x32x128_MI32x32x1_SN_LDSB0_AFC1_AFEM8_DTVSM1_GSU1_LPB16_LPMn1_MIWT1_1_PLR3_SU0_SUS0_TLDS1_VWA1_VWB1_WG32_2_1
    SolutionIndex: 15
    SolutionNameMin: Cijk_Ailk_Bljk_I8I8S_BH_Bias_SPA_AS_MT32x32x128_MI32x32x1_SN_LDSB0_AFC1_AFEM1_DTVSM1_GSU1_LPB16_LPMn1_MIWT1_1_PLR1_SU4_SUS256_TLDS1_VWA1_VWB1_WG32_2_1
    SolutionIndex: 16
    SolutionNameMin: Cijk_Ailk_Bljk_I8I8S_BH_Bias_SPA_AS_MT32x32x128_MI32x32x1_SN_LDSB0_AFC1_AFEM8_DTVSM0_GSU1_LPB16_LPM2_MIWT1_1_PLR3_SU4_SUS256_TLDS1_VWA1_VWB1_WG32_2_1
    SolutionIndex: 17
    SolutionNameMin: Cijk_Ailk_Bljk_I8I8S_BH_Bias_SPA_AS_MT32x32x128_MI32x32x1_SN_LDSB0_AFC1_AFEM8_DTVSM1_GSU1_LPB16_LPMn1_MIWT1_1_PLR1_SU4_SUS256_TLDS1_VWA1_VWB1_WG32_2_1
    SolutionIndex: 18
    SolutionNameMin: Cijk_Ailk_Bljk_I8I8S_BH_Bias_SPA_AS_MT32x32x128_MI32x32x1_SN_LDSB0_AFC1_AFEM8_DTVSM1_GSU1_LPB16_LPMn1_MIWT1_1_PLR3_SU4_SUS256_TLDS1_VWA1_VWB1_WG32_2_1
    SolutionIndex: 19
    SolutionNameMin: Cijk_Ailk_Bljk_I8I8S_BH_Bias_SPA_AS_MT32x32x128_MI32x32x1_SN_LDSB0_AFC0_AFEM8_DTVSM0_GSU2_LPB16_LPM2_MIWT1_1_PLR3_SU4_SUS256_TLDS1_VWA1_VWB1_WG32_2_1
    SolutionIndex: 20
    SolutionNameMin: Cijk_Ailk_Bljk_I8I8S_BH_Bias_SPA_AS_MT256x128x64_MI32x32x32x1_SN_1LDSB0_AFC0_AF0EM8_GRVWA8_GRVWB16_GSU2_LBSPPA0_LBSPPM0_LPA0_LPB16_LPM2_MIWT2_4_NLCA1_PLR1_SUS256_WG128_2_1
    SolutionIndex: 21
    SolutionNameMin: Cijk_Ailk_Bljk_I8I8S_BH_Bias_SPA_AS_MT256x160x64_MI32x32x32x1_SN_1LDSB0_AFC0_AF0EM8_GRVWA8_GRVWB8_GSU2_LBSPPA0_LBSPPM0_LPA0_LPB16_LPM2_MIWT2_5_NLCA1_PLR1_SUS128_WG128_2_1
    SolutionIndex: 22
    SolutionNameMin: Cijk_Ailk_Bljk_I8I8S_BH_Bias_SPA_AS_MT128x128x128_MI32x32x32x1_SN_1LDSB0_AFC0_AF0EM1_GRVWA8_GRVWB16_GSU3_LBSPPA0_LBSPPM0_LPA0_LPB16_LPM2_MIWT1_4_NLCA1_PLR3_SUS128_WG128_2_1
    SolutionIndex: 23
    SolutionNameMin: Cijk_Ailk_Bljk_I8I8S_BH_Bias_SPA_AS_MT256x192x64_MI32x32x32x1_SN_1LDSB0_AFC0_AF0EM8_GRVWA8_GRVWB16_GSU2_LBSPPA0_LBSPPM0_LPA0_LPB16_LPM2_MIWT2_6_NLCA1_PLR1_SUS256_WG128_2_1
    SolutionIndex: 24
    SolutionNameMin: Cijk_Ailk_Bljk_I8I8S_BH_Bias_SPA_AS_MT128x192x64_MI16x16x64x1_SN_1LDSB1_AFC1_AF0EM8_GRVWA16_GRVWB16_GSU1_LBSPPA2048_LBSPPM2048_LPA16_LPB32_LPM4_MIWT4_6_NLCA1_PLR1_SUS128_WG32_8_1
    SolutionIndex: 25
    SolutionNameMin: Cijk_Ailk_Bljk_I8I8S_BH_Bias_SPA_AS_MT128x96x64_MI16x16x64x1_SN_1LDSB0_AFC1_AF0EM8_GRVWA16_GRVWB8_GSU1_LBSPPA2048_LBSPPM2048_LPA16_LPB32_LPM4_MIWT2_6_NLCA1_PLR1_SUS128_WG64_4_1
    SolutionIndex: 26
    SolutionNameMin: Cijk_Ailk_Bljk_I8I8S_BH_Bias_SPA_AS_MT256x96x64_MI16x16x64x1_SN_1LDSB1_AFC1_AF0EM8_GRVWA16_GRVWB8_GSU1_LBSPPA4096_LBSPPM4096_LPA16_LPB32_LPM4_MIWT4_6_NLCA1_PLR1_SUS256_WG64_4_1
    SolutionIndex: 27
    SolutionNameMin: Cijk_Ailk_Bljk_I8I8S_BH_Bias_SPA_AS_MT256x96x64_MI16x16x64x1_SN_1LDSB1_AFC1_AF0EM8_GRVWA16_GRVWB8_GSU1_LBSPPA4096_LBSPPM4096_LPA16_LPB32_LPM4_MIWT4_6_NLCA1_PLR1_SUS128_WG64_4_1
    SolutionIndex: 28
    SolutionNameMin: Cijk_Ailk_Bljk_I8I8S_BH_Bias_SPA_AS_MT256x96x64_MI16x16x64x1_SN_1LDSB1_AFC1_AF0EM1_GRVWA16_GRVWB8_GSU1_LBSPPA4096_LBSPPM4096_LPA16_LPB32_LPM4_MIWT4_6_NLCA1_PLR1_SUS256_WG64_4_1
    SolutionIndex: 29
    SolutionNameMin: Cijk_Ailk_Bljk_I8I8S_BH_Bias_SPA_AS_MT128x192x64_MI16x16x64x1_SN_1LDSB1_AFC1_AF0EM8_GRVWA16_GRVWB16_GSU1_LBSPPA2048_LBSPPM2048_LPA16_LPB32_LPM4_MIWT4_6_NLCA1_PLR1_SUS256_WG32_8_1
    SolutionIndex: 30
    SolutionNameMin: Cijk_Ailk_Bljk_I8I8S_BH_Bias_SPA_AS_MT256x192x64_MI16x16x64x1_SN_1LDSB0_AFC1_AF0EM8_GRVWA16_GRVWB16_GSU1_LBSPPA4096_LBSPPM4096_LPA16_LPB32_LPM4_MIWT8_6_NLCA1_PLR1_SUS128_WG32_8_1
    SolutionIndex: 31
    SolutionNameMin: Cijk_Ailk_Bljk_I8I8S_BH_Bias_SPA_AS_MT256x192x64_MI32x32x32x1_SN_1LDSB0_AFC1_AF0EM8_GRVWA8_GRVWB16_GSU1_LBSPPA0_LBSPPM0_LPA0_LPB16_LPM2_MIWT4_3_NLCA1_PLR1_SUS128_WG64_4_1
    SolutionIndex: 32
    SolutionNameMin: Cijk_Ailk_Bljk_I8I8S_BH_Bias_SPA_AS_MT256x256x64_MI32x32x32x1_SN_1LDSB0_AFC1_AF0EM1_GRVWA8_GRVWB16_GSU1_LBSPPA0_LBSPPM0_LPA0_LPB16_LPM2_MIWT2_8_NLCA1_PLR1_SUS128_WG128_2_1
    SolutionIndex: 33
    SolutionNameMin: Cijk_Ailk_Bljk_I8I8S_BH_Bias_SPA_AS_MT256x192x64_MI32x32x32x1_SN_1LDSB0_AFC1_AF0EM8_GRVWA8_GRVWB16_GSU1_LBSPPA0_LBSPPM0_LPA0_LPB16_LPM2_MIWT2_6_NLCA1_PLR1_SUS256_WG128_2_1
    SolutionIndex: 34
    SolutionNameMin: Cijk_Ailk_Bljk_I8I8S_BH_Bias_SPA_AS_MT256x256x64_MI32x32x32x1_SN_1LDSB0_AFC1_AF0EM8_GRVWA8_GRVWB16_GSU1_LBSPPA0_LBSPPM0_LPA0_LPB16_LPM2_MIWT4_4_NLCA1_PLR1_SUS128_WG64_4_1
    SolutionIndex: 35
    SolutionNameMin: Cijk_Ailk_Bljk_I8I8S_BH_Bias_SPA_AS_MT256x256x64_MI32x32x32x1_SN_1LDSB0_AFC1_AF0EM8_GRVWA8_GRVWB16_GSU1_LBSPPA0_LBSPPM0_LPA0_LPB16_LPM2_MIWT4_4_NLCA1_PLR1_SUS256_WG64_4_1
    SolutionIndex: 36
    SolutionNameMin: Cijk_Ailk_Bljk_I8I8S_BH_Bias_SPA_AS_MT256x256x64_MI32x32x32x1_SN_1LDSB0_AFC1_AF0EM1_GRVWA8_GRVWB16_GSU1_LBSPPA0_LBSPPM0_LPA0_LPB16_LPM2_MIWT4_4_NLCA1_PLR1_SUS128_WG64_4_1
    SolutionIndex: 37
    SolutionNameMin: Cijk_Ailk_Bljk_I8I8S_BH_Bias_SPA_AS_MT256x256x64_MI32x32x32x1_SN_1LDSB0_AFC1_AF0EM1_GRVWA8_GRVWB16_GSU1_LBSPPA0_LBSPPM0_LPA0_LPB16_LPM2_MIWT4_4_NLCA1_PLR1_SUS256_WG64_4_1
    SolutionIndex: 38
    SolutionNameMin: Cijk_Ailk_Bljk_I8I8S_BH_Bias_SPA_AS_MT256x256x64_MI32x32x32x1_SN_1LDSB0_AFC1_AF0EM1_GRVWA8_GRVWB16_GSU1_LBSPPA0_LBSPPM0_LPA0_LPB16_LPM2_MIWT2_8_NLCA1_PLR1_SUS256_WG128_2_1
    SolutionIndex: 39
    SolutionNameMin: Cijk_Ailk_Bljk_I8I8S_BH_Bias_SPA_AS_MT256x192x64_MI32x32x32x1_SN_1LDSB0_AFC1_AF0EM1_GRVWA8_GRVWB16_GSU1_LBSPPA0_LBSPPM0_LPA0_LPB16_LPM2_MIWT2_6_NLCA1_PLR1_SUS256_WG128_2_1
- - - [16, 16, 1, 16]
    - [0, 0.0]
  - - [16, 16, 1, 32]
    - [2, 0.0]
  - - [16, 16, 1, 64]
    - [3, 0.0]
  - - [16, 16, 1, 96]
    - [3, 0.0]
  - - [16, 16, 1, 128]
    - [18, 0.0]
  - - [16, 16, 1, 136]
    - [10, 0.0]
  - - [16, 16, 1, 256]
    - [19, 0.0]
  - - [16, 16, 1, 264]
    - [9, 0.0]
  - - [256, 256, 1, 16]
    - [6, 0.004]
  - - [256, 256, 1, 24]
    - [4, 0.006]
  - - [256, 256, 1, 32]
    - [8, 0.007]
  - - [256, 256, 1, 64]
    - [16, 0.013]
  - - [256, 256, 1, 96]
    - [4, 0.022]
  - - [256, 256, 1, 128]
    - [14, 0.034]
  - - [256, 256, 1, 136]
    - [13, 0.027]
  - - [256, 256, 1, 256]
    - [11, 0.043]
  - - [384, 384, 1, 16]
    - [15, 0.007]
  - - [384, 384, 1, 24]
    - [7, 0.011]
  - - [384, 384, 1, 32]
    - [5, 0.015]
  - - [384, 384, 1, 64]
    - [1, 0.033]
  - - [384, 384, 1, 96]
    - [12, 0.036]
  - - [384, 384, 1, 128]
    - [17, 0.058]
  - - [384, 384, 1, 136]
    - [8, 0.058]
  - - [384, 384, 1, 256]
    - [14, 0.112]
  - - [3072, 1024, 1, 16384]
    - [20, 14.802]
  - - [4096, 1024, 1, 16384]
    - [21, 15.359]
  - - [1024, 1024, 1, 16384]
    - [22, 10.988]
  - - [1024, 4096, 1, 16384]
    - [23, 17.093]
  - - [3072, 3072, 1, 1024]
    - [24, 9.012]
  - - [4096, 4096, 1, 1024]
    - [25, 9.262]
  - - [5120, 5120, 1, 1024]
    - [25, 10.193]
  - - [6144, 6144, 1, 1024]
    - [26, 13.029]
  - - [7168, 7168, 1, 1024]
    - [27, 12.906]
  - - [8192, 8192, 1, 1024]
    - [27, 13.678]
  - - [9216, 9216, 1, 1024]
    - [26, 13.7]
  - - [10240, 10240, 1, 1024]
    - [26, 14.277]
  - - [11264, 11264, 1, 1024]
    - [27, 14.45]
  - - [12288, 12288, 1, 1024]
    - [28, 14.723]
  - - [13312, 13312, 1, 1024]
    - [26, 14.664]
  - - [14336, 14336, 1, 1024]
    - [27, 14.783]
  - - [15360, 15360, 1, 1024]
    - [27, 14.967]
  - - [16384, 16384, 1, 1024]
    - [26, 15.415]
  - - [17408, 17408, 1, 1024]
    - [26, 14.996]
  - - [18432, 18432, 1, 1024]
    - [27, 15.136]
  - - [19456, 19456, 1, 1024]
    - [27, 15.127]
  - - [20480, 20480, 1, 1024]
    - [27, 15.176]
  - - [10240, 10240, 1, 2560]
    - [26, 20.5]
  - - [10240, 10240, 1, 3840]
    - [29, 22.994]
  - - [10240, 10240, 1, 5120]
    - [30, 22.426]
  - - [10240, 10240, 1, 6400]
    - [24, 25.547]
  - - [10240, 10240, 1, 7680]
    - [31, 25.067]
  - - [10240, 10240, 1, 8960]
    - [32, 27.398]
  - - [10240, 10240, 1, 10240]
    - [33, 27.931]
  - - [10240, 10240, 1, 11520]
    - [33, 29.33]
  - - [10240, 10240, 1, 12800]
    - [34, 29.009]
  - - [10240, 10240, 1, 14080]
    - [35, 29.688]
  - - [10240, 10240, 1, 15360]
    - [32, 30.537]
  - - [10240, 10240, 1, 16640]
    - [36, 30.406]
  - - [10240, 10240, 1, 17920]
    - [37, 30.465]
  - - [10240, 10240, 1, 19200]
    - [38, 30.793]
  - - [10240, 10240, 1, 20480]
    - [39, 30.007]
- null
- null
- DeviceEfficiency
- null
- Euclidean
