library/src/hcc_detail/rocsparselt/src/spmm/Tensile/Logic/aquavanjaram/gfx942/aquavanjaram_Cijk_Alik_Bjlk_I8I8S_BH_SA_AH.yaml
- {MinimumRequiredVersion: 4.33.0}
- aquavanjaram
- gfx942
- [Device 0049, Device 0050]
    SolutionIndex: 0
    SolutionNameMin: Cijk_Alik_Bjlk_I8I8S_BH_SA_AH_MT32x32x32_MI32x32x32x1_SN_1LDSB0_GRVW8_LPA8_MIWT1_1_PGR1_PLR1_SU4_TLDS1_WG32_2_1_WGM12
    SolutionIndex: 1
    SolutionNameMin: Cijk_Alik_Bjlk_I8I8S_BH_SA_AH_MT32x32x32_MI32x32x32x1_SN_1LDSB0_GRVW8_LPA8_MIWT1_1_PGR2_PLR1_SU4_TLDS1_WG32_2_1_WGM12
    SolutionIndex: 2
    SolutionNameMin: Cijk_Alik_Bjlk_I8I8S_BH_SA_AH_MT32x32x32_MI32x32x32x1_SN_1LDSB0_GRVW16_LPA16_MIWT1_1_PGR2_PLR1_SU4_TLDS1_WG32_2_1_WGM12
    SolutionIndex: 3
    SolutionNameMin: Cijk_Alik_Bjlk_I8I8S_BH_SA_AH_MT32x32x32_MI32x32x32x1_SN_1LDSB0_GRVW16_LPA2_MIWT1_1_PGR2_PLR1_SU8_TLDS0_WG32_2_1_WGM12
    SolutionIndex: 4
    SolutionNameMin: Cijk_Alik_Bjlk_I8I8S_BH_SA_AH_MT32x32x32_MI32x32x32x1_SN_1LDSB0_GRVW16_LPA16_MIWT1_1_PGR2_PLR1_SU8_TLDS1_WG32_2_1_WGM12
    SolutionIndex: 5
    SolutionNameMin: Cijk_Alik_Bjlk_I8I8S_BH_SA_AH_MT32x32x32_MI32x32x32x1_SN_1LDSB0_GRVW8_LPA8_MIWT1_1_PGR2_PLR1_SU4_TLDS1_WG32_2_1_WGM18
    SolutionIndex: 6
    SolutionNameMin: Cijk_Alik_Bjlk_I8I8S_BH_SA_AH_MT32x32x32_MI32x32x32x1_SN_1LDSB0_GRVW16_LPA16_MIWT1_1_PGR2_PLR1_SU4_TLDS1_WG32_2_1_WGM18
    SolutionIndex: 7
    SolutionNameMin: Cijk_Alik_Bjlk_I8I8S_BH_SA_AH_MT32x32x32_MI32x32x32x1_SN_1LDSB0_GRVW8_LPA2_MIWT1_1_PGR2_PLR1_SU8_TLDS0_WG32_2_1_WGM18
    SolutionIndex: 8
    SolutionNameMin: Cijk_Alik_Bjlk_I8I8S_BH_SA_AH_MT32x32x32_MI32x32x32x1_SN_1LDSB0_GRVW8_LPA2_MIWT1_1_PGR1_PLR1_SU4_TLDS0_WG32_2_1_WGM19
    SolutionIndex: 9
    SolutionNameMin: Cijk_Alik_Bjlk_I8I8S_BH_SA_AH_MT32x32x32_MI32x32x32x1_SN_1LDSB0_GRVW8_LPA8_MIWT1_1_PGR2_PLR1_SU8_TLDS1_WG32_2_1_WGM19
    SolutionIndex: 10
    SolutionNameMin: Cijk_Alik_Bjlk_I8I8S_BH_SA_AH_MT32x32x32_MI32x32x32x1_SN_1LDSB0_GRVW16_LPA16_MIWT1_1_PGR2_PLR1_SU8_TLDS1_WG32_2_1_WGM19
    SolutionIndex: 11
    SolutionNameMin: Cijk_Alik_Bjlk_I8I8S_BH_SA_AH_MT32x32x64_MI32x32x32x1_SN_1LDSB0_GRVW8_LPA8_MIWT1_1_PGR1_PLR1_SU4_TLDS1_WG32_2_1_WGM12
    SolutionIndex: 12
    SolutionNameMin: Cijk_Alik_Bjlk_I8I8S_BH_SA_AH_MT32x32x64_MI32x32x32x1_SN_1LDSB0_GRVW16_LPA16_MIWT1_1_PGR1_PLR3_SU4_TLDS1_WG32_2_1_WGM12
    SolutionIndex: 13
    SolutionNameMin: Cijk_Alik_Bjlk_I8I8S_BH_SA_AH_MT32x32x64_MI32x32x32x1_SN_1LDSB0_GRVW16_LPA16_MIWT1_1_PGR2_PLR1_SU8_TLDS1_WG32_2_1_WGM12
    SolutionIndex: 14
    SolutionNameMin: Cijk_Alik_Bjlk_I8I8S_BH_SA_AH_MT32x32x64_MI32x32x32x1_SN_1LDSB0_GRVW16_LPA16_MIWT1_1_PGR1_PLR1_SU4_TLDS1_WG32_2_1_WGM18
    SolutionIndex: 15
    SolutionNameMin: Cijk_Alik_Bjlk_I8I8S_BH_SA_AH_MT32x32x64_MI32x32x32x1_SN_1LDSB0_GRVW16_LPA16_MIWT1_1_PGR1_PLR3_SU8_TLDS1_WG32_2_1_WGM18
    SolutionIndex: 16
    SolutionNameMin: Cijk_Alik_Bjlk_I8I8S_BH_SA_AH_MT32x32x64_MI32x32x32x1_SN_1LDSB0_GRVW16_LPA16_MIWT1_1_PGR2_PLR1_SU4_TLDS1_WG32_2_1_WGM19
    SolutionIndex: 17
    SolutionNameMin: Cijk_Alik_Bjlk_I8I8S_BH_SA_AH_MT32x32x64_MI32x32x32x1_SN_1LDSB0_GRVW8_LPA8_MIWT1_1_PGR2_PLR3_SU4_TLDS1_WG32_2_1_WGM19
    SolutionIndex: 18
    SolutionNameMin: Cijk_Alik_Bjlk_I8I8S_BH_SA_AH_MT32x32x64_MI32x32x32x1_SN_1LDSB0_GRVW16_LPA16_MIWT1_1_PGR2_PLR1_SU8_TLDS1_WG32_2_1_WGM19
    SolutionIndex: 19
    SolutionNameMin: Cijk_Alik_Bjlk_I8I8S_BH_SA_AH_MT32x32x128_MI32x32x32x1_SN_1LDSB0_GRVW8_LPA8_MIWT1_1_PGR1_PLR1_SU4_TLDS1_WG32_2_1_WGM18
    SolutionIndex: 20
    SolutionNameMin: Cijk_Alik_Bjlk_I8I8S_BH_SA_AH_MT32x32x128_MI32x32x32x1_SN_1LDSB0_GRVW16_LPA16_MIWT1_1_PGR1_PLR1_SU4_TLDS1_WG32_2_1_WGM18
    SolutionIndex: 21
    SolutionNameMin: Cijk_Alik_Bjlk_I8I8S_BH_SA_AH_MT32x32x128_MI32x32x32x1_SN_1LDSB0_GRVW16_LPA16_MIWT1_1_PGR2_PLR5_SU8_TLDS1_WG32_2_1_WGM19
    SolutionIndex: 22
    SolutionNameMin: Cijk_Alik_Bjlk_I8I8S_BH_SA_AH_MT32x32x64_MI32x32x32x1_SN_1LDSB0_GRVW8_LPA8_MIWT1_1_PGR2_PLR1_SU8_SRVW0_TLDS1_WG32_2_1_WGM18
    SolutionIndex: 23
    SolutionNameMin: Cijk_Alik_Bjlk_I8I8S_BH_SA_AH_MT32x32x64_MI32x32x32x1_SN_1LDSB0_GRVW8_LPA8_MIWT1_1_PGR2_PLR3_SU4_SRVW0_TLDS1_WG32_2_1_WGM19
    SolutionIndex: 24
    SolutionNameMin: Cijk_Alik_Bjlk_I8I8S_BH_SA_AH_MT32x32x64_MI32x32x32x1_SN_1LDSB0_GRVW16_LPA16_MIWT1_1_PGR2_PLR3_SU8_SRVW0_TLDS1_WG32_2_1_WGM18
    SolutionIndex: 25
    SolutionNameMin: Cijk_Alik_Bjlk_I8I8S_BH_SA_AH_MT32x32x32_MI32x32x32x1_SN_1LDSB0_GRVW16_LPA16_MIWT1_1_PGR2_PLR1_SU4_SRVW0_TLDS1_WG32_2_1_WGM19
    SolutionIndex: 26
    SolutionNameMin: Cijk_Alik_Bjlk_I8I8S_BH_SA_AH_MT32x32x32_MI32x32x32x1_SN_1LDSB0_GRVW16_LPA16_MIWT1_1_PGR1_PLR1_SU4_SRVW0_TLDS1_WG32_2_1_WGM18
    SolutionIndex: 27
    SolutionNameMin: Cijk_Alik_Bjlk_I8I8S_BH_SA_AH_MT32x32x64_MI32x32x32x1_SN_1LDSB0_GRVW16_LPA16_MIWT1_1_PGR2_PLR3_SU4_SRVW0_TLDS1_WG32_2_1_WGM18
    SolutionIndex: 28
    SolutionNameMin: Cijk_Alik_Bjlk_I8I8S_BH_SA_AH_MT32x32x32_MI32x32x32x1_SN_1LDSB0_GRVW8_LPA8_MIWT1_1_PGR2_PLR1_SU8_SRVW0_TLDS1_WG32_2_1_WGM12
    SolutionIndex: 29
    SolutionNameMin: Cijk_Alik_Bjlk_I8I8S_BH_SA_AH_MT32x32x32_MI32x32x32x1_SN_1LDSB0_GRVW8_LPA8_MIWT1_1_PGR1_PLR1_SU4_SRVW0_TLDS1_WG32_2_1_WGM19
    SolutionIndex: 30
    SolutionNameMin: Cijk_Alik_Bjlk_I8I8S_BH_SA_AH_MT32x32x32_MI32x32x32x1_SN_1LDSB0_GRVW16_LPA16_MIWT1_1_PGR2_PLR1_SU8_SRVW0_TLDS1_WG32_2_1_WGM18
    SolutionIndex: 31
    SolutionNameMin: Cijk_Alik_Bjlk_I8I8S_BH_SA_AH_MT32x32x64_MI32x32x32x1_SN_1LDSB0_GRVW16_LPA16_MIWT1_1_PGR1_PLR1_SU4_SRVW0_TLDS1_WG32_2_1_WGM19
    SolutionIndex: 32
    SolutionNameMin: Cijk_Alik_Bjlk_I8I8S_BH_SA_AH_MT32x32x64_MI32x32x32x1_SN_1LDSB0_GRVW16_LPA16_MIWT1_1_PGR2_PLR3_SU4_SRVW0_TLDS1_WG32_2_1_WGM12
    SolutionIndex: 33
    SolutionNameMin: Cijk_Alik_Bjlk_I8I8S_BH_SA_AH_MT32x32x64_MI32x32x32x1_SN_1LDSB0_GRVW16_LPA16_MIWT1_1_PGR2_PLR1_SU8_SRVW0_TLDS1_WG32_2_1_WGM18
    SolutionIndex: 34
    SolutionNameMin: Cijk_Alik_Bjlk_I8I8S_BH_SA_AH_MT32x32x32_MI32x32x32x1_SN_1LDSB0_GRVW16_LPA16_MIWT1_1_PGR1_PLR1_SU8_SRVW0_TLDS1_WG32_2_1_WGM18
    SolutionIndex: 35
    SolutionNameMin: Cijk_Alik_Bjlk_I8I8S_BH_SA_AH_MT32x32x32_MI32x32x32x1_SN_1LDSB0_GRVW8_LPA8_MIWT1_1_PGR2_PLR1_SU8_SRVW0_TLDS1_WG32_2_1_WGM19
    SolutionIndex: 36
    SolutionNameMin: Cijk_Alik_Bjlk_I8I8S_BH_SA_AH_MT32x32x64_MI32x32x32x1_SN_1LDSB0_GRVW16_LPA16_MIWT1_1_PGR2_PLR3_SU8_SRVW0_TLDS1_WG32_2_1_WGM12
    SolutionIndex: 37
    SolutionNameMin: Cijk_Alik_Bjlk_I8I8S_BH_SA_AH_MT32x32x32_MI32x32x32x1_SN_1LDSB0_GRVW16_LPA16_MIWT1_1_PGR1_PLR1_SU8_SRVW0_TLDS1_WG32_2_1_WGM19
    SolutionIndex: 38
    SolutionNameMin: Cijk_Alik_Bjlk_I8I8S_BH_SA_AH_MT32x32x128_MI32x32x32x1_SN_1LDSB0_GRVW16_LPA16_MIWT1_1_PGR2_PLR5_SU4_SRVW0_TLDS1_WG32_2_1_WGM12
    SolutionIndex: 39
    SolutionNameMin: Cijk_Alik_Bjlk_I8I8S_BH_SA_AH_MT32x32x32_MI32x32x32x1_SN_1LDSB0_GRVW8_LPA8_MIWT1_1_PGR2_PLR1_SU4_SRVW0_TLDS1_WG32_2_1_WGM18
    SolutionIndex: 40
    SolutionNameMin: Cijk_Alik_Bjlk_I8I8S_BH_SA_AH_MT32x32x64_MI32x32x32x1_SN_1LDSB0_GRVW16_LPA16_MIWT1_1_PGR1_PLR1_SU8_SRVW0_TLDS1_WG32_2_1_WGM19
    SolutionIndex: 41
    SolutionNameMin: Cijk_Alik_Bjlk_I8I8S_BH_SA_AH_MT32x32x32_MI32x32x32x1_SN_1LDSB0_GRVW16_LPA16_MIWT1_1_PGR1_PLR1_SU4_SRVW0_TLDS1_WG32_2_1_WGM19
    SolutionIndex: 42
    SolutionNameMin: Cijk_Alik_Bjlk_I8I8S_BH_SA_AH_MT32x32x64_MI32x32x32x1_SN_1LDSB0_GRVW8_LPA8_MIWT1_1_PGR1_PLR1_SU8_SRVW0_TLDS1_WG32_2_1_WGM19
    SolutionIndex: 43
    SolutionNameMin: Cijk_Alik_Bjlk_I8I8S_BH_SA_AH_MT32x32x32_MI32x32x32x1_SN_1LDSB0_GRVW16_LPA16_MIWT1_1_PGR2_PLR1_SU4_SRVW0_TLDS1_WG32_2_1_WGM18
- - - [15, 15, 1, 16]
    - [7, 0.0]
  - - [15, 15, 1, 32]
    - [0, 0.0]
  - - [15, 15, 1, 64]
    - [8, 0.0]
  - - [15, 15, 1, 96]
    - [8, 0.0]
  - - [15, 15, 1, 128]
    - [19, 0.0]
  - - [15, 15, 1, 136]
    - [1, 0.0]
  - - [15, 15, 1, 256]
    - [11, 0.0]
  - - [15, 15, 1, 264]
    - [1, 0.0]
  - - [15, 15, 1, 528]
    - [9, 0.0]
  - - [15, 15, 1, 544]
    - [9, 0.0]
  - - [15, 15, 1, 576]
    - [17, 0.0]
  - - [15, 15, 1, 608]
    - [9, 0.0]
  - - [15, 15, 1, 640]
    - [22, 0.001]
  - - [15, 15, 1, 768]
    - [17, 0.001]
  - - [15, 15, 1, 776]
    - [23, 0.001]
  - - [32, 32, 1, 16]
    - [2, 0.0]
  - - [32, 32, 1, 32]
    - [3, 0.0]
  - - [32, 32, 1, 64]
    - [15, 0.0]
  - - [32, 32, 1, 96]
    - [4, 0.001]
  - - [32, 32, 1, 128]
    - [21, 0.001]
  - - [32, 32, 1, 136]
    - [6, 0.001]
  - - [32, 32, 1, 256]
    - [14, 0.001]
  - - [32, 32, 1, 264]
    - [6, 0.001]
  - - [32, 32, 1, 528]
    - [6, 0.002]
  - - [32, 32, 1, 544]
    - [10, 0.002]
  - - [32, 32, 1, 576]
    - [24, 0.003]
  - - [32, 32, 1, 608]
    - [25, 0.003]
  - - [32, 32, 1, 640]
    - [18, 0.003]
  - - [32, 32, 1, 768]
    - [20, 0.003]
  - - [32, 32, 1, 776]
    - [6, 0.003]
  - - [256, 256, 1, 16]
    - [5, 0.006]
  - - [256, 256, 1, 24]
    - [0, 0.008]
  - - [256, 256, 1, 32]
    - [26, 0.013]
  - - [256, 256, 1, 64]
    - [27, 0.025]
  - - [256, 256, 1, 96]
    - [28, 0.034]
  - - [256, 256, 1, 128]
    - [16, 0.045]
  - - [256, 256, 1, 136]
    - [29, 0.042]
  - - [256, 256, 1, 256]
    - [12, 0.081]
  - - [256, 256, 1, 264]
    - [10, 0.074]
  - - [256, 256, 1, 280]
    - [10, 0.079]
  - - [256, 256, 1, 296]
    - [0, 0.083]
  - - [256, 256, 1, 528]
    - [10, 0.131]
  - - [256, 256, 1, 544]
    - [30, 0.147]
  - - [256, 256, 1, 576]
    - [31, 0.154]
  - - [256, 256, 1, 608]
    - [10, 0.159]
  - - [256, 256, 1, 640]
    - [13, 0.169]
  - - [256, 256, 1, 768]
    - [32, 0.193]
  - - [256, 256, 1, 776]
    - [10, 0.172]
  - - [256, 256, 1, 792]
    - [33, 0.174]
  - - [256, 256, 1, 808]
    - [10, 0.177]
  - - [255, 255, 1, 16]
    - [34, 0.005]
  - - [255, 255, 1, 32]
    - [35, 0.01]
  - - [255, 255, 1, 64]
    - [36, 0.02]
  - - [255, 255, 1, 96]
    - [37, 0.028]
  - - [255, 255, 1, 128]
    - [38, 0.037]
  - - [255, 255, 1, 136]
    - [37, 0.035]
  - - [255, 255, 1, 256]
    - [37, 0.067]
  - - [255, 255, 1, 264]
    - [37, 0.063]
  - - [255, 255, 1, 528]
    - [35, 0.11]
  - - [255, 255, 1, 544]
    - [39, 0.126]
  - - [255, 255, 1, 576]
    - [33, 0.132]
  - - [255, 255, 1, 608]
    - [35, 0.135]
  - - [255, 255, 1, 640]
    - [33, 0.143]
  - - [255, 255, 1, 768]
    - [33, 0.168]
  - - [255, 255, 1, 776]
    - [35, 0.151]
  - - [264, 264, 1, 16]
    - [26, 0.005]
  - - [264, 264, 1, 32]
    - [26, 0.011]
  - - [264, 264, 1, 64]
    - [40, 0.022]
  - - [264, 264, 1, 96]
    - [34, 0.03]
  - - [264, 264, 1, 128]
    - [36, 0.04]
  - - [264, 264, 1, 136]
    - [41, 0.038]
  - - [264, 264, 1, 256]
    - [39, 0.073]
  - - [264, 264, 1, 264]
    - [41, 0.069]
  - - [264, 264, 1, 528]
    - [39, 0.122]
  - - [264, 264, 1, 544]
    - [39, 0.137]
  - - [264, 264, 1, 576]
    - [33, 0.143]
  - - [264, 264, 1, 608]
    - [39, 0.146]
  - - [264, 264, 1, 640]
    - [42, 0.153]
  - - [264, 264, 1, 768]
    - [33, 0.182]
  - - [264, 264, 1, 776]
    - [43, 0.164]
- null
- null
- DeviceEfficiency
