library/src/hcc_detail/rocsparselt/src/spmm/Tensile/Logic/aquavanjaram/gfx942/aquavanjaram_Cijk_Alik_Bljk_BBS_BH_Bias_SPA_AS.yaml
- {MinimumRequiredVersion: 4.33.0}
- aquavanjaram
- gfx942
- [Device 0049, Device 0050]
    SolutionIndex: 0
    SolutionNameMin: Cijk_Alik_Bljk_BBS_BH_Bias_SPA_AS_MT32x32x32_MI32x32x1_SN_LDSB0_AFC1_AFEM1_DTVSM0_GRVWA4_GSU1_LPA4_LPB8_LPM1_MIWT1_1_PLR1_SU0_SUS0_SVW4_TLDS1_VWA1_VWB1_WG32_2_1
    SolutionIndex: 1
    SolutionNameMin: Cijk_Alik_Bljk_BBS_BH_Bias_SPA_AS_MT32x32x32_MI32x32x1_SN_LDSB0_AFC1_AFEM1_DTVSM1_GRVWA4_GSU1_LPA4_LPB8_LPMn1_MIWT1_1_PLR1_SU0_SUS0_SVW4_TLDS1_VWA1_VWB1_WG32_2_1
    SolutionIndex: 2
    SolutionNameMin: Cijk_Alik_Bljk_BBS_BH_Bias_SPA_AS_MT32x32x32_MI32x32x1_SN_LDSB0_AFC1_AFEM8_DTVSM1_GRVWA4_GSU1_LPA4_LPB8_LPMn1_MIWT1_1_PLR1_SU0_SUS0_SVW4_TLDS1_VWA1_VWB1_WG32_2_1
    SolutionIndex: 3
    SolutionNameMin: Cijk_Alik_Bljk_BBS_BH_Bias_SPA_AS_MT32x32x32_MI32x32x1_SN_LDSB0_AFC1_AFEM1_DTVSM1_GRVWA4_GSU1_LPA4_LPB8_LPMn1_MIWT1_1_PLR1_SU4_SUS256_SVW4_TLDS1_VWA1_VWB1_WG32_2_1
    SolutionIndex: 4
    SolutionNameMin: Cijk_Alik_Bljk_BBS_BH_Bias_SPA_AS_MT32x32x32_MI32x32x1_SN_LDSB0_AFC1_AFEM8_DTVSM0_GRVWA8_GSU1_LPA8_LPB8_LPM2_MIWT1_1_PLR1_SU4_SUS256_SVW4_TLDS1_VWA1_VWB1_WG32_2_1
    SolutionIndex: 5
    SolutionNameMin: Cijk_Alik_Bljk_BBS_BH_Bias_SPA_AS_MT32x32x32_MI32x32x1_SN_LDSB0_AFC1_AFEM8_DTVSM1_GRVWA4_GSU1_LPA4_LPB8_LPMn1_MIWT1_1_PLR1_SU4_SUS256_SVW4_TLDS1_VWA1_VWB1_WG32_2_1
    SolutionIndex: 6
    SolutionNameMin: Cijk_Alik_Bljk_BBS_BH_Bias_SPA_AS_MT32x32x32_MI32x32x1_SN_LDSB0_AFC0_AFEM8_DTVSM0_GRVWA4_GSU2_LPA0_LPB0_LPM1_MIWT1_1_PLR1_SU0_SUS0_SVW4_TLDS0_VWA1_VWB1_WG32_2_1
    SolutionIndex: 7
    SolutionNameMin: Cijk_Alik_Bljk_BBS_BH_Bias_SPA_AS_MT32x32x32_MI32x32x1_SN_LDSB0_AFC0_AFEM8_DTVSM0_GRVWA8_GSU2_LPA8_LPB8_LPM2_MIWT1_1_PLR1_SU0_SUS0_SVW4_TLDS1_VWA1_VWB1_WG32_2_1
    SolutionIndex: 8
    SolutionNameMin: Cijk_Alik_Bljk_BBS_BH_Bias_SPA_AS_MT128x128x32_MI32x32x1_SN_LDSB0_AFC1_AFEM8_DTVSM0_GRVWA4_GSU1_LPA4_LPB8_LPM1_MIWT2_2_PLR1_SU0_SUS0_SVW8_TLDS1_VWA2_VWB1_WG64_4_1
    SolutionIndex: 9
    SolutionNameMin: Cijk_Alik_Bljk_BBS_BH_Bias_SPA_AS_MT256x256x32_MI32x32x1_SN_LDSB0_AFC1_AFEM8_DTVSM0_GRVWA4_GSU1_LPA4_LPB8_LPM1_MIWT2_4_PLR1_SU4_SUS256_SVW8_TLDS1_VWA2_VWB4_WG128_4_1
    SolutionIndex: 10
    SolutionNameMin: Cijk_Alik_Bljk_BBS_BH_Bias_SPA_AS_MT256x256x32_MI32x32x1_SN_LDSB0_AFC1_AFEM1_DTVSM0_GRVWA4_GSU1_LPA4_LPB8_LPM1_MIWT4_2_PLR1_SU4_SUS256_SVW8_TLDS1_VWA2_VWB1_WG64_8_1
    SolutionIndex: 11
    SolutionNameMin: Cijk_Alik_Bljk_BBS_BH_Bias_SPA_AS_MT32x32x64_MI32x32x1_SN_LDSB0_AFC1_AFEM1_DTVSM1_GRVWA8_GSU1_LPA8_LPB8_LPMn1_MIWT1_1_PLR1_SU0_SUS0_SVW4_TLDS1_VWA1_VWB1_WG32_2_1
    SolutionIndex: 12
    SolutionNameMin: Cijk_Alik_Bljk_BBS_BH_Bias_SPA_AS_MT32x32x64_MI32x32x1_SN_LDSB0_AFC1_AFEM8_DTVSM0_GRVWA4_GSU1_LPA4_LPB8_LPM1_MIWT1_1_PLR1_SU0_SUS0_SVW4_TLDS1_VWA1_VWB1_WG32_2_1
    SolutionIndex: 13
    SolutionNameMin: Cijk_Alik_Bljk_BBS_BH_Bias_SPA_AS_MT32x32x64_MI32x32x1_SN_LDSB0_AFC1_AFEM8_DTVSM0_GRVWA8_GSU1_LPA8_LPB8_LPM2_MIWT1_1_PLR1_SU0_SUS0_SVW4_TLDS1_VWA1_VWB1_WG32_2_1
    SolutionIndex: 14
    SolutionNameMin: Cijk_Alik_Bljk_BBS_BH_Bias_SPA_AS_MT32x32x64_MI32x32x1_SN_LDSB0_AFC1_AFEM8_DTVSM1_GRVWA4_GSU1_LPA4_LPB8_LPMn1_MIWT1_1_PLR3_SU0_SUS0_SVW4_TLDS1_VWA1_VWB1_WG32_2_1
    SolutionIndex: 15
    SolutionNameMin: Cijk_Alik_Bljk_BBS_BH_Bias_SPA_AS_MT32x32x64_MI32x32x1_SN_LDSB0_AFC1_AFEM8_DTVSM1_GRVWA8_GSU1_LPA8_LPB8_LPMn1_MIWT1_1_PLR3_SU0_SUS0_SVW4_TLDS1_VWA1_VWB1_WG32_2_1
    SolutionIndex: 16
    SolutionNameMin: Cijk_Alik_Bljk_BBS_BH_Bias_SPA_AS_MT32x32x64_MI32x32x1_SN_LDSB0_AFC1_AFEM1_DTVSM1_GRVWA4_GSU1_LPA4_LPB8_LPMn1_MIWT1_1_PLR1_SU4_SUS256_SVW4_TLDS1_VWA1_VWB1_WG32_2_1
    SolutionIndex: 17
    SolutionNameMin: Cijk_Alik_Bljk_BBS_BH_Bias_SPA_AS_MT32x32x64_MI32x32x1_SN_LDSB0_AFC0_AFEM8_DTVSM1_GRVWA8_GSU2_LPA8_LPB8_LPMn1_MIWT1_1_PLR3_SU0_SUS0_SVW4_TLDS1_VWA1_VWB1_WG32_2_1
    SolutionIndex: 18
    SolutionNameMin: Cijk_Alik_Bljk_BBS_BH_Bias_SPA_AS_MT128x128x64_MI16x16x1_SN_LDSB0_AFEM1_GRVWA8_GRVWB8_GSU1_LBSPPA128_LBSPPB128_LPA8_MIWT4_4_PLR1_SU0_SUS0_SVW8_TLDS1_VWA2_VWB1_WG32_8_1_WGM1
    SolutionIndex: 19
    SolutionNameMin: Cijk_Alik_Bljk_BBS_BH_Bias_SPA_AS_MT128x160x64_MI16x16x1_SN_LDSB1_AFEM8_GRVWA8_GRVWB8_GSU1_LBSPPA128_LBSPPB128_LPA8_MIWT4_5_PLR1_SU32_SUS256_SVW4_TLDS1_VWA1_VWB1_WG32_8_1_WGM1
    SolutionIndex: 20
    SolutionNameMin: Cijk_Alik_Bljk_BBS_BH_Bias_SPA_AS_MT128x256x64_MI16x16x1_SN_LDSB1_AFC0_AFEM8_GRVWB8_GSU7_LBSPPA128_LBSPPB128_LPA8_MIWT4_8_SUS128_TLDS1
    SolutionIndex: 21
    SolutionNameMin: Cijk_Alik_Bljk_BBS_BH_Bias_SPA_AS_MT128x160x64_MI16x16x1_SN_LDSB1_AFEM8_GRVWA8_GRVWB8_GSU1_LBSPPA128_LBSPPB128_LPA8_MIWT4_5_PLR1_SU0_SUS0_SVW4_TLDS1_VWA1_VWB1_WG32_8_1_WGM18
    SolutionIndex: 22
    SolutionNameMin: Cijk_Alik_Bljk_BBS_BH_Bias_SPA_AS_MT256x96x64_MI16x16x1_SN_LDSB1_AFEM1_GRVWA8_GRVWB8_GSU1_LBSPPA128_LBSPPB128_LPA8_MIWT4_6_PLR1_SU0_SUS0_SVW8_TLDS1_VWA2_VWB1_WG64_4_1_WGM1
    SolutionIndex: 23
    SolutionNameMin: Cijk_Alik_Bljk_BBS_BH_Bias_SPA_AS_MT128x224x64_MI16x16x1_SN_LDSB1_AFEM8_GRVWA8_GRVWB8_GSU1_LBSPPA128_LBSPPB128_LPA8_MIWT4_7_PLR1_SU32_SUS128_SVW8_TLDS1_VWA2_VWB1_WG32_8_1_WGM18
    SolutionIndex: 24
    SolutionNameMin: Cijk_Alik_Bljk_BBS_BH_Bias_SPA_AS_MT128x192x64_MI16x16x1_SN_LDSB1_AFEM8_GRVWA8_GRVWB8_GSU1_LBSPPA128_LBSPPB128_LPA8_MIWT4_6_PLR1_SU0_SUS0_SVW8_TLDS1_VWA2_VWB1_WG32_8_1_WGM18
    SolutionIndex: 25
    SolutionNameMin: Cijk_Alik_Bljk_BBS_BH_Bias_SPA_AS_MT128x224x64_MI16x16x1_SN_LDSB1_AFEM1_GRVWA8_GRVWB8_GSU1_LBSPPA128_LBSPPB128_LPA8_MIWT4_7_PLR1_SU32_SUS256_SVW8_TLDS1_VWA2_VWB1_WG32_8_1_WGM6
    SolutionIndex: 26
    SolutionNameMin: Cijk_Alik_Bljk_BBS_BH_Bias_SPA_AS_MT256x256x64_MI16x16x1_SN_LDSB1_AFEM1_GRVWA8_GSU1_LBSPPA128_LBSPPB128_LPA8_LPB16_MIWT4_8_PLR1_SU32_SUS256_SVW8_TLDS1_VWA2_VWB1_WG64_8_1_WGM6
    SolutionIndex: 27
    SolutionNameMin: Cijk_Alik_Bljk_BBS_BH_Bias_SPA_AS_MT256x256x64_MI16x16x1_SN_LDSB1_AFEM1_GRVWA8_GSU1_LBSPPA128_LBSPPB128_LPA8_LPB16_MIWT4_8_PLR1_SU32_SUS128_SVW8_TLDS1_VWA2_VWB1_WG64_8_1_WGM1
    SolutionIndex: 28
    SolutionNameMin: Cijk_Alik_Bljk_BBS_BH_Bias_SPA_AS_MT256x256x64_MI16x16x1_SN_LDSB1_AFEM8_GRVWA8_GSU1_LBSPPA128_LBSPPB128_LPA8_LPB16_MIWT8_8_PLR1_SU32_SUS128_SVW8_TLDS1_VWA2_VWB1_WG32_8_1_WGM18
    SolutionIndex: 29
    SolutionNameMin: Cijk_Alik_Bljk_BBS_BH_Bias_SPA_AS_MT256x256x64_MI16x16x1_SN_LDSB1_AFEM1_GRVWA8_GSU1_LBSPPA128_LBSPPB128_LPA8_LPB16_MIWT8_8_PLR1_SU32_SUS128_SVW8_TLDS1_VWA2_VWB1_WG32_8_1_WGM18
    SolutionIndex: 30
    SolutionNameMin: Cijk_Alik_Bljk_BBS_BH_Bias_SPA_AS_MT256x256x64_MI16x16x1_SN_LDSB1_AFEM1_GRVWA8_GSU1_LBSPPA128_LBSPPB128_LPA8_LPB16_MIWT8_8_PLR1_SU32_SUS128_SVW8_TLDS1_VWA2_VWB1_WG32_8_1_WGM1
    SolutionIndex: 31
    SolutionNameMin: Cijk_Alik_Bljk_BBS_BH_Bias_SPA_AS_MT256x256x64_MI16x16x1_SN_LDSB1_AFEM1_GRVWA8_GSU1_LBSPPA128_LBSPPB128_LPA8_LPB16_MIWT8_8_PLR1_SU32_SUS128_SVW8_TLDS1_VWA2_VWB1_WG32_8_1_WGM6
    SolutionIndex: 32
    SolutionNameMin: Cijk_Alik_Bljk_BBS_BH_Bias_SPA_AS_MT256x256x64_MI16x16x1_SN_LDSB1_AFEM8_GRVWA8_GSU1_LBSPPA128_LBSPPB128_LPA8_LPB16_MIWT8_8_PLR1_SU32_SUS128_SVW8_TLDS1_VWA2_VWB1_WG32_8_1_WGM6
    SolutionIndex: 33
    SolutionNameMin: Cijk_Alik_Bljk_BBS_BH_Bias_SPA_AS_MT256x256x64_MI16x16x1_SN_LDSB1_AFEM8_GRVWA8_GSU1_LBSPPA128_LBSPPB128_LPA8_LPB16_MIWT8_8_PLR1_SU32_SUS128_SVW8_TLDS1_VWA2_VWB1_WG32_8_1_WGM1
    SolutionIndex: 34
    SolutionNameMin: Cijk_Alik_Bljk_BBS_BH_Bias_SPA_AS_MT256x256x64_MI16x16x1_SN_LDSB1_AFEM1_GRVWA8_GSU1_LBSPPA128_LBSPPB128_LPA8_LPB16_MIWT8_8_PLR1_SU32_SUS256_SVW8_TLDS1_VWA2_VWB1_WG32_8_1_WGM18
    SolutionIndex: 35
    SolutionNameMin: Cijk_Alik_Bljk_BBS_BH_Bias_SPA_AS_MT192x256x64_MI16x16x1_SN_LDSB1_AFEM8_GRVWA8_GSU1_LBSPPA128_LBSPPB128_LPA8_LPB16_MIWT6_8_PLR1_SU4_SUS256_SVW8_TLDS1_VWA2_VWB1_WG32_8_1_WGM1
    SolutionIndex: 36
    SolutionNameMin: Cijk_Alik_Bljk_BBS_BH_Bias_SPA_AS_MT256x256x64_MI16x16x1_SN_LDSB1_AFEM8_GRVWA8_GSU1_LBSPPA128_LBSPPB128_LPA8_LPB16_MIWT8_8_PLR1_SU32_SUS256_SVW8_TLDS1_VWA2_VWB1_WG32_8_1_WGM18
    SolutionIndex: 37
    SolutionNameMin: Cijk_Alik_Bljk_BBS_BH_Bias_SPA_AS_MT192x256x64_MI16x16x1_SN_LDSB1_AFEM1_GRVWA8_GSU1_LBSPPA128_LBSPPB128_LPA8_LPB16_MIWT6_8_PLR1_SU4_SUS256_SVW4_TLDS1_VWA1_VWB1_WG32_8_1_WGM1
    SolutionIndex: 38
    SolutionNameMin: Cijk_Alik_Bljk_BBS_BH_Bias_SPA_AS_MT192x256x64_MI16x16x1_SN_LDSB1_AFEM8_GRVWA8_GSU1_LBSPPA128_LBSPPB128_LPA8_LPB16_MIWT6_8_PLR1_SU4_SUS128_SVW4_TLDS1_VWA1_VWB1_WG32_8_1_WGM1
    SolutionIndex: 39
    SolutionNameMin: Cijk_Alik_Bljk_BBS_BH_Bias_SPA_AS_MT256x256x64_MI16x16x1_SN_LDSB1_AFEM1_GRVWA8_GSU1_LBSPPA128_LBSPPB128_LPA8_LPB16_MIWT8_8_PLR1_SU0_SUS0_SVW8_TLDS1_VWA2_VWB1_WG32_8_1_WGM1
    SolutionIndex: 40
    SolutionNameMin: Cijk_Alik_Bljk_BBS_BH_Bias_SPA_AS_MT192x256x64_MI16x16x1_SN_LDSB1_AFC1_AFEM1_GRVWA8_GRVWB8_GSU1_LPA8_LPB16_MIWT6_8_PLR1_WG32_8_1_WGM1
    SolutionIndex: 41
    SolutionNameMin: Cijk_Alik_Bljk_BBS_BH_Bias_SPA_AS_MT256x192x64_MI16x16x1_SN_LDSB1_AFC1_AFEM8_GRVWA8_GRVWB8_GSU1_LPA8_LPB16_MIWT8_6_PLR1_WG32_8_1_WGM18
    SolutionIndex: 42
    SolutionNameMin: Cijk_Alik_Bljk_BBS_BH_Bias_SPA_AS_MT192x256x64_MI16x16x1_SN_LDSB1_AFC1_AFEM8_GRVWA8_GRVWB8_GSU1_LPA8_LPB16_MIWT6_8_PLR1_WG32_8_1_WGM1
- - - [16, 16, 1, 16]
    - [5, 0.0]
  - - [16, 16, 1, 32]
    - [5, 0.0]
  - - [16, 16, 1, 64]
    - [5, 0.0]
  - - [16, 16, 1, 96]
    - [5, 0.0]
  - - [16, 16, 1, 128]
    - [2, 0.0]
  - - [16, 16, 1, 136]
    - [12, 0.0]
  - - [16, 16, 1, 256]
    - [7, 0.001]
  - - [16, 16, 1, 264]
    - [17, 0.001]
  - - [256, 256, 1, 16]
    - [8, 0.006]
  - - [256, 256, 1, 24]
    - [10, 0.005]
  - - [256, 256, 1, 32]
    - [9, 0.008]
  - - [256, 256, 1, 64]
    - [6, 0.019]
  - - [256, 256, 1, 96]
    - [3, 0.05]
  - - [256, 256, 1, 128]
    - [1, 0.064]
  - - [256, 256, 1, 136]
    - [15, 0.071]
  - - [256, 256, 1, 256]
    - [13, 0.123]
  - - [384, 384, 1, 16]
    - [0, 0.017]
  - - [384, 384, 1, 24]
    - [11, 0.022]
  - - [384, 384, 1, 32]
    - [4, 0.033]
  - - [384, 384, 1, 64]
    - [15, 0.067]
  - - [384, 384, 1, 96]
    - [5, 0.098]
  - - [384, 384, 1, 128]
    - [16, 0.132]
  - - [384, 384, 1, 136]
    - [14, 0.143]
  - - [384, 384, 1, 256]
    - [4, 0.229]
  - - [3072, 1024, 1, 16384]
    - [18, 26.298]
  - - [4096, 1024, 1, 16384]
    - [19, 28.985]
  - - [1024, 1024, 1, 16384]
    - [20, 26.952]
  - - [1024, 4096, 1, 16384]
    - [21, 30.247]
  - - [3072, 3072, 1, 1024]
    - [22, 21.839]
  - - [4096, 4096, 1, 1024]
    - [23, 23.307]
  - - [5120, 5120, 1, 1024]
    - [24, 24.867]
  - - [6144, 6144, 1, 1024]
    - [23, 27.102]
  - - [7168, 7168, 1, 1024]
    - [25, 27.893]
  - - [8192, 8192, 1, 1024]
    - [26, 29.164]
  - - [9216, 9216, 1, 1024]
    - [27, 31.562]
  - - [10240, 10240, 1, 1024]
    - [28, 29.747]
  - - [11264, 11264, 1, 1024]
    - [29, 31.783]
  - - [12288, 12288, 1, 1024]
    - [29, 32.067]
  - - [13312, 13312, 1, 1024]
    - [29, 33.456]
  - - [14336, 14336, 1, 1024]
    - [28, 34.035]
  - - [15360, 15360, 1, 1024]
    - [30, 35.261]
  - - [16384, 16384, 1, 1024]
    - [31, 34.471]
  - - [17408, 17408, 1, 1024]
    - [32, 33.97]
  - - [18432, 18432, 1, 1024]
    - [33, 35.881]
  - - [19456, 19456, 1, 1024]
    - [34, 34.512]
  - - [20480, 20480, 1, 1024]
    - [29, 34.801]
  - - [10240, 10240, 1, 2560]
    - [35, 38.392]
  - - [10240, 10240, 1, 3840]
    - [36, 44.262]
  - - [10240, 10240, 1, 5120]
    - [35, 40.39]
  - - [10240, 10240, 1, 6400]
    - [36, 46.636]
  - - [10240, 10240, 1, 7680]
    - [35, 42.487]
  - - [10240, 10240, 1, 8960]
    - [36, 47.073]
  - - [10240, 10240, 1, 10240]
    - [37, 40.609]
  - - [10240, 10240, 1, 11520]
    - [29, 46.76]
  - - [10240, 10240, 1, 12800]
    - [38, 42.661]
  - - [10240, 10240, 1, 14080]
    - [39, 46.282]
  - - [10240, 10240, 1, 15360]
    - [40, 40.481]
  - - [10240, 10240, 1, 16640]
    - [41, 45.965]
  - - [10240, 10240, 1, 17920]
    - [42, 41.165]
  - - [10240, 10240, 1, 19200]
    - [41, 46.331]
  - - [10240, 10240, 1, 20480]
    - [40, 36.527]
- null
- null
- DeviceEfficiency
- null
- Euclidean
