library/src/hcc_detail/rocsparselt/src/spmm/Tensile/Logic/aquavanjaram/gfx942/aquavanjaram_Cijk_Alik_Bjlk_BBS_BH_Bias_SA_AS.yaml
- {MinimumRequiredVersion: 4.33.0}
- aquavanjaram
- gfx942
- [Device 0049, Device 0050]
    SolutionIndex: 0
    SolutionNameMin: Cijk_Alik_Bjlk_BBS_BH_Bias_SA_AS_MT32x32x32_MI32x32x1_SN_LDSB0_AFC1_AFEM8_DTVSM0_GRVWA4_GSU1_LPA0_LPM1_MIWT1_1_PLR1_SU0_SUS0_SVW4_TLDS0_VWA1_VWB1_WG32_2_1
    SolutionIndex: 1
    SolutionNameMin: Cijk_Alik_Bjlk_BBS_BH_Bias_SA_AS_MT32x32x32_MI32x32x1_SN_LDSB0_AFC1_AFEM8_DTVSM0_GRVWA4_GSU1_LPA4_LPM1_MIWT1_1_PLR1_SU0_SUS0_SVW4_TLDS1_VWA1_VWB1_WG32_2_1
    SolutionIndex: 2
    SolutionNameMin: Cijk_Alik_Bjlk_BBS_BH_Bias_SA_AS_MT32x32x32_MI32x32x1_SN_LDSB0_AFC1_AFEM8_DTVSM0_GRVWA8_GSU1_LPA8_LPM2_MIWT1_1_PLR1_SU0_SUS0_SVW4_TLDS1_VWA1_VWB1_WG32_2_1
    SolutionIndex: 3
    SolutionNameMin: Cijk_Alik_Bjlk_BBS_BH_Bias_SA_AS_MT32x32x32_MI32x32x1_SN_LDSB0_AFC1_AFEM8_DTVSM1_GRVWA8_GSU1_LPA0_LPMn1_MIWT1_1_PLR1_SU0_SUS0_SVW4_TLDS0_VWA1_VWB1_WG32_2_1
    SolutionIndex: 4
    SolutionNameMin: Cijk_Alik_Bjlk_BBS_BH_Bias_SA_AS_MT32x32x32_MI32x32x1_SN_LDSB0_AFC1_AFEM1_DTVSM1_GRVWA4_GSU1_LPA4_LPMn1_MIWT1_1_PLR1_SU4_SUS256_SVW4_TLDS1_VWA1_VWB1_WG32_2_1
    SolutionIndex: 5
    SolutionNameMin: Cijk_Alik_Bjlk_BBS_BH_Bias_SA_AS_MT32x32x32_MI32x32x1_SN_LDSB0_AFC1_AFEM8_DTVSM0_GRVWA4_GSU1_LPA4_LPM1_MIWT1_1_PLR1_SU4_SUS256_SVW4_TLDS1_VWA1_VWB1_WG32_2_1
    SolutionIndex: 6
    SolutionNameMin: Cijk_Alik_Bjlk_BBS_BH_Bias_SA_AS_MT32x32x32_MI32x32x1_SN_LDSB0_AFC1_AFEM8_DTVSM1_GRVWA4_GSU1_LPA0_LPMn1_MIWT1_1_PLR1_SU4_SUS256_SVW4_TLDS0_VWA1_VWB1_WG32_2_1
    SolutionIndex: 7
    SolutionNameMin: Cijk_Alik_Bjlk_BBS_BH_Bias_SA_AS_MT32x32x32_MI32x32x1_SN_LDSB0_AFC0_AFEM8_DTVSM0_GRVWA4_GSU2_LPA4_LPM1_MIWT1_1_PLR1_SU0_SUS0_SVW4_TLDS1_VWA1_VWB1_WG32_2_1
    SolutionIndex: 8
    SolutionNameMin: Cijk_Alik_Bjlk_BBS_BH_Bias_SA_AS_MT128x128x32_MI32x32x1_SN_LDSB0_AFC1_AFEM1_DTVSM0_GRVWA4_GSU1_LPA0_LPM1_MIWT2_2_PLR1_SU4_SUS256_SVW8_TLDS0_VWA2_VWB1_WG64_4_1
    SolutionIndex: 9
    SolutionNameMin: Cijk_Alik_Bjlk_BBS_BH_Bias_SA_AS_MT32x32x64_MI32x32x1_SN_LDSB0_AFC1_AFEM1_DTVSM0_GRVWA8_GSU1_LPA0_LPM2_MIWT1_1_PLR1_SU0_SUS0_SVW4_TLDS0_VWA1_VWB1_WG32_2_1
    SolutionIndex: 10
    SolutionNameMin: Cijk_Alik_Bjlk_BBS_BH_Bias_SA_AS_MT32x32x64_MI32x32x1_SN_LDSB0_AFC1_AFEM1_DTVSM1_GRVWA4_GSU1_LPA4_LPMn1_MIWT1_1_PLR1_SU0_SUS0_SVW4_TLDS1_VWA1_VWB1_WG32_2_1
    SolutionIndex: 11
    SolutionNameMin: Cijk_Alik_Bjlk_BBS_BH_Bias_SA_AS_MT32x32x64_MI32x32x1_SN_LDSB0_AFC1_AFEM8_DTVSM0_GRVWA4_GSU1_LPA0_LPM1_MIWT1_1_PLR1_SU0_SUS0_SVW4_TLDS0_VWA1_VWB1_WG32_2_1
    SolutionIndex: 12
    SolutionNameMin: Cijk_Alik_Bjlk_BBS_BH_Bias_SA_AS_MT32x32x64_MI32x32x1_SN_LDSB0_AFC1_AFEM8_DTVSM0_GRVWA4_GSU1_LPA4_LPM1_MIWT1_1_PLR3_SU0_SUS0_SVW4_TLDS1_VWA1_VWB1_WG32_2_1
    SolutionIndex: 13
    SolutionNameMin: Cijk_Alik_Bjlk_BBS_BH_Bias_SA_AS_MT32x32x64_MI32x32x1_SN_LDSB0_AFC1_AFEM8_DTVSM1_GRVWA8_GSU1_LPA8_LPMn1_MIWT1_1_PLR1_SU0_SUS0_SVW4_TLDS1_VWA1_VWB1_WG32_2_1
    SolutionIndex: 14
    SolutionNameMin: Cijk_Alik_Bjlk_BBS_BH_Bias_SA_AS_MT32x32x64_MI32x32x1_SN_LDSB0_AFC1_AFEM8_DTVSM1_GRVWA4_GSU1_LPA4_LPMn1_MIWT1_1_PLR3_SU0_SUS0_SVW4_TLDS1_VWA1_VWB1_WG32_2_1
    SolutionIndex: 15
    SolutionNameMin: Cijk_Alik_Bjlk_BBS_BH_Bias_SA_AS_MT32x32x64_MI32x32x1_SN_LDSB0_AFC1_AFEM8_DTVSM1_GRVWA8_GSU1_LPA8_LPMn1_MIWT1_1_PLR3_SU0_SUS0_SVW4_TLDS1_VWA1_VWB1_WG32_2_1
    SolutionIndex: 16
    SolutionNameMin: Cijk_Alik_Bjlk_BBS_BH_Bias_SA_AS_MT32x32x64_MI32x32x1_SN_LDSB0_AFC1_AFEM1_DTVSM1_GRVWA8_GSU1_LPA0_LPMn1_MIWT1_1_PLR3_SU4_SUS256_SVW4_TLDS0_VWA1_VWB1_WG32_2_1
    SolutionIndex: 17
    SolutionNameMin: Cijk_Alik_Bjlk_BBS_BH_Bias_SA_AS_MT32x32x64_MI32x32x1_SN_LDSB0_AFC1_AFEM8_DTVSM1_GRVWA4_GSU1_LPA4_LPMn1_MIWT1_1_PLR3_SU4_SUS256_SVW4_TLDS1_VWA1_VWB1_WG32_2_1
- - - [16, 16, 1, 16, 16, 16, 16, 16]
    - [3, 0.39309]
  - - [16, 16, 1, 32, 16, 16, 32, 16]
    - [3, 0.804676]
  - - [16, 16, 1, 64, 16, 16, 64, 16]
    - [15, 1.60313]
  - - [16, 16, 1, 96, 16, 16, 96, 16]
    - [3, 2.29254]
  - - [16, 16, 1, 128, 16, 16, 128, 16]
    - [2, 2.99525]
  - - [16, 16, 1, 136, 16, 16, 136, 16]
    - [14, 2.93064]
  - - [16, 16, 1, 256, 16, 16, 256, 16]
    - [2, 5.33681]
  - - [16, 16, 1, 264, 16, 16, 264, 16]
    - [2, 5.34684]
  - - [256, 256, 1, 16, 256, 256, 16, 256]
    - [9, 75.8738]
  - - [256, 256, 1, 24, 256, 256, 24, 256]
    - [15, 115.313]
  - - [256, 256, 1, 32, 256, 256, 32, 256]
    - [16, 140.748]
  - - [256, 256, 1, 64, 256, 256, 64, 256]
    - [15, 322.639]
  - - [256, 256, 1, 96, 256, 256, 96, 256]
    - [17, 390.289]
  - - [256, 256, 1, 128, 256, 256, 128, 256]
    - [5, 580.125]
  - - [256, 256, 1, 136, 256, 256, 136, 256]
    - [1, 586.355]
  - - [256, 256, 1, 256, 256, 256, 256, 256]
    - [11, 989.223]
  - - [384, 384, 1, 16, 384, 384, 16, 384]
    - [8, 119.153]
  - - [384, 384, 1, 24, 384, 384, 24, 384]
    - [6, 209.896]
  - - [384, 384, 1, 32, 384, 384, 32, 384]
    - [10, 285.975]
  - - [384, 384, 1, 64, 384, 384, 64, 384]
    - [4, 571.241]
  - - [384, 384, 1, 96, 384, 384, 96, 384]
    - [0, 834.657]
  - - [384, 384, 1, 128, 384, 384, 128, 384]
    - [7, 662.259]
  - - [384, 384, 1, 136, 384, 384, 136, 384]
    - [12, 1106.73]
  - - [384, 384, 1, 256, 384, 384, 256, 384]
    - [13, 2174.47]
- null
- null
- DeviceEfficiency
