library/src/hcc_detail/rocsparselt/src/spmm/Tensile/Logic/aquavanjaram/gfx942/aquavanjaram_Cijk_Ailk_Bjlk_I8I8S_BH_Bias_SPB_AS.yaml
- {MinimumRequiredVersion: 4.33.0}
- aquavanjaram
- gfx942
- [Device 0049, Device 0050]
    SolutionIndex: 0
    SolutionNameMin: Cijk_Ailk_Bjlk_I8I8S_BH_Bias_SPB_AS_MT32x32x64_MI32x32x1_SN_LDSB0_AFC1_AFEM1_GRVWA8_GSU1_LPM0_MIWT1_1_PLR1_SU0_SUS0_SVW1_VWA1_VWB1_WG32_2_1
    SolutionIndex: 1
    SolutionNameMin: Cijk_Ailk_Bjlk_I8I8S_BH_Bias_SPB_AS_MT32x32x64_MI32x32x1_SN_LDSB0_AFC1_AFEM1_GRVWA16_GSU1_LPM0_MIWT1_1_PLR1_SU0_SUS0_SVW1_VWA1_VWB1_WG32_2_1
    SolutionIndex: 2
    SolutionNameMin: Cijk_Ailk_Bjlk_I8I8S_BH_Bias_SPB_AS_MT32x32x64_MI32x32x1_SN_LDSB0_AFC1_AFEM8_GRVWA16_GSU1_LPM0_MIWT1_1_PLR1_SU0_SUS0_SVW1_VWA1_VWB1_WG32_2_1
    SolutionIndex: 3
    SolutionNameMin: Cijk_Ailk_Bjlk_I8I8S_BH_Bias_SPB_AS_MT32x32x64_MI32x32x1_SN_LDSB0_AFC1_AFEM1_GRVWA8_GSU1_LPM0_MIWT1_1_PLR1_SU4_SUS256_SVW1_VWA1_VWB1_WG32_2_1
    SolutionIndex: 4
    SolutionNameMin: Cijk_Ailk_Bjlk_I8I8S_BH_Bias_SPB_AS_MT32x32x64_MI32x32x1_SN_LDSB0_AFC1_AFEM8_GRVWA8_GSU1_LPM0_MIWT1_1_PLR1_SU4_SUS256_SVW1_VWA1_VWB1_WG32_2_1
    SolutionIndex: 5
    SolutionNameMin: Cijk_Ailk_Bjlk_I8I8S_BH_Bias_SPB_AS_MT32x32x64_MI32x32x1_SN_LDSB0_AFC1_AFEM8_GRVWA16_GSU1_LPM0_MIWT1_1_PLR1_SU4_SUS256_SVW1_VWA1_VWB1_WG32_2_1
    SolutionIndex: 6
    SolutionNameMin: Cijk_Ailk_Bjlk_I8I8S_BH_Bias_SPB_AS_MT32x32x64_MI32x32x1_SN_LDSB0_AFC0_AFEM8_GRVWA8_GSU2_LPM0_MIWT1_1_PLR1_SU0_SUS0_SVW1_VWA1_VWB1_WG32_2_1
    SolutionIndex: 7
    SolutionNameMin: Cijk_Ailk_Bjlk_I8I8S_BH_Bias_SPB_AS_MT32x32x64_MI32x32x1_SN_LDSB0_AFC0_AFEM1_GRVWA8_GSU2_LPM0_MIWT1_1_PLR1_SU4_SUS256_SVW1_VWA1_VWB1_WG32_2_1
    SolutionIndex: 8
    SolutionNameMin: Cijk_Ailk_Bjlk_I8I8S_BH_Bias_SPB_AS_MT32x32x128_MI32x32x1_SN_LDSB0_AFC1_AFEM1_GRVWA8_GSU1_LPM0_MIWT1_1_PLR1_SU0_SUS0_SVW1_VWA1_VWB1_WG32_2_1
    SolutionIndex: 9
    SolutionNameMin: Cijk_Ailk_Bjlk_I8I8S_BH_Bias_SPB_AS_MT32x32x128_MI32x32x1_SN_LDSB0_AFC1_AFEM1_GRVWA8_GSU1_LPM0_MIWT1_1_PLR3_SU0_SUS0_SVW1_VWA1_VWB1_WG32_2_1
    SolutionIndex: 10
    SolutionNameMin: Cijk_Ailk_Bjlk_I8I8S_BH_Bias_SPB_AS_MT32x32x128_MI32x32x1_SN_LDSB0_AFC1_AFEM1_GRVWA16_GSU1_LPM0_MIWT1_1_PLR3_SU0_SUS0_SVW1_VWA1_VWB1_WG32_2_1
    SolutionIndex: 11
    SolutionNameMin: Cijk_Ailk_Bjlk_I8I8S_BH_Bias_SPB_AS_MT32x32x128_MI32x32x1_SN_LDSB0_AFC1_AFEM8_GRVWA8_GSU1_LPM0_MIWT1_1_PLR1_SU0_SUS0_SVW1_VWA1_VWB1_WG32_2_1
    SolutionIndex: 12
    SolutionNameMin: Cijk_Ailk_Bjlk_I8I8S_BH_Bias_SPB_AS_MT32x32x128_MI32x32x1_SN_LDSB0_AFC1_AFEM8_GRVWA8_GSU1_LPM0_MIWT1_1_PLR3_SU0_SUS0_SVW1_VWA1_VWB1_WG32_2_1
    SolutionIndex: 13
    SolutionNameMin: Cijk_Ailk_Bjlk_I8I8S_BH_Bias_SPB_AS_MT128x128x128_MI32x32x1_SN_LDSB1_AFC1_AFEM8_GRVWA8_GSU1_LPM0_MIWT2_2_PLR1_SU0_SUS0_SVW2_VWA2_VWB2_WG64_4_1
    SolutionIndex: 14
    SolutionNameMin: Cijk_Ailk_Bjlk_I8I8S_BH_Bias_SPB_AS_MT128x128x128_MI32x32x1_SN_LDSB1_AFC1_AFEM8_GRVWA8_GSU1_LPM0_MIWT2_2_PLR3_SU0_SUS0_SVW2_VWA2_VWB2_WG64_4_1
- - - [15, 15, 1, 16, 15, 15, 15, 15]
    - [9, 0.0]
  - - [15, 15, 1, 32, 15, 15, 15, 15]
    - [3, 0.0]
  - - [15, 15, 1, 64, 15, 15, 15, 15]
    - [0, 0.0]
  - - [15, 15, 1, 96, 15, 15, 15, 15]
    - [7, 0.0]
  - - [15, 15, 1, 128, 15, 15, 15, 15]
    - [7, 0.0]
  - - [15, 15, 1, 136, 15, 15, 15, 15]
    - [7, 0.0]
  - - [15, 15, 1, 256, 15, 15, 15, 15]
    - [7, 0.0]
  - - [15, 15, 1, 264, 15, 15, 15, 15]
    - [7, 0.0]
  - - [16, 16, 1, 16, 16, 16, 16, 16]
    - [8, 0.0]
  - - [16, 16, 1, 32, 16, 16, 16, 16]
    - [6, 0.0]
  - - [16, 16, 1, 64, 16, 16, 16, 16]
    - [0, 0.0]
  - - [16, 16, 1, 96, 16, 16, 16, 16]
    - [6, 0.0]
  - - [16, 16, 1, 128, 16, 16, 16, 16]
    - [6, 0.0]
  - - [16, 16, 1, 136, 16, 16, 16, 16]
    - [6, 0.0]
  - - [16, 16, 1, 256, 16, 16, 16, 16]
    - [6, 0.0]
  - - [16, 16, 1, 264, 16, 16, 16, 16]
    - [6, 0.0]
  - - [256, 256, 1, 16, 256, 256, 256, 256]
    - [10, 0.002]
  - - [256, 256, 1, 24, 256, 256, 256, 256]
    - [5, 0.004]
  - - [256, 256, 1, 32, 256, 256, 256, 256]
    - [11, 0.005]
  - - [256, 256, 1, 64, 256, 256, 256, 256]
    - [12, 0.009]
  - - [256, 256, 1, 96, 256, 256, 256, 256]
    - [10, 0.012]
  - - [256, 256, 1, 128, 256, 256, 256, 256]
    - [10, 0.02]
  - - [256, 256, 1, 136, 256, 256, 256, 256]
    - [12, 0.017]
  - - [256, 256, 1, 256, 256, 256, 256, 256]
    - [1, 0.034]
  - - [384, 384, 1, 16, 384, 384, 384, 384]
    - [2, 0.005]
  - - [384, 384, 1, 24, 384, 384, 384, 384]
    - [3, 0.007]
  - - [384, 384, 1, 32, 384, 384, 384, 384]
    - [4, 0.01]
  - - [384, 384, 1, 64, 384, 384, 384, 384]
    - [5, 0.02]
  - - [384, 384, 1, 96, 384, 384, 384, 384]
    - [14, 0.021]
  - - [384, 384, 1, 128, 384, 384, 384, 384]
    - [10, 0.039]
  - - [384, 384, 1, 136, 384, 384, 384, 384]
    - [11, 0.035]
  - - [384, 384, 1, 256, 384, 384, 384, 384]
    - [13, 0.055]
- null
- null
- DeviceEfficiency
- null
- Euclidean
