library/src/hcc_detail/rocsparselt/src/spmm/Tensile/Logic/aquavanjaram/gfx942/aquavanjaram_Cijk_Alik_Bljk_I8I8S_BH_SA_AH.yaml
- {MinimumRequiredVersion: 4.33.0}
- aquavanjaram
- gfx942
- [Device 0049, Device 0050]
    SolutionIndex: 0
    SolutionNameMin: Cijk_Alik_Bljk_I8I8S_BH_SA_AH_MT32x32x32_MI32x32x32x1_SN_1LDSB0_GRVW8_LPA8_LPB16_MIWT1_1_PGR1_PLR1_SU4_TLDS1_WG32_2_1_WGM12
    SolutionIndex: 1
    SolutionNameMin: Cijk_Alik_Bljk_I8I8S_BH_SA_AH_MT32x32x32_MI32x32x32x1_SN_1LDSB0_GRVW16_LPA16_LPB16_MIWT1_1_PGR2_PLR1_SU4_TLDS1_WG32_2_1_WGM12
    SolutionIndex: 2
    SolutionNameMin: Cijk_Alik_Bljk_I8I8S_BH_SA_AH_MT32x32x32_MI32x32x32x1_SN_1LDSB0_GRVW8_LPA8_LPB16_MIWT1_1_PGR2_PLR1_SU8_TLDS1_WG32_2_1_WGM12
    SolutionIndex: 3
    SolutionNameMin: Cijk_Alik_Bljk_I8I8S_BH_SA_AH_MT32x32x32_MI32x32x32x1_SN_1LDSB0_GRVW16_LPA16_LPB16_MIWT1_1_PGR2_PLR1_SU8_TLDS1_WG32_2_1_WGM12
    SolutionIndex: 4
    SolutionNameMin: Cijk_Alik_Bljk_I8I8S_BH_SA_AH_MT32x32x32_MI32x32x32x1_SN_1LDSB0_GRVW8_LPA8_LPB16_MIWT1_1_PGR1_PLR1_SU8_TLDS1_WG32_2_1_WGM18
    SolutionIndex: 5
    SolutionNameMin: Cijk_Alik_Bljk_I8I8S_BH_SA_AH_MT32x32x32_MI32x32x32x1_SN_1LDSB0_GRVW16_LPA16_LPB16_MIWT1_1_PGR1_PLR1_SU8_TLDS1_WG32_2_1_WGM18
    SolutionIndex: 6
    SolutionNameMin: Cijk_Alik_Bljk_I8I8S_BH_SA_AH_MT32x32x32_MI32x32x32x1_SN_1LDSB0_GRVW16_LPA16_LPB16_MIWT1_1_PGR2_PLR1_SU8_TLDS1_WG32_2_1_WGM18
    SolutionIndex: 7
    SolutionNameMin: Cijk_Alik_Bljk_I8I8S_BH_SA_AH_MT32x32x32_MI32x32x32x1_SN_1LDSB0_GRVW8_LPA8_LPB16_MIWT1_1_PGR2_PLR1_SU4_TLDS1_WG32_2_1_WGM19
    SolutionIndex: 8
    SolutionNameMin: Cijk_Alik_Bljk_I8I8S_BH_SA_AH_MT32x32x32_MI32x32x32x1_SN_1LDSB0_GRVW16_LPA16_LPB16_MIWT1_1_PGR1_PLR1_SU8_TLDS1_WG32_2_1_WGM19
    SolutionIndex: 9
    SolutionNameMin: Cijk_Alik_Bljk_I8I8S_BH_SA_AH_MT32x32x64_MI32x32x32x1_SN_1LDSB0_GRVW8_LPA8_LPB16_MIWT1_1_PGR2_PLR3_SU4_TLDS1_WG32_2_1_WGM12
    SolutionIndex: 10
    SolutionNameMin: Cijk_Alik_Bljk_I8I8S_BH_SA_AH_MT32x32x64_MI32x32x32x1_SN_1LDSB0_GRVW16_LPA16_LPB16_MIWT1_1_PGR1_PLR3_SU8_TLDS1_WG32_2_1_WGM12
    SolutionIndex: 11
    SolutionNameMin: Cijk_Alik_Bljk_I8I8S_BH_SA_AH_MT32x32x64_MI32x32x32x1_SN_1LDSB0_GRVW16_LPA16_LPB16_MIWT1_1_PGR2_PLR3_SU8_TLDS1_WG32_2_1_WGM12
    SolutionIndex: 12
    SolutionNameMin: Cijk_Alik_Bljk_I8I8S_BH_SA_AH_MT32x32x64_MI32x32x32x1_SN_1LDSB0_GRVW16_LPA16_LPB16_MIWT1_1_PGR1_PLR3_SU4_TLDS1_WG32_2_1_WGM18
    SolutionIndex: 13
    SolutionNameMin: Cijk_Alik_Bljk_I8I8S_BH_SA_AH_MT32x32x64_MI32x32x32x1_SN_1LDSB0_GRVW16_LPA16_LPB16_MIWT1_1_PGR2_PLR3_SU4_TLDS1_WG32_2_1_WGM18
    SolutionIndex: 14
    SolutionNameMin: Cijk_Alik_Bljk_I8I8S_BH_SA_AH_MT32x32x64_MI32x32x32x1_SN_1LDSB0_GRVW16_LPA16_LPB16_MIWT1_1_PGR1_PLR3_SU8_TLDS1_WG32_2_1_WGM18
    SolutionIndex: 15
    SolutionNameMin: Cijk_Alik_Bljk_I8I8S_BH_SA_AH_MT32x32x64_MI32x32x32x1_SN_1LDSB0_GRVW16_LPA16_LPB16_MIWT1_1_PGR2_PLR3_SU8_TLDS1_WG32_2_1_WGM18
    SolutionIndex: 16
    SolutionNameMin: Cijk_Alik_Bljk_I8I8S_BH_SA_AH_MT32x32x64_MI32x32x32x1_SN_1LDSB0_GRVW16_LPA16_LPB16_MIWT1_1_PGR1_PLR1_SU4_TLDS1_WG32_2_1_WGM19
    SolutionIndex: 17
    SolutionNameMin: Cijk_Alik_Bljk_I8I8S_BH_SA_AH_MT32x32x64_MI32x32x32x1_SN_1LDSB0_GRVW8_LPA8_LPB16_MIWT1_1_PGR2_PLR1_SU8_TLDS1_WG32_2_1_WGM19
    SolutionIndex: 18
    SolutionNameMin: Cijk_Alik_Bljk_I8I8S_BH_SA_AH_MT32x32x128_MI32x32x32x1_SN_1LDSB0_GRVW16_LPA16_LPB16_MIWT1_1_PGR2_PLR1_SU4_TLDS1_WG32_2_1_WGM12
    SolutionIndex: 19
    SolutionNameMin: Cijk_Alik_Bljk_I8I8S_BH_SA_AH_MT32x32x128_MI32x32x32x1_SN_1LDSB0_GRVW16_LPA16_LPB16_MIWT1_1_PGR1_PLR1_SU8_TLDS1_WG32_2_1_WGM12
    SolutionIndex: 20
    SolutionNameMin: Cijk_Alik_Bljk_I8I8S_BH_SA_AH_MT32x32x128_MI32x32x32x1_SN_1LDSB0_GRVW16_LPA16_LPB16_MIWT1_1_PGR1_PLR5_SU4_TLDS1_WG32_2_1_WGM18
    SolutionIndex: 21
    SolutionNameMin: Cijk_Alik_Bljk_I8I8S_BH_SA_AH_MT32x32x128_MI32x32x32x1_SN_1LDSB0_GRVW8_LPA8_LPB16_MIWT1_1_PGR2_PLR5_SU8_TLDS1_WG32_2_1_WGM18
    SolutionIndex: 22
    SolutionNameMin: Cijk_Alik_Bljk_I8I8S_BH_SA_AH_MT32x32x128_MI32x32x32x1_SN_1LDSB0_GRVW16_LPA16_LPB16_MIWT1_1_PGR2_PLR1_SU4_TLDS1_WG32_2_1_WGM19
    SolutionIndex: 23
    SolutionNameMin: Cijk_Alik_Bljk_I8I8S_BH_SA_AH_MT32x32x128_MI32x32x32x1_SN_1LDSB0_GRVW16_LPA16_LPB16_MIWT1_1_PGR2_PLR5_SU4_TLDS1_WG32_2_1_WGM19
    SolutionIndex: 24
    SolutionNameMin: Cijk_Alik_Bljk_I8I8S_BH_SA_AH_MT32x32x128_MI32x32x32x1_SN_1LDSB0_GRVW16_LPA16_LPB16_MIWT1_1_PGR1_PLR5_SU8_TLDS1_WG32_2_1_WGM19
    SolutionIndex: 25
    SolutionNameMin: Cijk_Alik_Bljk_I8I8S_BH_SA_AH_MT32x32x64_MI32x32x32x1_SN_1LDSB0_GRVW16_LPA16_LPB16_MIWT1_1_PGR2_PLR1_SU4_SRVW0_TLDS1_WG32_2_1_WGM12
    SolutionIndex: 26
    SolutionNameMin: Cijk_Alik_Bljk_I8I8S_BH_SA_AH_MT32x32x32_MI32x32x32x1_SN_1LDSB0_GRVW16_LPA16_LPB16_MIWT1_1_PGR1_PLR1_SU8_SRVW0_TLDS1_WG32_2_1_WGM18
    SolutionIndex: 27
    SolutionNameMin: Cijk_Alik_Bljk_I8I8S_BH_SA_AH_MT32x32x32_MI32x32x32x1_SN_1LDSB0_GRVW8_LPA8_LPB16_MIWT1_1_PGR1_PLR1_SU8_SRVW0_TLDS1_WG32_2_1_WGM19
    SolutionIndex: 28
    SolutionNameMin: Cijk_Alik_Bljk_I8I8S_BH_SA_AH_MT32x32x32_MI32x32x32x1_SN_1LDSB0_GRVW8_LPA8_LPB16_MIWT1_1_PGR1_PLR1_SU8_SRVW0_TLDS1_WG32_2_1_WGM18
    SolutionIndex: 29
    SolutionNameMin: Cijk_Alik_Bljk_I8I8S_BH_SA_AH_MT32x32x64_MI32x32x32x1_SN_1LDSB0_GRVW16_LPA16_LPB16_MIWT1_1_PGR1_PLR3_SU8_SRVW0_TLDS1_WG32_2_1_WGM12
    SolutionIndex: 30
    SolutionNameMin: Cijk_Alik_Bljk_I8I8S_BH_SA_AH_MT32x32x32_MI32x32x32x1_SN_1LDSB0_GRVW8_LPA8_LPB16_MIWT1_1_PGR2_PLR1_SU4_SRVW0_TLDS1_WG32_2_1_WGM19
    SolutionIndex: 31
    SolutionNameMin: Cijk_Alik_Bljk_I8I8S_BH_SA_AH_MT32x32x64_MI32x32x32x1_SN_1LDSB0_GRVW16_LPA16_LPB16_MIWT1_1_PGR2_PLR1_SU8_SRVW0_TLDS1_WG32_2_1_WGM12
    SolutionIndex: 32
    SolutionNameMin: Cijk_Alik_Bljk_I8I8S_BH_SA_AH_MT32x32x128_MI32x32x32x1_SN_1LDSB0_GRVW16_LPA16_LPB16_MIWT1_1_PGR1_PLR5_SU8_SRVW0_TLDS1_WG32_2_1_WGM18
    SolutionIndex: 33
    SolutionNameMin: Cijk_Alik_Bljk_I8I8S_BH_SA_AH_MT32x32x64_MI32x32x32x1_SN_1LDSB0_GRVW16_LPA16_LPB16_MIWT1_1_PGR2_PLR3_SU4_SRVW0_TLDS1_WG32_2_1_WGM19
    SolutionIndex: 34
    SolutionNameMin: Cijk_Alik_Bljk_I8I8S_BH_SA_AH_MT32x32x64_MI32x32x32x1_SN_1LDSB0_GRVW16_LPA16_LPB16_MIWT1_1_PGR2_PLR1_SU4_SRVW0_TLDS1_WG32_2_1_WGM19
    SolutionIndex: 35
    SolutionNameMin: Cijk_Alik_Bljk_I8I8S_BH_SA_AH_MT32x32x32_MI32x32x32x1_SN_1LDSB0_GRVW16_LPA16_LPB16_MIWT1_1_PGR2_PLR1_SU8_SRVW0_TLDS1_WG32_2_1_WGM12
    SolutionIndex: 36
    SolutionNameMin: Cijk_Alik_Bljk_I8I8S_BH_SA_AH_MT32x32x32_MI32x32x32x1_SN_1LDSB0_GRVW8_LPA8_LPB16_MIWT1_1_PGR2_PLR1_SU8_SRVW0_TLDS1_WG32_2_1_WGM12
    SolutionIndex: 37
    SolutionNameMin: Cijk_Alik_Bljk_I8I8S_BH_SA_AH_MT32x32x64_MI32x32x32x1_SN_1LDSB0_GRVW8_LPA8_LPB16_MIWT1_1_PGR1_PLR1_SU4_SRVW0_TLDS1_WG32_2_1_WGM18
    SolutionIndex: 38
    SolutionNameMin: Cijk_Alik_Bljk_I8I8S_BH_SA_AH_MT32x32x32_MI32x32x32x1_SN_1LDSB0_GRVW16_LPA16_LPB16_MIWT1_1_PGR1_PLR1_SU4_SRVW0_TLDS1_WG32_2_1_WGM19
    SolutionIndex: 39
    SolutionNameMin: Cijk_Alik_Bljk_I8I8S_BH_SA_AH_MT32x32x64_MI32x32x32x1_SN_1LDSB0_GRVW16_LPA16_LPB16_MIWT1_1_PGR1_PLR1_SU8_SRVW0_TLDS1_WG32_2_1_WGM18
    SolutionIndex: 40
    SolutionNameMin: Cijk_Alik_Bljk_I8I8S_BH_SA_AH_MT32x32x64_MI32x32x32x1_SN_1LDSB0_GRVW16_LPA16_LPB16_MIWT1_1_PGR1_PLR1_SU8_SRVW0_TLDS1_WG32_2_1_WGM19
    SolutionIndex: 41
    SolutionNameMin: Cijk_Alik_Bljk_I8I8S_BH_SA_AH_MT32x32x64_MI32x32x32x1_SN_1LDSB0_GRVW16_LPA16_LPB16_MIWT1_1_PGR2_PLR3_SU4_SRVW0_TLDS1_WG32_2_1_WGM18
    SolutionIndex: 42
    SolutionNameMin: Cijk_Alik_Bljk_I8I8S_BH_SA_AH_MT32x32x32_MI32x32x32x1_SN_1LDSB0_GRVW16_LPA16_LPB16_MIWT1_1_PGR2_PLR1_SU4_SRVW0_TLDS1_WG32_2_1_WGM19
    SolutionIndex: 43
    SolutionNameMin: Cijk_Alik_Bljk_I8I8S_BH_SA_AH_MT32x32x128_MI32x32x32x1_SN_1LDSB0_GRVW16_LPA16_LPB16_MIWT1_1_PGR1_PLR1_SU4_SRVW0_TLDS1_WG32_2_1_WGM18
    SolutionIndex: 44
    SolutionNameMin: Cijk_Alik_Bljk_I8I8S_BH_SA_AH_MT32x32x64_MI32x32x32x1_SN_1LDSB0_GRVW16_LPA16_LPB16_MIWT1_1_PGR2_PLR1_SU8_SRVW0_TLDS1_WG32_2_1_WGM18
    SolutionIndex: 45
    SolutionNameMin: Cijk_Alik_Bljk_I8I8S_BH_SA_AH_MT32x32x32_MI32x32x32x1_SN_1LDSB0_GRVW16_LPA16_LPB16_MIWT1_1_PGR2_PLR1_SU8_SRVW0_TLDS1_WG32_2_1_WGM18
    SolutionIndex: 46
    SolutionNameMin: Cijk_Alik_Bljk_I8I8S_BH_SA_AH_MT32x32x32_MI32x32x32x1_SN_1LDSB0_GRVW16_LPA16_LPB16_MIWT1_1_PGR1_PLR1_SU8_SRVW0_TLDS1_WG32_2_1_WGM12
    SolutionIndex: 47
    SolutionNameMin: Cijk_Alik_Bljk_I8I8S_BH_SA_AH_MT32x32x128_MI32x32x32x1_SN_1LDSB0_GRVW16_LPA16_LPB16_MIWT1_1_PGR1_PLR1_SU8_SRVW0_TLDS1_WG32_2_1_WGM19
    SolutionIndex: 48
    SolutionNameMin: Cijk_Alik_Bljk_I8I8S_BH_SA_AH_MT32x32x32_MI32x32x32x1_SN_1LDSB0_GRVW16_LPA16_LPB16_MIWT1_1_PGR1_PLR1_SU8_SRVW0_TLDS1_WG32_2_1_WGM19
    SolutionIndex: 49
    SolutionNameMin: Cijk_Alik_Bljk_I8I8S_BH_SA_AH_MT32x32x128_MI32x32x32x1_SN_1LDSB0_GRVW8_LPA8_LPB16_MIWT1_1_PGR2_PLR5_SU4_SRVW0_TLDS1_WG32_2_1_WGM19
    SolutionIndex: 50
    SolutionNameMin: Cijk_Alik_Bljk_I8I8S_BH_SA_AH_MT32x32x64_MI32x32x32x1_SN_1LDSB0_GRVW8_LPA8_LPB16_MIWT1_1_PGR2_PLR1_SU8_SRVW0_TLDS1_WG32_2_1_WGM18
    SolutionIndex: 51
    SolutionNameMin: Cijk_Alik_Bljk_I8I8S_BH_SA_AH_MT32x32x32_MI32x32x32x1_SN_1LDSB0_GRVW8_LPA8_LPB16_MIWT1_1_PGR2_PLR1_SU4_SRVW0_TLDS1_WG32_2_1_WGM18
    SolutionIndex: 52
    SolutionNameMin: Cijk_Alik_Bljk_I8I8S_BH_SA_AH_MT32x32x128_MI32x32x32x1_SN_1LDSB0_GRVW16_LPA16_LPB16_MIWT1_1_PGR1_PLR5_SU8_SRVW0_TLDS1_WG32_2_1_WGM12
- - - [15, 15, 1, 16]
    - [7, 0.0]
  - - [15, 15, 1, 32]
    - [7, 0.0]
  - - [15, 15, 1, 64]
    - [10, 0.0]
  - - [15, 15, 1, 96]
    - [1, 0.0]
  - - [15, 15, 1, 128]
    - [21, 0.0]
  - - [15, 15, 1, 136]
    - [0, 0.0]
  - - [15, 15, 1, 256]
    - [22, 0.0]
  - - [15, 15, 1, 264]
    - [12, 0.0]
  - - [15, 15, 1, 528]
    - [9, 0.0]
  - - [15, 15, 1, 544]
    - [1, 0.0]
  - - [15, 15, 1, 576]
    - [11, 0.001]
  - - [15, 15, 1, 608]
    - [25, 0.001]
  - - [15, 15, 1, 640]
    - [18, 0.001]
  - - [15, 15, 1, 768]
    - [18, 0.001]
  - - [15, 15, 1, 776]
    - [13, 0.001]
  - - [32, 32, 1, 16]
    - [4, 0.0]
  - - [32, 32, 1, 32]
    - [8, 0.0]
  - - [32, 32, 1, 64]
    - [12, 0.0]
  - - [32, 32, 1, 96]
    - [4, 0.001]
  - - [32, 32, 1, 128]
    - [20, 0.001]
  - - [32, 32, 1, 136]
    - [4, 0.001]
  - - [32, 32, 1, 256]
    - [20, 0.002]
  - - [32, 32, 1, 264]
    - [4, 0.001]
  - - [32, 32, 1, 528]
    - [17, 0.002]
  - - [32, 32, 1, 544]
    - [6, 0.002]
  - - [32, 32, 1, 576]
    - [11, 0.003]
  - - [32, 32, 1, 608]
    - [16, 0.003]
  - - [32, 32, 1, 640]
    - [24, 0.003]
  - - [32, 32, 1, 768]
    - [23, 0.004]
  - - [32, 32, 1, 776]
    - [13, 0.003]
  - - [256, 256, 1, 16]
    - [3, 0.006]
  - - [256, 256, 1, 24]
    - [26, 0.009]
  - - [256, 256, 1, 32]
    - [27, 0.013]
  - - [256, 256, 1, 64]
    - [14, 0.026]
  - - [256, 256, 1, 96]
    - [27, 0.037]
  - - [256, 256, 1, 128]
    - [19, 0.052]
  - - [256, 256, 1, 136]
    - [28, 0.046]
  - - [256, 256, 1, 256]
    - [19, 0.095]
  - - [256, 256, 1, 264]
    - [29, 0.084]
  - - [256, 256, 1, 280]
    - [26, 0.089]
  - - [256, 256, 1, 296]
    - [5, 0.093]
  - - [256, 256, 1, 528]
    - [9, 0.146]
  - - [256, 256, 1, 544]
    - [30, 0.167]
  - - [256, 256, 1, 576]
    - [31, 0.193]
  - - [256, 256, 1, 608]
    - [2, 0.175]
  - - [256, 256, 1, 640]
    - [32, 0.213]
  - - [256, 256, 1, 768]
    - [33, 0.246]
  - - [256, 256, 1, 776]
    - [34, 0.212]
  - - [256, 256, 1, 792]
    - [15, 0.212]
  - - [256, 256, 1, 808]
    - [34, 0.218]
  - - [255, 255, 1, 16]
    - [35, 0.005]
  - - [255, 255, 1, 32]
    - [36, 0.01]
  - - [255, 255, 1, 64]
    - [37, 0.021]
  - - [255, 255, 1, 96]
    - [38, 0.03]
  - - [255, 255, 1, 128]
    - [39, 0.041]
  - - [255, 255, 1, 136]
    - [35, 0.039]
  - - [255, 255, 1, 256]
    - [40, 0.076]
  - - [255, 255, 1, 264]
    - [27, 0.071]
  - - [255, 255, 1, 528]
    - [31, 0.126]
  - - [255, 255, 1, 544]
    - [36, 0.139]
  - - [255, 255, 1, 576]
    - [41, 0.162]
  - - [255, 255, 1, 608]
    - [42, 0.15]
  - - [255, 255, 1, 640]
    - [41, 0.177]
  - - [255, 255, 1, 768]
    - [43, 0.208]
  - - [255, 255, 1, 776]
    - [44, 0.179]
  - - [264, 264, 1, 16]
    - [45, 0.005]
  - - [264, 264, 1, 32]
    - [46, 0.011]
  - - [264, 264, 1, 64]
    - [44, 0.023]
  - - [264, 264, 1, 96]
    - [46, 0.033]
  - - [264, 264, 1, 128]
    - [47, 0.045]
  - - [264, 264, 1, 136]
    - [48, 0.042]
  - - [264, 264, 1, 256]
    - [49, 0.084]
  - - [264, 264, 1, 264]
    - [48, 0.076]
  - - [264, 264, 1, 528]
    - [50, 0.139]
  - - [264, 264, 1, 544]
    - [51, 0.15]
  - - [264, 264, 1, 576]
    - [41, 0.174]
  - - [264, 264, 1, 608]
    - [36, 0.168]
  - - [264, 264, 1, 640]
    - [52, 0.191]
  - - [264, 264, 1, 768]
    - [47, 0.229]
  - - [264, 264, 1, 776]
    - [41, 0.198]
- null
- null
- DeviceEfficiency
