library/src/hcc_detail/rocsparselt/src/spmm/Tensile/Logic/aquavanjaram/gfx942/aquavanjaram_Cijk_Ailk_Bjlk_I8HS_BH_BiasS_SPB_AS.yaml
- {MinimumRequiredVersion: 4.33.0}
- aquavanjaram
- gfx942
- [Device 0049, Device 0050]
    SolutionIndex: 0
    SolutionNameMin: Cijk_Ailk_Bjlk_I8HS_BH_BiasS_SPB_AS_MT32x32x64_MI32x32x1_SN_AFC1_AFEM8_GSU1_MIWT1_1_PLR1_SU0_SUS0_WG32_2_1
    SolutionIndex: 1
    SolutionNameMin: Cijk_Ailk_Bjlk_I8HS_BH_BiasS_SPB_AS_MT32x32x64_MI32x32x1_SN_AFC1_AFEM8_GSU1_MIWT1_1_PLR1_SU4_SUS256_WG32_2_1
    SolutionIndex: 2
    SolutionNameMin: Cijk_Ailk_Bjlk_I8HS_BH_BiasS_SPB_AS_MT32x32x128_MI32x32x1_SN_AFC1_AFEM1_GSU1_MIWT1_1_PLR1_SU0_SUS0_WG32_2_1
    SolutionIndex: 3
    SolutionNameMin: Cijk_Ailk_Bjlk_I8HS_BH_BiasS_SPB_AS_MT32x32x128_MI32x32x1_SN_AFC1_AFEM8_GSU1_MIWT1_1_PLR1_SU0_SUS0_WG32_2_1
    SolutionIndex: 4
    SolutionNameMin: Cijk_Ailk_Bjlk_I8HS_BH_BiasS_SPB_AS_MT32x32x128_MI32x32x1_SN_AFC1_AFEM1_GSU1_MIWT1_1_PLR3_SU4_SUS256_WG32_2_1
    SolutionIndex: 5
    SolutionNameMin: Cijk_Ailk_Bjlk_I8HS_BH_BiasS_SPB_AS_MT32x32x128_MI32x32x1_SN_AFC1_AFEM8_GSU1_MIWT1_1_PLR3_SU4_SUS256_WG32_2_1
    SolutionIndex: 6
    SolutionNameMin: Cijk_Ailk_Bjlk_I8HS_BH_BiasS_SPB_AS_MT32x32x128_MI32x32x1_SN_AFC0_AFEM8_GSU2_MIWT1_1_PLR3_SU0_SUS0_WG32_2_1
    SolutionIndex: 7
    SolutionNameMin: Cijk_Ailk_Bjlk_I8HS_BH_BiasS_SPB_AS_MT32x32x128_MI32x32x1_SN_AFC0_AFEM1_GSU2_MIWT1_1_PLR1_SU4_SUS256_WG32_2_1
    SolutionIndex: 8
    SolutionNameMin: Cijk_Ailk_Bjlk_I8HS_BH_BiasS_SPB_AS_MT32x32x128_MI32x32x1_SN_AFC0_AFEM8_GSU2_MIWT1_1_PLR3_SU4_SUS256_WG32_2_1
- - - [16, 16, 1, 16, 16, 16, 16, 16]
    - [4, 0.0]
  - - [16, 16, 1, 32, 16, 16, 16, 16]
    - [5, 0.0]
  - - [16, 16, 1, 64, 16, 16, 16, 16]
    - [1, 0.0]
  - - [16, 16, 1, 96, 16, 16, 16, 16]
    - [1, 0.0]
  - - [16, 16, 1, 128, 16, 16, 16, 16]
    - [1, 0.0]
  - - [16, 16, 1, 136, 16, 16, 16, 16]
    - [1, 0.0]
  - - [16, 16, 1, 256, 16, 16, 16, 16]
    - [3, 0.0]
  - - [16, 16, 1, 264, 16, 16, 16, 16]
    - [6, 0.0]
  - - [256, 256, 1, 16, 256, 256, 256, 256]
    - [8, 0.002]
  - - [256, 256, 1, 24, 256, 256, 256, 256]
    - [0, 0.004]
  - - [256, 256, 1, 32, 256, 256, 256, 256]
    - [0, 0.005]
  - - [256, 256, 1, 64, 256, 256, 256, 256]
    - [7, 0.005]
  - - [256, 256, 1, 96, 256, 256, 256, 256]
    - [2, 0.012]
  - - [256, 256, 1, 128, 256, 256, 256, 256]
    - [2, 0.021]
  - - [256, 256, 1, 136, 256, 256, 256, 256]
    - [0, 0.019]
  - - [256, 256, 1, 256, 256, 256, 256, 256]
    - [8, 0.028]
- null
- null
- DeviceEfficiency
- null
- Euclidean
