library/src/spmm/Tensile/Logic/asm_full/arcturus_Cijk_Ailk_Bljk_HBH_SA.yaml
- {MinimumRequiredVersion: 4.30.0}
- arcturus
- gfx908
- [Device 7380, Device 7388, Device 738c, Device 7390]
    SolutionIndex: 0
    SolutionNameMin: Cijk_Ailk_Bljk_HBH_SA_MT128x128x32_MI32x32x16x1_SN_
- - - [127, 127, 2, 128, 127, 127, 127, 128]
    - [0, 37.511]
  - - [128, 127, 2, 128, 128, 128, 128, 128]
    - [0, 40.0467]
  - - [129, 127, 2, 128, 129, 129, 129, 128]
    - [0, 43.3287]
  - - [127, 128, 2, 128, 127, 127, 127, 128]
    - [0, 41.3195]
  - - [128, 128, 2, 128, 128, 128, 128, 128]
    - [0, 86.2334]
  - - [129, 128, 2, 128, 129, 129, 129, 128]
    - [0, 35.8725]
  - - [127, 129, 2, 128, 127, 127, 127, 128]
    - [0, 36.4839]
  - - [128, 129, 2, 128, 128, 128, 128, 128]
    - [0, 36.8481]
  - - [129, 129, 2, 128, 129, 129, 129, 128]
    - [0, 38.4777]
  - - [127, 127, 2, 136, 127, 127, 127, 136]
    - [0, 38.35]
  - - [128, 127, 2, 136, 128, 128, 128, 136]
    - [0, 37.6517]
  - - [129, 127, 2, 136, 129, 129, 129, 136]
    - [0, 38.8724]
  - - [127, 128, 2, 136, 127, 127, 127, 136]
    - [0, 40.0521]
  - - [128, 128, 2, 136, 128, 128, 128, 136]
    - [0, 38.8748]
  - - [129, 128, 2, 136, 129, 129, 129, 136]
    - [0, 38.2965]
  - - [127, 129, 2, 136, 127, 127, 127, 136]
    - [0, 48.3967]
  - - [128, 129, 2, 136, 128, 128, 128, 136]
    - [0, 48.8202]
  - - [129, 129, 2, 136, 129, 129, 129, 136]
    - [0, 60.3216]
  - - [127, 127, 2, 144, 127, 127, 127, 144]
    - [0, 67.8362]
  - - [128, 127, 2, 144, 128, 128, 128, 144]
    - [0, 53.5434]
  - - [129, 127, 2, 144, 129, 129, 129, 144]
    - [0, 46.9595]
  - - [127, 128, 2, 144, 127, 127, 127, 144]
    - [0, 45.7933]
  - - [128, 128, 2, 144, 128, 128, 128, 144]
    - [0, 86.9995]
  - - [129, 128, 2, 144, 129, 129, 129, 144]
    - [0, 51.1576]
  - - [127, 129, 2, 144, 127, 127, 127, 144]
    - [0, 50.5843]
  - - [128, 129, 2, 144, 128, 128, 128, 144]
    - [0, 56.0798]
  - - [129, 129, 2, 144, 129, 129, 129, 144]
    - [0, 78.4169]
  - - [127, 127, 2, 152, 127, 127, 127, 152]
    - [0, 51.506]
  - - [128, 127, 2, 152, 128, 128, 128, 152]
    - [0, 47.1931]
  - - [129, 127, 2, 152, 129, 129, 129, 152]
    - [0, 70.0305]
  - - [127, 128, 2, 152, 127, 127, 127, 152]
    - [0, 58.1131]
  - - [128, 128, 2, 152, 128, 128, 128, 152]
    - [0, 100.749]
  - - [129, 128, 2, 152, 129, 129, 129, 152]
    - [0, 68.9531]
  - - [127, 129, 2, 152, 127, 127, 127, 152]
    - [0, 58.2929]
  - - [128, 129, 2, 152, 128, 128, 128, 152]
    - [0, 68.5024]
  - - [129, 129, 2, 152, 129, 129, 129, 152]
    - [0, 69.4165]
- null
- null
- DeviceEfficiency
