library/src/hcc_detail/rocsparselt/src/spmm/Tensile/Logic/aquavanjaram/aquavanjaram_Cijk_Alik_Bljk_HHS_BH_SA_AH.yaml
- {MinimumRequiredVersion: 4.33.0}
- aquavanjaram
- gfx940
- [Device 0049, Device 0050]
    SolutionIndex: 0
    SolutionNameMin: Cijk_Alik_Bljk_HHS_BH_SA_AH_MT32x32x16_MI32x32x16x1_SN_1LDSB0_AFC1_DTVSM1_EPS0_GSU1_LPA8_LPB8_MIWT1_1_PGR0_PLR0_SU0_SUS0_SRVW0_TLDS1_WG32_2_1
    SolutionIndex: 1
    SolutionNameMin: Cijk_Alik_Bljk_HHS_BH_SA_AH_MT32x32x16_MI32x32x16x1_SN_1LDSB0_AFC1_DTVSM1_EPS0_GSU1_LPA8_LPB8_MIWT1_1_PGR0_PLR1_SU0_SUS0_SRVW0_TLDS1_WG32_2_1
    SolutionIndex: 2
    SolutionNameMin: Cijk_Alik_Bljk_HHS_BH_SA_AH_MT32x32x16_MI32x32x16x1_SN_1LDSB0_AFC0_DTVSM0_EPS1_GSU2_LPA8_LPB8_MIWT1_1_PGR2_PLR1_SU4_SUS256_SRVW0_TLDS1_WG32_2_1
    SolutionIndex: 3
    SolutionNameMin: Cijk_Alik_Bljk_HHS_BH_SA_AH_MT128x128x16_MI32x32x16x1_SN_1LDSB0_AFC0_DTVSM1_EPS1_GSU2_LPA8_LPB8_MIWT2_4_PGR2_PLR0_SU4_SUS256_SRVW0_TLDS1_WG64_2_1
    SolutionIndex: 4
    SolutionNameMin: Cijk_Alik_Bljk_HHS_BH_SA_AH_MT128x128x16_MI32x32x16x1_SN_1LDSB0_AFC1_DTVSM1_EPS1_GSU1_LPA8_LPB8_MIWT4_2_PGR2_PLR0_SU4_SUS256_SRVW0_TLDS1_WG32_4_1
    SolutionIndex: 5
    SolutionNameMin: Cijk_Alik_Bljk_HHS_BH_SA_AH_MT128x128x16_MI32x32x16x1_SN_1LDSB1_AFC0_DTVSM0_EPS1_GSU3_LPA8_LPB8_MIWT2_2_PGR1_PLR1_SU4_SUS256_SRVW0_TLDS1_WG64_4_1
    SolutionIndex: 6
    SolutionNameMin: Cijk_Alik_Bljk_HHS_BH_SA_AH_MT256x256x16_MI32x32x16x1_SN_1LDSB1_AFC1_DTVSM1_EPS1_GSU1_LPA2_LPB2_MIWT2_8_PGR2_PLR1_SU0_SUS0_SRVW0_TLDS0_WG128_2_1
    SolutionIndex: 7
    SolutionNameMin: Cijk_Alik_Bljk_HHS_BH_SA_AH_MT32x32x32_MI32x32x16x1_SN_1LDSB0_AFC1_DTVSM0_EPS0_GSU1_LPA2_LPB2_MIWT1_1_PGR0_PLR0_SU0_SUS0_SRVW0_TLDS0_WG32_2_1
    SolutionIndex: 8
    SolutionNameMin: Cijk_Alik_Bljk_HHS_BH_SA_AH_MT32x32x32_MI32x32x16x1_SN_1LDSB0_AFC1_DTVSM0_EPS1_GSU1_LPA8_LPB8_MIWT1_1_PGR1_PLR0_SU0_SUS0_SRVW0_TLDS1_WG32_2_1
    SolutionIndex: 9
    SolutionNameMin: Cijk_Alik_Bljk_HHS_BH_SA_AH_MT32x32x32_MI32x32x16x1_SN_1LDSB0_AFC1_DTVSM0_EPS1_GSU1_LPA8_LPB8_MIWT1_1_PGR2_PLR0_SU0_SUS0_SRVW0_TLDS1_WG32_2_1
    SolutionIndex: 10
    SolutionNameMin: Cijk_Alik_Bljk_HHS_BH_SA_AH_MT32x32x32_MI32x32x16x1_SN_1LDSB0_AFC1_DTVSM0_EPS0_GSU1_LPA8_LPB8_MIWT1_1_PGR0_PLR2_SU0_SUS0_SRVW0_TLDS1_WG32_2_1
    SolutionIndex: 11
    SolutionNameMin: Cijk_Alik_Bljk_HHS_BH_SA_AH_MT32x32x32_MI32x32x16x1_SN_1LDSB0_AFC1_DTVSM1_EPS1_GSU1_LPA8_LPB8_MIWT1_1_PGR1_PLR0_SU0_SUS0_SRVW0_TLDS1_WG32_2_1
    SolutionIndex: 12
    SolutionNameMin: Cijk_Alik_Bljk_HHS_BH_SA_AH_MT32x32x32_MI32x32x16x1_SN_1LDSB0_AFC1_DTVSM1_EPS1_GSU1_LPA8_LPB8_MIWT1_1_PGR2_PLR0_SU0_SUS0_SRVW0_TLDS1_WG32_2_1
    SolutionIndex: 13
    SolutionNameMin: Cijk_Alik_Bljk_HHS_BH_SA_AH_MT32x32x32_MI32x32x16x1_SN_1LDSB0_AFC1_DTVSM1_EPS1_GSU1_LPA8_LPB8_MIWT1_1_PGR2_PLR1_SU0_SUS0_SRVW0_TLDS1_WG32_2_1
    SolutionIndex: 14
    SolutionNameMin: Cijk_Alik_Bljk_HHS_BH_SA_AH_MT32x32x32_MI32x32x16x1_SN_1LDSB0_AFC1_DTVSM0_EPS0_GSU1_LPA8_LPB8_MIWT1_1_PGR0_PLR0_SU4_SUS256_SRVW0_TLDS1_WG32_2_1
    SolutionIndex: 15
    SolutionNameMin: Cijk_Alik_Bljk_HHS_BH_SA_AH_MT32x32x32_MI32x32x16x1_SN_1LDSB0_AFC1_DTVSM1_EPS0_GSU1_LPA8_LPB8_MIWT1_1_PGR0_PLR1_SU4_SUS256_SRVW0_TLDS1_WG32_2_1
    SolutionIndex: 16
    SolutionNameMin: Cijk_Alik_Bljk_HHS_BH_SA_AH_MT128x128x32_MI32x32x16x1_SN_1LDSB0_AFC1_DTVSM0_EPS1_GSU1_LPA8_LPB8_MIWT2_2_PGR2_PLR2_SU0_SUS0_SRVW0_TLDS1_WG64_4_1
    SolutionIndex: 17
    SolutionNameMin: Cijk_Alik_Bljk_HHS_BH_SA_AH_MT128x128x32_MI32x32x16x1_SN_1LDSB0_AFC1_DTVSM0_EPS1_GSU1_LPA8_LPB8_MIWT2_2_PGR2_PLR0_SU4_SUS256_SRVW0_TLDS1_WG64_4_1
    SolutionIndex: 18
    SolutionNameMin: Cijk_Alik_Bljk_HHS_BH_SA_AH_MT128x128x32_MI32x32x16x1_SN_1LDSB0_AFC1_DTVSM1_EPS0_GSU1_LPA8_LPB8_MIWT2_2_PGR0_PLR2_SU4_SUS256_SRVW0_TLDS1_WG64_4_1
    SolutionIndex: 19
    SolutionNameMin: Cijk_Alik_Bljk_HHS_BH_SA_AH_MT128x128x32_MI32x32x16x1_SN_1LDSB0_AFC0_DTVSM1_EPS1_GSU3_LPA8_LPB8_MIWT2_2_PGR2_PLR1_SU0_SUS0_SRVW0_TLDS1_WG64_4_1
    SolutionIndex: 20
    SolutionNameMin: Cijk_Alik_Bljk_HHS_BH_SA_AH_MT128x128x32_MI32x32x16x1_SN_1LDSB0_AFC1_DTVSM0_EPS1_GSU1_LPA8_LPB8_MIWT4_2_PGR1_PLR0_SU4_SUS256_SRVW0_TLDS1_WG32_4_1
    SolutionIndex: 21
    SolutionNameMin: Cijk_Alik_Bljk_HHS_BH_SA_AH_MT128x128x32_MI32x32x16x1_SN_1LDSB1_AFC1_DTVSM1_EPS1_GSU1_LPA8_LPB8_MIWT2_2_PGR1_PLR1_SU0_SUS0_SRVW0_TLDS1_WG64_4_1
    SolutionIndex: 22
    SolutionNameMin: Cijk_Alik_Bljk_HHS_BH_SA_AH_MT128x128x32_MI32x32x16x1_SN_1LDSB1_AFC1_DTVSM0_EPS1_GSU1_LPA8_LPB8_MIWT2_4_PGR1_PLR1_SU0_SUS0_SRVW0_TLDS1_WG64_2_1
    SolutionIndex: 23
    SolutionNameMin: Cijk_Alik_Bljk_HHS_BH_SA_AH_MT128x128x32_MI32x32x16x1_SN_1LDSB1_AFC1_DTVSM0_EPS1_GSU1_LPA8_LPB8_MIWT4_2_PGR2_PLR0_SU0_SUS0_SRVW0_TLDS1_WG32_4_1
    SolutionIndex: 24
    SolutionNameMin: Cijk_Alik_Bljk_HHS_BH_SA_AH_MT128x128x32_MI32x32x16x1_SN_1LDSB1_AFC1_DTVSM0_EPS1_GSU1_LPA8_LPB8_MIWT4_2_PGR1_PLR1_SU0_SUS0_SRVW0_TLDS1_WG32_4_1
    SolutionIndex: 25
    SolutionNameMin: Cijk_Alik_Bljk_HHS_BH_SA_AH_MT256x256x32_MI32x32x16x1_SN_1LDSB1_AFC1_DTVSM1_EPS1_GSU1_LPA8_LPB8_MIWT8_2_PGR1_PLR0_SU4_SUS256_SRVW0_TLDS1_WG32_8_1
    SolutionIndex: 26
    SolutionNameMin: Cijk_Alik_Bljk_HHS_BH_SA_AH_MT32x32x64_MI32x32x16x1_SN_1LDSB0_AFC1_DTVSM0_EPS1_GSU1_LPA8_LPB8_MIWT1_1_PGR1_PLR0_SU0_SUS0_SRVW0_TLDS1_WG32_2_1
    SolutionIndex: 27
    SolutionNameMin: Cijk_Alik_Bljk_HHS_BH_SA_AH_MT32x32x64_MI32x32x16x1_SN_1LDSB0_AFC1_DTVSM0_EPS1_GSU1_LPA8_LPB8_MIWT1_1_PGR2_PLR0_SU0_SUS0_SRVW0_TLDS1_WG32_2_1
    SolutionIndex: 28
    SolutionNameMin: Cijk_Alik_Bljk_HHS_BH_SA_AH_MT32x32x64_MI32x32x16x1_SN_1LDSB0_AFC1_DTVSM0_EPS1_GSU1_LPA8_LPB8_MIWT1_1_PGR1_PLR1_SU0_SUS0_SRVW0_TLDS1_WG32_2_1
    SolutionIndex: 29
    SolutionNameMin: Cijk_Alik_Bljk_HHS_BH_SA_AH_MT32x32x64_MI32x32x16x1_SN_1LDSB0_AFC1_DTVSM0_EPS1_GSU1_LPA8_LPB8_MIWT1_1_PGR2_PLR1_SU0_SUS0_SRVW0_TLDS1_WG32_2_1
    SolutionIndex: 30
    SolutionNameMin: Cijk_Alik_Bljk_HHS_BH_SA_AH_MT32x32x64_MI32x32x16x1_SN_1LDSB0_AFC1_DTVSM1_EPS0_GSU1_LPA8_LPB8_MIWT1_1_PGR0_PLR0_SU0_SUS0_SRVW0_TLDS1_WG32_2_1
    SolutionIndex: 31
    SolutionNameMin: Cijk_Alik_Bljk_HHS_BH_SA_AH_MT32x32x64_MI32x32x16x1_SN_1LDSB0_AFC1_DTVSM1_EPS1_GSU1_LPA8_LPB8_MIWT1_1_PGR1_PLR0_SU0_SUS0_SRVW0_TLDS1_WG32_2_1
    SolutionIndex: 32
    SolutionNameMin: Cijk_Alik_Bljk_HHS_BH_SA_AH_MT32x32x64_MI32x32x16x1_SN_1LDSB0_AFC1_DTVSM1_EPS1_GSU1_LPA2_LPB2_MIWT1_1_PGR2_PLR0_SU0_SUS0_SRVW0_TLDS0_WG32_2_1
    SolutionIndex: 33
    SolutionNameMin: Cijk_Alik_Bljk_HHS_BH_SA_AH_MT32x32x64_MI32x32x16x1_SN_1LDSB0_AFC1_DTVSM1_EPS1_GSU1_LPA8_LPB8_MIWT1_1_PGR2_PLR1_SU0_SUS0_SRVW0_TLDS1_WG32_2_1
    SolutionIndex: 34
    SolutionNameMin: Cijk_Alik_Bljk_HHS_BH_SA_AH_MT32x32x64_MI32x32x16x1_SN_1LDSB0_AFC1_DTVSM0_EPS1_GSU1_LPA8_LPB8_MIWT1_1_PGR2_PLR0_SU4_SUS256_SRVW0_TLDS1_WG32_2_1
    SolutionIndex: 35
    SolutionNameMin: Cijk_Alik_Bljk_HHS_BH_SA_AH_MT32x32x64_MI32x32x16x1_SN_1LDSB0_AFC1_DTVSM0_EPS1_GSU1_LPA8_LPB8_MIWT1_1_PGR1_PLR1_SU4_SUS256_SRVW0_TLDS1_WG32_2_1
    SolutionIndex: 36
    SolutionNameMin: Cijk_Alik_Bljk_HHS_BH_SA_AH_MT32x32x64_MI32x32x16x1_SN_1LDSB0_AFC1_DTVSM1_EPS1_GSU1_LPA8_LPB8_MIWT1_1_PGR1_PLR0_SU4_SUS256_SRVW0_TLDS1_WG32_2_1
    SolutionIndex: 37
    SolutionNameMin: Cijk_Alik_Bljk_HHS_BH_SA_AH_MT32x32x64_MI32x32x16x1_SN_1LDSB0_AFC1_DTVSM1_EPS0_GSU1_LPA8_LPB8_MIWT1_1_PGR0_PLR1_SU4_SUS256_SRVW0_TLDS1_WG32_2_1
    SolutionIndex: 38
    SolutionNameMin: Cijk_Alik_Bljk_HHS_BH_SA_AH_MT32x32x64_MI32x32x16x1_SN_1LDSB0_AFC0_DTVSM1_EPS1_GSU2_LPA2_LPB2_MIWT1_1_PGR1_PLR0_SU4_SUS256_SRVW0_TLDS0_WG32_2_1
    SolutionIndex: 39
    SolutionNameMin: Cijk_Alik_Bljk_HHS_BH_SA_AH_MT32x32x64_MI32x32x16x1_SN_1LDSB0_AFC0_DTVSM1_EPS1_GSU2_LPA8_LPB8_MIWT1_1_PGR2_PLR0_SU4_SUS256_SRVW0_TLDS1_WG32_2_1
    SolutionIndex: 40
    SolutionNameMin: Cijk_Alik_Bljk_HHS_BH_SA_AH_MT256x256x64_MI32x32x16x1_SN_1LDSB0_AFC1_DTVSM0_EPS0_GSU1_LPA2_LPB2_MIWT2_8_PGR0_PLR0_SU0_SUS0_SRVW0_TLDS0_WG128_2_1
    SolutionIndex: 41
    SolutionNameMin: Cijk_Alik_Bljk_HHS_BH_SA_AH_MT128x128x64_MI32x32x16x1_SN_1LDSB1_AFC1_DTVSM0_EPS1_GSU1_LPA8_LPB8_MIWT2_2_PGR1_PLR0_SU0_SUS0_SRVW0_TLDS1_WG64_4_1
    SolutionIndex: 42
    SolutionNameMin: Cijk_Alik_Bljk_HHS_BH_SA_AH_MT256x256x64_MI32x32x16x1_SN_1LDSB1_AFC1_DTVSM1_EPS1_GSU1_LPA8_LPB8_MIWT2_4_PGR2_PLR0_SU4_SUS256_SRVW0_TLDS1_WG128_4_1
    SolutionIndex: 43
    SolutionNameMin: Cijk_Alik_Bljk_HHS_BH_SA_AH_MT32x32x16_MI32x32x16x1_SN_1LDSB0_AFC1_DTVSM1_EPS0_GSU1_LPA8_LPB8_MIWT1_1_PGR0_PLR0_SU0_SUS0_SRVW8_TLDS1_WG32_2_1
    SolutionIndex: 44
    SolutionNameMin: Cijk_Alik_Bljk_HHS_BH_SA_AH_MT32x32x16_MI32x32x16x1_SN_1LDSB0_AFC1_DTVSM1_EPS1_GSU1_LPA8_LPB8_MIWT1_1_PGR2_PLR0_SU0_SUS0_SRVW8_TLDS1_WG32_2_1
    SolutionIndex: 45
    SolutionNameMin: Cijk_Alik_Bljk_HHS_BH_SA_AH_MT128x128x16_MI32x32x16x1_SN_1LDSB0_AFC1_DTVSM0_EPS0_GSU1_LPA8_LPB8_MIWT4_2_PGR0_PLR1_SU0_SUS0_SRVW8_TLDS1_WG32_4_1
    SolutionIndex: 46
    SolutionNameMin: Cijk_Alik_Bljk_HHS_BH_SA_AH_MT256x256x16_MI32x32x16x1_SN_1LDSB0_AFC1_DTVSM0_EPS1_GSU1_LPA8_LPB8_MIWT4_4_PGR2_PLR1_SU4_SUS256_SRVW8_TLDS1_WG64_4_1
    SolutionIndex: 47
    SolutionNameMin: Cijk_Alik_Bljk_HHS_BH_SA_AH_MT128x128x16_MI32x32x16x1_SN_1LDSB1_AFC1_DTVSM1_EPS1_GSU1_LPA2_LPB2_MIWT2_2_PGR1_PLR1_SU0_SUS0_SRVW8_TLDS0_WG64_4_1
    SolutionIndex: 48
    SolutionNameMin: Cijk_Alik_Bljk_HHS_BH_SA_AH_MT128x128x16_MI32x32x16x1_SN_1LDSB1_AFC1_DTVSM1_EPS1_GSU1_LPA8_LPB8_MIWT2_2_PGR1_PLR1_SU0_SUS0_SRVW8_TLDS1_WG64_4_1
    SolutionIndex: 49
    SolutionNameMin: Cijk_Alik_Bljk_HHS_BH_SA_AH_MT128x128x16_MI32x32x16x1_SN_1LDSB1_AFC1_DTVSM1_EPS1_GSU1_LPA8_LPB8_MIWT2_2_PGR2_PLR0_SU4_SUS256_SRVW8_TLDS1_WG64_4_1
    SolutionIndex: 50
    SolutionNameMin: Cijk_Alik_Bljk_HHS_BH_SA_AH_MT32x32x32_MI32x32x16x1_SN_1LDSB0_AFC1_DTVSM1_EPS1_GSU1_LPA8_LPB8_MIWT1_1_PGR2_PLR2_SU4_SUS256_SRVW8_TLDS1_WG32_2_1
    SolutionIndex: 51
    SolutionNameMin: Cijk_Alik_Bljk_HHS_BH_SA_AH_MT128x128x32_MI32x32x16x1_SN_1LDSB0_AFC1_DTVSM0_EPS1_GSU1_LPA8_LPB8_MIWT2_2_PGR1_PLR2_SU4_SUS256_SRVW8_TLDS1_WG64_4_1
    SolutionIndex: 52
    SolutionNameMin: Cijk_Alik_Bljk_HHS_BH_SA_AH_MT128x128x32_MI32x32x16x1_SN_1LDSB0_AFC1_DTVSM1_EPS1_GSU1_LPA2_LPB2_MIWT2_2_PGR1_PLR1_SU4_SUS256_SRVW8_TLDS0_WG64_4_1
    SolutionIndex: 53
    SolutionNameMin: Cijk_Alik_Bljk_HHS_BH_SA_AH_MT128x128x32_MI32x32x16x1_SN_1LDSB0_AFC1_DTVSM1_EPS1_GSU1_LPA8_LPB8_MIWT2_2_PGR2_PLR2_SU4_SUS256_SRVW8_TLDS1_WG64_4_1
    SolutionIndex: 54
    SolutionNameMin: Cijk_Alik_Bljk_HHS_BH_SA_AH_MT128x128x32_MI32x32x16x1_SN_1LDSB1_AFC1_DTVSM0_EPS1_GSU1_LPA8_LPB8_MIWT4_2_PGR1_PLR1_SU4_SUS256_SRVW8_TLDS1_WG32_4_1
    SolutionIndex: 55
    SolutionNameMin: Cijk_Alik_Bljk_HHS_BH_SA_AH_MT256x256x32_MI32x32x16x1_SN_1LDSB1_AFC1_DTVSM1_EPS1_GSU1_LPA2_LPB2_MIWT2_8_PGR2_PLR1_SU4_SUS256_SRVW8_TLDS0_WG128_2_1
    SolutionIndex: 56
    SolutionNameMin: Cijk_Alik_Bljk_HHS_BH_SA_AH_MT32x32x64_MI32x32x16x1_SN_1LDSB0_AFC1_DTVSM1_EPS1_GSU1_LPA8_LPB8_MIWT1_1_PGR1_PLR0_SU0_SUS0_SRVW8_TLDS1_WG32_2_1
    SolutionIndex: 57
    SolutionNameMin: Cijk_Alik_Bljk_HHS_BH_SA_AH_MT32x32x64_MI32x32x16x1_SN_1LDSB0_AFC1_DTVSM1_EPS1_GSU1_LPA2_LPB2_MIWT1_1_PGR2_PLR1_SU0_SUS0_SRVW8_TLDS0_WG32_2_1
    SolutionIndex: 58
    SolutionNameMin: Cijk_Alik_Bljk_HHS_BH_SA_AH_MT32x32x64_MI32x32x16x1_SN_1LDSB0_AFC1_DTVSM1_EPS0_GSU1_LPA8_LPB8_MIWT1_1_PGR0_PLR0_SU4_SUS256_SRVW8_TLDS1_WG32_2_1
    SolutionIndex: 59
    SolutionNameMin: Cijk_Alik_Bljk_HHS_BH_SA_AH_MT128x128x64_MI32x32x16x1_SN_1LDSB0_AFC1_DTVSM0_EPS1_GSU1_LPA8_LPB8_MIWT2_2_PGR2_PLR0_SU0_SUS0_SRVW8_TLDS1_WG64_4_1
    SolutionIndex: 60
    SolutionNameMin: Cijk_Alik_Bljk_HHS_BH_SA_AH_MT128x128x64_MI32x32x16x1_SN_1LDSB0_AFC1_DTVSM1_EPS1_GSU1_LPA2_LPB2_MIWT4_2_PGR1_PLR1_SU0_SUS0_SRVW8_TLDS0_WG32_4_1
    SolutionIndex: 61
    SolutionNameMin: Cijk_Alik_Bljk_HHS_BH_SA_AH_MT256x256x64_MI32x32x16x1_SN_1LDSB1_AFC1_DTVSM0_EPS1_GSU1_LPA8_LPB8_MIWT2_4_PGR1_PLR1_SU0_SUS0_SRVW8_TLDS1_WG128_4_1
- - - [15, 15, 1, 16, 15, 15, 16, 16]
    - [1, 0.538076]
  - - [15, 15, 1, 32, 15, 15, 32, 32]
    - [13, 1.03889]
  - - [15, 15, 1, 64, 15, 15, 64, 64]
    - [14, 2.13333]
  - - [15, 15, 1, 96, 15, 15, 96, 96]
    - [15, 3.04611]
  - - [15, 15, 1, 128, 15, 15, 128, 128]
    - [30, 4.10812]
  - - [15, 15, 1, 136, 15, 15, 136, 136]
    - [10, 4.08463]
  - - [15, 15, 1, 256, 15, 15, 256, 256]
    - [8, 7.44956]
  - - [15, 15, 1, 264, 15, 15, 264, 264]
    - [13, 7.07733]
  - - [15, 15, 1, 528, 15, 15, 528, 528]
    - [29, 12.3821]
  - - [15, 15, 1, 544, 15, 15, 544, 544]
    - [9, 12.7043]
  - - [15, 15, 1, 576, 15, 15, 576, 576]
    - [29, 14.4425]
  - - [15, 15, 1, 608, 15, 15, 608, 608]
    - [29, 13.9949]
  - - [15, 15, 1, 640, 15, 15, 640, 640]
    - [27, 15.2631]
  - - [15, 15, 1, 768, 15, 15, 768, 768]
    - [29, 18.5527]
  - - [15, 15, 1, 776, 15, 15, 776, 776]
    - [29, 17.1589]
  - - [32, 32, 1, 16, 32, 32, 16, 16]
    - [43, 2.97431]
  - - [32, 32, 1, 32, 32, 32, 32, 32]
    - [13, 5.78072]
  - - [32, 32, 1, 64, 32, 32, 64, 64]
    - [26, 11.7691]
  - - [32, 32, 1, 96, 32, 32, 96, 96]
    - [11, 16.7497]
  - - [32, 32, 1, 128, 32, 32, 128, 128]
    - [11, 22.0326]
  - - [32, 32, 1, 136, 32, 32, 136, 136]
    - [8, 21.5913]
  - - [32, 32, 1, 256, 32, 32, 256, 256]
    - [28, 38.9487]
  - - [32, 32, 1, 264, 32, 32, 264, 264]
    - [26, 38.6719]
  - - [32, 32, 1, 528, 32, 32, 528, 528]
    - [26, 66.6509]
  - - [32, 32, 1, 544, 32, 32, 544, 544]
    - [33, 68.8361]
  - - [32, 32, 1, 576, 32, 32, 576, 576]
    - [34, 76.6802]
  - - [32, 32, 1, 608, 32, 32, 608, 608]
    - [36, 72.4534]
  - - [32, 32, 1, 640, 32, 32, 640, 640]
    - [33, 84.7594]
  - - [32, 32, 1, 768, 32, 32, 768, 768]
    - [29, 94.6027]
  - - [32, 32, 1, 776, 32, 32, 776, 776]
    - [29, 87.1872]
  - - [256, 256, 1, 16, 256, 256, 16, 16]
    - [46, 44.8954]
  - - [256, 256, 1, 24, 256, 256, 24, 24]
    - [25, 24.8335]
  - - [256, 256, 1, 32, 256, 256, 32, 32]
    - [16, 112.457]
  - - [256, 256, 1, 64, 256, 256, 64, 64]
    - [32, 601.722]
  - - [256, 256, 1, 96, 256, 256, 96, 96]
    - [53, 521.744]
  - - [256, 256, 1, 128, 256, 256, 128, 128]
    - [60, 434.88]
  - - [256, 256, 1, 136, 256, 256, 136, 136]
    - [49, 684.58]
  - - [256, 256, 1, 256, 256, 256, 256, 256]
    - [4, 640.352]
  - - [256, 256, 1, 264, 256, 256, 264, 264]
    - [61, 749.129]
  - - [256, 256, 1, 280, 256, 256, 280, 280]
    - [22, 745.408]
  - - [256, 256, 1, 296, 256, 256, 296, 296]
    - [37, 2181.22]
  - - [256, 256, 1, 528, 256, 256, 528, 528]
    - [54, 1440.8]
  - - [256, 256, 1, 544, 256, 256, 544, 544]
    - [59, 2048.18]
  - - [256, 256, 1, 576, 256, 256, 576, 576]
    - [3, 1117.77]
  - - [256, 256, 1, 608, 256, 256, 608, 608]
    - [31, 4343.35]
  - - [256, 256, 1, 640, 256, 256, 640, 640]
    - [12, 4748.18]
  - - [256, 256, 1, 768, 256, 256, 768, 768]
    - [7, 3625.81]
  - - [256, 256, 1, 776, 256, 256, 776, 776]
    - [13, 4920.51]
  - - [256, 256, 1, 792, 256, 256, 792, 792]
    - [2, 2503.65]
  - - [256, 256, 1, 808, 256, 256, 808, 808]
    - [44, 3728.7]
  - - [255, 255, 1, 16, 255, 255, 16, 16]
    - [55, 15.9034]
  - - [255, 255, 1, 32, 255, 255, 32, 32]
    - [35, 207.344]
  - - [255, 255, 1, 64, 255, 255, 64, 64]
    - [18, 134.04]
  - - [255, 255, 1, 96, 255, 255, 96, 96]
    - [51, 283.314]
  - - [255, 255, 1, 128, 255, 255, 128, 128]
    - [42, 85.0612]
  - - [255, 255, 1, 136, 255, 255, 136, 136]
    - [6, 84.3353]
  - - [255, 255, 1, 256, 255, 255, 256, 256]
    - [44, 1675.45]
  - - [255, 255, 1, 264, 255, 255, 264, 264]
    - [48, 646.808]
  - - [255, 255, 1, 528, 255, 255, 528, 528]
    - [58, 2699.26]
  - - [255, 255, 1, 544, 255, 255, 544, 544]
    - [24, 738.288]
  - - [255, 255, 1, 576, 255, 255, 576, 576]
    - [38, 1576.6]
  - - [255, 255, 1, 608, 255, 255, 608, 608]
    - [45, 730.746]
  - - [255, 255, 1, 640, 255, 255, 640, 640]
    - [41, 1152.96]
  - - [255, 255, 1, 768, 255, 255, 768, 768]
    - [21, 1076.48]
  - - [255, 255, 1, 776, 255, 255, 776, 776]
    - [39, 2367.6]
  - - [264, 264, 1, 16, 264, 264, 16, 16]
    - [0, 165.205]
  - - [264, 264, 1, 32, 264, 264, 32, 32]
    - [56, 239.956]
  - - [264, 264, 1, 64, 264, 264, 64, 64]
    - [47, 207.535]
  - - [264, 264, 1, 96, 264, 264, 96, 96]
    - [17, 418.058]
  - - [264, 264, 1, 128, 264, 264, 128, 128]
    - [52, 396.59]
  - - [264, 264, 1, 136, 264, 264, 136, 136]
    - [57, 815.859]
  - - [264, 264, 1, 256, 264, 264, 256, 256]
    - [23, 692.107]
  - - [264, 264, 1, 264, 264, 264, 264, 264]
    - [40, 316.865]
  - - [264, 264, 1, 528, 264, 264, 528, 528]
    - [27, 3843.49]
  - - [264, 264, 1, 544, 264, 264, 544, 544]
    - [34, 3785.59]
  - - [264, 264, 1, 576, 264, 264, 576, 576]
    - [9, 4210.27]
  - - [264, 264, 1, 608, 264, 264, 608, 608]
    - [50, 3757.66]
  - - [264, 264, 1, 640, 264, 264, 640, 640]
    - [20, 1501.59]
  - - [264, 264, 1, 768, 264, 264, 768, 768]
    - [5, 1749.98]
  - - [264, 264, 1, 776, 264, 264, 776, 776]
    - [19, 2007.5]
- null
- null
- DeviceEfficiency
