library/src/hcc_detail/rocsparselt/src/spmm/Tensile/Logic/aquavanjaram/aquavanjaram_Cijk_Ailk_Bljk_I8I8S_BH_SA_AH.yaml
- {MinimumRequiredVersion: 4.33.0}
- aquavanjaram
- gfx940
- [Device 0049, Device 0050]
    SolutionIndex: 0
    SolutionNameMin: Cijk_Ailk_Bljk_I8I8S_BH_SA_AH_MT32x32x32_MI32x32x32x1_SN_1LDSB0_AFC1_DTVSM0_EPS1_GRVW8_GSU1_LPB16_MIWT1_1_PGR2_PLR0_SU0_SUS0_SRVW0_TLDS1_WG32_2_1
    SolutionIndex: 1
    SolutionNameMin: Cijk_Ailk_Bljk_I8I8S_BH_SA_AH_MT32x32x32_MI32x32x32x1_SN_1LDSB0_AFC1_DTVSM0_EPS1_GRVW16_GSU1_LPB16_MIWT1_1_PGR2_PLR0_SU0_SUS0_SRVW0_TLDS1_WG32_2_1
    SolutionIndex: 2
    SolutionNameMin: Cijk_Ailk_Bljk_I8I8S_BH_SA_AH_MT32x32x32_MI32x32x32x1_SN_1LDSB0_AFC1_DTVSM0_EPS0_GRVW8_GSU1_LPB16_MIWT1_1_PGR0_PLR1_SU0_SUS0_SRVW0_TLDS1_WG32_2_1
    SolutionIndex: 3
    SolutionNameMin: Cijk_Ailk_Bljk_I8I8S_BH_SA_AH_MT32x32x32_MI32x32x32x1_SN_1LDSB0_AFC1_DTVSM0_EPS0_GRVW16_GSU1_LPB16_MIWT1_1_PGR0_PLR1_SU0_SUS0_SRVW0_TLDS1_WG32_2_1
    SolutionIndex: 4
    SolutionNameMin: Cijk_Ailk_Bljk_I8I8S_BH_SA_AH_MT32x32x32_MI32x32x32x1_SN_1LDSB0_AFC1_DTVSM0_EPS1_GRVW16_GSU1_LPB16_MIWT1_1_PGR1_PLR1_SU0_SUS0_SRVW0_TLDS1_WG32_2_1
    SolutionIndex: 5
    SolutionNameMin: Cijk_Ailk_Bljk_I8I8S_BH_SA_AH_MT32x32x32_MI32x32x32x1_SN_1LDSB0_AFC1_DTVSM1_EPS1_GRVW8_GSU1_LPB16_MIWT1_1_PGR2_PLR0_SU0_SUS0_SRVW0_TLDS1_WG32_2_1
    SolutionIndex: 6
    SolutionNameMin: Cijk_Ailk_Bljk_I8I8S_BH_SA_AH_MT32x32x32_MI32x32x32x1_SN_1LDSB0_AFC1_DTVSM1_EPS1_GRVW16_GSU1_LPB16_MIWT1_1_PGR2_PLR0_SU0_SUS0_SRVW0_TLDS1_WG32_2_1
    SolutionIndex: 7
    SolutionNameMin: Cijk_Ailk_Bljk_I8I8S_BH_SA_AH_MT32x32x32_MI32x32x32x1_SN_1LDSB0_AFC1_DTVSM1_EPS0_GRVW8_GSU1_LPB16_MIWT1_1_PGR0_PLR1_SU0_SUS0_SRVW0_TLDS1_WG32_2_1
    SolutionIndex: 8
    SolutionNameMin: Cijk_Ailk_Bljk_I8I8S_BH_SA_AH_MT32x32x32_MI32x32x32x1_SN_1LDSB0_AFC1_DTVSM1_EPS0_GRVW16_GSU1_LPB16_MIWT1_1_PGR0_PLR1_SU0_SUS0_SRVW0_TLDS1_WG32_2_1
    SolutionIndex: 9
    SolutionNameMin: Cijk_Ailk_Bljk_I8I8S_BH_SA_AH_MT32x32x32_MI32x32x32x1_SN_1LDSB0_AFC1_DTVSM1_EPS1_GRVW16_GSU1_LPB2_MIWT1_1_PGR1_PLR1_SU0_SUS0_SRVW0_TLDS0_WG32_2_1
    SolutionIndex: 10
    SolutionNameMin: Cijk_Ailk_Bljk_I8I8S_BH_SA_AH_MT32x32x32_MI32x32x32x1_SN_1LDSB0_AFC1_DTVSM1_EPS1_GRVW16_GSU1_LPB16_MIWT1_1_PGR1_PLR1_SU0_SUS0_SRVW0_TLDS1_WG32_2_1
    SolutionIndex: 11
    SolutionNameMin: Cijk_Ailk_Bljk_I8I8S_BH_SA_AH_MT32x32x32_MI32x32x32x1_SN_1LDSB0_AFC1_DTVSM1_EPS1_GRVW16_GSU1_LPB16_MIWT1_1_PGR2_PLR1_SU0_SUS0_SRVW0_TLDS1_WG32_2_1
    SolutionIndex: 12
    SolutionNameMin: Cijk_Ailk_Bljk_I8I8S_BH_SA_AH_MT32x32x32_MI32x32x32x1_SN_1LDSB0_AFC1_DTVSM0_EPS0_GRVW8_GSU1_LPB16_MIWT1_1_PGR0_PLR1_SU4_SUS256_SRVW0_TLDS1_WG32_2_1
    SolutionIndex: 13
    SolutionNameMin: Cijk_Ailk_Bljk_I8I8S_BH_SA_AH_MT32x32x32_MI32x32x32x1_SN_1LDSB0_AFC1_DTVSM0_EPS0_GRVW16_GSU1_LPB16_MIWT1_1_PGR0_PLR1_SU4_SUS256_SRVW0_TLDS1_WG32_2_1
    SolutionIndex: 14
    SolutionNameMin: Cijk_Ailk_Bljk_I8I8S_BH_SA_AH_MT32x32x32_MI32x32x32x1_SN_1LDSB0_AFC1_DTVSM1_EPS1_GRVW8_GSU1_LPB16_MIWT1_1_PGR2_PLR0_SU4_SUS256_SRVW0_TLDS1_WG32_2_1
    SolutionIndex: 15
    SolutionNameMin: Cijk_Ailk_Bljk_I8I8S_BH_SA_AH_MT32x32x32_MI32x32x32x1_SN_1LDSB0_AFC1_DTVSM1_EPS0_GRVW16_GSU1_LPB16_MIWT1_1_PGR0_PLR1_SU4_SUS256_SRVW0_TLDS1_WG32_2_1
    SolutionIndex: 16
    SolutionNameMin: Cijk_Ailk_Bljk_I8I8S_BH_SA_AH_MT32x32x32_MI32x32x32x1_SN_1LDSB0_AFC1_DTVSM1_EPS1_GRVW8_GSU1_LPB16_MIWT1_1_PGR2_PLR1_SU4_SUS256_SRVW0_TLDS1_WG32_2_1
    SolutionIndex: 17
    SolutionNameMin: Cijk_Ailk_Bljk_I8I8S_BH_SA_AH_MT32x32x64_MI32x32x32x1_SN_1LDSB0_AFC1_DTVSM0_EPS1_GRVW16_GSU1_LPB16_MIWT1_1_PGR2_PLR0_SU0_SUS0_SRVW0_TLDS1_WG32_2_1
    SolutionIndex: 18
    SolutionNameMin: Cijk_Ailk_Bljk_I8I8S_BH_SA_AH_MT32x32x64_MI32x32x32x1_SN_1LDSB0_AFC1_DTVSM0_EPS1_GRVW16_GSU1_LPB16_MIWT1_1_PGR1_PLR1_SU0_SUS0_SRVW0_TLDS1_WG32_2_1
    SolutionIndex: 19
    SolutionNameMin: Cijk_Ailk_Bljk_I8I8S_BH_SA_AH_MT32x32x64_MI32x32x32x1_SN_1LDSB0_AFC1_DTVSM0_EPS1_GRVW16_GSU1_LPB16_MIWT1_1_PGR2_PLR1_SU0_SUS0_SRVW0_TLDS1_WG32_2_1
    SolutionIndex: 20
    SolutionNameMin: Cijk_Ailk_Bljk_I8I8S_BH_SA_AH_MT32x32x64_MI32x32x32x1_SN_1LDSB0_AFC1_DTVSM0_EPS1_GRVW8_GSU1_LPB16_MIWT1_1_PGR2_PLR2_SU0_SUS0_SRVW0_TLDS1_WG32_2_1
    SolutionIndex: 21
    SolutionNameMin: Cijk_Ailk_Bljk_I8I8S_BH_SA_AH_MT32x32x64_MI32x32x32x1_SN_1LDSB0_AFC1_DTVSM1_EPS1_GRVW8_GSU1_LPB16_MIWT1_1_PGR2_PLR0_SU0_SUS0_SRVW0_TLDS1_WG32_2_1
    SolutionIndex: 22
    SolutionNameMin: Cijk_Ailk_Bljk_I8I8S_BH_SA_AH_MT32x32x64_MI32x32x32x1_SN_1LDSB0_AFC1_DTVSM1_EPS1_GRVW16_GSU1_LPB16_MIWT1_1_PGR2_PLR0_SU0_SUS0_SRVW0_TLDS1_WG32_2_1
    SolutionIndex: 23
    SolutionNameMin: Cijk_Ailk_Bljk_I8I8S_BH_SA_AH_MT32x32x64_MI32x32x32x1_SN_1LDSB0_AFC1_DTVSM1_EPS0_GRVW8_GSU1_LPB16_MIWT1_1_PGR0_PLR1_SU0_SUS0_SRVW0_TLDS1_WG32_2_1
    SolutionIndex: 24
    SolutionNameMin: Cijk_Ailk_Bljk_I8I8S_BH_SA_AH_MT32x32x64_MI32x32x32x1_SN_1LDSB0_AFC1_DTVSM1_EPS1_GRVW16_GSU1_LPB16_MIWT1_1_PGR2_PLR1_SU0_SUS0_SRVW0_TLDS1_WG32_2_1
    SolutionIndex: 25
    SolutionNameMin: Cijk_Ailk_Bljk_I8I8S_BH_SA_AH_MT32x32x64_MI32x32x32x1_SN_1LDSB0_AFC1_DTVSM1_EPS0_GRVW8_GSU1_LPB16_MIWT1_1_PGR0_PLR2_SU0_SUS0_SRVW0_TLDS1_WG32_2_1
    SolutionIndex: 26
    SolutionNameMin: Cijk_Ailk_Bljk_I8I8S_BH_SA_AH_MT32x32x64_MI32x32x32x1_SN_1LDSB0_AFC1_DTVSM1_EPS0_GRVW16_GSU1_LPB16_MIWT1_1_PGR0_PLR2_SU0_SUS0_SRVW0_TLDS1_WG32_2_1
    SolutionIndex: 27
    SolutionNameMin: Cijk_Ailk_Bljk_I8I8S_BH_SA_AH_MT32x32x64_MI32x32x32x1_SN_1LDSB0_AFC1_DTVSM1_EPS1_GRVW16_GSU1_LPB16_MIWT1_1_PGR1_PLR2_SU0_SUS0_SRVW0_TLDS1_WG32_2_1
    SolutionIndex: 28
    SolutionNameMin: Cijk_Ailk_Bljk_I8I8S_BH_SA_AH_MT32x32x64_MI32x32x32x1_SN_1LDSB0_AFC1_DTVSM0_EPS1_GRVW16_GSU1_LPB16_MIWT1_1_PGR1_PLR2_SU4_SUS256_SRVW0_TLDS1_WG32_2_1
    SolutionIndex: 29
    SolutionNameMin: Cijk_Ailk_Bljk_I8I8S_BH_SA_AH_MT32x32x64_MI32x32x32x1_SN_1LDSB0_AFC1_DTVSM1_EPS1_GRVW8_GSU1_LPB16_MIWT1_1_PGR1_PLR2_SU4_SUS256_SRVW0_TLDS1_WG32_2_1
    SolutionIndex: 30
    SolutionNameMin: Cijk_Ailk_Bljk_I8I8S_BH_SA_AH_MT32x32x128_MI32x32x32x1_SN_1LDSB0_AFC1_DTVSM0_EPS1_GRVW16_GSU1_LPB16_MIWT1_1_PGR2_PLR0_SU0_SUS0_SRVW0_TLDS1_WG32_2_1
    SolutionIndex: 31
    SolutionNameMin: Cijk_Ailk_Bljk_I8I8S_BH_SA_AH_MT32x32x128_MI32x32x32x1_SN_1LDSB0_AFC1_DTVSM1_EPS0_GRVW16_GSU1_LPB16_MIWT1_1_PGR0_PLR0_SU0_SUS0_SRVW0_TLDS1_WG32_2_1
    SolutionIndex: 32
    SolutionNameMin: Cijk_Ailk_Bljk_I8I8S_BH_SA_AH_MT32x32x128_MI32x32x32x1_SN_1LDSB0_AFC1_DTVSM1_EPS1_GRVW8_GSU1_LPB16_MIWT1_1_PGR1_PLR0_SU0_SUS0_SRVW0_TLDS1_WG32_2_1
    SolutionIndex: 33
    SolutionNameMin: Cijk_Ailk_Bljk_I8I8S_BH_SA_AH_MT32x32x128_MI32x32x32x1_SN_1LDSB0_AFC1_DTVSM1_EPS0_GRVW16_GSU1_LPB16_MIWT1_1_PGR0_PLR1_SU0_SUS0_SRVW0_TLDS1_WG32_2_1
    SolutionIndex: 34
    SolutionNameMin: Cijk_Ailk_Bljk_I8I8S_BH_SA_AH_MT32x32x128_MI32x32x32x1_SN_1LDSB0_AFC1_DTVSM1_EPS0_GRVW16_GSU1_LPB16_MIWT1_1_PGR0_PLR1_SU4_SUS256_SRVW0_TLDS1_WG32_2_1
    SolutionIndex: 35
    SolutionNameMin: Cijk_Ailk_Bljk_I8I8S_BH_SA_AH_MT32x32x64_MI32x32x32x1_SN_1LDSB0_AFC1_DTVSM0_EPS1_GRVW8_GSU1_LPB16_MIWT1_1_PGR2_PLR2_SU0_SUS0_SRVW8_TLDS1_WG32_2_1
- - - [15, 15, 1, 16, 15, 15, 15, 16]
    - [14, 0.408464]
  - - [15, 15, 1, 32, 15, 15, 15, 32]
    - [14, 0.896414]
  - - [15, 15, 1, 64, 15, 15, 15, 64]
    - [18, 1.79719]
  - - [15, 15, 1, 96, 15, 15, 15, 96]
    - [16, 2.47324]
  - - [15, 15, 1, 128, 15, 15, 15, 128]
    - [18, 3.43963]
  - - [15, 15, 1, 136, 15, 15, 15, 136]
    - [0, 3.37227]
  - - [15, 15, 1, 256, 15, 15, 15, 256]
    - [22, 6.39041]
  - - [15, 15, 1, 264, 15, 15, 15, 264]
    - [0, 5.81469]
  - - [15, 15, 1, 528, 15, 15, 15, 528]
    - [21, 10.3327]
  - - [15, 15, 1, 544, 15, 15, 15, 544]
    - [17, 10.777]
  - - [15, 15, 1, 576, 15, 15, 15, 576]
    - [22, 12.9406]
  - - [15, 15, 1, 608, 15, 15, 15, 608]
    - [1, 12.6007]
  - - [15, 15, 1, 640, 15, 15, 15, 640]
    - [17, 14.2928]
  - - [15, 15, 1, 768, 15, 15, 15, 768]
    - [19, 16.4321]
  - - [15, 15, 1, 776, 15, 15, 15, 776]
    - [22, 14.9263]
  - - [32, 32, 1, 16, 32, 32, 32, 16]
    - [11, 2.27208]
  - - [32, 32, 1, 32, 32, 32, 32, 32]
    - [9, 5.03349]
  - - [32, 32, 1, 64, 32, 32, 32, 64]
    - [28, 10.1922]
  - - [32, 32, 1, 96, 32, 32, 32, 96]
    - [11, 14.1019]
  - - [32, 32, 1, 128, 32, 32, 32, 128]
    - [32, 19.2456]
  - - [32, 32, 1, 136, 32, 32, 32, 136]
    - [11, 17.9198]
  - - [32, 32, 1, 256, 32, 32, 32, 256]
    - [30, 35.18]
  - - [32, 32, 1, 264, 32, 32, 32, 264]
    - [18, 31.6072]
  - - [32, 32, 1, 528, 32, 32, 32, 528]
    - [35, 55.8863]
  - - [32, 32, 1, 544, 32, 32, 32, 544]
    - [6, 58.7953]
  - - [32, 32, 1, 576, 32, 32, 32, 576]
    - [24, 68.4767]
  - - [32, 32, 1, 608, 32, 32, 32, 608]
    - [19, 64.4872]
  - - [32, 32, 1, 640, 32, 32, 32, 640]
    - [17, 76.6234]
  - - [32, 32, 1, 768, 32, 32, 32, 768]
    - [19, 88.4277]
  - - [32, 32, 1, 776, 32, 32, 32, 776]
    - [19, 75.1346]
  - - [256, 256, 1, 16, 256, 256, 256, 16]
    - [11, 146.633]
  - - [256, 256, 1, 24, 256, 256, 256, 24]
    - [13, 222.439]
  - - [256, 256, 1, 32, 256, 256, 256, 32]
    - [15, 317.27]
  - - [256, 256, 1, 64, 256, 256, 256, 64]
    - [26, 648.32]
  - - [256, 256, 1, 96, 256, 256, 256, 96]
    - [13, 897.433]
  - - [256, 256, 1, 128, 256, 256, 256, 128]
    - [26, 1220.96]
  - - [256, 256, 1, 136, 256, 256, 256, 136]
    - [3, 1132.23]
  - - [256, 256, 1, 256, 256, 256, 256, 256]
    - [26, 2215.84]
  - - [256, 256, 1, 264, 256, 256, 256, 264]
    - [6, 2013.44]
  - - [256, 256, 1, 280, 256, 256, 256, 280]
    - [11, 2101.11]
  - - [256, 256, 1, 296, 256, 256, 256, 296]
    - [11, 2257.36]
  - - [256, 256, 1, 528, 256, 256, 256, 528]
    - [11, 3614.08]
  - - [256, 256, 1, 544, 256, 256, 256, 544]
    - [11, 3955.35]
  - - [256, 256, 1, 576, 256, 256, 256, 576]
    - [19, 4302.59]
  - - [256, 256, 1, 608, 256, 256, 256, 608]
    - [11, 4205.59]
  - - [256, 256, 1, 640, 256, 256, 256, 640]
    - [33, 4737.45]
  - - [256, 256, 1, 768, 256, 256, 256, 768]
    - [34, 5462.52]
  - - [256, 256, 1, 776, 256, 256, 256, 776]
    - [19, 4808.62]
  - - [256, 256, 1, 792, 256, 256, 256, 792]
    - [20, 4825.41]
  - - [256, 256, 1, 808, 256, 256, 256, 808]
    - [27, 4815.23]
  - - [255, 255, 1, 16, 255, 255, 255, 16]
    - [11, 119.128]
  - - [255, 255, 1, 32, 255, 255, 255, 32]
    - [4, 264.329]
  - - [255, 255, 1, 64, 255, 255, 255, 64]
    - [29, 495.842]
  - - [255, 255, 1, 96, 255, 255, 255, 96]
    - [8, 724.723]
  - - [255, 255, 1, 128, 255, 255, 255, 128]
    - [25, 961.83]
  - - [255, 255, 1, 136, 255, 255, 255, 136]
    - [8, 929.466]
  - - [255, 255, 1, 256, 255, 255, 255, 256]
    - [23, 1775.71]
  - - [255, 255, 1, 264, 255, 255, 255, 264]
    - [11, 1651.27]
  - - [255, 255, 1, 528, 255, 255, 255, 528]
    - [11, 3028.29]
  - - [255, 255, 1, 544, 255, 255, 255, 544]
    - [11, 3276.4]
  - - [255, 255, 1, 576, 255, 255, 255, 576]
    - [29, 3568.45]
  - - [255, 255, 1, 608, 255, 255, 255, 608]
    - [11, 3601.64]
  - - [255, 255, 1, 640, 255, 255, 255, 640]
    - [34, 4041.96]
  - - [255, 255, 1, 768, 255, 255, 255, 768]
    - [34, 4574.44]
  - - [255, 255, 1, 776, 255, 255, 255, 776]
    - [24, 4150.13]
  - - [264, 264, 1, 16, 264, 264, 264, 16]
    - [7, 131.611]
  - - [264, 264, 1, 32, 264, 264, 264, 32]
    - [2, 284.039]
  - - [264, 264, 1, 64, 264, 264, 264, 64]
    - [25, 551.195]
  - - [264, 264, 1, 96, 264, 264, 264, 96]
    - [12, 797.19]
  - - [264, 264, 1, 128, 264, 264, 264, 128]
    - [26, 1050.4]
  - - [264, 264, 1, 136, 264, 264, 264, 136]
    - [10, 1017.68]
  - - [264, 264, 1, 256, 264, 264, 264, 256]
    - [31, 2019.83]
  - - [264, 264, 1, 264, 264, 264, 264, 264]
    - [11, 1818.97]
  - - [264, 264, 1, 528, 264, 264, 264, 528]
    - [11, 3322.15]
  - - [264, 264, 1, 544, 264, 264, 264, 544]
    - [5, 3511.75]
  - - [264, 264, 1, 576, 264, 264, 264, 576]
    - [29, 3824.78]
  - - [264, 264, 1, 608, 264, 264, 264, 608]
    - [11, 3888.7]
  - - [264, 264, 1, 640, 264, 264, 264, 640]
    - [34, 4357.92]
  - - [264, 264, 1, 768, 264, 264, 264, 768]
    - [34, 5199.02]
  - - [264, 264, 1, 776, 264, 264, 264, 776]
    - [24, 4477.72]
- null
- null
- DeviceEfficiency
