library/src/hcc_detail/rocsparselt/src/spmm/Tensile/Logic/aquavanjaram/aquavanjaram_Cijk_Alik_Bjlk_HHS_BH_SA_AH.yaml
- {MinimumRequiredVersion: 4.33.0}
- aquavanjaram
- gfx940
- [Device 0049, Device 0050]
    SolutionIndex: 0
    SolutionNameMin: Cijk_Alik_Bjlk_HHS_BH_SA_AH_MT32x32x16_MI32x32x16x1_SN_1LDSB0_AFC1_DTVSM0_EPS0_GSU1_LPA8_MIWT1_1_PGR0_PLR1_SU0_SUS0_SRVW0_TLDS1_WG32_2_1
    SolutionIndex: 1
    SolutionNameMin: Cijk_Alik_Bjlk_HHS_BH_SA_AH_MT32x32x16_MI32x32x16x1_SN_1LDSB0_AFC1_DTVSM0_EPS1_GSU1_LPA8_MIWT1_1_PGR2_PLR1_SU0_SUS0_SRVW0_TLDS1_WG32_2_1
    SolutionIndex: 2
    SolutionNameMin: Cijk_Alik_Bjlk_HHS_BH_SA_AH_MT32x32x16_MI32x32x16x1_SN_1LDSB0_AFC1_DTVSM1_EPS1_GSU1_LPA8_MIWT1_1_PGR2_PLR0_SU0_SUS0_SRVW0_TLDS1_WG32_2_1
    SolutionIndex: 3
    SolutionNameMin: Cijk_Alik_Bjlk_HHS_BH_SA_AH_MT32x32x16_MI32x32x16x1_SN_1LDSB0_AFC1_DTVSM0_EPS0_GSU1_LPA8_MIWT1_1_PGR0_PLR0_SU4_SUS256_SRVW0_TLDS1_WG32_2_1
    SolutionIndex: 4
    SolutionNameMin: Cijk_Alik_Bjlk_HHS_BH_SA_AH_MT32x32x16_MI32x32x16x1_SN_1LDSB0_AFC1_DTVSM0_EPS0_GSU1_LPA2_MIWT1_1_PGR0_PLR1_SU4_SUS256_SRVW0_TLDS0_WG32_2_1
    SolutionIndex: 5
    SolutionNameMin: Cijk_Alik_Bjlk_HHS_BH_SA_AH_MT32x32x16_MI32x32x16x1_SN_1LDSB0_AFC0_DTVSM1_EPS1_GSU3_LPA8_MIWT1_1_PGR2_PLR0_SU4_SUS256_SRVW0_TLDS1_WG32_2_1
    SolutionIndex: 6
    SolutionNameMin: Cijk_Alik_Bjlk_HHS_BH_SA_AH_MT128x128x16_MI32x32x16x1_SN_1LDSB1_AFC1_DTVSM0_EPS1_GSU1_LPA8_MIWT2_2_PGR2_PLR0_SU4_SUS256_SRVW0_TLDS1_WG64_4_1
    SolutionIndex: 7
    SolutionNameMin: Cijk_Alik_Bjlk_HHS_BH_SA_AH_MT128x128x16_MI32x32x16x1_SN_1LDSB1_AFC0_DTVSM0_EPS1_GSU2_LPA2_MIWT2_2_PGR1_PLR1_SU4_SUS256_SRVW0_TLDS0_WG64_4_1
    SolutionIndex: 8
    SolutionNameMin: Cijk_Alik_Bjlk_HHS_BH_SA_AH_MT128x128x16_MI32x32x16x1_SN_1LDSB1_AFC1_DTVSM1_EPS1_GSU1_LPA8_MIWT2_4_PGR1_PLR1_SU4_SUS256_SRVW0_TLDS1_WG64_2_1
    SolutionIndex: 9
    SolutionNameMin: Cijk_Alik_Bjlk_HHS_BH_SA_AH_MT128x128x16_MI32x32x16x1_SN_1LDSB1_AFC1_DTVSM0_EPS1_GSU1_LPA8_MIWT4_2_PGR2_PLR1_SU4_SUS256_SRVW0_TLDS1_WG32_4_1
    SolutionIndex: 10
    SolutionNameMin: Cijk_Alik_Bjlk_HHS_BH_SA_AH_MT128x128x16_MI32x32x16x1_SN_1LDSB1_AFC0_DTVSM1_EPS1_GSU3_LPA8_MIWT4_2_PGR2_PLR1_SU4_SUS256_SRVW0_TLDS1_WG32_4_1
    SolutionIndex: 11
    SolutionNameMin: Cijk_Alik_Bjlk_HHS_BH_SA_AH_MT32x32x32_MI32x32x16x1_SN_1LDSB0_AFC1_DTVSM0_EPS1_GSU1_LPA8_MIWT1_1_PGR2_PLR0_SU0_SUS0_SRVW0_TLDS1_WG32_2_1
    SolutionIndex: 12
    SolutionNameMin: Cijk_Alik_Bjlk_HHS_BH_SA_AH_MT32x32x32_MI32x32x16x1_SN_1LDSB0_AFC1_DTVSM0_EPS1_GSU1_LPA8_MIWT1_1_PGR2_PLR1_SU0_SUS0_SRVW0_TLDS1_WG32_2_1
    SolutionIndex: 13
    SolutionNameMin: Cijk_Alik_Bjlk_HHS_BH_SA_AH_MT32x32x32_MI32x32x16x1_SN_1LDSB0_AFC1_DTVSM0_EPS1_GSU1_LPA8_MIWT1_1_PGR1_PLR2_SU0_SUS0_SRVW0_TLDS1_WG32_2_1
    SolutionIndex: 14
    SolutionNameMin: Cijk_Alik_Bjlk_HHS_BH_SA_AH_MT32x32x32_MI32x32x16x1_SN_1LDSB0_AFC1_DTVSM0_EPS1_GSU1_LPA8_MIWT1_1_PGR2_PLR2_SU0_SUS0_SRVW0_TLDS1_WG32_2_1
    SolutionIndex: 15
    SolutionNameMin: Cijk_Alik_Bjlk_HHS_BH_SA_AH_MT32x32x32_MI32x32x16x1_SN_1LDSB0_AFC1_DTVSM1_EPS1_GSU1_LPA8_MIWT1_1_PGR1_PLR0_SU0_SUS0_SRVW0_TLDS1_WG32_2_1
    SolutionIndex: 16
    SolutionNameMin: Cijk_Alik_Bjlk_HHS_BH_SA_AH_MT32x32x32_MI32x32x16x1_SN_1LDSB0_AFC1_DTVSM1_EPS0_GSU1_LPA2_MIWT1_1_PGR0_PLR1_SU0_SUS0_SRVW0_TLDS0_WG32_2_1
    SolutionIndex: 17
    SolutionNameMin: Cijk_Alik_Bjlk_HHS_BH_SA_AH_MT32x32x32_MI32x32x16x1_SN_1LDSB0_AFC1_DTVSM1_EPS1_GSU1_LPA8_MIWT1_1_PGR1_PLR1_SU0_SUS0_SRVW0_TLDS1_WG32_2_1
    SolutionIndex: 18
    SolutionNameMin: Cijk_Alik_Bjlk_HHS_BH_SA_AH_MT32x32x32_MI32x32x16x1_SN_1LDSB0_AFC1_DTVSM1_EPS1_GSU1_LPA8_MIWT1_1_PGR2_PLR1_SU0_SUS0_SRVW0_TLDS1_WG32_2_1
    SolutionIndex: 19
    SolutionNameMin: Cijk_Alik_Bjlk_HHS_BH_SA_AH_MT32x32x32_MI32x32x16x1_SN_1LDSB0_AFC1_DTVSM1_EPS0_GSU1_LPA8_MIWT1_1_PGR0_PLR2_SU0_SUS0_SRVW0_TLDS1_WG32_2_1
    SolutionIndex: 20
    SolutionNameMin: Cijk_Alik_Bjlk_HHS_BH_SA_AH_MT32x32x32_MI32x32x16x1_SN_1LDSB0_AFC1_DTVSM1_EPS1_GSU1_LPA8_MIWT1_1_PGR1_PLR2_SU0_SUS0_SRVW0_TLDS1_WG32_2_1
    SolutionIndex: 21
    SolutionNameMin: Cijk_Alik_Bjlk_HHS_BH_SA_AH_MT32x32x32_MI32x32x16x1_SN_1LDSB0_AFC1_DTVSM1_EPS1_GSU1_LPA8_MIWT1_1_PGR2_PLR2_SU0_SUS0_SRVW0_TLDS1_WG32_2_1
    SolutionIndex: 22
    SolutionNameMin: Cijk_Alik_Bjlk_HHS_BH_SA_AH_MT32x32x32_MI32x32x16x1_SN_1LDSB0_AFC1_DTVSM0_EPS1_GSU1_LPA2_MIWT1_1_PGR2_PLR1_SU4_SUS256_SRVW0_TLDS0_WG32_2_1
    SolutionIndex: 23
    SolutionNameMin: Cijk_Alik_Bjlk_HHS_BH_SA_AH_MT32x32x32_MI32x32x16x1_SN_1LDSB0_AFC1_DTVSM1_EPS0_GSU1_LPA2_MIWT1_1_PGR0_PLR0_SU4_SUS256_SRVW0_TLDS0_WG32_2_1
    SolutionIndex: 24
    SolutionNameMin: Cijk_Alik_Bjlk_HHS_BH_SA_AH_MT32x32x32_MI32x32x16x1_SN_1LDSB0_AFC1_DTVSM1_EPS1_GSU1_LPA8_MIWT1_1_PGR2_PLR0_SU4_SUS256_SRVW0_TLDS1_WG32_2_1
    SolutionIndex: 25
    SolutionNameMin: Cijk_Alik_Bjlk_HHS_BH_SA_AH_MT32x32x32_MI32x32x16x1_SN_1LDSB0_AFC1_DTVSM1_EPS1_GSU1_LPA8_MIWT1_1_PGR2_PLR1_SU4_SUS256_SRVW0_TLDS1_WG32_2_1
    SolutionIndex: 26
    SolutionNameMin: Cijk_Alik_Bjlk_HHS_BH_SA_AH_MT32x32x32_MI32x32x16x1_SN_1LDSB0_AFC0_DTVSM1_EPS1_GSU2_LPA8_MIWT1_1_PGR1_PLR0_SU0_SUS0_SRVW0_TLDS1_WG32_2_1
    SolutionIndex: 27
    SolutionNameMin: Cijk_Alik_Bjlk_HHS_BH_SA_AH_MT128x128x32_MI32x32x16x1_SN_1LDSB0_AFC1_DTVSM0_EPS1_GSU1_LPA2_MIWT2_2_PGR1_PLR2_SU0_SUS0_SRVW0_TLDS0_WG64_4_1
    SolutionIndex: 28
    SolutionNameMin: Cijk_Alik_Bjlk_HHS_BH_SA_AH_MT128x128x32_MI32x32x16x1_SN_1LDSB0_AFC1_DTVSM1_EPS1_GSU1_LPA2_MIWT2_4_PGR1_PLR0_SU4_SUS256_SRVW0_TLDS0_WG64_2_1
    SolutionIndex: 29
    SolutionNameMin: Cijk_Alik_Bjlk_HHS_BH_SA_AH_MT256x256x32_MI32x32x16x1_SN_1LDSB0_AFC1_DTVSM1_EPS1_GSU1_LPA2_MIWT2_4_PGR1_PLR2_SU0_SUS0_SRVW0_TLDS0_WG128_4_1
    SolutionIndex: 30
    SolutionNameMin: Cijk_Alik_Bjlk_HHS_BH_SA_AH_MT128x128x32_MI32x32x16x1_SN_1LDSB1_AFC1_DTVSM0_EPS1_GSU1_LPA8_MIWT2_4_PGR2_PLR1_SU0_SUS0_SRVW0_TLDS1_WG64_2_1
    SolutionIndex: 31
    SolutionNameMin: Cijk_Alik_Bjlk_HHS_BH_SA_AH_MT128x128x32_MI32x32x16x1_SN_1LDSB1_AFC1_DTVSM1_EPS1_GSU1_LPA8_MIWT2_4_PGR1_PLR0_SU0_SUS0_SRVW0_TLDS1_WG64_2_1
    SolutionIndex: 32
    SolutionNameMin: Cijk_Alik_Bjlk_HHS_BH_SA_AH_MT256x256x32_MI32x32x16x1_SN_1LDSB1_AFC1_DTVSM1_EPS1_GSU1_LPA8_MIWT2_8_PGR1_PLR0_SU4_SUS256_SRVW0_TLDS1_WG128_2_1
    SolutionIndex: 33
    SolutionNameMin: Cijk_Alik_Bjlk_HHS_BH_SA_AH_MT32x32x64_MI32x32x16x1_SN_1LDSB0_AFC1_DTVSM0_EPS0_GSU1_LPA2_MIWT1_1_PGR0_PLR0_SU0_SUS0_SRVW0_TLDS0_WG32_2_1
    SolutionIndex: 34
    SolutionNameMin: Cijk_Alik_Bjlk_HHS_BH_SA_AH_MT32x32x64_MI32x32x16x1_SN_1LDSB0_AFC1_DTVSM0_EPS1_GSU1_LPA8_MIWT1_1_PGR1_PLR0_SU0_SUS0_SRVW0_TLDS1_WG32_2_1
    SolutionIndex: 35
    SolutionNameMin: Cijk_Alik_Bjlk_HHS_BH_SA_AH_MT32x32x64_MI32x32x16x1_SN_1LDSB0_AFC1_DTVSM0_EPS1_GSU1_LPA8_MIWT1_1_PGR2_PLR0_SU0_SUS0_SRVW0_TLDS1_WG32_2_1
    SolutionIndex: 36
    SolutionNameMin: Cijk_Alik_Bjlk_HHS_BH_SA_AH_MT32x32x64_MI32x32x16x1_SN_1LDSB0_AFC1_DTVSM0_EPS0_GSU1_LPA8_MIWT1_1_PGR0_PLR1_SU0_SUS0_SRVW0_TLDS1_WG32_2_1
    SolutionIndex: 37
    SolutionNameMin: Cijk_Alik_Bjlk_HHS_BH_SA_AH_MT32x32x64_MI32x32x16x1_SN_1LDSB0_AFC1_DTVSM0_EPS1_GSU1_LPA8_MIWT1_1_PGR2_PLR1_SU0_SUS0_SRVW0_TLDS1_WG32_2_1
    SolutionIndex: 38
    SolutionNameMin: Cijk_Alik_Bjlk_HHS_BH_SA_AH_MT32x32x64_MI32x32x16x1_SN_1LDSB0_AFC1_DTVSM1_EPS1_GSU1_LPA8_MIWT1_1_PGR1_PLR0_SU0_SUS0_SRVW0_TLDS1_WG32_2_1
    SolutionIndex: 39
    SolutionNameMin: Cijk_Alik_Bjlk_HHS_BH_SA_AH_MT32x32x64_MI32x32x16x1_SN_1LDSB0_AFC1_DTVSM1_EPS1_GSU1_LPA8_MIWT1_1_PGR2_PLR0_SU0_SUS0_SRVW0_TLDS1_WG32_2_1
    SolutionIndex: 40
    SolutionNameMin: Cijk_Alik_Bjlk_HHS_BH_SA_AH_MT32x32x64_MI32x32x16x1_SN_1LDSB0_AFC1_DTVSM1_EPS0_GSU1_LPA2_MIWT1_1_PGR0_PLR1_SU0_SUS0_SRVW0_TLDS0_WG32_2_1
    SolutionIndex: 41
    SolutionNameMin: Cijk_Alik_Bjlk_HHS_BH_SA_AH_MT32x32x64_MI32x32x16x1_SN_1LDSB0_AFC1_DTVSM1_EPS1_GSU1_LPA8_MIWT1_1_PGR2_PLR1_SU0_SUS0_SRVW0_TLDS1_WG32_2_1
    SolutionIndex: 42
    SolutionNameMin: Cijk_Alik_Bjlk_HHS_BH_SA_AH_MT32x32x64_MI32x32x16x1_SN_1LDSB0_AFC1_DTVSM0_EPS1_GSU1_LPA8_MIWT1_1_PGR2_PLR1_SU4_SUS256_SRVW0_TLDS1_WG32_2_1
    SolutionIndex: 43
    SolutionNameMin: Cijk_Alik_Bjlk_HHS_BH_SA_AH_MT32x32x64_MI32x32x16x1_SN_1LDSB0_AFC1_DTVSM1_EPS1_GSU1_LPA8_MIWT1_1_PGR1_PLR1_SU4_SUS256_SRVW0_TLDS1_WG32_2_1
    SolutionIndex: 44
    SolutionNameMin: Cijk_Alik_Bjlk_HHS_BH_SA_AH_MT32x32x64_MI32x32x16x1_SN_1LDSB0_AFC0_DTVSM1_EPS1_GSU2_LPA8_MIWT1_1_PGR2_PLR1_SU4_SUS256_SRVW0_TLDS1_WG32_2_1
    SolutionIndex: 45
    SolutionNameMin: Cijk_Alik_Bjlk_HHS_BH_SA_AH_MT128x128x64_MI32x32x16x1_SN_1LDSB0_AFC1_DTVSM0_EPS1_GSU1_LPA8_MIWT2_2_PGR2_PLR1_SU0_SUS0_SRVW0_TLDS1_WG64_4_1
    SolutionIndex: 46
    SolutionNameMin: Cijk_Alik_Bjlk_HHS_BH_SA_AH_MT128x128x64_MI32x32x16x1_SN_1LDSB0_AFC1_DTVSM1_EPS0_GSU1_LPA8_MIWT2_2_PGR0_PLR1_SU0_SUS0_SRVW0_TLDS1_WG64_4_1
    SolutionIndex: 47
    SolutionNameMin: Cijk_Alik_Bjlk_HHS_BH_SA_AH_MT128x128x64_MI32x32x16x1_SN_1LDSB0_AFC1_DTVSM1_EPS1_GSU1_LPA8_MIWT2_2_PGR1_PLR1_SU0_SUS0_SRVW0_TLDS1_WG64_4_1
    SolutionIndex: 48
    SolutionNameMin: Cijk_Alik_Bjlk_HHS_BH_SA_AH_MT128x128x64_MI32x32x16x1_SN_1LDSB0_AFC1_DTVSM1_EPS0_GSU1_LPA8_MIWT2_2_PGR0_PLR1_SU4_SUS256_SRVW0_TLDS1_WG64_4_1
    SolutionIndex: 49
    SolutionNameMin: Cijk_Alik_Bjlk_HHS_BH_SA_AH_MT128x128x64_MI32x32x16x1_SN_1LDSB0_AFC1_DTVSM1_EPS1_GSU1_LPA2_MIWT2_4_PGR1_PLR0_SU0_SUS0_SRVW0_TLDS0_WG64_2_1
    SolutionIndex: 50
    SolutionNameMin: Cijk_Alik_Bjlk_HHS_BH_SA_AH_MT256x256x64_MI32x32x16x1_SN_1LDSB0_AFC0_DTVSM0_EPS0_GSU2_LPA2_MIWT4_2_PGR0_PLR0_SU0_SUS0_SRVW0_TLDS0_WG64_8_1
    SolutionIndex: 51
    SolutionNameMin: Cijk_Alik_Bjlk_HHS_BH_SA_AH_MT32x32x16_MI32x32x16x1_SN_1LDSB0_AFC1_DTVSM1_EPS1_GSU1_LPA2_MIWT1_1_PGR1_PLR1_SU0_SUS0_SRVW8_TLDS0_WG32_2_1
    SolutionIndex: 52
    SolutionNameMin: Cijk_Alik_Bjlk_HHS_BH_SA_AH_MT32x32x16_MI32x32x16x1_SN_1LDSB0_AFC1_DTVSM0_EPS1_GSU1_LPA8_MIWT1_1_PGR1_PLR0_SU4_SUS256_SRVW8_TLDS1_WG32_2_1
    SolutionIndex: 53
    SolutionNameMin: Cijk_Alik_Bjlk_HHS_BH_SA_AH_MT32x32x16_MI32x32x16x1_SN_1LDSB0_AFC1_DTVSM1_EPS1_GSU1_LPA8_MIWT1_1_PGR2_PLR0_SU4_SUS256_SRVW8_TLDS1_WG32_2_1
    SolutionIndex: 54
    SolutionNameMin: Cijk_Alik_Bjlk_HHS_BH_SA_AH_MT32x32x16_MI32x32x16x1_SN_1LDSB0_AFC1_DTVSM1_EPS1_GSU1_LPA8_MIWT1_1_PGR2_PLR1_SU4_SUS256_SRVW8_TLDS1_WG32_2_1
    SolutionIndex: 55
    SolutionNameMin: Cijk_Alik_Bjlk_HHS_BH_SA_AH_MT128x128x16_MI32x32x16x1_SN_1LDSB0_AFC1_DTVSM0_EPS1_GSU1_LPA8_MIWT2_2_PGR1_PLR1_SU4_SUS256_SRVW8_TLDS1_WG64_4_1
    SolutionIndex: 56
    SolutionNameMin: Cijk_Alik_Bjlk_HHS_BH_SA_AH_MT128x128x16_MI32x32x16x1_SN_1LDSB0_AFC1_DTVSM0_EPS1_GSU1_LPA2_MIWT4_2_PGR2_PLR1_SU0_SUS0_SRVW8_TLDS0_WG32_4_1
    SolutionIndex: 57
    SolutionNameMin: Cijk_Alik_Bjlk_HHS_BH_SA_AH_MT128x128x16_MI32x32x16x1_SN_1LDSB0_AFC1_DTVSM1_EPS1_GSU1_LPA2_MIWT4_2_PGR2_PLR0_SU0_SUS0_SRVW8_TLDS0_WG32_4_1
    SolutionIndex: 58
    SolutionNameMin: Cijk_Alik_Bjlk_HHS_BH_SA_AH_MT128x128x16_MI32x32x16x1_SN_1LDSB0_AFC1_DTVSM0_EPS1_GSU1_LPA8_MIWT4_2_PGR2_PLR1_SU4_SUS256_SRVW8_TLDS1_WG32_4_1
    SolutionIndex: 59
    SolutionNameMin: Cijk_Alik_Bjlk_HHS_BH_SA_AH_MT128x128x16_MI32x32x16x1_SN_1LDSB1_AFC1_DTVSM0_EPS1_GSU1_LPA2_MIWT2_2_PGR1_PLR1_SU0_SUS0_SRVW8_TLDS0_WG64_4_1
    SolutionIndex: 60
    SolutionNameMin: Cijk_Alik_Bjlk_HHS_BH_SA_AH_MT128x128x16_MI32x32x16x1_SN_1LDSB1_AFC1_DTVSM1_EPS1_GSU1_LPA8_MIWT2_2_PGR2_PLR1_SU0_SUS0_SRVW8_TLDS1_WG64_4_1
    SolutionIndex: 61
    SolutionNameMin: Cijk_Alik_Bjlk_HHS_BH_SA_AH_MT32x32x32_MI32x32x16x1_SN_1LDSB0_AFC1_DTVSM0_EPS1_GSU1_LPA8_MIWT1_1_PGR2_PLR0_SU0_SUS0_SRVW8_TLDS1_WG32_2_1
    SolutionIndex: 62
    SolutionNameMin: Cijk_Alik_Bjlk_HHS_BH_SA_AH_MT32x32x32_MI32x32x16x1_SN_1LDSB0_AFC1_DTVSM1_EPS0_GSU1_LPA8_MIWT1_1_PGR0_PLR1_SU0_SUS0_SRVW8_TLDS1_WG32_2_1
    SolutionIndex: 63
    SolutionNameMin: Cijk_Alik_Bjlk_HHS_BH_SA_AH_MT32x32x32_MI32x32x16x1_SN_1LDSB0_AFC1_DTVSM1_EPS1_GSU1_LPA8_MIWT1_1_PGR1_PLR2_SU0_SUS0_SRVW8_TLDS1_WG32_2_1
    SolutionIndex: 64
    SolutionNameMin: Cijk_Alik_Bjlk_HHS_BH_SA_AH_MT128x128x32_MI32x32x16x1_SN_1LDSB0_AFC1_DTVSM0_EPS1_GSU1_LPA2_MIWT2_2_PGR1_PLR2_SU4_SUS256_SRVW8_TLDS0_WG64_4_1
    SolutionIndex: 65
    SolutionNameMin: Cijk_Alik_Bjlk_HHS_BH_SA_AH_MT128x128x32_MI32x32x16x1_SN_1LDSB0_AFC1_DTVSM1_EPS1_GSU1_LPA8_MIWT2_2_PGR1_PLR1_SU4_SUS256_SRVW8_TLDS1_WG64_4_1
    SolutionIndex: 66
    SolutionNameMin: Cijk_Alik_Bjlk_HHS_BH_SA_AH_MT128x128x32_MI32x32x16x1_SN_1LDSB0_AFC1_DTVSM1_EPS0_GSU1_LPA2_MIWT4_2_PGR0_PLR2_SU4_SUS256_SRVW8_TLDS0_WG32_4_1
    SolutionIndex: 67
    SolutionNameMin: Cijk_Alik_Bjlk_HHS_BH_SA_AH_MT128x128x32_MI32x32x16x1_SN_1LDSB1_AFC1_DTVSM0_EPS1_GSU1_LPA2_MIWT4_2_PGR2_PLR2_SU4_SUS256_SRVW8_TLDS0_WG32_4_1
    SolutionIndex: 68
    SolutionNameMin: Cijk_Alik_Bjlk_HHS_BH_SA_AH_MT128x128x64_MI32x32x16x1_SN_1LDSB0_AFC1_DTVSM0_EPS0_GSU1_LPA8_MIWT2_2_PGR0_PLR0_SU4_SUS256_SRVW8_TLDS1_WG64_4_1
    SolutionIndex: 69
    SolutionNameMin: Cijk_Alik_Bjlk_HHS_BH_SA_AH_MT128x128x64_MI32x32x16x1_SN_1LDSB0_AFC1_DTVSM0_EPS1_GSU1_LPA8_MIWT2_4_PGR2_PLR0_SU0_SUS0_SRVW8_TLDS1_WG64_2_1
- - - [15, 15, 1, 16, 15, 15, 16, 15]
    - [0, 0.531758]
  - - [15, 15, 1, 32, 15, 15, 32, 15]
    - [17, 1.00125]
  - - [15, 15, 1, 64, 15, 15, 64, 15]
    - [1, 1.99143]
  - - [15, 15, 1, 96, 15, 15, 96, 15]
    - [19, 2.78638]
  - - [15, 15, 1, 128, 15, 15, 128, 15]
    - [40, 3.64004]
  - - [15, 15, 1, 136, 15, 15, 136, 15]
    - [1, 3.65482]
  - - [15, 15, 1, 256, 15, 15, 256, 15]
    - [36, 6.5059]
  - - [15, 15, 1, 264, 15, 15, 264, 15]
    - [20, 6.21664]
  - - [15, 15, 1, 528, 15, 15, 528, 15]
    - [41, 10.61]
  - - [15, 15, 1, 544, 15, 15, 544, 15]
    - [11, 11.9578]
  - - [15, 15, 1, 576, 15, 15, 576, 15]
    - [37, 12.2542]
  - - [15, 15, 1, 608, 15, 15, 608, 15]
    - [14, 12.5315]
  - - [15, 15, 1, 640, 15, 15, 640, 15]
    - [42, 13.3879]
  - - [15, 15, 1, 768, 15, 15, 768, 15]
    - [35, 15.4596]
  - - [15, 15, 1, 776, 15, 15, 776, 15]
    - [37, 14.7242]
  - - [32, 32, 1, 16, 32, 32, 16, 32]
    - [3, 2.84989]
  - - [32, 32, 1, 32, 32, 32, 32, 32]
    - [16, 5.84256]
  - - [32, 32, 1, 64, 32, 32, 64, 32]
    - [20, 11.0909]
  - - [32, 32, 1, 96, 32, 32, 96, 32]
    - [15, 16.1432]
  - - [32, 32, 1, 128, 32, 32, 128, 32]
    - [13, 20.4496]
  - - [32, 32, 1, 136, 32, 32, 136, 32]
    - [15, 20.7531]
  - - [32, 32, 1, 256, 32, 32, 256, 32]
    - [13, 35.7583]
  - - [32, 32, 1, 264, 32, 32, 264, 32]
    - [15, 33.9107]
  - - [32, 32, 1, 528, 32, 32, 528, 32]
    - [38, 58.2998]
  - - [32, 32, 1, 544, 32, 32, 544, 32]
    - [18, 59.5495]
  - - [32, 32, 1, 576, 32, 32, 576, 32]
    - [34, 67.3815]
  - - [32, 32, 1, 608, 32, 32, 608, 32]
    - [12, 66.5553]
  - - [32, 32, 1, 640, 32, 32, 640, 32]
    - [42, 69.1709]
  - - [32, 32, 1, 768, 32, 32, 768, 32]
    - [14, 81.6267]
  - - [32, 32, 1, 776, 32, 32, 776, 32]
    - [18, 75.9969]
  - - [256, 256, 1, 16, 256, 256, 16, 256]
    - [66, 69.1536]
  - - [256, 256, 1, 24, 256, 256, 24, 256]
    - [28, 69.5511]
  - - [256, 256, 1, 32, 256, 256, 32, 256]
    - [60, 181.132]
  - - [256, 256, 1, 64, 256, 256, 64, 256]
    - [4, 603.454]
  - - [256, 256, 1, 96, 256, 256, 96, 256]
    - [69, 340.659]
  - - [256, 256, 1, 128, 256, 256, 128, 256]
    - [64, 649.273]
  - - [256, 256, 1, 136, 256, 256, 136, 256]
    - [47, 384.915]
  - - [256, 256, 1, 256, 256, 256, 256, 256]
    - [31, 691.644]
  - - [256, 256, 1, 264, 256, 256, 264, 256]
    - [6, 702.813]
  - - [256, 256, 1, 280, 256, 256, 280, 256]
    - [9, 712.362]
  - - [256, 256, 1, 296, 256, 256, 296, 256]
    - [55, 1056.11]
  - - [256, 256, 1, 528, 256, 256, 528, 256]
    - [45, 1271.16]
  - - [256, 256, 1, 544, 256, 256, 544, 256]
    - [52, 2768.09]
  - - [256, 256, 1, 576, 256, 256, 576, 256]
    - [39, 3761.52]
  - - [256, 256, 1, 608, 256, 256, 608, 256]
    - [51, 2736.29]
  - - [256, 256, 1, 640, 256, 256, 640, 256]
    - [48, 1327.79]
  - - [256, 256, 1, 768, 256, 256, 768, 256]
    - [61, 4850.78]
  - - [256, 256, 1, 776, 256, 256, 776, 256]
    - [30, 1589.82]
  - - [256, 256, 1, 792, 256, 256, 792, 256]
    - [26, 2046.79]
  - - [256, 256, 1, 808, 256, 256, 808, 256]
    - [10, 1325.8]
  - - [255, 255, 1, 16, 255, 255, 16, 255]
    - [59, 51.0225]
  - - [255, 255, 1, 32, 255, 255, 32, 255]
    - [8, 49.3964]
  - - [255, 255, 1, 64, 255, 255, 64, 255]
    - [32, 39.7632]
  - - [255, 255, 1, 96, 255, 255, 96, 255]
    - [29, 61.1305]
  - - [255, 255, 1, 128, 255, 255, 128, 255]
    - [27, 241.022]
  - - [255, 255, 1, 136, 255, 255, 136, 255]
    - [65, 370.691]
  - - [255, 255, 1, 256, 255, 255, 256, 255]
    - [67, 419.934]
  - - [255, 255, 1, 264, 255, 255, 264, 255]
    - [11, 1500.97]
  - - [255, 255, 1, 528, 255, 255, 528, 255]
    - [57, 792.805]
  - - [255, 255, 1, 544, 255, 255, 544, 255]
    - [23, 1313.95]
  - - [255, 255, 1, 576, 255, 255, 576, 255]
    - [54, 2799.18]
  - - [255, 255, 1, 608, 255, 255, 608, 255]
    - [58, 907.885]
  - - [255, 255, 1, 640, 255, 255, 640, 255]
    - [56, 934.603]
  - - [255, 255, 1, 768, 255, 255, 768, 255]
    - [7, 953.402]
  - - [255, 255, 1, 776, 255, 255, 776, 255]
    - [5, 2554.84]
  - - [264, 264, 1, 16, 264, 264, 16, 264]
    - [63, 130.38]
  - - [264, 264, 1, 32, 264, 264, 32, 264]
    - [24, 293.785]
  - - [264, 264, 1, 64, 264, 264, 64, 264]
    - [68, 221.802]
  - - [264, 264, 1, 96, 264, 264, 96, 264]
    - [33, 737.402]
  - - [264, 264, 1, 128, 264, 264, 128, 264]
    - [2, 1078.34]
  - - [264, 264, 1, 136, 264, 264, 136, 264]
    - [46, 576.385]
  - - [264, 264, 1, 256, 264, 264, 256, 264]
    - [22, 1729.56]
  - - [264, 264, 1, 264, 264, 264, 264, 264]
    - [53, 1625.78]
  - - [264, 264, 1, 528, 264, 264, 528, 264]
    - [43, 3151.18]
  - - [264, 264, 1, 544, 264, 264, 544, 264]
    - [49, 1022.05]
  - - [264, 264, 1, 576, 264, 264, 576, 264]
    - [50, 1076.93]
  - - [264, 264, 1, 608, 264, 264, 608, 264]
    - [44, 2012.88]
  - - [264, 264, 1, 640, 264, 264, 640, 264]
    - [62, 3080.06]
  - - [264, 264, 1, 768, 264, 264, 768, 264]
    - [21, 4647.61]
  - - [264, 264, 1, 776, 264, 264, 776, 264]
    - [25, 4347.95]
- null
- null
- DeviceEfficiency
