library/src/hcc_detail/rocsparselt/src/spmm/Tensile/Logic/aquavanjaram/aquavanjaram_Cijk_Alik_Bjlk_BBS_BH_SA_AH.yaml
- {MinimumRequiredVersion: 4.33.0}
- aquavanjaram
- gfx940
- [Device 0049, Device 0050]
    SolutionIndex: 0
    SolutionNameMin: Cijk_Alik_Bjlk_BBS_BH_SA_AH_MT32x32x16_MI32x32x16x1_SN_1LDSB0_GRVW4_LPA8_MIWT1_1_PGR2_PLR1_SU8_TLDS0_VW8_WG32_2_1_WGM12
    SolutionIndex: 1
    SolutionNameMin: Cijk_Alik_Bjlk_BBS_BH_SA_AH_MT32x32x16_MI32x32x16x1_SN_1LDSB0_GRVW4_LPA4_MIWT1_1_PGR2_PLR1_SU8_TLDS1_VW8_WG32_2_1_WGM18
    SolutionIndex: 2
    SolutionNameMin: Cijk_Alik_Bjlk_BBS_BH_SA_AH_MT32x32x16_MI32x32x16x1_SN_1LDSB0_GRVW8_LPA8_MIWT1_1_PGR1_PLR1_SU4_TLDS1_VW8_WG32_2_1_WGM19
    SolutionIndex: 3
    SolutionNameMin: Cijk_Alik_Bjlk_BBS_BH_SA_AH_MT32x32x16_MI32x32x16x1_SN_1LDSB0_GRVW8_LPA8_MIWT1_1_PGR2_PLR1_SU4_TLDS1_VW4_WG32_2_1_WGM19
    SolutionIndex: 4
    SolutionNameMin: Cijk_Alik_Bjlk_BBS_BH_SA_AH_MT32x32x16_MI32x32x16x1_SN_1LDSB0_GRVW8_LPA8_MIWT1_1_PGR2_PLR1_SU4_TLDS1_VW8_WG32_2_1_WGM19
    SolutionIndex: 5
    SolutionNameMin: Cijk_Alik_Bjlk_BBS_BH_SA_AH_MT32x32x16_MI32x32x16x1_SN_1LDSB0_GRVW8_LPA8_MIWT1_1_PGR1_PLR1_SU8_TLDS1_VW8_WG32_2_1_WGM19
    SolutionIndex: 6
    SolutionNameMin: Cijk_Alik_Bjlk_BBS_BH_SA_AH_MT32x32x16_MI32x32x16x1_SN_1LDSB0_GRVW4_LPA4_MIWT1_1_PGR2_PLR1_SU8_TLDS1_VW8_WG32_2_1_WGM19
    SolutionIndex: 7
    SolutionNameMin: Cijk_Alik_Bjlk_BBS_BH_SA_AH_MT32x32x16_MI32x32x16x1_SN_1LDSB0_GRVW8_LPA8_MIWT1_1_PGR2_PLR1_SU8_TLDS1_VW4_WG32_2_1_WGM19
    SolutionIndex: 8
    SolutionNameMin: Cijk_Alik_Bjlk_BBS_BH_SA_AH_MT32x32x16_MI32x32x16x1_SN_1LDSB0_GRVW8_LPA8_MIWT1_1_PGR2_PLR1_SU8_TLDS1_VW8_WG32_2_1_WGM19
    SolutionIndex: 9
    SolutionNameMin: Cijk_Alik_Bjlk_BBS_BH_SA_AH_MT128x128x16_MI32x32x16x1_SN_1LDSB0_GRVW8_LPA8_MIWT2_2_PGR2_PLR1_SU8_TLDS1_VW4_WG64_4_1_WGM19
    SolutionIndex: 10
    SolutionNameMin: Cijk_Alik_Bjlk_BBS_BH_SA_AH_MT128x128x16_MI32x32x16x1_SN_1LDSB0_GRVW8_LPA8_MIWT2_4_PGR2_PLR1_SU4_TLDS1_VW8_WG64_2_1_WGM19
    SolutionIndex: 11
    SolutionNameMin: Cijk_Alik_Bjlk_BBS_BH_SA_AH_MT128x128x16_MI32x32x16x1_SN_1LDSB1_GRVW4_LPA4_MIWT2_2_PGR2_PLR1_SU8_TLDS1_VW8_WG64_4_1_WGM12
    SolutionIndex: 12
    SolutionNameMin: Cijk_Alik_Bjlk_BBS_BH_SA_AH_MT128x128x16_MI32x32x16x1_SN_1LDSB1_GRVW4_LPA8_MIWT2_2_PGR1_PLR1_SU4_TLDS0_VW8_WG64_4_1_WGM19
    SolutionIndex: 13
    SolutionNameMin: Cijk_Alik_Bjlk_BBS_BH_SA_AH_MT32x32x32_MI32x32x16x1_SN_1LDSB0_GRVW4_LPA4_MIWT1_1_PGR1_PLR1_SU4_TLDS1_VW4_WG32_2_1_WGM12
    SolutionIndex: 14
    SolutionNameMin: Cijk_Alik_Bjlk_BBS_BH_SA_AH_MT32x32x32_MI32x32x16x1_SN_1LDSB0_GRVW8_LPA8_MIWT1_1_PGR1_PLR3_SU4_TLDS1_VW4_WG32_2_1_WGM12
    SolutionIndex: 15
    SolutionNameMin: Cijk_Alik_Bjlk_BBS_BH_SA_AH_MT32x32x32_MI32x32x16x1_SN_1LDSB0_GRVW8_LPA8_MIWT1_1_PGR2_PLR3_SU4_TLDS0_VW8_WG32_2_1_WGM12
    SolutionIndex: 16
    SolutionNameMin: Cijk_Alik_Bjlk_BBS_BH_SA_AH_MT32x32x32_MI32x32x16x1_SN_1LDSB0_GRVW8_LPA8_MIWT1_1_PGR2_PLR3_SU4_TLDS1_VW8_WG32_2_1_WGM12
    SolutionIndex: 17
    SolutionNameMin: Cijk_Alik_Bjlk_BBS_BH_SA_AH_MT32x32x32_MI32x32x16x1_SN_1LDSB0_GRVW4_LPA4_MIWT1_1_PGR2_PLR3_SU8_TLDS1_VW4_WG32_2_1_WGM12
    SolutionIndex: 18
    SolutionNameMin: Cijk_Alik_Bjlk_BBS_BH_SA_AH_MT32x32x32_MI32x32x16x1_SN_1LDSB0_GRVW8_LPA8_MIWT1_1_PGR2_PLR3_SU4_TLDS1_VW8_WG32_2_1_WGM18
    SolutionIndex: 19
    SolutionNameMin: Cijk_Alik_Bjlk_BBS_BH_SA_AH_MT32x32x32_MI32x32x16x1_SN_1LDSB0_GRVW8_LPA8_MIWT1_1_PGR2_PLR1_SU8_TLDS1_VW4_WG32_2_1_WGM18
    SolutionIndex: 20
    SolutionNameMin: Cijk_Alik_Bjlk_BBS_BH_SA_AH_MT32x32x32_MI32x32x16x1_SN_1LDSB0_GRVW8_LPA8_MIWT1_1_PGR2_PLR1_SU8_TLDS1_VW8_WG32_2_1_WGM18
    SolutionIndex: 21
    SolutionNameMin: Cijk_Alik_Bjlk_BBS_BH_SA_AH_MT32x32x32_MI32x32x16x1_SN_1LDSB0_GRVW8_LPA8_MIWT1_1_PGR1_PLR3_SU8_TLDS1_VW8_WG32_2_1_WGM18
    SolutionIndex: 22
    SolutionNameMin: Cijk_Alik_Bjlk_BBS_BH_SA_AH_MT32x32x32_MI32x32x16x1_SN_1LDSB0_GRVW8_LPA8_MIWT1_1_PGR1_PLR1_SU4_TLDS1_VW8_WG32_2_1_WGM19
    SolutionIndex: 23
    SolutionNameMin: Cijk_Alik_Bjlk_BBS_BH_SA_AH_MT32x32x32_MI32x32x16x1_SN_1LDSB0_GRVW8_LPA4_MIWT1_1_PGR2_PLR1_SU4_TLDS0_VW4_WG32_2_1_WGM19
    SolutionIndex: 24
    SolutionNameMin: Cijk_Alik_Bjlk_BBS_BH_SA_AH_MT32x32x32_MI32x32x16x1_SN_1LDSB0_GRVW8_LPA8_MIWT1_1_PGR2_PLR1_SU4_TLDS1_VW8_WG32_2_1_WGM19
    SolutionIndex: 25
    SolutionNameMin: Cijk_Alik_Bjlk_BBS_BH_SA_AH_MT32x32x32_MI32x32x16x1_SN_1LDSB0_GRVW8_LPA8_MIWT1_1_PGR1_PLR3_SU4_TLDS1_VW8_WG32_2_1_WGM19
    SolutionIndex: 26
    SolutionNameMin: Cijk_Alik_Bjlk_BBS_BH_SA_AH_MT32x32x32_MI32x32x16x1_SN_1LDSB0_GRVW8_LPA8_MIWT1_1_PGR2_PLR3_SU4_TLDS1_VW4_WG32_2_1_WGM19
    SolutionIndex: 27
    SolutionNameMin: Cijk_Alik_Bjlk_BBS_BH_SA_AH_MT32x32x32_MI32x32x16x1_SN_1LDSB0_GRVW8_LPA8_MIWT1_1_PGR2_PLR3_SU4_TLDS0_VW8_WG32_2_1_WGM19
    SolutionIndex: 28
    SolutionNameMin: Cijk_Alik_Bjlk_BBS_BH_SA_AH_MT32x32x32_MI32x32x16x1_SN_1LDSB0_GRVW8_LPA8_MIWT1_1_PGR2_PLR3_SU4_TLDS1_VW8_WG32_2_1_WGM19
    SolutionIndex: 29
    SolutionNameMin: Cijk_Alik_Bjlk_BBS_BH_SA_AH_MT32x32x32_MI32x32x16x1_SN_1LDSB0_GRVW8_LPA8_MIWT1_1_PGR2_PLR1_SU8_TLDS1_VW4_WG32_2_1_WGM19
    SolutionIndex: 30
    SolutionNameMin: Cijk_Alik_Bjlk_BBS_BH_SA_AH_MT32x32x32_MI32x32x16x1_SN_1LDSB0_GRVW8_LPA8_MIWT1_1_PGR2_PLR1_SU8_TLDS1_VW8_WG32_2_1_WGM19
    SolutionIndex: 31
    SolutionNameMin: Cijk_Alik_Bjlk_BBS_BH_SA_AH_MT32x32x32_MI32x32x16x1_SN_1LDSB0_GRVW8_LPA8_MIWT1_1_PGR2_PLR3_SU8_TLDS1_VW8_WG32_2_1_WGM19
    SolutionIndex: 32
    SolutionNameMin: Cijk_Alik_Bjlk_BBS_BH_SA_AH_MT128x128x32_MI32x32x16x1_SN_1LDSB0_GRVW8_LPA8_MIWT2_2_PGR2_PLR1_SU8_TLDS1_VW4_WG64_4_1_WGM19
    SolutionIndex: 33
    SolutionNameMin: Cijk_Alik_Bjlk_BBS_BH_SA_AH_MT128x128x32_MI32x32x16x1_SN_1LDSB0_GRVW8_LPA4_MIWT2_2_PGR2_PLR3_SU8_TLDS0_VW4_WG64_4_1_WGM19
    SolutionIndex: 34
    SolutionNameMin: Cijk_Alik_Bjlk_BBS_BH_SA_AH_MT128x128x32_MI32x32x16x1_SN_1LDSB0_GRVW4_LPA4_MIWT2_4_PGR1_PLR3_SU8_TLDS0_VW4_WG64_2_1_WGM12
    SolutionIndex: 35
    SolutionNameMin: Cijk_Alik_Bjlk_BBS_BH_SA_AH_MT128x128x32_MI32x32x16x1_SN_1LDSB0_GRVW8_LPA4_MIWT4_2_PGR2_PLR3_SU4_TLDS0_VW4_WG32_4_1_WGM12
    SolutionIndex: 36
    SolutionNameMin: Cijk_Alik_Bjlk_BBS_BH_SA_AH_MT256x256x32_MI32x32x16x1_SN_1LDSB0_GRVW8_LPA8_MIWT2_8_PGR2_PLR1_SU4_TLDS1_VW4_WG128_2_1_WGM18
    SolutionIndex: 37
    SolutionNameMin: Cijk_Alik_Bjlk_BBS_BH_SA_AH_MT256x256x32_MI32x32x16x1_SN_1LDSB0_GRVW8_LPA8_MIWT2_4_PGR1_PLR3_SU8_TLDS1_VW4_WG128_4_1_WGM19
    SolutionIndex: 38
    SolutionNameMin: Cijk_Alik_Bjlk_BBS_BH_SA_AH_MT32x32x64_MI32x32x16x1_SN_1LDSB0_GRVW4_LPA4_MIWT1_1_PGR1_PLR1_SU4_TLDS1_VW4_WG32_2_1_WGM12
    SolutionIndex: 39
    SolutionNameMin: Cijk_Alik_Bjlk_BBS_BH_SA_AH_MT32x32x64_MI32x32x16x1_SN_1LDSB0_GRVW8_LPA8_MIWT1_1_PGR1_PLR1_SU4_TLDS1_VW4_WG32_2_1_WGM12
    SolutionIndex: 40
    SolutionNameMin: Cijk_Alik_Bjlk_BBS_BH_SA_AH_MT32x32x64_MI32x32x16x1_SN_1LDSB0_GRVW8_LPA8_MIWT1_1_PGR1_PLR1_SU4_TLDS1_VW8_WG32_2_1_WGM12
    SolutionIndex: 41
    SolutionNameMin: Cijk_Alik_Bjlk_BBS_BH_SA_AH_MT32x32x64_MI32x32x16x1_SN_1LDSB0_GRVW8_LPA8_MIWT1_1_PGR1_PLR5_SU4_TLDS1_VW4_WG32_2_1_WGM12
    SolutionIndex: 42
    SolutionNameMin: Cijk_Alik_Bjlk_BBS_BH_SA_AH_MT32x32x64_MI32x32x16x1_SN_1LDSB0_GRVW8_LPA8_MIWT1_1_PGR2_PLR5_SU4_TLDS1_VW4_WG32_2_1_WGM12
    SolutionIndex: 43
    SolutionNameMin: Cijk_Alik_Bjlk_BBS_BH_SA_AH_MT32x32x64_MI32x32x16x1_SN_1LDSB0_GRVW8_LPA8_MIWT1_1_PGR1_PLR1_SU8_TLDS0_VW8_WG32_2_1_WGM12
    SolutionIndex: 44
    SolutionNameMin: Cijk_Alik_Bjlk_BBS_BH_SA_AH_MT32x32x64_MI32x32x16x1_SN_1LDSB0_GRVW8_LPA8_MIWT1_1_PGR1_PLR1_SU4_TLDS1_VW8_WG32_2_1_WGM18
    SolutionIndex: 45
    SolutionNameMin: Cijk_Alik_Bjlk_BBS_BH_SA_AH_MT32x32x64_MI32x32x16x1_SN_1LDSB0_GRVW8_LPA8_MIWT1_1_PGR2_PLR1_SU4_TLDS1_VW4_WG32_2_1_WGM18
    SolutionIndex: 46
    SolutionNameMin: Cijk_Alik_Bjlk_BBS_BH_SA_AH_MT32x32x64_MI32x32x16x1_SN_1LDSB0_GRVW8_LPA8_MIWT1_1_PGR1_PLR5_SU4_TLDS1_VW8_WG32_2_1_WGM18
    SolutionIndex: 47
    SolutionNameMin: Cijk_Alik_Bjlk_BBS_BH_SA_AH_MT32x32x64_MI32x32x16x1_SN_1LDSB0_GRVW8_LPA8_MIWT1_1_PGR2_PLR5_SU8_TLDS1_VW8_WG32_2_1_WGM18
    SolutionIndex: 48
    SolutionNameMin: Cijk_Alik_Bjlk_BBS_BH_SA_AH_MT32x32x64_MI32x32x16x1_SN_1LDSB0_GRVW8_LPA8_MIWT1_1_PGR1_PLR1_SU4_TLDS1_VW4_WG32_2_1_WGM19
    SolutionIndex: 49
    SolutionNameMin: Cijk_Alik_Bjlk_BBS_BH_SA_AH_MT32x32x64_MI32x32x16x1_SN_1LDSB0_GRVW8_LPA8_MIWT1_1_PGR1_PLR5_SU4_TLDS1_VW4_WG32_2_1_WGM19
    SolutionIndex: 50
    SolutionNameMin: Cijk_Alik_Bjlk_BBS_BH_SA_AH_MT32x32x64_MI32x32x16x1_SN_1LDSB0_GRVW8_LPA8_MIWT1_1_PGR2_PLR5_SU4_TLDS1_VW4_WG32_2_1_WGM19
    SolutionIndex: 51
    SolutionNameMin: Cijk_Alik_Bjlk_BBS_BH_SA_AH_MT32x32x64_MI32x32x16x1_SN_1LDSB0_GRVW8_LPA8_MIWT1_1_PGR2_PLR1_SU8_TLDS1_VW4_WG32_2_1_WGM19
    SolutionIndex: 52
    SolutionNameMin: Cijk_Alik_Bjlk_BBS_BH_SA_AH_MT32x32x64_MI32x32x16x1_SN_1LDSB0_GRVW8_LPA8_MIWT1_1_PGR1_PLR5_SU8_TLDS1_VW8_WG32_2_1_WGM19
    SolutionIndex: 53
    SolutionNameMin: Cijk_Alik_Bjlk_BBS_BH_SA_AH_MT32x32x64_MI32x32x16x1_SN_1LDSB0_GRVW8_LPA8_MIWT1_1_PGR2_PLR5_SU8_TLDS1_VW4_WG32_2_1_WGM19
    SolutionIndex: 54
    SolutionNameMin: Cijk_Alik_Bjlk_BBS_BH_SA_AH_MT128x128x64_MI32x32x16x1_SN_1LDSB0_GRVW8_LPA8_MIWT2_2_PGR1_PLR5_SU4_TLDS0_VW8_WG64_4_1_WGM18
    SolutionIndex: 55
    SolutionNameMin: Cijk_Alik_Bjlk_BBS_BH_SA_AH_MT128x128x64_MI32x32x16x1_SN_1LDSB0_GRVW8_LPA8_MIWT2_2_PGR2_PLR1_SU8_TLDS1_VW4_WG64_4_1_WGM18
    SolutionIndex: 56
    SolutionNameMin: Cijk_Alik_Bjlk_BBS_BH_SA_AH_MT128x128x64_MI32x32x16x1_SN_1LDSB0_GRVW4_LPA4_MIWT2_2_PGR1_PLR1_SU4_TLDS1_VW4_WG64_4_1_WGM19
- - - [15, 15, 1, 16, 15, 15, 16, 15]
    - [0, 0.0]
  - - [15, 15, 1, 32, 15, 15, 32, 15]
    - [29, 0.0]
  - - [15, 15, 1, 64, 15, 15, 64, 15]
    - [48, 0.0]
  - - [15, 15, 1, 96, 15, 15, 96, 15]
    - [22, 0.0]
  - - [15, 15, 1, 128, 15, 15, 128, 15]
    - [46, 0.0]
  - - [15, 15, 1, 136, 15, 15, 136, 15]
    - [48, 0.0]
  - - [15, 15, 1, 256, 15, 15, 256, 15]
    - [26, 0.0]
  - - [15, 15, 1, 264, 15, 15, 264, 15]
    - [26, 0.0]
  - - [15, 15, 1, 528, 15, 15, 528, 15]
    - [45, 0.001]
  - - [15, 15, 1, 544, 15, 15, 544, 15]
    - [24, 0.001]
  - - [15, 15, 1, 576, 15, 15, 576, 15]
    - [42, 0.001]
  - - [15, 15, 1, 608, 15, 15, 608, 15]
    - [24, 0.001]
  - - [15, 15, 1, 640, 15, 15, 640, 15]
    - [42, 0.001]
  - - [15, 15, 1, 768, 15, 15, 768, 15]
    - [47, 0.001]
  - - [15, 15, 1, 776, 15, 15, 776, 15]
    - [45, 0.001]
  - - [32, 32, 1, 16, 32, 32, 16, 32]
    - [6, 0.0]
  - - [32, 32, 1, 32, 32, 32, 32, 32]
    - [23, 0.0]
  - - [32, 32, 1, 64, 32, 32, 64, 32]
    - [40, 0.001]
  - - [32, 32, 1, 96, 32, 32, 96, 32]
    - [21, 0.001]
  - - [32, 32, 1, 128, 32, 32, 128, 32]
    - [21, 0.001]
  - - [32, 32, 1, 136, 32, 32, 136, 32]
    - [25, 0.001]
  - - [32, 32, 1, 256, 32, 32, 256, 32]
    - [26, 0.002]
  - - [32, 32, 1, 264, 32, 32, 264, 32]
    - [26, 0.002]
  - - [32, 32, 1, 528, 32, 32, 528, 32]
    - [45, 0.004]
  - - [32, 32, 1, 544, 32, 32, 544, 32]
    - [31, 0.004]
  - - [32, 32, 1, 576, 32, 32, 576, 32]
    - [42, 0.005]
  - - [32, 32, 1, 608, 32, 32, 608, 32]
    - [26, 0.005]
  - - [32, 32, 1, 640, 32, 32, 640, 32]
    - [42, 0.005]
  - - [32, 32, 1, 768, 32, 32, 768, 32]
    - [42, 0.006]
  - - [32, 32, 1, 776, 32, 32, 776, 32]
    - [42, 0.005]
  - - [256, 256, 1, 16, 256, 256, 16, 256]
    - [5, 0.013]
  - - [256, 256, 1, 24, 256, 256, 24, 256]
    - [56, 0.008]
  - - [256, 256, 1, 32, 256, 256, 32, 256]
    - [43, 0.022]
  - - [256, 256, 1, 64, 256, 256, 64, 256]
    - [16, 0.044]
  - - [256, 256, 1, 96, 256, 256, 96, 256]
    - [37, 0.024]
  - - [256, 256, 1, 128, 256, 256, 128, 256]
    - [25, 0.091]
  - - [256, 256, 1, 136, 256, 256, 136, 256]
    - [4, 0.085]
  - - [256, 256, 1, 256, 256, 256, 256, 256]
    - [44, 0.153]
  - - [256, 256, 1, 264, 256, 256, 264, 256]
    - [12, 0.067]
  - - [256, 256, 1, 280, 256, 256, 280, 256]
    - [38, 0.137]
  - - [256, 256, 1, 296, 256, 256, 296, 256]
    - [9, 0.087]
  - - [256, 256, 1, 528, 256, 256, 528, 256]
    - [34, 0.081]
  - - [256, 256, 1, 544, 256, 256, 544, 256]
    - [27, 0.26]
  - - [256, 256, 1, 576, 256, 256, 576, 256]
    - [51, 0.285]
  - - [256, 256, 1, 608, 256, 256, 608, 256]
    - [32, 0.162]
  - - [256, 256, 1, 640, 256, 256, 640, 256]
    - [30, 0.316]
  - - [256, 256, 1, 768, 256, 256, 768, 256]
    - [33, 0.159]
  - - [256, 256, 1, 776, 256, 256, 776, 256]
    - [55, 0.16]
  - - [256, 256, 1, 792, 256, 256, 792, 256]
    - [14, 0.293]
  - - [256, 256, 1, 808, 256, 256, 808, 256]
    - [29, 0.349]
  - - [255, 255, 1, 16, 255, 255, 16, 255]
    - [2, 0.008]
  - - [255, 255, 1, 32, 255, 255, 32, 255]
    - [18, 0.018]
  - - [255, 255, 1, 64, 255, 255, 64, 255]
    - [49, 0.035]
  - - [255, 255, 1, 96, 255, 255, 96, 255]
    - [53, 0.047]
  - - [255, 255, 1, 128, 255, 255, 128, 255]
    - [7, 0.06]
  - - [255, 255, 1, 136, 255, 255, 136, 255]
    - [39, 0.064]
  - - [255, 255, 1, 256, 255, 255, 256, 255]
    - [11, 0.049]
  - - [255, 255, 1, 264, 255, 255, 264, 255]
    - [30, 0.116]
  - - [255, 255, 1, 528, 255, 255, 528, 255]
    - [19, 0.209]
  - - [255, 255, 1, 544, 255, 255, 544, 255]
    - [1, 0.193]
  - - [255, 255, 1, 576, 255, 255, 576, 255]
    - [54, 0.089]
  - - [255, 255, 1, 608, 255, 255, 608, 255]
    - [52, 0.212]
  - - [255, 255, 1, 640, 255, 255, 640, 255]
    - [8, 0.221]
  - - [255, 255, 1, 768, 255, 255, 768, 255]
    - [17, 0.257]
  - - [255, 255, 1, 776, 255, 255, 776, 255]
    - [15, 0.254]
  - - [264, 264, 1, 16, 264, 264, 16, 264]
    - [36, 0.001]
  - - [264, 264, 1, 32, 264, 264, 32, 264]
    - [35, 0.005]
  - - [264, 264, 1, 64, 264, 264, 64, 264]
    - [13, 0.034]
  - - [264, 264, 1, 96, 264, 264, 96, 264]
    - [30, 0.054]
  - - [264, 264, 1, 128, 264, 264, 128, 264]
    - [10, 0.017]
  - - [264, 264, 1, 136, 264, 264, 136, 264]
    - [28, 0.068]
  - - [264, 264, 1, 256, 264, 264, 256, 264]
    - [19, 0.129]
  - - [264, 264, 1, 264, 264, 264, 264, 264]
    - [28, 0.125]
  - - [264, 264, 1, 528, 264, 264, 528, 264]
    - [20, 0.225]
  - - [264, 264, 1, 544, 264, 264, 544, 264]
    - [30, 0.239]
  - - [264, 264, 1, 576, 264, 264, 576, 264]
    - [49, 0.254]
  - - [264, 264, 1, 608, 264, 264, 608, 264]
    - [20, 0.262]
  - - [264, 264, 1, 640, 264, 264, 640, 264]
    - [41, 0.273]
  - - [264, 264, 1, 768, 264, 264, 768, 264]
    - [3, 0.277]
  - - [264, 264, 1, 776, 264, 264, 776, 264]
    - [50, 0.295]
- null
- null
- DeviceEfficiency
