library/src/hcc_detail/rocsparselt/src/spmm/Tensile/Logic/aquavanjaram/aquavanjaram_Cijk_Ailk_Bljk_HHS_BH_SA_AH.yaml
- {MinimumRequiredVersion: 4.33.0}
- aquavanjaram
- gfx940
- [Device 0049, Device 0050]
    SolutionIndex: 0
    SolutionNameMin: Cijk_Ailk_Bljk_HHS_BH_SA_AH_MT32x32x16_MI32x32x16x1_SN_1LDSB0_GRVW4_LPB8_MIWT1_1_PGR1_PLR1_SU4_TLDS1_VW4_WG32_2_1_WGM8
    SolutionIndex: 1
    SolutionNameMin: Cijk_Ailk_Bljk_HHS_BH_SA_AH_MT32x32x16_MI32x32x16x1_SN_1LDSB0_GRVW8_LPB8_MIWT1_1_PGR1_PLR1_SU4_TLDS1_VW8_WG32_2_1_WGM8
    SolutionIndex: 2
    SolutionNameMin: Cijk_Ailk_Bljk_HHS_BH_SA_AH_MT32x32x16_MI32x32x16x1_SN_1LDSB0_GRVW8_LPB8_MIWT1_1_PGR1_PLR1_SU8_TLDS1_VW8_WG32_2_1_WGM8
    SolutionIndex: 3
    SolutionNameMin: Cijk_Ailk_Bljk_HHS_BH_SA_AH_MT32x32x16_MI32x32x16x1_SN_1LDSB0_GRVW8_LPB4_MIWT1_1_PGR2_PLR1_SU8_TLDS0_VW4_WG32_2_1_WGM8
    SolutionIndex: 4
    SolutionNameMin: Cijk_Ailk_Bljk_HHS_BH_SA_AH_MT32x32x16_MI32x32x16x1_SN_1LDSB0_GRVW8_LPB8_MIWT1_1_PGR2_PLR1_SU8_TLDS1_VW8_WG32_2_1_WGM8
    SolutionIndex: 5
    SolutionNameMin: Cijk_Ailk_Bljk_HHS_BH_SA_AH_MT32x32x16_MI32x32x16x1_SN_1LDSB0_GRVW4_LPB8_MIWT1_1_PGR2_PLR1_SU4_TLDS1_VW4_WG32_2_1_WGM18
    SolutionIndex: 6
    SolutionNameMin: Cijk_Ailk_Bljk_HHS_BH_SA_AH_MT32x32x16_MI32x32x16x1_SN_1LDSB0_GRVW8_LPB8_MIWT1_1_PGR1_PLR1_SU4_TLDS1_VW4_WG32_2_1_WGM19
    SolutionIndex: 7
    SolutionNameMin: Cijk_Ailk_Bljk_HHS_BH_SA_AH_MT32x32x16_MI32x32x16x1_SN_1LDSB0_GRVW8_LPB8_MIWT1_1_PGR2_PLR1_SU4_TLDS1_VW4_WG32_2_1_WGM19
    SolutionIndex: 8
    SolutionNameMin: Cijk_Ailk_Bljk_HHS_BH_SA_AH_MT32x32x16_MI32x32x16x1_SN_1LDSB0_GRVW4_LPB8_MIWT1_1_PGR2_PLR1_SU8_TLDS1_VW8_WG32_2_1_WGM19
    SolutionIndex: 9
    SolutionNameMin: Cijk_Ailk_Bljk_HHS_BH_SA_AH_MT128x128x16_MI32x32x16x1_SN_1LDSB1_GRVW8_LPB8_MIWT2_2_PGR2_PLR1_SU4_TLDS1_VW4_WG64_4_1_WGM8
    SolutionIndex: 10
    SolutionNameMin: Cijk_Ailk_Bljk_HHS_BH_SA_AH_MT128x128x16_MI32x32x16x1_SN_1LDSB1_GRVW8_LPB8_MIWT2_2_PGR1_PLR1_SU4_TLDS1_VW4_WG64_4_1_WGM19
    SolutionIndex: 11
    SolutionNameMin: Cijk_Ailk_Bljk_HHS_BH_SA_AH_MT128x128x16_MI32x32x16x1_SN_1LDSB1_GRVW4_LPB8_MIWT2_2_PGR2_PLR1_SU4_TLDS1_VW4_WG64_4_1_WGM19
    SolutionIndex: 12
    SolutionNameMin: Cijk_Ailk_Bljk_HHS_BH_SA_AH_MT128x128x16_MI32x32x16x1_SN_1LDSB1_GRVW8_LPB8_MIWT2_2_PGR2_PLR1_SU8_TLDS1_VW4_WG64_4_1_WGM19
    SolutionIndex: 13
    SolutionNameMin: Cijk_Ailk_Bljk_HHS_BH_SA_AH_MT128x128x16_MI32x32x16x1_SN_1LDSB1_GRVW4_LPB8_MIWT2_4_PGR2_PLR1_SU4_TLDS1_VW4_WG64_2_1_WGM8
    SolutionIndex: 14
    SolutionNameMin: Cijk_Ailk_Bljk_HHS_BH_SA_AH_MT128x128x16_MI32x32x16x1_SN_1LDSB1_GRVW4_LPB8_MIWT4_2_PGR2_PLR1_SU4_TLDS1_VW4_WG32_4_1_WGM8
    SolutionIndex: 15
    SolutionNameMin: Cijk_Ailk_Bljk_HHS_BH_SA_AH_MT128x128x16_MI32x32x16x1_SN_1LDSB1_GRVW4_LPB8_MIWT4_2_PGR2_PLR1_SU4_TLDS1_VW8_WG32_4_1_WGM19
    SolutionIndex: 16
    SolutionNameMin: Cijk_Ailk_Bljk_HHS_BH_SA_AH_MT32x32x32_MI32x32x16x1_SN_1LDSB0_GRVW8_LPB8_MIWT1_1_PGR1_PLR3_SU4_TLDS1_VW8_WG32_2_1_WGM8
    SolutionIndex: 17
    SolutionNameMin: Cijk_Ailk_Bljk_HHS_BH_SA_AH_MT32x32x32_MI32x32x16x1_SN_1LDSB0_GRVW4_LPB8_MIWT1_1_PGR2_PLR3_SU4_TLDS1_VW4_WG32_2_1_WGM8
    SolutionIndex: 18
    SolutionNameMin: Cijk_Ailk_Bljk_HHS_BH_SA_AH_MT32x32x32_MI32x32x16x1_SN_1LDSB0_GRVW8_LPB8_MIWT1_1_PGR2_PLR3_SU4_TLDS1_VW4_WG32_2_1_WGM8
    SolutionIndex: 19
    SolutionNameMin: Cijk_Ailk_Bljk_HHS_BH_SA_AH_MT32x32x32_MI32x32x16x1_SN_1LDSB0_GRVW8_LPB8_MIWT1_1_PGR2_PLR3_SU4_TLDS1_VW8_WG32_2_1_WGM8
    SolutionIndex: 20
    SolutionNameMin: Cijk_Ailk_Bljk_HHS_BH_SA_AH_MT32x32x32_MI32x32x16x1_SN_1LDSB0_GRVW8_LPB8_MIWT1_1_PGR1_PLR1_SU8_TLDS1_VW4_WG32_2_1_WGM8
    SolutionIndex: 21
    SolutionNameMin: Cijk_Ailk_Bljk_HHS_BH_SA_AH_MT32x32x32_MI32x32x16x1_SN_1LDSB0_GRVW4_LPB4_MIWT1_1_PGR1_PLR1_SU4_TLDS0_VW4_WG32_2_1_WGM12
    SolutionIndex: 22
    SolutionNameMin: Cijk_Ailk_Bljk_HHS_BH_SA_AH_MT32x32x32_MI32x32x16x1_SN_1LDSB0_GRVW8_LPB8_MIWT1_1_PGR2_PLR1_SU4_TLDS1_VW4_WG32_2_1_WGM12
    SolutionIndex: 23
    SolutionNameMin: Cijk_Ailk_Bljk_HHS_BH_SA_AH_MT32x32x32_MI32x32x16x1_SN_1LDSB0_GRVW4_LPB8_MIWT1_1_PGR1_PLR3_SU4_TLDS1_VW4_WG32_2_1_WGM12
    SolutionIndex: 24
    SolutionNameMin: Cijk_Ailk_Bljk_HHS_BH_SA_AH_MT32x32x32_MI32x32x16x1_SN_1LDSB0_GRVW4_LPB8_MIWT1_1_PGR2_PLR3_SU4_TLDS0_VW8_WG32_2_1_WGM12
    SolutionIndex: 25
    SolutionNameMin: Cijk_Ailk_Bljk_HHS_BH_SA_AH_MT32x32x32_MI32x32x16x1_SN_1LDSB0_GRVW4_LPB8_MIWT1_1_PGR2_PLR1_SU8_TLDS1_VW4_WG32_2_1_WGM12
    SolutionIndex: 26
    SolutionNameMin: Cijk_Ailk_Bljk_HHS_BH_SA_AH_MT32x32x32_MI32x32x16x1_SN_1LDSB0_GRVW8_LPB8_MIWT1_1_PGR2_PLR1_SU8_TLDS1_VW4_WG32_2_1_WGM12
    SolutionIndex: 27
    SolutionNameMin: Cijk_Ailk_Bljk_HHS_BH_SA_AH_MT32x32x32_MI32x32x16x1_SN_1LDSB0_GRVW8_LPB8_MIWT1_1_PGR2_PLR3_SU8_TLDS1_VW4_WG32_2_1_WGM12
    SolutionIndex: 28
    SolutionNameMin: Cijk_Ailk_Bljk_HHS_BH_SA_AH_MT32x32x32_MI32x32x16x1_SN_1LDSB0_GRVW4_LPB8_MIWT1_1_PGR2_PLR3_SU4_TLDS1_VW4_WG32_2_1_WGM18
    SolutionIndex: 29
    SolutionNameMin: Cijk_Ailk_Bljk_HHS_BH_SA_AH_MT32x32x32_MI32x32x16x1_SN_1LDSB0_GRVW8_LPB8_MIWT1_1_PGR2_PLR3_SU4_TLDS1_VW8_WG32_2_1_WGM18
    SolutionIndex: 30
    SolutionNameMin: Cijk_Ailk_Bljk_HHS_BH_SA_AH_MT32x32x32_MI32x32x16x1_SN_1LDSB0_GRVW4_LPB8_MIWT1_1_PGR2_PLR1_SU8_TLDS1_VW4_WG32_2_1_WGM18
    SolutionIndex: 31
    SolutionNameMin: Cijk_Ailk_Bljk_HHS_BH_SA_AH_MT32x32x32_MI32x32x16x1_SN_1LDSB0_GRVW8_LPB8_MIWT1_1_PGR2_PLR3_SU8_TLDS1_VW8_WG32_2_1_WGM18
    SolutionIndex: 32
    SolutionNameMin: Cijk_Ailk_Bljk_HHS_BH_SA_AH_MT32x32x32_MI32x32x16x1_SN_1LDSB0_GRVW8_LPB8_MIWT1_1_PGR1_PLR3_SU4_TLDS1_VW8_WG32_2_1_WGM19
    SolutionIndex: 33
    SolutionNameMin: Cijk_Ailk_Bljk_HHS_BH_SA_AH_MT32x32x32_MI32x32x16x1_SN_1LDSB0_GRVW8_LPB8_MIWT1_1_PGR1_PLR3_SU8_TLDS0_VW8_WG32_2_1_WGM19
    SolutionIndex: 34
    SolutionNameMin: Cijk_Ailk_Bljk_HHS_BH_SA_AH_MT128x128x32_MI32x32x16x1_SN_1LDSB0_GRVW8_LPB8_MIWT2_2_PGR2_PLR1_SU4_TLDS1_VW4_WG64_4_1_WGM8
    SolutionIndex: 35
    SolutionNameMin: Cijk_Ailk_Bljk_HHS_BH_SA_AH_MT128x128x32_MI32x32x16x1_SN_1LDSB0_GRVW4_LPB8_MIWT2_2_PGR1_PLR1_SU8_TLDS1_VW4_WG64_4_1_WGM12
    SolutionIndex: 36
    SolutionNameMin: Cijk_Ailk_Bljk_HHS_BH_SA_AH_MT128x128x32_MI32x32x16x1_SN_1LDSB0_GRVW8_LPB8_MIWT2_2_PGR2_PLR3_SU8_TLDS1_VW8_WG64_4_1_WGM12
    SolutionIndex: 37
    SolutionNameMin: Cijk_Ailk_Bljk_HHS_BH_SA_AH_MT128x128x32_MI32x32x16x1_SN_1LDSB0_GRVW8_LPB8_MIWT2_2_PGR1_PLR1_SU4_TLDS1_VW4_WG64_4_1_WGM19
    SolutionIndex: 38
    SolutionNameMin: Cijk_Ailk_Bljk_HHS_BH_SA_AH_MT128x128x32_MI32x32x16x1_SN_1LDSB0_GRVW4_LPB8_MIWT2_4_PGR1_PLR3_SU4_TLDS0_VW8_WG64_2_1_WGM19
    SolutionIndex: 39
    SolutionNameMin: Cijk_Ailk_Bljk_HHS_BH_SA_AH_MT128x128x32_MI32x32x16x1_SN_1LDSB0_GRVW4_LPB8_MIWT4_2_PGR1_PLR3_SU8_TLDS1_VW8_WG32_4_1_WGM12
    SolutionIndex: 40
    SolutionNameMin: Cijk_Ailk_Bljk_HHS_BH_SA_AH_MT128x128x32_MI32x32x16x1_SN_1LDSB0_GRVW8_LPB8_MIWT4_2_PGR2_PLR1_SU8_TLDS1_VW4_WG32_4_1_WGM19
    SolutionIndex: 41
    SolutionNameMin: Cijk_Ailk_Bljk_HHS_BH_SA_AH_MT128x128x32_MI32x32x16x1_SN_1LDSB0_GRVW4_LPB8_MIWT4_2_PGR2_PLR3_SU8_TLDS1_VW8_WG32_4_1_WGM19
    SolutionIndex: 42
    SolutionNameMin: Cijk_Ailk_Bljk_HHS_BH_SA_AH_MT256x256x32_MI32x32x16x1_SN_1LDSB0_GRVW4_LPB8_MIWT2_4_PGR2_PLR1_SU4_TLDS1_VW8_WG128_4_1_WGM19
    SolutionIndex: 43
    SolutionNameMin: Cijk_Ailk_Bljk_HHS_BH_SA_AH_MT32x32x64_MI32x32x16x1_SN_1LDSB0_GRVW8_LPB8_MIWT1_1_PGR2_PLR5_SU4_TLDS1_VW4_WG32_2_1_WGM8
    SolutionIndex: 44
    SolutionNameMin: Cijk_Ailk_Bljk_HHS_BH_SA_AH_MT32x32x64_MI32x32x16x1_SN_1LDSB0_GRVW8_LPB8_MIWT1_1_PGR2_PLR1_SU8_TLDS1_VW8_WG32_2_1_WGM8
    SolutionIndex: 45
    SolutionNameMin: Cijk_Ailk_Bljk_HHS_BH_SA_AH_MT32x32x64_MI32x32x16x1_SN_1LDSB0_GRVW8_LPB8_MIWT1_1_PGR1_PLR5_SU8_TLDS1_VW4_WG32_2_1_WGM8
    SolutionIndex: 46
    SolutionNameMin: Cijk_Ailk_Bljk_HHS_BH_SA_AH_MT32x32x64_MI32x32x16x1_SN_1LDSB0_GRVW8_LPB8_MIWT1_1_PGR2_PLR5_SU8_TLDS1_VW4_WG32_2_1_WGM8
    SolutionIndex: 47
    SolutionNameMin: Cijk_Ailk_Bljk_HHS_BH_SA_AH_MT32x32x64_MI32x32x16x1_SN_1LDSB0_GRVW8_LPB8_MIWT1_1_PGR2_PLR5_SU8_TLDS1_VW8_WG32_2_1_WGM8
    SolutionIndex: 48
    SolutionNameMin: Cijk_Ailk_Bljk_HHS_BH_SA_AH_MT32x32x64_MI32x32x16x1_SN_1LDSB0_GRVW8_LPB8_MIWT1_1_PGR1_PLR5_SU4_TLDS1_VW4_WG32_2_1_WGM12
    SolutionIndex: 49
    SolutionNameMin: Cijk_Ailk_Bljk_HHS_BH_SA_AH_MT32x32x64_MI32x32x16x1_SN_1LDSB0_GRVW8_LPB8_MIWT1_1_PGR2_PLR5_SU4_TLDS1_VW8_WG32_2_1_WGM12
    SolutionIndex: 50
    SolutionNameMin: Cijk_Ailk_Bljk_HHS_BH_SA_AH_MT32x32x64_MI32x32x16x1_SN_1LDSB0_GRVW8_LPB8_MIWT1_1_PGR2_PLR1_SU8_TLDS1_VW4_WG32_2_1_WGM12
    SolutionIndex: 51
    SolutionNameMin: Cijk_Ailk_Bljk_HHS_BH_SA_AH_MT32x32x64_MI32x32x16x1_SN_1LDSB0_GRVW8_LPB8_MIWT1_1_PGR2_PLR1_SU8_TLDS1_VW8_WG32_2_1_WGM12
    SolutionIndex: 52
    SolutionNameMin: Cijk_Ailk_Bljk_HHS_BH_SA_AH_MT32x32x64_MI32x32x16x1_SN_1LDSB0_GRVW8_LPB8_MIWT1_1_PGR1_PLR5_SU8_TLDS1_VW4_WG32_2_1_WGM12
    SolutionIndex: 53
    SolutionNameMin: Cijk_Ailk_Bljk_HHS_BH_SA_AH_MT32x32x64_MI32x32x16x1_SN_1LDSB0_GRVW8_LPB8_MIWT1_1_PGR1_PLR1_SU4_TLDS1_VW4_WG32_2_1_WGM18
    SolutionIndex: 54
    SolutionNameMin: Cijk_Ailk_Bljk_HHS_BH_SA_AH_MT32x32x64_MI32x32x16x1_SN_1LDSB0_GRVW8_LPB8_MIWT1_1_PGR2_PLR1_SU8_TLDS1_VW8_WG32_2_1_WGM18
    SolutionIndex: 55
    SolutionNameMin: Cijk_Ailk_Bljk_HHS_BH_SA_AH_MT32x32x64_MI32x32x16x1_SN_1LDSB0_GRVW8_LPB8_MIWT1_1_PGR1_PLR5_SU8_TLDS1_VW4_WG32_2_1_WGM18
    SolutionIndex: 56
    SolutionNameMin: Cijk_Ailk_Bljk_HHS_BH_SA_AH_MT32x32x64_MI32x32x16x1_SN_1LDSB0_GRVW8_LPB8_MIWT1_1_PGR1_PLR5_SU8_TLDS1_VW8_WG32_2_1_WGM18
    SolutionIndex: 57
    SolutionNameMin: Cijk_Ailk_Bljk_HHS_BH_SA_AH_MT32x32x64_MI32x32x16x1_SN_1LDSB0_GRVW4_LPB4_MIWT1_1_PGR1_PLR1_SU4_TLDS0_VW4_WG32_2_1_WGM19
    SolutionIndex: 58
    SolutionNameMin: Cijk_Ailk_Bljk_HHS_BH_SA_AH_MT32x32x64_MI32x32x16x1_SN_1LDSB0_GRVW8_LPB8_MIWT1_1_PGR1_PLR1_SU4_TLDS1_VW8_WG32_2_1_WGM19
    SolutionIndex: 59
    SolutionNameMin: Cijk_Ailk_Bljk_HHS_BH_SA_AH_MT32x32x64_MI32x32x16x1_SN_1LDSB0_GRVW8_LPB8_MIWT1_1_PGR2_PLR1_SU4_TLDS1_VW8_WG32_2_1_WGM19
    SolutionIndex: 60
    SolutionNameMin: Cijk_Ailk_Bljk_HHS_BH_SA_AH_MT32x32x64_MI32x32x16x1_SN_1LDSB0_GRVW8_LPB8_MIWT1_1_PGR2_PLR5_SU4_TLDS1_VW4_WG32_2_1_WGM19
    SolutionIndex: 61
    SolutionNameMin: Cijk_Ailk_Bljk_HHS_BH_SA_AH_MT32x32x64_MI32x32x16x1_SN_1LDSB0_GRVW4_LPB8_MIWT1_1_PGR1_PLR1_SU8_TLDS1_VW4_WG32_2_1_WGM19
    SolutionIndex: 62
    SolutionNameMin: Cijk_Ailk_Bljk_HHS_BH_SA_AH_MT32x32x64_MI32x32x16x1_SN_1LDSB0_GRVW8_LPB8_MIWT1_1_PGR1_PLR1_SU8_TLDS1_VW4_WG32_2_1_WGM19
    SolutionIndex: 63
    SolutionNameMin: Cijk_Ailk_Bljk_HHS_BH_SA_AH_MT32x32x64_MI32x32x16x1_SN_1LDSB0_GRVW8_LPB8_MIWT1_1_PGR1_PLR5_SU8_TLDS1_VW4_WG32_2_1_WGM19
    SolutionIndex: 64
    SolutionNameMin: Cijk_Ailk_Bljk_HHS_BH_SA_AH_MT32x32x64_MI32x32x16x1_SN_1LDSB0_GRVW8_LPB8_MIWT1_1_PGR1_PLR5_SU8_TLDS1_VW8_WG32_2_1_WGM19
    SolutionIndex: 65
    SolutionNameMin: Cijk_Ailk_Bljk_HHS_BH_SA_AH_MT32x32x64_MI32x32x16x1_SN_1LDSB0_GRVW8_LPB8_MIWT1_1_PGR2_PLR5_SU8_TLDS1_VW4_WG32_2_1_WGM19
    SolutionIndex: 66
    SolutionNameMin: Cijk_Ailk_Bljk_HHS_BH_SA_AH_MT128x128x64_MI32x32x16x1_SN_1LDSB0_GRVW8_LPB4_MIWT2_2_PGR2_PLR1_SU8_TLDS0_VW4_WG64_4_1_WGM8
    SolutionIndex: 67
    SolutionNameMin: Cijk_Ailk_Bljk_HHS_BH_SA_AH_MT128x128x64_MI32x32x16x1_SN_1LDSB0_GRVW8_LPB8_MIWT2_2_PGR2_PLR5_SU8_TLDS1_VW8_WG64_4_1_WGM18
    SolutionIndex: 68
    SolutionNameMin: Cijk_Ailk_Bljk_HHS_BH_SA_AH_MT128x128x64_MI32x32x16x1_SN_1LDSB0_GRVW8_LPB8_MIWT2_2_PGR2_PLR5_SU8_TLDS1_VW4_WG64_4_1_WGM19
    SolutionIndex: 69
    SolutionNameMin: Cijk_Ailk_Bljk_HHS_BH_SA_AH_MT128x128x64_MI32x32x16x1_SN_1LDSB0_GRVW4_LPB8_MIWT4_2_PGR1_PLR5_SU4_TLDS1_VW8_WG32_4_1_WGM19
- - - [15, 15, 1, 16, 15, 15, 15, 16]
    - [7, 0.0]
  - - [15, 15, 1, 32, 15, 15, 15, 32]
    - [16, 0.0]
  - - [15, 15, 1, 64, 15, 15, 15, 64]
    - [56, 0.0]
  - - [15, 15, 1, 96, 15, 15, 15, 96]
    - [31, 0.0]
  - - [15, 15, 1, 128, 15, 15, 15, 128]
    - [62, 0.0]
  - - [15, 15, 1, 136, 15, 15, 15, 136]
    - [51, 0.0]
  - - [15, 15, 1, 256, 15, 15, 15, 256]
    - [47, 0.0]
  - - [15, 15, 1, 264, 15, 15, 15, 264]
    - [64, 0.0]
  - - [15, 15, 1, 528, 15, 15, 15, 528]
    - [51, 0.001]
  - - [15, 15, 1, 544, 15, 15, 15, 544]
    - [60, 0.001]
  - - [15, 15, 1, 576, 15, 15, 15, 576]
    - [46, 0.001]
  - - [15, 15, 1, 608, 15, 15, 15, 608]
    - [18, 0.001]
  - - [15, 15, 1, 640, 15, 15, 15, 640]
    - [44, 0.001]
  - - [15, 15, 1, 768, 15, 15, 15, 768]
    - [54, 0.001]
  - - [15, 15, 1, 776, 15, 15, 15, 776]
    - [51, 0.001]
  - - [32, 32, 1, 16, 32, 32, 32, 16]
    - [5, 0.0]
  - - [32, 32, 1, 32, 32, 32, 32, 32]
    - [17, 0.0]
  - - [32, 32, 1, 64, 32, 32, 32, 64]
    - [59, 0.001]
  - - [32, 32, 1, 96, 32, 32, 32, 96]
    - [27, 0.001]
  - - [32, 32, 1, 128, 32, 32, 32, 128]
    - [53, 0.002]
  - - [32, 32, 1, 136, 32, 32, 32, 136]
    - [45, 0.001]
  - - [32, 32, 1, 256, 32, 32, 32, 256]
    - [43, 0.003]
  - - [32, 32, 1, 264, 32, 32, 32, 264]
    - [19, 0.003]
  - - [32, 32, 1, 528, 32, 32, 32, 528]
    - [49, 0.005]
  - - [32, 32, 1, 544, 32, 32, 32, 544]
    - [27, 0.005]
  - - [32, 32, 1, 576, 32, 32, 32, 576]
    - [54, 0.005]
  - - [32, 32, 1, 608, 32, 32, 32, 608]
    - [25, 0.005]
  - - [32, 32, 1, 640, 32, 32, 32, 640]
    - [43, 0.006]
  - - [32, 32, 1, 768, 32, 32, 32, 768]
    - [54, 0.006]
  - - [32, 32, 1, 776, 32, 32, 32, 776]
    - [50, 0.006]
  - - [256, 256, 1, 16, 256, 256, 256, 16]
    - [6, 0.013]
  - - [256, 256, 1, 24, 256, 256, 256, 24]
    - [0, 0.018]
  - - [256, 256, 1, 32, 256, 256, 256, 32]
    - [28, 0.026]
  - - [256, 256, 1, 64, 256, 256, 256, 64]
    - [55, 0.05]
  - - [256, 256, 1, 96, 256, 256, 256, 96]
    - [2, 0.071]
  - - [256, 256, 1, 128, 256, 256, 256, 128]
    - [66, 0.049]
  - - [256, 256, 1, 136, 256, 256, 256, 136]
    - [3, 0.08]
  - - [256, 256, 1, 256, 256, 256, 256, 256]
    - [40, 0.07]
  - - [256, 256, 1, 264, 256, 256, 256, 264]
    - [15, 0.069]
  - - [256, 256, 1, 280, 256, 256, 256, 280]
    - [11, 0.094]
  - - [256, 256, 1, 296, 256, 256, 256, 296]
    - [41, 0.07]
  - - [256, 256, 1, 528, 256, 256, 256, 528]
    - [36, 0.162]
  - - [256, 256, 1, 544, 256, 256, 256, 544]
    - [21, 0.244]
  - - [256, 256, 1, 576, 256, 256, 256, 576]
    - [67, 0.17]
  - - [256, 256, 1, 608, 256, 256, 256, 608]
    - [12, 0.17]
  - - [256, 256, 1, 640, 256, 256, 256, 640]
    - [26, 0.341]
  - - [256, 256, 1, 768, 256, 256, 256, 768]
    - [29, 0.386]
  - - [256, 256, 1, 776, 256, 256, 256, 776]
    - [29, 0.368]
  - - [256, 256, 1, 792, 256, 256, 256, 792]
    - [24, 0.293]
  - - [256, 256, 1, 808, 256, 256, 256, 808]
    - [63, 0.36]
  - - [255, 255, 1, 16, 255, 255, 255, 16]
    - [8, 0.009]
  - - [255, 255, 1, 32, 255, 255, 255, 32]
    - [23, 0.018]
  - - [255, 255, 1, 64, 255, 255, 255, 64]
    - [61, 0.035]
  - - [255, 255, 1, 96, 255, 255, 255, 96]
    - [32, 0.052]
  - - [255, 255, 1, 128, 255, 255, 255, 128]
    - [13, 0.018]
  - - [255, 255, 1, 136, 255, 255, 255, 136]
    - [57, 0.052]
  - - [255, 255, 1, 256, 255, 255, 255, 256]
    - [37, 0.012]
  - - [255, 255, 1, 264, 255, 255, 255, 264]
    - [69, 0.031]
  - - [255, 255, 1, 528, 255, 255, 255, 528]
    - [38, 0.053]
  - - [255, 255, 1, 544, 255, 255, 255, 544]
    - [33, 0.191]
  - - [255, 255, 1, 576, 255, 255, 255, 576]
    - [65, 0.232]
  - - [255, 255, 1, 608, 255, 255, 255, 608]
    - [58, 0.231]
  - - [255, 255, 1, 640, 255, 255, 255, 640]
    - [10, 0.088]
  - - [255, 255, 1, 768, 255, 255, 255, 768]
    - [52, 0.272]
  - - [255, 255, 1, 776, 255, 255, 255, 776]
    - [30, 0.285]
  - - [264, 264, 1, 16, 264, 264, 264, 16]
    - [1, 0.01]
  - - [264, 264, 1, 32, 264, 264, 264, 32]
    - [4, 0.02]
  - - [264, 264, 1, 64, 264, 264, 264, 64]
    - [20, 0.039]
  - - [264, 264, 1, 96, 264, 264, 264, 96]
    - [14, 0.015]
  - - [264, 264, 1, 128, 264, 264, 264, 128]
    - [68, 0.033]
  - - [264, 264, 1, 136, 264, 264, 264, 136]
    - [4, 0.073]
  - - [264, 264, 1, 256, 264, 264, 264, 256]
    - [48, 0.134]
  - - [264, 264, 1, 264, 264, 264, 264, 264]
    - [52, 0.095]
  - - [264, 264, 1, 528, 264, 264, 264, 528]
    - [35, 0.094]
  - - [264, 264, 1, 544, 264, 264, 264, 544]
    - [53, 0.238]
  - - [264, 264, 1, 576, 264, 264, 264, 576]
    - [22, 0.264]
  - - [264, 264, 1, 608, 264, 264, 264, 608]
    - [42, 0.069]
  - - [264, 264, 1, 640, 264, 264, 264, 640]
    - [34, 0.132]
  - - [264, 264, 1, 768, 264, 264, 264, 768]
    - [9, 0.133]
  - - [264, 264, 1, 776, 264, 264, 264, 776]
    - [39, 0.082]
- null
- null
- DeviceEfficiency
