library/src/hcc_detail/rocsparselt/src/spmm/Tensile/Logic/aquavanjaram/aquavanjaram_Cijk_Alik_Bljk_I8I8S_BH_SA_AH.yaml
- {MinimumRequiredVersion: 4.33.0}
- aquavanjaram
- gfx940
- [Device 0049, Device 0050]
    SolutionIndex: 0
    SolutionNameMin: Cijk_Alik_Bljk_I8I8S_BH_SA_AH_MT32x32x32_MI32x32x32x1_SN_1LDSB0_AFC1_DTVSM0_EPS0_GRVW16_GSU1_LPA16_LPB16_MIWT1_1_PGR0_PLR1_SU0_SUS0_SRVW0_TLDS1_WG32_2_1
    SolutionIndex: 1
    SolutionNameMin: Cijk_Alik_Bljk_I8I8S_BH_SA_AH_MT32x32x32_MI32x32x32x1_SN_1LDSB0_AFC1_DTVSM0_EPS1_GRVW8_GSU1_LPA8_LPB16_MIWT1_1_PGR2_PLR1_SU0_SUS0_SRVW0_TLDS1_WG32_2_1
    SolutionIndex: 2
    SolutionNameMin: Cijk_Alik_Bljk_I8I8S_BH_SA_AH_MT32x32x32_MI32x32x32x1_SN_1LDSB0_AFC1_DTVSM0_EPS1_GRVW16_GSU1_LPA16_LPB16_MIWT1_1_PGR2_PLR1_SU0_SUS0_SRVW0_TLDS1_WG32_2_1
    SolutionIndex: 3
    SolutionNameMin: Cijk_Alik_Bljk_I8I8S_BH_SA_AH_MT32x32x32_MI32x32x32x1_SN_1LDSB0_AFC1_DTVSM1_EPS0_GRVW16_GSU1_LPA16_LPB16_MIWT1_1_PGR0_PLR0_SU0_SUS0_SRVW0_TLDS1_WG32_2_1
    SolutionIndex: 4
    SolutionNameMin: Cijk_Alik_Bljk_I8I8S_BH_SA_AH_MT32x32x32_MI32x32x32x1_SN_1LDSB0_AFC1_DTVSM1_EPS1_GRVW16_GSU1_LPA2_LPB2_MIWT1_1_PGR1_PLR0_SU0_SUS0_SRVW0_TLDS0_WG32_2_1
    SolutionIndex: 5
    SolutionNameMin: Cijk_Alik_Bljk_I8I8S_BH_SA_AH_MT32x32x32_MI32x32x32x1_SN_1LDSB0_AFC1_DTVSM1_EPS1_GRVW16_GSU1_LPA16_LPB16_MIWT1_1_PGR1_PLR0_SU0_SUS0_SRVW0_TLDS1_WG32_2_1
    SolutionIndex: 6
    SolutionNameMin: Cijk_Alik_Bljk_I8I8S_BH_SA_AH_MT32x32x32_MI32x32x32x1_SN_1LDSB0_AFC1_DTVSM1_EPS1_GRVW8_GSU1_LPA8_LPB16_MIWT1_1_PGR2_PLR0_SU0_SUS0_SRVW0_TLDS1_WG32_2_1
    SolutionIndex: 7
    SolutionNameMin: Cijk_Alik_Bljk_I8I8S_BH_SA_AH_MT32x32x32_MI32x32x32x1_SN_1LDSB0_AFC1_DTVSM1_EPS1_GRVW16_GSU1_LPA16_LPB16_MIWT1_1_PGR2_PLR0_SU0_SUS0_SRVW0_TLDS1_WG32_2_1
    SolutionIndex: 8
    SolutionNameMin: Cijk_Alik_Bljk_I8I8S_BH_SA_AH_MT32x32x32_MI32x32x32x1_SN_1LDSB0_AFC1_DTVSM1_EPS0_GRVW8_GSU1_LPA8_LPB16_MIWT1_1_PGR0_PLR1_SU0_SUS0_SRVW0_TLDS1_WG32_2_1
    SolutionIndex: 9
    SolutionNameMin: Cijk_Alik_Bljk_I8I8S_BH_SA_AH_MT32x32x32_MI32x32x32x1_SN_1LDSB0_AFC1_DTVSM1_EPS1_GRVW16_GSU1_LPA16_LPB16_MIWT1_1_PGR1_PLR1_SU0_SUS0_SRVW0_TLDS1_WG32_2_1
    SolutionIndex: 10
    SolutionNameMin: Cijk_Alik_Bljk_I8I8S_BH_SA_AH_MT32x32x32_MI32x32x32x1_SN_1LDSB0_AFC1_DTVSM1_EPS1_GRVW8_GSU1_LPA8_LPB16_MIWT1_1_PGR2_PLR1_SU0_SUS0_SRVW0_TLDS1_WG32_2_1
    SolutionIndex: 11
    SolutionNameMin: Cijk_Alik_Bljk_I8I8S_BH_SA_AH_MT32x32x32_MI32x32x32x1_SN_1LDSB0_AFC1_DTVSM1_EPS1_GRVW16_GSU1_LPA16_LPB16_MIWT1_1_PGR2_PLR1_SU0_SUS0_SRVW0_TLDS1_WG32_2_1
    SolutionIndex: 12
    SolutionNameMin: Cijk_Alik_Bljk_I8I8S_BH_SA_AH_MT32x32x32_MI32x32x32x1_SN_1LDSB0_AFC1_DTVSM0_EPS0_GRVW16_GSU1_LPA16_LPB16_MIWT1_1_PGR0_PLR1_SU4_SUS256_SRVW0_TLDS1_WG32_2_1
    SolutionIndex: 13
    SolutionNameMin: Cijk_Alik_Bljk_I8I8S_BH_SA_AH_MT32x32x64_MI32x32x32x1_SN_1LDSB0_AFC1_DTVSM0_EPS0_GRVW8_GSU1_LPA8_LPB16_MIWT1_1_PGR0_PLR1_SU0_SUS0_SRVW0_TLDS1_WG32_2_1
    SolutionIndex: 14
    SolutionNameMin: Cijk_Alik_Bljk_I8I8S_BH_SA_AH_MT32x32x64_MI32x32x32x1_SN_1LDSB0_AFC1_DTVSM0_EPS1_GRVW8_GSU1_LPA8_LPB16_MIWT1_1_PGR2_PLR1_SU0_SUS0_SRVW0_TLDS1_WG32_2_1
    SolutionIndex: 15
    SolutionNameMin: Cijk_Alik_Bljk_I8I8S_BH_SA_AH_MT32x32x64_MI32x32x32x1_SN_1LDSB0_AFC1_DTVSM0_EPS1_GRVW16_GSU1_LPA16_LPB16_MIWT1_1_PGR2_PLR1_SU0_SUS0_SRVW0_TLDS1_WG32_2_1
    SolutionIndex: 16
    SolutionNameMin: Cijk_Alik_Bljk_I8I8S_BH_SA_AH_MT32x32x64_MI32x32x32x1_SN_1LDSB0_AFC1_DTVSM0_EPS0_GRVW8_GSU1_LPA8_LPB16_MIWT1_1_PGR0_PLR2_SU0_SUS0_SRVW0_TLDS1_WG32_2_1
    SolutionIndex: 17
    SolutionNameMin: Cijk_Alik_Bljk_I8I8S_BH_SA_AH_MT32x32x64_MI32x32x32x1_SN_1LDSB0_AFC1_DTVSM0_EPS1_GRVW8_GSU1_LPA8_LPB16_MIWT1_1_PGR1_PLR2_SU0_SUS0_SRVW0_TLDS1_WG32_2_1
    SolutionIndex: 18
    SolutionNameMin: Cijk_Alik_Bljk_I8I8S_BH_SA_AH_MT32x32x64_MI32x32x32x1_SN_1LDSB0_AFC1_DTVSM0_EPS1_GRVW8_GSU1_LPA8_LPB16_MIWT1_1_PGR2_PLR2_SU0_SUS0_SRVW0_TLDS1_WG32_2_1
    SolutionIndex: 19
    SolutionNameMin: Cijk_Alik_Bljk_I8I8S_BH_SA_AH_MT32x32x64_MI32x32x32x1_SN_1LDSB0_AFC1_DTVSM0_EPS1_GRVW16_GSU1_LPA16_LPB16_MIWT1_1_PGR2_PLR2_SU0_SUS0_SRVW0_TLDS1_WG32_2_1
    SolutionIndex: 20
    SolutionNameMin: Cijk_Alik_Bljk_I8I8S_BH_SA_AH_MT32x32x64_MI32x32x32x1_SN_1LDSB0_AFC1_DTVSM1_EPS0_GRVW8_GSU1_LPA8_LPB16_MIWT1_1_PGR0_PLR0_SU0_SUS0_SRVW0_TLDS1_WG32_2_1
    SolutionIndex: 21
    SolutionNameMin: Cijk_Alik_Bljk_I8I8S_BH_SA_AH_MT32x32x64_MI32x32x32x1_SN_1LDSB0_AFC1_DTVSM1_EPS1_GRVW16_GSU1_LPA16_LPB16_MIWT1_1_PGR1_PLR0_SU0_SUS0_SRVW0_TLDS1_WG32_2_1
    SolutionIndex: 22
    SolutionNameMin: Cijk_Alik_Bljk_I8I8S_BH_SA_AH_MT32x32x64_MI32x32x32x1_SN_1LDSB0_AFC1_DTVSM1_EPS1_GRVW8_GSU1_LPA8_LPB16_MIWT1_1_PGR2_PLR0_SU0_SUS0_SRVW0_TLDS1_WG32_2_1
    SolutionIndex: 23
    SolutionNameMin: Cijk_Alik_Bljk_I8I8S_BH_SA_AH_MT32x32x64_MI32x32x32x1_SN_1LDSB0_AFC1_DTVSM1_EPS1_GRVW16_GSU1_LPA16_LPB16_MIWT1_1_PGR2_PLR0_SU0_SUS0_SRVW0_TLDS1_WG32_2_1
    SolutionIndex: 24
    SolutionNameMin: Cijk_Alik_Bljk_I8I8S_BH_SA_AH_MT32x32x64_MI32x32x32x1_SN_1LDSB0_AFC1_DTVSM1_EPS0_GRVW16_GSU1_LPA16_LPB16_MIWT1_1_PGR0_PLR1_SU0_SUS0_SRVW0_TLDS1_WG32_2_1
    SolutionIndex: 25
    SolutionNameMin: Cijk_Alik_Bljk_I8I8S_BH_SA_AH_MT32x32x64_MI32x32x32x1_SN_1LDSB0_AFC1_DTVSM1_EPS1_GRVW8_GSU1_LPA8_LPB16_MIWT1_1_PGR1_PLR1_SU0_SUS0_SRVW0_TLDS1_WG32_2_1
    SolutionIndex: 26
    SolutionNameMin: Cijk_Alik_Bljk_I8I8S_BH_SA_AH_MT32x32x64_MI32x32x32x1_SN_1LDSB0_AFC1_DTVSM1_EPS1_GRVW8_GSU1_LPA8_LPB16_MIWT1_1_PGR2_PLR1_SU0_SUS0_SRVW0_TLDS1_WG32_2_1
    SolutionIndex: 27
    SolutionNameMin: Cijk_Alik_Bljk_I8I8S_BH_SA_AH_MT32x32x64_MI32x32x32x1_SN_1LDSB0_AFC1_DTVSM1_EPS1_GRVW16_GSU1_LPA16_LPB16_MIWT1_1_PGR2_PLR1_SU0_SUS0_SRVW0_TLDS1_WG32_2_1
    SolutionIndex: 28
    SolutionNameMin: Cijk_Alik_Bljk_I8I8S_BH_SA_AH_MT32x32x64_MI32x32x32x1_SN_1LDSB0_AFC1_DTVSM1_EPS0_GRVW16_GSU1_LPA16_LPB16_MIWT1_1_PGR0_PLR2_SU0_SUS0_SRVW0_TLDS1_WG32_2_1
    SolutionIndex: 29
    SolutionNameMin: Cijk_Alik_Bljk_I8I8S_BH_SA_AH_MT32x32x64_MI32x32x32x1_SN_1LDSB0_AFC1_DTVSM1_EPS1_GRVW16_GSU1_LPA16_LPB16_MIWT1_1_PGR1_PLR2_SU0_SUS0_SRVW0_TLDS1_WG32_2_1
    SolutionIndex: 30
    SolutionNameMin: Cijk_Alik_Bljk_I8I8S_BH_SA_AH_MT32x32x64_MI32x32x32x1_SN_1LDSB0_AFC1_DTVSM1_EPS1_GRVW16_GSU1_LPA16_LPB16_MIWT1_1_PGR2_PLR2_SU0_SUS0_SRVW0_TLDS1_WG32_2_1
    SolutionIndex: 31
    SolutionNameMin: Cijk_Alik_Bljk_I8I8S_BH_SA_AH_MT32x32x128_MI32x32x32x1_SN_1LDSB0_AFC1_DTVSM0_EPS1_GRVW16_GSU1_LPA16_LPB16_MIWT1_1_PGR1_PLR0_SU0_SUS0_SRVW0_TLDS1_WG32_2_1
    SolutionIndex: 32
    SolutionNameMin: Cijk_Alik_Bljk_I8I8S_BH_SA_AH_MT32x32x128_MI32x32x32x1_SN_1LDSB0_AFC1_DTVSM0_EPS1_GRVW16_GSU1_LPA16_LPB16_MIWT1_1_PGR2_PLR0_SU0_SUS0_SRVW0_TLDS1_WG32_2_1
    SolutionIndex: 33
    SolutionNameMin: Cijk_Alik_Bljk_I8I8S_BH_SA_AH_MT32x32x128_MI32x32x32x1_SN_1LDSB0_AFC1_DTVSM0_EPS1_GRVW16_GSU1_LPA16_LPB16_MIWT1_1_PGR1_PLR1_SU0_SUS0_SRVW0_TLDS1_WG32_2_1
    SolutionIndex: 34
    SolutionNameMin: Cijk_Alik_Bljk_I8I8S_BH_SA_AH_MT32x32x128_MI32x32x32x1_SN_1LDSB0_AFC1_DTVSM0_EPS1_GRVW8_GSU1_LPA8_LPB16_MIWT1_1_PGR2_PLR1_SU0_SUS0_SRVW0_TLDS1_WG32_2_1
    SolutionIndex: 35
    SolutionNameMin: Cijk_Alik_Bljk_I8I8S_BH_SA_AH_MT32x32x128_MI32x32x32x1_SN_1LDSB0_AFC1_DTVSM0_EPS1_GRVW16_GSU1_LPA16_LPB16_MIWT1_1_PGR2_PLR1_SU0_SUS0_SRVW0_TLDS1_WG32_2_1
    SolutionIndex: 36
    SolutionNameMin: Cijk_Alik_Bljk_I8I8S_BH_SA_AH_MT32x32x128_MI32x32x32x1_SN_1LDSB0_AFC1_DTVSM1_EPS0_GRVW16_GSU1_LPA16_LPB16_MIWT1_1_PGR0_PLR0_SU0_SUS0_SRVW0_TLDS1_WG32_2_1
    SolutionIndex: 37
    SolutionNameMin: Cijk_Alik_Bljk_I8I8S_BH_SA_AH_MT32x32x128_MI32x32x32x1_SN_1LDSB0_AFC1_DTVSM1_EPS1_GRVW16_GSU1_LPA16_LPB16_MIWT1_1_PGR1_PLR0_SU0_SUS0_SRVW0_TLDS1_WG32_2_1
    SolutionIndex: 38
    SolutionNameMin: Cijk_Alik_Bljk_I8I8S_BH_SA_AH_MT32x32x128_MI32x32x32x1_SN_1LDSB0_AFC1_DTVSM1_EPS0_GRVW16_GSU1_LPA16_LPB16_MIWT1_1_PGR0_PLR1_SU0_SUS0_SRVW0_TLDS1_WG32_2_1
    SolutionIndex: 39
    SolutionNameMin: Cijk_Alik_Bljk_I8I8S_BH_SA_AH_MT32x32x128_MI32x32x32x1_SN_1LDSB0_AFC1_DTVSM1_EPS1_GRVW16_GSU1_LPA16_LPB16_MIWT1_1_PGR1_PLR1_SU0_SUS0_SRVW0_TLDS1_WG32_2_1
    SolutionIndex: 40
    SolutionNameMin: Cijk_Alik_Bljk_I8I8S_BH_SA_AH_MT32x32x128_MI32x32x32x1_SN_1LDSB0_AFC1_DTVSM1_EPS1_GRVW16_GSU1_LPA16_LPB16_MIWT1_1_PGR2_PLR0_SU4_SUS256_SRVW0_TLDS1_WG32_2_1
    SolutionIndex: 41
    SolutionNameMin: Cijk_Alik_Bljk_I8I8S_BH_SA_AH_MT32x32x64_MI32x32x32x1_SN_1LDSB0_AFC1_DTVSM1_EPS1_GRVW16_GSU1_LPA16_LPB16_MIWT1_1_PGR2_PLR0_SU0_SUS0_SRVW8_TLDS1_WG32_2_1
- - - [15, 15, 1, 16, 15, 15, 16, 16]
    - [10, 0.439426]
  - - [15, 15, 1, 32, 15, 15, 32, 32]
    - [4, 1.00685]
  - - [15, 15, 1, 64, 15, 15, 64, 64]
    - [20, 1.96426]
  - - [15, 15, 1, 96, 15, 15, 96, 96]
    - [1, 2.79377]
  - - [15, 15, 1, 128, 15, 15, 128, 128]
    - [34, 3.88612]
  - - [15, 15, 1, 136, 15, 15, 136, 136]
    - [8, 3.55277]
  - - [15, 15, 1, 256, 15, 15, 256, 256]
    - [20, 7.60748]
  - - [15, 15, 1, 264, 15, 15, 264, 264]
    - [20, 6.7244]
  - - [15, 15, 1, 528, 15, 15, 528, 528]
    - [14, 11.8859]
  - - [15, 15, 1, 544, 15, 15, 544, 544]
    - [15, 12.3943]
  - - [15, 15, 1, 576, 15, 15, 576, 576]
    - [19, 14.5724]
  - - [15, 15, 1, 608, 15, 15, 608, 608]
    - [2, 13.7143]
  - - [15, 15, 1, 640, 15, 15, 640, 640]
    - [35, 17.4071]
  - - [15, 15, 1, 768, 15, 15, 768, 768]
    - [40, 19.2986]
  - - [15, 15, 1, 776, 15, 15, 776, 776]
    - [14, 16.3851]
  - - [32, 32, 1, 16, 32, 32, 16, 16]
    - [3, 2.42726]
  - - [32, 32, 1, 32, 32, 32, 32, 32]
    - [3, 5.29413]
  - - [32, 32, 1, 64, 32, 32, 64, 64]
    - [13, 10.7976]
  - - [32, 32, 1, 96, 32, 32, 96, 96]
    - [3, 15.5311]
  - - [32, 32, 1, 128, 32, 32, 128, 128]
    - [38, 22.0326]
  - - [32, 32, 1, 136, 32, 32, 136, 136]
    - [3, 20.693]
  - - [32, 32, 1, 256, 32, 32, 256, 256]
    - [29, 40.2679]
  - - [32, 32, 1, 264, 32, 32, 264, 264]
    - [21, 35.894]
  - - [32, 32, 1, 528, 32, 32, 528, 528]
    - [22, 61.3459]
  - - [32, 32, 1, 544, 32, 32, 544, 544]
    - [7, 65.4359]
  - - [32, 32, 1, 576, 32, 32, 576, 576]
    - [27, 78.7324]
  - - [32, 32, 1, 608, 32, 32, 608, 608]
    - [26, 70.3216]
  - - [32, 32, 1, 640, 32, 32, 640, 640]
    - [32, 92.1614]
  - - [32, 32, 1, 768, 32, 32, 768, 768]
    - [31, 102.513]
  - - [32, 32, 1, 776, 32, 32, 776, 776]
    - [31, 85.8635]
  - - [256, 256, 1, 16, 256, 256, 16, 16]
    - [9, 157.196]
  - - [256, 256, 1, 24, 256, 256, 24, 24]
    - [11, 228.93]
  - - [256, 256, 1, 32, 256, 256, 32, 32]
    - [5, 351.341]
  - - [256, 256, 1, 64, 256, 256, 64, 64]
    - [16, 702.681]
  - - [256, 256, 1, 96, 256, 256, 96, 96]
    - [12, 981.506]
  - - [256, 256, 1, 128, 256, 256, 128, 128]
    - [36, 1368.67]
  - - [256, 256, 1, 136, 256, 256, 136, 136]
    - [11, 1271.27]
  - - [256, 256, 1, 256, 256, 256, 256, 256]
    - [25, 2545.86]
  - - [256, 256, 1, 264, 256, 256, 264, 264]
    - [11, 2334.41]
  - - [256, 256, 1, 280, 256, 256, 280, 280]
    - [11, 2373.42]
  - - [256, 256, 1, 296, 256, 256, 296, 296]
    - [7, 2562.06]
  - - [256, 256, 1, 528, 256, 256, 528, 528]
    - [27, 3917.25]
  - - [256, 256, 1, 544, 256, 256, 544, 544]
    - [6, 4139.28]
  - - [256, 256, 1, 576, 256, 256, 576, 576]
    - [26, 5052.36]
  - - [256, 256, 1, 608, 256, 256, 608, 608]
    - [11, 4669.62]
  - - [256, 256, 1, 640, 256, 256, 640, 640]
    - [33, 5736.98]
  - - [256, 256, 1, 768, 256, 256, 768, 768]
    - [30, 6526.41]
  - - [256, 256, 1, 776, 256, 256, 776, 776]
    - [27, 5823.42]
  - - [256, 256, 1, 792, 256, 256, 792, 792]
    - [27, 5733.09]
  - - [256, 256, 1, 808, 256, 256, 808, 808]
    - [41, 5648.93]
  - - [255, 255, 1, 16, 255, 255, 16, 16]
    - [0, 126.377]
  - - [255, 255, 1, 32, 255, 255, 32, 32]
    - [6, 272.642]
  - - [255, 255, 1, 64, 255, 255, 64, 64]
    - [24, 561.506]
  - - [255, 255, 1, 96, 255, 255, 96, 96]
    - [8, 803.243]
  - - [255, 255, 1, 128, 255, 255, 128, 128]
    - [28, 1079.25]
  - - [255, 255, 1, 136, 255, 255, 136, 136]
    - [5, 1056.24]
  - - [255, 255, 1, 256, 255, 255, 256, 256]
    - [21, 2093.36]
  - - [255, 255, 1, 264, 255, 255, 264, 264]
    - [11, 1908.78]
  - - [255, 255, 1, 528, 255, 255, 528, 528]
    - [23, 3321.71]
  - - [255, 255, 1, 544, 255, 255, 544, 544]
    - [5, 3476.35]
  - - [255, 255, 1, 576, 255, 255, 576, 576]
    - [18, 4100.55]
  - - [255, 255, 1, 608, 255, 255, 608, 608]
    - [19, 3987.21]
  - - [255, 255, 1, 640, 255, 255, 640, 640]
    - [37, 4732.59]
  - - [255, 255, 1, 768, 255, 255, 768, 768]
    - [39, 5372.98]
  - - [255, 255, 1, 776, 255, 255, 776, 776]
    - [19, 4665.04]
  - - [264, 264, 1, 16, 264, 264, 16, 16]
    - [8, 141.291]
  - - [264, 264, 1, 32, 264, 264, 32, 32]
    - [9, 298.504]
  - - [264, 264, 1, 64, 264, 264, 64, 64]
    - [28, 632.612]
  - - [264, 264, 1, 96, 264, 264, 96, 96]
    - [8, 888.378]
  - - [264, 264, 1, 128, 264, 264, 128, 128]
    - [8, 1194.02]
  - - [264, 264, 1, 136, 264, 264, 136, 136]
    - [9, 1151.37]
  - - [264, 264, 1, 256, 264, 264, 256, 256]
    - [28, 2272.31]
  - - [264, 264, 1, 264, 264, 264, 264, 264]
    - [10, 2087.68]
  - - [264, 264, 1, 528, 264, 264, 528, 528]
    - [19, 3689.17]
  - - [264, 264, 1, 544, 264, 264, 544, 544]
    - [1, 3984.93]
  - - [264, 264, 1, 576, 264, 264, 576, 576]
    - [27, 4524.13]
  - - [264, 264, 1, 608, 264, 264, 608, 608]
    - [23, 4265.24]
  - - [264, 264, 1, 640, 264, 264, 640, 640]
    - [17, 4915.74]
  - - [264, 264, 1, 768, 264, 264, 768, 768]
    - [37, 5873.0]
  - - [264, 264, 1, 776, 264, 264, 776, 776]
    - [23, 5123.54]
- null
- null
- DeviceEfficiency
