library/src/hcc_detail/rocsparselt/src/spmm/Tensile/Logic/aquavanjaram/aquavanjaram_Cijk_Alik_Bjlk_I8I8S_BH_SA_AH.yaml
- {MinimumRequiredVersion: 4.33.0}
- aquavanjaram
- gfx940
- [Device 0049, Device 0050]
    SolutionIndex: 0
    SolutionNameMin: Cijk_Alik_Bjlk_I8I8S_BH_SA_AH_MT32x32x32_MI32x32x32x1_SN_1LDSB0_GRVW8_LPA8_MIWT1_1_PGR1_PLR1_SU4_TLDS1_WG32_2_1_WGM12
    SolutionIndex: 1
    SolutionNameMin: Cijk_Alik_Bjlk_I8I8S_BH_SA_AH_MT32x32x32_MI32x32x32x1_SN_1LDSB0_GRVW16_LPA16_MIWT1_1_PGR1_PLR1_SU4_TLDS1_WG32_2_1_WGM12
    SolutionIndex: 2
    SolutionNameMin: Cijk_Alik_Bjlk_I8I8S_BH_SA_AH_MT32x32x32_MI32x32x32x1_SN_1LDSB0_GRVW8_LPA8_MIWT1_1_PGR2_PLR1_SU4_TLDS1_WG32_2_1_WGM12
    SolutionIndex: 3
    SolutionNameMin: Cijk_Alik_Bjlk_I8I8S_BH_SA_AH_MT32x32x32_MI32x32x32x1_SN_1LDSB0_GRVW16_LPA16_MIWT1_1_PGR2_PLR1_SU4_TLDS1_WG32_2_1_WGM12
    SolutionIndex: 4
    SolutionNameMin: Cijk_Alik_Bjlk_I8I8S_BH_SA_AH_MT32x32x32_MI32x32x32x1_SN_1LDSB0_GRVW16_LPA2_MIWT1_1_PGR2_PLR1_SU8_TLDS0_WG32_2_1_WGM12
    SolutionIndex: 5
    SolutionNameMin: Cijk_Alik_Bjlk_I8I8S_BH_SA_AH_MT32x32x32_MI32x32x32x1_SN_1LDSB0_GRVW16_LPA16_MIWT1_1_PGR2_PLR1_SU8_TLDS1_WG32_2_1_WGM12
    SolutionIndex: 6
    SolutionNameMin: Cijk_Alik_Bjlk_I8I8S_BH_SA_AH_MT32x32x32_MI32x32x32x1_SN_1LDSB0_GRVW16_LPA16_MIWT1_1_PGR1_PLR1_SU4_TLDS1_WG32_2_1_WGM18
    SolutionIndex: 7
    SolutionNameMin: Cijk_Alik_Bjlk_I8I8S_BH_SA_AH_MT32x32x32_MI32x32x32x1_SN_1LDSB0_GRVW8_LPA8_MIWT1_1_PGR2_PLR1_SU4_TLDS1_WG32_2_1_WGM18
    SolutionIndex: 8
    SolutionNameMin: Cijk_Alik_Bjlk_I8I8S_BH_SA_AH_MT32x32x32_MI32x32x32x1_SN_1LDSB0_GRVW16_LPA16_MIWT1_1_PGR2_PLR1_SU4_TLDS1_WG32_2_1_WGM18
    SolutionIndex: 9
    SolutionNameMin: Cijk_Alik_Bjlk_I8I8S_BH_SA_AH_MT32x32x32_MI32x32x32x1_SN_1LDSB0_GRVW8_LPA2_MIWT1_1_PGR2_PLR1_SU8_TLDS0_WG32_2_1_WGM18
    SolutionIndex: 10
    SolutionNameMin: Cijk_Alik_Bjlk_I8I8S_BH_SA_AH_MT32x32x32_MI32x32x32x1_SN_1LDSB0_GRVW8_LPA8_MIWT1_1_PGR2_PLR1_SU8_TLDS1_WG32_2_1_WGM18
    SolutionIndex: 11
    SolutionNameMin: Cijk_Alik_Bjlk_I8I8S_BH_SA_AH_MT32x32x32_MI32x32x32x1_SN_1LDSB0_GRVW8_LPA2_MIWT1_1_PGR1_PLR1_SU4_TLDS0_WG32_2_1_WGM19
    SolutionIndex: 12
    SolutionNameMin: Cijk_Alik_Bjlk_I8I8S_BH_SA_AH_MT32x32x32_MI32x32x32x1_SN_1LDSB0_GRVW16_LPA16_MIWT1_1_PGR1_PLR1_SU4_TLDS1_WG32_2_1_WGM19
    SolutionIndex: 13
    SolutionNameMin: Cijk_Alik_Bjlk_I8I8S_BH_SA_AH_MT32x32x32_MI32x32x32x1_SN_1LDSB0_GRVW8_LPA8_MIWT1_1_PGR2_PLR1_SU8_TLDS1_WG32_2_1_WGM19
    SolutionIndex: 14
    SolutionNameMin: Cijk_Alik_Bjlk_I8I8S_BH_SA_AH_MT32x32x32_MI32x32x32x1_SN_1LDSB0_GRVW16_LPA16_MIWT1_1_PGR2_PLR1_SU8_TLDS1_WG32_2_1_WGM19
    SolutionIndex: 15
    SolutionNameMin: Cijk_Alik_Bjlk_I8I8S_BH_SA_AH_MT32x32x64_MI32x32x32x1_SN_1LDSB0_GRVW8_LPA8_MIWT1_1_PGR1_PLR1_SU4_TLDS1_WG32_2_1_WGM12
    SolutionIndex: 16
    SolutionNameMin: Cijk_Alik_Bjlk_I8I8S_BH_SA_AH_MT32x32x64_MI32x32x32x1_SN_1LDSB0_GRVW16_LPA16_MIWT1_1_PGR1_PLR3_SU4_TLDS1_WG32_2_1_WGM12
    SolutionIndex: 17
    SolutionNameMin: Cijk_Alik_Bjlk_I8I8S_BH_SA_AH_MT32x32x64_MI32x32x32x1_SN_1LDSB0_GRVW16_LPA16_MIWT1_1_PGR2_PLR1_SU8_TLDS1_WG32_2_1_WGM12
    SolutionIndex: 18
    SolutionNameMin: Cijk_Alik_Bjlk_I8I8S_BH_SA_AH_MT32x32x64_MI32x32x32x1_SN_1LDSB0_GRVW16_LPA16_MIWT1_1_PGR1_PLR1_SU4_TLDS1_WG32_2_1_WGM18
    SolutionIndex: 19
    SolutionNameMin: Cijk_Alik_Bjlk_I8I8S_BH_SA_AH_MT32x32x64_MI32x32x32x1_SN_1LDSB0_GRVW16_LPA16_MIWT1_1_PGR1_PLR3_SU8_TLDS1_WG32_2_1_WGM18
    SolutionIndex: 20
    SolutionNameMin: Cijk_Alik_Bjlk_I8I8S_BH_SA_AH_MT32x32x64_MI32x32x32x1_SN_1LDSB0_GRVW16_LPA16_MIWT1_1_PGR1_PLR1_SU4_TLDS1_WG32_2_1_WGM19
    SolutionIndex: 21
    SolutionNameMin: Cijk_Alik_Bjlk_I8I8S_BH_SA_AH_MT32x32x64_MI32x32x32x1_SN_1LDSB0_GRVW16_LPA16_MIWT1_1_PGR2_PLR1_SU4_TLDS1_WG32_2_1_WGM19
    SolutionIndex: 22
    SolutionNameMin: Cijk_Alik_Bjlk_I8I8S_BH_SA_AH_MT32x32x64_MI32x32x32x1_SN_1LDSB0_GRVW8_LPA8_MIWT1_1_PGR2_PLR3_SU4_TLDS1_WG32_2_1_WGM19
    SolutionIndex: 23
    SolutionNameMin: Cijk_Alik_Bjlk_I8I8S_BH_SA_AH_MT32x32x64_MI32x32x32x1_SN_1LDSB0_GRVW8_LPA8_MIWT1_1_PGR1_PLR1_SU8_TLDS1_WG32_2_1_WGM19
    SolutionIndex: 24
    SolutionNameMin: Cijk_Alik_Bjlk_I8I8S_BH_SA_AH_MT32x32x64_MI32x32x32x1_SN_1LDSB0_GRVW16_LPA16_MIWT1_1_PGR1_PLR1_SU8_TLDS1_WG32_2_1_WGM19
    SolutionIndex: 25
    SolutionNameMin: Cijk_Alik_Bjlk_I8I8S_BH_SA_AH_MT32x32x64_MI32x32x32x1_SN_1LDSB0_GRVW16_LPA16_MIWT1_1_PGR2_PLR1_SU8_TLDS1_WG32_2_1_WGM19
    SolutionIndex: 26
    SolutionNameMin: Cijk_Alik_Bjlk_I8I8S_BH_SA_AH_MT32x32x64_MI32x32x32x1_SN_1LDSB0_GRVW16_LPA16_MIWT1_1_PGR1_PLR3_SU8_TLDS1_WG32_2_1_WGM19
    SolutionIndex: 27
    SolutionNameMin: Cijk_Alik_Bjlk_I8I8S_BH_SA_AH_MT32x32x64_MI32x32x32x1_SN_1LDSB0_GRVW16_LPA16_MIWT1_1_PGR2_PLR3_SU8_TLDS1_WG32_2_1_WGM19
    SolutionIndex: 28
    SolutionNameMin: Cijk_Alik_Bjlk_I8I8S_BH_SA_AH_MT32x32x128_MI32x32x32x1_SN_1LDSB0_GRVW8_LPA8_MIWT1_1_PGR1_PLR1_SU4_TLDS1_WG32_2_1_WGM18
    SolutionIndex: 29
    SolutionNameMin: Cijk_Alik_Bjlk_I8I8S_BH_SA_AH_MT32x32x128_MI32x32x32x1_SN_1LDSB0_GRVW16_LPA16_MIWT1_1_PGR1_PLR1_SU4_TLDS1_WG32_2_1_WGM18
    SolutionIndex: 30
    SolutionNameMin: Cijk_Alik_Bjlk_I8I8S_BH_SA_AH_MT32x32x128_MI32x32x32x1_SN_1LDSB0_GRVW16_LPA16_MIWT1_1_PGR2_PLR5_SU8_TLDS1_WG32_2_1_WGM19
- - - [15, 15, 1, 16, 15, 15, 16, 15]
    - [9, 0.0]
  - - [15, 15, 1, 32, 15, 15, 32, 15]
    - [0, 0.0]
  - - [15, 15, 1, 64, 15, 15, 64, 15]
    - [11, 0.0]
  - - [15, 15, 1, 96, 15, 15, 96, 15]
    - [11, 0.0]
  - - [15, 15, 1, 128, 15, 15, 128, 15]
    - [28, 0.0]
  - - [15, 15, 1, 136, 15, 15, 136, 15]
    - [2, 0.0]
  - - [15, 15, 1, 256, 15, 15, 256, 15]
    - [15, 0.0]
  - - [15, 15, 1, 264, 15, 15, 264, 15]
    - [2, 0.0]
  - - [15, 15, 1, 528, 15, 15, 528, 15]
    - [13, 0.0]
  - - [15, 15, 1, 544, 15, 15, 544, 15]
    - [13, 0.0]
  - - [15, 15, 1, 576, 15, 15, 576, 15]
    - [22, 0.0]
  - - [15, 15, 1, 608, 15, 15, 608, 15]
    - [13, 0.0]
  - - [15, 15, 1, 640, 15, 15, 640, 15]
    - [22, 0.0]
  - - [15, 15, 1, 768, 15, 15, 768, 15]
    - [22, 0.001]
  - - [15, 15, 1, 776, 15, 15, 776, 15]
    - [22, 0.0]
  - - [32, 32, 1, 16, 32, 32, 16, 32]
    - [3, 0.0]
  - - [32, 32, 1, 32, 32, 32, 32, 32]
    - [4, 0.0]
  - - [32, 32, 1, 64, 32, 32, 64, 32]
    - [19, 0.0]
  - - [32, 32, 1, 96, 32, 32, 96, 32]
    - [5, 0.001]
  - - [32, 32, 1, 128, 32, 32, 128, 32]
    - [30, 0.001]
  - - [32, 32, 1, 136, 32, 32, 136, 32]
    - [8, 0.001]
  - - [32, 32, 1, 256, 32, 32, 256, 32]
    - [18, 0.001]
  - - [32, 32, 1, 264, 32, 32, 264, 32]
    - [8, 0.001]
  - - [32, 32, 1, 528, 32, 32, 528, 32]
    - [8, 0.002]
  - - [32, 32, 1, 544, 32, 32, 544, 32]
    - [14, 0.002]
  - - [32, 32, 1, 576, 32, 32, 576, 32]
    - [18, 0.002]
  - - [32, 32, 1, 608, 32, 32, 608, 32]
    - [10, 0.002]
  - - [32, 32, 1, 640, 32, 32, 640, 32]
    - [25, 0.003]
  - - [32, 32, 1, 768, 32, 32, 768, 32]
    - [29, 0.003]
  - - [32, 32, 1, 776, 32, 32, 776, 32]
    - [8, 0.003]
  - - [256, 256, 1, 16, 256, 256, 16, 256]
    - [7, 0.006]
  - - [256, 256, 1, 24, 256, 256, 24, 256]
    - [0, 0.008]
  - - [256, 256, 1, 32, 256, 256, 32, 256]
    - [14, 0.012]
  - - [256, 256, 1, 64, 256, 256, 64, 256]
    - [24, 0.024]
  - - [256, 256, 1, 96, 256, 256, 96, 256]
    - [14, 0.033]
  - - [256, 256, 1, 128, 256, 256, 128, 256]
    - [21, 0.045]
  - - [256, 256, 1, 136, 256, 256, 136, 256]
    - [1, 0.041]
  - - [256, 256, 1, 256, 256, 256, 256, 256]
    - [16, 0.081]
  - - [256, 256, 1, 264, 256, 256, 264, 256]
    - [14, 0.074]
  - - [256, 256, 1, 280, 256, 256, 280, 256]
    - [14, 0.079]
  - - [256, 256, 1, 296, 256, 256, 296, 256]
    - [0, 0.083]
  - - [256, 256, 1, 528, 256, 256, 528, 256]
    - [14, 0.131]
  - - [256, 256, 1, 544, 256, 256, 544, 256]
    - [14, 0.146]
  - - [256, 256, 1, 576, 256, 256, 576, 256]
    - [21, 0.153]
  - - [256, 256, 1, 608, 256, 256, 608, 256]
    - [14, 0.159]
  - - [256, 256, 1, 640, 256, 256, 640, 256]
    - [17, 0.169]
  - - [256, 256, 1, 768, 256, 256, 768, 256]
    - [17, 0.191]
  - - [256, 256, 1, 776, 256, 256, 776, 256]
    - [14, 0.172]
  - - [256, 256, 1, 792, 256, 256, 792, 256]
    - [14, 0.173]
  - - [256, 256, 1, 808, 256, 256, 808, 256]
    - [14, 0.177]
  - - [255, 255, 1, 16, 255, 255, 16, 255]
    - [6, 0.004]
  - - [255, 255, 1, 32, 255, 255, 32, 255]
    - [12, 0.009]
  - - [255, 255, 1, 64, 255, 255, 64, 255]
    - [26, 0.017]
  - - [255, 255, 1, 96, 255, 255, 96, 255]
    - [12, 0.024]
  - - [255, 255, 1, 128, 255, 255, 128, 255]
    - [21, 0.032]
  - - [255, 255, 1, 136, 255, 255, 136, 255]
    - [12, 0.031]
  - - [255, 255, 1, 256, 255, 255, 256, 255]
    - [26, 0.059]
  - - [255, 255, 1, 264, 255, 255, 264, 255]
    - [16, 0.055]
  - - [255, 255, 1, 528, 255, 255, 528, 255]
    - [8, 0.098]
  - - [255, 255, 1, 544, 255, 255, 544, 255]
    - [14, 0.106]
  - - [255, 255, 1, 576, 255, 255, 576, 255]
    - [21, 0.117]
  - - [255, 255, 1, 608, 255, 255, 608, 255]
    - [8, 0.117]
  - - [255, 255, 1, 640, 255, 255, 640, 255]
    - [27, 0.13]
  - - [255, 255, 1, 768, 255, 255, 768, 255]
    - [27, 0.149]
  - - [255, 255, 1, 776, 255, 255, 776, 255]
    - [27, 0.135]
  - - [264, 264, 1, 16, 264, 264, 16, 264]
    - [1, 0.004]
  - - [264, 264, 1, 32, 264, 264, 32, 264]
    - [1, 0.009]
  - - [264, 264, 1, 64, 264, 264, 64, 264]
    - [26, 0.019]
  - - [264, 264, 1, 96, 264, 264, 96, 264]
    - [0, 0.026]
  - - [264, 264, 1, 128, 264, 264, 128, 264]
    - [23, 0.035]
  - - [264, 264, 1, 136, 264, 264, 136, 264]
    - [0, 0.034]
  - - [264, 264, 1, 256, 264, 264, 256, 264]
    - [20, 0.063]
  - - [264, 264, 1, 264, 264, 264, 264, 264]
    - [0, 0.062]
  - - [264, 264, 1, 528, 264, 264, 528, 264]
    - [16, 0.108]
  - - [264, 264, 1, 544, 264, 264, 544, 264]
    - [8, 0.118]
  - - [264, 264, 1, 576, 264, 264, 576, 264]
    - [21, 0.128]
  - - [264, 264, 1, 608, 264, 264, 608, 264]
    - [14, 0.126]
  - - [264, 264, 1, 640, 264, 264, 640, 264]
    - [21, 0.138]
  - - [264, 264, 1, 768, 264, 264, 768, 264]
    - [16, 0.16]
  - - [264, 264, 1, 776, 264, 264, 776, 264]
    - [21, 0.147]
- null
- null
- DeviceEfficiency
