library/src/hcc_detail/rocsparselt/src/spmm/Tensile/Logic/aquavanjaram/aquavanjaram_Cijk_Ailk_Bjlk_BBS_BH_SA_AH.yaml
- {MinimumRequiredVersion: 4.33.0}
- aquavanjaram
- gfx940
- [Device 0049, Device 0050]
    SolutionIndex: 0
    SolutionNameMin: Cijk_Ailk_Bjlk_BBS_BH_SA_AH_MT32x32x16_MI32x32x16x1_SN_1LDSB0_AFC1_DTVSM0_EPS0_GSU1_MIWT1_1_PGR0_PLR0_SU0_SUS0_SRVW0_WG32_2_1
    SolutionIndex: 1
    SolutionNameMin: Cijk_Ailk_Bjlk_BBS_BH_SA_AH_MT32x32x16_MI32x32x16x1_SN_1LDSB0_AFC1_DTVSM1_EPS0_GSU1_MIWT1_1_PGR0_PLR0_SU0_SUS0_SRVW0_WG32_2_1
    SolutionIndex: 2
    SolutionNameMin: Cijk_Ailk_Bjlk_BBS_BH_SA_AH_MT32x32x16_MI32x32x16x1_SN_1LDSB0_AFC1_DTVSM1_EPS1_GSU1_MIWT1_1_PGR2_PLR0_SU0_SUS0_SRVW0_WG32_2_1
    SolutionIndex: 3
    SolutionNameMin: Cijk_Ailk_Bjlk_BBS_BH_SA_AH_MT32x32x16_MI32x32x16x1_SN_1LDSB0_AFC1_DTVSM1_EPS0_GSU1_MIWT1_1_PGR0_PLR1_SU0_SUS0_SRVW0_WG32_2_1
    SolutionIndex: 4
    SolutionNameMin: Cijk_Ailk_Bjlk_BBS_BH_SA_AH_MT32x32x16_MI32x32x16x1_SN_1LDSB0_AFC1_DTVSM1_EPS1_GSU1_MIWT1_1_PGR1_PLR1_SU0_SUS0_SRVW0_WG32_2_1
    SolutionIndex: 5
    SolutionNameMin: Cijk_Ailk_Bjlk_BBS_BH_SA_AH_MT32x32x16_MI32x32x16x1_SN_1LDSB0_AFC1_DTVSM0_EPS1_GSU1_MIWT1_1_PGR2_PLR1_SU4_SUS256_SRVW0_WG32_2_1
    SolutionIndex: 6
    SolutionNameMin: Cijk_Ailk_Bjlk_BBS_BH_SA_AH_MT32x32x16_MI32x32x16x1_SN_1LDSB0_AFC1_DTVSM1_EPS0_GSU1_MIWT1_1_PGR0_PLR0_SU4_SUS256_SRVW0_WG32_2_1
    SolutionIndex: 7
    SolutionNameMin: Cijk_Ailk_Bjlk_BBS_BH_SA_AH_MT32x32x16_MI32x32x16x1_SN_1LDSB0_AFC1_DTVSM1_EPS1_GSU1_MIWT1_1_PGR2_PLR1_SU4_SUS256_SRVW0_WG32_2_1
    SolutionIndex: 8
    SolutionNameMin: Cijk_Ailk_Bjlk_BBS_BH_SA_AH_MT32x32x16_MI32x32x16x1_SN_1LDSB0_AFC0_DTVSM0_EPS1_GSU2_MIWT1_1_PGR2_PLR1_SU4_SUS256_SRVW0_WG32_2_1
    SolutionIndex: 9
    SolutionNameMin: Cijk_Ailk_Bjlk_BBS_BH_SA_AH_MT128x128x16_MI32x32x16x1_SN_1LDSB0_AFC1_DTVSM1_EPS1_GSU1_MIWT2_2_PGR1_PLR0_SU0_SUS0_SRVW0_WG64_4_1
    SolutionIndex: 10
    SolutionNameMin: Cijk_Ailk_Bjlk_BBS_BH_SA_AH_MT32x32x32_MI32x32x16x1_SN_1LDSB0_AFC1_DTVSM0_EPS1_GSU1_MIWT1_1_PGR1_PLR1_SU0_SUS0_SRVW0_WG32_2_1
    SolutionIndex: 11
    SolutionNameMin: Cijk_Ailk_Bjlk_BBS_BH_SA_AH_MT32x32x32_MI32x32x16x1_SN_1LDSB0_AFC1_DTVSM0_EPS1_GSU1_MIWT1_1_PGR2_PLR2_SU0_SUS0_SRVW0_WG32_2_1
    SolutionIndex: 12
    SolutionNameMin: Cijk_Ailk_Bjlk_BBS_BH_SA_AH_MT32x32x32_MI32x32x16x1_SN_1LDSB0_AFC1_DTVSM1_EPS1_GSU1_MIWT1_1_PGR2_PLR0_SU0_SUS0_SRVW0_WG32_2_1
    SolutionIndex: 13
    SolutionNameMin: Cijk_Ailk_Bjlk_BBS_BH_SA_AH_MT32x32x32_MI32x32x16x1_SN_1LDSB0_AFC1_DTVSM1_EPS0_GSU1_MIWT1_1_PGR0_PLR1_SU0_SUS0_SRVW0_WG32_2_1
    SolutionIndex: 14
    SolutionNameMin: Cijk_Ailk_Bjlk_BBS_BH_SA_AH_MT32x32x32_MI32x32x16x1_SN_1LDSB0_AFC1_DTVSM1_EPS1_GSU1_MIWT1_1_PGR2_PLR1_SU0_SUS0_SRVW0_WG32_2_1
    SolutionIndex: 15
    SolutionNameMin: Cijk_Ailk_Bjlk_BBS_BH_SA_AH_MT32x32x32_MI32x32x16x1_SN_1LDSB0_AFC1_DTVSM1_EPS0_GSU1_MIWT1_1_PGR0_PLR2_SU0_SUS0_SRVW0_WG32_2_1
    SolutionIndex: 16
    SolutionNameMin: Cijk_Ailk_Bjlk_BBS_BH_SA_AH_MT32x32x32_MI32x32x16x1_SN_1LDSB0_AFC1_DTVSM1_EPS1_GSU1_MIWT1_1_PGR2_PLR2_SU0_SUS0_SRVW0_WG32_2_1
    SolutionIndex: 17
    SolutionNameMin: Cijk_Ailk_Bjlk_BBS_BH_SA_AH_MT32x32x32_MI32x32x16x1_SN_1LDSB0_AFC1_DTVSM0_EPS1_GSU1_MIWT1_1_PGR1_PLR0_SU4_SUS256_SRVW0_WG32_2_1
    SolutionIndex: 18
    SolutionNameMin: Cijk_Ailk_Bjlk_BBS_BH_SA_AH_MT32x32x32_MI32x32x16x1_SN_1LDSB0_AFC1_DTVSM0_EPS1_GSU1_MIWT1_1_PGR2_PLR1_SU4_SUS256_SRVW0_WG32_2_1
    SolutionIndex: 19
    SolutionNameMin: Cijk_Ailk_Bjlk_BBS_BH_SA_AH_MT32x32x32_MI32x32x16x1_SN_1LDSB0_AFC1_DTVSM0_EPS1_GSU1_MIWT1_1_PGR1_PLR2_SU4_SUS256_SRVW0_WG32_2_1
    SolutionIndex: 20
    SolutionNameMin: Cijk_Ailk_Bjlk_BBS_BH_SA_AH_MT32x32x32_MI32x32x16x1_SN_1LDSB0_AFC1_DTVSM0_EPS1_GSU1_MIWT1_1_PGR2_PLR2_SU4_SUS256_SRVW0_WG32_2_1
    SolutionIndex: 21
    SolutionNameMin: Cijk_Ailk_Bjlk_BBS_BH_SA_AH_MT32x32x32_MI32x32x16x1_SN_1LDSB0_AFC1_DTVSM1_EPS0_GSU1_MIWT1_1_PGR0_PLR0_SU4_SUS256_SRVW0_WG32_2_1
    SolutionIndex: 22
    SolutionNameMin: Cijk_Ailk_Bjlk_BBS_BH_SA_AH_MT32x32x32_MI32x32x16x1_SN_1LDSB0_AFC1_DTVSM1_EPS1_GSU1_MIWT1_1_PGR1_PLR1_SU4_SUS256_SRVW0_WG32_2_1
    SolutionIndex: 23
    SolutionNameMin: Cijk_Ailk_Bjlk_BBS_BH_SA_AH_MT32x32x32_MI32x32x16x1_SN_1LDSB0_AFC1_DTVSM1_EPS1_GSU1_MIWT1_1_PGR2_PLR1_SU4_SUS256_SRVW0_WG32_2_1
    SolutionIndex: 24
    SolutionNameMin: Cijk_Ailk_Bjlk_BBS_BH_SA_AH_MT32x32x32_MI32x32x16x1_SN_1LDSB0_AFC1_DTVSM1_EPS1_GSU1_MIWT1_1_PGR1_PLR2_SU4_SUS256_SRVW0_WG32_2_1
    SolutionIndex: 25
    SolutionNameMin: Cijk_Ailk_Bjlk_BBS_BH_SA_AH_MT32x32x32_MI32x32x16x1_SN_1LDSB0_AFC1_DTVSM1_EPS1_GSU1_MIWT1_1_PGR2_PLR2_SU4_SUS256_SRVW0_WG32_2_1
    SolutionIndex: 26
    SolutionNameMin: Cijk_Ailk_Bjlk_BBS_BH_SA_AH_MT128x128x32_MI32x32x16x1_SN_1LDSB0_AFC1_DTVSM0_EPS1_GSU1_MIWT2_2_PGR2_PLR2_SU0_SUS0_SRVW0_WG64_4_1
    SolutionIndex: 27
    SolutionNameMin: Cijk_Ailk_Bjlk_BBS_BH_SA_AH_MT128x128x32_MI32x32x16x1_SN_1LDSB0_AFC0_DTVSM0_EPS1_GSU3_MIWT2_2_PGR1_PLR0_SU4_SUS256_SRVW0_WG64_4_1
    SolutionIndex: 28
    SolutionNameMin: Cijk_Ailk_Bjlk_BBS_BH_SA_AH_MT32x32x64_MI32x32x16x1_SN_1LDSB0_AFC1_DTVSM0_EPS0_GSU1_MIWT1_1_PGR0_PLR0_SU0_SUS0_SRVW0_WG32_2_1
    SolutionIndex: 29
    SolutionNameMin: Cijk_Ailk_Bjlk_BBS_BH_SA_AH_MT32x32x64_MI32x32x16x1_SN_1LDSB0_AFC1_DTVSM0_EPS1_GSU1_MIWT1_1_PGR1_PLR0_SU0_SUS0_SRVW0_WG32_2_1
    SolutionIndex: 30
    SolutionNameMin: Cijk_Ailk_Bjlk_BBS_BH_SA_AH_MT32x32x64_MI32x32x16x1_SN_1LDSB0_AFC1_DTVSM0_EPS1_GSU1_MIWT1_1_PGR2_PLR0_SU0_SUS0_SRVW0_WG32_2_1
    SolutionIndex: 31
    SolutionNameMin: Cijk_Ailk_Bjlk_BBS_BH_SA_AH_MT32x32x64_MI32x32x16x1_SN_1LDSB0_AFC1_DTVSM0_EPS1_GSU1_MIWT1_1_PGR1_PLR1_SU0_SUS0_SRVW0_WG32_2_1
    SolutionIndex: 32
    SolutionNameMin: Cijk_Ailk_Bjlk_BBS_BH_SA_AH_MT32x32x64_MI32x32x16x1_SN_1LDSB0_AFC1_DTVSM1_EPS0_GSU1_MIWT1_1_PGR0_PLR1_SU0_SUS0_SRVW0_WG32_2_1
    SolutionIndex: 33
    SolutionNameMin: Cijk_Ailk_Bjlk_BBS_BH_SA_AH_MT32x32x64_MI32x32x16x1_SN_1LDSB0_AFC1_DTVSM1_EPS1_GSU1_MIWT1_1_PGR1_PLR0_SU4_SUS256_SRVW0_WG32_2_1
    SolutionIndex: 34
    SolutionNameMin: Cijk_Ailk_Bjlk_BBS_BH_SA_AH_MT32x32x64_MI32x32x16x1_SN_1LDSB0_AFC1_DTVSM1_EPS1_GSU1_MIWT1_1_PGR2_PLR0_SU4_SUS256_SRVW0_WG32_2_1
    SolutionIndex: 35
    SolutionNameMin: Cijk_Ailk_Bjlk_BBS_BH_SA_AH_MT32x32x64_MI32x32x16x1_SN_1LDSB0_AFC1_DTVSM1_EPS1_GSU1_MIWT1_1_PGR2_PLR1_SU4_SUS256_SRVW0_WG32_2_1
    SolutionIndex: 36
    SolutionNameMin: Cijk_Ailk_Bjlk_BBS_BH_SA_AH_MT32x32x64_MI32x32x16x1_SN_1LDSB0_AFC0_DTVSM1_EPS1_GSU2_MIWT1_1_PGR2_PLR0_SU0_SUS0_SRVW0_WG32_2_1
    SolutionIndex: 37
    SolutionNameMin: Cijk_Ailk_Bjlk_BBS_BH_SA_AH_MT128x128x64_MI32x32x16x1_SN_1LDSB0_AFC1_DTVSM1_EPS0_GSU1_MIWT2_2_PGR0_PLR0_SU4_SUS256_SRVW0_WG64_4_1
    SolutionIndex: 38
    SolutionNameMin: Cijk_Ailk_Bjlk_BBS_BH_SA_AH_MT128x128x64_MI32x32x16x1_SN_1LDSB0_AFC1_DTVSM1_EPS0_GSU1_MIWT4_2_PGR0_PLR1_SU4_SUS256_SRVW0_WG32_4_1
    SolutionIndex: 39
    SolutionNameMin: Cijk_Ailk_Bjlk_BBS_BH_SA_AH_MT128x128x64_MI32x32x16x1_SN_1LDSB1_AFC1_DTVSM1_EPS1_GSU1_MIWT2_2_PGR1_PLR0_SU0_SUS0_SRVW0_WG64_4_1
    SolutionIndex: 40
    SolutionNameMin: Cijk_Ailk_Bjlk_BBS_BH_SA_AH_MT128x128x64_MI32x32x16x1_SN_1LDSB1_AFC0_DTVSM1_EPS1_GSU2_MIWT2_4_PGR1_PLR0_SU4_SUS256_SRVW0_WG64_2_1
    SolutionIndex: 41
    SolutionNameMin: Cijk_Ailk_Bjlk_BBS_BH_SA_AH_MT32x32x16_MI32x32x16x1_SN_1LDSB0_AFC1_DTVSM0_EPS1_GSU1_MIWT1_1_PGR2_PLR1_SU0_SUS0_SRVW8_WG32_2_1
    SolutionIndex: 42
    SolutionNameMin: Cijk_Ailk_Bjlk_BBS_BH_SA_AH_MT32x32x16_MI32x32x16x1_SN_1LDSB0_AFC1_DTVSM1_EPS1_GSU1_MIWT1_1_PGR1_PLR1_SU4_SUS256_SRVW8_WG32_2_1
    SolutionIndex: 43
    SolutionNameMin: Cijk_Ailk_Bjlk_BBS_BH_SA_AH_MT128x128x16_MI32x32x16x1_SN_1LDSB0_AFC1_DTVSM1_EPS1_GSU1_MIWT2_2_PGR2_PLR1_SU4_SUS256_SRVW8_WG64_4_1
    SolutionIndex: 44
    SolutionNameMin: Cijk_Ailk_Bjlk_BBS_BH_SA_AH_MT128x128x16_MI32x32x16x1_SN_1LDSB0_AFC1_DTVSM1_EPS1_GSU1_MIWT2_4_PGR1_PLR1_SU4_SUS256_SRVW8_WG64_2_1
    SolutionIndex: 45
    SolutionNameMin: Cijk_Ailk_Bjlk_BBS_BH_SA_AH_MT128x128x16_MI32x32x16x1_SN_1LDSB1_AFC1_DTVSM0_EPS1_GSU1_MIWT2_4_PGR2_PLR1_SU4_SUS256_SRVW8_WG64_2_1
    SolutionIndex: 46
    SolutionNameMin: Cijk_Ailk_Bjlk_BBS_BH_SA_AH_MT32x32x32_MI32x32x16x1_SN_1LDSB0_AFC1_DTVSM0_EPS1_GSU1_MIWT1_1_PGR1_PLR1_SU0_SUS0_SRVW8_WG32_2_1
    SolutionIndex: 47
    SolutionNameMin: Cijk_Ailk_Bjlk_BBS_BH_SA_AH_MT32x32x32_MI32x32x16x1_SN_1LDSB0_AFC1_DTVSM0_EPS1_GSU1_MIWT1_1_PGR1_PLR2_SU4_SUS256_SRVW8_WG32_2_1
    SolutionIndex: 48
    SolutionNameMin: Cijk_Ailk_Bjlk_BBS_BH_SA_AH_MT128x128x32_MI32x32x16x1_SN_1LDSB0_AFC1_DTVSM1_EPS1_GSU1_MIWT2_2_PGR2_PLR0_SU0_SUS0_SRVW8_WG64_4_1
    SolutionIndex: 49
    SolutionNameMin: Cijk_Ailk_Bjlk_BBS_BH_SA_AH_MT128x128x32_MI32x32x16x1_SN_1LDSB0_AFC1_DTVSM1_EPS1_GSU1_MIWT2_4_PGR1_PLR1_SU4_SUS256_SRVW8_WG64_2_1
    SolutionIndex: 50
    SolutionNameMin: Cijk_Ailk_Bjlk_BBS_BH_SA_AH_MT128x128x32_MI32x32x16x1_SN_1LDSB0_AFC1_DTVSM1_EPS1_GSU1_MIWT4_2_PGR1_PLR0_SU0_SUS0_SRVW8_WG32_4_1
    SolutionIndex: 51
    SolutionNameMin: Cijk_Ailk_Bjlk_BBS_BH_SA_AH_MT128x128x32_MI32x32x16x1_SN_1LDSB1_AFC1_DTVSM1_EPS1_GSU1_MIWT4_2_PGR2_PLR2_SU4_SUS256_SRVW8_WG32_4_1
    SolutionIndex: 52
    SolutionNameMin: Cijk_Ailk_Bjlk_BBS_BH_SA_AH_MT256x256x32_MI32x32x16x1_SN_1LDSB1_AFC1_DTVSM1_EPS1_GSU1_MIWT2_4_PGR1_PLR2_SU0_SUS0_SRVW8_WG128_4_1
    SolutionIndex: 53
    SolutionNameMin: Cijk_Ailk_Bjlk_BBS_BH_SA_AH_MT32x32x64_MI32x32x16x1_SN_1LDSB0_AFC1_DTVSM0_EPS1_GSU1_MIWT1_1_PGR2_PLR1_SU0_SUS0_SRVW8_WG32_2_1
    SolutionIndex: 54
    SolutionNameMin: Cijk_Ailk_Bjlk_BBS_BH_SA_AH_MT32x32x64_MI32x32x16x1_SN_1LDSB0_AFC1_DTVSM1_EPS1_GSU1_MIWT1_1_PGR2_PLR0_SU0_SUS0_SRVW8_WG32_2_1
    SolutionIndex: 55
    SolutionNameMin: Cijk_Ailk_Bjlk_BBS_BH_SA_AH_MT32x32x64_MI32x32x16x1_SN_1LDSB0_AFC1_DTVSM1_EPS0_GSU1_MIWT1_1_PGR0_PLR1_SU0_SUS0_SRVW8_WG32_2_1
    SolutionIndex: 56
    SolutionNameMin: Cijk_Ailk_Bjlk_BBS_BH_SA_AH_MT32x32x64_MI32x32x16x1_SN_1LDSB0_AFC1_DTVSM1_EPS1_GSU1_MIWT1_1_PGR1_PLR1_SU0_SUS0_SRVW8_WG32_2_1
    SolutionIndex: 57
    SolutionNameMin: Cijk_Ailk_Bjlk_BBS_BH_SA_AH_MT32x32x64_MI32x32x16x1_SN_1LDSB0_AFC1_DTVSM1_EPS0_GSU1_MIWT1_1_PGR0_PLR1_SU4_SUS256_SRVW8_WG32_2_1
    SolutionIndex: 58
    SolutionNameMin: Cijk_Ailk_Bjlk_BBS_BH_SA_AH_MT128x128x64_MI32x32x16x1_SN_1LDSB0_AFC1_DTVSM0_EPS0_GSU1_MIWT2_2_PGR0_PLR1_SU4_SUS256_SRVW8_WG64_4_1
    SolutionIndex: 59
    SolutionNameMin: Cijk_Ailk_Bjlk_BBS_BH_SA_AH_MT128x128x64_MI32x32x16x1_SN_1LDSB0_AFC1_DTVSM0_EPS1_GSU1_MIWT2_2_PGR2_PLR1_SU4_SUS256_SRVW8_WG64_4_1
    SolutionIndex: 60
    SolutionNameMin: Cijk_Ailk_Bjlk_BBS_BH_SA_AH_MT128x128x64_MI32x32x16x1_SN_1LDSB1_AFC1_DTVSM1_EPS1_GSU1_MIWT2_4_PGR1_PLR0_SU4_SUS256_SRVW8_WG64_2_1
- - - [15, 15, 1, 16, 15, 15, 15, 15]
    - [4, 0.438356]
  - - [15, 15, 1, 32, 15, 15, 15, 15]
    - [24, 0.907658]
  - - [15, 15, 1, 64, 15, 15, 15, 15]
    - [17, 1.75771]
  - - [15, 15, 1, 96, 15, 15, 15, 15]
    - [17, 2.51367]
  - - [15, 15, 1, 128, 15, 15, 15, 15]
    - [18, 3.14634]
  - - [15, 15, 1, 136, 15, 15, 15, 15]
    - [24, 3.13685]
  - - [15, 15, 1, 256, 15, 15, 15, 15]
    - [17, 5.54059]
  - - [15, 15, 1, 264, 15, 15, 15, 15]
    - [11, 5.37216]
  - - [15, 15, 1, 528, 15, 15, 15, 15]
    - [14, 9.90124]
  - - [15, 15, 1, 544, 15, 15, 15, 15]
    - [11, 10.3221]
  - - [15, 15, 1, 576, 15, 15, 15, 15]
    - [23, 11.1359]
  - - [15, 15, 1, 608, 15, 15, 15, 15]
    - [14, 11.2699]
  - - [15, 15, 1, 640, 15, 15, 15, 15]
    - [11, 11.6514]
  - - [15, 15, 1, 768, 15, 15, 15, 15]
    - [30, 13.4167]
  - - [15, 15, 1, 776, 15, 15, 15, 15]
    - [34, 12.8562]
  - - [32, 32, 1, 16, 32, 32, 32, 32]
    - [3, 2.46376]
  - - [32, 32, 1, 32, 32, 32, 32, 32]
    - [10, 5.14411]
  - - [32, 32, 1, 64, 32, 32, 32, 32]
    - [55, 9.48354]
  - - [32, 32, 1, 96, 32, 32, 32, 32]
    - [11, 13.446]
  - - [32, 32, 1, 128, 32, 32, 32, 32]
    - [57, 17.4973]
  - - [32, 32, 1, 136, 32, 32, 32, 32]
    - [57, 17.2956]
  - - [32, 32, 1, 256, 32, 32, 32, 32]
    - [57, 31.3083]
  - - [32, 32, 1, 264, 32, 32, 32, 32]
    - [57, 30.7427]
  - - [32, 32, 1, 528, 32, 32, 32, 32]
    - [14, 54.2027]
  - - [32, 32, 1, 544, 32, 32, 32, 32]
    - [11, 56.9878]
  - - [32, 32, 1, 576, 32, 32, 32, 32]
    - [16, 61.0932]
  - - [32, 32, 1, 608, 32, 32, 32, 32]
    - [20, 60.1219]
  - - [32, 32, 1, 640, 32, 32, 32, 32]
    - [11, 64.916]
  - - [32, 32, 1, 768, 32, 32, 32, 32]
    - [29, 71.7777]
  - - [32, 32, 1, 776, 32, 32, 32, 32]
    - [14, 66.2269]
  - - [256, 256, 1, 16, 256, 256, 256, 256]
    - [53, 131.863]
  - - [256, 256, 1, 24, 256, 256, 256, 256]
    - [38, 72.304]
  - - [256, 256, 1, 32, 256, 256, 256, 256]
    - [44, 106.943]
  - - [256, 256, 1, 64, 256, 256, 256, 256]
    - [31, 553.959]
  - - [256, 256, 1, 96, 256, 256, 256, 256]
    - [58, 418.231]
  - - [256, 256, 1, 128, 256, 256, 256, 256]
    - [5, 978.549]
  - - [256, 256, 1, 136, 256, 256, 256, 256]
    - [43, 516.211]
  - - [256, 256, 1, 256, 256, 256, 256, 256]
    - [39, 722.673]
  - - [256, 256, 1, 264, 256, 256, 256, 256]
    - [9, 687.7]
  - - [256, 256, 1, 280, 256, 256, 256, 256]
    - [49, 706.873]
  - - [256, 256, 1, 296, 256, 256, 256, 256]
    - [52, 673.004]
  - - [256, 256, 1, 528, 256, 256, 256, 256]
    - [47, 2874.48]
  - - [256, 256, 1, 544, 256, 256, 256, 256]
    - [42, 2704.87]
  - - [256, 256, 1, 576, 256, 256, 256, 256]
    - [41, 2908.22]
  - - [256, 256, 1, 608, 256, 256, 256, 256]
    - [37, 1207.09]
  - - [256, 256, 1, 640, 256, 256, 256, 256]
    - [8, 1694.12]
  - - [256, 256, 1, 768, 256, 256, 256, 256]
    - [59, 2194.53]
  - - [256, 256, 1, 776, 256, 256, 256, 256]
    - [33, 4175.88]
  - - [256, 256, 1, 792, 256, 256, 256, 256]
    - [7, 3569.16]
  - - [256, 256, 1, 808, 256, 256, 256, 256]
    - [26, 1814.39]
  - - [255, 255, 1, 16, 255, 255, 255, 255]
    - [51, 25.6496]
  - - [255, 255, 1, 32, 255, 255, 255, 255]
    - [28, 199.387]
  - - [255, 255, 1, 64, 255, 255, 255, 255]
    - [30, 418.02]
  - - [255, 255, 1, 96, 255, 255, 255, 255]
    - [13, 630.864]
  - - [255, 255, 1, 128, 255, 255, 255, 255]
    - [56, 789.977]
  - - [255, 255, 1, 136, 255, 255, 255, 255]
    - [6, 766.492]
  - - [255, 255, 1, 256, 255, 255, 255, 255]
    - [60, 357.899]
  - - [255, 255, 1, 264, 255, 255, 255, 255]
    - [12, 1421.25]
  - - [255, 255, 1, 528, 255, 255, 255, 255]
    - [48, 1037.55]
  - - [255, 255, 1, 544, 255, 255, 255, 255]
    - [45, 721.101]
  - - [255, 255, 1, 576, 255, 255, 255, 255]
    - [19, 2690.5]
  - - [255, 255, 1, 608, 255, 255, 255, 255]
    - [2, 2430.69]
  - - [255, 255, 1, 640, 255, 255, 255, 255]
    - [23, 2917.96]
  - - [255, 255, 1, 768, 255, 255, 255, 255]
    - [30, 3472.46]
  - - [255, 255, 1, 776, 255, 255, 255, 255]
    - [25, 3408.84]
  - - [264, 264, 1, 16, 264, 264, 264, 264]
    - [1, 144.233]
  - - [264, 264, 1, 32, 264, 264, 264, 264]
    - [0, 279.763]
  - - [264, 264, 1, 64, 264, 264, 264, 264]
    - [50, 111.622]
  - - [264, 264, 1, 96, 264, 264, 264, 264]
    - [46, 644.836]
  - - [264, 264, 1, 128, 264, 264, 264, 264]
    - [15, 968.21]
  - - [264, 264, 1, 136, 264, 264, 264, 264]
    - [32, 981.786]
  - - [264, 264, 1, 256, 264, 264, 264, 264]
    - [54, 1289.03]
  - - [264, 264, 1, 264, 264, 264, 264, 264]
    - [21, 1682.42]
  - - [264, 264, 1, 528, 264, 264, 264, 264]
    - [35, 2658.83]
  - - [264, 264, 1, 544, 264, 264, 264, 264]
    - [22, 2837.81]
  - - [264, 264, 1, 576, 264, 264, 264, 264]
    - [25, 3414.26]
  - - [264, 264, 1, 608, 264, 264, 264, 264]
    - [7, 3143.33]
  - - [264, 264, 1, 640, 264, 264, 264, 264]
    - [36, 2235.81]
  - - [264, 264, 1, 768, 264, 264, 264, 264]
    - [27, 1789.86]
  - - [264, 264, 1, 776, 264, 264, 264, 264]
    - [40, 1273.62]
- null
- null
- DeviceEfficiency
