library/src/hcc_detail/rocsparselt/src/spmm/Tensile/Logic/aquavanjaram/aquavanjaram_Cijk_Ailk_Bjlk_HHS_BH_SA_AH.yaml
- {MinimumRequiredVersion: 4.33.0}
- aquavanjaram
- gfx940
- [Device 0049, Device 0050]
    SolutionIndex: 0
    SolutionNameMin: Cijk_Ailk_Bjlk_HHS_BH_SA_AH_MT32x32x16_MI32x32x16x1_SN_1LDSB0_AFC1_GRVW4_GSU1_MIWT1_1_PGR2_PLR1_SU4_SRVW0_VW4_WG32_2_1_WGM8
    SolutionIndex: 1
    SolutionNameMin: Cijk_Ailk_Bjlk_HHS_BH_SA_AH_MT32x32x16_MI32x32x16x1_SN_1LDSB0_AFC1_GRVW8_GSU1_MIWT1_1_PGR2_PLR1_SU4_SRVW0_VW4_WG32_2_1_WGM18
    SolutionIndex: 2
    SolutionNameMin: Cijk_Ailk_Bjlk_HHS_BH_SA_AH_MT32x32x16_MI32x32x16x1_SN_1LDSB0_AFC1_GRVW8_GSU1_MIWT1_1_PGR1_PLR1_SU8_SRVW0_VW8_WG32_2_1_WGM19
    SolutionIndex: 3
    SolutionNameMin: Cijk_Ailk_Bjlk_HHS_BH_SA_AH_MT128x128x16_MI32x32x16x1_SN_1LDSB0_AFC1_GRVW4_GSU1_MIWT2_2_PGR1_PLR1_SU8_SRVW0_VW4_WG64_4_1_WGM12
    SolutionIndex: 4
    SolutionNameMin: Cijk_Ailk_Bjlk_HHS_BH_SA_AH_MT128x128x16_MI32x32x16x1_SN_1LDSB0_AFC1_GRVW4_GSU1_MIWT2_2_PGR2_PLR1_SU4_SRVW0_VW8_WG64_4_1_WGM18
    SolutionIndex: 5
    SolutionNameMin: Cijk_Ailk_Bjlk_HHS_BH_SA_AH_MT128x128x16_MI32x32x16x1_SN_1LDSB0_AFC1_GRVW4_GSU1_MIWT4_2_PGR1_PLR1_SU8_SRVW0_VW4_WG32_4_1_WGM12
    SolutionIndex: 6
    SolutionNameMin: Cijk_Ailk_Bjlk_HHS_BH_SA_AH_MT128x128x16_MI32x32x16x1_SN_1LDSB0_AFC1_GRVW4_GSU1_MIWT4_2_PGR2_PLR1_SU4_SRVW0_VW8_WG32_4_1_WGM19
    SolutionIndex: 7
    SolutionNameMin: Cijk_Ailk_Bjlk_HHS_BH_SA_AH_MT32x32x32_MI32x32x16x1_SN_1LDSB0_AFC1_GRVW8_GSU1_MIWT1_1_PGR1_PLR3_SU8_SRVW0_VW8_WG32_2_1_WGM8
    SolutionIndex: 8
    SolutionNameMin: Cijk_Ailk_Bjlk_HHS_BH_SA_AH_MT32x32x32_MI32x32x16x1_SN_1LDSB0_AFC1_GRVW8_GSU1_MIWT1_1_PGR2_PLR3_SU8_SRVW0_VW8_WG32_2_1_WGM8
    SolutionIndex: 9
    SolutionNameMin: Cijk_Ailk_Bjlk_HHS_BH_SA_AH_MT32x32x32_MI32x32x16x1_SN_1LDSB0_AFC0_GRVW4_GSU2_MIWT1_1_PGR2_PLR3_SU4_SRVW0_VW4_WG32_2_1_WGM8
    SolutionIndex: 10
    SolutionNameMin: Cijk_Ailk_Bjlk_HHS_BH_SA_AH_MT32x32x32_MI32x32x16x1_SN_1LDSB0_AFC0_GRVW8_GSU2_MIWT1_1_PGR2_PLR3_SU8_SRVW0_VW8_WG32_2_1_WGM8
    SolutionIndex: 11
    SolutionNameMin: Cijk_Ailk_Bjlk_HHS_BH_SA_AH_MT32x32x32_MI32x32x16x1_SN_1LDSB0_AFC1_GRVW8_GSU1_MIWT1_1_PGR2_PLR3_SU4_SRVW0_VW4_WG32_2_1_WGM12
    SolutionIndex: 12
    SolutionNameMin: Cijk_Ailk_Bjlk_HHS_BH_SA_AH_MT32x32x32_MI32x32x16x1_SN_1LDSB0_AFC1_GRVW4_GSU1_MIWT1_1_PGR1_PLR1_SU8_SRVW0_VW4_WG32_2_1_WGM12
    SolutionIndex: 13
    SolutionNameMin: Cijk_Ailk_Bjlk_HHS_BH_SA_AH_MT32x32x32_MI32x32x16x1_SN_1LDSB0_AFC0_GRVW4_GSU2_MIWT1_1_PGR2_PLR1_SU8_SRVW0_VW4_WG32_2_1_WGM12
    SolutionIndex: 14
    SolutionNameMin: Cijk_Ailk_Bjlk_HHS_BH_SA_AH_MT32x32x32_MI32x32x16x1_SN_1LDSB0_AFC0_GRVW8_GSU2_MIWT1_1_PGR2_PLR1_SU8_SRVW0_VW4_WG32_2_1_WGM12
    SolutionIndex: 15
    SolutionNameMin: Cijk_Ailk_Bjlk_HHS_BH_SA_AH_MT32x32x32_MI32x32x16x1_SN_1LDSB0_AFC1_GRVW8_GSU1_MIWT1_1_PGR1_PLR3_SU4_SRVW0_VW4_WG32_2_1_WGM18
    SolutionIndex: 16
    SolutionNameMin: Cijk_Ailk_Bjlk_HHS_BH_SA_AH_MT32x32x32_MI32x32x16x1_SN_1LDSB0_AFC1_GRVW8_GSU1_MIWT1_1_PGR2_PLR3_SU8_SRVW0_VW4_WG32_2_1_WGM18
    SolutionIndex: 17
    SolutionNameMin: Cijk_Ailk_Bjlk_HHS_BH_SA_AH_MT32x32x32_MI32x32x16x1_SN_1LDSB0_AFC1_GRVW8_GSU1_MIWT1_1_PGR2_PLR3_SU8_SRVW0_VW8_WG32_2_1_WGM18
    SolutionIndex: 18
    SolutionNameMin: Cijk_Ailk_Bjlk_HHS_BH_SA_AH_MT32x32x32_MI32x32x16x1_SN_1LDSB0_AFC0_GRVW8_GSU2_MIWT1_1_PGR2_PLR1_SU4_SRVW0_VW8_WG32_2_1_WGM18
    SolutionIndex: 19
    SolutionNameMin: Cijk_Ailk_Bjlk_HHS_BH_SA_AH_MT32x32x32_MI32x32x16x1_SN_1LDSB0_AFC0_GRVW4_GSU2_MIWT1_1_PGR2_PLR3_SU4_SRVW0_VW8_WG32_2_1_WGM18
    SolutionIndex: 20
    SolutionNameMin: Cijk_Ailk_Bjlk_HHS_BH_SA_AH_MT32x32x32_MI32x32x16x1_SN_1LDSB0_AFC1_GRVW8_GSU1_MIWT1_1_PGR1_PLR1_SU4_SRVW0_VW8_WG32_2_1_WGM19
    SolutionIndex: 21
    SolutionNameMin: Cijk_Ailk_Bjlk_HHS_BH_SA_AH_MT32x32x32_MI32x32x16x1_SN_1LDSB0_AFC1_GRVW4_GSU1_MIWT1_1_PGR2_PLR1_SU4_SRVW0_VW8_WG32_2_1_WGM19
    SolutionIndex: 22
    SolutionNameMin: Cijk_Ailk_Bjlk_HHS_BH_SA_AH_MT32x32x32_MI32x32x16x1_SN_1LDSB0_AFC1_GRVW8_GSU1_MIWT1_1_PGR2_PLR1_SU4_SRVW0_VW8_WG32_2_1_WGM19
    SolutionIndex: 23
    SolutionNameMin: Cijk_Ailk_Bjlk_HHS_BH_SA_AH_MT32x32x32_MI32x32x16x1_SN_1LDSB0_AFC1_GRVW4_GSU1_MIWT1_1_PGR1_PLR3_SU4_SRVW0_VW8_WG32_2_1_WGM19
    SolutionIndex: 24
    SolutionNameMin: Cijk_Ailk_Bjlk_HHS_BH_SA_AH_MT32x32x32_MI32x32x16x1_SN_1LDSB0_AFC1_GRVW8_GSU1_MIWT1_1_PGR1_PLR3_SU8_SRVW0_VW8_WG32_2_1_WGM19
    SolutionIndex: 25
    SolutionNameMin: Cijk_Ailk_Bjlk_HHS_BH_SA_AH_MT32x32x32_MI32x32x16x1_SN_1LDSB0_AFC0_GRVW8_GSU2_MIWT1_1_PGR1_PLR3_SU4_SRVW0_VW8_WG32_2_1_WGM19
    SolutionIndex: 26
    SolutionNameMin: Cijk_Ailk_Bjlk_HHS_BH_SA_AH_MT32x32x32_MI32x32x16x1_SN_1LDSB0_AFC0_GRVW4_GSU2_MIWT1_1_PGR2_PLR1_SU8_SRVW0_VW4_WG32_2_1_WGM19
    SolutionIndex: 27
    SolutionNameMin: Cijk_Ailk_Bjlk_HHS_BH_SA_AH_MT128x128x32_MI32x32x16x1_SN_1LDSB0_AFC1_GRVW4_GSU1_MIWT2_2_PGR2_PLR3_SU8_SRVW0_VW4_WG64_4_1_WGM12
    SolutionIndex: 28
    SolutionNameMin: Cijk_Ailk_Bjlk_HHS_BH_SA_AH_MT128x128x32_MI32x32x16x1_SN_1LDSB0_AFC1_GRVW4_GSU1_MIWT2_2_PGR1_PLR1_SU4_SRVW0_VW4_WG64_4_1_WGM19
    SolutionIndex: 29
    SolutionNameMin: Cijk_Ailk_Bjlk_HHS_BH_SA_AH_MT128x128x32_MI32x32x16x1_SN_1LDSB0_AFC1_GRVW8_GSU1_MIWT2_2_PGR2_PLR1_SU4_SRVW0_VW8_WG64_4_1_WGM19
    SolutionIndex: 30
    SolutionNameMin: Cijk_Ailk_Bjlk_HHS_BH_SA_AH_MT128x128x32_MI32x32x16x1_SN_1LDSB0_AFC1_GRVW8_GSU1_MIWT2_4_PGR1_PLR3_SU8_SRVW0_VW4_WG64_2_1_WGM12
    SolutionIndex: 31
    SolutionNameMin: Cijk_Ailk_Bjlk_HHS_BH_SA_AH_MT256x256x32_MI32x32x16x1_SN_1LDSB0_AFC1_GRVW4_GSU1_MIWT2_4_PGR2_PLR1_SU4_SRVW0_VW8_WG128_4_1_WGM8
    SolutionIndex: 32
    SolutionNameMin: Cijk_Ailk_Bjlk_HHS_BH_SA_AH_MT256x256x32_MI32x32x16x1_SN_1LDSB0_AFC1_GRVW8_GSU1_MIWT2_4_PGR1_PLR3_SU4_SRVW0_VW4_WG128_4_1_WGM12
    SolutionIndex: 33
    SolutionNameMin: Cijk_Ailk_Bjlk_HHS_BH_SA_AH_MT32x32x64_MI32x32x16x1_SN_1LDSB0_AFC1_GRVW8_GSU1_MIWT1_1_PGR1_PLR1_SU4_SRVW0_VW8_WG32_2_1_WGM8
    SolutionIndex: 34
    SolutionNameMin: Cijk_Ailk_Bjlk_HHS_BH_SA_AH_MT32x32x64_MI32x32x16x1_SN_1LDSB0_AFC1_GRVW8_GSU1_MIWT1_1_PGR1_PLR1_SU8_SRVW0_VW4_WG32_2_1_WGM8
    SolutionIndex: 35
    SolutionNameMin: Cijk_Ailk_Bjlk_HHS_BH_SA_AH_MT32x32x64_MI32x32x16x1_SN_1LDSB0_AFC1_GRVW8_GSU1_MIWT1_1_PGR1_PLR1_SU8_SRVW0_VW8_WG32_2_1_WGM8
    SolutionIndex: 36
    SolutionNameMin: Cijk_Ailk_Bjlk_HHS_BH_SA_AH_MT32x32x64_MI32x32x16x1_SN_1LDSB0_AFC1_GRVW8_GSU1_MIWT1_1_PGR1_PLR5_SU4_SRVW0_VW8_WG32_2_1_WGM12
    SolutionIndex: 37
    SolutionNameMin: Cijk_Ailk_Bjlk_HHS_BH_SA_AH_MT32x32x64_MI32x32x16x1_SN_1LDSB0_AFC1_GRVW4_GSU1_MIWT1_1_PGR2_PLR1_SU8_SRVW0_VW4_WG32_2_1_WGM12
    SolutionIndex: 38
    SolutionNameMin: Cijk_Ailk_Bjlk_HHS_BH_SA_AH_MT32x32x64_MI32x32x16x1_SN_1LDSB0_AFC0_GRVW8_GSU2_MIWT1_1_PGR2_PLR5_SU4_SRVW0_VW4_WG32_2_1_WGM12
    SolutionIndex: 39
    SolutionNameMin: Cijk_Ailk_Bjlk_HHS_BH_SA_AH_MT32x32x64_MI32x32x16x1_SN_1LDSB0_AFC1_GRVW8_GSU1_MIWT1_1_PGR1_PLR5_SU4_SRVW0_VW4_WG32_2_1_WGM18
    SolutionIndex: 40
    SolutionNameMin: Cijk_Ailk_Bjlk_HHS_BH_SA_AH_MT32x32x64_MI32x32x16x1_SN_1LDSB0_AFC1_GRVW8_GSU1_MIWT1_1_PGR1_PLR5_SU4_SRVW0_VW8_WG32_2_1_WGM18
    SolutionIndex: 41
    SolutionNameMin: Cijk_Ailk_Bjlk_HHS_BH_SA_AH_MT32x32x64_MI32x32x16x1_SN_1LDSB0_AFC1_GRVW8_GSU1_MIWT1_1_PGR1_PLR1_SU8_SRVW0_VW8_WG32_2_1_WGM18
    SolutionIndex: 42
    SolutionNameMin: Cijk_Ailk_Bjlk_HHS_BH_SA_AH_MT32x32x64_MI32x32x16x1_SN_1LDSB0_AFC1_GRVW8_GSU1_MIWT1_1_PGR1_PLR5_SU8_SRVW0_VW4_WG32_2_1_WGM18
    SolutionIndex: 43
    SolutionNameMin: Cijk_Ailk_Bjlk_HHS_BH_SA_AH_MT32x32x64_MI32x32x16x1_SN_1LDSB0_AFC1_GRVW4_GSU1_MIWT1_1_PGR1_PLR1_SU4_SRVW0_VW8_WG32_2_1_WGM19
    SolutionIndex: 44
    SolutionNameMin: Cijk_Ailk_Bjlk_HHS_BH_SA_AH_MT32x32x64_MI32x32x16x1_SN_1LDSB0_AFC1_GRVW8_GSU1_MIWT1_1_PGR1_PLR1_SU4_SRVW0_VW8_WG32_2_1_WGM19
    SolutionIndex: 45
    SolutionNameMin: Cijk_Ailk_Bjlk_HHS_BH_SA_AH_MT32x32x64_MI32x32x16x1_SN_1LDSB0_AFC1_GRVW4_GSU1_MIWT1_1_PGR2_PLR1_SU4_SRVW0_VW8_WG32_2_1_WGM19
    SolutionIndex: 46
    SolutionNameMin: Cijk_Ailk_Bjlk_HHS_BH_SA_AH_MT32x32x64_MI32x32x16x1_SN_1LDSB0_AFC1_GRVW8_GSU1_MIWT1_1_PGR1_PLR5_SU8_SRVW0_VW8_WG32_2_1_WGM19
    SolutionIndex: 47
    SolutionNameMin: Cijk_Ailk_Bjlk_HHS_BH_SA_AH_MT32x32x64_MI32x32x16x1_SN_1LDSB0_AFC0_GRVW8_GSU2_MIWT1_1_PGR1_PLR5_SU8_SRVW0_VW4_WG32_2_1_WGM19
    SolutionIndex: 48
    SolutionNameMin: Cijk_Ailk_Bjlk_HHS_BH_SA_AH_MT128x128x64_MI32x32x16x1_SN_1LDSB0_AFC1_GRVW4_GSU1_MIWT2_2_PGR2_PLR1_SU4_SRVW0_VW4_WG64_4_1_WGM18
    SolutionIndex: 49
    SolutionNameMin: Cijk_Ailk_Bjlk_HHS_BH_SA_AH_MT32x32x16_MI32x32x16x1_SN_1LDSB0_AFC1_GRVW8_GSU1_MIWT1_1_PGR1_PLR1_SU8_SRVW8_VW4_WG32_2_1_WGM8
    SolutionIndex: 50
    SolutionNameMin: Cijk_Ailk_Bjlk_HHS_BH_SA_AH_MT32x32x16_MI32x32x16x1_SN_1LDSB0_AFC1_GRVW4_GSU1_MIWT1_1_PGR2_PLR1_SU8_SRVW8_VW4_WG32_2_1_WGM12
    SolutionIndex: 51
    SolutionNameMin: Cijk_Ailk_Bjlk_HHS_BH_SA_AH_MT32x32x16_MI32x32x16x1_SN_1LDSB0_AFC1_GRVW8_GSU1_MIWT1_1_PGR2_PLR1_SU8_SRVW8_VW4_WG32_2_1_WGM19
    SolutionIndex: 52
    SolutionNameMin: Cijk_Ailk_Bjlk_HHS_BH_SA_AH_MT128x128x16_MI32x32x16x1_SN_1LDSB0_AFC1_GRVW8_GSU1_MIWT2_4_PGR1_PLR1_SU4_SRVW8_VW8_WG64_2_1_WGM18
    SolutionIndex: 53
    SolutionNameMin: Cijk_Ailk_Bjlk_HHS_BH_SA_AH_MT32x32x32_MI32x32x16x1_SN_1LDSB0_AFC1_GRVW8_GSU1_MIWT1_1_PGR2_PLR3_SU4_SRVW8_VW4_WG32_2_1_WGM8
    SolutionIndex: 54
    SolutionNameMin: Cijk_Ailk_Bjlk_HHS_BH_SA_AH_MT32x32x32_MI32x32x16x1_SN_1LDSB0_AFC1_GRVW4_GSU1_MIWT1_1_PGR2_PLR1_SU8_SRVW8_VW4_WG32_2_1_WGM8
    SolutionIndex: 55
    SolutionNameMin: Cijk_Ailk_Bjlk_HHS_BH_SA_AH_MT32x32x32_MI32x32x16x1_SN_1LDSB0_AFC1_GRVW8_GSU1_MIWT1_1_PGR2_PLR3_SU8_SRVW8_VW8_WG32_2_1_WGM8
    SolutionIndex: 56
    SolutionNameMin: Cijk_Ailk_Bjlk_HHS_BH_SA_AH_MT32x32x32_MI32x32x16x1_SN_1LDSB0_AFC1_GRVW4_GSU1_MIWT1_1_PGR2_PLR3_SU4_SRVW8_VW4_WG32_2_1_WGM12
    SolutionIndex: 57
    SolutionNameMin: Cijk_Ailk_Bjlk_HHS_BH_SA_AH_MT32x32x32_MI32x32x16x1_SN_1LDSB0_AFC1_GRVW8_GSU1_MIWT1_1_PGR2_PLR1_SU8_SRVW8_VW8_WG32_2_1_WGM12
    SolutionIndex: 58
    SolutionNameMin: Cijk_Ailk_Bjlk_HHS_BH_SA_AH_MT128x128x32_MI32x32x16x1_SN_1LDSB0_AFC1_GRVW8_GSU1_MIWT2_2_PGR2_PLR1_SU8_SRVW8_VW4_WG64_4_1_WGM8
    SolutionIndex: 59
    SolutionNameMin: Cijk_Ailk_Bjlk_HHS_BH_SA_AH_MT128x128x32_MI32x32x16x1_SN_1LDSB0_AFC1_GRVW4_GSU1_MIWT2_2_PGR1_PLR1_SU8_SRVW8_VW4_WG64_4_1_WGM18
    SolutionIndex: 60
    SolutionNameMin: Cijk_Ailk_Bjlk_HHS_BH_SA_AH_MT128x128x32_MI32x32x16x1_SN_1LDSB0_AFC1_GRVW8_GSU1_MIWT2_2_PGR2_PLR3_SU8_SRVW8_VW8_WG64_4_1_WGM19
    SolutionIndex: 61
    SolutionNameMin: Cijk_Ailk_Bjlk_HHS_BH_SA_AH_MT128x128x32_MI32x32x16x1_SN_1LDSB0_AFC1_GRVW4_GSU1_MIWT2_4_PGR2_PLR3_SU8_SRVW8_VW8_WG64_2_1_WGM8
    SolutionIndex: 62
    SolutionNameMin: Cijk_Ailk_Bjlk_HHS_BH_SA_AH_MT32x32x64_MI32x32x16x1_SN_1LDSB0_AFC1_GRVW8_GSU1_MIWT1_1_PGR2_PLR5_SU8_SRVW8_VW4_WG32_2_1_WGM8
    SolutionIndex: 63
    SolutionNameMin: Cijk_Ailk_Bjlk_HHS_BH_SA_AH_MT32x32x64_MI32x32x16x1_SN_1LDSB0_AFC1_GRVW8_GSU1_MIWT1_1_PGR1_PLR1_SU4_SRVW8_VW4_WG32_2_1_WGM18
    SolutionIndex: 64
    SolutionNameMin: Cijk_Ailk_Bjlk_HHS_BH_SA_AH_MT32x32x64_MI32x32x16x1_SN_1LDSB0_AFC1_GRVW8_GSU1_MIWT1_1_PGR1_PLR5_SU8_SRVW8_VW4_WG32_2_1_WGM19
    SolutionIndex: 65
    SolutionNameMin: Cijk_Ailk_Bjlk_HHS_BH_SA_AH_MT128x128x64_MI32x32x16x1_SN_1LDSB0_AFC1_GRVW8_GSU1_MIWT2_2_PGR1_PLR1_SU4_SRVW8_VW4_WG64_4_1_WGM18
    SolutionIndex: 66
    SolutionNameMin: Cijk_Ailk_Bjlk_HHS_BH_SA_AH_MT128x128x64_MI32x32x16x1_SN_1LDSB0_AFC1_GRVW8_GSU1_MIWT2_4_PGR2_PLR1_SU4_SRVW8_VW4_WG64_2_1_WGM8
    SolutionIndex: 67
    SolutionNameMin: Cijk_Ailk_Bjlk_HHS_BH_SA_AH_MT128x128x64_MI32x32x16x1_SN_1LDSB0_AFC1_GRVW4_GSU1_MIWT4_2_PGR1_PLR1_SU4_SRVW8_VW8_WG32_4_1_WGM8
    SolutionIndex: 68
    SolutionNameMin: Cijk_Ailk_Bjlk_HHS_BH_SA_AH_MT128x128x64_MI32x32x16x1_SN_1LDSB0_AFC1_GRVW8_GSU1_MIWT4_2_PGR1_PLR1_SU8_SRVW8_VW4_WG32_4_1_WGM12
    SolutionIndex: 69
    SolutionNameMin: Cijk_Ailk_Bjlk_HHS_BH_SA_AH_MT128x128x64_MI32x32x16x1_SN_1LDSB0_AFC1_GRVW4_GSU1_MIWT4_2_PGR1_PLR1_SU4_SRVW8_VW4_WG32_4_1_WGM18
    SolutionIndex: 70
    SolutionNameMin: Cijk_Ailk_Bjlk_HHS_BH_SA_AH_MT128x128x64_MI32x32x16x1_SN_1LDSB0_AFC1_GRVW4_GSU1_MIWT4_2_PGR2_PLR5_SU8_SRVW8_VW4_WG32_4_1_WGM19
- - - [15, 15, 1, 16, 15, 15, 15, 15]
    - [1, 0.0]
  - - [15, 15, 1, 32, 15, 15, 15, 15]
    - [15, 0.0]
  - - [15, 15, 1, 64, 15, 15, 15, 15]
    - [45, 0.0]
  - - [15, 15, 1, 96, 15, 15, 15, 15]
    - [15, 0.0]
  - - [15, 15, 1, 128, 15, 15, 15, 15]
    - [40, 0.0]
  - - [15, 15, 1, 136, 15, 15, 15, 15]
    - [41, 0.0]
  - - [15, 15, 1, 256, 15, 15, 15, 15]
    - [17, 0.0]
  - - [15, 15, 1, 264, 15, 15, 15, 15]
    - [17, 0.0]
  - - [15, 15, 1, 528, 15, 15, 15, 15]
    - [13, 0.001]
  - - [15, 15, 1, 544, 15, 15, 15, 15]
    - [19, 0.001]
  - - [15, 15, 1, 576, 15, 15, 15, 15]
    - [9, 0.001]
  - - [15, 15, 1, 608, 15, 15, 15, 15]
    - [26, 0.001]
  - - [15, 15, 1, 640, 15, 15, 15, 15]
    - [19, 0.001]
  - - [15, 15, 1, 768, 15, 15, 15, 15]
    - [9, 0.001]
  - - [15, 15, 1, 776, 15, 15, 15, 15]
    - [13, 0.001]
  - - [32, 32, 1, 16, 32, 32, 32, 32]
    - [2, 0.0]
  - - [32, 32, 1, 32, 32, 32, 32, 32]
    - [24, 0.0]
  - - [32, 32, 1, 64, 32, 32, 32, 32]
    - [33, 0.001]
  - - [32, 32, 1, 96, 32, 32, 32, 32]
    - [7, 0.001]
  - - [32, 32, 1, 128, 32, 32, 32, 32]
    - [34, 0.002]
  - - [32, 32, 1, 136, 32, 32, 32, 32]
    - [33, 0.001]
  - - [32, 32, 1, 256, 32, 32, 32, 32]
    - [46, 0.003]
  - - [32, 32, 1, 264, 32, 32, 32, 32]
    - [44, 0.002]
  - - [32, 32, 1, 528, 32, 32, 32, 32]
    - [36, 0.004]
  - - [32, 32, 1, 544, 32, 32, 32, 32]
    - [53, 0.005]
  - - [32, 32, 1, 576, 32, 32, 32, 32]
    - [35, 0.005]
  - - [32, 32, 1, 608, 32, 32, 32, 32]
    - [18, 0.005]
  - - [32, 32, 1, 640, 32, 32, 32, 32]
    - [46, 0.005]
  - - [32, 32, 1, 768, 32, 32, 32, 32]
    - [10, 0.006]
  - - [32, 32, 1, 776, 32, 32, 32, 32]
    - [14, 0.006]
  - - [256, 256, 1, 16, 256, 256, 256, 256]
    - [0, 0.013]
  - - [256, 256, 1, 24, 256, 256, 256, 256]
    - [31, 0.004]
  - - [256, 256, 1, 32, 256, 256, 256, 256]
    - [66, 0.006]
  - - [256, 256, 1, 64, 256, 256, 256, 256]
    - [42, 0.048]
  - - [256, 256, 1, 96, 256, 256, 256, 256]
    - [16, 0.062]
  - - [256, 256, 1, 128, 256, 256, 256, 256]
    - [52, 0.04]
  - - [256, 256, 1, 136, 256, 256, 256, 256]
    - [48, 0.03]
  - - [256, 256, 1, 256, 256, 256, 256, 256]
    - [30, 0.051]
  - - [256, 256, 1, 264, 256, 256, 256, 256]
    - [12, 0.145]
  - - [256, 256, 1, 280, 256, 256, 256, 256]
    - [68, 0.063]
  - - [256, 256, 1, 296, 256, 256, 256, 256]
    - [64, 0.147]
  - - [256, 256, 1, 528, 256, 256, 256, 256]
    - [63, 0.248]
  - - [256, 256, 1, 544, 256, 256, 256, 256]
    - [8, 0.275]
  - - [256, 256, 1, 576, 256, 256, 256, 256]
    - [25, 0.205]
  - - [256, 256, 1, 608, 256, 256, 256, 256]
    - [62, 0.247]
  - - [256, 256, 1, 640, 256, 256, 256, 256]
    - [0, 0.278]
  - - [256, 256, 1, 768, 256, 256, 256, 256]
    - [58, 0.181]
  - - [256, 256, 1, 776, 256, 256, 256, 256]
    - [50, 0.304]
  - - [256, 256, 1, 792, 256, 256, 256, 256]
    - [60, 0.182]
  - - [256, 256, 1, 808, 256, 256, 256, 256]
    - [22, 0.35]
  - - [255, 255, 1, 16, 255, 255, 255, 255]
    - [69, 0.002]
  - - [255, 255, 1, 32, 255, 255, 255, 255]
    - [6, 0.004]
  - - [255, 255, 1, 64, 255, 255, 255, 255]
    - [70, 0.009]
  - - [255, 255, 1, 96, 255, 255, 255, 255]
    - [67, 0.013]
  - - [255, 255, 1, 128, 255, 255, 255, 255]
    - [21, 0.059]
  - - [255, 255, 1, 136, 255, 255, 255, 255]
    - [49, 0.028]
  - - [255, 255, 1, 256, 255, 255, 255, 255]
    - [59, 0.048]
  - - [255, 255, 1, 264, 255, 255, 255, 255]
    - [23, 0.106]
  - - [255, 255, 1, 528, 255, 255, 255, 255]
    - [4, 0.069]
  - - [255, 255, 1, 544, 255, 255, 255, 255]
    - [37, 0.177]
  - - [255, 255, 1, 576, 255, 255, 255, 255]
    - [51, 0.212]
  - - [255, 255, 1, 608, 255, 255, 255, 255]
    - [47, 0.159]
  - - [255, 255, 1, 640, 255, 255, 255, 255]
    - [61, 0.069]
  - - [255, 255, 1, 768, 255, 255, 255, 255]
    - [29, 0.091]
  - - [255, 255, 1, 776, 255, 255, 255, 255]
    - [56, 0.256]
  - - [264, 264, 1, 16, 264, 264, 264, 264]
    - [28, 0.006]
  - - [264, 264, 1, 32, 264, 264, 264, 264]
    - [32, 0.007]
  - - [264, 264, 1, 64, 264, 264, 264, 264]
    - [3, 0.021]
  - - [264, 264, 1, 96, 264, 264, 264, 264]
    - [27, 0.031]
  - - [264, 264, 1, 128, 264, 264, 264, 264]
    - [54, 0.064]
  - - [264, 264, 1, 136, 264, 264, 264, 264]
    - [5, 0.027]
  - - [264, 264, 1, 256, 264, 264, 264, 264]
    - [43, 0.134]
  - - [264, 264, 1, 264, 264, 264, 264, 264]
    - [65, 0.055]
  - - [264, 264, 1, 528, 264, 264, 264, 264]
    - [39, 0.24]
  - - [264, 264, 1, 544, 264, 264, 264, 264]
    - [57, 0.236]
  - - [264, 264, 1, 576, 264, 264, 264, 264]
    - [41, 0.276]
  - - [264, 264, 1, 608, 264, 264, 264, 264]
    - [20, 0.279]
  - - [264, 264, 1, 640, 264, 264, 264, 264]
    - [38, 0.18]
  - - [264, 264, 1, 768, 264, 264, 264, 264]
    - [55, 0.304]
  - - [264, 264, 1, 776, 264, 264, 264, 264]
    - [11, 0.325]
- null
- null
- DeviceEfficiency
