library/src/hcc_detail/rocsparselt/src/spmm/Tensile/Logic/aquavanjaram/aquavanjaram_Cijk_Alik_Bljk_BBS_BH_SA_AH.yaml
- {MinimumRequiredVersion: 4.33.0}
- aquavanjaram
- gfx940
- [Device 0049, Device 0050]
    SolutionIndex: 0
    SolutionNameMin: Cijk_Alik_Bljk_BBS_BH_SA_AH_MT32x32x16_MI32x32x16x1_SN_1LDSB0_AFC1_DTVSM1_EPS0_GSU1_LPA8_LPB8_MIWT1_1_PGR0_PLR0_SU0_SUS0_SRVW0_TLDS1_WG32_2_1
    SolutionIndex: 1
    SolutionNameMin: Cijk_Alik_Bljk_BBS_BH_SA_AH_MT32x32x16_MI32x32x16x1_SN_1LDSB0_AFC1_DTVSM1_EPS0_GSU1_LPA2_LPB2_MIWT1_1_PGR0_PLR1_SU0_SUS0_SRVW0_TLDS0_WG32_2_1
    SolutionIndex: 2
    SolutionNameMin: Cijk_Alik_Bljk_BBS_BH_SA_AH_MT32x32x16_MI32x32x16x1_SN_1LDSB0_AFC1_DTVSM0_EPS1_GSU1_LPA8_LPB8_MIWT1_1_PGR2_PLR1_SU4_SUS256_SRVW0_TLDS1_WG32_2_1
    SolutionIndex: 3
    SolutionNameMin: Cijk_Alik_Bljk_BBS_BH_SA_AH_MT32x32x16_MI32x32x16x1_SN_1LDSB0_AFC1_DTVSM1_EPS1_GSU1_LPA8_LPB8_MIWT1_1_PGR1_PLR1_SU4_SUS256_SRVW0_TLDS1_WG32_2_1
    SolutionIndex: 4
    SolutionNameMin: Cijk_Alik_Bljk_BBS_BH_SA_AH_MT128x128x16_MI32x32x16x1_SN_1LDSB0_AFC1_DTVSM0_EPS0_GSU1_LPA2_LPB2_MIWT2_2_PGR0_PLR0_SU0_SUS0_SRVW0_TLDS0_WG64_4_1
    SolutionIndex: 5
    SolutionNameMin: Cijk_Alik_Bljk_BBS_BH_SA_AH_MT32x32x32_MI32x32x16x1_SN_1LDSB0_AFC1_DTVSM0_EPS1_GSU1_LPA8_LPB8_MIWT1_1_PGR2_PLR2_SU0_SUS0_SRVW0_TLDS1_WG32_2_1
    SolutionIndex: 6
    SolutionNameMin: Cijk_Alik_Bljk_BBS_BH_SA_AH_MT32x32x32_MI32x32x16x1_SN_1LDSB0_AFC1_DTVSM1_EPS1_GSU1_LPA8_LPB8_MIWT1_1_PGR1_PLR0_SU0_SUS0_SRVW0_TLDS1_WG32_2_1
    SolutionIndex: 7
    SolutionNameMin: Cijk_Alik_Bljk_BBS_BH_SA_AH_MT32x32x32_MI32x32x16x1_SN_1LDSB0_AFC1_DTVSM1_EPS1_GSU1_LPA8_LPB8_MIWT1_1_PGR2_PLR0_SU0_SUS0_SRVW0_TLDS1_WG32_2_1
    SolutionIndex: 8
    SolutionNameMin: Cijk_Alik_Bljk_BBS_BH_SA_AH_MT32x32x32_MI32x32x16x1_SN_1LDSB0_AFC1_DTVSM1_EPS1_GSU1_LPA8_LPB8_MIWT1_1_PGR1_PLR1_SU0_SUS0_SRVW0_TLDS1_WG32_2_1
    SolutionIndex: 9
    SolutionNameMin: Cijk_Alik_Bljk_BBS_BH_SA_AH_MT32x32x32_MI32x32x16x1_SN_1LDSB0_AFC1_DTVSM1_EPS1_GSU1_LPA8_LPB8_MIWT1_1_PGR2_PLR1_SU0_SUS0_SRVW0_TLDS1_WG32_2_1
    SolutionIndex: 10
    SolutionNameMin: Cijk_Alik_Bljk_BBS_BH_SA_AH_MT32x32x32_MI32x32x16x1_SN_1LDSB0_AFC1_DTVSM1_EPS1_GSU1_LPA8_LPB8_MIWT1_1_PGR1_PLR2_SU0_SUS0_SRVW0_TLDS1_WG32_2_1
    SolutionIndex: 11
    SolutionNameMin: Cijk_Alik_Bljk_BBS_BH_SA_AH_MT32x32x32_MI32x32x16x1_SN_1LDSB0_AFC1_DTVSM1_EPS1_GSU1_LPA8_LPB8_MIWT1_1_PGR2_PLR2_SU0_SUS0_SRVW0_TLDS1_WG32_2_1
    SolutionIndex: 12
    SolutionNameMin: Cijk_Alik_Bljk_BBS_BH_SA_AH_MT32x32x32_MI32x32x16x1_SN_1LDSB0_AFC1_DTVSM0_EPS1_GSU1_LPA8_LPB8_MIWT1_1_PGR2_PLR0_SU4_SUS256_SRVW0_TLDS1_WG32_2_1
    SolutionIndex: 13
    SolutionNameMin: Cijk_Alik_Bljk_BBS_BH_SA_AH_MT32x32x32_MI32x32x16x1_SN_1LDSB0_AFC1_DTVSM0_EPS1_GSU1_LPA8_LPB8_MIWT1_1_PGR2_PLR1_SU4_SUS256_SRVW0_TLDS1_WG32_2_1
    SolutionIndex: 14
    SolutionNameMin: Cijk_Alik_Bljk_BBS_BH_SA_AH_MT32x32x32_MI32x32x16x1_SN_1LDSB0_AFC1_DTVSM1_EPS1_GSU1_LPA8_LPB8_MIWT1_1_PGR2_PLR2_SU4_SUS256_SRVW0_TLDS1_WG32_2_1
    SolutionIndex: 15
    SolutionNameMin: Cijk_Alik_Bljk_BBS_BH_SA_AH_MT32x32x32_MI32x32x16x1_SN_1LDSB0_AFC0_DTVSM0_EPS0_GSU2_LPA8_LPB8_MIWT1_1_PGR0_PLR2_SU4_SUS256_SRVW0_TLDS1_WG32_2_1
    SolutionIndex: 16
    SolutionNameMin: Cijk_Alik_Bljk_BBS_BH_SA_AH_MT32x32x32_MI32x32x16x1_SN_1LDSB0_AFC0_DTVSM1_EPS1_GSU3_LPA2_LPB2_MIWT1_1_PGR2_PLR2_SU0_SUS0_SRVW0_TLDS0_WG32_2_1
    SolutionIndex: 17
    SolutionNameMin: Cijk_Alik_Bljk_BBS_BH_SA_AH_MT128x128x32_MI32x32x16x1_SN_1LDSB0_AFC1_DTVSM0_EPS1_GSU1_LPA2_LPB2_MIWT2_2_PGR1_PLR2_SU4_SUS256_SRVW0_TLDS0_WG64_4_1
    SolutionIndex: 18
    SolutionNameMin: Cijk_Alik_Bljk_BBS_BH_SA_AH_MT128x128x32_MI32x32x16x1_SN_1LDSB1_AFC1_DTVSM1_EPS1_GSU1_LPA8_LPB8_MIWT2_2_PGR1_PLR0_SU0_SUS0_SRVW0_TLDS1_WG64_4_1
    SolutionIndex: 19
    SolutionNameMin: Cijk_Alik_Bljk_BBS_BH_SA_AH_MT32x32x64_MI32x32x16x1_SN_1LDSB0_AFC1_DTVSM0_EPS1_GSU1_LPA8_LPB8_MIWT1_1_PGR1_PLR0_SU0_SUS0_SRVW0_TLDS1_WG32_2_1
    SolutionIndex: 20
    SolutionNameMin: Cijk_Alik_Bljk_BBS_BH_SA_AH_MT32x32x64_MI32x32x16x1_SN_1LDSB0_AFC1_DTVSM0_EPS1_GSU1_LPA8_LPB8_MIWT1_1_PGR2_PLR0_SU0_SUS0_SRVW0_TLDS1_WG32_2_1
    SolutionIndex: 21
    SolutionNameMin: Cijk_Alik_Bljk_BBS_BH_SA_AH_MT32x32x64_MI32x32x16x1_SN_1LDSB0_AFC1_DTVSM0_EPS1_GSU1_LPA8_LPB8_MIWT1_1_PGR2_PLR1_SU0_SUS0_SRVW0_TLDS1_WG32_2_1
    SolutionIndex: 22
    SolutionNameMin: Cijk_Alik_Bljk_BBS_BH_SA_AH_MT32x32x64_MI32x32x16x1_SN_1LDSB0_AFC1_DTVSM1_EPS0_GSU1_LPA8_LPB8_MIWT1_1_PGR0_PLR0_SU0_SUS0_SRVW0_TLDS1_WG32_2_1
    SolutionIndex: 23
    SolutionNameMin: Cijk_Alik_Bljk_BBS_BH_SA_AH_MT32x32x64_MI32x32x16x1_SN_1LDSB0_AFC1_DTVSM1_EPS1_GSU1_LPA8_LPB8_MIWT1_1_PGR1_PLR0_SU0_SUS0_SRVW0_TLDS1_WG32_2_1
    SolutionIndex: 24
    SolutionNameMin: Cijk_Alik_Bljk_BBS_BH_SA_AH_MT32x32x64_MI32x32x16x1_SN_1LDSB0_AFC1_DTVSM1_EPS0_GSU1_LPA8_LPB8_MIWT1_1_PGR0_PLR1_SU0_SUS0_SRVW0_TLDS1_WG32_2_1
    SolutionIndex: 25
    SolutionNameMin: Cijk_Alik_Bljk_BBS_BH_SA_AH_MT32x32x64_MI32x32x16x1_SN_1LDSB0_AFC1_DTVSM1_EPS1_GSU1_LPA8_LPB8_MIWT1_1_PGR1_PLR1_SU0_SUS0_SRVW0_TLDS1_WG32_2_1
    SolutionIndex: 26
    SolutionNameMin: Cijk_Alik_Bljk_BBS_BH_SA_AH_MT32x32x64_MI32x32x16x1_SN_1LDSB0_AFC1_DTVSM1_EPS1_GSU1_LPA8_LPB8_MIWT1_1_PGR2_PLR1_SU0_SUS0_SRVW0_TLDS1_WG32_2_1
    SolutionIndex: 27
    SolutionNameMin: Cijk_Alik_Bljk_BBS_BH_SA_AH_MT32x32x64_MI32x32x16x1_SN_1LDSB0_AFC1_DTVSM0_EPS0_GSU1_LPA8_LPB8_MIWT1_1_PGR0_PLR0_SU4_SUS256_SRVW0_TLDS1_WG32_2_1
    SolutionIndex: 28
    SolutionNameMin: Cijk_Alik_Bljk_BBS_BH_SA_AH_MT32x32x64_MI32x32x16x1_SN_1LDSB0_AFC1_DTVSM0_EPS1_GSU1_LPA8_LPB8_MIWT1_1_PGR2_PLR0_SU4_SUS256_SRVW0_TLDS1_WG32_2_1
    SolutionIndex: 29
    SolutionNameMin: Cijk_Alik_Bljk_BBS_BH_SA_AH_MT32x32x64_MI32x32x16x1_SN_1LDSB0_AFC1_DTVSM0_EPS1_GSU1_LPA2_LPB2_MIWT1_1_PGR1_PLR1_SU4_SUS256_SRVW0_TLDS0_WG32_2_1
    SolutionIndex: 30
    SolutionNameMin: Cijk_Alik_Bljk_BBS_BH_SA_AH_MT32x32x64_MI32x32x16x1_SN_1LDSB0_AFC1_DTVSM0_EPS1_GSU1_LPA8_LPB8_MIWT1_1_PGR1_PLR1_SU4_SUS256_SRVW0_TLDS1_WG32_2_1
    SolutionIndex: 31
    SolutionNameMin: Cijk_Alik_Bljk_BBS_BH_SA_AH_MT32x32x64_MI32x32x16x1_SN_1LDSB0_AFC1_DTVSM0_EPS1_GSU1_LPA8_LPB8_MIWT1_1_PGR2_PLR1_SU4_SUS256_SRVW0_TLDS1_WG32_2_1
    SolutionIndex: 32
    SolutionNameMin: Cijk_Alik_Bljk_BBS_BH_SA_AH_MT32x32x64_MI32x32x16x1_SN_1LDSB0_AFC1_DTVSM1_EPS1_GSU1_LPA8_LPB8_MIWT1_1_PGR2_PLR1_SU4_SUS256_SRVW0_TLDS1_WG32_2_1
    SolutionIndex: 33
    SolutionNameMin: Cijk_Alik_Bljk_BBS_BH_SA_AH_MT128x128x64_MI32x32x16x1_SN_1LDSB0_AFC1_DTVSM1_EPS1_GSU1_LPA8_LPB8_MIWT2_2_PGR1_PLR1_SU4_SUS256_SRVW0_TLDS1_WG64_4_1
    SolutionIndex: 34
    SolutionNameMin: Cijk_Alik_Bljk_BBS_BH_SA_AH_MT32x32x16_MI32x32x16x1_SN_1LDSB0_AFC1_DTVSM0_EPS1_GSU1_LPA8_LPB8_MIWT1_1_PGR2_PLR0_SU0_SUS0_SRVW8_TLDS1_WG32_2_1
    SolutionIndex: 35
    SolutionNameMin: Cijk_Alik_Bljk_BBS_BH_SA_AH_MT32x32x16_MI32x32x16x1_SN_1LDSB0_AFC1_DTVSM1_EPS1_GSU1_LPA8_LPB8_MIWT1_1_PGR1_PLR0_SU0_SUS0_SRVW8_TLDS1_WG32_2_1
    SolutionIndex: 36
    SolutionNameMin: Cijk_Alik_Bljk_BBS_BH_SA_AH_MT32x32x16_MI32x32x16x1_SN_1LDSB0_AFC1_DTVSM1_EPS1_GSU1_LPA8_LPB8_MIWT1_1_PGR2_PLR1_SU0_SUS0_SRVW8_TLDS1_WG32_2_1
    SolutionIndex: 37
    SolutionNameMin: Cijk_Alik_Bljk_BBS_BH_SA_AH_MT32x32x16_MI32x32x16x1_SN_1LDSB0_AFC1_DTVSM1_EPS0_GSU1_LPA2_LPB2_MIWT1_1_PGR0_PLR0_SU4_SUS256_SRVW8_TLDS0_WG32_2_1
    SolutionIndex: 38
    SolutionNameMin: Cijk_Alik_Bljk_BBS_BH_SA_AH_MT128x128x16_MI32x32x16x1_SN_1LDSB0_AFC1_DTVSM0_EPS1_GSU1_LPA8_LPB8_MIWT2_2_PGR1_PLR0_SU4_SUS256_SRVW8_TLDS1_WG64_4_1
    SolutionIndex: 39
    SolutionNameMin: Cijk_Alik_Bljk_BBS_BH_SA_AH_MT128x128x16_MI32x32x16x1_SN_1LDSB0_AFC1_DTVSM0_EPS1_GSU1_LPA8_LPB8_MIWT2_2_PGR2_PLR0_SU4_SUS256_SRVW8_TLDS1_WG64_4_1
    SolutionIndex: 40
    SolutionNameMin: Cijk_Alik_Bljk_BBS_BH_SA_AH_MT32x32x32_MI32x32x16x1_SN_1LDSB0_AFC1_DTVSM0_EPS1_GSU1_LPA8_LPB8_MIWT1_1_PGR2_PLR0_SU0_SUS0_SRVW8_TLDS1_WG32_2_1
    SolutionIndex: 41
    SolutionNameMin: Cijk_Alik_Bljk_BBS_BH_SA_AH_MT32x32x32_MI32x32x16x1_SN_1LDSB0_AFC1_DTVSM0_EPS1_GSU1_LPA8_LPB8_MIWT1_1_PGR1_PLR2_SU0_SUS0_SRVW8_TLDS1_WG32_2_1
    SolutionIndex: 42
    SolutionNameMin: Cijk_Alik_Bljk_BBS_BH_SA_AH_MT32x32x32_MI32x32x16x1_SN_1LDSB0_AFC1_DTVSM1_EPS1_GSU1_LPA8_LPB8_MIWT1_1_PGR1_PLR2_SU0_SUS0_SRVW8_TLDS1_WG32_2_1
    SolutionIndex: 43
    SolutionNameMin: Cijk_Alik_Bljk_BBS_BH_SA_AH_MT32x32x32_MI32x32x16x1_SN_1LDSB0_AFC1_DTVSM0_EPS0_GSU1_LPA2_LPB2_MIWT1_1_PGR0_PLR0_SU4_SUS256_SRVW8_TLDS0_WG32_2_1
    SolutionIndex: 44
    SolutionNameMin: Cijk_Alik_Bljk_BBS_BH_SA_AH_MT32x32x32_MI32x32x16x1_SN_1LDSB0_AFC1_DTVSM1_EPS1_GSU1_LPA8_LPB8_MIWT1_1_PGR1_PLR1_SU4_SUS256_SRVW8_TLDS1_WG32_2_1
    SolutionIndex: 45
    SolutionNameMin: Cijk_Alik_Bljk_BBS_BH_SA_AH_MT32x32x32_MI32x32x16x1_SN_1LDSB0_AFC1_DTVSM1_EPS1_GSU1_LPA2_LPB2_MIWT1_1_PGR2_PLR2_SU4_SUS256_SRVW8_TLDS0_WG32_2_1
    SolutionIndex: 46
    SolutionNameMin: Cijk_Alik_Bljk_BBS_BH_SA_AH_MT256x256x32_MI32x32x16x1_SN_1LDSB0_AFC1_DTVSM1_EPS1_GSU1_LPA8_LPB8_MIWT2_8_PGR1_PLR1_SU4_SUS256_SRVW8_TLDS1_WG128_2_1
    SolutionIndex: 47
    SolutionNameMin: Cijk_Alik_Bljk_BBS_BH_SA_AH_MT32x32x64_MI32x32x16x1_SN_1LDSB0_AFC1_DTVSM0_EPS1_GSU1_LPA8_LPB8_MIWT1_1_PGR1_PLR0_SU0_SUS0_SRVW8_TLDS1_WG32_2_1
    SolutionIndex: 48
    SolutionNameMin: Cijk_Alik_Bljk_BBS_BH_SA_AH_MT32x32x64_MI32x32x16x1_SN_1LDSB0_AFC1_DTVSM0_EPS0_GSU1_LPA8_LPB8_MIWT1_1_PGR0_PLR1_SU0_SUS0_SRVW8_TLDS1_WG32_2_1
    SolutionIndex: 49
    SolutionNameMin: Cijk_Alik_Bljk_BBS_BH_SA_AH_MT32x32x64_MI32x32x16x1_SN_1LDSB0_AFC1_DTVSM0_EPS1_GSU1_LPA8_LPB8_MIWT1_1_PGR2_PLR1_SU0_SUS0_SRVW8_TLDS1_WG32_2_1
    SolutionIndex: 50
    SolutionNameMin: Cijk_Alik_Bljk_BBS_BH_SA_AH_MT32x32x64_MI32x32x16x1_SN_1LDSB0_AFC1_DTVSM1_EPS1_GSU1_LPA8_LPB8_MIWT1_1_PGR1_PLR0_SU0_SUS0_SRVW8_TLDS1_WG32_2_1
    SolutionIndex: 51
    SolutionNameMin: Cijk_Alik_Bljk_BBS_BH_SA_AH_MT32x32x64_MI32x32x16x1_SN_1LDSB0_AFC1_DTVSM1_EPS1_GSU1_LPA8_LPB8_MIWT1_1_PGR2_PLR1_SU0_SUS0_SRVW8_TLDS1_WG32_2_1
    SolutionIndex: 52
    SolutionNameMin: Cijk_Alik_Bljk_BBS_BH_SA_AH_MT32x32x64_MI32x32x16x1_SN_1LDSB0_AFC1_DTVSM0_EPS1_GSU1_LPA8_LPB8_MIWT1_1_PGR1_PLR0_SU4_SUS256_SRVW8_TLDS1_WG32_2_1
    SolutionIndex: 53
    SolutionNameMin: Cijk_Alik_Bljk_BBS_BH_SA_AH_MT32x32x64_MI32x32x16x1_SN_1LDSB0_AFC1_DTVSM0_EPS1_GSU1_LPA8_LPB8_MIWT1_1_PGR2_PLR1_SU4_SUS256_SRVW8_TLDS1_WG32_2_1
    SolutionIndex: 54
    SolutionNameMin: Cijk_Alik_Bljk_BBS_BH_SA_AH_MT32x32x64_MI32x32x16x1_SN_1LDSB0_AFC1_DTVSM1_EPS0_GSU1_LPA8_LPB8_MIWT1_1_PGR0_PLR1_SU4_SUS256_SRVW8_TLDS1_WG32_2_1
- - - [15, 15, 1, 16, 15, 15, 16, 16]
    - [3, 0.481831]
  - - [15, 15, 1, 32, 15, 15, 32, 32]
    - [5, 0.966248]
  - - [15, 15, 1, 64, 15, 15, 64, 64]
    - [0, 1.95347]
  - - [15, 15, 1, 96, 15, 15, 96, 96]
    - [10, 2.95445]
  - - [15, 15, 1, 128, 15, 15, 128, 128]
    - [25, 3.78375]
  - - [15, 15, 1, 136, 15, 15, 136, 136]
    - [24, 3.6812]
  - - [15, 15, 1, 256, 15, 15, 256, 256]
    - [32, 6.76612]
  - - [15, 15, 1, 264, 15, 15, 264, 264]
    - [25, 6.8014]
  - - [15, 15, 1, 528, 15, 15, 528, 528]
    - [25, 11.815]
  - - [15, 15, 1, 544, 15, 15, 544, 544]
    - [26, 12.2455]
  - - [15, 15, 1, 576, 15, 15, 576, 576]
    - [28, 13.5927]
  - - [15, 15, 1, 608, 15, 15, 608, 608]
    - [11, 13.0584]
  - - [15, 15, 1, 640, 15, 15, 640, 640]
    - [32, 14.6416]
  - - [15, 15, 1, 768, 15, 15, 768, 768]
    - [31, 16.7191]
  - - [15, 15, 1, 776, 15, 15, 776, 776]
    - [26, 15.9357]
  - - [32, 32, 1, 16, 32, 32, 16, 16]
    - [1, 2.64728]
  - - [32, 32, 1, 32, 32, 32, 32, 32]
    - [10, 5.56427]
  - - [32, 32, 1, 64, 32, 32, 64, 64]
    - [27, 10.4866]
  - - [32, 32, 1, 96, 32, 32, 96, 96]
    - [10, 15.147]
  - - [32, 32, 1, 128, 32, 32, 128, 128]
    - [25, 19.7695]
  - - [32, 32, 1, 136, 32, 32, 136, 136]
    - [10, 19.5294]
  - - [32, 32, 1, 256, 32, 32, 256, 256]
    - [20, 36.4545]
  - - [32, 32, 1, 264, 32, 32, 264, 264]
    - [23, 35.2367]
  - - [32, 32, 1, 528, 32, 32, 528, 528]
    - [21, 60.2487]
  - - [32, 32, 1, 544, 32, 32, 544, 544]
    - [20, 62.0744]
  - - [32, 32, 1, 576, 32, 32, 576, 576]
    - [21, 68.003]
  - - [32, 32, 1, 608, 32, 32, 608, 608]
    - [51, 67.1294]
  - - [32, 32, 1, 640, 32, 32, 640, 640]
    - [20, 78.0841]
  - - [32, 32, 1, 768, 32, 32, 768, 768]
    - [26, 85.9113]
  - - [32, 32, 1, 776, 32, 32, 776, 776]
    - [26, 82.4727]
  - - [256, 256, 1, 16, 256, 256, 16, 16]
    - [35, 153.514]
  - - [256, 256, 1, 24, 256, 256, 24, 24]
    - [45, 200.314]
  - - [256, 256, 1, 32, 256, 256, 32, 32]
    - [38, 171.357]
  - - [256, 256, 1, 64, 256, 256, 64, 64]
    - [37, 543.902]
  - - [256, 256, 1, 96, 256, 256, 96, 96]
    - [11, 907.727]
  - - [256, 256, 1, 128, 256, 256, 128, 128]
    - [36, 1196.58]
  - - [256, 256, 1, 136, 256, 256, 136, 136]
    - [41, 1189.73]
  - - [256, 256, 1, 256, 256, 256, 256, 256]
    - [10, 2301.24]
  - - [256, 256, 1, 264, 256, 256, 264, 264]
    - [34, 1963.07]
  - - [256, 256, 1, 280, 256, 256, 280, 280]
    - [53, 1987.23]
  - - [256, 256, 1, 296, 256, 256, 296, 296]
    - [13, 2252.12]
  - - [256, 256, 1, 528, 256, 256, 528, 528]
    - [23, 3838.81]
  - - [256, 256, 1, 544, 256, 256, 544, 544]
    - [9, 3981.86]
  - - [256, 256, 1, 576, 256, 256, 576, 576]
    - [14, 4114.75]
  - - [256, 256, 1, 608, 256, 256, 608, 608]
    - [40, 4214.49]
  - - [256, 256, 1, 640, 256, 256, 640, 640]
    - [31, 4663.45]
  - - [256, 256, 1, 768, 256, 256, 768, 768]
    - [23, 5346.18]
  - - [256, 256, 1, 776, 256, 256, 776, 776]
    - [11, 4710.41]
  - - [256, 256, 1, 792, 256, 256, 792, 792]
    - [49, 5121.06]
  - - [256, 256, 1, 808, 256, 256, 808, 808]
    - [36, 3582.15]
  - - [255, 255, 1, 16, 255, 255, 16, 16]
    - [39, 46.7511]
  - - [255, 255, 1, 32, 255, 255, 32, 32]
    - [46, 29.7567]
  - - [255, 255, 1, 64, 255, 255, 64, 64]
    - [23, 450.682]
  - - [255, 255, 1, 96, 255, 255, 96, 96]
    - [42, 676.023]
  - - [255, 255, 1, 128, 255, 255, 128, 128]
    - [8, 913.232]
  - - [255, 255, 1, 136, 255, 255, 136, 136]
    - [22, 921.716]
  - - [255, 255, 1, 256, 255, 255, 256, 256]
    - [40, 1585.98]
  - - [255, 255, 1, 264, 255, 255, 264, 264]
    - [30, 1538.57]
  - - [255, 255, 1, 528, 255, 255, 528, 528]
    - [22, 2760.13]
  - - [255, 255, 1, 544, 255, 255, 544, 544]
    - [12, 2895.09]
  - - [255, 255, 1, 576, 255, 255, 576, 576]
    - [2, 2846.08]
  - - [255, 255, 1, 608, 255, 255, 608, 608]
    - [44, 2844.05]
  - - [255, 255, 1, 640, 255, 255, 640, 640]
    - [48, 3422.79]
  - - [255, 255, 1, 768, 255, 255, 768, 768]
    - [47, 4162.29]
  - - [255, 255, 1, 776, 255, 255, 776, 776]
    - [54, 3588.48]
  - - [264, 264, 1, 16, 264, 264, 16, 16]
    - [18, 62.4132]
  - - [264, 264, 1, 32, 264, 264, 32, 32]
    - [29, 236.395]
  - - [264, 264, 1, 64, 264, 264, 64, 64]
    - [43, 447.172]
  - - [264, 264, 1, 96, 264, 264, 96, 96]
    - [6, 890.802]
  - - [264, 264, 1, 128, 264, 264, 128, 128]
    - [17, 424.561]
  - - [264, 264, 1, 136, 264, 264, 136, 136]
    - [9, 1073.04]
  - - [264, 264, 1, 256, 264, 264, 256, 256]
    - [4, 717.764]
  - - [264, 264, 1, 264, 264, 264, 264, 264]
    - [33, 910.383]
  - - [264, 264, 1, 528, 264, 264, 528, 528]
    - [50, 2992.19]
  - - [264, 264, 1, 544, 264, 264, 544, 544]
    - [15, 2136.4]
  - - [264, 264, 1, 576, 264, 264, 576, 576]
    - [19, 4192.9]
  - - [264, 264, 1, 608, 264, 264, 608, 608]
    - [7, 3924.9]
  - - [264, 264, 1, 640, 264, 264, 640, 640]
    - [14, 4349.42]
  - - [264, 264, 1, 768, 264, 264, 768, 768]
    - [16, 2648.39]
  - - [264, 264, 1, 776, 264, 264, 776, 776]
    - [52, 3422.29]
- null
- null
- DeviceEfficiency
