library/src/hcc_detail/rocsparselt/src/spmm/Tensile/Logic/aquavanjaram/aquavanjaram_Cijk_Ailk_Bjlk_I8I8S_BH_SA_AH.yaml
- {MinimumRequiredVersion: 4.33.0}
- aquavanjaram
- gfx940
- [Device 0049, Device 0050]
    SolutionIndex: 0
    SolutionNameMin: Cijk_Ailk_Bjlk_I8I8S_BH_SA_AH_MT32x32x32_MI32x32x32x1_SN_1LDSB0_AFC1_DTVSM0_EPS0_GRVW8_GSU1_MIWT1_1_PGR0_PLR0_SU0_SUS0_SRVW0_WG32_2_1
    SolutionIndex: 1
    SolutionNameMin: Cijk_Ailk_Bjlk_I8I8S_BH_SA_AH_MT32x32x32_MI32x32x32x1_SN_1LDSB0_AFC1_DTVSM0_EPS0_GRVW16_GSU1_MIWT1_1_PGR0_PLR0_SU0_SUS0_SRVW0_WG32_2_1
    SolutionIndex: 2
    SolutionNameMin: Cijk_Ailk_Bjlk_I8I8S_BH_SA_AH_MT32x32x32_MI32x32x32x1_SN_1LDSB0_AFC1_DTVSM0_EPS0_GRVW16_GSU1_MIWT1_1_PGR0_PLR1_SU0_SUS0_SRVW0_WG32_2_1
    SolutionIndex: 3
    SolutionNameMin: Cijk_Ailk_Bjlk_I8I8S_BH_SA_AH_MT32x32x32_MI32x32x32x1_SN_1LDSB0_AFC1_DTVSM0_EPS1_GRVW8_GSU1_MIWT1_1_PGR2_PLR1_SU0_SUS0_SRVW0_WG32_2_1
    SolutionIndex: 4
    SolutionNameMin: Cijk_Ailk_Bjlk_I8I8S_BH_SA_AH_MT32x32x32_MI32x32x32x1_SN_1LDSB0_AFC1_DTVSM1_EPS0_GRVW8_GSU1_MIWT1_1_PGR0_PLR0_SU0_SUS0_SRVW0_WG32_2_1
    SolutionIndex: 5
    SolutionNameMin: Cijk_Ailk_Bjlk_I8I8S_BH_SA_AH_MT32x32x32_MI32x32x32x1_SN_1LDSB0_AFC1_DTVSM1_EPS0_GRVW16_GSU1_MIWT1_1_PGR0_PLR0_SU0_SUS0_SRVW0_WG32_2_1
    SolutionIndex: 6
    SolutionNameMin: Cijk_Ailk_Bjlk_I8I8S_BH_SA_AH_MT32x32x32_MI32x32x32x1_SN_1LDSB0_AFC1_DTVSM1_EPS1_GRVW8_GSU1_MIWT1_1_PGR1_PLR0_SU0_SUS0_SRVW0_WG32_2_1
    SolutionIndex: 7
    SolutionNameMin: Cijk_Ailk_Bjlk_I8I8S_BH_SA_AH_MT32x32x32_MI32x32x32x1_SN_1LDSB0_AFC1_DTVSM1_EPS1_GRVW8_GSU1_MIWT1_1_PGR2_PLR0_SU0_SUS0_SRVW0_WG32_2_1
    SolutionIndex: 8
    SolutionNameMin: Cijk_Ailk_Bjlk_I8I8S_BH_SA_AH_MT32x32x32_MI32x32x32x1_SN_1LDSB0_AFC1_DTVSM1_EPS1_GRVW16_GSU1_MIWT1_1_PGR2_PLR0_SU0_SUS0_SRVW0_WG32_2_1
    SolutionIndex: 9
    SolutionNameMin: Cijk_Ailk_Bjlk_I8I8S_BH_SA_AH_MT32x32x32_MI32x32x32x1_SN_1LDSB0_AFC1_DTVSM1_EPS0_GRVW8_GSU1_MIWT1_1_PGR0_PLR1_SU0_SUS0_SRVW0_WG32_2_1
    SolutionIndex: 10
    SolutionNameMin: Cijk_Ailk_Bjlk_I8I8S_BH_SA_AH_MT32x32x32_MI32x32x32x1_SN_1LDSB0_AFC1_DTVSM1_EPS0_GRVW16_GSU1_MIWT1_1_PGR0_PLR1_SU0_SUS0_SRVW0_WG32_2_1
    SolutionIndex: 11
    SolutionNameMin: Cijk_Ailk_Bjlk_I8I8S_BH_SA_AH_MT32x32x32_MI32x32x32x1_SN_1LDSB0_AFC1_DTVSM1_EPS1_GRVW8_GSU1_MIWT1_1_PGR2_PLR1_SU0_SUS0_SRVW0_WG32_2_1
    SolutionIndex: 12
    SolutionNameMin: Cijk_Ailk_Bjlk_I8I8S_BH_SA_AH_MT32x32x32_MI32x32x32x1_SN_1LDSB0_AFC1_DTVSM1_EPS1_GRVW16_GSU1_MIWT1_1_PGR2_PLR1_SU0_SUS0_SRVW0_WG32_2_1
    SolutionIndex: 13
    SolutionNameMin: Cijk_Ailk_Bjlk_I8I8S_BH_SA_AH_MT32x32x32_MI32x32x32x1_SN_1LDSB0_AFC1_DTVSM0_EPS0_GRVW8_GSU1_MIWT1_1_PGR0_PLR0_SU4_SUS256_SRVW0_WG32_2_1
    SolutionIndex: 14
    SolutionNameMin: Cijk_Ailk_Bjlk_I8I8S_BH_SA_AH_MT32x32x32_MI32x32x32x1_SN_1LDSB0_AFC1_DTVSM0_EPS0_GRVW16_GSU1_MIWT1_1_PGR0_PLR0_SU4_SUS256_SRVW0_WG32_2_1
    SolutionIndex: 15
    SolutionNameMin: Cijk_Ailk_Bjlk_I8I8S_BH_SA_AH_MT32x32x32_MI32x32x32x1_SN_1LDSB0_AFC1_DTVSM0_EPS1_GRVW8_GSU1_MIWT1_1_PGR2_PLR1_SU4_SUS256_SRVW0_WG32_2_1
    SolutionIndex: 16
    SolutionNameMin: Cijk_Ailk_Bjlk_I8I8S_BH_SA_AH_MT32x32x32_MI32x32x32x1_SN_1LDSB0_AFC1_DTVSM1_EPS0_GRVW16_GSU1_MIWT1_1_PGR0_PLR1_SU4_SUS256_SRVW0_WG32_2_1
    SolutionIndex: 17
    SolutionNameMin: Cijk_Ailk_Bjlk_I8I8S_BH_SA_AH_MT32x32x32_MI32x32x32x1_SN_1LDSB0_AFC1_DTVSM1_EPS1_GRVW8_GSU1_MIWT1_1_PGR1_PLR1_SU4_SUS256_SRVW0_WG32_2_1
    SolutionIndex: 18
    SolutionNameMin: Cijk_Ailk_Bjlk_I8I8S_BH_SA_AH_MT32x32x64_MI32x32x32x1_SN_1LDSB0_AFC1_DTVSM0_EPS0_GRVW8_GSU1_MIWT1_1_PGR0_PLR1_SU0_SUS0_SRVW0_WG32_2_1
    SolutionIndex: 19
    SolutionNameMin: Cijk_Ailk_Bjlk_I8I8S_BH_SA_AH_MT32x32x64_MI32x32x32x1_SN_1LDSB0_AFC1_DTVSM0_EPS0_GRVW16_GSU1_MIWT1_1_PGR0_PLR1_SU0_SUS0_SRVW0_WG32_2_1
    SolutionIndex: 20
    SolutionNameMin: Cijk_Ailk_Bjlk_I8I8S_BH_SA_AH_MT32x32x64_MI32x32x32x1_SN_1LDSB0_AFC1_DTVSM0_EPS1_GRVW16_GSU1_MIWT1_1_PGR1_PLR2_SU0_SUS0_SRVW0_WG32_2_1
    SolutionIndex: 21
    SolutionNameMin: Cijk_Ailk_Bjlk_I8I8S_BH_SA_AH_MT32x32x64_MI32x32x32x1_SN_1LDSB0_AFC1_DTVSM1_EPS0_GRVW16_GSU1_MIWT1_1_PGR0_PLR0_SU0_SUS0_SRVW0_WG32_2_1
    SolutionIndex: 22
    SolutionNameMin: Cijk_Ailk_Bjlk_I8I8S_BH_SA_AH_MT32x32x64_MI32x32x32x1_SN_1LDSB0_AFC1_DTVSM1_EPS0_GRVW8_GSU1_MIWT1_1_PGR0_PLR1_SU0_SUS0_SRVW0_WG32_2_1
    SolutionIndex: 23
    SolutionNameMin: Cijk_Ailk_Bjlk_I8I8S_BH_SA_AH_MT32x32x64_MI32x32x32x1_SN_1LDSB0_AFC1_DTVSM1_EPS0_GRVW16_GSU1_MIWT1_1_PGR0_PLR1_SU0_SUS0_SRVW0_WG32_2_1
    SolutionIndex: 24
    SolutionNameMin: Cijk_Ailk_Bjlk_I8I8S_BH_SA_AH_MT32x32x64_MI32x32x32x1_SN_1LDSB0_AFC1_DTVSM1_EPS1_GRVW8_GSU1_MIWT1_1_PGR2_PLR1_SU0_SUS0_SRVW0_WG32_2_1
    SolutionIndex: 25
    SolutionNameMin: Cijk_Ailk_Bjlk_I8I8S_BH_SA_AH_MT32x32x64_MI32x32x32x1_SN_1LDSB0_AFC1_DTVSM1_EPS1_GRVW16_GSU1_MIWT1_1_PGR1_PLR2_SU0_SUS0_SRVW0_WG32_2_1
    SolutionIndex: 26
    SolutionNameMin: Cijk_Ailk_Bjlk_I8I8S_BH_SA_AH_MT32x32x64_MI32x32x32x1_SN_1LDSB0_AFC1_DTVSM0_EPS0_GRVW8_GSU1_MIWT1_1_PGR0_PLR0_SU4_SUS256_SRVW0_WG32_2_1
    SolutionIndex: 27
    SolutionNameMin: Cijk_Ailk_Bjlk_I8I8S_BH_SA_AH_MT32x32x64_MI32x32x32x1_SN_1LDSB0_AFC1_DTVSM0_EPS1_GRVW8_GSU1_MIWT1_1_PGR1_PLR0_SU4_SUS256_SRVW0_WG32_2_1
    SolutionIndex: 28
    SolutionNameMin: Cijk_Ailk_Bjlk_I8I8S_BH_SA_AH_MT32x32x64_MI32x32x32x1_SN_1LDSB0_AFC1_DTVSM0_EPS0_GRVW16_GSU1_MIWT1_1_PGR0_PLR2_SU4_SUS256_SRVW0_WG32_2_1
    SolutionIndex: 29
    SolutionNameMin: Cijk_Ailk_Bjlk_I8I8S_BH_SA_AH_MT32x32x64_MI32x32x32x1_SN_1LDSB0_AFC1_DTVSM1_EPS0_GRVW16_GSU1_MIWT1_1_PGR0_PLR1_SU4_SUS256_SRVW0_WG32_2_1
    SolutionIndex: 30
    SolutionNameMin: Cijk_Ailk_Bjlk_I8I8S_BH_SA_AH_MT32x32x64_MI32x32x32x1_SN_1LDSB0_AFC1_DTVSM1_EPS0_GRVW8_GSU1_MIWT1_1_PGR0_PLR2_SU4_SUS256_SRVW0_WG32_2_1
    SolutionIndex: 31
    SolutionNameMin: Cijk_Ailk_Bjlk_I8I8S_BH_SA_AH_MT32x32x128_MI32x32x32x1_SN_1LDSB0_AFC1_DTVSM0_EPS0_GRVW16_GSU1_MIWT1_1_PGR0_PLR1_SU0_SUS0_SRVW0_WG32_2_1
    SolutionIndex: 32
    SolutionNameMin: Cijk_Ailk_Bjlk_I8I8S_BH_SA_AH_MT32x32x128_MI32x32x32x1_SN_1LDSB0_AFC1_DTVSM1_EPS0_GRVW16_GSU1_MIWT1_1_PGR0_PLR1_SU0_SUS0_SRVW0_WG32_2_1
    SolutionIndex: 33
    SolutionNameMin: Cijk_Ailk_Bjlk_I8I8S_BH_SA_AH_MT32x32x128_MI32x32x32x1_SN_1LDSB0_AFC1_DTVSM0_EPS0_GRVW8_GSU1_MIWT1_1_PGR0_PLR0_SU4_SUS256_SRVW0_WG32_2_1
    SolutionIndex: 34
    SolutionNameMin: Cijk_Ailk_Bjlk_I8I8S_BH_SA_AH_MT32x32x32_MI32x32x32x1_SN_1LDSB0_AFC1_DTVSM0_EPS0_GRVW8_GSU1_MIWT1_1_PGR0_PLR1_SU0_SUS0_SRVW8_WG32_2_1
    SolutionIndex: 35
    SolutionNameMin: Cijk_Ailk_Bjlk_I8I8S_BH_SA_AH_MT32x32x32_MI32x32x32x1_SN_1LDSB0_AFC1_DTVSM0_EPS1_GRVW16_GSU1_MIWT1_1_PGR2_PLR1_SU0_SUS0_SRVW8_WG32_2_1
    SolutionIndex: 36
    SolutionNameMin: Cijk_Ailk_Bjlk_I8I8S_BH_SA_AH_MT32x32x32_MI32x32x32x1_SN_1LDSB0_AFC1_DTVSM1_EPS0_GRVW16_GSU1_MIWT1_1_PGR0_PLR0_SU0_SUS0_SRVW8_WG32_2_1
    SolutionIndex: 37
    SolutionNameMin: Cijk_Ailk_Bjlk_I8I8S_BH_SA_AH_MT32x32x32_MI32x32x32x1_SN_1LDSB0_AFC1_DTVSM1_EPS1_GRVW8_GSU1_MIWT1_1_PGR2_PLR0_SU0_SUS0_SRVW8_WG32_2_1
- - - [15, 15, 1, 16, 15, 15, 15, 15]
    - [3, 0.379967]
  - - [15, 15, 1, 32, 15, 15, 15, 15]
    - [17, 0.847757]
  - - [15, 15, 1, 64, 15, 15, 15, 15]
    - [9, 1.61553]
  - - [15, 15, 1, 96, 15, 15, 15, 15]
    - [3, 2.30905]
  - - [15, 15, 1, 128, 15, 15, 15, 15]
    - [30, 3.04617]
  - - [15, 15, 1, 136, 15, 15, 15, 15]
    - [9, 2.81341]
  - - [15, 15, 1, 256, 15, 15, 15, 15]
    - [3, 5.64955]
  - - [15, 15, 1, 264, 15, 15, 15, 15]
    - [7, 5.32401]
  - - [15, 15, 1, 528, 15, 15, 15, 15]
    - [15, 8.86534]
  - - [15, 15, 1, 544, 15, 15, 15, 15]
    - [7, 10.4997]
  - - [15, 15, 1, 576, 15, 15, 15, 15]
    - [27, 11.0793]
  - - [15, 15, 1, 608, 15, 15, 15, 15]
    - [15, 10.6879]
  - - [15, 15, 1, 640, 15, 15, 15, 15]
    - [7, 12.1233]
  - - [15, 15, 1, 768, 15, 15, 15, 15]
    - [24, 13.6068]
  - - [15, 15, 1, 776, 15, 15, 15, 15]
    - [11, 12.3641]
  - - [32, 32, 1, 16, 32, 32, 32, 32]
    - [12, 2.1639]
  - - [32, 32, 1, 32, 32, 32, 32, 32]
    - [4, 4.86858]
  - - [32, 32, 1, 64, 32, 32, 32, 32]
    - [27, 9.48354]
  - - [32, 32, 1, 96, 32, 32, 32, 32]
    - [2, 13.0871]
  - - [32, 32, 1, 128, 32, 32, 32, 32]
    - [21, 17.8791]
  - - [32, 32, 1, 136, 32, 32, 32, 32]
    - [12, 16.0934]
  - - [32, 32, 1, 256, 32, 32, 32, 32]
    - [23, 31.9201]
  - - [32, 32, 1, 264, 32, 32, 32, 32]
    - [8, 28.961]
  - - [32, 32, 1, 528, 32, 32, 32, 32]
    - [12, 51.5097]
  - - [32, 32, 1, 544, 32, 32, 32, 32]
    - [8, 56.2967]
  - - [32, 32, 1, 576, 32, 32, 32, 32]
    - [20, 60.5911]
  - - [32, 32, 1, 608, 32, 32, 32, 32]
    - [12, 60.8238]
  - - [32, 32, 1, 640, 32, 32, 32, 32]
    - [27, 63.9002]
  - - [32, 32, 1, 768, 32, 32, 32, 32]
    - [32, 73.3886]
  - - [32, 32, 1, 776, 32, 32, 32, 32]
    - [37, 66.1167]
  - - [256, 256, 1, 16, 256, 256, 256, 256]
    - [5, 143.033]
  - - [256, 256, 1, 24, 256, 256, 256, 256]
    - [36, 213.385]
  - - [256, 256, 1, 32, 256, 256, 256, 256]
    - [5, 322.143]
  - - [256, 256, 1, 64, 256, 256, 256, 256]
    - [16, 623.179]
  - - [256, 256, 1, 96, 256, 256, 256, 256]
    - [34, 877.347]
  - - [256, 256, 1, 128, 256, 256, 256, 256]
    - [0, 1150.54]
  - - [256, 256, 1, 136, 256, 256, 256, 256]
    - [10, 1064.48]
  - - [256, 256, 1, 256, 256, 256, 256, 256]
    - [26, 2037.8]
  - - [256, 256, 1, 264, 256, 256, 256, 256]
    - [1, 1890.15]
  - - [256, 256, 1, 280, 256, 256, 256, 256]
    - [23, 1904.62]
  - - [256, 256, 1, 296, 256, 256, 256, 256]
    - [16, 1992.77]
  - - [256, 256, 1, 528, 256, 256, 256, 256]
    - [12, 3235.14]
  - - [256, 256, 1, 544, 256, 256, 256, 256]
    - [37, 3552.55]
  - - [256, 256, 1, 576, 256, 256, 256, 256]
    - [18, 3901.68]
  - - [256, 256, 1, 608, 256, 256, 256, 256]
    - [15, 3753.38]
  - - [256, 256, 1, 640, 256, 256, 256, 256]
    - [22, 4162.87]
  - - [256, 256, 1, 768, 256, 256, 256, 256]
    - [31, 4610.39]
  - - [256, 256, 1, 776, 256, 256, 256, 256]
    - [12, 4210.45]
  - - [256, 256, 1, 792, 256, 256, 256, 256]
    - [35, 4220.22]
  - - [256, 256, 1, 808, 256, 256, 256, 256]
    - [37, 4312.67]
  - - [255, 255, 1, 16, 255, 255, 255, 255]
    - [5, 115.427]
  - - [255, 255, 1, 32, 255, 255, 255, 255]
    - [6, 245.58]
  - - [255, 255, 1, 64, 255, 255, 255, 255]
    - [4, 472.185]
  - - [255, 255, 1, 96, 255, 255, 255, 255]
    - [13, 665.927]
  - - [255, 255, 1, 128, 255, 255, 255, 255]
    - [22, 876.634]
  - - [255, 255, 1, 136, 255, 255, 255, 255]
    - [6, 839.351]
  - - [255, 255, 1, 256, 255, 255, 255, 255]
    - [22, 1613.73]
  - - [255, 255, 1, 264, 255, 255, 255, 255]
    - [13, 1482.76]
  - - [255, 255, 1, 528, 255, 255, 255, 255]
    - [12, 2641.12]
  - - [255, 255, 1, 544, 255, 255, 255, 255]
    - [12, 2895.09]
  - - [255, 255, 1, 576, 255, 255, 255, 255]
    - [12, 3030.54]
  - - [255, 255, 1, 608, 255, 255, 255, 255]
    - [15, 3183.44]
  - - [255, 255, 1, 640, 255, 255, 255, 255]
    - [18, 3324.23]
  - - [255, 255, 1, 768, 255, 255, 255, 255]
    - [24, 3806.34]
  - - [255, 255, 1, 776, 255, 255, 255, 255]
    - [11, 3474.57]
  - - [264, 264, 1, 16, 264, 264, 264, 264]
    - [6, 126.239]
  - - [264, 264, 1, 32, 264, 264, 264, 264]
    - [6, 267.643]
  - - [264, 264, 1, 64, 264, 264, 264, 264]
    - [28, 514.273]
  - - [264, 264, 1, 96, 264, 264, 264, 264]
    - [14, 742.269]
  - - [264, 264, 1, 128, 264, 264, 264, 264]
    - [19, 972.432]
  - - [264, 264, 1, 136, 264, 264, 264, 264]
    - [14, 938.899]
  - - [264, 264, 1, 256, 264, 264, 264, 264]
    - [22, 1821.56]
  - - [264, 264, 1, 264, 264, 264, 264, 264]
    - [5, 1640.34]
  - - [264, 264, 1, 528, 264, 264, 264, 264]
    - [12, 2906.98]
  - - [264, 264, 1, 544, 264, 264, 264, 264]
    - [12, 3154.82]
  - - [264, 264, 1, 576, 264, 264, 264, 264]
    - [28, 3479.51]
  - - [264, 264, 1, 608, 264, 264, 264, 264]
    - [12, 3451.17]
  - - [264, 264, 1, 640, 264, 264, 264, 264]
    - [29, 3717.58]
  - - [264, 264, 1, 768, 264, 264, 264, 264]
    - [33, 4228.17]
  - - [264, 264, 1, 776, 264, 264, 264, 264]
    - [25, 3755.32]
- null
- null
- DeviceEfficiency
