library/src/hcc_detail/rocsparselt/src/spmm/Tensile/Logic/aquavanjaram/aquavanjaram_Cijk_Alik_Bljk_I8I8S_BH_SA_AH.yaml
- {MinimumRequiredVersion: 4.33.0}
- aquavanjaram
- gfx940
- [Device 0049, Device 0050]
    SolutionIndex: 0
    SolutionNameMin: Cijk_Alik_Bljk_I8I8S_BH_SA_AH_MT32x32x32_MI32x32x32x1_SN_1LDSB0_GRVW8_LPA8_LPB16_MIWT1_1_PGR1_PLR1_SU4_TLDS1_WG32_2_1_WGM12
    SolutionIndex: 1
    SolutionNameMin: Cijk_Alik_Bljk_I8I8S_BH_SA_AH_MT32x32x32_MI32x32x32x1_SN_1LDSB0_GRVW16_LPA16_LPB16_MIWT1_1_PGR2_PLR1_SU4_TLDS1_WG32_2_1_WGM12
    SolutionIndex: 2
    SolutionNameMin: Cijk_Alik_Bljk_I8I8S_BH_SA_AH_MT32x32x32_MI32x32x32x1_SN_1LDSB0_GRVW16_LPA16_LPB16_MIWT1_1_PGR1_PLR1_SU8_TLDS1_WG32_2_1_WGM12
    SolutionIndex: 3
    SolutionNameMin: Cijk_Alik_Bljk_I8I8S_BH_SA_AH_MT32x32x32_MI32x32x32x1_SN_1LDSB0_GRVW8_LPA8_LPB16_MIWT1_1_PGR2_PLR1_SU8_TLDS1_WG32_2_1_WGM12
    SolutionIndex: 4
    SolutionNameMin: Cijk_Alik_Bljk_I8I8S_BH_SA_AH_MT32x32x32_MI32x32x32x1_SN_1LDSB0_GRVW16_LPA16_LPB16_MIWT1_1_PGR2_PLR1_SU8_TLDS1_WG32_2_1_WGM12
    SolutionIndex: 5
    SolutionNameMin: Cijk_Alik_Bljk_I8I8S_BH_SA_AH_MT32x32x32_MI32x32x32x1_SN_1LDSB0_GRVW8_LPA8_LPB16_MIWT1_1_PGR1_PLR1_SU4_TLDS1_WG32_2_1_WGM18
    SolutionIndex: 6
    SolutionNameMin: Cijk_Alik_Bljk_I8I8S_BH_SA_AH_MT32x32x32_MI32x32x32x1_SN_1LDSB0_GRVW16_LPA16_LPB16_MIWT1_1_PGR1_PLR1_SU4_TLDS1_WG32_2_1_WGM18
    SolutionIndex: 7
    SolutionNameMin: Cijk_Alik_Bljk_I8I8S_BH_SA_AH_MT32x32x32_MI32x32x32x1_SN_1LDSB0_GRVW8_LPA8_LPB16_MIWT1_1_PGR1_PLR1_SU8_TLDS1_WG32_2_1_WGM18
    SolutionIndex: 8
    SolutionNameMin: Cijk_Alik_Bljk_I8I8S_BH_SA_AH_MT32x32x32_MI32x32x32x1_SN_1LDSB0_GRVW16_LPA16_LPB16_MIWT1_1_PGR1_PLR1_SU8_TLDS1_WG32_2_1_WGM18
    SolutionIndex: 9
    SolutionNameMin: Cijk_Alik_Bljk_I8I8S_BH_SA_AH_MT32x32x32_MI32x32x32x1_SN_1LDSB0_GRVW16_LPA16_LPB16_MIWT1_1_PGR2_PLR1_SU8_TLDS1_WG32_2_1_WGM18
    SolutionIndex: 10
    SolutionNameMin: Cijk_Alik_Bljk_I8I8S_BH_SA_AH_MT32x32x32_MI32x32x32x1_SN_1LDSB0_GRVW8_LPA8_LPB16_MIWT1_1_PGR1_PLR1_SU4_TLDS1_WG32_2_1_WGM19
    SolutionIndex: 11
    SolutionNameMin: Cijk_Alik_Bljk_I8I8S_BH_SA_AH_MT32x32x32_MI32x32x32x1_SN_1LDSB0_GRVW8_LPA8_LPB16_MIWT1_1_PGR2_PLR1_SU4_TLDS1_WG32_2_1_WGM19
    SolutionIndex: 12
    SolutionNameMin: Cijk_Alik_Bljk_I8I8S_BH_SA_AH_MT32x32x32_MI32x32x32x1_SN_1LDSB0_GRVW16_LPA16_LPB16_MIWT1_1_PGR1_PLR1_SU8_TLDS1_WG32_2_1_WGM19
    SolutionIndex: 13
    SolutionNameMin: Cijk_Alik_Bljk_I8I8S_BH_SA_AH_MT32x32x32_MI32x32x32x1_SN_1LDSB0_GRVW16_LPA16_LPB16_MIWT1_1_PGR2_PLR1_SU8_TLDS1_WG32_2_1_WGM19
    SolutionIndex: 14
    SolutionNameMin: Cijk_Alik_Bljk_I8I8S_BH_SA_AH_MT32x32x64_MI32x32x32x1_SN_1LDSB0_GRVW16_LPA16_LPB16_MIWT1_1_PGR2_PLR1_SU4_TLDS1_WG32_2_1_WGM12
    SolutionIndex: 15
    SolutionNameMin: Cijk_Alik_Bljk_I8I8S_BH_SA_AH_MT32x32x64_MI32x32x32x1_SN_1LDSB0_GRVW8_LPA8_LPB16_MIWT1_1_PGR2_PLR3_SU4_TLDS1_WG32_2_1_WGM12
    SolutionIndex: 16
    SolutionNameMin: Cijk_Alik_Bljk_I8I8S_BH_SA_AH_MT32x32x64_MI32x32x32x1_SN_1LDSB0_GRVW16_LPA16_LPB16_MIWT1_1_PGR1_PLR1_SU8_TLDS1_WG32_2_1_WGM12
    SolutionIndex: 17
    SolutionNameMin: Cijk_Alik_Bljk_I8I8S_BH_SA_AH_MT32x32x64_MI32x32x32x1_SN_1LDSB0_GRVW16_LPA16_LPB16_MIWT1_1_PGR1_PLR3_SU8_TLDS1_WG32_2_1_WGM12
    SolutionIndex: 18
    SolutionNameMin: Cijk_Alik_Bljk_I8I8S_BH_SA_AH_MT32x32x64_MI32x32x32x1_SN_1LDSB0_GRVW16_LPA16_LPB16_MIWT1_1_PGR2_PLR3_SU8_TLDS1_WG32_2_1_WGM12
    SolutionIndex: 19
    SolutionNameMin: Cijk_Alik_Bljk_I8I8S_BH_SA_AH_MT32x32x64_MI32x32x32x1_SN_1LDSB0_GRVW16_LPA16_LPB16_MIWT1_1_PGR1_PLR3_SU4_TLDS1_WG32_2_1_WGM18
    SolutionIndex: 20
    SolutionNameMin: Cijk_Alik_Bljk_I8I8S_BH_SA_AH_MT32x32x64_MI32x32x32x1_SN_1LDSB0_GRVW16_LPA16_LPB16_MIWT1_1_PGR2_PLR3_SU4_TLDS1_WG32_2_1_WGM18
    SolutionIndex: 21
    SolutionNameMin: Cijk_Alik_Bljk_I8I8S_BH_SA_AH_MT32x32x64_MI32x32x32x1_SN_1LDSB0_GRVW8_LPA8_LPB16_MIWT1_1_PGR1_PLR1_SU8_TLDS1_WG32_2_1_WGM18
    SolutionIndex: 22
    SolutionNameMin: Cijk_Alik_Bljk_I8I8S_BH_SA_AH_MT32x32x64_MI32x32x32x1_SN_1LDSB0_GRVW16_LPA16_LPB16_MIWT1_1_PGR2_PLR1_SU8_TLDS1_WG32_2_1_WGM18
    SolutionIndex: 23
    SolutionNameMin: Cijk_Alik_Bljk_I8I8S_BH_SA_AH_MT32x32x64_MI32x32x32x1_SN_1LDSB0_GRVW16_LPA16_LPB16_MIWT1_1_PGR1_PLR3_SU8_TLDS1_WG32_2_1_WGM18
    SolutionIndex: 24
    SolutionNameMin: Cijk_Alik_Bljk_I8I8S_BH_SA_AH_MT32x32x64_MI32x32x32x1_SN_1LDSB0_GRVW16_LPA16_LPB16_MIWT1_1_PGR2_PLR3_SU8_TLDS1_WG32_2_1_WGM18
    SolutionIndex: 25
    SolutionNameMin: Cijk_Alik_Bljk_I8I8S_BH_SA_AH_MT32x32x64_MI32x32x32x1_SN_1LDSB0_GRVW16_LPA16_LPB16_MIWT1_1_PGR1_PLR1_SU4_TLDS1_WG32_2_1_WGM19
    SolutionIndex: 26
    SolutionNameMin: Cijk_Alik_Bljk_I8I8S_BH_SA_AH_MT32x32x64_MI32x32x32x1_SN_1LDSB0_GRVW16_LPA16_LPB16_MIWT1_1_PGR2_PLR3_SU4_TLDS1_WG32_2_1_WGM19
    SolutionIndex: 27
    SolutionNameMin: Cijk_Alik_Bljk_I8I8S_BH_SA_AH_MT32x32x64_MI32x32x32x1_SN_1LDSB0_GRVW8_LPA8_LPB16_MIWT1_1_PGR2_PLR1_SU8_TLDS1_WG32_2_1_WGM19
    SolutionIndex: 28
    SolutionNameMin: Cijk_Alik_Bljk_I8I8S_BH_SA_AH_MT32x32x64_MI32x32x32x1_SN_1LDSB0_GRVW16_LPA16_LPB16_MIWT1_1_PGR1_PLR3_SU8_TLDS1_WG32_2_1_WGM19
    SolutionIndex: 29
    SolutionNameMin: Cijk_Alik_Bljk_I8I8S_BH_SA_AH_MT32x32x128_MI32x32x32x1_SN_1LDSB0_GRVW8_LPA8_LPB16_MIWT1_1_PGR1_PLR1_SU4_TLDS1_WG32_2_1_WGM12
    SolutionIndex: 30
    SolutionNameMin: Cijk_Alik_Bljk_I8I8S_BH_SA_AH_MT32x32x128_MI32x32x32x1_SN_1LDSB0_GRVW16_LPA16_LPB16_MIWT1_1_PGR2_PLR1_SU4_TLDS1_WG32_2_1_WGM12
    SolutionIndex: 31
    SolutionNameMin: Cijk_Alik_Bljk_I8I8S_BH_SA_AH_MT32x32x128_MI32x32x32x1_SN_1LDSB0_GRVW16_LPA16_LPB16_MIWT1_1_PGR1_PLR5_SU4_TLDS1_WG32_2_1_WGM12
    SolutionIndex: 32
    SolutionNameMin: Cijk_Alik_Bljk_I8I8S_BH_SA_AH_MT32x32x128_MI32x32x32x1_SN_1LDSB0_GRVW16_LPA16_LPB16_MIWT1_1_PGR1_PLR1_SU8_TLDS1_WG32_2_1_WGM12
    SolutionIndex: 33
    SolutionNameMin: Cijk_Alik_Bljk_I8I8S_BH_SA_AH_MT32x32x128_MI32x32x32x1_SN_1LDSB0_GRVW16_LPA16_LPB16_MIWT1_1_PGR1_PLR5_SU4_TLDS1_WG32_2_1_WGM18
    SolutionIndex: 34
    SolutionNameMin: Cijk_Alik_Bljk_I8I8S_BH_SA_AH_MT32x32x128_MI32x32x32x1_SN_1LDSB0_GRVW8_LPA8_LPB16_MIWT1_1_PGR1_PLR1_SU8_TLDS1_WG32_2_1_WGM18
    SolutionIndex: 35
    SolutionNameMin: Cijk_Alik_Bljk_I8I8S_BH_SA_AH_MT32x32x128_MI32x32x32x1_SN_1LDSB0_GRVW8_LPA8_LPB16_MIWT1_1_PGR2_PLR5_SU8_TLDS1_WG32_2_1_WGM18
    SolutionIndex: 36
    SolutionNameMin: Cijk_Alik_Bljk_I8I8S_BH_SA_AH_MT32x32x128_MI32x32x32x1_SN_1LDSB0_GRVW16_LPA16_LPB16_MIWT1_1_PGR2_PLR1_SU4_TLDS1_WG32_2_1_WGM19
    SolutionIndex: 37
    SolutionNameMin: Cijk_Alik_Bljk_I8I8S_BH_SA_AH_MT32x32x128_MI32x32x32x1_SN_1LDSB0_GRVW16_LPA16_LPB16_MIWT1_1_PGR2_PLR5_SU4_TLDS1_WG32_2_1_WGM19
    SolutionIndex: 38
    SolutionNameMin: Cijk_Alik_Bljk_I8I8S_BH_SA_AH_MT32x32x128_MI32x32x32x1_SN_1LDSB0_GRVW16_LPA16_LPB16_MIWT1_1_PGR2_PLR1_SU8_TLDS1_WG32_2_1_WGM19
    SolutionIndex: 39
    SolutionNameMin: Cijk_Alik_Bljk_I8I8S_BH_SA_AH_MT32x32x128_MI32x32x32x1_SN_1LDSB0_GRVW16_LPA16_LPB16_MIWT1_1_PGR1_PLR5_SU8_TLDS1_WG32_2_1_WGM19
- - - [15, 15, 1, 16, 15, 15, 16, 16]
    - [11, 0.0]
  - - [15, 15, 1, 32, 15, 15, 32, 32]
    - [11, 0.0]
  - - [15, 15, 1, 64, 15, 15, 64, 64]
    - [17, 0.0]
  - - [15, 15, 1, 96, 15, 15, 96, 96]
    - [1, 0.0]
  - - [15, 15, 1, 128, 15, 15, 128, 128]
    - [35, 0.0]
  - - [15, 15, 1, 136, 15, 15, 136, 136]
    - [0, 0.0]
  - - [15, 15, 1, 256, 15, 15, 256, 256]
    - [36, 0.0]
  - - [15, 15, 1, 264, 15, 15, 264, 264]
    - [19, 0.0]
  - - [15, 15, 1, 528, 15, 15, 528, 528]
    - [15, 0.0]
  - - [15, 15, 1, 544, 15, 15, 544, 544]
    - [1, 0.0]
  - - [15, 15, 1, 576, 15, 15, 576, 576]
    - [18, 0.001]
  - - [15, 15, 1, 608, 15, 15, 608, 608]
    - [16, 0.0]
  - - [15, 15, 1, 640, 15, 15, 640, 640]
    - [30, 0.001]
  - - [15, 15, 1, 768, 15, 15, 768, 768]
    - [30, 0.001]
  - - [15, 15, 1, 776, 15, 15, 776, 776]
    - [20, 0.001]
  - - [32, 32, 1, 16, 32, 32, 16, 16]
    - [7, 0.0]
  - - [32, 32, 1, 32, 32, 32, 32, 32]
    - [12, 0.0]
  - - [32, 32, 1, 64, 32, 32, 64, 64]
    - [19, 0.0]
  - - [32, 32, 1, 96, 32, 32, 96, 96]
    - [7, 0.001]
  - - [32, 32, 1, 128, 32, 32, 128, 128]
    - [33, 0.001]
  - - [32, 32, 1, 136, 32, 32, 136, 136]
    - [7, 0.001]
  - - [32, 32, 1, 256, 32, 32, 256, 256]
    - [33, 0.002]
  - - [32, 32, 1, 264, 32, 32, 264, 264]
    - [7, 0.001]
  - - [32, 32, 1, 528, 32, 32, 528, 528]
    - [27, 0.002]
  - - [32, 32, 1, 544, 32, 32, 544, 544]
    - [9, 0.002]
  - - [32, 32, 1, 576, 32, 32, 576, 576]
    - [18, 0.003]
  - - [32, 32, 1, 608, 32, 32, 608, 608]
    - [25, 0.003]
  - - [32, 32, 1, 640, 32, 32, 640, 640]
    - [39, 0.003]
  - - [32, 32, 1, 768, 32, 32, 768, 768]
    - [37, 0.004]
  - - [32, 32, 1, 776, 32, 32, 776, 776]
    - [20, 0.003]
  - - [256, 256, 1, 16, 256, 256, 16, 16]
    - [4, 0.006]
  - - [256, 256, 1, 24, 256, 256, 24, 24]
    - [9, 0.008]
  - - [256, 256, 1, 32, 256, 256, 32, 32]
    - [2, 0.012]
  - - [256, 256, 1, 64, 256, 256, 64, 64]
    - [23, 0.026]
  - - [256, 256, 1, 96, 256, 256, 96, 96]
    - [2, 0.036]
  - - [256, 256, 1, 128, 256, 256, 128, 128]
    - [32, 0.052]
  - - [256, 256, 1, 136, 256, 256, 136, 136]
    - [8, 0.045]
  - - [256, 256, 1, 256, 256, 256, 256, 256]
    - [32, 0.095]
  - - [256, 256, 1, 264, 256, 256, 264, 264]
    - [28, 0.083]
  - - [256, 256, 1, 280, 256, 256, 280, 280]
    - [10, 0.088]
  - - [256, 256, 1, 296, 256, 256, 296, 296]
    - [8, 0.093]
  - - [256, 256, 1, 528, 256, 256, 528, 528]
    - [15, 0.146]
  - - [256, 256, 1, 544, 256, 256, 544, 544]
    - [11, 0.163]
  - - [256, 256, 1, 576, 256, 256, 576, 576]
    - [26, 0.19]
  - - [256, 256, 1, 608, 256, 256, 608, 608]
    - [3, 0.175]
  - - [256, 256, 1, 640, 256, 256, 640, 640]
    - [31, 0.21]
  - - [256, 256, 1, 768, 256, 256, 768, 768]
    - [32, 0.245]
  - - [256, 256, 1, 776, 256, 256, 776, 776]
    - [18, 0.211]
  - - [256, 256, 1, 792, 256, 256, 792, 792]
    - [24, 0.212]
  - - [256, 256, 1, 808, 256, 256, 808, 808]
    - [26, 0.213]
  - - [255, 255, 1, 16, 255, 255, 16, 16]
    - [6, 0.004]
  - - [255, 255, 1, 32, 255, 255, 32, 32]
    - [5, 0.009]
  - - [255, 255, 1, 64, 255, 255, 64, 64]
    - [12, 0.018]
  - - [255, 255, 1, 96, 255, 255, 96, 96]
    - [12, 0.026]
  - - [255, 255, 1, 128, 255, 255, 128, 128]
    - [34, 0.035]
  - - [255, 255, 1, 136, 255, 255, 136, 136]
    - [8, 0.034]
  - - [255, 255, 1, 256, 255, 255, 256, 256]
    - [21, 0.068]
  - - [255, 255, 1, 264, 255, 255, 264, 264]
    - [17, 0.061]
  - - [255, 255, 1, 528, 255, 255, 528, 528]
    - [14, 0.113]
  - - [255, 255, 1, 544, 255, 255, 544, 544]
    - [13, 0.123]
  - - [255, 255, 1, 576, 255, 255, 576, 576]
    - [17, 0.14]
  - - [255, 255, 1, 608, 255, 255, 608, 608]
    - [4, 0.136]
  - - [255, 255, 1, 640, 255, 255, 640, 640]
    - [29, 0.153]
  - - [255, 255, 1, 768, 255, 255, 768, 768]
    - [22, 0.178]
  - - [255, 255, 1, 776, 255, 255, 776, 776]
    - [26, 0.161]
  - - [264, 264, 1, 16, 264, 264, 16, 16]
    - [4, 0.004]
  - - [264, 264, 1, 32, 264, 264, 32, 32]
    - [6, 0.01]
  - - [264, 264, 1, 64, 264, 264, 64, 64]
    - [17, 0.019]
  - - [264, 264, 1, 96, 264, 264, 96, 96]
    - [12, 0.028]
  - - [264, 264, 1, 128, 264, 264, 128, 128]
    - [12, 0.037]
  - - [264, 264, 1, 136, 264, 264, 136, 136]
    - [12, 0.036]
  - - [264, 264, 1, 256, 264, 264, 256, 256]
    - [38, 0.072]
  - - [264, 264, 1, 264, 264, 264, 264, 264]
    - [21, 0.066]
  - - [264, 264, 1, 528, 264, 264, 528, 528]
    - [4, 0.122]
  - - [264, 264, 1, 544, 264, 264, 544, 544]
    - [4, 0.133]
  - - [264, 264, 1, 576, 264, 264, 576, 576]
    - [22, 0.15]
  - - [264, 264, 1, 608, 264, 264, 608, 608]
    - [4, 0.144]
  - - [264, 264, 1, 640, 264, 264, 640, 640]
    - [29, 0.163]
  - - [264, 264, 1, 768, 264, 264, 768, 768]
    - [34, 0.192]
  - - [264, 264, 1, 776, 264, 264, 776, 776]
    - [26, 0.172]
- null
- null
- DeviceEfficiency
