library/src/hcc_detail/rocsparselt/src/spmm/Tensile/Logic/aquavanjaram/aquavanjaram_Cijk_Ailk_Bjlk_HHS_BH_SA_AH.yaml
- {MinimumRequiredVersion: 4.33.0}
- aquavanjaram
- gfx940
- [Device 0049, Device 0050]
    SolutionIndex: 0
    SolutionNameMin: Cijk_Ailk_Bjlk_HHS_BH_SA_AH_MT32x32x16_MI32x32x16x1_SN_1LDSB0_AFC1_DTVSM0_EPS0_GSU1_MIWT1_1_PGR0_PLR0_SU0_SUS0_SRVW0_WG32_2_1
    SolutionIndex: 1
    SolutionNameMin: Cijk_Ailk_Bjlk_HHS_BH_SA_AH_MT32x32x16_MI32x32x16x1_SN_1LDSB0_AFC1_DTVSM1_EPS1_GSU1_MIWT1_1_PGR1_PLR0_SU0_SUS0_SRVW0_WG32_2_1
    SolutionIndex: 2
    SolutionNameMin: Cijk_Ailk_Bjlk_HHS_BH_SA_AH_MT32x32x16_MI32x32x16x1_SN_1LDSB0_AFC1_DTVSM0_EPS1_GSU1_MIWT1_1_PGR2_PLR0_SU4_SUS256_SRVW0_WG32_2_1
    SolutionIndex: 3
    SolutionNameMin: Cijk_Ailk_Bjlk_HHS_BH_SA_AH_MT32x32x16_MI32x32x16x1_SN_1LDSB0_AFC1_DTVSM1_EPS0_GSU1_MIWT1_1_PGR0_PLR0_SU4_SUS256_SRVW0_WG32_2_1
    SolutionIndex: 4
    SolutionNameMin: Cijk_Ailk_Bjlk_HHS_BH_SA_AH_MT32x32x16_MI32x32x16x1_SN_1LDSB0_AFC0_DTVSM1_EPS1_GSU2_MIWT1_1_PGR1_PLR0_SU4_SUS256_SRVW0_WG32_2_1
    SolutionIndex: 5
    SolutionNameMin: Cijk_Ailk_Bjlk_HHS_BH_SA_AH_MT128x128x16_MI32x32x16x1_SN_1LDSB0_AFC1_DTVSM1_EPS1_GSU1_MIWT2_2_PGR1_PLR1_SU4_SUS256_SRVW0_WG64_4_1
    SolutionIndex: 6
    SolutionNameMin: Cijk_Ailk_Bjlk_HHS_BH_SA_AH_MT128x128x16_MI32x32x16x1_SN_1LDSB0_AFC1_DTVSM1_EPS1_GSU1_MIWT2_2_PGR2_PLR1_SU4_SUS256_SRVW0_WG64_4_1
    SolutionIndex: 7
    SolutionNameMin: Cijk_Ailk_Bjlk_HHS_BH_SA_AH_MT128x128x16_MI32x32x16x1_SN_1LDSB0_AFC0_DTVSM0_EPS1_GSU2_MIWT2_2_PGR2_PLR1_SU0_SUS0_SRVW0_WG64_4_1
    SolutionIndex: 8
    SolutionNameMin: Cijk_Ailk_Bjlk_HHS_BH_SA_AH_MT128x128x16_MI32x32x16x1_SN_1LDSB0_AFC1_DTVSM1_EPS1_GSU1_MIWT2_4_PGR2_PLR1_SU4_SUS256_SRVW0_WG64_2_1
    SolutionIndex: 9
    SolutionNameMin: Cijk_Ailk_Bjlk_HHS_BH_SA_AH_MT128x128x16_MI32x32x16x1_SN_1LDSB1_AFC1_DTVSM0_EPS1_GSU1_MIWT2_2_PGR2_PLR0_SU0_SUS0_SRVW0_WG64_4_1
    SolutionIndex: 10
    SolutionNameMin: Cijk_Ailk_Bjlk_HHS_BH_SA_AH_MT128x128x16_MI32x32x16x1_SN_1LDSB1_AFC1_DTVSM1_EPS1_GSU1_MIWT2_2_PGR2_PLR0_SU0_SUS0_SRVW0_WG64_4_1
    SolutionIndex: 11
    SolutionNameMin: Cijk_Ailk_Bjlk_HHS_BH_SA_AH_MT128x128x16_MI32x32x16x1_SN_1LDSB1_AFC0_DTVSM0_EPS1_GSU2_MIWT2_2_PGR2_PLR0_SU0_SUS0_SRVW0_WG64_4_1
    SolutionIndex: 12
    SolutionNameMin: Cijk_Ailk_Bjlk_HHS_BH_SA_AH_MT128x128x16_MI32x32x16x1_SN_1LDSB1_AFC1_DTVSM0_EPS1_GSU1_MIWT2_4_PGR2_PLR1_SU0_SUS0_SRVW0_WG64_2_1
    SolutionIndex: 13
    SolutionNameMin: Cijk_Ailk_Bjlk_HHS_BH_SA_AH_MT128x128x16_MI32x32x16x1_SN_1LDSB1_AFC1_DTVSM1_EPS1_GSU1_MIWT4_2_PGR2_PLR1_SU4_SUS256_SRVW0_WG32_4_1
    SolutionIndex: 14
    SolutionNameMin: Cijk_Ailk_Bjlk_HHS_BH_SA_AH_MT32x32x32_MI32x32x16x1_SN_1LDSB0_AFC1_DTVSM0_EPS1_GSU1_MIWT1_1_PGR2_PLR1_SU0_SUS0_SRVW0_WG32_2_1
    SolutionIndex: 15
    SolutionNameMin: Cijk_Ailk_Bjlk_HHS_BH_SA_AH_MT32x32x32_MI32x32x16x1_SN_1LDSB0_AFC1_DTVSM1_EPS1_GSU1_MIWT1_1_PGR2_PLR0_SU0_SUS0_SRVW0_WG32_2_1
    SolutionIndex: 16
    SolutionNameMin: Cijk_Ailk_Bjlk_HHS_BH_SA_AH_MT32x32x32_MI32x32x16x1_SN_1LDSB0_AFC1_DTVSM1_EPS1_GSU1_MIWT1_1_PGR1_PLR1_SU0_SUS0_SRVW0_WG32_2_1
    SolutionIndex: 17
    SolutionNameMin: Cijk_Ailk_Bjlk_HHS_BH_SA_AH_MT32x32x32_MI32x32x16x1_SN_1LDSB0_AFC1_DTVSM1_EPS1_GSU1_MIWT1_1_PGR2_PLR1_SU0_SUS0_SRVW0_WG32_2_1
    SolutionIndex: 18
    SolutionNameMin: Cijk_Ailk_Bjlk_HHS_BH_SA_AH_MT32x32x32_MI32x32x16x1_SN_1LDSB0_AFC1_DTVSM1_EPS1_GSU1_MIWT1_1_PGR1_PLR2_SU0_SUS0_SRVW0_WG32_2_1
    SolutionIndex: 19
    SolutionNameMin: Cijk_Ailk_Bjlk_HHS_BH_SA_AH_MT32x32x32_MI32x32x16x1_SN_1LDSB0_AFC1_DTVSM1_EPS1_GSU1_MIWT1_1_PGR2_PLR2_SU0_SUS0_SRVW0_WG32_2_1
    SolutionIndex: 20
    SolutionNameMin: Cijk_Ailk_Bjlk_HHS_BH_SA_AH_MT32x32x32_MI32x32x16x1_SN_1LDSB0_AFC1_DTVSM0_EPS0_GSU1_MIWT1_1_PGR0_PLR0_SU4_SUS256_SRVW0_WG32_2_1
    SolutionIndex: 21
    SolutionNameMin: Cijk_Ailk_Bjlk_HHS_BH_SA_AH_MT32x32x32_MI32x32x16x1_SN_1LDSB0_AFC1_DTVSM0_EPS1_GSU1_MIWT1_1_PGR1_PLR2_SU4_SUS256_SRVW0_WG32_2_1
    SolutionIndex: 22
    SolutionNameMin: Cijk_Ailk_Bjlk_HHS_BH_SA_AH_MT32x32x32_MI32x32x16x1_SN_1LDSB0_AFC1_DTVSM1_EPS1_GSU1_MIWT1_1_PGR1_PLR0_SU4_SUS256_SRVW0_WG32_2_1
    SolutionIndex: 23
    SolutionNameMin: Cijk_Ailk_Bjlk_HHS_BH_SA_AH_MT32x32x32_MI32x32x16x1_SN_1LDSB0_AFC1_DTVSM1_EPS1_GSU1_MIWT1_1_PGR2_PLR1_SU4_SUS256_SRVW0_WG32_2_1
    SolutionIndex: 24
    SolutionNameMin: Cijk_Ailk_Bjlk_HHS_BH_SA_AH_MT128x128x32_MI32x32x16x1_SN_1LDSB0_AFC1_DTVSM1_EPS0_GSU1_MIWT2_4_PGR0_PLR1_SU4_SUS256_SRVW0_WG64_2_1
    SolutionIndex: 25
    SolutionNameMin: Cijk_Ailk_Bjlk_HHS_BH_SA_AH_MT128x128x32_MI32x32x16x1_SN_1LDSB0_AFC1_DTVSM0_EPS0_GSU1_MIWT4_2_PGR0_PLR2_SU0_SUS0_SRVW0_WG32_4_1
    SolutionIndex: 26
    SolutionNameMin: Cijk_Ailk_Bjlk_HHS_BH_SA_AH_MT128x128x32_MI32x32x16x1_SN_1LDSB0_AFC1_DTVSM0_EPS1_GSU1_MIWT4_2_PGR2_PLR1_SU4_SUS256_SRVW0_WG32_4_1
    SolutionIndex: 27
    SolutionNameMin: Cijk_Ailk_Bjlk_HHS_BH_SA_AH_MT128x128x32_MI32x32x16x1_SN_1LDSB0_AFC1_DTVSM1_EPS0_GSU1_MIWT4_2_PGR0_PLR2_SU4_SUS256_SRVW0_WG32_4_1
    SolutionIndex: 28
    SolutionNameMin: Cijk_Ailk_Bjlk_HHS_BH_SA_AH_MT128x128x32_MI32x32x16x1_SN_1LDSB0_AFC1_DTVSM1_EPS1_GSU1_MIWT4_2_PGR1_PLR2_SU4_SUS256_SRVW0_WG32_4_1
    SolutionIndex: 29
    SolutionNameMin: Cijk_Ailk_Bjlk_HHS_BH_SA_AH_MT256x256x32_MI32x32x16x1_SN_1LDSB0_AFC0_DTVSM0_EPS1_GSU2_MIWT4_4_PGR1_PLR0_SU4_SUS256_SRVW0_WG64_4_1
    SolutionIndex: 30
    SolutionNameMin: Cijk_Ailk_Bjlk_HHS_BH_SA_AH_MT256x256x32_MI32x32x16x1_SN_1LDSB0_AFC1_DTVSM0_EPS1_GSU1_MIWT4_2_PGR1_PLR1_SU0_SUS0_SRVW0_WG64_8_1
    SolutionIndex: 31
    SolutionNameMin: Cijk_Ailk_Bjlk_HHS_BH_SA_AH_MT32x32x64_MI32x32x16x1_SN_1LDSB0_AFC1_DTVSM0_EPS1_GSU1_MIWT1_1_PGR1_PLR0_SU0_SUS0_SRVW0_WG32_2_1
    SolutionIndex: 32
    SolutionNameMin: Cijk_Ailk_Bjlk_HHS_BH_SA_AH_MT32x32x64_MI32x32x16x1_SN_1LDSB0_AFC1_DTVSM0_EPS0_GSU1_MIWT1_1_PGR0_PLR1_SU0_SUS0_SRVW0_WG32_2_1
    SolutionIndex: 33
    SolutionNameMin: Cijk_Ailk_Bjlk_HHS_BH_SA_AH_MT32x32x64_MI32x32x16x1_SN_1LDSB0_AFC1_DTVSM0_EPS1_GSU1_MIWT1_1_PGR2_PLR0_SU4_SUS256_SRVW0_WG32_2_1
    SolutionIndex: 34
    SolutionNameMin: Cijk_Ailk_Bjlk_HHS_BH_SA_AH_MT32x32x64_MI32x32x16x1_SN_1LDSB0_AFC1_DTVSM1_EPS1_GSU1_MIWT1_1_PGR1_PLR0_SU4_SUS256_SRVW0_WG32_2_1
    SolutionIndex: 35
    SolutionNameMin: Cijk_Ailk_Bjlk_HHS_BH_SA_AH_MT32x32x64_MI32x32x16x1_SN_1LDSB0_AFC1_DTVSM1_EPS1_GSU1_MIWT1_1_PGR2_PLR0_SU4_SUS256_SRVW0_WG32_2_1
    SolutionIndex: 36
    SolutionNameMin: Cijk_Ailk_Bjlk_HHS_BH_SA_AH_MT128x128x64_MI32x32x16x1_SN_1LDSB0_AFC0_DTVSM0_EPS1_GSU3_MIWT2_2_PGR1_PLR1_SU4_SUS256_SRVW0_WG64_4_1
    SolutionIndex: 37
    SolutionNameMin: Cijk_Ailk_Bjlk_HHS_BH_SA_AH_MT256x256x64_MI32x32x16x1_SN_1LDSB0_AFC1_DTVSM0_EPS0_GSU1_MIWT8_2_PGR0_PLR1_SU0_SUS0_SRVW0_WG32_8_1
    SolutionIndex: 38
    SolutionNameMin: Cijk_Ailk_Bjlk_HHS_BH_SA_AH_MT32x32x16_MI32x32x16x1_SN_1LDSB0_AFC1_DTVSM1_EPS1_GSU1_MIWT1_1_PGR2_PLR1_SU0_SUS0_SRVW8_WG32_2_1
    SolutionIndex: 39
    SolutionNameMin: Cijk_Ailk_Bjlk_HHS_BH_SA_AH_MT32x32x16_MI32x32x16x1_SN_1LDSB0_AFC1_DTVSM0_EPS1_GSU1_MIWT1_1_PGR2_PLR0_SU4_SUS256_SRVW8_WG32_2_1
    SolutionIndex: 40
    SolutionNameMin: Cijk_Ailk_Bjlk_HHS_BH_SA_AH_MT32x32x16_MI32x32x16x1_SN_1LDSB0_AFC1_DTVSM1_EPS1_GSU1_MIWT1_1_PGR2_PLR0_SU4_SUS256_SRVW8_WG32_2_1
    SolutionIndex: 41
    SolutionNameMin: Cijk_Ailk_Bjlk_HHS_BH_SA_AH_MT128x128x16_MI32x32x16x1_SN_1LDSB0_AFC1_DTVSM0_EPS1_GSU1_MIWT2_2_PGR2_PLR1_SU4_SUS256_SRVW8_WG64_4_1
    SolutionIndex: 42
    SolutionNameMin: Cijk_Ailk_Bjlk_HHS_BH_SA_AH_MT128x128x16_MI32x32x16x1_SN_1LDSB0_AFC1_DTVSM1_EPS1_GSU1_MIWT2_4_PGR1_PLR0_SU4_SUS256_SRVW8_WG64_2_1
    SolutionIndex: 43
    SolutionNameMin: Cijk_Ailk_Bjlk_HHS_BH_SA_AH_MT128x128x16_MI32x32x16x1_SN_1LDSB0_AFC1_DTVSM1_EPS1_GSU1_MIWT2_4_PGR2_PLR0_SU4_SUS256_SRVW8_WG64_2_1
    SolutionIndex: 44
    SolutionNameMin: Cijk_Ailk_Bjlk_HHS_BH_SA_AH_MT256x256x16_MI32x32x16x1_SN_1LDSB0_AFC1_DTVSM1_EPS1_GSU1_MIWT2_4_PGR2_PLR1_SU0_SUS0_SRVW8_WG128_4_1
    SolutionIndex: 45
    SolutionNameMin: Cijk_Ailk_Bjlk_HHS_BH_SA_AH_MT32x32x32_MI32x32x16x1_SN_1LDSB0_AFC1_DTVSM0_EPS1_GSU1_MIWT1_1_PGR1_PLR2_SU0_SUS0_SRVW8_WG32_2_1
    SolutionIndex: 46
    SolutionNameMin: Cijk_Ailk_Bjlk_HHS_BH_SA_AH_MT32x32x32_MI32x32x16x1_SN_1LDSB0_AFC1_DTVSM0_EPS1_GSU1_MIWT1_1_PGR2_PLR2_SU0_SUS0_SRVW8_WG32_2_1
    SolutionIndex: 47
    SolutionNameMin: Cijk_Ailk_Bjlk_HHS_BH_SA_AH_MT32x32x32_MI32x32x16x1_SN_1LDSB0_AFC1_DTVSM1_EPS1_GSU1_MIWT1_1_PGR2_PLR1_SU0_SUS0_SRVW8_WG32_2_1
    SolutionIndex: 48
    SolutionNameMin: Cijk_Ailk_Bjlk_HHS_BH_SA_AH_MT32x32x32_MI32x32x16x1_SN_1LDSB0_AFC1_DTVSM1_EPS0_GSU1_MIWT1_1_PGR0_PLR2_SU0_SUS0_SRVW8_WG32_2_1
    SolutionIndex: 49
    SolutionNameMin: Cijk_Ailk_Bjlk_HHS_BH_SA_AH_MT32x32x32_MI32x32x16x1_SN_1LDSB0_AFC1_DTVSM1_EPS0_GSU1_MIWT1_1_PGR0_PLR0_SU4_SUS256_SRVW8_WG32_2_1
    SolutionIndex: 50
    SolutionNameMin: Cijk_Ailk_Bjlk_HHS_BH_SA_AH_MT128x128x32_MI32x32x16x1_SN_1LDSB0_AFC1_DTVSM0_EPS1_GSU1_MIWT2_2_PGR2_PLR1_SU4_SUS256_SRVW8_WG64_4_1
    SolutionIndex: 51
    SolutionNameMin: Cijk_Ailk_Bjlk_HHS_BH_SA_AH_MT128x128x32_MI32x32x16x1_SN_1LDSB0_AFC1_DTVSM0_EPS0_GSU1_MIWT2_4_PGR0_PLR1_SU0_SUS0_SRVW8_WG64_2_1
    SolutionIndex: 52
    SolutionNameMin: Cijk_Ailk_Bjlk_HHS_BH_SA_AH_MT256x256x32_MI32x32x16x1_SN_1LDSB0_AFC1_DTVSM1_EPS1_GSU1_MIWT2_8_PGR2_PLR2_SU4_SUS256_SRVW8_WG128_2_1
    SolutionIndex: 53
    SolutionNameMin: Cijk_Ailk_Bjlk_HHS_BH_SA_AH_MT32x32x64_MI32x32x16x1_SN_1LDSB0_AFC1_DTVSM0_EPS1_GSU1_MIWT1_1_PGR1_PLR0_SU4_SUS256_SRVW8_WG32_2_1
    SolutionIndex: 54
    SolutionNameMin: Cijk_Ailk_Bjlk_HHS_BH_SA_AH_MT128x128x64_MI32x32x16x1_SN_1LDSB0_AFC1_DTVSM0_EPS1_GSU1_MIWT2_2_PGR1_PLR0_SU4_SUS256_SRVW8_WG64_4_1
    SolutionIndex: 55
    SolutionNameMin: Cijk_Ailk_Bjlk_HHS_BH_SA_AH_MT128x128x64_MI32x32x16x1_SN_1LDSB0_AFC1_DTVSM1_EPS0_GSU1_MIWT4_2_PGR0_PLR0_SU0_SUS0_SRVW8_WG32_4_1
    SolutionIndex: 56
    SolutionNameMin: Cijk_Ailk_Bjlk_HHS_BH_SA_AH_MT128x128x64_MI32x32x16x1_SN_1LDSB0_AFC1_DTVSM0_EPS0_GSU1_MIWT4_2_PGR0_PLR0_SU4_SUS256_SRVW8_WG32_4_1
    SolutionIndex: 57
    SolutionNameMin: Cijk_Ailk_Bjlk_HHS_BH_SA_AH_MT256x256x64_MI32x32x16x1_SN_1LDSB0_AFC1_DTVSM0_EPS0_GSU1_MIWT2_4_PGR0_PLR0_SU0_SUS0_SRVW8_WG128_4_1
    SolutionIndex: 58
    SolutionNameMin: Cijk_Ailk_Bjlk_HHS_BH_SA_AH_MT128x128x64_MI32x32x16x1_SN_1LDSB1_AFC1_DTVSM0_EPS1_GSU1_MIWT2_2_PGR1_PLR0_SU0_SUS0_SRVW8_WG64_4_1
- - - [15, 15, 1, 16, 15, 15, 15, 15]
    - [3, 0.464396]
  - - [15, 15, 1, 32, 15, 15, 15, 15]
    - [16, 0.931255]
  - - [15, 15, 1, 64, 15, 15, 15, 15]
    - [22, 1.77943]
  - - [15, 15, 1, 96, 15, 15, 15, 15]
    - [22, 2.48461]
  - - [15, 15, 1, 128, 15, 15, 15, 15]
    - [22, 3.25295]
  - - [15, 15, 1, 136, 15, 15, 15, 15]
    - [16, 3.23655]
  - - [15, 15, 1, 256, 15, 15, 15, 15]
    - [23, 5.76259]
  - - [15, 15, 1, 264, 15, 15, 15, 15]
    - [15, 5.59506]
  - - [15, 15, 1, 528, 15, 15, 15, 15]
    - [14, 10.0186]
  - - [15, 15, 1, 544, 15, 15, 15, 15]
    - [19, 10.4455]
  - - [15, 15, 1, 576, 15, 15, 15, 15]
    - [14, 11.5333]
  - - [15, 15, 1, 608, 15, 15, 15, 15]
    - [19, 11.4784]
  - - [15, 15, 1, 640, 15, 15, 15, 15]
    - [33, 12.0421]
  - - [15, 15, 1, 768, 15, 15, 15, 15]
    - [35, 13.8918]
  - - [15, 15, 1, 776, 15, 15, 15, 15]
    - [19, 13.0099]
  - - [32, 32, 1, 16, 32, 32, 32, 32]
    - [3, 2.81077]
  - - [32, 32, 1, 32, 32, 32, 32, 32]
    - [18, 5.39924]
  - - [32, 32, 1, 64, 32, 32, 32, 32]
    - [18, 10.3541]
  - - [32, 32, 1, 96, 32, 32, 32, 32]
    - [18, 14.9626]
  - - [32, 32, 1, 128, 32, 32, 32, 32]
    - [18, 18.75]
  - - [32, 32, 1, 136, 32, 32, 32, 32]
    - [18, 18.4909]
  - - [32, 32, 1, 256, 32, 32, 32, 32]
    - [18, 32.9658]
  - - [32, 32, 1, 264, 32, 32, 32, 32]
    - [18, 31.8304]
  - - [32, 32, 1, 528, 32, 32, 32, 32]
    - [32, 53.6621]
  - - [32, 32, 1, 544, 32, 32, 32, 32]
    - [17, 55.7307]
  - - [32, 32, 1, 576, 32, 32, 32, 32]
    - [14, 62.3855]
  - - [32, 32, 1, 608, 32, 32, 32, 32]
    - [19, 63.954]
  - - [32, 32, 1, 640, 32, 32, 32, 32]
    - [31, 64.916]
  - - [32, 32, 1, 768, 32, 32, 32, 32]
    - [46, 72.7067]
  - - [32, 32, 1, 776, 32, 32, 32, 32]
    - [19, 70.8379]
  - - [256, 256, 1, 16, 256, 256, 256, 256]
    - [25, 9.98449]
  - - [256, 256, 1, 24, 256, 256, 256, 256]
    - [58, 122.693]
  - - [256, 256, 1, 32, 256, 256, 256, 256]
    - [0, 311.589]
  - - [256, 256, 1, 64, 256, 256, 256, 256]
    - [28, 191.403]
  - - [256, 256, 1, 96, 256, 256, 256, 256]
    - [42, 354.908]
  - - [256, 256, 1, 128, 256, 256, 256, 256]
    - [8, 80.044]
  - - [256, 256, 1, 136, 256, 256, 256, 256]
    - [43, 491.123]
  - - [256, 256, 1, 256, 256, 256, 256, 256]
    - [27, 159.629]
  - - [256, 256, 1, 264, 256, 256, 256, 256]
    - [45, 164.619]
  - - [256, 256, 1, 280, 256, 256, 256, 256]
    - [24, 174.862]
  - - [256, 256, 1, 296, 256, 256, 256, 256]
    - [39, 2009.29]
  - - [256, 256, 1, 528, 256, 256, 256, 256]
    - [29, 460.422]
  - - [256, 256, 1, 544, 256, 256, 256, 256]
    - [55, 538.531]
  - - [256, 256, 1, 576, 256, 256, 256, 256]
    - [30, 632.196]
  - - [256, 256, 1, 608, 256, 256, 256, 256]
    - [49, 3315.52]
  - - [256, 256, 1, 640, 256, 256, 256, 256]
    - [54, 2123.64]
  - - [256, 256, 1, 768, 256, 256, 256, 256]
    - [41, 2206.08]
  - - [256, 256, 1, 776, 256, 256, 256, 256]
    - [47, 4134.97]
  - - [256, 256, 1, 792, 256, 256, 256, 256]
    - [21, 3782.85]
  - - [256, 256, 1, 808, 256, 256, 256, 256]
    - [40, 3787.37]
  - - [255, 255, 1, 16, 255, 255, 255, 255]
    - [56, 18.0537]
  - - [255, 255, 1, 32, 255, 255, 255, 255]
    - [48, 228.308]
  - - [255, 255, 1, 64, 255, 255, 255, 255]
    - [52, 60.9807]
  - - [255, 255, 1, 96, 255, 255, 255, 255]
    - [57, 117.115]
  - - [255, 255, 1, 128, 255, 255, 255, 255]
    - [38, 811.584]
  - - [255, 255, 1, 136, 255, 255, 255, 255]
    - [6, 208.156]
  - - [255, 255, 1, 256, 255, 255, 255, 255]
    - [44, 295.642]
  - - [255, 255, 1, 264, 255, 255, 255, 255]
    - [13, 359.947]
  - - [255, 255, 1, 528, 255, 255, 255, 255]
    - [51, 704.206]
  - - [255, 255, 1, 544, 255, 255, 255, 255]
    - [19, 2712.7]
  - - [255, 255, 1, 576, 255, 255, 255, 255]
    - [11, 851.866]
  - - [255, 255, 1, 608, 255, 255, 255, 255]
    - [5, 824.449]
  - - [255, 255, 1, 640, 255, 255, 255, 255]
    - [50, 1423.01]
  - - [255, 255, 1, 768, 255, 255, 255, 255]
    - [36, 1013.88]
  - - [255, 255, 1, 776, 255, 255, 255, 255]
    - [4, 2323.93]
  - - [264, 264, 1, 16, 264, 264, 264, 264]
    - [10, 77.4292]
  - - [264, 264, 1, 32, 264, 264, 264, 264]
    - [1, 299.305]
  - - [264, 264, 1, 64, 264, 264, 264, 264]
    - [53, 469.803]
  - - [264, 264, 1, 96, 264, 264, 264, 264]
    - [26, 247.978]
  - - [264, 264, 1, 128, 264, 264, 264, 264]
    - [37, 188.559]
  - - [264, 264, 1, 136, 264, 264, 264, 264]
    - [20, 985.871]
  - - [264, 264, 1, 256, 264, 264, 264, 264]
    - [10, 939.606]
  - - [264, 264, 1, 264, 264, 264, 264, 264]
    - [12, 618.157]
  - - [264, 264, 1, 528, 264, 264, 264, 264]
    - [22, 2982.37]
  - - [264, 264, 1, 544, 264, 264, 264, 264]
    - [34, 3165.22]
  - - [264, 264, 1, 576, 264, 264, 264, 264]
    - [2, 3181.18]
  - - [264, 264, 1, 608, 264, 264, 264, 264]
    - [23, 3610.08]
  - - [264, 264, 1, 640, 264, 264, 264, 264]
    - [7, 1570.45]
  - - [264, 264, 1, 768, 264, 264, 264, 264]
    - [46, 3901.07]
  - - [264, 264, 1, 776, 264, 264, 264, 264]
    - [9, 2053.31]
- null
- null
- DeviceEfficiency
