library/src/hcc_detail/rocsparselt/src/spmm/Tensile/Logic/aquavanjaram/aquavanjaram_Cijk_Alik_Bjlk_I8I8S_BH_SA_AH.yaml
- {MinimumRequiredVersion: 4.33.0}
- aquavanjaram
- gfx940
- [Device 0049, Device 0050]
    SolutionIndex: 0
    SolutionNameMin: Cijk_Alik_Bjlk_I8I8S_BH_SA_AH_MT32x32x32_MI32x32x32x1_SN_1LDSB0_AFC1_DTVSM0_EPS0_GRVW16_GSU1_LPA2_MIWT1_1_PGR0_PLR0_SU0_SUS0_SRVW0_TLDS0_WG32_2_1
    SolutionIndex: 1
    SolutionNameMin: Cijk_Alik_Bjlk_I8I8S_BH_SA_AH_MT32x32x32_MI32x32x32x1_SN_1LDSB0_AFC1_DTVSM0_EPS1_GRVW16_GSU1_LPA16_MIWT1_1_PGR2_PLR0_SU0_SUS0_SRVW0_TLDS1_WG32_2_1
    SolutionIndex: 2
    SolutionNameMin: Cijk_Alik_Bjlk_I8I8S_BH_SA_AH_MT32x32x32_MI32x32x32x1_SN_1LDSB0_AFC1_DTVSM0_EPS0_GRVW16_GSU1_LPA2_MIWT1_1_PGR0_PLR1_SU0_SUS0_SRVW0_TLDS0_WG32_2_1
    SolutionIndex: 3
    SolutionNameMin: Cijk_Alik_Bjlk_I8I8S_BH_SA_AH_MT32x32x32_MI32x32x32x1_SN_1LDSB0_AFC1_DTVSM0_EPS1_GRVW8_GSU1_LPA8_MIWT1_1_PGR1_PLR1_SU0_SUS0_SRVW0_TLDS1_WG32_2_1
    SolutionIndex: 4
    SolutionNameMin: Cijk_Alik_Bjlk_I8I8S_BH_SA_AH_MT32x32x32_MI32x32x32x1_SN_1LDSB0_AFC1_DTVSM0_EPS1_GRVW8_GSU1_LPA8_MIWT1_1_PGR2_PLR1_SU0_SUS0_SRVW0_TLDS1_WG32_2_1
    SolutionIndex: 5
    SolutionNameMin: Cijk_Alik_Bjlk_I8I8S_BH_SA_AH_MT32x32x32_MI32x32x32x1_SN_1LDSB0_AFC1_DTVSM1_EPS0_GRVW8_GSU1_LPA8_MIWT1_1_PGR0_PLR0_SU0_SUS0_SRVW0_TLDS1_WG32_2_1
    SolutionIndex: 6
    SolutionNameMin: Cijk_Alik_Bjlk_I8I8S_BH_SA_AH_MT32x32x32_MI32x32x32x1_SN_1LDSB0_AFC1_DTVSM1_EPS0_GRVW16_GSU1_LPA2_MIWT1_1_PGR0_PLR0_SU0_SUS0_SRVW0_TLDS0_WG32_2_1
    SolutionIndex: 7
    SolutionNameMin: Cijk_Alik_Bjlk_I8I8S_BH_SA_AH_MT32x32x32_MI32x32x32x1_SN_1LDSB0_AFC1_DTVSM1_EPS1_GRVW8_GSU1_LPA2_MIWT1_1_PGR1_PLR0_SU0_SUS0_SRVW0_TLDS0_WG32_2_1
    SolutionIndex: 8
    SolutionNameMin: Cijk_Alik_Bjlk_I8I8S_BH_SA_AH_MT32x32x32_MI32x32x32x1_SN_1LDSB0_AFC1_DTVSM1_EPS1_GRVW8_GSU1_LPA8_MIWT1_1_PGR1_PLR0_SU0_SUS0_SRVW0_TLDS1_WG32_2_1
    SolutionIndex: 9
    SolutionNameMin: Cijk_Alik_Bjlk_I8I8S_BH_SA_AH_MT32x32x32_MI32x32x32x1_SN_1LDSB0_AFC1_DTVSM1_EPS1_GRVW16_GSU1_LPA16_MIWT1_1_PGR1_PLR0_SU0_SUS0_SRVW0_TLDS1_WG32_2_1
    SolutionIndex: 10
    SolutionNameMin: Cijk_Alik_Bjlk_I8I8S_BH_SA_AH_MT32x32x32_MI32x32x32x1_SN_1LDSB0_AFC1_DTVSM1_EPS1_GRVW8_GSU1_LPA8_MIWT1_1_PGR2_PLR0_SU0_SUS0_SRVW0_TLDS1_WG32_2_1
    SolutionIndex: 11
    SolutionNameMin: Cijk_Alik_Bjlk_I8I8S_BH_SA_AH_MT32x32x32_MI32x32x32x1_SN_1LDSB0_AFC1_DTVSM1_EPS1_GRVW16_GSU1_LPA16_MIWT1_1_PGR2_PLR0_SU0_SUS0_SRVW0_TLDS1_WG32_2_1
    SolutionIndex: 12
    SolutionNameMin: Cijk_Alik_Bjlk_I8I8S_BH_SA_AH_MT32x32x32_MI32x32x32x1_SN_1LDSB0_AFC1_DTVSM1_EPS0_GRVW8_GSU1_LPA8_MIWT1_1_PGR0_PLR1_SU0_SUS0_SRVW0_TLDS1_WG32_2_1
    SolutionIndex: 13
    SolutionNameMin: Cijk_Alik_Bjlk_I8I8S_BH_SA_AH_MT32x32x32_MI32x32x32x1_SN_1LDSB0_AFC1_DTVSM1_EPS0_GRVW16_GSU1_LPA16_MIWT1_1_PGR0_PLR1_SU0_SUS0_SRVW0_TLDS1_WG32_2_1
    SolutionIndex: 14
    SolutionNameMin: Cijk_Alik_Bjlk_I8I8S_BH_SA_AH_MT32x32x32_MI32x32x32x1_SN_1LDSB0_AFC1_DTVSM1_EPS1_GRVW16_GSU1_LPA16_MIWT1_1_PGR1_PLR1_SU0_SUS0_SRVW0_TLDS1_WG32_2_1
    SolutionIndex: 15
    SolutionNameMin: Cijk_Alik_Bjlk_I8I8S_BH_SA_AH_MT32x32x32_MI32x32x32x1_SN_1LDSB0_AFC1_DTVSM1_EPS1_GRVW8_GSU1_LPA8_MIWT1_1_PGR2_PLR1_SU0_SUS0_SRVW0_TLDS1_WG32_2_1
    SolutionIndex: 16
    SolutionNameMin: Cijk_Alik_Bjlk_I8I8S_BH_SA_AH_MT32x32x32_MI32x32x32x1_SN_1LDSB0_AFC1_DTVSM1_EPS1_GRVW16_GSU1_LPA16_MIWT1_1_PGR2_PLR1_SU0_SUS0_SRVW0_TLDS1_WG32_2_1
    SolutionIndex: 17
    SolutionNameMin: Cijk_Alik_Bjlk_I8I8S_BH_SA_AH_MT32x32x32_MI32x32x32x1_SN_1LDSB0_AFC1_DTVSM0_EPS0_GRVW16_GSU1_LPA16_MIWT1_1_PGR0_PLR0_SU4_SUS256_SRVW0_TLDS1_WG32_2_1
    SolutionIndex: 18
    SolutionNameMin: Cijk_Alik_Bjlk_I8I8S_BH_SA_AH_MT32x32x32_MI32x32x32x1_SN_1LDSB0_AFC1_DTVSM1_EPS0_GRVW16_GSU1_LPA16_MIWT1_1_PGR0_PLR0_SU4_SUS256_SRVW0_TLDS1_WG32_2_1
    SolutionIndex: 19
    SolutionNameMin: Cijk_Alik_Bjlk_I8I8S_BH_SA_AH_MT32x32x64_MI32x32x32x1_SN_1LDSB0_AFC1_DTVSM0_EPS1_GRVW8_GSU1_LPA2_MIWT1_1_PGR2_PLR0_SU0_SUS0_SRVW0_TLDS0_WG32_2_1
    SolutionIndex: 20
    SolutionNameMin: Cijk_Alik_Bjlk_I8I8S_BH_SA_AH_MT32x32x64_MI32x32x32x1_SN_1LDSB0_AFC1_DTVSM0_EPS0_GRVW16_GSU1_LPA16_MIWT1_1_PGR0_PLR1_SU0_SUS0_SRVW0_TLDS1_WG32_2_1
    SolutionIndex: 21
    SolutionNameMin: Cijk_Alik_Bjlk_I8I8S_BH_SA_AH_MT32x32x64_MI32x32x32x1_SN_1LDSB0_AFC1_DTVSM0_EPS1_GRVW8_GSU1_LPA8_MIWT1_1_PGR1_PLR2_SU0_SUS0_SRVW0_TLDS1_WG32_2_1
    SolutionIndex: 22
    SolutionNameMin: Cijk_Alik_Bjlk_I8I8S_BH_SA_AH_MT32x32x64_MI32x32x32x1_SN_1LDSB0_AFC1_DTVSM0_EPS1_GRVW16_GSU1_LPA16_MIWT1_1_PGR1_PLR2_SU0_SUS0_SRVW0_TLDS1_WG32_2_1
    SolutionIndex: 23
    SolutionNameMin: Cijk_Alik_Bjlk_I8I8S_BH_SA_AH_MT32x32x64_MI32x32x32x1_SN_1LDSB0_AFC1_DTVSM1_EPS0_GRVW16_GSU1_LPA16_MIWT1_1_PGR0_PLR0_SU0_SUS0_SRVW0_TLDS1_WG32_2_1
    SolutionIndex: 24
    SolutionNameMin: Cijk_Alik_Bjlk_I8I8S_BH_SA_AH_MT32x32x64_MI32x32x32x1_SN_1LDSB0_AFC1_DTVSM1_EPS0_GRVW8_GSU1_LPA8_MIWT1_1_PGR0_PLR1_SU0_SUS0_SRVW0_TLDS1_WG32_2_1
    SolutionIndex: 25
    SolutionNameMin: Cijk_Alik_Bjlk_I8I8S_BH_SA_AH_MT32x32x64_MI32x32x32x1_SN_1LDSB0_AFC1_DTVSM1_EPS0_GRVW16_GSU1_LPA16_MIWT1_1_PGR0_PLR1_SU0_SUS0_SRVW0_TLDS1_WG32_2_1
    SolutionIndex: 26
    SolutionNameMin: Cijk_Alik_Bjlk_I8I8S_BH_SA_AH_MT32x32x64_MI32x32x32x1_SN_1LDSB0_AFC1_DTVSM1_EPS1_GRVW8_GSU1_LPA8_MIWT1_1_PGR2_PLR1_SU0_SUS0_SRVW0_TLDS1_WG32_2_1
    SolutionIndex: 27
    SolutionNameMin: Cijk_Alik_Bjlk_I8I8S_BH_SA_AH_MT32x32x64_MI32x32x32x1_SN_1LDSB0_AFC1_DTVSM1_EPS1_GRVW16_GSU1_LPA16_MIWT1_1_PGR2_PLR1_SU0_SUS0_SRVW0_TLDS1_WG32_2_1
    SolutionIndex: 28
    SolutionNameMin: Cijk_Alik_Bjlk_I8I8S_BH_SA_AH_MT32x32x64_MI32x32x32x1_SN_1LDSB0_AFC1_DTVSM1_EPS0_GRVW16_GSU1_LPA16_MIWT1_1_PGR0_PLR2_SU0_SUS0_SRVW0_TLDS1_WG32_2_1
    SolutionIndex: 29
    SolutionNameMin: Cijk_Alik_Bjlk_I8I8S_BH_SA_AH_MT32x32x64_MI32x32x32x1_SN_1LDSB0_AFC1_DTVSM1_EPS1_GRVW8_GSU1_LPA8_MIWT1_1_PGR2_PLR2_SU0_SUS0_SRVW0_TLDS1_WG32_2_1
    SolutionIndex: 30
    SolutionNameMin: Cijk_Alik_Bjlk_I8I8S_BH_SA_AH_MT32x32x64_MI32x32x32x1_SN_1LDSB0_AFC1_DTVSM1_EPS1_GRVW16_GSU1_LPA16_MIWT1_1_PGR2_PLR2_SU0_SUS0_SRVW0_TLDS1_WG32_2_1
    SolutionIndex: 31
    SolutionNameMin: Cijk_Alik_Bjlk_I8I8S_BH_SA_AH_MT32x32x64_MI32x32x32x1_SN_1LDSB0_AFC1_DTVSM0_EPS0_GRVW8_GSU1_LPA8_MIWT1_1_PGR0_PLR1_SU4_SUS256_SRVW0_TLDS1_WG32_2_1
    SolutionIndex: 32
    SolutionNameMin: Cijk_Alik_Bjlk_I8I8S_BH_SA_AH_MT32x32x64_MI32x32x32x1_SN_1LDSB0_AFC1_DTVSM0_EPS1_GRVW8_GSU1_LPA8_MIWT1_1_PGR2_PLR2_SU4_SUS256_SRVW0_TLDS1_WG32_2_1
    SolutionIndex: 33
    SolutionNameMin: Cijk_Alik_Bjlk_I8I8S_BH_SA_AH_MT32x32x64_MI32x32x32x1_SN_1LDSB0_AFC1_DTVSM1_EPS0_GRVW8_GSU1_LPA8_MIWT1_1_PGR0_PLR0_SU4_SUS256_SRVW0_TLDS1_WG32_2_1
    SolutionIndex: 34
    SolutionNameMin: Cijk_Alik_Bjlk_I8I8S_BH_SA_AH_MT32x32x128_MI32x32x32x1_SN_1LDSB0_AFC1_DTVSM0_EPS0_GRVW16_GSU1_LPA16_MIWT1_1_PGR0_PLR1_SU0_SUS0_SRVW0_TLDS1_WG32_2_1
    SolutionIndex: 35
    SolutionNameMin: Cijk_Alik_Bjlk_I8I8S_BH_SA_AH_MT32x32x128_MI32x32x32x1_SN_1LDSB0_AFC1_DTVSM1_EPS1_GRVW8_GSU1_LPA8_MIWT1_1_PGR1_PLR0_SU0_SUS0_SRVW0_TLDS1_WG32_2_1
    SolutionIndex: 36
    SolutionNameMin: Cijk_Alik_Bjlk_I8I8S_BH_SA_AH_MT32x32x128_MI32x32x32x1_SN_1LDSB0_AFC1_DTVSM1_EPS0_GRVW8_GSU1_LPA8_MIWT1_1_PGR0_PLR1_SU0_SUS0_SRVW0_TLDS1_WG32_2_1
    SolutionIndex: 37
    SolutionNameMin: Cijk_Alik_Bjlk_I8I8S_BH_SA_AH_MT32x32x128_MI32x32x32x1_SN_1LDSB0_AFC1_DTVSM1_EPS0_GRVW16_GSU1_LPA16_MIWT1_1_PGR0_PLR1_SU0_SUS0_SRVW0_TLDS1_WG32_2_1
    SolutionIndex: 38
    SolutionNameMin: Cijk_Alik_Bjlk_I8I8S_BH_SA_AH_MT32x32x128_MI32x32x32x1_SN_1LDSB0_AFC1_DTVSM1_EPS0_GRVW8_GSU1_LPA8_MIWT1_1_PGR0_PLR1_SU4_SUS256_SRVW0_TLDS1_WG32_2_1
    SolutionIndex: 39
    SolutionNameMin: Cijk_Alik_Bjlk_I8I8S_BH_SA_AH_MT32x32x32_MI32x32x32x1_SN_1LDSB0_AFC1_DTVSM1_EPS1_GRVW16_GSU1_LPA16_MIWT1_1_PGR2_PLR1_SU0_SUS0_SRVW8_TLDS1_WG32_2_1
    SolutionIndex: 40
    SolutionNameMin: Cijk_Alik_Bjlk_I8I8S_BH_SA_AH_MT32x32x64_MI32x32x32x1_SN_1LDSB0_AFC1_DTVSM1_EPS1_GRVW16_GSU1_LPA16_MIWT1_1_PGR2_PLR1_SU0_SUS0_SRVW8_TLDS1_WG32_2_1
- - - [15, 15, 1, 16, 15, 15, 16, 15]
    - [4, 0.418921]
  - - [15, 15, 1, 32, 15, 15, 32, 15]
    - [4, 0.916964]
  - - [15, 15, 1, 64, 15, 15, 64, 15]
    - [19, 1.83393]
  - - [15, 15, 1, 96, 15, 15, 96, 15]
    - [5, 2.50203]
  - - [15, 15, 1, 128, 15, 15, 128, 15]
    - [35, 3.34359]
  - - [15, 15, 1, 136, 15, 15, 136, 15]
    - [8, 3.15643]
  - - [15, 15, 1, 256, 15, 15, 256, 15]
    - [38, 6.27861]
  - - [15, 15, 1, 264, 15, 15, 264, 15]
    - [10, 5.71401]
  - - [15, 15, 1, 528, 15, 15, 528, 15]
    - [10, 10.156]
  - - [15, 15, 1, 544, 15, 15, 544, 15]
    - [4, 11.443]
  - - [15, 15, 1, 576, 15, 15, 576, 15]
    - [21, 12.3007]
  - - [15, 15, 1, 608, 15, 15, 608, 15]
    - [4, 12.9105]
  - - [15, 15, 1, 640, 15, 15, 640, 15]
    - [32, 13.2396]
  - - [15, 15, 1, 768, 15, 15, 768, 15]
    - [26, 14.8735]
  - - [15, 15, 1, 776, 15, 15, 776, 15]
    - [29, 13.2877]
  - - [32, 32, 1, 16, 32, 32, 16, 32]
    - [3, 2.29757]
  - - [32, 32, 1, 32, 32, 32, 32, 32]
    - [4, 5.2433]
  - - [32, 32, 1, 64, 32, 32, 64, 32]
    - [6, 10.4523]
  - - [32, 32, 1, 96, 32, 32, 96, 32]
    - [17, 14.1424]
  - - [32, 32, 1, 128, 32, 32, 128, 32]
    - [28, 19.1332]
  - - [32, 32, 1, 136, 32, 32, 136, 32]
    - [12, 17.8727]
  - - [32, 32, 1, 256, 32, 32, 256, 32]
    - [20, 34.6225]
  - - [32, 32, 1, 264, 32, 32, 264, 32]
    - [10, 31.3124]
  - - [32, 32, 1, 528, 32, 32, 528, 32]
    - [39, 53.2393]
  - - [32, 32, 1, 544, 32, 32, 544, 32]
    - [15, 58.5481]
  - - [32, 32, 1, 576, 32, 32, 576, 32]
    - [22, 65.293]
  - - [32, 32, 1, 608, 32, 32, 608, 32]
    - [39, 62.4152]
  - - [32, 32, 1, 640, 32, 32, 640, 32]
    - [37, 72.8664]
  - - [32, 32, 1, 768, 32, 32, 768, 32]
    - [37, 82.8303]
  - - [32, 32, 1, 776, 32, 32, 776, 32]
    - [30, 71.9964]
  - - [256, 256, 1, 16, 256, 256, 16, 256]
    - [9, 153.965]
  - - [256, 256, 1, 24, 256, 256, 24, 256]
    - [14, 228.266]
  - - [256, 256, 1, 32, 256, 256, 32, 256]
    - [7, 333.41]
  - - [256, 256, 1, 64, 256, 256, 64, 256]
    - [24, 660.52]
  - - [256, 256, 1, 96, 256, 256, 96, 256]
    - [2, 929.314]
  - - [256, 256, 1, 128, 256, 256, 128, 256]
    - [25, 1296.64]
  - - [256, 256, 1, 136, 256, 256, 136, 256]
    - [9, 1167.91]
  - - [256, 256, 1, 256, 256, 256, 256, 256]
    - [20, 2339.59]
  - - [256, 256, 1, 264, 256, 256, 264, 256]
    - [3, 2022.74]
  - - [256, 256, 1, 280, 256, 256, 280, 256]
    - [23, 2165.84]
  - - [256, 256, 1, 296, 256, 256, 296, 256]
    - [9, 2294.88]
  - - [256, 256, 1, 528, 256, 256, 528, 256]
    - [39, 3489.97]
  - - [256, 256, 1, 544, 256, 256, 544, 256]
    - [4, 3903.17]
  - - [256, 256, 1, 576, 256, 256, 576, 256]
    - [25, 4235.01]
  - - [256, 256, 1, 608, 256, 256, 608, 256]
    - [10, 4179.13]
  - - [256, 256, 1, 640, 256, 256, 640, 256]
    - [37, 4532.42]
  - - [256, 256, 1, 768, 256, 256, 768, 256]
    - [34, 5289.99]
  - - [256, 256, 1, 776, 256, 256, 776, 256]
    - [11, 4558.21]
  - - [256, 256, 1, 792, 256, 256, 792, 256]
    - [40, 4562.03]
  - - [256, 256, 1, 808, 256, 256, 808, 256]
    - [11, 4637.89]
  - - [255, 255, 1, 16, 255, 255, 16, 255]
    - [0, 124.853]
  - - [255, 255, 1, 32, 255, 255, 32, 255]
    - [2, 265.679]
  - - [255, 255, 1, 64, 255, 255, 64, 255]
    - [28, 527.285]
  - - [255, 255, 1, 96, 255, 255, 96, 255]
    - [18, 761.965]
  - - [255, 255, 1, 128, 255, 255, 128, 255]
    - [6, 980.007]
  - - [255, 255, 1, 136, 255, 255, 136, 255]
    - [17, 939.338]
  - - [255, 255, 1, 256, 255, 255, 256, 255]
    - [33, 1806.64]
  - - [255, 255, 1, 264, 255, 255, 264, 255]
    - [11, 1707.19]
  - - [255, 255, 1, 528, 255, 255, 528, 255]
    - [11, 3007.07]
  - - [255, 255, 1, 544, 255, 255, 544, 255]
    - [11, 3301.01]
  - - [255, 255, 1, 576, 255, 255, 576, 255]
    - [31, 3387.39]
  - - [255, 255, 1, 608, 255, 255, 608, 255]
    - [1, 3569.13]
  - - [255, 255, 1, 640, 255, 255, 640, 255]
    - [36, 3784.48]
  - - [255, 255, 1, 768, 255, 255, 768, 255]
    - [27, 4306.03]
  - - [255, 255, 1, 776, 255, 255, 776, 255]
    - [11, 3923.75]
  - - [264, 264, 1, 16, 264, 264, 16, 264]
    - [12, 136.45]
  - - [264, 264, 1, 32, 264, 264, 32, 264]
    - [6, 287.721]
  - - [264, 264, 1, 64, 264, 264, 64, 264]
    - [2, 562.348]
  - - [264, 264, 1, 96, 264, 264, 96, 264]
    - [13, 822.726]
  - - [264, 264, 1, 128, 264, 264, 128, 264]
    - [20, 1081.02]
  - - [264, 264, 1, 136, 264, 264, 136, 264]
    - [17, 1046.9]
  - - [264, 264, 1, 256, 264, 264, 256, 264]
    - [37, 2071.54]
  - - [264, 264, 1, 264, 264, 264, 264, 264]
    - [11, 1874.66]
  - - [264, 264, 1, 528, 264, 264, 528, 264]
    - [16, 3234.55]
  - - [264, 264, 1, 544, 264, 264, 544, 264]
    - [11, 3711.48]
  - - [264, 264, 1, 576, 264, 264, 576, 264]
    - [11, 3839.41]
  - - [264, 264, 1, 608, 264, 264, 608, 264]
    - [11, 3846.52]
  - - [264, 264, 1, 640, 264, 264, 640, 264]
    - [37, 4375.01]
  - - [264, 264, 1, 768, 264, 264, 768, 264]
    - [37, 4780.43]
  - - [264, 264, 1, 776, 264, 264, 776, 264]
    - [11, 4383.18]
- null
- null
- DeviceEfficiency
