library/src/hcc_detail/rocsparselt/src/spmm/Tensile/Logic/aquavanjaram/aquavanjaram_Cijk_Ailk_Bljk_BBS_BH_SA_AH.yaml
- {MinimumRequiredVersion: 4.33.0}
- aquavanjaram
- gfx940
- [Device 0049, Device 0050]
    SolutionIndex: 0
    SolutionNameMin: Cijk_Ailk_Bljk_BBS_BH_SA_AH_MT32x32x16_MI32x32x16x1_SN_1LDSB0_AFC1_DTVSM0_EPS0_GRVW8_GSU1_LPB8_MIWT1_1_PGR0_PLR1_SU0_SUS0_SRVW0_TLDS1_WG32_2_1
    SolutionIndex: 1
    SolutionNameMin: Cijk_Ailk_Bljk_BBS_BH_SA_AH_MT32x32x16_MI32x32x16x1_SN_1LDSB0_AFC1_DTVSM1_EPS1_GRVW8_GSU1_LPB8_MIWT1_1_PGR2_PLR0_SU0_SUS0_SRVW0_TLDS1_WG32_2_1
    SolutionIndex: 2
    SolutionNameMin: Cijk_Ailk_Bljk_BBS_BH_SA_AH_MT32x32x16_MI32x32x16x1_SN_1LDSB0_AFC1_DTVSM1_EPS0_GRVW8_GSU1_LPB8_MIWT1_1_PGR0_PLR1_SU0_SUS0_SRVW0_TLDS1_WG32_2_1
    SolutionIndex: 3
    SolutionNameMin: Cijk_Ailk_Bljk_BBS_BH_SA_AH_MT32x32x16_MI32x32x16x1_SN_1LDSB0_AFC1_DTVSM0_EPS0_GRVW4_GSU1_LPB8_MIWT1_1_PGR0_PLR0_SU4_SUS256_SRVW0_TLDS1_WG32_2_1
    SolutionIndex: 4
    SolutionNameMin: Cijk_Ailk_Bljk_BBS_BH_SA_AH_MT32x32x16_MI32x32x16x1_SN_1LDSB0_AFC1_DTVSM1_EPS1_GRVW4_GSU1_LPB8_MIWT1_1_PGR2_PLR1_SU4_SUS256_SRVW0_TLDS1_WG32_2_1
    SolutionIndex: 5
    SolutionNameMin: Cijk_Ailk_Bljk_BBS_BH_SA_AH_MT32x32x32_MI32x32x16x1_SN_1LDSB0_AFC1_DTVSM0_EPS1_GRVW4_GSU1_LPB8_MIWT1_1_PGR2_PLR0_SU0_SUS0_SRVW0_TLDS1_WG32_2_1
    SolutionIndex: 6
    SolutionNameMin: Cijk_Ailk_Bljk_BBS_BH_SA_AH_MT32x32x32_MI32x32x16x1_SN_1LDSB0_AFC1_DTVSM0_EPS1_GRVW8_GSU1_LPB8_MIWT1_1_PGR2_PLR0_SU0_SUS0_SRVW0_TLDS1_WG32_2_1
    SolutionIndex: 7
    SolutionNameMin: Cijk_Ailk_Bljk_BBS_BH_SA_AH_MT32x32x32_MI32x32x16x1_SN_1LDSB0_AFC1_DTVSM0_EPS1_GRVW4_GSU1_LPB8_MIWT1_1_PGR2_PLR2_SU0_SUS0_SRVW0_TLDS1_WG32_2_1
    SolutionIndex: 8
    SolutionNameMin: Cijk_Ailk_Bljk_BBS_BH_SA_AH_MT32x32x32_MI32x32x16x1_SN_1LDSB0_AFC1_DTVSM0_EPS1_GRVW8_GSU1_LPB8_MIWT1_1_PGR2_PLR2_SU0_SUS0_SRVW0_TLDS1_WG32_2_1
    SolutionIndex: 9
    SolutionNameMin: Cijk_Ailk_Bljk_BBS_BH_SA_AH_MT32x32x32_MI32x32x16x1_SN_1LDSB0_AFC1_DTVSM1_EPS1_GRVW4_GSU1_LPB8_MIWT1_1_PGR1_PLR0_SU0_SUS0_SRVW0_TLDS1_WG32_2_1
    SolutionIndex: 10
    SolutionNameMin: Cijk_Ailk_Bljk_BBS_BH_SA_AH_MT32x32x32_MI32x32x16x1_SN_1LDSB0_AFC1_DTVSM1_EPS1_GRVW8_GSU1_LPB2_MIWT1_1_PGR1_PLR0_SU0_SUS0_SRVW0_TLDS0_WG32_2_1
    SolutionIndex: 11
    SolutionNameMin: Cijk_Ailk_Bljk_BBS_BH_SA_AH_MT32x32x32_MI32x32x16x1_SN_1LDSB0_AFC1_DTVSM1_EPS1_GRVW8_GSU1_LPB8_MIWT1_1_PGR1_PLR0_SU0_SUS0_SRVW0_TLDS1_WG32_2_1
    SolutionIndex: 12
    SolutionNameMin: Cijk_Ailk_Bljk_BBS_BH_SA_AH_MT32x32x32_MI32x32x16x1_SN_1LDSB0_AFC1_DTVSM1_EPS1_GRVW4_GSU1_LPB8_MIWT1_1_PGR2_PLR0_SU0_SUS0_SRVW0_TLDS1_WG32_2_1
    SolutionIndex: 13
    SolutionNameMin: Cijk_Ailk_Bljk_BBS_BH_SA_AH_MT32x32x32_MI32x32x16x1_SN_1LDSB0_AFC1_DTVSM1_EPS0_GRVW8_GSU1_LPB8_MIWT1_1_PGR0_PLR1_SU0_SUS0_SRVW0_TLDS1_WG32_2_1
    SolutionIndex: 14
    SolutionNameMin: Cijk_Ailk_Bljk_BBS_BH_SA_AH_MT32x32x32_MI32x32x16x1_SN_1LDSB0_AFC1_DTVSM1_EPS1_GRVW8_GSU1_LPB8_MIWT1_1_PGR2_PLR1_SU0_SUS0_SRVW0_TLDS1_WG32_2_1
    SolutionIndex: 15
    SolutionNameMin: Cijk_Ailk_Bljk_BBS_BH_SA_AH_MT32x32x32_MI32x32x16x1_SN_1LDSB0_AFC1_DTVSM1_EPS0_GRVW4_GSU1_LPB2_MIWT1_1_PGR0_PLR2_SU0_SUS0_SRVW0_TLDS0_WG32_2_1
    SolutionIndex: 16
    SolutionNameMin: Cijk_Ailk_Bljk_BBS_BH_SA_AH_MT32x32x32_MI32x32x16x1_SN_1LDSB0_AFC1_DTVSM1_EPS1_GRVW8_GSU1_LPB8_MIWT1_1_PGR1_PLR2_SU0_SUS0_SRVW0_TLDS1_WG32_2_1
    SolutionIndex: 17
    SolutionNameMin: Cijk_Ailk_Bljk_BBS_BH_SA_AH_MT32x32x32_MI32x32x16x1_SN_1LDSB0_AFC1_DTVSM0_EPS1_GRVW4_GSU1_LPB8_MIWT1_1_PGR1_PLR0_SU4_SUS256_SRVW0_TLDS1_WG32_2_1
    SolutionIndex: 18
    SolutionNameMin: Cijk_Ailk_Bljk_BBS_BH_SA_AH_MT32x32x32_MI32x32x16x1_SN_1LDSB0_AFC1_DTVSM0_EPS1_GRVW8_GSU1_LPB8_MIWT1_1_PGR2_PLR0_SU4_SUS256_SRVW0_TLDS1_WG32_2_1
    SolutionIndex: 19
    SolutionNameMin: Cijk_Ailk_Bljk_BBS_BH_SA_AH_MT32x32x32_MI32x32x16x1_SN_1LDSB0_AFC1_DTVSM0_EPS0_GRVW4_GSU1_LPB2_MIWT1_1_PGR0_PLR1_SU4_SUS256_SRVW0_TLDS0_WG32_2_1
    SolutionIndex: 20
    SolutionNameMin: Cijk_Ailk_Bljk_BBS_BH_SA_AH_MT32x32x32_MI32x32x16x1_SN_1LDSB0_AFC1_DTVSM0_EPS0_GRVW4_GSU1_LPB8_MIWT1_1_PGR0_PLR1_SU4_SUS256_SRVW0_TLDS1_WG32_2_1
    SolutionIndex: 21
    SolutionNameMin: Cijk_Ailk_Bljk_BBS_BH_SA_AH_MT32x32x32_MI32x32x16x1_SN_1LDSB0_AFC1_DTVSM0_EPS1_GRVW8_GSU1_LPB8_MIWT1_1_PGR2_PLR1_SU4_SUS256_SRVW0_TLDS1_WG32_2_1
    SolutionIndex: 22
    SolutionNameMin: Cijk_Ailk_Bljk_BBS_BH_SA_AH_MT32x32x32_MI32x32x16x1_SN_1LDSB0_AFC1_DTVSM0_EPS1_GRVW8_GSU1_LPB8_MIWT1_1_PGR2_PLR2_SU4_SUS256_SRVW0_TLDS1_WG32_2_1
    SolutionIndex: 23
    SolutionNameMin: Cijk_Ailk_Bljk_BBS_BH_SA_AH_MT32x32x32_MI32x32x16x1_SN_1LDSB0_AFC1_DTVSM1_EPS1_GRVW8_GSU1_LPB8_MIWT1_1_PGR2_PLR0_SU4_SUS256_SRVW0_TLDS1_WG32_2_1
    SolutionIndex: 24
    SolutionNameMin: Cijk_Ailk_Bljk_BBS_BH_SA_AH_MT32x32x32_MI32x32x16x1_SN_1LDSB0_AFC1_DTVSM1_EPS1_GRVW8_GSU1_LPB2_MIWT1_1_PGR1_PLR1_SU4_SUS256_SRVW0_TLDS0_WG32_2_1
    SolutionIndex: 25
    SolutionNameMin: Cijk_Ailk_Bljk_BBS_BH_SA_AH_MT32x32x32_MI32x32x16x1_SN_1LDSB0_AFC1_DTVSM1_EPS0_GRVW4_GSU1_LPB2_MIWT1_1_PGR0_PLR2_SU4_SUS256_SRVW0_TLDS0_WG32_2_1
    SolutionIndex: 26
    SolutionNameMin: Cijk_Ailk_Bljk_BBS_BH_SA_AH_MT32x32x32_MI32x32x16x1_SN_1LDSB0_AFC1_DTVSM1_EPS1_GRVW4_GSU1_LPB2_MIWT1_1_PGR2_PLR2_SU4_SUS256_SRVW0_TLDS0_WG32_2_1
    SolutionIndex: 27
    SolutionNameMin: Cijk_Ailk_Bljk_BBS_BH_SA_AH_MT32x32x32_MI32x32x16x1_SN_1LDSB0_AFC1_DTVSM1_EPS1_GRVW8_GSU1_LPB8_MIWT1_1_PGR2_PLR2_SU4_SUS256_SRVW0_TLDS1_WG32_2_1
    SolutionIndex: 28
    SolutionNameMin: Cijk_Ailk_Bljk_BBS_BH_SA_AH_MT128x128x32_MI32x32x16x1_SN_1LDSB0_AFC1_DTVSM0_EPS1_GRVW4_GSU1_LPB8_MIWT2_2_PGR2_PLR2_SU0_SUS0_SRVW0_TLDS1_WG64_4_1
    SolutionIndex: 29
    SolutionNameMin: Cijk_Ailk_Bljk_BBS_BH_SA_AH_MT32x32x64_MI32x32x16x1_SN_1LDSB0_AFC1_DTVSM0_EPS0_GRVW8_GSU1_LPB8_MIWT1_1_PGR0_PLR0_SU0_SUS0_SRVW0_TLDS1_WG32_2_1
    SolutionIndex: 30
    SolutionNameMin: Cijk_Ailk_Bljk_BBS_BH_SA_AH_MT32x32x64_MI32x32x16x1_SN_1LDSB0_AFC1_DTVSM0_EPS1_GRVW8_GSU1_LPB8_MIWT1_1_PGR2_PLR0_SU0_SUS0_SRVW0_TLDS1_WG32_2_1
    SolutionIndex: 31
    SolutionNameMin: Cijk_Ailk_Bljk_BBS_BH_SA_AH_MT32x32x64_MI32x32x16x1_SN_1LDSB0_AFC1_DTVSM0_EPS0_GRVW8_GSU1_LPB8_MIWT1_1_PGR0_PLR1_SU0_SUS0_SRVW0_TLDS1_WG32_2_1
    SolutionIndex: 32
    SolutionNameMin: Cijk_Ailk_Bljk_BBS_BH_SA_AH_MT32x32x64_MI32x32x16x1_SN_1LDSB0_AFC1_DTVSM0_EPS1_GRVW4_GSU1_LPB8_MIWT1_1_PGR1_PLR1_SU0_SUS0_SRVW0_TLDS1_WG32_2_1
    SolutionIndex: 33
    SolutionNameMin: Cijk_Ailk_Bljk_BBS_BH_SA_AH_MT32x32x64_MI32x32x16x1_SN_1LDSB0_AFC1_DTVSM0_EPS1_GRVW8_GSU1_LPB8_MIWT1_1_PGR1_PLR1_SU0_SUS0_SRVW0_TLDS1_WG32_2_1
    SolutionIndex: 34
    SolutionNameMin: Cijk_Ailk_Bljk_BBS_BH_SA_AH_MT32x32x64_MI32x32x16x1_SN_1LDSB0_AFC1_DTVSM0_EPS1_GRVW8_GSU1_LPB8_MIWT1_1_PGR2_PLR1_SU0_SUS0_SRVW0_TLDS1_WG32_2_1
    SolutionIndex: 35
    SolutionNameMin: Cijk_Ailk_Bljk_BBS_BH_SA_AH_MT32x32x64_MI32x32x16x1_SN_1LDSB0_AFC1_DTVSM1_EPS1_GRVW8_GSU1_LPB2_MIWT1_1_PGR1_PLR0_SU0_SUS0_SRVW0_TLDS0_WG32_2_1
    SolutionIndex: 36
    SolutionNameMin: Cijk_Ailk_Bljk_BBS_BH_SA_AH_MT32x32x64_MI32x32x16x1_SN_1LDSB0_AFC1_DTVSM1_EPS1_GRVW4_GSU1_LPB2_MIWT1_1_PGR2_PLR0_SU0_SUS0_SRVW0_TLDS0_WG32_2_1
    SolutionIndex: 37
    SolutionNameMin: Cijk_Ailk_Bljk_BBS_BH_SA_AH_MT32x32x64_MI32x32x16x1_SN_1LDSB0_AFC1_DTVSM1_EPS0_GRVW4_GSU1_LPB8_MIWT1_1_PGR0_PLR1_SU0_SUS0_SRVW0_TLDS1_WG32_2_1
    SolutionIndex: 38
    SolutionNameMin: Cijk_Ailk_Bljk_BBS_BH_SA_AH_MT32x32x64_MI32x32x16x1_SN_1LDSB0_AFC1_DTVSM1_EPS0_GRVW8_GSU1_LPB8_MIWT1_1_PGR0_PLR1_SU0_SUS0_SRVW0_TLDS1_WG32_2_1
    SolutionIndex: 39
    SolutionNameMin: Cijk_Ailk_Bljk_BBS_BH_SA_AH_MT32x32x64_MI32x32x16x1_SN_1LDSB0_AFC1_DTVSM1_EPS1_GRVW8_GSU1_LPB8_MIWT1_1_PGR2_PLR1_SU0_SUS0_SRVW0_TLDS1_WG32_2_1
    SolutionIndex: 40
    SolutionNameMin: Cijk_Ailk_Bljk_BBS_BH_SA_AH_MT32x32x64_MI32x32x16x1_SN_1LDSB0_AFC1_DTVSM0_EPS0_GRVW4_GSU1_LPB2_MIWT1_1_PGR0_PLR0_SU4_SUS256_SRVW0_TLDS0_WG32_2_1
    SolutionIndex: 41
    SolutionNameMin: Cijk_Ailk_Bljk_BBS_BH_SA_AH_MT32x32x64_MI32x32x16x1_SN_1LDSB0_AFC1_DTVSM0_EPS1_GRVW8_GSU1_LPB8_MIWT1_1_PGR1_PLR0_SU4_SUS256_SRVW0_TLDS1_WG32_2_1
    SolutionIndex: 42
    SolutionNameMin: Cijk_Ailk_Bljk_BBS_BH_SA_AH_MT32x32x64_MI32x32x16x1_SN_1LDSB0_AFC1_DTVSM0_EPS0_GRVW8_GSU1_LPB8_MIWT1_1_PGR0_PLR1_SU4_SUS256_SRVW0_TLDS1_WG32_2_1
    SolutionIndex: 43
    SolutionNameMin: Cijk_Ailk_Bljk_BBS_BH_SA_AH_MT32x32x64_MI32x32x16x1_SN_1LDSB0_AFC1_DTVSM1_EPS1_GRVW8_GSU1_LPB8_MIWT1_1_PGR1_PLR0_SU4_SUS256_SRVW0_TLDS1_WG32_2_1
    SolutionIndex: 44
    SolutionNameMin: Cijk_Ailk_Bljk_BBS_BH_SA_AH_MT32x32x64_MI32x32x16x1_SN_1LDSB0_AFC1_DTVSM1_EPS0_GRVW4_GSU1_LPB8_MIWT1_1_PGR0_PLR1_SU4_SUS256_SRVW0_TLDS1_WG32_2_1
    SolutionIndex: 45
    SolutionNameMin: Cijk_Ailk_Bljk_BBS_BH_SA_AH_MT32x32x64_MI32x32x16x1_SN_1LDSB0_AFC1_DTVSM1_EPS0_GRVW8_GSU1_LPB8_MIWT1_1_PGR0_PLR1_SU4_SUS256_SRVW0_TLDS1_WG32_2_1
    SolutionIndex: 46
    SolutionNameMin: Cijk_Ailk_Bljk_BBS_BH_SA_AH_MT32x32x64_MI32x32x16x1_SN_1LDSB0_AFC1_DTVSM1_EPS1_GRVW8_GSU1_LPB8_MIWT1_1_PGR1_PLR1_SU4_SUS256_SRVW0_TLDS1_WG32_2_1
    SolutionIndex: 47
    SolutionNameMin: Cijk_Ailk_Bljk_BBS_BH_SA_AH_MT32x32x64_MI32x32x16x1_SN_1LDSB0_AFC1_DTVSM1_EPS1_GRVW8_GSU1_LPB8_MIWT1_1_PGR2_PLR1_SU4_SUS256_SRVW0_TLDS1_WG32_2_1
    SolutionIndex: 48
    SolutionNameMin: Cijk_Ailk_Bljk_BBS_BH_SA_AH_MT32x32x16_MI32x32x16x1_SN_1LDSB0_AFC1_DTVSM0_EPS1_GRVW4_GSU1_LPB8_MIWT1_1_PGR2_PLR0_SU0_SUS0_SRVW8_TLDS1_WG32_2_1
    SolutionIndex: 49
    SolutionNameMin: Cijk_Ailk_Bljk_BBS_BH_SA_AH_MT32x32x16_MI32x32x16x1_SN_1LDSB0_AFC1_DTVSM1_EPS1_GRVW8_GSU1_LPB8_MIWT1_1_PGR1_PLR1_SU0_SUS0_SRVW8_TLDS1_WG32_2_1
    SolutionIndex: 50
    SolutionNameMin: Cijk_Ailk_Bljk_BBS_BH_SA_AH_MT32x32x16_MI32x32x16x1_SN_1LDSB0_AFC1_DTVSM1_EPS1_GRVW8_GSU1_LPB8_MIWT1_1_PGR1_PLR0_SU4_SUS256_SRVW8_TLDS1_WG32_2_1
    SolutionIndex: 51
    SolutionNameMin: Cijk_Ailk_Bljk_BBS_BH_SA_AH_MT32x32x32_MI32x32x16x1_SN_1LDSB0_AFC1_DTVSM0_EPS1_GRVW4_GSU1_LPB8_MIWT1_1_PGR2_PLR2_SU0_SUS0_SRVW8_TLDS1_WG32_2_1
    SolutionIndex: 52
    SolutionNameMin: Cijk_Ailk_Bljk_BBS_BH_SA_AH_MT32x32x32_MI32x32x16x1_SN_1LDSB0_AFC1_DTVSM1_EPS1_GRVW8_GSU1_LPB2_MIWT1_1_PGR2_PLR0_SU0_SUS0_SRVW8_TLDS0_WG32_2_1
    SolutionIndex: 53
    SolutionNameMin: Cijk_Ailk_Bljk_BBS_BH_SA_AH_MT32x32x32_MI32x32x16x1_SN_1LDSB0_AFC1_DTVSM1_EPS1_GRVW8_GSU1_LPB8_MIWT1_1_PGR1_PLR1_SU0_SUS0_SRVW8_TLDS1_WG32_2_1
    SolutionIndex: 54
    SolutionNameMin: Cijk_Ailk_Bljk_BBS_BH_SA_AH_MT32x32x32_MI32x32x16x1_SN_1LDSB0_AFC1_DTVSM1_EPS1_GRVW8_GSU1_LPB8_MIWT1_1_PGR2_PLR1_SU0_SUS0_SRVW8_TLDS1_WG32_2_1
    SolutionIndex: 55
    SolutionNameMin: Cijk_Ailk_Bljk_BBS_BH_SA_AH_MT32x32x32_MI32x32x16x1_SN_1LDSB0_AFC1_DTVSM0_EPS1_GRVW4_GSU1_LPB8_MIWT1_1_PGR2_PLR0_SU4_SUS256_SRVW8_TLDS1_WG32_2_1
    SolutionIndex: 56
    SolutionNameMin: Cijk_Ailk_Bljk_BBS_BH_SA_AH_MT32x32x32_MI32x32x16x1_SN_1LDSB0_AFC1_DTVSM1_EPS1_GRVW8_GSU1_LPB8_MIWT1_1_PGR2_PLR0_SU4_SUS256_SRVW8_TLDS1_WG32_2_1
    SolutionIndex: 57
    SolutionNameMin: Cijk_Ailk_Bljk_BBS_BH_SA_AH_MT32x32x32_MI32x32x16x1_SN_1LDSB0_AFC1_DTVSM1_EPS1_GRVW4_GSU1_LPB8_MIWT1_1_PGR2_PLR1_SU4_SUS256_SRVW8_TLDS1_WG32_2_1
    SolutionIndex: 58
    SolutionNameMin: Cijk_Ailk_Bljk_BBS_BH_SA_AH_MT128x128x32_MI32x32x16x1_SN_1LDSB0_AFC1_DTVSM0_EPS1_GRVW8_GSU1_LPB8_MIWT2_2_PGR2_PLR1_SU0_SUS0_SRVW8_TLDS1_WG64_4_1
    SolutionIndex: 59
    SolutionNameMin: Cijk_Ailk_Bljk_BBS_BH_SA_AH_MT128x128x32_MI32x32x16x1_SN_1LDSB0_AFC1_DTVSM0_EPS1_GRVW4_GSU1_LPB8_MIWT2_2_PGR2_PLR2_SU0_SUS0_SRVW8_TLDS1_WG64_4_1
    SolutionIndex: 60
    SolutionNameMin: Cijk_Ailk_Bljk_BBS_BH_SA_AH_MT32x32x64_MI32x32x16x1_SN_1LDSB0_AFC1_DTVSM0_EPS1_GRVW8_GSU1_LPB8_MIWT1_1_PGR2_PLR1_SU0_SUS0_SRVW8_TLDS1_WG32_2_1
    SolutionIndex: 61
    SolutionNameMin: Cijk_Ailk_Bljk_BBS_BH_SA_AH_MT32x32x64_MI32x32x16x1_SN_1LDSB0_AFC1_DTVSM1_EPS0_GRVW8_GSU1_LPB8_MIWT1_1_PGR0_PLR0_SU0_SUS0_SRVW8_TLDS1_WG32_2_1
    SolutionIndex: 62
    SolutionNameMin: Cijk_Ailk_Bljk_BBS_BH_SA_AH_MT32x32x64_MI32x32x16x1_SN_1LDSB0_AFC1_DTVSM1_EPS1_GRVW8_GSU1_LPB8_MIWT1_1_PGR2_PLR0_SU4_SUS256_SRVW8_TLDS1_WG32_2_1
    SolutionIndex: 63
    SolutionNameMin: Cijk_Ailk_Bljk_BBS_BH_SA_AH_MT32x32x64_MI32x32x16x1_SN_1LDSB0_AFC1_DTVSM1_EPS0_GRVW4_GSU1_LPB8_MIWT1_1_PGR0_PLR1_SU4_SUS256_SRVW8_TLDS1_WG32_2_1
- - - [15, 15, 1, 16, 15, 15, 15, 16]
    - [2, 0.450422]
  - - [15, 15, 1, 32, 15, 15, 15, 32]
    - [7, 0.912316]
  - - [15, 15, 1, 64, 15, 15, 15, 64]
    - [21, 1.75771]
  - - [15, 15, 1, 96, 15, 15, 15, 96]
    - [16, 2.56746]
  - - [15, 15, 1, 128, 15, 15, 15, 128]
    - [42, 3.35919]
  - - [15, 15, 1, 136, 15, 15, 15, 136]
    - [6, 3.30668]
  - - [15, 15, 1, 256, 15, 15, 15, 256]
    - [39, 6.05392]
  - - [15, 15, 1, 264, 15, 15, 15, 264]
    - [47, 5.72503]
  - - [15, 15, 1, 528, 15, 15, 15, 528]
    - [39, 10.7448]
  - - [15, 15, 1, 544, 15, 15, 15, 544]
    - [8, 11.1511]
  - - [15, 15, 1, 576, 15, 15, 15, 576]
    - [18, 11.7211]
  - - [15, 15, 1, 608, 15, 15, 15, 608]
    - [41, 11.6149]
  - - [15, 15, 1, 640, 15, 15, 15, 640]
    - [47, 13.1429]
  - - [15, 15, 1, 768, 15, 15, 15, 768]
    - [39, 16.2459]
  - - [15, 15, 1, 776, 15, 15, 15, 776]
    - [47, 14.5518]
  - - [32, 32, 1, 16, 32, 32, 32, 16]
    - [49, 2.44155]
  - - [32, 32, 1, 32, 32, 32, 32, 32]
    - [10, 5.09611]
  - - [32, 32, 1, 64, 32, 32, 32, 64]
    - [31, 9.79538]
  - - [32, 32, 1, 96, 32, 32, 32, 96]
    - [11, 14.3081]
  - - [32, 32, 1, 128, 32, 32, 32, 128]
    - [42, 18.4856]
  - - [32, 32, 1, 136, 32, 32, 32, 136]
    - [9, 17.9649]
  - - [32, 32, 1, 256, 32, 32, 32, 256]
    - [33, 33.1325]
  - - [32, 32, 1, 264, 32, 32, 32, 264]
    - [22, 31.5334]
  - - [32, 32, 1, 528, 32, 32, 32, 528]
    - [34, 56.5882]
  - - [32, 32, 1, 544, 32, 32, 32, 544]
    - [5, 56.7556]
  - - [32, 32, 1, 576, 32, 32, 32, 576]
    - [54, 62.1227]
  - - [32, 32, 1, 608, 32, 32, 32, 608]
    - [39, 63.5622]
  - - [32, 32, 1, 640, 32, 32, 32, 640]
    - [47, 69.6118]
  - - [32, 32, 1, 768, 32, 32, 32, 768]
    - [30, 82.1382]
  - - [32, 32, 1, 776, 32, 32, 32, 776]
    - [47, 73.8738]
  - - [256, 256, 1, 16, 256, 256, 256, 16]
    - [50, 150.011]
  - - [256, 256, 1, 24, 256, 256, 256, 24]
    - [25, 209.953]
  - - [256, 256, 1, 32, 256, 256, 256, 32]
    - [59, 168.324]
  - - [256, 256, 1, 64, 256, 256, 256, 64]
    - [62, 542.495]
  - - [256, 256, 1, 96, 256, 256, 256, 96]
    - [50, 797.194]
  - - [256, 256, 1, 128, 256, 256, 256, 128]
    - [32, 1076.57]
  - - [256, 256, 1, 136, 256, 256, 256, 136]
    - [46, 1034.76]
  - - [256, 256, 1, 256, 256, 256, 256, 256]
    - [37, 1943.38]
  - - [256, 256, 1, 264, 256, 256, 256, 264]
    - [38, 2013.32]
  - - [256, 256, 1, 280, 256, 256, 256, 280]
    - [51, 1932.71]
  - - [256, 256, 1, 296, 256, 256, 256, 296]
    - [36, 1557.0]
  - - [256, 256, 1, 528, 256, 256, 256, 528]
    - [44, 3354.3]
  - - [256, 256, 1, 544, 256, 256, 256, 544]
    - [40, 2742.43]
  - - [256, 256, 1, 576, 256, 256, 256, 576]
    - [17, 3673.66]
  - - [256, 256, 1, 608, 256, 256, 256, 608]
    - [56, 3855.25]
  - - [256, 256, 1, 640, 256, 256, 256, 640]
    - [12, 4097.8]
  - - [256, 256, 1, 768, 256, 256, 256, 768]
    - [60, 4860.38]
  - - [256, 256, 1, 776, 256, 256, 256, 776]
    - [43, 4754.45]
  - - [256, 256, 1, 792, 256, 256, 256, 792]
    - [43, 4719.88]
  - - [256, 256, 1, 808, 256, 256, 256, 808]
    - [14, 4581.71]
  - - [255, 255, 1, 16, 255, 255, 255, 16]
    - [63, 103.266]
  - - [255, 255, 1, 32, 255, 255, 255, 32]
    - [38, 209.441]
  - - [255, 255, 1, 64, 255, 255, 255, 64]
    - [13, 448.738]
  - - [255, 255, 1, 96, 255, 255, 255, 96]
    - [28, 191.782]
  - - [255, 255, 1, 128, 255, 255, 255, 128]
    - [58, 332.416]
  - - [255, 255, 1, 136, 255, 255, 255, 136]
    - [48, 811.582]
  - - [255, 255, 1, 256, 255, 255, 255, 256]
    - [1, 1513.79]
  - - [255, 255, 1, 264, 255, 255, 255, 264]
    - [53, 1452.58]
  - - [255, 255, 1, 528, 255, 255, 255, 528]
    - [35, 2325.7]
  - - [255, 255, 1, 544, 255, 255, 255, 544]
    - [45, 2671.72]
  - - [255, 255, 1, 576, 255, 255, 255, 576]
    - [27, 2986.91]
  - - [255, 255, 1, 608, 255, 255, 255, 608]
    - [22, 3188.58]
  - - [255, 255, 1, 640, 255, 255, 255, 640]
    - [22, 3367.26]
  - - [255, 255, 1, 768, 255, 255, 255, 768]
    - [60, 3853.48]
  - - [255, 255, 1, 776, 255, 255, 255, 776]
    - [23, 3693.68]
  - - [264, 264, 1, 16, 264, 264, 264, 16]
    - [19, 127.978]
  - - [264, 264, 1, 32, 264, 264, 264, 32]
    - [3, 277.656]
  - - [264, 264, 1, 64, 264, 264, 264, 64]
    - [52, 382.617]
  - - [264, 264, 1, 96, 264, 264, 264, 96]
    - [57, 633.84]
  - - [264, 264, 1, 128, 264, 264, 264, 128]
    - [20, 1014.51]
  - - [264, 264, 1, 136, 264, 264, 264, 136]
    - [24, 848.05]
  - - [264, 264, 1, 256, 264, 264, 264, 256]
    - [26, 1494.57]
  - - [264, 264, 1, 264, 264, 264, 264, 264]
    - [15, 1625.85]
  - - [264, 264, 1, 528, 264, 264, 264, 528]
    - [0, 2319.69]
  - - [264, 264, 1, 544, 264, 264, 264, 544]
    - [29, 3113.24]
  - - [264, 264, 1, 576, 264, 264, 264, 576]
    - [55, 3280.08]
  - - [264, 264, 1, 608, 264, 264, 264, 608]
    - [34, 3585.65]
  - - [264, 264, 1, 640, 264, 264, 264, 640]
    - [4, 3474.08]
  - - [264, 264, 1, 768, 264, 264, 264, 768]
    - [61, 3465.96]
  - - [264, 264, 1, 776, 264, 264, 264, 776]
    - [22, 4426.41]
- null
- null
- DeviceEfficiency
