library/src/hcc_detail/rocsparselt/src/spmm/Tensile/Logic/aquavanjaram/aquavanjaram_Cijk_Alik_Bljk_HHS_BH_SA_AH.yaml
- {MinimumRequiredVersion: 4.33.0}
- aquavanjaram
- gfx940
- [Device 0049, Device 0050]
    SolutionIndex: 0
    SolutionNameMin: Cijk_Alik_Bljk_HHS_BH_SA_AH_MT32x32x16_MI32x32x16x1_SN_1LDSB0_GRVW4_LPA4_LPB8_MIWT1_1_PGR2_PLR1_SU4_TLDS1_VW8_WG32_2_1_WGM12
    SolutionIndex: 1
    SolutionNameMin: Cijk_Alik_Bljk_HHS_BH_SA_AH_MT32x32x16_MI32x32x16x1_SN_1LDSB0_GRVW8_LPA8_LPB8_MIWT1_1_PGR1_PLR1_SU8_TLDS1_VW8_WG32_2_1_WGM12
    SolutionIndex: 2
    SolutionNameMin: Cijk_Alik_Bljk_HHS_BH_SA_AH_MT32x32x16_MI32x32x16x1_SN_1LDSB0_GRVW4_LPA4_LPB8_MIWT1_1_PGR2_PLR1_SU8_TLDS1_VW8_WG32_2_1_WGM12
    SolutionIndex: 3
    SolutionNameMin: Cijk_Alik_Bljk_HHS_BH_SA_AH_MT32x32x16_MI32x32x16x1_SN_1LDSB0_GRVW8_LPA8_LPB8_MIWT1_1_PGR2_PLR1_SU8_TLDS1_VW4_WG32_2_1_WGM12
    SolutionIndex: 4
    SolutionNameMin: Cijk_Alik_Bljk_HHS_BH_SA_AH_MT32x32x16_MI32x32x16x1_SN_1LDSB0_GRVW4_LPA4_LPB8_MIWT1_1_PGR1_PLR1_SU4_TLDS1_VW4_WG32_2_1_WGM18
    SolutionIndex: 5
    SolutionNameMin: Cijk_Alik_Bljk_HHS_BH_SA_AH_MT32x32x16_MI32x32x16x1_SN_1LDSB0_GRVW4_LPA8_LPB8_MIWT1_1_PGR2_PLR1_SU4_TLDS0_VW8_WG32_2_1_WGM18
    SolutionIndex: 6
    SolutionNameMin: Cijk_Alik_Bljk_HHS_BH_SA_AH_MT32x32x16_MI32x32x16x1_SN_1LDSB0_GRVW4_LPA4_LPB8_MIWT1_1_PGR1_PLR1_SU4_TLDS1_VW8_WG32_2_1_WGM19
    SolutionIndex: 7
    SolutionNameMin: Cijk_Alik_Bljk_HHS_BH_SA_AH_MT32x32x16_MI32x32x16x1_SN_1LDSB0_GRVW8_LPA8_LPB8_MIWT1_1_PGR1_PLR1_SU4_TLDS1_VW4_WG32_2_1_WGM19
    SolutionIndex: 8
    SolutionNameMin: Cijk_Alik_Bljk_HHS_BH_SA_AH_MT32x32x16_MI32x32x16x1_SN_1LDSB0_GRVW8_LPA8_LPB8_MIWT1_1_PGR2_PLR1_SU8_TLDS1_VW4_WG32_2_1_WGM19
    SolutionIndex: 9
    SolutionNameMin: Cijk_Alik_Bljk_HHS_BH_SA_AH_MT32x32x16_MI32x32x16x1_SN_1LDSB0_GRVW8_LPA8_LPB8_MIWT1_1_PGR2_PLR1_SU8_TLDS1_VW8_WG32_2_1_WGM19
    SolutionIndex: 10
    SolutionNameMin: Cijk_Alik_Bljk_HHS_BH_SA_AH_MT128x128x16_MI32x32x16x1_SN_1LDSB0_GRVW4_LPA4_LPB4_MIWT2_2_PGR2_PLR1_SU8_TLDS0_VW4_WG64_4_1_WGM18
    SolutionIndex: 11
    SolutionNameMin: Cijk_Alik_Bljk_HHS_BH_SA_AH_MT128x128x16_MI32x32x16x1_SN_1LDSB0_GRVW8_LPA4_LPB4_MIWT2_2_PGR2_PLR1_SU8_TLDS0_VW4_WG64_4_1_WGM19
    SolutionIndex: 12
    SolutionNameMin: Cijk_Alik_Bljk_HHS_BH_SA_AH_MT256x256x16_MI32x32x16x1_SN_1LDSB0_GRVW8_LPA8_LPB8_MIWT2_4_PGR1_PLR1_SU8_TLDS1_VW4_WG128_4_1_WGM19
    SolutionIndex: 13
    SolutionNameMin: Cijk_Alik_Bljk_HHS_BH_SA_AH_MT128x128x16_MI32x32x16x1_SN_1LDSB1_GRVW4_LPA4_LPB8_MIWT2_2_PGR1_PLR1_SU4_TLDS1_VW8_WG64_4_1_WGM12
    SolutionIndex: 14
    SolutionNameMin: Cijk_Alik_Bljk_HHS_BH_SA_AH_MT128x128x16_MI32x32x16x1_SN_1LDSB1_GRVW4_LPA4_LPB8_MIWT2_2_PGR2_PLR1_SU4_TLDS1_VW4_WG64_4_1_WGM18
    SolutionIndex: 15
    SolutionNameMin: Cijk_Alik_Bljk_HHS_BH_SA_AH_MT128x128x16_MI32x32x16x1_SN_1LDSB1_GRVW8_LPA8_LPB8_MIWT2_2_PGR2_PLR1_SU8_TLDS0_VW8_WG64_4_1_WGM19
    SolutionIndex: 16
    SolutionNameMin: Cijk_Alik_Bljk_HHS_BH_SA_AH_MT256x256x16_MI32x32x16x1_SN_1LDSB1_GRVW4_LPA4_LPB8_MIWT4_4_PGR1_PLR1_SU4_TLDS1_VW4_WG64_4_1_WGM19
    SolutionIndex: 17
    SolutionNameMin: Cijk_Alik_Bljk_HHS_BH_SA_AH_MT32x32x32_MI32x32x16x1_SN_1LDSB0_GRVW8_LPA8_LPB8_MIWT1_1_PGR1_PLR1_SU4_TLDS1_VW4_WG32_2_1_WGM12
    SolutionIndex: 18
    SolutionNameMin: Cijk_Alik_Bljk_HHS_BH_SA_AH_MT32x32x32_MI32x32x16x1_SN_1LDSB0_GRVW8_LPA8_LPB8_MIWT1_1_PGR1_PLR3_SU4_TLDS1_VW4_WG32_2_1_WGM12
    SolutionIndex: 19
    SolutionNameMin: Cijk_Alik_Bljk_HHS_BH_SA_AH_MT32x32x32_MI32x32x16x1_SN_1LDSB0_GRVW8_LPA8_LPB8_MIWT1_1_PGR1_PLR3_SU4_TLDS1_VW8_WG32_2_1_WGM12
    SolutionIndex: 20
    SolutionNameMin: Cijk_Alik_Bljk_HHS_BH_SA_AH_MT32x32x32_MI32x32x16x1_SN_1LDSB0_GRVW4_LPA4_LPB8_MIWT1_1_PGR1_PLR1_SU8_TLDS1_VW8_WG32_2_1_WGM12
    SolutionIndex: 21
    SolutionNameMin: Cijk_Alik_Bljk_HHS_BH_SA_AH_MT32x32x32_MI32x32x16x1_SN_1LDSB0_GRVW8_LPA8_LPB8_MIWT1_1_PGR1_PLR1_SU8_TLDS1_VW4_WG32_2_1_WGM12
    SolutionIndex: 22
    SolutionNameMin: Cijk_Alik_Bljk_HHS_BH_SA_AH_MT32x32x32_MI32x32x16x1_SN_1LDSB0_GRVW8_LPA8_LPB8_MIWT1_1_PGR2_PLR3_SU8_TLDS1_VW8_WG32_2_1_WGM12
    SolutionIndex: 23
    SolutionNameMin: Cijk_Alik_Bljk_HHS_BH_SA_AH_MT32x32x32_MI32x32x16x1_SN_1LDSB0_GRVW8_LPA8_LPB8_MIWT1_1_PGR1_PLR1_SU4_TLDS1_VW8_WG32_2_1_WGM18
    SolutionIndex: 24
    SolutionNameMin: Cijk_Alik_Bljk_HHS_BH_SA_AH_MT32x32x32_MI32x32x16x1_SN_1LDSB0_GRVW4_LPA4_LPB8_MIWT1_1_PGR2_PLR1_SU4_TLDS1_VW8_WG32_2_1_WGM18
    SolutionIndex: 25
    SolutionNameMin: Cijk_Alik_Bljk_HHS_BH_SA_AH_MT32x32x32_MI32x32x16x1_SN_1LDSB0_GRVW8_LPA8_LPB8_MIWT1_1_PGR2_PLR1_SU4_TLDS0_VW8_WG32_2_1_WGM18
    SolutionIndex: 26
    SolutionNameMin: Cijk_Alik_Bljk_HHS_BH_SA_AH_MT32x32x32_MI32x32x16x1_SN_1LDSB0_GRVW4_LPA4_LPB8_MIWT1_1_PGR1_PLR3_SU4_TLDS1_VW8_WG32_2_1_WGM18
    SolutionIndex: 27
    SolutionNameMin: Cijk_Alik_Bljk_HHS_BH_SA_AH_MT32x32x32_MI32x32x16x1_SN_1LDSB0_GRVW8_LPA8_LPB8_MIWT1_1_PGR1_PLR3_SU4_TLDS1_VW4_WG32_2_1_WGM18
    SolutionIndex: 28
    SolutionNameMin: Cijk_Alik_Bljk_HHS_BH_SA_AH_MT32x32x32_MI32x32x16x1_SN_1LDSB0_GRVW8_LPA8_LPB8_MIWT1_1_PGR2_PLR3_SU4_TLDS1_VW8_WG32_2_1_WGM18
    SolutionIndex: 29
    SolutionNameMin: Cijk_Alik_Bljk_HHS_BH_SA_AH_MT32x32x32_MI32x32x16x1_SN_1LDSB0_GRVW8_LPA8_LPB8_MIWT1_1_PGR1_PLR3_SU8_TLDS1_VW8_WG32_2_1_WGM18
    SolutionIndex: 30
    SolutionNameMin: Cijk_Alik_Bljk_HHS_BH_SA_AH_MT32x32x32_MI32x32x16x1_SN_1LDSB0_GRVW8_LPA8_LPB8_MIWT1_1_PGR2_PLR1_SU4_TLDS1_VW4_WG32_2_1_WGM19
    SolutionIndex: 31
    SolutionNameMin: Cijk_Alik_Bljk_HHS_BH_SA_AH_MT32x32x32_MI32x32x16x1_SN_1LDSB0_GRVW4_LPA4_LPB8_MIWT1_1_PGR2_PLR3_SU4_TLDS1_VW4_WG32_2_1_WGM19
    SolutionIndex: 32
    SolutionNameMin: Cijk_Alik_Bljk_HHS_BH_SA_AH_MT32x32x32_MI32x32x16x1_SN_1LDSB0_GRVW8_LPA8_LPB8_MIWT1_1_PGR2_PLR3_SU4_TLDS1_VW8_WG32_2_1_WGM19
    SolutionIndex: 33
    SolutionNameMin: Cijk_Alik_Bljk_HHS_BH_SA_AH_MT32x32x32_MI32x32x16x1_SN_1LDSB0_GRVW4_LPA4_LPB8_MIWT1_1_PGR2_PLR3_SU8_TLDS1_VW4_WG32_2_1_WGM19
    SolutionIndex: 34
    SolutionNameMin: Cijk_Alik_Bljk_HHS_BH_SA_AH_MT128x128x32_MI32x32x16x1_SN_1LDSB0_GRVW8_LPA8_LPB8_MIWT2_2_PGR2_PLR1_SU4_TLDS1_VW4_WG64_4_1_WGM12
    SolutionIndex: 35
    SolutionNameMin: Cijk_Alik_Bljk_HHS_BH_SA_AH_MT128x128x32_MI32x32x16x1_SN_1LDSB0_GRVW4_LPA4_LPB8_MIWT2_2_PGR1_PLR3_SU8_TLDS1_VW8_WG64_4_1_WGM12
    SolutionIndex: 36
    SolutionNameMin: Cijk_Alik_Bljk_HHS_BH_SA_AH_MT128x128x32_MI32x32x16x1_SN_1LDSB0_GRVW8_LPA8_LPB8_MIWT2_2_PGR1_PLR3_SU8_TLDS1_VW4_WG64_4_1_WGM18
    SolutionIndex: 37
    SolutionNameMin: Cijk_Alik_Bljk_HHS_BH_SA_AH_MT128x128x32_MI32x32x16x1_SN_1LDSB0_GRVW4_LPA4_LPB8_MIWT2_4_PGR2_PLR1_SU4_TLDS1_VW8_WG64_2_1_WGM19
    SolutionIndex: 38
    SolutionNameMin: Cijk_Alik_Bljk_HHS_BH_SA_AH_MT256x256x32_MI32x32x16x1_SN_1LDSB0_GRVW8_LPA8_LPB8_MIWT4_4_PGR1_PLR1_SU8_TLDS1_VW8_WG64_4_1_WGM18
    SolutionIndex: 39
    SolutionNameMin: Cijk_Alik_Bljk_HHS_BH_SA_AH_MT128x128x32_MI32x32x16x1_SN_1LDSB1_GRVW8_LPA8_LPB8_MIWT4_2_PGR1_PLR3_SU8_TLDS1_VW8_WG32_4_1_WGM18
    SolutionIndex: 40
    SolutionNameMin: Cijk_Alik_Bljk_HHS_BH_SA_AH_MT32x32x64_MI32x32x16x1_SN_1LDSB0_GRVW4_LPA4_LPB8_MIWT1_1_PGR1_PLR1_SU4_TLDS1_VW4_WG32_2_1_WGM12
    SolutionIndex: 41
    SolutionNameMin: Cijk_Alik_Bljk_HHS_BH_SA_AH_MT32x32x64_MI32x32x16x1_SN_1LDSB0_GRVW8_LPA8_LPB8_MIWT1_1_PGR2_PLR1_SU4_TLDS1_VW8_WG32_2_1_WGM12
    SolutionIndex: 42
    SolutionNameMin: Cijk_Alik_Bljk_HHS_BH_SA_AH_MT32x32x64_MI32x32x16x1_SN_1LDSB0_GRVW4_LPA8_LPB8_MIWT1_1_PGR2_PLR5_SU8_TLDS0_VW8_WG32_2_1_WGM12
    SolutionIndex: 43
    SolutionNameMin: Cijk_Alik_Bljk_HHS_BH_SA_AH_MT32x32x64_MI32x32x16x1_SN_1LDSB0_GRVW8_LPA8_LPB8_MIWT1_1_PGR2_PLR5_SU8_TLDS1_VW8_WG32_2_1_WGM12
    SolutionIndex: 44
    SolutionNameMin: Cijk_Alik_Bljk_HHS_BH_SA_AH_MT32x32x64_MI32x32x16x1_SN_1LDSB0_GRVW8_LPA8_LPB8_MIWT1_1_PGR2_PLR1_SU4_TLDS1_VW8_WG32_2_1_WGM18
    SolutionIndex: 45
    SolutionNameMin: Cijk_Alik_Bljk_HHS_BH_SA_AH_MT32x32x64_MI32x32x16x1_SN_1LDSB0_GRVW8_LPA8_LPB8_MIWT1_1_PGR2_PLR5_SU4_TLDS1_VW8_WG32_2_1_WGM18
    SolutionIndex: 46
    SolutionNameMin: Cijk_Alik_Bljk_HHS_BH_SA_AH_MT32x32x64_MI32x32x16x1_SN_1LDSB0_GRVW8_LPA8_LPB8_MIWT1_1_PGR1_PLR1_SU8_TLDS1_VW8_WG32_2_1_WGM18
    SolutionIndex: 47
    SolutionNameMin: Cijk_Alik_Bljk_HHS_BH_SA_AH_MT32x32x64_MI32x32x16x1_SN_1LDSB0_GRVW4_LPA4_LPB8_MIWT1_1_PGR1_PLR5_SU8_TLDS1_VW8_WG32_2_1_WGM18
    SolutionIndex: 48
    SolutionNameMin: Cijk_Alik_Bljk_HHS_BH_SA_AH_MT32x32x64_MI32x32x16x1_SN_1LDSB0_GRVW8_LPA8_LPB8_MIWT1_1_PGR1_PLR1_SU4_TLDS1_VW8_WG32_2_1_WGM19
    SolutionIndex: 49
    SolutionNameMin: Cijk_Alik_Bljk_HHS_BH_SA_AH_MT32x32x64_MI32x32x16x1_SN_1LDSB0_GRVW8_LPA8_LPB8_MIWT1_1_PGR2_PLR1_SU4_TLDS1_VW4_WG32_2_1_WGM19
    SolutionIndex: 50
    SolutionNameMin: Cijk_Alik_Bljk_HHS_BH_SA_AH_MT32x32x64_MI32x32x16x1_SN_1LDSB0_GRVW8_LPA8_LPB8_MIWT1_1_PGR1_PLR5_SU4_TLDS1_VW8_WG32_2_1_WGM19
    SolutionIndex: 51
    SolutionNameMin: Cijk_Alik_Bljk_HHS_BH_SA_AH_MT32x32x64_MI32x32x16x1_SN_1LDSB0_GRVW4_LPA4_LPB8_MIWT1_1_PGR2_PLR5_SU4_TLDS1_VW4_WG32_2_1_WGM19
    SolutionIndex: 52
    SolutionNameMin: Cijk_Alik_Bljk_HHS_BH_SA_AH_MT32x32x64_MI32x32x16x1_SN_1LDSB0_GRVW8_LPA8_LPB8_MIWT1_1_PGR2_PLR5_SU4_TLDS1_VW4_WG32_2_1_WGM19
    SolutionIndex: 53
    SolutionNameMin: Cijk_Alik_Bljk_HHS_BH_SA_AH_MT32x32x64_MI32x32x16x1_SN_1LDSB0_GRVW8_LPA8_LPB8_MIWT1_1_PGR2_PLR1_SU8_TLDS1_VW4_WG32_2_1_WGM19
    SolutionIndex: 54
    SolutionNameMin: Cijk_Alik_Bljk_HHS_BH_SA_AH_MT32x32x64_MI32x32x16x1_SN_1LDSB0_GRVW4_LPA4_LPB8_MIWT1_1_PGR1_PLR5_SU8_TLDS1_VW4_WG32_2_1_WGM19
    SolutionIndex: 55
    SolutionNameMin: Cijk_Alik_Bljk_HHS_BH_SA_AH_MT32x32x64_MI32x32x16x1_SN_1LDSB0_GRVW8_LPA8_LPB8_MIWT1_1_PGR1_PLR5_SU8_TLDS1_VW8_WG32_2_1_WGM19
    SolutionIndex: 56
    SolutionNameMin: Cijk_Alik_Bljk_HHS_BH_SA_AH_MT32x32x64_MI32x32x16x1_SN_1LDSB0_GRVW8_LPA8_LPB8_MIWT1_1_PGR2_PLR5_SU8_TLDS1_VW4_WG32_2_1_WGM19
    SolutionIndex: 57
    SolutionNameMin: Cijk_Alik_Bljk_HHS_BH_SA_AH_MT128x128x64_MI32x32x16x1_SN_1LDSB0_GRVW4_LPA4_LPB8_MIWT2_2_PGR1_PLR5_SU8_TLDS1_VW8_WG64_4_1_WGM12
    SolutionIndex: 58
    SolutionNameMin: Cijk_Alik_Bljk_HHS_BH_SA_AH_MT128x128x64_MI32x32x16x1_SN_1LDSB0_GRVW4_LPA4_LPB8_MIWT2_2_PGR2_PLR5_SU8_TLDS1_VW4_WG64_4_1_WGM19
    SolutionIndex: 59
    SolutionNameMin: Cijk_Alik_Bljk_HHS_BH_SA_AH_MT128x128x64_MI32x32x16x1_SN_1LDSB0_GRVW8_LPA8_LPB8_MIWT2_4_PGR1_PLR5_SU8_TLDS1_VW4_WG64_2_1_WGM12
    SolutionIndex: 60
    SolutionNameMin: Cijk_Alik_Bljk_HHS_BH_SA_AH_MT128x128x64_MI32x32x16x1_SN_1LDSB1_GRVW4_LPA4_LPB8_MIWT4_2_PGR2_PLR1_SU8_TLDS1_VW8_WG32_4_1_WGM18
    SolutionIndex: 61
    SolutionNameMin: Cijk_Alik_Bljk_HHS_BH_SA_AH_MT256x256x64_MI32x32x16x1_SN_1LDSB1_GRVW4_LPA4_LPB8_MIWT2_4_PGR2_PLR1_SU8_TLDS1_VW8_WG128_4_1_WGM12
- - - [15, 15, 1, 16, 15, 15, 16, 16]
    - [0, 0.0]
  - - [15, 15, 1, 32, 15, 15, 32, 32]
    - [33, 0.0]
  - - [15, 15, 1, 64, 15, 15, 64, 64]
    - [1, 0.0]
  - - [15, 15, 1, 96, 15, 15, 96, 96]
    - [31, 0.0]
  - - [15, 15, 1, 128, 15, 15, 128, 128]
    - [19, 0.0]
  - - [15, 15, 1, 136, 15, 15, 136, 136]
    - [20, 0.0]
  - - [15, 15, 1, 256, 15, 15, 256, 256]
    - [47, 0.0]
  - - [15, 15, 1, 264, 15, 15, 264, 264]
    - [46, 0.0]
  - - [15, 15, 1, 528, 15, 15, 528, 528]
    - [44, 0.001]
  - - [15, 15, 1, 544, 15, 15, 544, 544]
    - [44, 0.001]
  - - [15, 15, 1, 576, 15, 15, 576, 576]
    - [44, 0.001]
  - - [15, 15, 1, 608, 15, 15, 608, 608]
    - [28, 0.001]
  - - [15, 15, 1, 640, 15, 15, 640, 640]
    - [44, 0.001]
  - - [15, 15, 1, 768, 15, 15, 768, 768]
    - [44, 0.001]
  - - [15, 15, 1, 776, 15, 15, 776, 776]
    - [56, 0.001]
  - - [32, 32, 1, 16, 32, 32, 16, 16]
    - [4, 0.0]
  - - [32, 32, 1, 32, 32, 32, 32, 32]
    - [24, 0.0]
  - - [32, 32, 1, 64, 32, 32, 64, 64]
    - [19, 0.001]
  - - [32, 32, 1, 96, 32, 32, 96, 96]
    - [19, 0.001]
  - - [32, 32, 1, 128, 32, 32, 128, 128]
    - [19, 0.002]
  - - [32, 32, 1, 136, 32, 32, 136, 136]
    - [23, 0.002]
  - - [32, 32, 1, 256, 32, 32, 256, 256]
    - [53, 0.003]
  - - [32, 32, 1, 264, 32, 32, 264, 264]
    - [48, 0.003]
  - - [32, 32, 1, 528, 32, 32, 528, 528]
    - [44, 0.005]
  - - [32, 32, 1, 544, 32, 32, 544, 544]
    - [53, 0.005]
  - - [32, 32, 1, 576, 32, 32, 576, 576]
    - [49, 0.006]
  - - [32, 32, 1, 608, 32, 32, 608, 608]
    - [41, 0.005]
  - - [32, 32, 1, 640, 32, 32, 640, 640]
    - [56, 0.006]
  - - [32, 32, 1, 768, 32, 32, 768, 768]
    - [53, 0.007]
  - - [32, 32, 1, 776, 32, 32, 776, 776]
    - [45, 0.007]
  - - [256, 256, 1, 16, 256, 256, 16, 16]
    - [11, 0.008]
  - - [256, 256, 1, 24, 256, 256, 24, 24]
    - [12, 0.002]
  - - [256, 256, 1, 32, 256, 256, 32, 32]
    - [49, 0.025]
  - - [256, 256, 1, 64, 256, 256, 64, 64]
    - [26, 0.054]
  - - [256, 256, 1, 96, 256, 256, 96, 96]
    - [21, 0.078]
  - - [256, 256, 1, 128, 256, 256, 128, 128]
    - [29, 0.103]
  - - [256, 256, 1, 136, 256, 256, 136, 136]
    - [6, 0.098]
  - - [256, 256, 1, 256, 256, 256, 256, 256]
    - [50, 0.185]
  - - [256, 256, 1, 264, 256, 256, 264, 264]
    - [34, 0.102]
  - - [256, 256, 1, 280, 256, 256, 280, 280]
    - [55, 0.184]
  - - [256, 256, 1, 296, 256, 256, 296, 296]
    - [50, 0.186]
  - - [256, 256, 1, 528, 256, 256, 528, 528]
    - [49, 0.306]
  - - [256, 256, 1, 544, 256, 256, 544, 544]
    - [3, 0.277]
  - - [256, 256, 1, 576, 256, 256, 576, 576]
    - [22, 0.342]
  - - [256, 256, 1, 608, 256, 256, 608, 608]
    - [30, 0.351]
  - - [256, 256, 1, 640, 256, 256, 640, 640]
    - [9, 0.322]
  - - [256, 256, 1, 768, 256, 256, 768, 768]
    - [17, 0.373]
  - - [256, 256, 1, 776, 256, 256, 776, 776]
    - [59, 0.165]
  - - [256, 256, 1, 792, 256, 256, 792, 792]
    - [8, 0.285]
  - - [256, 256, 1, 808, 256, 256, 808, 808]
    - [57, 0.191]
  - - [255, 255, 1, 16, 255, 255, 16, 16]
    - [42, 0.008]
  - - [255, 255, 1, 32, 255, 255, 32, 32]
    - [13, 0.008]
  - - [255, 255, 1, 64, 255, 255, 64, 64]
    - [38, 0.005]
  - - [255, 255, 1, 96, 255, 255, 96, 96]
    - [58, 0.023]
  - - [255, 255, 1, 128, 255, 255, 128, 128]
    - [27, 0.074]
  - - [255, 255, 1, 136, 255, 255, 136, 136]
    - [54, 0.071]
  - - [255, 255, 1, 256, 255, 255, 256, 256]
    - [50, 0.139]
  - - [255, 255, 1, 264, 255, 255, 264, 264]
    - [15, 0.051]
  - - [255, 255, 1, 528, 255, 255, 528, 528]
    - [61, 0.031]
  - - [255, 255, 1, 544, 255, 255, 544, 544]
    - [43, 0.242]
  - - [255, 255, 1, 576, 255, 255, 576, 576]
    - [14, 0.106]
  - - [255, 255, 1, 608, 255, 255, 608, 608]
    - [16, 0.037]
  - - [255, 255, 1, 640, 255, 255, 640, 640]
    - [36, 0.11]
  - - [255, 255, 1, 768, 255, 255, 768, 768]
    - [32, 0.322]
  - - [255, 255, 1, 776, 255, 255, 776, 776]
    - [35, 0.108]
  - - [264, 264, 1, 16, 264, 264, 16, 16]
    - [51, 0.01]
  - - [264, 264, 1, 32, 264, 264, 32, 32]
    - [60, 0.005]
  - - [264, 264, 1, 64, 264, 264, 64, 64]
    - [7, 0.041]
  - - [264, 264, 1, 96, 264, 264, 96, 96]
    - [18, 0.061]
  - - [264, 264, 1, 128, 264, 264, 128, 128]
    - [8, 0.074]
  - - [264, 264, 1, 136, 264, 264, 136, 136]
    - [40, 0.074]
  - - [264, 264, 1, 256, 264, 264, 256, 256]
    - [2, 0.14]
  - - [264, 264, 1, 264, 264, 264, 264, 264]
    - [0, 0.135]
  - - [264, 264, 1, 528, 264, 264, 528, 528]
    - [52, 0.264]
  - - [264, 264, 1, 544, 264, 264, 544, 544]
    - [5, 0.213]
  - - [264, 264, 1, 576, 264, 264, 576, 576]
    - [32, 0.288]
  - - [264, 264, 1, 608, 264, 264, 608, 608]
    - [25, 0.236]
  - - [264, 264, 1, 640, 264, 264, 640, 640]
    - [39, 0.084]
  - - [264, 264, 1, 768, 264, 264, 768, 768]
    - [10, 0.125]
  - - [264, 264, 1, 776, 264, 264, 776, 776]
    - [37, 0.098]
- null
- null
- DeviceEfficiency
