library/src/hcc_detail/rocsparselt/src/spmm/Tensile/Logic/aquavanjaram/gfx941/aquavanjaram_Cijk_Alik_Bljk_I8HS_BH_BiasS_SPA_AS.yaml
- {MinimumRequiredVersion: 4.33.0}
- aquavanjaram
- gfx941
- [Device 0049, Device 0050]
    SolutionIndex: 0
    SolutionNameMin: Cijk_Alik_Bljk_I8HS_BH_BiasS_SPA_AS_MT32x32x64_MI32x32x1_SN_LDSB0_AFC1_AFEM8_DTVSM0_GRVWA8_GSU1_LPA8_LPB16_LPM2_MIWT1_1_PLR1_SU0_SUS0_TLDS1_WG32_2_1
    SolutionIndex: 1
    SolutionNameMin: Cijk_Alik_Bljk_I8HS_BH_BiasS_SPA_AS_MT32x32x64_MI32x32x1_SN_LDSB0_AFC1_AFEM8_DTVSM0_GRVWA16_GSU1_LPA16_LPB16_LPM4_MIWT1_1_PLR1_SU0_SUS0_TLDS1_WG32_2_1
    SolutionIndex: 2
    SolutionNameMin: Cijk_Alik_Bljk_I8HS_BH_BiasS_SPA_AS_MT32x32x64_MI32x32x1_SN_LDSB0_AFC1_AFEM8_DTVSM1_GRVWA16_GSU1_LPA16_LPB16_LPMn1_MIWT1_1_PLR1_SU0_SUS0_TLDS1_WG32_2_1
    SolutionIndex: 3
    SolutionNameMin: Cijk_Alik_Bljk_I8HS_BH_BiasS_SPA_AS_MT32x32x64_MI32x32x1_SN_LDSB0_AFC1_AFEM1_DTVSM1_GRVWA8_GSU1_LPA8_LPB16_LPMn1_MIWT1_1_PLR1_SU4_SUS256_TLDS1_WG32_2_1
    SolutionIndex: 4
    SolutionNameMin: Cijk_Alik_Bljk_I8HS_BH_BiasS_SPA_AS_MT32x32x64_MI32x32x1_SN_LDSB0_AFC1_AFEM8_DTVSM0_GRVWA8_GSU1_LPA0_LPB0_LPM2_MIWT1_1_PLR1_SU4_SUS256_TLDS0_WG32_2_1
    SolutionIndex: 5
    SolutionNameMin: Cijk_Alik_Bljk_I8HS_BH_BiasS_SPA_AS_MT32x32x64_MI32x32x1_SN_LDSB0_AFC1_AFEM8_DTVSM1_GRVWA8_GSU1_LPA8_LPB16_LPMn1_MIWT1_1_PLR1_SU4_SUS256_TLDS1_WG32_2_1
    SolutionIndex: 6
    SolutionNameMin: Cijk_Alik_Bljk_I8HS_BH_BiasS_SPA_AS_MT32x32x64_MI32x32x1_SN_LDSB0_AFC0_AFEM8_DTVSM1_GRVWA16_GSU2_LPA16_LPB16_LPMn1_MIWT1_1_PLR1_SU4_SUS256_TLDS1_WG32_2_1
    SolutionIndex: 7
    SolutionNameMin: Cijk_Alik_Bljk_I8HS_BH_BiasS_SPA_AS_MT32x32x128_MI32x32x1_SN_LDSB0_AFC1_AFEM8_DTVSM1_GRVWA16_GSU1_LPA16_LPB16_LPMn1_MIWT1_1_PLR3_SU0_SUS0_TLDS1_WG32_2_1
    SolutionIndex: 8
    SolutionNameMin: Cijk_Alik_Bljk_I8HS_BH_BiasS_SPA_AS_MT32x32x128_MI32x32x1_SN_LDSB0_AFC1_AFEM8_DTVSM0_GRVWA8_GSU1_LPA8_LPB16_LPM2_MIWT1_1_PLR1_SU4_SUS256_TLDS1_WG32_2_1
    SolutionIndex: 9
    SolutionNameMin: Cijk_Alik_Bljk_I8HS_BH_BiasS_SPA_AS_MT32x32x128_MI32x32x1_SN_LDSB0_AFC1_AFEM8_DTVSM1_GRVWA8_GSU1_LPA8_LPB16_LPMn1_MIWT1_1_PLR1_SU4_SUS256_TLDS1_WG32_2_1
    SolutionIndex: 10
    SolutionNameMin: Cijk_Alik_Bljk_I8HS_BH_BiasS_SPA_AS_MT32x32x128_MI32x32x1_SN_LDSB0_AFC0_AFEM1_DTVSM1_GRVWA16_GSU2_LPA16_LPB16_LPMn1_MIWT1_1_PLR3_SU4_SUS256_TLDS1_WG32_2_1
- - - [16, 16, 1, 16, 16, 16, 16, 16]
    - [2, 0.0]
  - - [16, 16, 1, 32, 16, 16, 32, 32]
    - [4, 0.0]
  - - [16, 16, 1, 64, 16, 16, 64, 64]
    - [4, 0.0]
  - - [16, 16, 1, 96, 16, 16, 96, 96]
    - [4, 0.0]
  - - [16, 16, 1, 128, 16, 16, 128, 128]
    - [7, 0.0]
  - - [16, 16, 1, 136, 16, 16, 136, 136]
    - [9, 0.0]
  - - [16, 16, 1, 256, 16, 16, 256, 256]
    - [8, 0.0]
  - - [16, 16, 1, 264, 16, 16, 264, 264]
    - [7, 0.0]
  - - [256, 256, 1, 16, 256, 256, 16, 16]
    - [5, 0.004]
  - - [256, 256, 1, 24, 256, 256, 24, 24]
    - [1, 0.006]
  - - [256, 256, 1, 32, 256, 256, 32, 32]
    - [1, 0.009]
  - - [256, 256, 1, 64, 256, 256, 64, 64]
    - [3, 0.018]
  - - [256, 256, 1, 96, 256, 256, 96, 96]
    - [6, 0.015]
  - - [256, 256, 1, 128, 256, 256, 128, 128]
    - [10, 0.021]
  - - [256, 256, 1, 136, 256, 256, 136, 136]
    - [1, 0.035]
  - - [256, 256, 1, 256, 256, 256, 256, 256]
    - [0, 0.068]
- null
- null
- DeviceEfficiency
- null
- Euclidean
