library/src/hcc_detail/rocsparselt/src/spmm/Tensile/Logic/aquavanjaram/gfx941/aquavanjaram_Cijk_Alik_Bjlk_HHS_BH_SA_AH.yaml
- {MinimumRequiredVersion: 4.33.0}
- aquavanjaram
- gfx941
- [Device 0049, Device 0050]
    SolutionIndex: 0
    SolutionNameMin: Cijk_Alik_Bjlk_HHS_BH_SA_AH_MT32x32x16_MI32x32x16x1_SN_1LDSB0_GRVW8_LPA8_MIWT1_1_PGR1_PLR1_SU4_TLDS1_VW4_WG32_2_1_WGM12
    SolutionIndex: 1
    SolutionNameMin: Cijk_Alik_Bjlk_HHS_BH_SA_AH_MT32x32x16_MI32x32x16x1_SN_1LDSB0_GRVW8_LPA8_MIWT1_1_PGR1_PLR1_SU4_TLDS1_VW8_WG32_2_1_WGM12
    SolutionIndex: 2
    SolutionNameMin: Cijk_Alik_Bjlk_HHS_BH_SA_AH_MT32x32x16_MI32x32x16x1_SN_1LDSB0_GRVW8_LPA8_MIWT1_1_PGR1_PLR1_SU8_TLDS1_VW8_WG32_2_1_WGM12
    SolutionIndex: 3
    SolutionNameMin: Cijk_Alik_Bjlk_HHS_BH_SA_AH_MT32x32x16_MI32x32x16x1_SN_1LDSB0_GRVW4_LPA4_MIWT1_1_PGR1_PLR1_SU4_TLDS1_VW8_WG32_2_1_WGM19
    SolutionIndex: 4
    SolutionNameMin: Cijk_Alik_Bjlk_HHS_BH_SA_AH_MT32x32x16_MI32x32x16x1_SN_1LDSB0_GRVW8_LPA4_MIWT1_1_PGR2_PLR1_SU4_TLDS0_VW4_WG32_2_1_WGM19
    SolutionIndex: 5
    SolutionNameMin: Cijk_Alik_Bjlk_HHS_BH_SA_AH_MT32x32x16_MI32x32x16x1_SN_1LDSB0_GRVW8_LPA8_MIWT1_1_PGR2_PLR1_SU4_TLDS1_VW4_WG32_2_1_WGM19
    SolutionIndex: 6
    SolutionNameMin: Cijk_Alik_Bjlk_HHS_BH_SA_AH_MT32x32x32_MI32x32x16x1_SN_1LDSB0_GRVW8_LPA4_MIWT1_1_PGR1_PLR3_SU4_TLDS0_VW4_WG32_2_1_WGM12
    SolutionIndex: 7
    SolutionNameMin: Cijk_Alik_Bjlk_HHS_BH_SA_AH_MT32x32x32_MI32x32x16x1_SN_1LDSB0_GRVW8_LPA8_MIWT1_1_PGR1_PLR3_SU4_TLDS1_VW4_WG32_2_1_WGM12
    SolutionIndex: 8
    SolutionNameMin: Cijk_Alik_Bjlk_HHS_BH_SA_AH_MT32x32x32_MI32x32x16x1_SN_1LDSB0_GRVW8_LPA8_MIWT1_1_PGR2_PLR3_SU4_TLDS1_VW4_WG32_2_1_WGM12
    SolutionIndex: 9
    SolutionNameMin: Cijk_Alik_Bjlk_HHS_BH_SA_AH_MT32x32x32_MI32x32x16x1_SN_1LDSB0_GRVW8_LPA8_MIWT1_1_PGR1_PLR1_SU8_TLDS1_VW8_WG32_2_1_WGM12
    SolutionIndex: 10
    SolutionNameMin: Cijk_Alik_Bjlk_HHS_BH_SA_AH_MT32x32x32_MI32x32x16x1_SN_1LDSB0_GRVW8_LPA8_MIWT1_1_PGR1_PLR3_SU8_TLDS1_VW8_WG32_2_1_WGM12
    SolutionIndex: 11
    SolutionNameMin: Cijk_Alik_Bjlk_HHS_BH_SA_AH_MT32x32x32_MI32x32x16x1_SN_1LDSB0_GRVW8_LPA8_MIWT1_1_PGR2_PLR3_SU8_TLDS1_VW8_WG32_2_1_WGM12
    SolutionIndex: 12
    SolutionNameMin: Cijk_Alik_Bjlk_HHS_BH_SA_AH_MT32x32x32_MI32x32x16x1_SN_1LDSB0_GRVW8_LPA8_MIWT1_1_PGR2_PLR1_SU4_TLDS1_VW4_WG32_2_1_WGM18
    SolutionIndex: 13
    SolutionNameMin: Cijk_Alik_Bjlk_HHS_BH_SA_AH_MT32x32x32_MI32x32x16x1_SN_1LDSB0_GRVW4_LPA4_MIWT1_1_PGR2_PLR1_SU8_TLDS1_VW8_WG32_2_1_WGM18
    SolutionIndex: 14
    SolutionNameMin: Cijk_Alik_Bjlk_HHS_BH_SA_AH_MT32x32x32_MI32x32x16x1_SN_1LDSB0_GRVW8_LPA8_MIWT1_1_PGR2_PLR1_SU8_TLDS1_VW4_WG32_2_1_WGM18
    SolutionIndex: 15
    SolutionNameMin: Cijk_Alik_Bjlk_HHS_BH_SA_AH_MT32x32x32_MI32x32x16x1_SN_1LDSB0_GRVW8_LPA8_MIWT1_1_PGR2_PLR3_SU8_TLDS1_VW8_WG32_2_1_WGM18
    SolutionIndex: 16
    SolutionNameMin: Cijk_Alik_Bjlk_HHS_BH_SA_AH_MT32x32x32_MI32x32x16x1_SN_1LDSB0_GRVW4_LPA4_MIWT1_1_PGR1_PLR1_SU4_TLDS1_VW8_WG32_2_1_WGM19
    SolutionIndex: 17
    SolutionNameMin: Cijk_Alik_Bjlk_HHS_BH_SA_AH_MT32x32x32_MI32x32x16x1_SN_1LDSB0_GRVW8_LPA8_MIWT1_1_PGR2_PLR1_SU8_TLDS1_VW4_WG32_2_1_WGM19
    SolutionIndex: 18
    SolutionNameMin: Cijk_Alik_Bjlk_HHS_BH_SA_AH_MT32x32x32_MI32x32x16x1_SN_1LDSB0_GRVW8_LPA8_MIWT1_1_PGR2_PLR1_SU8_TLDS1_VW8_WG32_2_1_WGM19
    SolutionIndex: 19
    SolutionNameMin: Cijk_Alik_Bjlk_HHS_BH_SA_AH_MT32x32x32_MI32x32x16x1_SN_1LDSB0_GRVW8_LPA8_MIWT1_1_PGR2_PLR3_SU8_TLDS1_VW4_WG32_2_1_WGM19
    SolutionIndex: 20
    SolutionNameMin: Cijk_Alik_Bjlk_HHS_BH_SA_AH_MT32x32x32_MI32x32x16x1_SN_1LDSB0_GRVW8_LPA8_MIWT1_1_PGR2_PLR3_SU8_TLDS1_VW8_WG32_2_1_WGM19
    SolutionIndex: 21
    SolutionNameMin: Cijk_Alik_Bjlk_HHS_BH_SA_AH_MT32x32x64_MI32x32x16x1_SN_1LDSB0_GRVW8_LPA8_MIWT1_1_PGR2_PLR1_SU4_TLDS1_VW8_WG32_2_1_WGM12
    SolutionIndex: 22
    SolutionNameMin: Cijk_Alik_Bjlk_HHS_BH_SA_AH_MT32x32x64_MI32x32x16x1_SN_1LDSB0_GRVW8_LPA8_MIWT1_1_PGR2_PLR5_SU4_TLDS1_VW4_WG32_2_1_WGM12
    SolutionIndex: 23
    SolutionNameMin: Cijk_Alik_Bjlk_HHS_BH_SA_AH_MT32x32x64_MI32x32x16x1_SN_1LDSB0_GRVW8_LPA8_MIWT1_1_PGR1_PLR5_SU8_TLDS1_VW4_WG32_2_1_WGM12
    SolutionIndex: 24
    SolutionNameMin: Cijk_Alik_Bjlk_HHS_BH_SA_AH_MT32x32x64_MI32x32x16x1_SN_1LDSB0_GRVW8_LPA8_MIWT1_1_PGR2_PLR5_SU8_TLDS1_VW4_WG32_2_1_WGM12
    SolutionIndex: 25
    SolutionNameMin: Cijk_Alik_Bjlk_HHS_BH_SA_AH_MT32x32x64_MI32x32x16x1_SN_1LDSB0_GRVW8_LPA8_MIWT1_1_PGR2_PLR1_SU4_TLDS1_VW4_WG32_2_1_WGM18
    SolutionIndex: 26
    SolutionNameMin: Cijk_Alik_Bjlk_HHS_BH_SA_AH_MT32x32x64_MI32x32x16x1_SN_1LDSB0_GRVW8_LPA8_MIWT1_1_PGR1_PLR5_SU8_TLDS1_VW4_WG32_2_1_WGM18
    SolutionIndex: 27
    SolutionNameMin: Cijk_Alik_Bjlk_HHS_BH_SA_AH_MT32x32x64_MI32x32x16x1_SN_1LDSB0_GRVW8_LPA8_MIWT1_1_PGR2_PLR5_SU8_TLDS1_VW8_WG32_2_1_WGM19
    SolutionIndex: 28
    SolutionNameMin: Cijk_Alik_Bjlk_HHS_BH_SA_AH_MT32x32x64_MI32x32x16x1_SN_1LDSB0_AFC0_GRVW8_GSU2_LPA8_MIWT1_1_PGR2_PLR1_SU8_SRVW0_TLDS1_VW8_WG32_2_1_WGM18
    SolutionIndex: 29
    SolutionNameMin: Cijk_Alik_Bjlk_HHS_BH_SA_AH_MT32x32x32_MI32x32x16x1_SN_1LDSB0_AFC0_GRVW4_GSU2_LPA4_MIWT1_1_PGR1_PLR3_SU4_SRVW0_TLDS1_VW4_WG32_2_1_WGM12
    SolutionIndex: 30
    SolutionNameMin: Cijk_Alik_Bjlk_HHS_BH_SA_AH_MT32x32x16_MI32x32x16x1_SN_1LDSB0_AFC1_GRVW4_GSU1_LPA4_MIWT1_1_PGR2_PLR1_SU4_SRVW0_TLDS1_VW8_WG32_2_1_WGM19
    SolutionIndex: 31
    SolutionNameMin: Cijk_Alik_Bjlk_HHS_BH_SA_AH_MT32x32x32_MI32x32x16x1_SN_1LDSB0_AFC0_GRVW8_GSU2_LPA8_MIWT1_1_PGR2_PLR3_SU4_SRVW0_TLDS1_VW8_WG32_2_1_WGM18
    SolutionIndex: 32
    SolutionNameMin: Cijk_Alik_Bjlk_HHS_BH_SA_AH_MT32x32x32_MI32x32x16x1_SN_1LDSB0_AFC1_GRVW8_GSU1_LPA8_MIWT1_1_PGR2_PLR3_SU8_SRVW0_TLDS1_VW8_WG32_2_1_WGM12
    SolutionIndex: 33
    SolutionNameMin: Cijk_Alik_Bjlk_HHS_BH_SA_AH_MT32x32x32_MI32x32x16x1_SN_1LDSB0_AFC1_GRVW8_GSU1_LPA8_MIWT1_1_PGR1_PLR3_SU8_SRVW0_TLDS1_VW8_WG32_2_1_WGM18
    SolutionIndex: 34
    SolutionNameMin: Cijk_Alik_Bjlk_HHS_BH_SA_AH_MT32x32x32_MI32x32x16x1_SN_1LDSB0_AFC1_GRVW8_GSU1_LPA8_MIWT1_1_PGR1_PLR3_SU4_SRVW8_TLDS1_VW4_WG32_2_1_WGM12
    SolutionIndex: 35
    SolutionNameMin: Cijk_Alik_Bjlk_HHS_BH_SA_AH_MT32x32x32_MI32x32x16x1_SN_1LDSB0_AFC1_GRVW8_GSU1_LPA8_MIWT1_1_PGR2_PLR1_SU8_SRVW8_TLDS1_VW8_WG32_2_1_WGM18
    SolutionIndex: 36
    SolutionNameMin: Cijk_Alik_Bjlk_HHS_BH_SA_AH_MT32x32x32_MI32x32x16x1_SN_1LDSB0_AFC1_GRVW8_GSU1_LPA8_MIWT1_1_PGR1_PLR1_SU8_SRVW8_TLDS1_VW4_WG32_2_1_WGM18
    SolutionIndex: 37
    SolutionNameMin: Cijk_Alik_Bjlk_HHS_BH_SA_AH_MT32x32x32_MI32x32x16x1_SN_1LDSB0_AFC1_GRVW8_GSU1_LPA8_MIWT1_1_PGR1_PLR1_SU4_SRVW8_TLDS1_VW8_WG32_2_1_WGM18
    SolutionIndex: 38
    SolutionNameMin: Cijk_Alik_Bjlk_HHS_BH_SA_AH_MT32x32x32_MI32x32x16x1_SN_1LDSB0_AFC1_GRVW8_GSU1_LPA8_MIWT1_1_PGR2_PLR1_SU4_SRVW8_TLDS1_VW4_WG32_2_1_WGM19
    SolutionIndex: 39
    SolutionNameMin: Cijk_Alik_Bjlk_HHS_BH_SA_AH_MT32x32x64_MI32x32x16x1_SN_1LDSB0_AFC1_GRVW8_GSU1_LPA8_MIWT1_1_PGR2_PLR1_SU4_SRVW0_TLDS1_VW8_WG32_2_1_WGM18
    SolutionIndex: 40
    SolutionNameMin: Cijk_Alik_Bjlk_HHS_BH_SA_AH_MT32x32x32_MI32x32x16x1_SN_1LDSB0_AFC1_GRVW8_GSU1_LPA8_MIWT1_1_PGR2_PLR3_SU4_SRVW8_TLDS1_VW8_WG32_2_1_WGM19
    SolutionIndex: 41
    SolutionNameMin: Cijk_Alik_Bjlk_HHS_BH_SA_AH_MT32x32x64_MI32x32x16x1_SN_1LDSB0_AFC1_GRVW8_GSU1_LPA8_MIWT1_1_PGR2_PLR1_SU8_SRVW0_TLDS1_VW4_WG32_2_1_WGM12
    SolutionIndex: 42
    SolutionNameMin: Cijk_Alik_Bjlk_HHS_BH_SA_AH_MT32x32x32_MI32x32x16x1_SN_1LDSB0_AFC1_GRVW4_GSU1_LPA4_MIWT1_1_PGR2_PLR1_SU8_SRVW8_TLDS1_VW8_WG32_2_1_WGM19
    SolutionIndex: 43
    SolutionNameMin: Cijk_Alik_Bjlk_HHS_BH_SA_AH_MT32x32x64_MI32x32x16x1_SN_1LDSB0_AFC1_GRVW8_GSU1_LPA8_MIWT1_1_PGR1_PLR1_SU4_SRVW0_TLDS1_VW4_WG32_2_1_WGM18
    SolutionIndex: 44
    SolutionNameMin: Cijk_Alik_Bjlk_HHS_BH_SA_AH_MT32x32x64_MI32x32x16x1_SN_1LDSB0_AFC1_GRVW8_GSU1_LPA8_MIWT1_1_PGR1_PLR5_SU8_SRVW8_TLDS1_VW8_WG32_2_1_WGM19
    SolutionIndex: 45
    SolutionNameMin: Cijk_Alik_Bjlk_HHS_BH_SA_AH_MT32x32x32_MI32x32x16x1_SN_1LDSB0_AFC1_GRVW4_GSU1_LPA4_MIWT1_1_PGR1_PLR3_SU8_SRVW0_TLDS0_VW4_WG32_2_1_WGM12
    SolutionIndex: 46
    SolutionNameMin: Cijk_Alik_Bjlk_HHS_BH_SA_AH_MT32x32x16_MI32x32x16x1_SN_1LDSB0_AFC1_GRVW8_GSU1_LPA8_MIWT1_1_PGR1_PLR1_SU8_SRVW0_TLDS1_VW8_WG32_2_1_WGM19
    SolutionIndex: 47
    SolutionNameMin: Cijk_Alik_Bjlk_HHS_BH_SA_AH_MT32x32x32_MI32x32x16x1_SN_1LDSB0_AFC1_GRVW8_GSU1_LPA8_MIWT1_1_PGR1_PLR1_SU4_SRVW8_TLDS1_VW8_WG32_2_1_WGM12
    SolutionIndex: 48
    SolutionNameMin: Cijk_Alik_Bjlk_HHS_BH_SA_AH_MT32x32x16_MI32x32x16x1_SN_1LDSB0_AFC1_GRVW8_GSU1_LPA8_MIWT1_1_PGR2_PLR1_SU4_SRVW0_TLDS1_VW4_WG32_2_1_WGM18
    SolutionIndex: 49
    SolutionNameMin: Cijk_Alik_Bjlk_HHS_BH_SA_AH_MT32x32x64_MI32x32x16x1_SN_1LDSB0_AFC1_GRVW8_GSU1_LPA8_MIWT1_1_PGR1_PLR1_SU4_SRVW0_TLDS1_VW8_WG32_2_1_WGM18
    SolutionIndex: 50
    SolutionNameMin: Cijk_Alik_Bjlk_HHS_BH_SA_AH_MT32x32x16_MI32x32x16x1_SN_1LDSB0_AFC1_GRVW8_GSU1_LPA8_MIWT1_1_PGR2_PLR1_SU4_SRVW0_TLDS1_VW8_WG32_2_1_WGM19
    SolutionIndex: 51
    SolutionNameMin: Cijk_Alik_Bjlk_HHS_BH_SA_AH_MT32x32x32_MI32x32x16x1_SN_1LDSB0_AFC1_GRVW8_GSU1_LPA8_MIWT1_1_PGR2_PLR1_SU4_SRVW0_TLDS1_VW8_WG32_2_1_WGM18
    SolutionIndex: 52
    SolutionNameMin: Cijk_Alik_Bjlk_HHS_BH_SA_AH_MT32x32x64_MI32x32x16x1_SN_1LDSB0_AFC1_GRVW8_GSU1_LPA8_MIWT1_1_PGR1_PLR5_SU4_SRVW0_TLDS0_VW8_WG32_2_1_WGM19
    SolutionIndex: 53
    SolutionNameMin: Cijk_Alik_Bjlk_HHS_BH_SA_AH_MT32x32x64_MI32x32x16x1_SN_1LDSB0_AFC1_GRVW8_GSU1_LPA8_MIWT1_1_PGR1_PLR1_SU4_SRVW0_TLDS1_VW4_WG32_2_1_WGM19
    SolutionIndex: 54
    SolutionNameMin: Cijk_Alik_Bjlk_HHS_BH_SA_AH_MT32x32x32_MI32x32x16x1_SN_1LDSB0_AFC1_GRVW8_GSU1_LPA8_MIWT1_1_PGR2_PLR3_SU8_SRVW0_TLDS1_VW4_WG32_2_1_WGM18
    SolutionIndex: 55
    SolutionNameMin: Cijk_Alik_Bjlk_HHS_BH_SA_AH_MT32x32x16_MI32x32x16x1_SN_1LDSB0_AFC1_GRVW8_GSU1_LPA8_MIWT1_1_PGR1_PLR1_SU4_SRVW0_TLDS1_VW8_WG32_2_1_WGM19
    SolutionIndex: 56
    SolutionNameMin: Cijk_Alik_Bjlk_HHS_BH_SA_AH_MT32x32x32_MI32x32x16x1_SN_1LDSB0_AFC1_GRVW8_GSU1_LPA8_MIWT1_1_PGR2_PLR3_SU8_SRVW0_TLDS1_VW8_WG32_2_1_WGM18
    SolutionIndex: 57
    SolutionNameMin: Cijk_Alik_Bjlk_HHS_BH_SA_AH_MT32x32x16_MI32x32x16x1_SN_1LDSB0_AFC1_GRVW4_GSU1_LPA4_MIWT1_1_PGR1_PLR1_SU8_SRVW0_TLDS1_VW8_WG32_2_1_WGM19
    SolutionIndex: 58
    SolutionNameMin: Cijk_Alik_Bjlk_HHS_BH_SA_AH_MT32x32x16_MI32x32x16x1_SN_1LDSB0_AFC1_GRVW4_GSU1_LPA4_MIWT1_1_PGR1_PLR1_SU4_SRVW0_TLDS1_VW8_WG32_2_1_WGM19
    SolutionIndex: 59
    SolutionNameMin: Cijk_Alik_Bjlk_HHS_BH_SA_AH_MT32x32x64_MI32x32x16x1_SN_1LDSB0_AFC1_GRVW8_GSU1_LPA8_MIWT1_1_PGR2_PLR1_SU8_SRVW0_TLDS1_VW8_WG32_2_1_WGM12
    SolutionIndex: 60
    SolutionNameMin: Cijk_Alik_Bjlk_HHS_BH_SA_AH_MT32x32x64_MI32x32x16x1_SN_1LDSB0_AFC1_GRVW8_GSU1_LPA8_MIWT1_1_PGR2_PLR5_SU4_SRVW0_TLDS1_VW8_WG32_2_1_WGM12
    SolutionIndex: 61
    SolutionNameMin: Cijk_Alik_Bjlk_HHS_BH_SA_AH_MT32x32x32_MI32x32x16x1_SN_1LDSB0_AFC1_GRVW8_GSU1_LPA8_MIWT1_1_PGR1_PLR1_SU8_SRVW0_TLDS1_VW4_WG32_2_1_WGM12
    SolutionIndex: 62
    SolutionNameMin: Cijk_Alik_Bjlk_HHS_BH_SA_AH_MT32x32x32_MI32x32x16x1_SN_1LDSB0_AFC1_GRVW4_GSU1_LPA4_MIWT1_1_PGR2_PLR1_SU4_SRVW0_TLDS1_VW4_WG32_2_1_WGM12
    SolutionIndex: 63
    SolutionNameMin: Cijk_Alik_Bjlk_HHS_BH_SA_AH_MT32x32x64_MI32x32x16x1_SN_1LDSB0_AFC1_GRVW4_GSU1_LPA4_MIWT1_1_PGR1_PLR1_SU8_SRVW0_TLDS1_VW8_WG32_2_1_WGM19
    SolutionIndex: 64
    SolutionNameMin: Cijk_Alik_Bjlk_HHS_BH_SA_AH_MT32x32x64_MI32x32x16x1_SN_1LDSB0_AFC1_GRVW8_GSU1_LPA8_MIWT1_1_PGR2_PLR1_SU4_SRVW0_TLDS1_VW8_WG32_2_1_WGM12
    SolutionIndex: 65
    SolutionNameMin: Cijk_Alik_Bjlk_HHS_BH_SA_AH_MT32x32x32_MI32x32x16x1_SN_1LDSB0_AFC1_GRVW4_GSU1_LPA4_MIWT1_1_PGR2_PLR3_SU8_SRVW0_TLDS1_VW4_WG32_2_1_WGM12
    SolutionIndex: 66
    SolutionNameMin: Cijk_Alik_Bjlk_HHS_BH_SA_AH_MT32x32x32_MI32x32x16x1_SN_1LDSB0_AFC1_GRVW8_GSU1_LPA8_MIWT1_1_PGR2_PLR1_SU8_SRVW0_TLDS1_VW8_WG32_2_1_WGM18
    SolutionIndex: 67
    SolutionNameMin: Cijk_Alik_Bjlk_HHS_BH_SA_AH_MT32x32x64_MI32x32x16x1_SN_1LDSB0_AFC1_GRVW8_GSU1_LPA8_MIWT1_1_PGR1_PLR1_SU8_SRVW0_TLDS1_VW8_WG32_2_1_WGM19
    SolutionIndex: 68
    SolutionNameMin: Cijk_Alik_Bjlk_HHS_BH_SA_AH_MT32x32x32_MI32x32x16x1_SN_1LDSB0_AFC0_GRVW8_GSU2_LPA8_MIWT1_1_PGR2_PLR1_SU4_SRVW0_TLDS1_VW8_WG32_2_1_WGM18
- - - [15, 15, 1, 16]
    - [4, 0.0]
  - - [15, 15, 1, 32]
    - [9, 0.0]
  - - [15, 15, 1, 64]
    - [21, 0.0]
  - - [15, 15, 1, 96]
    - [7, 0.0]
  - - [15, 15, 1, 128]
    - [24, 0.0]
  - - [15, 15, 1, 136]
    - [5, 0.0]
  - - [15, 15, 1, 256]
    - [28, 0.001]
  - - [15, 15, 1, 264]
    - [29, 0.001]
  - - [15, 15, 1, 528]
    - [24, 0.001]
  - - [15, 15, 1, 544]
    - [24, 0.001]
  - - [15, 15, 1, 576]
    - [24, 0.001]
  - - [15, 15, 1, 608]
    - [14, 0.001]
  - - [15, 15, 1, 640]
    - [24, 0.001]
  - - [15, 15, 1, 768]
    - [22, 0.001]
  - - [15, 15, 1, 776]
    - [25, 0.001]
  - - [32, 32, 1, 16]
    - [0, 0.0]
  - - [32, 32, 1, 32]
    - [16, 0.0]
  - - [32, 32, 1, 64]
    - [23, 0.001]
  - - [32, 32, 1, 96]
    - [6, 0.001]
  - - [32, 32, 1, 128]
    - [17, 0.002]
  - - [32, 32, 1, 136]
    - [30, 0.002]
  - - [32, 32, 1, 256]
    - [20, 0.003]
  - - [32, 32, 1, 264]
    - [8, 0.003]
  - - [32, 32, 1, 528]
    - [31, 0.005]
  - - [32, 32, 1, 544]
    - [14, 0.005]
  - - [32, 32, 1, 576]
    - [13, 0.005]
  - - [32, 32, 1, 608]
    - [20, 0.005]
  - - [32, 32, 1, 640]
    - [32, 0.006]
  - - [32, 32, 1, 768]
    - [24, 0.006]
  - - [32, 32, 1, 776]
    - [24, 0.006]
  - - [256, 256, 1, 16]
    - [3, 0.014]
  - - [256, 256, 1, 24]
    - [1, 0.019]
  - - [256, 256, 1, 32]
    - [33, 0.027]
  - - [256, 256, 1, 64]
    - [34, 0.051]
  - - [256, 256, 1, 96]
    - [35, 0.072]
  - - [256, 256, 1, 128]
    - [2, 0.095]
  - - [256, 256, 1, 136]
    - [36, 0.088]
  - - [256, 256, 1, 256]
    - [37, 0.163]
  - - [256, 256, 1, 264]
    - [38, 0.157]
  - - [256, 256, 1, 280]
    - [26, 0.16]
  - - [256, 256, 1, 296]
    - [12, 0.175]
  - - [256, 256, 1, 528]
    - [39, 0.265]
  - - [256, 256, 1, 544]
    - [40, 0.286]
  - - [256, 256, 1, 576]
    - [41, 0.31]
  - - [256, 256, 1, 608]
    - [42, 0.3]
  - - [256, 256, 1, 640]
    - [11, 0.332]
  - - [256, 256, 1, 768]
    - [43, 0.384]
  - - [256, 256, 1, 776]
    - [44, 0.344]
  - - [256, 256, 1, 792]
    - [19, 0.348]
  - - [256, 256, 1, 808]
    - [15, 0.364]
  - - [255, 255, 1, 16]
    - [27, 0.009]
  - - [255, 255, 1, 32]
    - [45, 0.018]
  - - [255, 255, 1, 64]
    - [10, 0.037]
  - - [255, 255, 1, 96]
    - [46, 0.053]
  - - [255, 255, 1, 128]
    - [47, 0.067]
  - - [255, 255, 1, 136]
    - [48, 0.068]
  - - [255, 255, 1, 256]
    - [49, 0.12]
  - - [255, 255, 1, 264]
    - [50, 0.122]
  - - [255, 255, 1, 528]
    - [51, 0.211]
  - - [255, 255, 1, 544]
    - [11, 0.231]
  - - [255, 255, 1, 576]
    - [52, 0.218]
  - - [255, 255, 1, 608]
    - [18, 0.249]
  - - [255, 255, 1, 640]
    - [14, 0.263]
  - - [255, 255, 1, 768]
    - [53, 0.294]
  - - [255, 255, 1, 776]
    - [54, 0.284]
  - - [264, 264, 1, 16]
    - [55, 0.012]
  - - [264, 264, 1, 32]
    - [56, 0.024]
  - - [264, 264, 1, 64]
    - [57, 0.045]
  - - [264, 264, 1, 96]
    - [58, 0.065]
  - - [264, 264, 1, 128]
    - [59, 0.084]
  - - [264, 264, 1, 136]
    - [60, 0.081]
  - - [264, 264, 1, 256]
    - [61, 0.155]
  - - [264, 264, 1, 264]
    - [62, 0.144]
  - - [264, 264, 1, 528]
    - [63, 0.24]
  - - [264, 264, 1, 544]
    - [15, 0.249]
  - - [264, 264, 1, 576]
    - [64, 0.29]
  - - [264, 264, 1, 608]
    - [65, 0.289]
  - - [264, 264, 1, 640]
    - [66, 0.317]
  - - [264, 264, 1, 768]
    - [67, 0.363]
  - - [264, 264, 1, 776]
    - [68, 0.34]
- null
- null
- DeviceEfficiency
