library/src/hcc_detail/rocsparselt/src/spmm/Tensile/Logic/aquavanjaram/gfx941/aquavanjaram_Cijk_Alik_Bjlk_HHS_BH_SA_AH.yaml
- {MinimumRequiredVersion: 4.33.0}
- aquavanjaram
- gfx941
- [Device 0049, Device 0050]
    SolutionIndex: 0
    SolutionNameMin: Cijk_Alik_Bjlk_HHS_BH_SA_AH_MT32x32x32_MI32x32x16x1_SN_AFC1_DTVSM1_GSU1_LPA4_LPMn1_MIWT1_1_SU0_SUS0_TLDS1_WG32_2_1
    SolutionIndex: 1
    SolutionNameMin: Cijk_Alik_Bjlk_HHS_BH_SA_AH_MT32x32x32_MI32x32x16x1_SN_AFC1_DTVSM0_GSU1_LPA4_LPM1_MIWT1_1_SU4_SUS256_TLDS1_WG32_2_1
    SolutionIndex: 2
    SolutionNameMin: Cijk_Alik_Bjlk_HHS_BH_SA_AH_MT128x128x32_MI32x32x16x1_SN_AFC1_DTVSM1_GSU1_LPA4_LPMn1_MIWT2_2_SU4_SUS256_TLDS1_WG64_4_1
    SolutionIndex: 3
    SolutionNameMin: Cijk_Alik_Bjlk_HHS_BH_SA_AH_MT256x256x32_MI32x32x16x1_SN_AFC1_DTVSM0_GSU1_LPA0_LPM1_MIWT2_4_SU0_SUS0_TLDS0_WG128_4_1
    SolutionIndex: 4
    SolutionNameMin: Cijk_Alik_Bjlk_HHS_BH_SA_AH_MT256x256x32_MI32x32x16x1_SN_AFC1_DTVSM0_GSU1_LPA0_LPM1_MIWT2_4_SU4_SUS256_TLDS0_WG128_4_1
    SolutionIndex: 5
    SolutionNameMin: Cijk_Alik_Bjlk_HHS_BH_SA_AH_MT256x256x32_MI32x32x16x1_SN_AFC1_DTVSM1_GSU1_LPA4_LPMn1_MIWT2_4_SU4_SUS256_TLDS1_WG128_4_1
    SolutionIndex: 6
    SolutionNameMin: Cijk_Alik_Bjlk_HHS_BH_SA_AH_MT32x32x64_MI32x32x16x1_SN_AFC1_DTVSM0_GSU1_LPA0_LPM1_MIWT1_1_SU0_SUS0_TLDS0_WG32_2_1
    SolutionIndex: 7
    SolutionNameMin: Cijk_Alik_Bjlk_HHS_BH_SA_AH_MT32x32x64_MI32x32x16x1_SN_AFC1_DTVSM1_GSU1_LPA0_LPMn1_MIWT1_1_SU0_SUS0_TLDS0_WG32_2_1
    SolutionIndex: 8
    SolutionNameMin: Cijk_Alik_Bjlk_HHS_BH_SA_AH_MT32x32x64_MI32x32x16x1_SN_AFC1_DTVSM0_GSU1_LPA0_LPM1_MIWT1_1_SU4_SUS256_TLDS0_WG32_2_1
    SolutionIndex: 9
    SolutionNameMin: Cijk_Alik_Bjlk_HHS_BH_SA_AH_MT32x32x64_MI32x32x16x1_SN_AFC1_DTVSM1_GSU1_LPA4_LPMn1_MIWT1_1_SU4_SUS256_TLDS1_WG32_2_1
    SolutionIndex: 10
    SolutionNameMin: Cijk_Alik_Bjlk_HHS_BH_SA_AH_MT32x32x64_MI32x32x16x1_SN_AFC0_DTVSM1_GSU2_LPA0_LPMn1_MIWT1_1_SU4_SUS256_TLDS0_WG32_2_1
- - - [15, 15, 1, 16, 15, 15, 16, 15]
    - [9, 0.45045]
  - - [15, 15, 1, 32, 15, 15, 32, 15]
    - [10, 0.905376]
  - - [15, 15, 1, 64, 15, 15, 64, 15]
    - [1, 2.36473]
  - - [15, 15, 1, 96, 15, 15, 96, 15]
    - [0, 3.59461]
  - - [15, 15, 1, 128, 15, 15, 128, 15]
    - [7, 4.57906]
  - - [15, 15, 1, 136, 15, 15, 136, 15]
    - [6, 4.37706]
  - - [15, 15, 1, 256, 15, 15, 256, 15]
    - [0, 8.03291]
  - - [15, 15, 1, 264, 15, 15, 264, 15]
    - [1, 7.26828]
  - - [256, 256, 1, 16, 256, 256, 16, 256]
    - [9, 9.92209]
  - - [256, 256, 1, 24, 256, 256, 24, 256]
    - [8, 14.8521]
  - - [256, 256, 1, 32, 256, 256, 32, 256]
    - [5, 19.912]
  - - [256, 256, 1, 64, 256, 256, 64, 256]
    - [8, 39.9152]
  - - [256, 256, 1, 96, 256, 256, 96, 256]
    - [3, 173.054]
  - - [256, 256, 1, 128, 256, 256, 128, 256]
    - [4, 79.2413]
  - - [256, 256, 1, 136, 256, 256, 136, 256]
    - [2, 84.2735]
  - - [256, 256, 1, 256, 256, 256, 256, 256]
    - [5, 158.663]
- null
- null
- DeviceEfficiency
