library/src/hcc_detail/rocsparselt/src/spmm/Tensile/Logic/aquavanjaram/gfx941/aquavanjaram_Cijk_Alik_Bjlk_BBS_BH_Bias_SPA_AS.yaml
- {MinimumRequiredVersion: 4.33.0}
- aquavanjaram
- gfx941
- [Device 0049, Device 0050]
    SolutionIndex: 0
    SolutionNameMin: Cijk_Alik_Bjlk_BBS_BH_Bias_SPA_AS_MT32x32x32_MI32x32x1_SN_LDSB0_AFC1_AFEM8_DTVSM0_GRVWA4_GSU1_LPA0_LPM1_MIWT1_1_PLR1_SU0_SUS0_SVW4_TLDS0_VWA1_VWB1_WG32_2_1
    SolutionIndex: 1
    SolutionNameMin: Cijk_Alik_Bjlk_BBS_BH_Bias_SPA_AS_MT32x32x32_MI32x32x1_SN_LDSB0_AFC1_AFEM8_DTVSM0_GRVWA4_GSU1_LPA4_LPM1_MIWT1_1_PLR1_SU0_SUS0_SVW4_TLDS1_VWA1_VWB1_WG32_2_1
    SolutionIndex: 2
    SolutionNameMin: Cijk_Alik_Bjlk_BBS_BH_Bias_SPA_AS_MT32x32x32_MI32x32x1_SN_LDSB0_AFC1_AFEM8_DTVSM0_GRVWA8_GSU1_LPA8_LPM2_MIWT1_1_PLR1_SU0_SUS0_SVW4_TLDS1_VWA1_VWB1_WG32_2_1
    SolutionIndex: 3
    SolutionNameMin: Cijk_Alik_Bjlk_BBS_BH_Bias_SPA_AS_MT32x32x32_MI32x32x1_SN_LDSB0_AFC1_AFEM8_DTVSM1_GRVWA8_GSU1_LPA0_LPMn1_MIWT1_1_PLR1_SU0_SUS0_SVW4_TLDS0_VWA1_VWB1_WG32_2_1
    SolutionIndex: 4
    SolutionNameMin: Cijk_Alik_Bjlk_BBS_BH_Bias_SPA_AS_MT32x32x32_MI32x32x1_SN_LDSB0_AFC1_AFEM1_DTVSM1_GRVWA4_GSU1_LPA4_LPMn1_MIWT1_1_PLR1_SU4_SUS256_SVW4_TLDS1_VWA1_VWB1_WG32_2_1
    SolutionIndex: 5
    SolutionNameMin: Cijk_Alik_Bjlk_BBS_BH_Bias_SPA_AS_MT32x32x32_MI32x32x1_SN_LDSB0_AFC1_AFEM8_DTVSM0_GRVWA4_GSU1_LPA4_LPM1_MIWT1_1_PLR1_SU4_SUS256_SVW4_TLDS1_VWA1_VWB1_WG32_2_1
    SolutionIndex: 6
    SolutionNameMin: Cijk_Alik_Bjlk_BBS_BH_Bias_SPA_AS_MT32x32x32_MI32x32x1_SN_LDSB0_AFC1_AFEM8_DTVSM1_GRVWA4_GSU1_LPA0_LPMn1_MIWT1_1_PLR1_SU4_SUS256_SVW4_TLDS0_VWA1_VWB1_WG32_2_1
    SolutionIndex: 7
    SolutionNameMin: Cijk_Alik_Bjlk_BBS_BH_Bias_SPA_AS_MT32x32x32_MI32x32x1_SN_LDSB0_AFC0_AFEM8_DTVSM0_GRVWA4_GSU2_LPA4_LPM1_MIWT1_1_PLR1_SU0_SUS0_SVW4_TLDS1_VWA1_VWB1_WG32_2_1
    SolutionIndex: 8
    SolutionNameMin: Cijk_Alik_Bjlk_BBS_BH_Bias_SPA_AS_MT128x128x32_MI32x32x1_SN_LDSB0_AFC1_AFEM1_DTVSM0_GRVWA4_GSU1_LPA0_LPM1_MIWT2_2_PLR1_SU4_SUS256_SVW8_TLDS0_VWA2_VWB1_WG64_4_1
    SolutionIndex: 9
    SolutionNameMin: Cijk_Alik_Bjlk_BBS_BH_Bias_SPA_AS_MT32x32x64_MI32x32x1_SN_LDSB0_AFC1_AFEM1_DTVSM0_GRVWA8_GSU1_LPA0_LPM2_MIWT1_1_PLR1_SU0_SUS0_SVW4_TLDS0_VWA1_VWB1_WG32_2_1
    SolutionIndex: 10
    SolutionNameMin: Cijk_Alik_Bjlk_BBS_BH_Bias_SPA_AS_MT32x32x64_MI32x32x1_SN_LDSB0_AFC1_AFEM1_DTVSM1_GRVWA4_GSU1_LPA4_LPMn1_MIWT1_1_PLR1_SU0_SUS0_SVW4_TLDS1_VWA1_VWB1_WG32_2_1
    SolutionIndex: 11
    SolutionNameMin: Cijk_Alik_Bjlk_BBS_BH_Bias_SPA_AS_MT32x32x64_MI32x32x1_SN_LDSB0_AFC1_AFEM8_DTVSM0_GRVWA4_GSU1_LPA0_LPM1_MIWT1_1_PLR1_SU0_SUS0_SVW4_TLDS0_VWA1_VWB1_WG32_2_1
    SolutionIndex: 12
    SolutionNameMin: Cijk_Alik_Bjlk_BBS_BH_Bias_SPA_AS_MT32x32x64_MI32x32x1_SN_LDSB0_AFC1_AFEM8_DTVSM0_GRVWA4_GSU1_LPA4_LPM1_MIWT1_1_PLR3_SU0_SUS0_SVW4_TLDS1_VWA1_VWB1_WG32_2_1
    SolutionIndex: 13
    SolutionNameMin: Cijk_Alik_Bjlk_BBS_BH_Bias_SPA_AS_MT32x32x64_MI32x32x1_SN_LDSB0_AFC1_AFEM8_DTVSM1_GRVWA8_GSU1_LPA8_LPMn1_MIWT1_1_PLR1_SU0_SUS0_SVW4_TLDS1_VWA1_VWB1_WG32_2_1
    SolutionIndex: 14
    SolutionNameMin: Cijk_Alik_Bjlk_BBS_BH_Bias_SPA_AS_MT32x32x64_MI32x32x1_SN_LDSB0_AFC1_AFEM8_DTVSM1_GRVWA4_GSU1_LPA4_LPMn1_MIWT1_1_PLR3_SU0_SUS0_SVW4_TLDS1_VWA1_VWB1_WG32_2_1
    SolutionIndex: 15
    SolutionNameMin: Cijk_Alik_Bjlk_BBS_BH_Bias_SPA_AS_MT32x32x64_MI32x32x1_SN_LDSB0_AFC1_AFEM8_DTVSM1_GRVWA8_GSU1_LPA8_LPMn1_MIWT1_1_PLR3_SU0_SUS0_SVW4_TLDS1_VWA1_VWB1_WG32_2_1
    SolutionIndex: 16
    SolutionNameMin: Cijk_Alik_Bjlk_BBS_BH_Bias_SPA_AS_MT32x32x64_MI32x32x1_SN_LDSB0_AFC1_AFEM1_DTVSM1_GRVWA8_GSU1_LPA0_LPMn1_MIWT1_1_PLR3_SU4_SUS256_SVW4_TLDS0_VWA1_VWB1_WG32_2_1
    SolutionIndex: 17
    SolutionNameMin: Cijk_Alik_Bjlk_BBS_BH_Bias_SPA_AS_MT32x32x64_MI32x32x1_SN_LDSB0_AFC1_AFEM8_DTVSM1_GRVWA4_GSU1_LPA4_LPMn1_MIWT1_1_PLR3_SU4_SUS256_SVW4_TLDS1_VWA1_VWB1_WG32_2_1
    SolutionIndex: 18
    SolutionNameMin: Cijk_Alik_Bjlk_BBS_BH_Bias_SPA_AS_MT128x128x64_MI32x32x1_SN_LDSB0_AFEM1_GRVWA8_GRVWB8_GSU1_LBSPPA128_LBSPPB0_LPA8_LPB0_MIWT2_2_NLCB1_PLR1_SU0_SUS0_SVW8_TLDS1_VWA2_VWB2_WG64_4_1_WGM1
    SolutionIndex: 19
    SolutionNameMin: Cijk_Alik_Bjlk_BBS_BH_Bias_SPA_AS_MT160x128x64_MI16x16x1_SN_LDSB0_AFEM1_GRVWA4_GRVWB8_GSU1_LBSPPA128_LBSPPB2048_LPA4_LPB16_MIWT5_4_NLCB1_PLR1_SU32_SUS128_SVW4_TLDS1_VWA1_VWB4_WG32_8_1_WGM1
    SolutionIndex: 20
    SolutionNameMin: Cijk_Alik_Bjlk_BBS_BH_Bias_SPA_AS_MT256x96x64_MI32x32x1_SN_LDSB0_AFC0_AFEM8_GRVWA8_GRVWB8_GSU5_LBSPPB0_LPA8_LPB0_MIWT2_3_NLCB3_PLR1_WG128_2_1_WGM1
    SolutionIndex: 21
    SolutionNameMin: Cijk_Alik_Bjlk_BBS_BH_Bias_SPA_AS_MT160x128x64_MI16x16x1_SN_LDSB0_AFEM1_GRVWA4_GRVWB8_GSU1_LBSPPA128_LBSPPB2048_LPA4_LPB16_MIWT5_4_NLCB1_PLR1_SU0_SUS0_SVW4_TLDS1_VWA1_VWB2_WG32_8_1_WGM18
    SolutionIndex: 22
    SolutionNameMin: Cijk_Alik_Bjlk_BBS_BH_Bias_SPA_AS_MT192x256x64_MI16x16x1_SN_LDSB1_AFEM8_GRVWA8_GSU1_LBSPPA128_LBSPPB4096_LPA8_LPB16_MIWT6_8_PLR1_SU0_SUS0_SVW8_TLDS1_VWA2_VWB2_WG32_8_1_WGM6
    SolutionIndex: 23
    SolutionNameMin: Cijk_Alik_Bjlk_BBS_BH_Bias_SPA_AS_MT160x256x64_MI16x16x1_SN_LDSB1_AFEM8_GRVWA4_GRVWB8_GSU1_LBSPPA128_LBSPPB4096_LPA4_LPB16_MIWT5_8_NLCB1_PLR1_SU4_SUS256_SVW4_TLDS1_VWA1_VWB4_WG32_8_1_WGM38
    SolutionIndex: 24
    SolutionNameMin: Cijk_Alik_Bjlk_BBS_BH_Bias_SPA_AS_MT256x256x64_MI16x16x1_SN_LDSB1_AFEM1_GRVWA8_GSU1_LBSPPA128_LBSPPB4096_LPA8_LPB16_MIWT8_8_PLR1_SU4_SUS256_SVW8_TLDS1_VWA2_VWB8_WG32_8_1_WGM6
    SolutionIndex: 25
    SolutionNameMin: Cijk_Alik_Bjlk_BBS_BH_Bias_SPA_AS_MT256x256x64_MI16x16x1_SN_LDSB1_AFEM1_GRVWA8_GSU1_LBSPPA128_LBSPPB4096_LPA8_LPB16_MIWT8_8_PLR1_SU0_SUS0_SVW8_TLDS1_VWA2_VWB4_WG32_8_1_WGM1
    SolutionIndex: 26
    SolutionNameMin: Cijk_Alik_Bjlk_BBS_BH_Bias_SPA_AS_MT256x256x64_MI16x16x1_SN_LDSB1_AFEM1_GRVWA8_GSU1_LBSPPA128_LBSPPB4096_LPA8_LPB16_MIWT8_8_PLR1_SU4_SUS128_SVW8_TLDS1_VWA2_VWB4_WG32_8_1_WGM1
    SolutionIndex: 27
    SolutionNameMin: Cijk_Alik_Bjlk_BBS_BH_Bias_SPA_AS_MT256x256x64_MI16x16x1_SN_LDSB1_AFEM8_GRVWA8_GSU1_LBSPPA128_LBSPPB4096_LPA8_LPB16_MIWT8_8_PLR1_SU0_SUS0_SVW8_TLDS1_VWA2_VWB4_WG32_8_1_WGM18
    SolutionIndex: 28
    SolutionNameMin: Cijk_Alik_Bjlk_BBS_BH_Bias_SPA_AS_MT256x256x64_MI16x16x1_SN_LDSB1_AFEM1_GRVWA8_GSU1_LBSPPA128_LBSPPB4096_LPA8_LPB16_MIWT8_8_PLR1_SU4_SUS128_SVW8_TLDS1_VWA2_VWB4_WG32_8_1_WGM18
    SolutionIndex: 29
    SolutionNameMin: Cijk_Alik_Bjlk_BBS_BH_Bias_SPA_AS_MT256x256x64_MI16x16x1_SN_LDSB1_AFEM8_GRVWA8_GSU1_LBSPPA128_LBSPPB4096_LPA8_LPB16_MIWT8_8_PLR1_SU4_SUS128_SVW8_TLDS1_VWA2_VWB4_WG32_8_1_WGM18
    SolutionIndex: 30
    SolutionNameMin: Cijk_Alik_Bjlk_BBS_BH_Bias_SPA_AS_MT256x256x64_MI16x16x1_SN_LDSB1_AFEM1_GRVWA8_GSU1_LBSPPA128_LBSPPB4096_LPA8_LPB16_MIWT8_8_PLR1_SU4_SUS256_SVW8_TLDS1_VWA2_VWB4_WG32_8_1_WGM1
    SolutionIndex: 31
    SolutionNameMin: Cijk_Alik_Bjlk_BBS_BH_Bias_SPA_AS_MT192x256x64_MI16x16x1_SN_LDSB1_AFEM8_GRVWA8_GSU1_LBSPPA128_LBSPPB4096_LPA8_LPB16_MIWT6_8_PLR1_SU0_SUS0_SVW8_TLDS1_VWA2_VWB4_WG32_8_1_WGM1
    SolutionIndex: 32
    SolutionNameMin: Cijk_Alik_Bjlk_BBS_BH_Bias_SPA_AS_MT256x256x64_MI16x16x1_SN_LDSB1_AFEM8_GRVWA8_GSU1_LBSPPA128_LBSPPB4096_LPA8_LPB16_MIWT8_8_PLR1_SU0_SUS0_SVW8_TLDS1_VWA2_VWB4_WG32_8_1_WGM1
    SolutionIndex: 33
    SolutionNameMin: Cijk_Alik_Bjlk_BBS_BH_Bias_SPA_AS_MT256x256x64_MI16x16x1_SN_LDSB1_AFEM1_GRVWA8_GSU1_LBSPPA128_LBSPPB4096_LPA8_LPB16_MIWT8_8_PLR1_SU4_SUS256_SVW8_TLDS1_VWA2_VWB4_WG32_8_1_WGM18
    SolutionIndex: 34
    SolutionNameMin: Cijk_Alik_Bjlk_BBS_BH_Bias_SPA_AS_MT192x256x64_MI16x16x1_SN_LDSB1_AFEM1_GRVWA8_GRVWB8_GSU1_LBSPPA128_LBSPPB4096_LPA8_LPB16_MIWT6_8_NLCB1_PLR1_SU0_SUS0_SVW8_TLDS1_VWA2_VWB4_WG32_8_1_WGM1
    SolutionIndex: 35
    SolutionNameMin: Cijk_Alik_Bjlk_BBS_BH_Bias_SPA_AS_MT256x256x64_MI16x16x1_SN_LDSB1_AFEM1_GRVWA8_GSU1_LBSPPA128_LBSPPB4096_LPA8_LPB16_MIWT8_8_PLR1_SU0_SUS0_SVW8_TLDS1_VWA2_VWB4_WG32_8_1_WGM18
    SolutionIndex: 36
    SolutionNameMin: Cijk_Alik_Bjlk_BBS_BH_Bias_SPA_AS_MT256x256x64_MI16x16x1_SN_LDSB1_AFEM8_GRVWA8_GSU1_LBSPPA128_LBSPPB4096_LPA8_LPB16_MIWT8_8_PLR1_SU32_SUS256_SVW8_TLDS1_VWA2_VWB4_WG32_8_1_WGM38
- - - [16, 16, 1, 16]
    - [3, 0.0]
  - - [16, 16, 1, 32]
    - [3, 0.0]
  - - [16, 16, 1, 64]
    - [15, 0.0]
  - - [16, 16, 1, 96]
    - [3, 0.0]
  - - [16, 16, 1, 128]
    - [2, 0.0]
  - - [16, 16, 1, 136]
    - [14, 0.0]
  - - [16, 16, 1, 256]
    - [2, 0.001]
  - - [16, 16, 1, 264]
    - [2, 0.001]
  - - [256, 256, 1, 16]
    - [9, 0.008]
  - - [256, 256, 1, 24]
    - [15, 0.013]
  - - [256, 256, 1, 32]
    - [16, 0.015]
  - - [256, 256, 1, 64]
    - [15, 0.035]
  - - [256, 256, 1, 96]
    - [17, 0.042]
  - - [256, 256, 1, 128]
    - [5, 0.063]
  - - [256, 256, 1, 136]
    - [1, 0.064]
  - - [256, 256, 1, 256]
    - [11, 0.108]
  - - [384, 384, 1, 16]
    - [8, 0.013]
  - - [384, 384, 1, 24]
    - [6, 0.023]
  - - [384, 384, 1, 32]
    - [10, 0.031]
  - - [384, 384, 1, 64]
    - [4, 0.062]
  - - [384, 384, 1, 96]
    - [0, 0.091]
  - - [384, 384, 1, 128]
    - [7, 0.072]
  - - [384, 384, 1, 136]
    - [12, 0.12]
  - - [384, 384, 1, 256]
    - [13, 0.236]
  - - [3072, 1024, 1, 16384]
    - [18, 24.131]
  - - [4096, 1024, 1, 16384]
    - [19, 23.872]
  - - [1024, 1024, 1, 16384]
    - [20, 16.907]
  - - [1024, 4096, 1, 16384]
    - [21, 24.802]
  - - [3072, 3072, 1, 1024]
    - [22, 14.552]
  - - [4096, 4096, 1, 1024]
    - [23, 15.94]
  - - [5120, 5120, 1, 1024]
    - [24, 20.772]
  - - [6144, 6144, 1, 1024]
    - [25, 24.403]
  - - [7168, 7168, 1, 1024]
    - [26, 26.698]
  - - [8192, 8192, 1, 1024]
    - [26, 28.507]
  - - [9216, 9216, 1, 1024]
    - [25, 31.138]
  - - [10240, 10240, 1, 1024]
    - [27, 29.507]
  - - [11264, 11264, 1, 1024]
    - [28, 31.517]
  - - [12288, 12288, 1, 1024]
    - [25, 32.075]
  - - [13312, 13312, 1, 1024]
    - [28, 33.599]
  - - [14336, 14336, 1, 1024]
    - [29, 33.963]
  - - [15360, 15360, 1, 1024]
    - [25, 35.197]
  - - [16384, 16384, 1, 1024]
    - [28, 34.577]
  - - [17408, 17408, 1, 1024]
    - [27, 33.845]
  - - [18432, 18432, 1, 1024]
    - [26, 35.48]
  - - [19456, 19456, 1, 1024]
    - [28, 34.562]
  - - [20480, 20480, 1, 1024]
    - [29, 34.536]
  - - [10240, 10240, 1, 2560]
    - [30, 38.256]
  - - [10240, 10240, 1, 3840]
    - [25, 44.861]
  - - [10240, 10240, 1, 5120]
    - [31, 42.066]
  - - [10240, 10240, 1, 6400]
    - [26, 48.032]
  - - [10240, 10240, 1, 7680]
    - [31, 43.239]
  - - [10240, 10240, 1, 8960]
    - [32, 49.229]
  - - [10240, 10240, 1, 10240]
    - [33, 42.011]
  - - [10240, 10240, 1, 11520]
    - [29, 48.54]
  - - [10240, 10240, 1, 12800]
    - [34, 43.15]
  - - [10240, 10240, 1, 14080]
    - [29, 48.427]
  - - [10240, 10240, 1, 15360]
    - [29, 43.16]
  - - [10240, 10240, 1, 16640]
    - [28, 48.161]
  - - [10240, 10240, 1, 17920]
    - [35, 42.033]
  - - [10240, 10240, 1, 19200]
    - [25, 48.517]
  - - [10240, 10240, 1, 20480]
    - [36, 39.202]
- null
- null
- DeviceEfficiency
- null
- Euclidean
