library/src/hcc_detail/rocsparselt/src/spmm/Tensile/Logic/aquavanjaram/gfx941/aquavanjaram_Cijk_Alik_Bljk_I8I8S_BH_Bias_SPB_AS.yaml
- {MinimumRequiredVersion: 4.33.0}
- aquavanjaram
- gfx941
- [Device 0049, Device 0050]
    SolutionIndex: 0
    SolutionNameMin: Cijk_Alik_Bljk_I8I8S_BH_Bias_SPB_AS_MT32x32x64_MI32x32x1_SN_LDSB0_AFC1_AFEM1_GRVWA8_GSU1_LPA0_LPB0_LPM0_MIWT1_1_PLR1_SU0_SUS0_SVW1_TLDS0_VWA1_VWB1_WG32_2_1
    SolutionIndex: 1
    SolutionNameMin: Cijk_Alik_Bljk_I8I8S_BH_Bias_SPB_AS_MT32x32x64_MI32x32x1_SN_LDSB0_AFC1_AFEM1_GRVWA8_GSU1_LPA16_LPB16_LPM0_MIWT1_1_PLR1_SU0_SUS0_SVW1_TLDS1_VWA1_VWB1_WG32_2_1
    SolutionIndex: 2
    SolutionNameMin: Cijk_Alik_Bljk_I8I8S_BH_Bias_SPB_AS_MT32x32x64_MI32x32x1_SN_LDSB0_AFC1_AFEM8_GRVWA16_GSU1_LPA16_LPB16_LPM0_MIWT1_1_PLR1_SU0_SUS0_SVW1_TLDS1_VWA1_VWB1_WG32_2_1
    SolutionIndex: 3
    SolutionNameMin: Cijk_Alik_Bljk_I8I8S_BH_Bias_SPB_AS_MT32x32x64_MI32x32x1_SN_LDSB0_AFC1_AFEM1_GRVWA8_GSU1_LPA16_LPB16_LPM0_MIWT1_1_PLR1_SU4_SUS256_SVW1_TLDS1_VWA1_VWB1_WG32_2_1
    SolutionIndex: 4
    SolutionNameMin: Cijk_Alik_Bljk_I8I8S_BH_Bias_SPB_AS_MT32x32x64_MI32x32x1_SN_LDSB0_AFC1_AFEM8_GRVWA8_GSU1_LPA16_LPB16_LPM0_MIWT1_1_PLR1_SU4_SUS256_SVW1_TLDS1_VWA1_VWB1_WG32_2_1
    SolutionIndex: 5
    SolutionNameMin: Cijk_Alik_Bljk_I8I8S_BH_Bias_SPB_AS_MT32x32x64_MI32x32x1_SN_LDSB0_AFC0_AFEM1_GRVWA8_GSU2_LPA16_LPB16_LPM0_MIWT1_1_PLR1_SU0_SUS0_SVW1_TLDS1_VWA1_VWB1_WG32_2_1
    SolutionIndex: 6
    SolutionNameMin: Cijk_Alik_Bljk_I8I8S_BH_Bias_SPB_AS_MT32x32x64_MI32x32x1_SN_LDSB0_AFC0_AFEM1_GRVWA16_GSU2_LPA16_LPB16_LPM0_MIWT1_1_PLR1_SU0_SUS0_SVW1_TLDS1_VWA1_VWB1_WG32_2_1
    SolutionIndex: 7
    SolutionNameMin: Cijk_Alik_Bljk_I8I8S_BH_Bias_SPB_AS_MT32x32x64_MI32x32x1_SN_LDSB0_AFC0_AFEM8_GRVWA16_GSU2_LPA16_LPB16_LPM0_MIWT1_1_PLR1_SU0_SUS0_SVW1_TLDS1_VWA1_VWB1_WG32_2_1
    SolutionIndex: 8
    SolutionNameMin: Cijk_Alik_Bljk_I8I8S_BH_Bias_SPB_AS_MT32x32x64_MI32x32x1_SN_LDSB0_AFC0_AFEM1_GRVWA8_GSU2_LPA16_LPB16_LPM0_MIWT1_1_PLR1_SU4_SUS256_SVW1_TLDS1_VWA1_VWB1_WG32_2_1
    SolutionIndex: 9
    SolutionNameMin: Cijk_Alik_Bljk_I8I8S_BH_Bias_SPB_AS_MT32x32x64_MI32x32x1_SN_LDSB0_AFC0_AFEM1_GRVWA16_GSU2_LPA16_LPB16_LPM0_MIWT1_1_PLR1_SU4_SUS256_SVW1_TLDS1_VWA1_VWB1_WG32_2_1
    SolutionIndex: 10
    SolutionNameMin: Cijk_Alik_Bljk_I8I8S_BH_Bias_SPB_AS_MT32x32x128_MI32x32x1_SN_LDSB0_AFC1_AFEM1_GRVWA8_GSU1_LPA16_LPB16_LPM0_MIWT1_1_PLR1_SU0_SUS0_SVW1_TLDS1_VWA1_VWB1_WG32_2_1
    SolutionIndex: 11
    SolutionNameMin: Cijk_Alik_Bljk_I8I8S_BH_Bias_SPB_AS_MT32x32x128_MI32x32x1_SN_LDSB0_AFC1_AFEM1_GRVWA16_GSU1_LPA16_LPB16_LPM0_MIWT1_1_PLR1_SU0_SUS0_SVW1_TLDS1_VWA1_VWB1_WG32_2_1
    SolutionIndex: 12
    SolutionNameMin: Cijk_Alik_Bljk_I8I8S_BH_Bias_SPB_AS_MT32x32x128_MI32x32x1_SN_LDSB0_AFC1_AFEM1_GRVWA16_GSU1_LPA0_LPB0_LPM0_MIWT1_1_PLR3_SU0_SUS0_SVW1_TLDS0_VWA1_VWB1_WG32_2_1
    SolutionIndex: 13
    SolutionNameMin: Cijk_Alik_Bljk_I8I8S_BH_Bias_SPB_AS_MT32x32x128_MI32x32x1_SN_LDSB0_AFC1_AFEM1_GRVWA16_GSU1_LPA16_LPB16_LPM0_MIWT1_1_PLR3_SU0_SUS0_SVW1_TLDS1_VWA1_VWB1_WG32_2_1
    SolutionIndex: 14
    SolutionNameMin: Cijk_Alik_Bljk_I8I8S_BH_Bias_SPB_AS_MT32x32x128_MI32x32x1_SN_LDSB0_AFC1_AFEM8_GRVWA8_GSU1_LPA16_LPB16_LPM0_MIWT1_1_PLR1_SU0_SUS0_SVW1_TLDS1_VWA1_VWB1_WG32_2_1
    SolutionIndex: 15
    SolutionNameMin: Cijk_Alik_Bljk_I8I8S_BH_Bias_SPB_AS_MT32x32x128_MI32x32x1_SN_LDSB0_AFC1_AFEM8_GRVWA16_GSU1_LPA16_LPB16_LPM0_MIWT1_1_PLR1_SU0_SUS0_SVW1_TLDS1_VWA1_VWB1_WG32_2_1
    SolutionIndex: 16
    SolutionNameMin: Cijk_Alik_Bljk_I8I8S_BH_Bias_SPB_AS_MT32x32x128_MI32x32x1_SN_LDSB0_AFC1_AFEM8_GRVWA16_GSU1_LPA16_LPB16_LPM0_MIWT1_1_PLR3_SU0_SUS0_SVW1_TLDS1_VWA1_VWB1_WG32_2_1
    SolutionIndex: 17
    SolutionNameMin: Cijk_Alik_Bljk_I8I8S_BH_Bias_SPB_AS_MT32x32x128_MI32x32x1_SN_LDSB0_AFC1_AFEM1_GRVWA16_GSU1_LPA16_LPB16_LPM0_MIWT1_1_PLR1_SU4_SUS256_SVW1_TLDS1_VWA1_VWB1_WG32_2_1
    SolutionIndex: 18
    SolutionNameMin: Cijk_Alik_Bljk_I8I8S_BH_Bias_SPB_AS_MT32x32x128_MI32x32x1_SN_LDSB0_AFC1_AFEM8_GRVWA16_GSU1_LPA16_LPB16_LPM0_MIWT1_1_PLR1_SU4_SUS256_SVW1_TLDS1_VWA1_VWB1_WG32_2_1
    SolutionIndex: 19
    SolutionNameMin: Cijk_Alik_Bljk_I8I8S_BH_Bias_SPB_AS_MT32x32x128_MI32x32x1_SN_LDSB0_AFC0_AFEM8_GRVWA8_GSU2_LPA16_LPB16_LPM0_MIWT1_1_PLR3_SU0_SUS0_SVW1_TLDS1_VWA1_VWB1_WG32_2_1
    SolutionIndex: 20
    SolutionNameMin: Cijk_Alik_Bljk_I8I8S_BH_Bias_SPB_AS_MT128x128x128_MI32x32x1_SN_LDSB1_AFC1_AFEM1_GRVWA16_GSU1_LPA16_LPB16_LPM0_MIWT2_2_PLR1_SU4_SUS256_SVW2_TLDS1_VWA2_VWB2_WG64_4_1
- - - [15, 15, 1, 16, 15, 15, 16, 16]
    - [3, 0.0]
  - - [15, 15, 1, 32, 15, 15, 32, 32]
    - [6, 0.0]
  - - [15, 15, 1, 64, 15, 15, 64, 64]
    - [8, 0.0]
  - - [15, 15, 1, 96, 15, 15, 96, 96]
    - [9, 0.0]
  - - [15, 15, 1, 128, 15, 15, 128, 128]
    - [8, 0.0]
  - - [15, 15, 1, 136, 15, 15, 136, 136]
    - [6, 0.0]
  - - [15, 15, 1, 256, 15, 15, 256, 256]
    - [8, 0.0]
  - - [15, 15, 1, 264, 15, 15, 264, 264]
    - [5, 0.0]
  - - [16, 16, 1, 16, 16, 16, 16, 16]
    - [2, 0.0]
  - - [16, 16, 1, 32, 16, 16, 32, 32]
    - [2, 0.0]
  - - [16, 16, 1, 64, 16, 16, 64, 64]
    - [7, 0.0]
  - - [16, 16, 1, 96, 16, 16, 96, 96]
    - [7, 0.0]
  - - [16, 16, 1, 128, 16, 16, 128, 128]
    - [7, 0.0]
  - - [16, 16, 1, 136, 16, 16, 136, 136]
    - [9, 0.0]
  - - [16, 16, 1, 256, 16, 16, 256, 256]
    - [19, 0.0]
  - - [16, 16, 1, 264, 16, 16, 264, 264]
    - [7, 0.0]
  - - [256, 256, 1, 16, 256, 256, 16, 16]
    - [11, 0.003]
  - - [256, 256, 1, 24, 256, 256, 24, 24]
    - [10, 0.004]
  - - [256, 256, 1, 32, 256, 256, 32, 32]
    - [15, 0.005]
  - - [256, 256, 1, 64, 256, 256, 64, 64]
    - [4, 0.01]
  - - [256, 256, 1, 96, 256, 256, 96, 96]
    - [11, 0.015]
  - - [256, 256, 1, 128, 256, 256, 128, 128]
    - [16, 0.024]
  - - [256, 256, 1, 136, 256, 256, 136, 136]
    - [14, 0.02]
  - - [256, 256, 1, 256, 256, 256, 256, 256]
    - [1, 0.042]
  - - [384, 384, 1, 16, 384, 384, 16, 16]
    - [0, 0.005]
  - - [384, 384, 1, 24, 384, 384, 24, 24]
    - [2, 0.008]
  - - [384, 384, 1, 32, 384, 384, 32, 32]
    - [20, 0.008]
  - - [384, 384, 1, 64, 384, 384, 64, 64]
    - [12, 0.019]
  - - [384, 384, 1, 96, 384, 384, 96, 96]
    - [15, 0.026]
  - - [384, 384, 1, 128, 384, 384, 128, 128]
    - [18, 0.043]
  - - [384, 384, 1, 136, 384, 384, 136, 136]
    - [13, 0.039]
  - - [384, 384, 1, 256, 384, 384, 256, 256]
    - [17, 0.083]
- null
- null
- DeviceEfficiency
- null
- Euclidean
