library/src/hcc_detail/rocsparselt/src/spmm/Tensile/Logic/aquavanjaram/gfx941/aquavanjaram_Cijk_Ailk_Bljk_BBS_BH_Bias_SA_AS.yaml
- {MinimumRequiredVersion: 4.33.0}
- aquavanjaram
- gfx941
- [Device 0049, Device 0050]
    SolutionIndex: 0
    SolutionNameMin: Cijk_Ailk_Bljk_BBS_BH_Bias_SA_AS_MT32x32x32_MI32x32x1_SN_LDSB0_AFC1_AFEM1_DTVSM1_GRVWA8_GSU1_LPB8_LPMn1_MIWT1_1_PLR1_SU0_SUS0_SVW4_TLDS1_VWA1_VWB1_WG32_2_1
    SolutionIndex: 1
    SolutionNameMin: Cijk_Ailk_Bljk_BBS_BH_Bias_SA_AS_MT32x32x32_MI32x32x1_SN_LDSB0_AFC1_AFEM8_DTVSM0_GRVWA4_GSU1_LPB8_LPM1_MIWT1_1_PLR1_SU0_SUS0_SVW4_TLDS1_VWA1_VWB1_WG32_2_1
    SolutionIndex: 2
    SolutionNameMin: Cijk_Ailk_Bljk_BBS_BH_Bias_SA_AS_MT32x32x32_MI32x32x1_SN_LDSB0_AFC1_AFEM8_DTVSM1_GRVWA4_GSU1_LPB0_LPMn1_MIWT1_1_PLR1_SU0_SUS0_SVW4_TLDS0_VWA1_VWB1_WG32_2_1
    SolutionIndex: 3
    SolutionNameMin: Cijk_Ailk_Bljk_BBS_BH_Bias_SA_AS_MT32x32x32_MI32x32x1_SN_LDSB0_AFC1_AFEM8_DTVSM1_GRVWA8_GSU1_LPB0_LPMn1_MIWT1_1_PLR1_SU0_SUS0_SVW4_TLDS0_VWA1_VWB1_WG32_2_1
    SolutionIndex: 4
    SolutionNameMin: Cijk_Ailk_Bljk_BBS_BH_Bias_SA_AS_MT32x32x32_MI32x32x1_SN_LDSB0_AFC1_AFEM1_DTVSM0_GRVWA4_GSU1_LPB8_LPM1_MIWT1_1_PLR1_SU4_SUS256_SVW4_TLDS1_VWA1_VWB1_WG32_2_1
    SolutionIndex: 5
    SolutionNameMin: Cijk_Ailk_Bljk_BBS_BH_Bias_SA_AS_MT32x32x32_MI32x32x1_SN_LDSB0_AFC1_AFEM8_DTVSM1_GRVWA4_GSU1_LPB8_LPMn1_MIWT1_1_PLR1_SU4_SUS256_SVW4_TLDS1_VWA1_VWB1_WG32_2_1
    SolutionIndex: 6
    SolutionNameMin: Cijk_Ailk_Bljk_BBS_BH_Bias_SA_AS_MT32x32x32_MI32x32x1_SN_LDSB0_AFC0_AFEM8_DTVSM0_GRVWA4_GSU2_LPB8_LPM1_MIWT1_1_PLR1_SU0_SUS0_SVW4_TLDS1_VWA1_VWB1_WG32_2_1
    SolutionIndex: 7
    SolutionNameMin: Cijk_Ailk_Bljk_BBS_BH_Bias_SA_AS_MT128x128x32_MI32x32x1_SN_LDSB0_AFC1_AFEM8_DTVSM1_GRVWA8_GSU1_LPB8_LPMn1_MIWT2_2_PLR1_SU0_SUS0_SVW4_TLDS1_VWA1_VWB1_WG64_4_1
    SolutionIndex: 8
    SolutionNameMin: Cijk_Ailk_Bljk_BBS_BH_Bias_SA_AS_MT32x32x64_MI32x32x1_SN_LDSB0_AFC1_AFEM1_DTVSM0_GRVWA4_GSU1_LPB8_LPM1_MIWT1_1_PLR1_SU0_SUS0_SVW4_TLDS1_VWA1_VWB1_WG32_2_1
    SolutionIndex: 9
    SolutionNameMin: Cijk_Ailk_Bljk_BBS_BH_Bias_SA_AS_MT32x32x64_MI32x32x1_SN_LDSB0_AFC1_AFEM8_DTVSM1_GRVWA4_GSU1_LPB8_LPMn1_MIWT1_1_PLR1_SU0_SUS0_SVW4_TLDS1_VWA1_VWB1_WG32_2_1
    SolutionIndex: 10
    SolutionNameMin: Cijk_Ailk_Bljk_BBS_BH_Bias_SA_AS_MT32x32x64_MI32x32x1_SN_LDSB0_AFC1_AFEM8_DTVSM1_GRVWA8_GSU1_LPB0_LPMn1_MIWT1_1_PLR1_SU0_SUS0_SVW4_TLDS0_VWA1_VWB1_WG32_2_1
    SolutionIndex: 11
    SolutionNameMin: Cijk_Ailk_Bljk_BBS_BH_Bias_SA_AS_MT32x32x64_MI32x32x1_SN_LDSB0_AFC1_AFEM8_DTVSM1_GRVWA4_GSU1_LPB8_LPMn1_MIWT1_1_PLR3_SU0_SUS0_SVW4_TLDS1_VWA1_VWB1_WG32_2_1
    SolutionIndex: 12
    SolutionNameMin: Cijk_Ailk_Bljk_BBS_BH_Bias_SA_AS_MT32x32x64_MI32x32x1_SN_LDSB0_AFC1_AFEM1_DTVSM1_GRVWA4_GSU1_LPB8_LPMn1_MIWT1_1_PLR3_SU4_SUS256_SVW4_TLDS1_VWA1_VWB1_WG32_2_1
    SolutionIndex: 13
    SolutionNameMin: Cijk_Ailk_Bljk_BBS_BH_Bias_SA_AS_MT32x32x64_MI32x32x1_SN_LDSB0_AFC1_AFEM1_DTVSM1_GRVWA8_GSU1_LPB8_LPMn1_MIWT1_1_PLR3_SU4_SUS256_SVW4_TLDS1_VWA1_VWB1_WG32_2_1
    SolutionIndex: 14
    SolutionNameMin: Cijk_Ailk_Bljk_BBS_BH_Bias_SA_AS_MT32x32x64_MI32x32x1_SN_LDSB0_AFC1_AFEM8_DTVSM1_GRVWA8_GSU1_LPB0_LPMn1_MIWT1_1_PLR1_SU4_SUS256_SVW4_TLDS0_VWA1_VWB1_WG32_2_1
    SolutionIndex: 15
    SolutionNameMin: Cijk_Ailk_Bljk_BBS_BH_Bias_SA_AS_MT32x32x64_MI32x32x1_SN_LDSB0_AFC1_AFEM8_DTVSM1_GRVWA8_GSU1_LPB8_LPMn1_MIWT1_1_PLR3_SU4_SUS256_SVW4_TLDS1_VWA1_VWB1_WG32_2_1
    SolutionIndex: 16
    SolutionNameMin: Cijk_Ailk_Bljk_BBS_BH_Bias_SA_AS_MT32x32x64_MI32x32x1_SN_LDSB0_AFC0_AFEM8_DTVSM1_GRVWA8_GSU2_LPB8_LPMn1_MIWT1_1_PLR3_SU0_SUS0_SVW4_TLDS1_VWA1_VWB1_WG32_2_1
- - - [16, 16, 1, 16, 16, 16, 16, 16]
    - [3, 0.407968]
  - - [16, 16, 1, 32, 16, 16, 16, 32]
    - [3, 0.817565]
  - - [16, 16, 1, 64, 16, 16, 16, 64]
    - [16, 1.57842]
  - - [16, 16, 1, 96, 16, 16, 16, 96]
    - [6, 2.30544]
  - - [16, 16, 1, 128, 16, 16, 16, 128]
    - [16, 3.18755]
  - - [16, 16, 1, 136, 16, 16, 16, 136]
    - [16, 3.13079]
  - - [16, 16, 1, 256, 16, 16, 16, 256]
    - [16, 5.7894]
  - - [16, 16, 1, 264, 16, 16, 16, 264]
    - [16, 5.81593]
  - - [256, 256, 1, 16, 256, 256, 256, 16]
    - [13, 76.7625]
  - - [256, 256, 1, 24, 256, 256, 256, 24]
    - [10, 113.811]
  - - [256, 256, 1, 32, 256, 256, 256, 32]
    - [8, 150.441]
  - - [256, 256, 1, 64, 256, 256, 256, 64]
    - [15, 324.624]
  - - [256, 256, 1, 96, 256, 256, 256, 96]
    - [11, 435.079]
  - - [256, 256, 1, 128, 256, 256, 256, 128]
    - [9, 581.734]
  - - [256, 256, 1, 136, 256, 256, 256, 136]
    - [0, 559.855]
  - - [256, 256, 1, 256, 256, 256, 256, 256]
    - [1, 1055.17]
  - - [384, 384, 1, 16, 384, 384, 384, 16]
    - [9, 155.217]
  - - [384, 384, 1, 24, 384, 384, 384, 24]
    - [7, 167.882]
  - - [384, 384, 1, 32, 384, 384, 384, 32]
    - [2, 294.544]
  - - [384, 384, 1, 64, 384, 384, 384, 64]
    - [4, 563.078]
  - - [384, 384, 1, 96, 384, 384, 384, 96]
    - [5, 798.859]
  - - [384, 384, 1, 128, 384, 384, 384, 128]
    - [14, 1150.84]
  - - [384, 384, 1, 136, 384, 384, 384, 136]
    - [12, 1061.03]
  - - [384, 384, 1, 256, 384, 384, 384, 256]
    - [15, 2040.47]
- null
- null
- DeviceEfficiency
