library/src/hcc_detail/rocsparselt/src/spmm/Tensile/Logic/aquavanjaram/gfx941/aquavanjaram_Cijk_Alik_Bjlk_I8HS_BH_BiasS_SPA_AS.yaml
- {MinimumRequiredVersion: 4.33.0}
- aquavanjaram
- gfx941
- [Device 0049, Device 0050]
    SolutionIndex: 0
    SolutionNameMin: Cijk_Alik_Bjlk_I8HS_BH_BiasS_SPA_AS_MT32x32x64_MI32x32x1_SN_AFC1_AFEM1_DTVSM0_GSU1_LPA8_LPM2_MIWT1_1_PLR1_SU0_SUS0_TLDS1_WG32_2_1
    SolutionIndex: 1
    SolutionNameMin: Cijk_Alik_Bjlk_I8HS_BH_BiasS_SPA_AS_MT32x32x64_MI32x32x1_SN_AFC1_AFEM1_DTVSM1_GSU1_LPA8_LPMn1_MIWT1_1_PLR1_SU0_SUS0_TLDS1_WG32_2_1
    SolutionIndex: 2
    SolutionNameMin: Cijk_Alik_Bjlk_I8HS_BH_BiasS_SPA_AS_MT32x32x64_MI32x32x1_SN_AFC1_AFEM8_DTVSM1_GSU1_LPA0_LPMn1_MIWT1_1_PLR1_SU0_SUS0_TLDS0_WG32_2_1
    SolutionIndex: 3
    SolutionNameMin: Cijk_Alik_Bjlk_I8HS_BH_BiasS_SPA_AS_MT32x32x64_MI32x32x1_SN_AFC1_AFEM8_DTVSM1_GSU1_LPA8_LPMn1_MIWT1_1_PLR1_SU0_SUS0_TLDS1_WG32_2_1
    SolutionIndex: 4
    SolutionNameMin: Cijk_Alik_Bjlk_I8HS_BH_BiasS_SPA_AS_MT32x32x64_MI32x32x1_SN_AFC1_AFEM1_DTVSM0_GSU1_LPA8_LPM2_MIWT1_1_PLR1_SU4_SUS256_TLDS1_WG32_2_1
    SolutionIndex: 5
    SolutionNameMin: Cijk_Alik_Bjlk_I8HS_BH_BiasS_SPA_AS_MT32x32x64_MI32x32x1_SN_AFC0_AFEM1_DTVSM1_GSU2_LPA8_LPMn1_MIWT1_1_PLR1_SU0_SUS0_TLDS1_WG32_2_1
    SolutionIndex: 6
    SolutionNameMin: Cijk_Alik_Bjlk_I8HS_BH_BiasS_SPA_AS_MT32x32x64_MI32x32x1_SN_AFC0_AFEM8_DTVSM0_GSU2_LPA0_LPM2_MIWT1_1_PLR1_SU4_SUS256_TLDS0_WG32_2_1
    SolutionIndex: 7
    SolutionNameMin: Cijk_Alik_Bjlk_I8HS_BH_BiasS_SPA_AS_MT32x32x128_MI32x32x1_SN_AFC1_AFEM1_DTVSM1_GSU1_LPA8_LPMn1_MIWT1_1_PLR1_SU0_SUS0_TLDS1_WG32_2_1
    SolutionIndex: 8
    SolutionNameMin: Cijk_Alik_Bjlk_I8HS_BH_BiasS_SPA_AS_MT32x32x128_MI32x32x1_SN_AFC1_AFEM8_DTVSM1_GSU1_LPA8_LPMn1_MIWT1_1_PLR3_SU0_SUS0_TLDS1_WG32_2_1
    SolutionIndex: 9
    SolutionNameMin: Cijk_Alik_Bjlk_I8HS_BH_BiasS_SPA_AS_MT32x32x128_MI32x32x1_SN_AFC1_AFEM8_DTVSM0_GSU1_LPA8_LPM2_MIWT1_1_PLR1_SU4_SUS256_TLDS1_WG32_2_1
- - - [16, 16, 1, 16, 16, 16, 16, 16]
    - [2, 0.0]
  - - [16, 16, 1, 32, 16, 16, 32, 16]
    - [2, 0.0]
  - - [16, 16, 1, 64, 16, 16, 64, 16]
    - [3, 0.0]
  - - [16, 16, 1, 96, 16, 16, 96, 16]
    - [3, 0.0]
  - - [16, 16, 1, 128, 16, 16, 128, 16]
    - [3, 0.0]
  - - [16, 16, 1, 136, 16, 16, 136, 16]
    - [3, 0.0]
  - - [16, 16, 1, 256, 16, 16, 256, 16]
    - [9, 0.0]
  - - [16, 16, 1, 264, 16, 16, 264, 16]
    - [8, 0.0]
  - - [256, 256, 1, 16, 256, 256, 16, 256]
    - [0, 0.004]
  - - [256, 256, 1, 24, 256, 256, 24, 256]
    - [1, 0.006]
  - - [256, 256, 1, 32, 256, 256, 32, 256]
    - [4, 0.007]
  - - [256, 256, 1, 64, 256, 256, 64, 256]
    - [5, 0.01]
  - - [256, 256, 1, 96, 256, 256, 96, 256]
    - [6, 0.014]
  - - [256, 256, 1, 128, 256, 256, 128, 256]
    - [3, 0.035]
  - - [256, 256, 1, 136, 256, 256, 136, 256]
    - [0, 0.031]
  - - [256, 256, 1, 256, 256, 256, 256, 256]
    - [7, 0.063]
- null
- null
- DeviceEfficiency
- null
- Euclidean
