library/src/hcc_detail/rocsparselt/src/spmm/Tensile/Logic/aquavanjaram/gfx941/aquavanjaram_Cijk_Ailk_Bljk_HHS_BH_Bias_SPA_AS.yaml
- {MinimumRequiredVersion: 4.33.0}
- aquavanjaram
- gfx941
- [Device 0049, Device 0050]
    SolutionIndex: 0
    SolutionNameMin: Cijk_Ailk_Bljk_HHS_BH_Bias_SPA_AS_MT32x32x32_MI32x32x1_SN_LDSB0_AFC1_AFEM1_DTVSM0_GRVWA8_GSU1_LPB0_LPM2_MIWT1_1_PLR1_SU0_SUS0_SVW4_TLDS0_VWA1_VWB1_WG32_2_1
    SolutionIndex: 1
    SolutionNameMin: Cijk_Ailk_Bljk_HHS_BH_Bias_SPA_AS_MT32x32x32_MI32x32x1_SN_LDSB0_AFC1_AFEM1_DTVSM0_GRVWA8_GSU1_LPB8_LPM2_MIWT1_1_PLR1_SU0_SUS0_SVW4_TLDS1_VWA1_VWB1_WG32_2_1
    SolutionIndex: 2
    SolutionNameMin: Cijk_Ailk_Bljk_HHS_BH_Bias_SPA_AS_MT32x32x32_MI32x32x1_SN_LDSB0_AFC1_AFEM1_DTVSM1_GRVWA4_GSU1_LPB8_LPMn1_MIWT1_1_PLR1_SU0_SUS0_SVW4_TLDS1_VWA1_VWB1_WG32_2_1
    SolutionIndex: 3
    SolutionNameMin: Cijk_Ailk_Bljk_HHS_BH_Bias_SPA_AS_MT32x32x32_MI32x32x1_SN_LDSB0_AFC1_AFEM8_DTVSM1_GRVWA4_GSU1_LPB8_LPMn1_MIWT1_1_PLR1_SU0_SUS0_SVW4_TLDS1_VWA1_VWB1_WG32_2_1
    SolutionIndex: 4
    SolutionNameMin: Cijk_Ailk_Bljk_HHS_BH_Bias_SPA_AS_MT32x32x32_MI32x32x1_SN_LDSB0_AFC1_AFEM8_DTVSM1_GRVWA8_GSU1_LPB8_LPMn1_MIWT1_1_PLR1_SU0_SUS0_SVW4_TLDS1_VWA1_VWB1_WG32_2_1
    SolutionIndex: 5
    SolutionNameMin: Cijk_Ailk_Bljk_HHS_BH_Bias_SPA_AS_MT32x32x32_MI32x32x1_SN_LDSB0_AFC1_AFEM1_DTVSM1_GRVWA8_GSU1_LPB8_LPMn1_MIWT1_1_PLR1_SU4_SUS256_SVW4_TLDS1_VWA1_VWB1_WG32_2_1
    SolutionIndex: 6
    SolutionNameMin: Cijk_Ailk_Bljk_HHS_BH_Bias_SPA_AS_MT32x32x32_MI32x32x1_SN_LDSB0_AFC0_AFEM8_DTVSM0_GRVWA8_GSU2_LPB8_LPM2_MIWT1_1_PLR1_SU0_SUS0_SVW4_TLDS1_VWA1_VWB1_WG32_2_1
    SolutionIndex: 7
    SolutionNameMin: Cijk_Ailk_Bljk_HHS_BH_Bias_SPA_AS_MT128x128x32_MI32x32x1_SN_LDSB0_AFC1_AFEM8_DTVSM0_GRVWA8_GSU1_LPB8_LPM2_MIWT2_2_PLR1_SU0_SUS0_SVW8_TLDS1_VWA2_VWB1_WG64_4_1
    SolutionIndex: 8
    SolutionNameMin: Cijk_Ailk_Bljk_HHS_BH_Bias_SPA_AS_MT128x128x32_MI32x32x1_SN_LDSB0_AFC1_AFEM8_DTVSM0_GRVWA8_GSU1_LPB8_LPM2_MIWT2_2_PLR1_SU4_SUS256_SVW4_TLDS1_VWA1_VWB1_WG64_4_1
    SolutionIndex: 9
    SolutionNameMin: Cijk_Ailk_Bljk_HHS_BH_Bias_SPA_AS_MT32x32x64_MI32x32x1_SN_LDSB0_AFC1_AFEM1_DTVSM1_GRVWA4_GSU1_LPB0_LPMn1_MIWT1_1_PLR3_SU0_SUS0_SVW4_TLDS0_VWA1_VWB1_WG32_2_1
    SolutionIndex: 10
    SolutionNameMin: Cijk_Ailk_Bljk_HHS_BH_Bias_SPA_AS_MT32x32x64_MI32x32x1_SN_LDSB0_AFC1_AFEM8_DTVSM0_GRVWA4_GSU1_LPB8_LPM1_MIWT1_1_PLR1_SU0_SUS0_SVW4_TLDS1_VWA1_VWB1_WG32_2_1
    SolutionIndex: 11
    SolutionNameMin: Cijk_Ailk_Bljk_HHS_BH_Bias_SPA_AS_MT32x32x64_MI32x32x1_SN_LDSB0_AFC1_AFEM8_DTVSM0_GRVWA8_GSU1_LPB8_LPM2_MIWT1_1_PLR3_SU0_SUS0_SVW4_TLDS1_VWA1_VWB1_WG32_2_1
    SolutionIndex: 12
    SolutionNameMin: Cijk_Ailk_Bljk_HHS_BH_Bias_SPA_AS_MT32x32x64_MI32x32x1_SN_LDSB0_AFC1_AFEM8_DTVSM1_GRVWA4_GSU1_LPB8_LPMn1_MIWT1_1_PLR1_SU0_SUS0_SVW4_TLDS1_VWA1_VWB1_WG32_2_1
    SolutionIndex: 13
    SolutionNameMin: Cijk_Ailk_Bljk_HHS_BH_Bias_SPA_AS_MT32x32x64_MI32x32x1_SN_LDSB0_AFC1_AFEM8_DTVSM1_GRVWA4_GSU1_LPB8_LPMn1_MIWT1_1_PLR3_SU0_SUS0_SVW4_TLDS1_VWA1_VWB1_WG32_2_1
    SolutionIndex: 14
    SolutionNameMin: Cijk_Ailk_Bljk_HHS_BH_Bias_SPA_AS_MT32x32x64_MI32x32x1_SN_LDSB0_AFC1_AFEM8_DTVSM1_GRVWA8_GSU1_LPB8_LPMn1_MIWT1_1_PLR3_SU0_SUS0_SVW4_TLDS1_VWA1_VWB1_WG32_2_1
    SolutionIndex: 15
    SolutionNameMin: Cijk_Ailk_Bljk_HHS_BH_Bias_SPA_AS_MT32x32x64_MI32x32x1_SN_LDSB0_AFC1_AFEM8_DTVSM1_GRVWA4_GSU1_LPB8_LPMn1_MIWT1_1_PLR3_SU4_SUS256_SVW4_TLDS1_VWA1_VWB1_WG32_2_1
    SolutionIndex: 16
    SolutionNameMin: Cijk_Ailk_Bljk_HHS_BH_Bias_SPA_AS_MT32x32x64_MI32x32x1_SN_LDSB0_AFC1_AFEM8_DTVSM1_GRVWA8_GSU1_LPB8_LPMn1_MIWT1_1_PLR3_SU4_SUS256_SVW4_TLDS1_VWA1_VWB1_WG32_2_1
    SolutionIndex: 17
    SolutionNameMin: Cijk_Ailk_Bljk_HHS_BH_Bias_SPA_AS_MT32x32x64_MI32x32x1_SN_LDSB0_AFC0_AFEM8_DTVSM1_GRVWA8_GSU2_LPB8_LPMn1_MIWT1_1_PLR3_SU0_SUS0_SVW4_TLDS1_VWA1_VWB1_WG32_2_1
    SolutionIndex: 18
    SolutionNameMin: Cijk_Ailk_Bljk_HHS_BH_Bias_SPA_AS_MT256x64x64_MI32x32x1_SN_LDSB0_AFC1_AFEM1_GRVWB8_GSU1_LBSPPA0_LPA0_LPB8_MIWT2_2_NLCA1_PLR1_SU8_SUS128_WG128_2_1_WGM18
    SolutionIndex: 19
    SolutionNameMin: Cijk_Ailk_Bljk_HHS_BH_Bias_SPA_AS_MT192x256x64_MI16x16x1_SN_LDSB1_AFC0_AFEM8_GRVWA8_GRVWB8_GSU2_LBSPPA3072_LPA16_LPB16_MIWT6_8_NLCA3_PLR1_SU0_SUS0_WSGRA1_WSGRB0_WG32_8_1_WGM1
    SolutionIndex: 20
    SolutionNameMin: Cijk_Ailk_Bljk_HHS_BH_Bias_SPA_AS_MT192x256x64_MI16x16x1_SN_LDSB1_AFC0_AFEM8_GRVWB8_GSU8_LBSPPA3072_LPA16_LPB16_MIWT6_8_NLCA3_PLR1_SU0_SUS0_WG32_8_1_WGM6
    SolutionIndex: 21
    SolutionNameMin: Cijk_Ailk_Bljk_HHS_BH_Bias_SPA_AS_MT192x256x64_MI16x16x1_SN_LDSB1_AFC0_AFEM8_GRVWA8_GRVWB8_GSU2_LBSPPA3072_LPA16_LPB16_MIWT6_8_NLCA3_PLR1_SU0_SUS0_WSGRA1_WSGRB0_WG32_8_1_WGM18
    SolutionIndex: 22
    SolutionNameMin: Cijk_Ailk_Bljk_HHS_BH_Bias_SPA_AS_MT192x256x64_MI16x16x1_SN_LDSB1_AFC1_AFEM1_GRVWB8_GSU1_LBSPPA3072_LBSPPB128_LPA16_LPB16_MIWT6_8_NLCA3_PLR1_SU8_SUS128_TLDS1_WSGRA1_WSGRB0_WG32_8_1_WGM6
    SolutionIndex: 23
    SolutionNameMin: Cijk_Ailk_Bljk_HHS_BH_Bias_SPA_AS_MT192x256x64_MI16x16x1_SN_LDSB1_AFC1_AFEM8_GRVWB8_GSU1_LBSPPA3072_LBSPPB128_LPA16_LPB16_MIWT6_8_NLCA3_PLR1_SU4_SUS256_TLDS1_WSGRA0_WSGRB1_WG32_8_1_WGM1
    SolutionIndex: 24
    SolutionNameMin: Cijk_Ailk_Bljk_HHS_BH_Bias_SPA_AS_MT192x256x64_MI16x16x1_SN_LDSB1_AFC1_AFEM8_GRVWB8_GSU1_LBSPPA3072_LBSPPB128_LPA16_LPB16_MIWT6_8_NLCA3_PLR1_SU8_SUS256_TLDS1_WSGRA0_WSGRB0_WG32_8_1_WGM6
    SolutionIndex: 25
    SolutionNameMin: Cijk_Ailk_Bljk_HHS_BH_Bias_SPA_AS_MT256x224x64_MI16x16x1_SN_LDSB1_AFC1_AFEM8_GRVWB8_GSU1_LBSPPA4096_LPA16_LPB16_MIWT8_7_NLCA1_PLR1_SU8_SUS128_WG32_8_1_WGM18
    SolutionIndex: 26
    SolutionNameMin: Cijk_Ailk_Bljk_HHS_BH_Bias_SPA_AS_MT256x224x64_MI16x16x1_SN_LDSB1_AFC1_AFEM8_GRVWB8_GSU1_LBSPPA4096_LPA16_LPB16_MIWT8_7_NLCA1_PLR1_SU8_SUS256_WG32_8_1_WGM6
    SolutionIndex: 27
    SolutionNameMin: Cijk_Ailk_Bljk_HHS_BH_Bias_SPA_AS_MT256x224x64_MI16x16x1_SN_LDSB1_AFC1_AFEM8_GRVWA8_GRVWB8_GSU1_LBSPPA4096_LPA16_LPB16_MIWT8_7_NLCA1_PLR1_SU0_SUS0_WSGRA1_WSGRB1_WG32_8_1_WGM38
    SolutionIndex: 28
    SolutionNameMin: Cijk_Ailk_Bljk_HHS_BH_Bias_SPA_AS_MT256x224x64_MI16x16x1_SN_LDSB1_AFC1_AFEM8_GRVWB8_GSU1_LBSPPA4096_LPA16_LPB16_MIWT8_7_NLCA1_PLR1_SU4_SUS256_WG32_8_1_WGM18
    SolutionIndex: 29
    SolutionNameMin: Cijk_Ailk_Bljk_HHS_BH_Bias_SPA_AS_MT192x256x64_MI16x16x1_SN_LDSB1_AFC1_AFEM8_GRVWB8_GSU1_LBSPPA3072_LPA16_LPB16_MIWT6_8_NLCA3_PLR1_SU8_SUS128_WG32_8_1_WGM1
    SolutionIndex: 30
    SolutionNameMin: Cijk_Ailk_Bljk_HHS_BH_Bias_SPA_AS_MT256x224x64_MI16x16x1_SN_LDSB1_AFC1_AFEM8_GRVWB8_GSU1_LBSPPA4096_LPA16_LPB16_MIWT8_7_NLCA1_PLR1_SU8_SUS256_WG32_8_1_WGM18
    SolutionIndex: 31
    SolutionNameMin: Cijk_Ailk_Bljk_HHS_BH_Bias_SPA_AS_MT256x224x64_MI16x16x1_SN_LDSB1_AFC1_AFEM8_GRVWB8_GSU1_LBSPPA4096_LPA16_LPB16_MIWT8_7_NLCA1_PLR1_SU4_SUS128_WG32_8_1_WGM18
    SolutionIndex: 32
    SolutionNameMin: Cijk_Ailk_Bljk_HHS_BH_Bias_SPA_AS_MT256x224x64_MI16x16x1_SN_LDSB1_AFC1_AFEM8_GRVWB8_GSU1_LBSPPA4096_LPA16_LPB16_MIWT8_7_NLCA1_PLR1_SU8_SUS128_WG32_8_1_WGM6
    SolutionIndex: 33
    SolutionNameMin: Cijk_Ailk_Bljk_HHS_BH_Bias_SPA_AS_MT192x256x64_MI16x16x1_SN_LDSB1_AFC1_AFEM8_GRVWA8_GRVWB8_GSU1_LBSPPA3072_LPA16_LPB16_MIWT6_8_NLCA3_PLR1_SU8_SUS128_WSGRA1_WSGRB0_WG32_8_1_WGM1
    SolutionIndex: 34
    SolutionNameMin: Cijk_Ailk_Bljk_HHS_BH_Bias_SPA_AS_MT192x256x64_MI16x16x1_SN_LDSB1_AFC1_AFEM8_GRVWA8_GRVWB8_GSU1_LBSPPA3072_LPA16_LPB16_MIWT6_8_NLCA3_PLR1_SU8_SUS256_WSGRA1_WSGRB0_WG32_8_1_WGM1
    SolutionIndex: 35
    SolutionNameMin: Cijk_Ailk_Bljk_HHS_BH_Bias_SPA_AS_MT192x256x64_MI16x16x1_SN_LDSB1_AFC1_AFEM1_GRVWB8_GSU1_LBSPPA3072_LPA16_LPB16_MIWT6_8_NLCA3_PLR1_SU8_SUS256_WG32_8_1_WGM1
    SolutionIndex: 36
    SolutionNameMin: Cijk_Ailk_Bljk_HHS_BH_Bias_SPA_AS_MT256x224x64_MI16x16x1_SN_LDSB1_AFC1_AFEM8_GRVWA8_GRVWB8_GSU1_LBSPPA4096_LPA16_LPB16_MIWT8_7_NLCA1_PLR1_SU8_SUS256_WSGRA0_WSGRB1_WG32_8_1_WGM18
    SolutionIndex: 37
    SolutionNameMin: Cijk_Ailk_Bljk_HHS_BH_Bias_SPA_AS_MT256x224x64_MI32x32x1_SN_LDSB1_AFC1_AFEM8_GRVWA8_GRVWB8_GSU1_LBSPPA0_LPA0_LPB8_MIWT2_7_NLCA1_PLR1_SU8_SUS256_WSGRA0_WSGRB1_WG128_2_1_WGM18
    SolutionIndex: 38
    SolutionNameMin: Cijk_Ailk_Bljk_HHS_BH_Bias_SPA_AS_MT256x224x64_MI32x32x1_SN_LDSB1_AFC1_AFEM8_GRVWA8_GRVWB8_GSU1_LBSPPA0_LPA0_LPB8_MIWT2_7_NLCA1_PLR1_SU8_SUS256_WSGRA0_WSGRB0_WG128_2_1_WGM18
    SolutionIndex: 39
    SolutionNameMin: Cijk_Ailk_Bljk_HHS_BH_Bias_SPA_AS_MT256x256x64_MI32x32x1_SN_LDSB1_AFC1_AFEM8_GRVWA8_GRVWB8_GSU1_LBSPPA0_LPA0_LPB8_MIWT2_8_NLCA1_PLR1_SU8_SUS256_WSGRA0_WSGRB1_WG128_2_1_WGM18
- - - [16, 16, 1, 16]
    - [4, 0.0]
  - - [16, 16, 1, 32]
    - [4, 0.0]
  - - [16, 16, 1, 64]
    - [4, 0.0]
  - - [16, 16, 1, 96]
    - [3, 0.0]
  - - [16, 16, 1, 128]
    - [11, 0.0]
  - - [16, 16, 1, 136]
    - [6, 0.0]
  - - [16, 16, 1, 256]
    - [6, 0.001]
  - - [16, 16, 1, 264]
    - [17, 0.001]
  - - [256, 256, 1, 16]
    - [1, 0.009]
  - - [256, 256, 1, 24]
    - [4, 0.013]
  - - [256, 256, 1, 32]
    - [14, 0.018]
  - - [256, 256, 1, 64]
    - [2, 0.036]
  - - [256, 256, 1, 96]
    - [9, 0.042]
  - - [256, 256, 1, 128]
    - [3, 0.067]
  - - [256, 256, 1, 136]
    - [12, 0.068]
  - - [256, 256, 1, 256]
    - [13, 0.129]
  - - [384, 384, 1, 16]
    - [7, 0.017]
  - - [384, 384, 1, 24]
    - [0, 0.025]
  - - [384, 384, 1, 32]
    - [8, 0.03]
  - - [384, 384, 1, 64]
    - [10, 0.066]
  - - [384, 384, 1, 96]
    - [15, 0.097]
  - - [384, 384, 1, 128]
    - [16, 0.124]
  - - [384, 384, 1, 136]
    - [5, 0.111]
  - - [384, 384, 1, 256]
    - [11, 0.23]
  - - [3072, 1024, 1, 16384]
    - [18, 20.355]
  - - [4096, 1024, 1, 16384]
    - [19, 26.701]
  - - [1024, 1024, 1, 16384]
    - [20, 18.394]
  - - [1024, 4096, 1, 16384]
    - [21, 27.483]
  - - [3072, 3072, 1, 1024]
    - [22, 14.98]
  - - [4096, 4096, 1, 1024]
    - [23, 16.757]
  - - [5120, 5120, 1, 1024]
    - [24, 18.588]
  - - [6144, 6144, 1, 1024]
    - [25, 22.871]
  - - [7168, 7168, 1, 1024]
    - [26, 24.797]
  - - [8192, 8192, 1, 1024]
    - [27, 23.3]
  - - [9216, 9216, 1, 1024]
    - [28, 25.516]
  - - [10240, 10240, 1, 1024]
    - [29, 25.056]
  - - [11264, 11264, 1, 1024]
    - [30, 27.132]
  - - [12288, 12288, 1, 1024]
    - [31, 27.15]
  - - [13312, 13312, 1, 1024]
    - [25, 27.539]
  - - [14336, 14336, 1, 1024]
    - [25, 28.218]
  - - [15360, 15360, 1, 1024]
    - [25, 27.639]
  - - [16384, 16384, 1, 1024]
    - [25, 28.671]
  - - [17408, 17408, 1, 1024]
    - [32, 28.206]
  - - [18432, 18432, 1, 1024]
    - [32, 28.217]
  - - [19456, 19456, 1, 1024]
    - [32, 29.051]
  - - [20480, 20480, 1, 1024]
    - [32, 28.708]
  - - [10240, 10240, 1, 2560]
    - [29, 35.711]
  - - [10240, 10240, 1, 3840]
    - [33, 38.432]
  - - [10240, 10240, 1, 5120]
    - [33, 39.329]
  - - [10240, 10240, 1, 6400]
    - [33, 40.762]
  - - [10240, 10240, 1, 7680]
    - [34, 41.146]
  - - [10240, 10240, 1, 8960]
    - [34, 41.668]
  - - [10240, 10240, 1, 10240]
    - [34, 41.229]
  - - [10240, 10240, 1, 11520]
    - [34, 42.037]
  - - [10240, 10240, 1, 12800]
    - [34, 42.513]
  - - [10240, 10240, 1, 14080]
    - [35, 42.195]
  - - [10240, 10240, 1, 15360]
    - [36, 41.713]
  - - [10240, 10240, 1, 16640]
    - [37, 42.059]
  - - [10240, 10240, 1, 17920]
    - [38, 41.901]
  - - [10240, 10240, 1, 19200]
    - [37, 42.068]
  - - [10240, 10240, 1, 20480]
    - [39, 39.318]
- null
- null
- DeviceEfficiency
- null
- Euclidean
