library/src/hcc_detail/rocsparselt/src/spmm/Tensile/Logic/aquavanjaram/gfx941/aquavanjaram_Cijk_Ailk_Bjlk_I8HS_BH_BiasS_SPA_AS.yaml
- {MinimumRequiredVersion: 4.33.0}
- aquavanjaram
- gfx941
- [Device 0049, Device 0050]
    SolutionIndex: 0
    SolutionNameMin: Cijk_Ailk_Bjlk_I8HS_BH_BiasS_SPA_AS_MT32x32x64_MI32x32x1_SN_AFC1_AFEM8_DTVSM0_GSU1_LPM2_MIWT1_1_PLR1_SU0_SUS0_WG32_2_1
    SolutionIndex: 1
    SolutionNameMin: Cijk_Ailk_Bjlk_I8HS_BH_BiasS_SPA_AS_MT32x32x64_MI32x32x1_SN_AFC1_AFEM8_DTVSM1_GSU1_LPMn1_MIWT1_1_PLR1_SU0_SUS0_WG32_2_1
    SolutionIndex: 2
    SolutionNameMin: Cijk_Ailk_Bjlk_I8HS_BH_BiasS_SPA_AS_MT32x32x64_MI32x32x1_SN_AFC1_AFEM8_DTVSM0_GSU1_LPM2_MIWT1_1_PLR1_SU4_SUS256_WG32_2_1
    SolutionIndex: 3
    SolutionNameMin: Cijk_Ailk_Bjlk_I8HS_BH_BiasS_SPA_AS_MT128x128x64_MI32x32x1_SN_AFC1_AFEM1_DTVSM1_GSU1_LPMn1_MIWT2_2_PLR1_SU4_SUS256_WG64_4_1
    SolutionIndex: 4
    SolutionNameMin: Cijk_Ailk_Bjlk_I8HS_BH_BiasS_SPA_AS_MT128x128x64_MI32x32x1_SN_AFC1_AFEM8_DTVSM0_GSU1_LPM2_MIWT2_2_PLR1_SU4_SUS256_WG64_4_1
    SolutionIndex: 5
    SolutionNameMin: Cijk_Ailk_Bjlk_I8HS_BH_BiasS_SPA_AS_MT128x128x64_MI32x32x1_SN_AFC0_AFEM8_DTVSM0_GSU2_LPM2_MIWT2_2_PLR1_SU0_SUS0_WG64_4_1
    SolutionIndex: 6
    SolutionNameMin: Cijk_Ailk_Bjlk_I8HS_BH_BiasS_SPA_AS_MT128x128x64_MI32x32x1_SN_AFC0_AFEM1_DTVSM0_GSU2_LPM2_MIWT2_2_PLR1_SU4_SUS256_WG64_4_1
    SolutionIndex: 7
    SolutionNameMin: Cijk_Ailk_Bjlk_I8HS_BH_BiasS_SPA_AS_MT32x32x128_MI32x32x1_SN_AFC1_AFEM1_DTVSM0_GSU1_LPM2_MIWT1_1_PLR3_SU0_SUS0_WG32_2_1
    SolutionIndex: 8
    SolutionNameMin: Cijk_Ailk_Bjlk_I8HS_BH_BiasS_SPA_AS_MT32x32x128_MI32x32x1_SN_AFC1_AFEM1_DTVSM0_GSU1_LPM2_MIWT1_1_PLR3_SU4_SUS256_WG32_2_1
    SolutionIndex: 9
    SolutionNameMin: Cijk_Ailk_Bjlk_I8HS_BH_BiasS_SPA_AS_MT32x32x128_MI32x32x1_SN_AFC0_AFEM1_DTVSM1_GSU2_LPMn1_MIWT1_1_PLR3_SU4_SUS256_WG32_2_1
- - - [16, 16, 1, 16, 16, 16, 16, 16]
    - [0, 0.0]
  - - [16, 16, 1, 32, 16, 16, 16, 16]
    - [0, 0.0]
  - - [16, 16, 1, 64, 16, 16, 16, 16]
    - [0, 0.0]
  - - [16, 16, 1, 96, 16, 16, 16, 16]
    - [0, 0.0]
  - - [16, 16, 1, 128, 16, 16, 16, 16]
    - [7, 0.0]
  - - [16, 16, 1, 136, 16, 16, 16, 16]
    - [1, 0.0]
  - - [16, 16, 1, 256, 16, 16, 16, 16]
    - [7, 0.0]
  - - [16, 16, 1, 264, 16, 16, 16, 16]
    - [0, 0.0]
  - - [256, 256, 1, 16, 256, 256, 256, 256]
    - [9, 0.002]
  - - [256, 256, 1, 24, 256, 256, 256, 256]
    - [5, 0.001]
  - - [256, 256, 1, 32, 256, 256, 256, 256]
    - [6, 0.003]
  - - [256, 256, 1, 64, 256, 256, 256, 256]
    - [4, 0.002]
  - - [256, 256, 1, 96, 256, 256, 256, 256]
    - [3, 0.003]
  - - [256, 256, 1, 128, 256, 256, 256, 256]
    - [3, 0.014]
  - - [256, 256, 1, 136, 256, 256, 256, 256]
    - [2, 0.026]
  - - [256, 256, 1, 256, 256, 256, 256, 256]
    - [8, 0.05]
- null
- null
- DeviceEfficiency
- null
- Euclidean
