library/src/hcc_detail/rocsparselt/src/spmm/Tensile/Logic/aquavanjaram/gfx941/aquavanjaram_Cijk_Ailk_Bjlk_BBS_BH_Bias_SPA_AS.yaml
- {MinimumRequiredVersion: 4.33.0}
- aquavanjaram
- gfx941
- [Device 0049, Device 0050]
    SolutionIndex: 0
    SolutionNameMin: Cijk_Ailk_Bjlk_BBS_BH_Bias_SPA_AS_MT32x32x32_MI32x32x1_SN_LDSB0_AFC1_AFEM8_DTVSM0_GRVWA4_GSU1_LPM1_MIWT1_1_PLR1_SU0_SUS0_SVW4_VWA1_VWB1_WG32_2_1
    SolutionIndex: 1
    SolutionNameMin: Cijk_Ailk_Bjlk_BBS_BH_Bias_SPA_AS_MT32x32x32_MI32x32x1_SN_LDSB0_AFC1_AFEM8_DTVSM0_GRVWA8_GSU1_LPM2_MIWT1_1_PLR1_SU0_SUS0_SVW4_VWA1_VWB1_WG32_2_1
    SolutionIndex: 2
    SolutionNameMin: Cijk_Ailk_Bjlk_BBS_BH_Bias_SPA_AS_MT32x32x32_MI32x32x1_SN_LDSB0_AFC1_AFEM8_DTVSM1_GRVWA4_GSU1_LPMn1_MIWT1_1_PLR1_SU0_SUS0_SVW4_VWA1_VWB1_WG32_2_1
    SolutionIndex: 3
    SolutionNameMin: Cijk_Ailk_Bjlk_BBS_BH_Bias_SPA_AS_MT32x32x32_MI32x32x1_SN_LDSB0_AFC1_AFEM8_DTVSM1_GRVWA8_GSU1_LPMn1_MIWT1_1_PLR1_SU0_SUS0_SVW4_VWA1_VWB1_WG32_2_1
    SolutionIndex: 4
    SolutionNameMin: Cijk_Ailk_Bjlk_BBS_BH_Bias_SPA_AS_MT32x32x32_MI32x32x1_SN_LDSB0_AFC1_AFEM8_DTVSM0_GRVWA4_GSU1_LPM1_MIWT1_1_PLR1_SU4_SUS256_SVW4_VWA1_VWB1_WG32_2_1
    SolutionIndex: 5
    SolutionNameMin: Cijk_Ailk_Bjlk_BBS_BH_Bias_SPA_AS_MT32x32x32_MI32x32x1_SN_LDSB0_AFC1_AFEM8_DTVSM1_GRVWA8_GSU1_LPMn1_MIWT1_1_PLR1_SU4_SUS256_SVW4_VWA1_VWB1_WG32_2_1
    SolutionIndex: 6
    SolutionNameMin: Cijk_Ailk_Bjlk_BBS_BH_Bias_SPA_AS_MT32x32x32_MI32x32x1_SN_LDSB0_AFC0_AFEM8_DTVSM1_GRVWA8_GSU2_LPMn1_MIWT1_1_PLR1_SU0_SUS0_SVW4_VWA1_VWB1_WG32_2_1
    SolutionIndex: 7
    SolutionNameMin: Cijk_Ailk_Bjlk_BBS_BH_Bias_SPA_AS_MT256x256x32_MI32x32x1_SN_LDSB0_AFC1_AFEM8_DTVSM0_GRVWA4_GSU1_LPM1_MIWT2_4_PLR1_SU0_SUS0_SVW8_VWA2_VWB2_WG128_4_1
    SolutionIndex: 8
    SolutionNameMin: Cijk_Ailk_Bjlk_BBS_BH_Bias_SPA_AS_MT32x32x64_MI32x32x1_SN_LDSB0_AFC1_AFEM1_DTVSM1_GRVWA8_GSU1_LPMn1_MIWT1_1_PLR1_SU0_SUS0_SVW4_VWA1_VWB1_WG32_2_1
    SolutionIndex: 9
    SolutionNameMin: Cijk_Ailk_Bjlk_BBS_BH_Bias_SPA_AS_MT32x32x64_MI32x32x1_SN_LDSB0_AFC1_AFEM1_DTVSM1_GRVWA4_GSU1_LPMn1_MIWT1_1_PLR3_SU0_SUS0_SVW4_VWA1_VWB1_WG32_2_1
    SolutionIndex: 10
    SolutionNameMin: Cijk_Ailk_Bjlk_BBS_BH_Bias_SPA_AS_MT32x32x64_MI32x32x1_SN_LDSB0_AFC1_AFEM1_DTVSM1_GRVWA8_GSU1_LPMn1_MIWT1_1_PLR3_SU0_SUS0_SVW4_VWA1_VWB1_WG32_2_1
    SolutionIndex: 11
    SolutionNameMin: Cijk_Ailk_Bjlk_BBS_BH_Bias_SPA_AS_MT32x32x64_MI32x32x1_SN_LDSB0_AFC1_AFEM8_DTVSM0_GRVWA8_GSU1_LPM2_MIWT1_1_PLR1_SU0_SUS0_SVW4_VWA1_VWB1_WG32_2_1
    SolutionIndex: 12
    SolutionNameMin: Cijk_Ailk_Bjlk_BBS_BH_Bias_SPA_AS_MT32x32x64_MI32x32x1_SN_LDSB0_AFC1_AFEM8_DTVSM0_GRVWA4_GSU1_LPM1_MIWT1_1_PLR3_SU0_SUS0_SVW4_VWA1_VWB1_WG32_2_1
    SolutionIndex: 13
    SolutionNameMin: Cijk_Ailk_Bjlk_BBS_BH_Bias_SPA_AS_MT32x32x64_MI32x32x1_SN_LDSB0_AFC1_AFEM8_DTVSM1_GRVWA4_GSU1_LPMn1_MIWT1_1_PLR3_SU0_SUS0_SVW4_VWA1_VWB1_WG32_2_1
    SolutionIndex: 14
    SolutionNameMin: Cijk_Ailk_Bjlk_BBS_BH_Bias_SPA_AS_MT32x32x64_MI32x32x1_SN_LDSB0_AFC1_AFEM1_DTVSM1_GRVWA8_GSU1_LPMn1_MIWT1_1_PLR3_SU4_SUS256_SVW4_VWA1_VWB1_WG32_2_1
    SolutionIndex: 15
    SolutionNameMin: Cijk_Ailk_Bjlk_BBS_BH_Bias_SPA_AS_MT32x32x64_MI32x32x1_SN_LDSB0_AFC1_AFEM8_DTVSM0_GRVWA4_GSU1_LPM1_MIWT1_1_PLR3_SU4_SUS256_SVW4_VWA1_VWB1_WG32_2_1
    SolutionIndex: 16
    SolutionNameMin: Cijk_Ailk_Bjlk_BBS_BH_Bias_SPA_AS_MT32x32x64_MI32x32x1_SN_LDSB0_AFC1_AFEM8_DTVSM1_GRVWA4_GSU1_LPMn1_MIWT1_1_PLR3_SU4_SUS256_SVW4_VWA1_VWB1_WG32_2_1
    SolutionIndex: 17
    SolutionNameMin: Cijk_Ailk_Bjlk_BBS_BH_Bias_SPA_AS_MT32x32x64_MI32x32x1_SN_LDSB0_AFC0_AFEM8_DTVSM1_GRVWA8_GSU2_LPMn1_MIWT1_1_PLR3_SU0_SUS0_SVW4_VWA1_VWB1_WG32_2_1
    SolutionIndex: 18
    SolutionNameMin: Cijk_Ailk_Bjlk_BBS_BH_Bias_SPA_AS_MT256x128x32_MI32x32x1_SN_AFC0_AFEM1_GRVWA8_GRVWB8_GSU2_LBSPPA0_LBSPPB0_LPA0_LPB0_MIWT4_2_NLCA1_NLCB1_PLR1_SU4_SUS256_SVW8_VWA2_VWB1_WG64_4_1_WGM18
    SolutionIndex: 19
    SolutionNameMin: Cijk_Ailk_Bjlk_BBS_BH_Bias_SPA_AS_MT256x256x32_MI32x32x1_SN_AFC0_AFEM1_GRVWA8_GRVWB8_GSU2_LBSPPA0_LBSPPB0_LPA0_LPB0_MIWT4_2_NLCA1_NLCB1_PLR1_SU32_SUS256_SVW8_VWA2_VWB2_WG64_8_1_WGM38
    SolutionIndex: 20
    SolutionNameMin: Cijk_Ailk_Bjlk_BBS_BH_Bias_SPA_AS_MT256x96x64_MI32x32x1_SN_LDSB0_AFC0_AFEM8_GRVWA8_GRVWB8_GSU5_LBSPPA0_LBSPPB0_LPA0_LPB0_MIWT2_3_NLCA1_NLCB3_PLR1_VWA1_WG128_2_1_WGM1
    SolutionIndex: 21
    SolutionNameMin: Cijk_Ailk_Bjlk_BBS_BH_Bias_SPA_AS_MT256x192x32_MI32x32x1_SN_LDSB0_AFC0_AFEM8_GRVWA8_GRVWB8_GSU2_LBSPPA0_LBSPPB0_LPA0_LPB0_MIWT4_3_NLCA1_NLCB3_PLR1_SU32_SUS256_VWA1_WG64_4_1_WGM1
    SolutionIndex: 22
    SolutionNameMin: Cijk_Ailk_Bjlk_BBS_BH_Bias_SPA_AS_MT256x256x32_MI32x32x1_SN_AFC1_AFEM8_GRVWA8_GRVWB8_GSU1_LBSPPA0_LBSPPB0_LPA0_LPB0_MIWT4_2_NLCA1_NLCB1_PLR1_SU32_SUS256_SVW8_VWA2_VWB2_WG64_8_1_WGM1
    SolutionIndex: 23
    SolutionNameMin: Cijk_Ailk_Bjlk_BBS_BH_Bias_SPA_AS_MT256x128x32_MI32x32x1_SN_AFC1_AFEM1_GRVWA8_GRVWB8_GSU1_LBSPPA0_LBSPPB0_LPA0_LPB0_MIWT4_2_NLCA1_NLCB1_PLR1_SU0_SUS0_SVW8_VWA2_WG64_4_1_WGM6
    SolutionIndex: 24
    SolutionNameMin: Cijk_Ailk_Bjlk_BBS_BH_Bias_SPA_AS_MT256x256x32_MI32x32x1_SN_AFC1_AFEM8_GRVWA8_GRVWB8_GSU1_LBSPPA0_LBSPPB0_LPA0_LPB0_MIWT4_2_NLCA1_NLCB1_PLR1_SU32_SUS256_SVW8_VWA2_WG64_8_1_WGM6
    SolutionIndex: 25
    SolutionNameMin: Cijk_Ailk_Bjlk_BBS_BH_Bias_SPA_AS_MT256x256x32_MI32x32x1_SN_AFC1_AFEM8_GRVWA8_GRVWB8_GSU1_LBSPPA0_LBSPPB0_LPA0_LPB0_MIWT4_2_NLCA1_NLCB1_PLR1_SU0_SUS0_SVW8_VWA2_VWB2_WG64_8_1_WGM38
    SolutionIndex: 26
    SolutionNameMin: Cijk_Ailk_Bjlk_BBS_BH_Bias_SPA_AS_MT256x256x32_MI32x32x1_SN_AFC1_AFEM8_GRVWA8_GRVWB8_GSU1_LBSPPA0_LBSPPB0_LPA0_LPB0_MIWT4_2_NLCA1_NLCB1_PLR1_SU0_SUS0_SVW8_VWA2_VWB2_WG64_8_1_WGM18
    SolutionIndex: 27
    SolutionNameMin: Cijk_Ailk_Bjlk_BBS_BH_Bias_SPA_AS_MT256x256x32_MI32x32x1_SN_AFC1_AFEM8_GRVWA8_GRVWB8_GSU1_LBSPPA0_LBSPPB0_LPA0_LPB0_MIWT4_2_NLCA1_NLCB1_PLR1_SU0_SUS0_SVW8_VWA2_VWB2_WG64_8_1_WGM1
    SolutionIndex: 28
    SolutionNameMin: Cijk_Ailk_Bjlk_BBS_BH_Bias_SPA_AS_MT256x256x32_MI32x32x1_SN_AFC1_AFEM1_GRVWA8_GRVWB8_GSU1_LBSPPA0_LBSPPB0_LPA0_LPB0_MIWT4_2_NLCA1_NLCB1_PLR1_SU0_SUS0_SVW8_VWA2_VWB2_WG64_8_1_WGM18
    SolutionIndex: 29
    SolutionNameMin: Cijk_Ailk_Bjlk_BBS_BH_Bias_SPA_AS_MT256x256x32_MI32x32x1_SN_AFC1_AFEM1_GRVWA8_GRVWB8_GSU1_LBSPPA0_LBSPPB0_LPA0_LPB0_MIWT4_2_NLCA1_NLCB1_PLR1_SU0_SUS0_SVW8_VWA2_WG64_8_1_WGM18
    SolutionIndex: 30
    SolutionNameMin: Cijk_Ailk_Bjlk_BBS_BH_Bias_SPA_AS_MT256x256x32_MI32x32x1_SN_AFC1_AFEM8_GRVWA8_GRVWB8_GSU1_LBSPPA0_LBSPPB0_LPA0_LPB0_MIWT4_2_NLCA1_NLCB1_PLR1_SU4_SUS128_SVW8_VWA2_VWB2_WG64_8_1_WGM1
    SolutionIndex: 31
    SolutionNameMin: Cijk_Ailk_Bjlk_BBS_BH_Bias_SPA_AS_MT256x256x32_MI32x32x1_SN_AFC1_AFEM8_GRVWA8_GRVWB8_GSU1_LBSPPA0_LBSPPB0_LPA0_LPB0_MIWT4_2_NLCA1_NLCB1_PLR1_SU4_SUS256_SVW8_VWA2_VWB2_WG64_8_1_WGM18
    SolutionIndex: 32
    SolutionNameMin: Cijk_Ailk_Bjlk_BBS_BH_Bias_SPA_AS_MT256x256x32_MI32x32x1_SN_AFC1_AFEM1_GRVWA8_GRVWB8_GSU1_LBSPPA0_LBSPPB0_LPA0_LPB0_MIWT4_2_NLCA1_NLCB1_PLR2_SU0_SUS0_SVW8_VWA2_VWB2_WG64_8_1_WGM18
    SolutionIndex: 33
    SolutionNameMin: Cijk_Ailk_Bjlk_BBS_BH_Bias_SPA_AS_MT256x256x32_MI32x32x1_SN_AFC1_AFEM8_GRVWA8_GRVWB8_GSU1_LBSPPA0_LBSPPB0_LPA0_LPB0_MIWT4_2_NLCA1_NLCB1_PLR1_SU4_SUS128_SVW8_VWA2_VWB2_WG64_8_1_WGM18
    SolutionIndex: 34
    SolutionNameMin: Cijk_Ailk_Bjlk_BBS_BH_Bias_SPA_AS_MT256x256x32_MI32x32x1_SN_AFC1_AFEM8_GRVWA8_GRVWB8_GSU1_LBSPPA0_LBSPPB0_LPA0_LPB0_MIWT4_2_NLCA1_NLCB1_PLR1_SU4_SUS256_SVW8_VWA2_VWB2_WG64_8_1_WGM1
    SolutionIndex: 35
    SolutionNameMin: Cijk_Ailk_Bjlk_BBS_BH_Bias_SPA_AS_MT256x256x32_MI32x32x1_SN_AFC1_AFEM1_GRVWA8_GRVWB8_GSU1_LBSPPA0_LBSPPB0_LPA0_LPB0_MIWT4_2_NLCA1_NLCB1_PLR1_SU4_SUS128_SVW8_VWA2_VWB2_WG64_8_1_WGM18
    SolutionIndex: 36
    SolutionNameMin: Cijk_Ailk_Bjlk_BBS_BH_Bias_SPA_AS_MT256x256x32_MI32x32x1_SN_AFC1_AFEM1_GRVWA8_GRVWB8_GSU1_LBSPPA0_LBSPPB0_LPA0_LPB0_MIWT4_2_NLCA1_NLCB1_PLR1_SU32_SUS128_SVW8_VWA2_VWB2_WG64_8_1_WGM18
- - - [16, 16, 1, 16]
    - [0, 0.0]
  - - [16, 16, 1, 32]
    - [4, 0.0]
  - - [16, 16, 1, 64]
    - [11, 0.0]
  - - [16, 16, 1, 96]
    - [5, 0.0]
  - - [16, 16, 1, 128]
    - [16, 0.0]
  - - [16, 16, 1, 136]
    - [17, 0.0]
  - - [16, 16, 1, 256]
    - [6, 0.001]
  - - [16, 16, 1, 264]
    - [6, 0.001]
  - - [256, 256, 1, 16]
    - [12, 0.008]
  - - [256, 256, 1, 24]
    - [3, 0.012]
  - - [256, 256, 1, 32]
    - [10, 0.017]
  - - [256, 256, 1, 64]
    - [8, 0.034]
  - - [256, 256, 1, 96]
    - [14, 0.044]
  - - [256, 256, 1, 128]
    - [11, 0.063]
  - - [256, 256, 1, 136]
    - [2, 0.061]
  - - [256, 256, 1, 256]
    - [1, 0.115]
  - - [384, 384, 1, 16]
    - [9, 0.015]
  - - [384, 384, 1, 24]
    - [2, 0.022]
  - - [384, 384, 1, 32]
    - [2, 0.036]
  - - [384, 384, 1, 64]
    - [15, 0.06]
  - - [384, 384, 1, 96]
    - [13, 0.091]
  - - [384, 384, 1, 128]
    - [7, 0.064]
  - - [384, 384, 1, 136]
    - [8, 0.117]
  - - [384, 384, 1, 256]
    - [3, 0.226]
  - - [3072, 1024, 1, 16384]
    - [18, 21.095]
  - - [4096, 1024, 1, 16384]
    - [19, 24.029]
  - - [1024, 1024, 1, 16384]
    - [20, 19.051]
  - - [1024, 4096, 1, 16384]
    - [21, 27.236]
  - - [3072, 3072, 1, 1024]
    - [22, 17.518]
  - - [4096, 4096, 1, 1024]
    - [23, 19.182]
  - - [5120, 5120, 1, 1024]
    - [24, 24.854]
  - - [6144, 6144, 1, 1024]
    - [25, 25.829]
  - - [7168, 7168, 1, 1024]
    - [26, 26.0]
  - - [8192, 8192, 1, 1024]
    - [27, 27.413]
  - - [9216, 9216, 1, 1024]
    - [27, 27.368]
  - - [10240, 10240, 1, 1024]
    - [28, 25.719]
  - - [11264, 11264, 1, 1024]
    - [26, 27.527]
  - - [12288, 12288, 1, 1024]
    - [27, 27.705]
  - - [13312, 13312, 1, 1024]
    - [28, 28.53]
  - - [14336, 14336, 1, 1024]
    - [26, 28.737]
  - - [15360, 15360, 1, 1024]
    - [27, 28.898]
  - - [16384, 16384, 1, 1024]
    - [28, 29.515]
  - - [17408, 17408, 1, 1024]
    - [28, 27.979]
  - - [18432, 18432, 1, 1024]
    - [27, 29.068]
  - - [19456, 19456, 1, 1024]
    - [26, 28.685]
  - - [20480, 20480, 1, 1024]
    - [26, 28.645]
  - - [10240, 10240, 1, 2560]
    - [28, 36.61]
  - - [10240, 10240, 1, 3840]
    - [29, 38.772]
  - - [10240, 10240, 1, 5120]
    - [30, 41.186]
  - - [10240, 10240, 1, 6400]
    - [31, 43.407]
  - - [10240, 10240, 1, 7680]
    - [26, 45.383]
  - - [10240, 10240, 1, 8960]
    - [32, 45.63]
  - - [10240, 10240, 1, 10240]
    - [33, 46.499]
  - - [10240, 10240, 1, 11520]
    - [34, 46.325]
  - - [10240, 10240, 1, 12800]
    - [26, 48.103]
  - - [10240, 10240, 1, 14080]
    - [28, 48.422]
  - - [10240, 10240, 1, 15360]
    - [33, 48.164]
  - - [10240, 10240, 1, 16640]
    - [35, 48.449]
  - - [10240, 10240, 1, 17920]
    - [36, 48.022]
  - - [10240, 10240, 1, 19200]
    - [28, 49.623]
  - - [10240, 10240, 1, 20480]
    - [33, 43.265]
- null
- null
- DeviceEfficiency
- null
- Euclidean
