library/src/hcc_detail/rocsparselt/src/spmm/Tensile/Logic/aquavanjaram/gfx941/aquavanjaram_Cijk_Alik_Bjlk_I8I8S_BH_Bias_SPA_AS.yaml
- {MinimumRequiredVersion: 4.33.0}
- aquavanjaram
- gfx941
- [Device 0049, Device 0050]
    SolutionIndex: 0
    SolutionNameMin: Cijk_Alik_Bjlk_I8I8S_BH_Bias_SPA_AS_MT32x32x64_MI32x32x1_SN_LDSB0_AFC1_AFEM1_DTVSM1_GRVWA8_GSU1_LPA8_LPMn1_MIWT1_1_PLR1_SU0_SUS0_TLDS1_VWA1_VWB1_WG32_2_1
    SolutionIndex: 1
    SolutionNameMin: Cijk_Alik_Bjlk_I8I8S_BH_Bias_SPA_AS_MT32x32x64_MI32x32x1_SN_LDSB0_AFC1_AFEM8_DTVSM0_GRVWA8_GSU1_LPA0_LPM2_MIWT1_1_PLR1_SU0_SUS0_TLDS0_VWA1_VWB1_WG32_2_1
    SolutionIndex: 2
    SolutionNameMin: Cijk_Alik_Bjlk_I8I8S_BH_Bias_SPA_AS_MT32x32x64_MI32x32x1_SN_LDSB0_AFC1_AFEM8_DTVSM0_GRVWA16_GSU1_LPA16_LPM4_MIWT1_1_PLR1_SU0_SUS0_TLDS1_VWA1_VWB1_WG32_2_1
    SolutionIndex: 3
    SolutionNameMin: Cijk_Alik_Bjlk_I8I8S_BH_Bias_SPA_AS_MT32x32x64_MI32x32x1_SN_LDSB0_AFC1_AFEM8_DTVSM1_GRVWA8_GSU1_LPA8_LPMn1_MIWT1_1_PLR1_SU0_SUS0_TLDS1_VWA1_VWB1_WG32_2_1
    SolutionIndex: 4
    SolutionNameMin: Cijk_Alik_Bjlk_I8I8S_BH_Bias_SPA_AS_MT32x32x64_MI32x32x1_SN_LDSB0_AFC1_AFEM8_DTVSM1_GRVWA16_GSU1_LPA0_LPMn1_MIWT1_1_PLR1_SU0_SUS0_TLDS0_VWA1_VWB1_WG32_2_1
    SolutionIndex: 5
    SolutionNameMin: Cijk_Alik_Bjlk_I8I8S_BH_Bias_SPA_AS_MT32x32x64_MI32x32x1_SN_LDSB0_AFC1_AFEM8_DTVSM1_GRVWA16_GSU1_LPA16_LPMn1_MIWT1_1_PLR1_SU0_SUS0_TLDS1_VWA1_VWB1_WG32_2_1
    SolutionIndex: 6
    SolutionNameMin: Cijk_Alik_Bjlk_I8I8S_BH_Bias_SPA_AS_MT32x32x64_MI32x32x1_SN_LDSB0_AFC1_AFEM1_DTVSM1_GRVWA16_GSU1_LPA16_LPMn1_MIWT1_1_PLR1_SU4_SUS256_TLDS1_VWA1_VWB1_WG32_2_1
    SolutionIndex: 7
    SolutionNameMin: Cijk_Alik_Bjlk_I8I8S_BH_Bias_SPA_AS_MT32x32x64_MI32x32x1_SN_LDSB0_AFC1_AFEM8_DTVSM0_GRVWA16_GSU1_LPA16_LPM4_MIWT1_1_PLR1_SU4_SUS256_TLDS1_VWA1_VWB1_WG32_2_1
    SolutionIndex: 8
    SolutionNameMin: Cijk_Alik_Bjlk_I8I8S_BH_Bias_SPA_AS_MT32x32x64_MI32x32x1_SN_LDSB0_AFC1_AFEM8_DTVSM1_GRVWA8_GSU1_LPA8_LPMn1_MIWT1_1_PLR1_SU4_SUS256_TLDS1_VWA1_VWB1_WG32_2_1
    SolutionIndex: 9
    SolutionNameMin: Cijk_Alik_Bjlk_I8I8S_BH_Bias_SPA_AS_MT32x32x64_MI32x32x1_SN_LDSB0_AFC0_AFEM1_DTVSM0_GRVWA8_GSU2_LPA8_LPM2_MIWT1_1_PLR1_SU0_SUS0_TLDS1_VWA1_VWB1_WG32_2_1
    SolutionIndex: 10
    SolutionNameMin: Cijk_Alik_Bjlk_I8I8S_BH_Bias_SPA_AS_MT32x32x64_MI32x32x1_SN_LDSB0_AFC0_AFEM8_DTVSM0_GRVWA8_GSU2_LPA0_LPM2_MIWT1_1_PLR1_SU0_SUS0_TLDS0_VWA1_VWB1_WG32_2_1
    SolutionIndex: 11
    SolutionNameMin: Cijk_Alik_Bjlk_I8I8S_BH_Bias_SPA_AS_MT32x32x64_MI32x32x1_SN_LDSB0_AFC0_AFEM8_DTVSM0_GRVWA16_GSU2_LPA16_LPM4_MIWT1_1_PLR1_SU4_SUS256_TLDS1_VWA1_VWB1_WG32_2_1
    SolutionIndex: 12
    SolutionNameMin: Cijk_Alik_Bjlk_I8I8S_BH_Bias_SPA_AS_MT32x32x128_MI32x32x1_SN_LDSB0_AFC1_AFEM1_DTVSM0_GRVWA8_GSU1_LPA0_LPM2_MIWT1_1_PLR3_SU0_SUS0_TLDS0_VWA1_VWB1_WG32_2_1
    SolutionIndex: 13
    SolutionNameMin: Cijk_Alik_Bjlk_I8I8S_BH_Bias_SPA_AS_MT32x32x128_MI32x32x1_SN_LDSB0_AFC1_AFEM1_DTVSM1_GRVWA8_GSU1_LPA8_LPMn1_MIWT1_1_PLR1_SU0_SUS0_TLDS1_VWA1_VWB1_WG32_2_1
    SolutionIndex: 14
    SolutionNameMin: Cijk_Alik_Bjlk_I8I8S_BH_Bias_SPA_AS_MT32x32x128_MI32x32x1_SN_LDSB0_AFC1_AFEM8_DTVSM1_GRVWA16_GSU1_LPA0_LPMn1_MIWT1_1_PLR3_SU0_SUS0_TLDS0_VWA1_VWB1_WG32_2_1
    SolutionIndex: 15
    SolutionNameMin: Cijk_Alik_Bjlk_I8I8S_BH_Bias_SPA_AS_MT32x32x128_MI32x32x1_SN_LDSB0_AFC1_AFEM1_DTVSM0_GRVWA16_GSU1_LPA16_LPM4_MIWT1_1_PLR3_SU4_SUS256_TLDS1_VWA1_VWB1_WG32_2_1
    SolutionIndex: 16
    SolutionNameMin: Cijk_Alik_Bjlk_I8I8S_BH_Bias_SPA_AS_MT32x32x128_MI32x32x1_SN_LDSB0_AFC1_AFEM1_DTVSM1_GRVWA16_GSU1_LPA0_LPMn1_MIWT1_1_PLR1_SU4_SUS256_TLDS0_VWA1_VWB1_WG32_2_1
    SolutionIndex: 17
    SolutionNameMin: Cijk_Alik_Bjlk_I8I8S_BH_Bias_SPA_AS_MT32x32x128_MI32x32x1_SN_LDSB0_AFC1_AFEM1_DTVSM1_GRVWA16_GSU1_LPA16_LPMn1_MIWT1_1_PLR1_SU4_SUS256_TLDS1_VWA1_VWB1_WG32_2_1
    SolutionIndex: 18
    SolutionNameMin: Cijk_Alik_Bjlk_I8I8S_BH_Bias_SPA_AS_MT32x32x128_MI32x32x1_SN_LDSB0_AFC0_AFEM8_DTVSM1_GRVWA8_GSU2_LPA8_LPMn1_MIWT1_1_PLR1_SU0_SUS0_TLDS1_VWA1_VWB1_WG32_2_1
    SolutionIndex: 19
    SolutionNameMin: Cijk_Alik_Bjlk_I8I8S_BH_Bias_SPA_AS_MT32x32x128_MI32x32x1_SN_LDSB0_AFC0_AFEM8_DTVSM1_GRVWA16_GSU2_LPA16_LPMn1_MIWT1_1_PLR1_SU4_SUS256_TLDS1_VWA1_VWB1_WG32_2_1
    SolutionIndex: 20
    SolutionNameMin: Cijk_Alik_Bjlk_I8I8S_BH_Bias_SPA_AS_MT128x128x128_MI32x32x32x1_SN_1LDSB0_AFC1_AF0EM8_GRVWB16_GSU1_LBSPPB0_LPB0_MIWT4_1_NLCB1_PLR3_SUS256_WG32_8_1
    SolutionIndex: 21
    SolutionNameMin: Cijk_Alik_Bjlk_I8I8S_BH_Bias_SPA_AS_MT256x192x64_MI32x32x32x1_SN_1LDSB0_AFC0_AF0EM8_GRVWB16_GSU2_LBSPPB0_LPB0_MIWT4_3_NLCB3_PLR1_SUS256_WG64_4_1
    SolutionIndex: 22
    SolutionNameMin: Cijk_Alik_Bjlk_I8I8S_BH_Bias_SPA_AS_MT256x64x128_MI32x32x32x1_SN_1LDSB0_AFC0_AF0EM8_GRVWB16_GSU3_LBSPPB0_LPB0_MIWT4_1_NLCB1_PLR3_SUS256_WG64_4_1
    SolutionIndex: 23
    SolutionNameMin: Cijk_Alik_Bjlk_I8I8S_BH_Bias_SPA_AS_MT256x192x64_MI32x32x32x1_SN_1LDSB0_AFC0_AF0EM8_GRVWB16_GSU2_LBSPPB0_LPB0_MIWT4_3_NLCB3_PLR1_SUS128_WG64_4_1
    SolutionIndex: 24
    SolutionNameMin: Cijk_Alik_Bjlk_I8I8S_BH_Bias_SPA_AS_MT256x96x64_MI16x16x64x1_SN_1LDSB0_AFC1_AF0EM1_GRVWB8_GSU1_LBSPPB1536_LPB16_MIWT4_6_NLCB3_PLR1_SUS256_WG64_4_1
    SolutionIndex: 25
    SolutionNameMin: Cijk_Alik_Bjlk_I8I8S_BH_Bias_SPA_AS_MT128x112x64_MI16x16x64x1_SN_1LDSB0_AFC1_AF0EM8_GRVWB4_GSU1_LBSPPB1792_LPB16_MIWT2_7_NLCB7_PLR1_SUS128_WG64_4_1
    SolutionIndex: 26
    SolutionNameMin: Cijk_Alik_Bjlk_I8I8S_BH_Bias_SPA_AS_MT256x96x64_MI16x16x64x1_SN_1LDSB1_AFC1_AF0EM8_GRVWB8_GSU1_LBSPPB1536_LPB16_MIWT8_3_NLCB3_PLR1_SUS128_WG32_8_1
    SolutionIndex: 27
    SolutionNameMin: Cijk_Alik_Bjlk_I8I8S_BH_Bias_SPA_AS_MT128x192x64_MI16x16x64x1_SN_1LDSB1_AFC1_AF0EM8_GRVWB16_GSU1_LBSPPB3072_LPB16_MIWT8_3_NLCB3_PLR1_SUS128_WG16_16_1
    SolutionIndex: 28
    SolutionNameMin: Cijk_Alik_Bjlk_I8I8S_BH_Bias_SPA_AS_MT128x192x64_MI16x16x64x1_SN_1LDSB1_AFC1_AF0EM8_GRVWB16_GSU1_LBSPPB3072_LPB16_MIWT8_3_NLCB3_PLR1_SUS256_WG16_16_1
    SolutionIndex: 29
    SolutionNameMin: Cijk_Alik_Bjlk_I8I8S_BH_Bias_SPA_AS_MT256x192x64_MI16x16x64x1_SN_1LDSB0_AFC1_AF0EM8_GRVWB16_GSU1_LBSPPB3072_LPB16_MIWT8_6_NLCB3_PLR1_SUS128_WG32_8_1
    SolutionIndex: 30
    SolutionNameMin: Cijk_Alik_Bjlk_I8I8S_BH_Bias_SPA_AS_MT256x192x64_MI16x16x64x1_SN_1LDSB0_AFC1_AF0EM8_GRVWB16_GSU1_LBSPPB3072_LPB16_MIWT8_6_NLCB3_PLR1_SUS256_WG32_8_1
    SolutionIndex: 31
    SolutionNameMin: Cijk_Alik_Bjlk_I8I8S_BH_Bias_SPA_AS_MT256x256x64_MI32x32x32x1_SN_1LDSB0_AFC1_AF0EM1_GRVWB16_GSU1_LBSPPB0_LPB0_MIWT8_2_NLCB1_PLR1_SUS128_WG32_8_1
    SolutionIndex: 32
    SolutionNameMin: Cijk_Alik_Bjlk_I8I8S_BH_Bias_SPA_AS_MT256x256x64_MI32x32x32x1_SN_1LDSB0_AFC1_AF0EM8_GRVWB16_GSU1_LBSPPB0_LPB0_MIWT8_2_NLCB1_PLR1_SUS128_WG32_8_1
    SolutionIndex: 33
    SolutionNameMin: Cijk_Alik_Bjlk_I8I8S_BH_Bias_SPA_AS_MT256x256x64_MI32x32x32x1_SN_1LDSB0_AFC1_AF0EM1_GRVWB16_GSU1_LBSPPB0_LPB0_MIWT4_4_NLCB1_PLR1_SUS128_WG64_4_1
- - - [16, 16, 1, 16]
    - [1, 0.0]
  - - [16, 16, 1, 32]
    - [2, 0.0]
  - - [16, 16, 1, 64]
    - [4, 0.0]
  - - [16, 16, 1, 96]
    - [2, 0.0]
  - - [16, 16, 1, 128]
    - [8, 0.0]
  - - [16, 16, 1, 136]
    - [2, 0.0]
  - - [16, 16, 1, 256]
    - [18, 0.0]
  - - [16, 16, 1, 264]
    - [9, 0.0]
  - - [256, 256, 1, 16]
    - [1, 0.004]
  - - [256, 256, 1, 24]
    - [0, 0.006]
  - - [256, 256, 1, 32]
    - [5, 0.008]
  - - [256, 256, 1, 64]
    - [7, 0.017]
  - - [256, 256, 1, 96]
    - [6, 0.021]
  - - [256, 256, 1, 128]
    - [17, 0.031]
  - - [256, 256, 1, 136]
    - [3, 0.03]
  - - [256, 256, 1, 256]
    - [19, 0.042]
  - - [384, 384, 1, 16]
    - [14, 0.007]
  - - [384, 384, 1, 24]
    - [11, 0.006]
  - - [384, 384, 1, 32]
    - [16, 0.013]
  - - [384, 384, 1, 64]
    - [13, 0.027]
  - - [384, 384, 1, 96]
    - [12, 0.038]
  - - [384, 384, 1, 128]
    - [7, 0.055]
  - - [384, 384, 1, 136]
    - [15, 0.057]
  - - [384, 384, 1, 256]
    - [10, 0.072]
  - - [3072, 1024, 1, 16384]
    - [20, 14.939]
  - - [4096, 1024, 1, 16384]
    - [21, 14.459]
  - - [1024, 1024, 1, 16384]
    - [22, 8.953]
  - - [1024, 4096, 1, 16384]
    - [23, 14.808]
  - - [3072, 3072, 1, 1024]
    - [24, 5.674]
  - - [4096, 4096, 1, 1024]
    - [25, 6.105]
  - - [5120, 5120, 1, 1024]
    - [26, 9.254]
  - - [6144, 6144, 1, 1024]
    - [27, 11.416]
  - - [7168, 7168, 1, 1024]
    - [27, 11.303]
  - - [8192, 8192, 1, 1024]
    - [27, 11.77]
  - - [9216, 9216, 1, 1024]
    - [27, 11.897]
  - - [10240, 10240, 1, 1024]
    - [27, 12.273]
  - - [11264, 11264, 1, 1024]
    - [27, 12.361]
  - - [12288, 12288, 1, 1024]
    - [27, 12.484]
  - - [13312, 13312, 1, 1024]
    - [28, 12.485]
  - - [14336, 14336, 1, 1024]
    - [28, 12.658]
  - - [15360, 15360, 1, 1024]
    - [27, 12.59]
  - - [16384, 16384, 1, 1024]
    - [27, 13.409]
  - - [17408, 17408, 1, 1024]
    - [27, 12.691]
  - - [18432, 18432, 1, 1024]
    - [29, 12.885]
  - - [19456, 19456, 1, 1024]
    - [29, 12.983]
  - - [20480, 20480, 1, 1024]
    - [30, 12.983]
  - - [10240, 10240, 1, 2560]
    - [27, 18.611]
  - - [10240, 10240, 1, 3840]
    - [27, 20.81]
  - - [10240, 10240, 1, 5120]
    - [30, 20.284]
  - - [10240, 10240, 1, 6400]
    - [29, 22.992]
  - - [10240, 10240, 1, 7680]
    - [31, 23.164]
  - - [10240, 10240, 1, 8960]
    - [31, 24.187]
  - - [10240, 10240, 1, 10240]
    - [31, 24.351]
  - - [10240, 10240, 1, 11520]
    - [31, 25.867]
  - - [10240, 10240, 1, 12800]
    - [32, 26.647]
  - - [10240, 10240, 1, 14080]
    - [31, 27.212]
  - - [10240, 10240, 1, 15360]
    - [31, 26.955]
  - - [10240, 10240, 1, 16640]
    - [31, 27.849]
  - - [10240, 10240, 1, 17920]
    - [32, 28.562]
  - - [10240, 10240, 1, 19200]
    - [32, 28.647]
  - - [10240, 10240, 1, 20480]
    - [33, 26.172]
- null
- null
- DeviceEfficiency
- null
- Euclidean
