library/src/hcc_detail/rocsparselt/src/spmm/Tensile/Logic/aquavanjaram/gfx940/aquavanjaram_Cijk_Alik_Bljk_BBS_BH_Bias_SA_AS.yaml
- {MinimumRequiredVersion: 4.33.0}
- aquavanjaram
- gfx940
- [Device 0049, Device 0050]
    SolutionIndex: 0
    SolutionNameMin: Cijk_Alik_Bljk_BBS_BH_Bias_SA_AS_MT32x32x32_MI32x32x1_SN_LDSB0_AFC1_AFEM1_DTVSM0_GRVWA4_GSU1_LPA4_LPB8_LPM1_MIWT1_1_PLR1_SU0_SUS0_SVW4_TLDS1_VWA1_VWB1_WG32_2_1
    SolutionIndex: 1
    SolutionNameMin: Cijk_Alik_Bljk_BBS_BH_Bias_SA_AS_MT32x32x32_MI32x32x1_SN_LDSB0_AFC1_AFEM1_DTVSM1_GRVWA4_GSU1_LPA4_LPB8_LPMn1_MIWT1_1_PLR1_SU0_SUS0_SVW4_TLDS1_VWA1_VWB1_WG32_2_1
    SolutionIndex: 2
    SolutionNameMin: Cijk_Alik_Bljk_BBS_BH_Bias_SA_AS_MT32x32x32_MI32x32x1_SN_LDSB0_AFC1_AFEM8_DTVSM1_GRVWA4_GSU1_LPA4_LPB8_LPMn1_MIWT1_1_PLR1_SU0_SUS0_SVW4_TLDS1_VWA1_VWB1_WG32_2_1
    SolutionIndex: 3
    SolutionNameMin: Cijk_Alik_Bljk_BBS_BH_Bias_SA_AS_MT32x32x32_MI32x32x1_SN_LDSB0_AFC1_AFEM1_DTVSM1_GRVWA4_GSU1_LPA4_LPB8_LPMn1_MIWT1_1_PLR1_SU4_SUS256_SVW4_TLDS1_VWA1_VWB1_WG32_2_1
    SolutionIndex: 4
    SolutionNameMin: Cijk_Alik_Bljk_BBS_BH_Bias_SA_AS_MT32x32x32_MI32x32x1_SN_LDSB0_AFC1_AFEM8_DTVSM0_GRVWA8_GSU1_LPA8_LPB8_LPM2_MIWT1_1_PLR1_SU4_SUS256_SVW4_TLDS1_VWA1_VWB1_WG32_2_1
    SolutionIndex: 5
    SolutionNameMin: Cijk_Alik_Bljk_BBS_BH_Bias_SA_AS_MT32x32x32_MI32x32x1_SN_LDSB0_AFC1_AFEM8_DTVSM1_GRVWA4_GSU1_LPA4_LPB8_LPMn1_MIWT1_1_PLR1_SU4_SUS256_SVW4_TLDS1_VWA1_VWB1_WG32_2_1
    SolutionIndex: 6
    SolutionNameMin: Cijk_Alik_Bljk_BBS_BH_Bias_SA_AS_MT32x32x32_MI32x32x1_SN_LDSB0_AFC0_AFEM8_DTVSM0_GRVWA4_GSU2_LPA0_LPB0_LPM1_MIWT1_1_PLR1_SU0_SUS0_SVW4_TLDS0_VWA1_VWB1_WG32_2_1
    SolutionIndex: 7
    SolutionNameMin: Cijk_Alik_Bljk_BBS_BH_Bias_SA_AS_MT32x32x32_MI32x32x1_SN_LDSB0_AFC0_AFEM8_DTVSM0_GRVWA8_GSU2_LPA8_LPB8_LPM2_MIWT1_1_PLR1_SU0_SUS0_SVW4_TLDS1_VWA1_VWB1_WG32_2_1
    SolutionIndex: 8
    SolutionNameMin: Cijk_Alik_Bljk_BBS_BH_Bias_SA_AS_MT128x128x32_MI32x32x1_SN_LDSB0_AFC1_AFEM8_DTVSM0_GRVWA4_GSU1_LPA4_LPB8_LPM1_MIWT2_2_PLR1_SU0_SUS0_SVW8_TLDS1_VWA2_VWB1_WG64_4_1
    SolutionIndex: 9
    SolutionNameMin: Cijk_Alik_Bljk_BBS_BH_Bias_SA_AS_MT256x256x32_MI32x32x1_SN_LDSB0_AFC1_AFEM8_DTVSM0_GRVWA4_GSU1_LPA4_LPB8_LPM1_MIWT2_4_PLR1_SU4_SUS256_SVW8_TLDS1_VWA2_VWB4_WG128_4_1
    SolutionIndex: 10
    SolutionNameMin: Cijk_Alik_Bljk_BBS_BH_Bias_SA_AS_MT256x256x32_MI32x32x1_SN_LDSB0_AFC1_AFEM1_DTVSM0_GRVWA4_GSU1_LPA4_LPB8_LPM1_MIWT4_2_PLR1_SU4_SUS256_SVW8_TLDS1_VWA2_VWB1_WG64_8_1
    SolutionIndex: 11
    SolutionNameMin: Cijk_Alik_Bljk_BBS_BH_Bias_SA_AS_MT32x32x64_MI32x32x1_SN_LDSB0_AFC1_AFEM1_DTVSM1_GRVWA8_GSU1_LPA8_LPB8_LPMn1_MIWT1_1_PLR1_SU0_SUS0_SVW4_TLDS1_VWA1_VWB1_WG32_2_1
    SolutionIndex: 12
    SolutionNameMin: Cijk_Alik_Bljk_BBS_BH_Bias_SA_AS_MT32x32x64_MI32x32x1_SN_LDSB0_AFC1_AFEM8_DTVSM0_GRVWA4_GSU1_LPA4_LPB8_LPM1_MIWT1_1_PLR1_SU0_SUS0_SVW4_TLDS1_VWA1_VWB1_WG32_2_1
    SolutionIndex: 13
    SolutionNameMin: Cijk_Alik_Bljk_BBS_BH_Bias_SA_AS_MT32x32x64_MI32x32x1_SN_LDSB0_AFC1_AFEM8_DTVSM0_GRVWA8_GSU1_LPA8_LPB8_LPM2_MIWT1_1_PLR1_SU0_SUS0_SVW4_TLDS1_VWA1_VWB1_WG32_2_1
    SolutionIndex: 14
    SolutionNameMin: Cijk_Alik_Bljk_BBS_BH_Bias_SA_AS_MT32x32x64_MI32x32x1_SN_LDSB0_AFC1_AFEM8_DTVSM1_GRVWA4_GSU1_LPA4_LPB8_LPMn1_MIWT1_1_PLR3_SU0_SUS0_SVW4_TLDS1_VWA1_VWB1_WG32_2_1
    SolutionIndex: 15
    SolutionNameMin: Cijk_Alik_Bljk_BBS_BH_Bias_SA_AS_MT32x32x64_MI32x32x1_SN_LDSB0_AFC1_AFEM8_DTVSM1_GRVWA8_GSU1_LPA8_LPB8_LPMn1_MIWT1_1_PLR3_SU0_SUS0_SVW4_TLDS1_VWA1_VWB1_WG32_2_1
    SolutionIndex: 16
    SolutionNameMin: Cijk_Alik_Bljk_BBS_BH_Bias_SA_AS_MT32x32x64_MI32x32x1_SN_LDSB0_AFC1_AFEM1_DTVSM1_GRVWA4_GSU1_LPA4_LPB8_LPMn1_MIWT1_1_PLR1_SU4_SUS256_SVW4_TLDS1_VWA1_VWB1_WG32_2_1
    SolutionIndex: 17
    SolutionNameMin: Cijk_Alik_Bljk_BBS_BH_Bias_SA_AS_MT32x32x64_MI32x32x1_SN_LDSB0_AFC0_AFEM8_DTVSM1_GRVWA8_GSU2_LPA8_LPB8_LPMn1_MIWT1_1_PLR3_SU0_SUS0_SVW4_TLDS1_VWA1_VWB1_WG32_2_1
- - - [16, 16, 1, 16, 16, 16, 16, 16]
    - [5, 0.393846]
  - - [16, 16, 1, 32, 16, 16, 32, 32]
    - [5, 0.8192]
  - - [16, 16, 1, 64, 16, 16, 64, 64]
    - [5, 1.58453]
  - - [16, 16, 1, 96, 16, 16, 96, 96]
    - [5, 2.25468]
  - - [16, 16, 1, 128, 16, 16, 128, 128]
    - [2, 3.00624]
  - - [16, 16, 1, 136, 16, 16, 136, 136]
    - [12, 3.09751]
  - - [16, 16, 1, 256, 16, 16, 256, 256]
    - [7, 5.78914]
  - - [16, 16, 1, 264, 16, 16, 264, 264]
    - [17, 5.76655]
  - - [256, 256, 1, 16, 256, 256, 16, 16]
    - [8, 53.0119]
  - - [256, 256, 1, 24, 256, 256, 24, 24]
    - [10, 44.9897]
  - - [256, 256, 1, 32, 256, 256, 32, 32]
    - [9, 73.636]
  - - [256, 256, 1, 64, 256, 256, 64, 64]
    - [6, 178.026]
  - - [256, 256, 1, 96, 256, 256, 96, 96]
    - [3, 462.607]
  - - [256, 256, 1, 128, 256, 256, 128, 128]
    - [1, 590.747]
  - - [256, 256, 1, 136, 256, 256, 136, 136]
    - [15, 656.325]
  - - [256, 256, 1, 256, 256, 256, 256, 256]
    - [13, 1129.02]
  - - [384, 384, 1, 16, 384, 384, 16, 16]
    - [0, 158.982]
  - - [384, 384, 1, 24, 384, 384, 24, 24]
    - [11, 199.265]
  - - [384, 384, 1, 32, 384, 384, 32, 32]
    - [4, 304.819]
  - - [384, 384, 1, 64, 384, 384, 64, 64]
    - [15, 613.601]
  - - [384, 384, 1, 96, 384, 384, 96, 96]
    - [5, 902.792]
  - - [384, 384, 1, 128, 384, 384, 128, 128]
    - [16, 1217.7]
  - - [384, 384, 1, 136, 384, 384, 136, 136]
    - [14, 1315.88]
  - - [384, 384, 1, 256, 384, 384, 256, 256]
    - [4, 2106.51]
- null
- null
- DeviceEfficiency
