library/src/hcc_detail/rocsparselt/src/spmm/Tensile/Logic/aquavanjaram/gfx940/aquavanjaram_Cijk_Alik_Bjlk_BBS_BH_SPB_AS.yaml
- {MinimumRequiredVersion: 4.33.0}
- aquavanjaram
- gfx940
- [Device 0049, Device 0050]
    SolutionIndex: 0
    SolutionNameMin: Cijk_Alik_Bjlk_BBS_BH_SPB_AS_MT32x32x32_MI32x32x1_SN_LDSB0_AFC1_AFEM1_GRVWA4_GSU1_LPA0_LPM0_MIWT1_1_PLR1_SU0_SUS0_SVW1_TLDS0_VWA1_VWB1_WG32_2_1
    SolutionIndex: 1
    SolutionNameMin: Cijk_Alik_Bjlk_BBS_BH_SPB_AS_MT32x32x32_MI32x32x1_SN_LDSB0_AFC1_AFEM1_GRVWA8_GSU1_LPA8_LPM0_MIWT1_1_PLR1_SU0_SUS0_SVW1_TLDS1_VWA1_VWB1_WG32_2_1
    SolutionIndex: 2
    SolutionNameMin: Cijk_Alik_Bjlk_BBS_BH_SPB_AS_MT32x32x32_MI32x32x1_SN_LDSB0_AFC1_AFEM8_GRVWA8_GSU1_LPA8_LPM0_MIWT1_1_PLR1_SU4_SUS256_SVW1_TLDS1_VWA1_VWB1_WG32_2_1
    SolutionIndex: 3
    SolutionNameMin: Cijk_Alik_Bjlk_BBS_BH_SPB_AS_MT32x32x64_MI32x32x1_SN_LDSB0_AFC1_AFEM1_GRVWA4_GSU1_LPA8_LPM0_MIWT1_1_PLR1_SU0_SUS0_SVW1_TLDS1_VWA1_VWB1_WG32_2_1
    SolutionIndex: 4
    SolutionNameMin: Cijk_Alik_Bjlk_BBS_BH_SPB_AS_MT32x32x64_MI32x32x1_SN_LDSB0_AFC1_AFEM1_GRVWA4_GSU1_LPA8_LPM0_MIWT1_1_PLR3_SU0_SUS0_SVW1_TLDS1_VWA1_VWB1_WG32_2_1
    SolutionIndex: 5
    SolutionNameMin: Cijk_Alik_Bjlk_BBS_BH_SPB_AS_MT32x32x64_MI32x32x1_SN_LDSB0_AFC1_AFEM1_GRVWA8_GSU1_LPA8_LPM0_MIWT1_1_PLR3_SU0_SUS0_SVW1_TLDS1_VWA1_VWB1_WG32_2_1
    SolutionIndex: 6
    SolutionNameMin: Cijk_Alik_Bjlk_BBS_BH_SPB_AS_MT32x32x64_MI32x32x1_SN_LDSB0_AFC1_AFEM8_GRVWA4_GSU1_LPA0_LPM0_MIWT1_1_PLR1_SU0_SUS0_SVW1_TLDS0_VWA1_VWB1_WG32_2_1
    SolutionIndex: 7
    SolutionNameMin: Cijk_Alik_Bjlk_BBS_BH_SPB_AS_MT32x32x64_MI32x32x1_SN_LDSB0_AFC1_AFEM8_GRVWA4_GSU1_LPA8_LPM0_MIWT1_1_PLR1_SU0_SUS0_SVW1_TLDS1_VWA1_VWB1_WG32_2_1
    SolutionIndex: 8
    SolutionNameMin: Cijk_Alik_Bjlk_BBS_BH_SPB_AS_MT32x32x64_MI32x32x1_SN_LDSB0_AFC1_AFEM8_GRVWA8_GSU1_LPA8_LPM0_MIWT1_1_PLR3_SU0_SUS0_SVW1_TLDS1_VWA1_VWB1_WG32_2_1
    SolutionIndex: 9
    SolutionNameMin: Cijk_Alik_Bjlk_BBS_BH_SPB_AS_MT32x32x64_MI32x32x1_SN_LDSB0_AFC1_AFEM8_GRVWA8_GSU1_LPA8_LPM0_MIWT1_1_PLR1_SU4_SUS256_SVW1_TLDS1_VWA1_VWB1_WG32_2_1
    SolutionIndex: 10
    SolutionNameMin: Cijk_Alik_Bjlk_BBS_BH_SPB_AS_MT32x32x64_MI32x32x1_SN_LDSB0_AFC1_AFEM8_GRVWA8_GSU1_LPA8_LPM0_MIWT1_1_PLR3_SU4_SUS256_SVW1_TLDS1_VWA1_VWB1_WG32_2_1
- - - [15, 15, 1, 16, 15, 15, 16, 15]
    - [0, 0.280811]
  - - [15, 15, 1, 32, 15, 15, 32, 15]
    - [1, 0.615385]
  - - [15, 15, 1, 64, 15, 15, 64, 15]
    - [1, 1.22444]
  - - [15, 15, 1, 96, 15, 15, 96, 15]
    - [1, 1.78808]
  - - [15, 15, 1, 128, 15, 15, 128, 15]
    - [1, 2.3076]
  - - [15, 15, 1, 136, 15, 15, 136, 15]
    - [1, 2.35385]
  - - [15, 15, 1, 256, 15, 15, 256, 15]
    - [1, 4.37673]
  - - [15, 15, 1, 264, 15, 15, 264, 15]
    - [1, 4.11357]
  - - [16, 16, 1, 16, 16, 16, 16, 16]
    - [1, 0.358042]
  - - [16, 16, 1, 32, 16, 16, 32, 16]
    - [1, 0.771338]
  - - [16, 16, 1, 64, 16, 16, 64, 16]
    - [1, 1.4787]
  - - [16, 16, 1, 96, 16, 16, 96, 16]
    - [1, 2.1672]
  - - [16, 16, 1, 128, 16, 16, 128, 16]
    - [7, 2.82483]
  - - [16, 16, 1, 136, 16, 16, 136, 16]
    - [1, 2.72426]
  - - [16, 16, 1, 256, 16, 16, 256, 16]
    - [1, 5.16845]
  - - [16, 16, 1, 264, 16, 16, 264, 16]
    - [7, 4.80666]
  - - [256, 256, 1, 16, 256, 256, 16, 256]
    - [2, 78.959]
  - - [256, 256, 1, 24, 256, 256, 24, 256]
    - [8, 112.027]
  - - [256, 256, 1, 32, 256, 256, 32, 256]
    - [8, 160.088]
  - - [256, 256, 1, 64, 256, 256, 64, 256]
    - [4, 304.819]
  - - [256, 256, 1, 96, 256, 256, 96, 256]
    - [5, 413.912]
  - - [256, 256, 1, 128, 256, 256, 128, 256]
    - [8, 582.542]
  - - [256, 256, 1, 136, 256, 256, 136, 256]
    - [1, 590.258]
  - - [256, 256, 1, 256, 256, 256, 256, 256]
    - [2, 1071.34]
  - - [384, 384, 1, 16, 384, 384, 16, 384]
    - [6, 151.232]
  - - [384, 384, 1, 24, 384, 384, 24, 384]
    - [3, 226.855]
  - - [384, 384, 1, 32, 384, 384, 32, 384]
    - [8, 285.975]
  - - [384, 384, 1, 64, 384, 384, 64, 384]
    - [10, 633.368]
  - - [384, 384, 1, 96, 384, 384, 96, 384]
    - [1, 855.851]
  - - [384, 384, 1, 128, 384, 384, 128, 384]
    - [7, 1282.18]
  - - [384, 384, 1, 136, 384, 384, 136, 384]
    - [1, 1199.4]
  - - [384, 384, 1, 256, 384, 384, 256, 384]
    - [9, 2199.81]
- null
- null
- DeviceEfficiency
- null
- Euclidean
