library/src/hcc_detail/rocsparselt/src/spmm/Tensile/Logic/aquavanjaram/gfx940/aquavanjaram_Cijk_Ailk_Bljk_BBS_BH_SA_AH.yaml
- {MinimumRequiredVersion: 4.33.0}
- aquavanjaram
- gfx940
- [Device 0049, Device 0050]
    SolutionIndex: 0
    SolutionNameMin: Cijk_Ailk_Bljk_BBS_BH_SA_AH_MT32x32x16_MI32x32x16x1_SN_1LDSB0_GRVW4_LPB8_MIWT1_1_PGR2_PLR1_SU4_TLDS1_VW4_WG32_2_1_WGM8
    SolutionIndex: 1
    SolutionNameMin: Cijk_Ailk_Bljk_BBS_BH_SA_AH_MT32x32x16_MI32x32x16x1_SN_1LDSB0_GRVW8_LPB8_MIWT1_1_PGR1_PLR1_SU4_TLDS1_VW4_WG32_2_1_WGM12
    SolutionIndex: 2
    SolutionNameMin: Cijk_Ailk_Bljk_BBS_BH_SA_AH_MT32x32x16_MI32x32x16x1_SN_1LDSB0_GRVW8_LPB4_MIWT1_1_PGR2_PLR1_SU4_TLDS0_VW4_WG32_2_1_WGM18
    SolutionIndex: 3
    SolutionNameMin: Cijk_Ailk_Bljk_BBS_BH_SA_AH_MT32x32x32_MI32x32x16x1_SN_1LDSB0_GRVW8_LPB8_MIWT1_1_PGR2_PLR1_SU4_TLDS1_VW8_WG32_2_1_WGM8
    SolutionIndex: 4
    SolutionNameMin: Cijk_Ailk_Bljk_BBS_BH_SA_AH_MT32x32x32_MI32x32x16x1_SN_1LDSB0_GRVW8_LPB8_MIWT1_1_PGR2_PLR3_SU4_TLDS1_VW8_WG32_2_1_WGM8
    SolutionIndex: 5
    SolutionNameMin: Cijk_Ailk_Bljk_BBS_BH_SA_AH_MT32x32x32_MI32x32x16x1_SN_1LDSB0_GRVW8_LPB8_MIWT1_1_PGR2_PLR1_SU8_TLDS1_VW8_WG32_2_1_WGM8
    SolutionIndex: 6
    SolutionNameMin: Cijk_Ailk_Bljk_BBS_BH_SA_AH_MT32x32x32_MI32x32x16x1_SN_1LDSB0_GRVW8_LPB8_MIWT1_1_PGR2_PLR3_SU4_TLDS1_VW8_WG32_2_1_WGM12
    SolutionIndex: 7
    SolutionNameMin: Cijk_Ailk_Bljk_BBS_BH_SA_AH_MT32x32x32_MI32x32x16x1_SN_1LDSB0_GRVW8_LPB8_MIWT1_1_PGR1_PLR3_SU8_TLDS1_VW8_WG32_2_1_WGM12
    SolutionIndex: 8
    SolutionNameMin: Cijk_Ailk_Bljk_BBS_BH_SA_AH_MT32x32x32_MI32x32x16x1_SN_1LDSB0_GRVW8_LPB8_MIWT1_1_PGR2_PLR3_SU8_TLDS1_VW4_WG32_2_1_WGM12
    SolutionIndex: 9
    SolutionNameMin: Cijk_Ailk_Bljk_BBS_BH_SA_AH_MT32x32x32_MI32x32x16x1_SN_1LDSB0_GRVW8_LPB8_MIWT1_1_PGR1_PLR3_SU4_TLDS1_VW8_WG32_2_1_WGM18
    SolutionIndex: 10
    SolutionNameMin: Cijk_Ailk_Bljk_BBS_BH_SA_AH_MT32x32x32_MI32x32x16x1_SN_1LDSB0_GRVW8_LPB8_MIWT1_1_PGR2_PLR3_SU4_TLDS1_VW4_WG32_2_1_WGM18
    SolutionIndex: 11
    SolutionNameMin: Cijk_Ailk_Bljk_BBS_BH_SA_AH_MT32x32x32_MI32x32x16x1_SN_1LDSB0_GRVW8_LPB8_MIWT1_1_PGR2_PLR1_SU8_TLDS1_VW4_WG32_2_1_WGM18
    SolutionIndex: 12
    SolutionNameMin: Cijk_Ailk_Bljk_BBS_BH_SA_AH_MT32x32x32_MI32x32x16x1_SN_1LDSB0_GRVW8_LPB8_MIWT1_1_PGR2_PLR3_SU8_TLDS1_VW4_WG32_2_1_WGM18
    SolutionIndex: 13
    SolutionNameMin: Cijk_Ailk_Bljk_BBS_BH_SA_AH_MT32x32x32_MI32x32x16x1_SN_1LDSB0_GRVW8_LPB8_MIWT1_1_PGR2_PLR3_SU8_TLDS1_VW8_WG32_2_1_WGM18
    SolutionIndex: 14
    SolutionNameMin: Cijk_Ailk_Bljk_BBS_BH_SA_AH_MT32x32x32_MI32x32x16x1_SN_1LDSB0_GRVW8_LPB8_MIWT1_1_PGR1_PLR1_SU8_TLDS1_VW8_WG32_2_1_WGM19
    SolutionIndex: 15
    SolutionNameMin: Cijk_Ailk_Bljk_BBS_BH_SA_AH_MT32x32x64_MI32x32x16x1_SN_1LDSB0_GRVW8_LPB8_MIWT1_1_PGR2_PLR5_SU4_TLDS1_VW8_WG32_2_1_WGM8
    SolutionIndex: 16
    SolutionNameMin: Cijk_Ailk_Bljk_BBS_BH_SA_AH_MT32x32x64_MI32x32x16x1_SN_1LDSB0_GRVW8_LPB8_MIWT1_1_PGR2_PLR1_SU4_TLDS1_VW4_WG32_2_1_WGM12
    SolutionIndex: 17
    SolutionNameMin: Cijk_Ailk_Bljk_BBS_BH_SA_AH_MT32x32x64_MI32x32x16x1_SN_1LDSB0_GRVW8_LPB8_MIWT1_1_PGR2_PLR1_SU8_TLDS1_VW4_WG32_2_1_WGM12
    SolutionIndex: 18
    SolutionNameMin: Cijk_Ailk_Bljk_BBS_BH_SA_AH_MT32x32x64_MI32x32x16x1_SN_1LDSB0_GRVW8_LPB8_MIWT1_1_PGR2_PLR1_SU8_TLDS1_VW8_WG32_2_1_WGM12
    SolutionIndex: 19
    SolutionNameMin: Cijk_Ailk_Bljk_BBS_BH_SA_AH_MT32x32x64_MI32x32x16x1_SN_1LDSB0_GRVW8_LPB8_MIWT1_1_PGR2_PLR5_SU8_TLDS1_VW4_WG32_2_1_WGM12
    SolutionIndex: 20
    SolutionNameMin: Cijk_Ailk_Bljk_BBS_BH_SA_AH_MT32x32x64_MI32x32x16x1_SN_1LDSB0_GRVW8_LPB8_MIWT1_1_PGR1_PLR5_SU4_TLDS1_VW4_WG32_2_1_WGM18
    SolutionIndex: 21
    SolutionNameMin: Cijk_Ailk_Bljk_BBS_BH_SA_AH_MT32x32x64_MI32x32x16x1_SN_1LDSB0_GRVW8_LPB8_MIWT1_1_PGR2_PLR5_SU4_TLDS1_VW8_WG32_2_1_WGM18
    SolutionIndex: 22
    SolutionNameMin: Cijk_Ailk_Bljk_BBS_BH_SA_AH_MT32x32x64_MI32x32x16x1_SN_1LDSB0_GRVW8_LPB8_MIWT1_1_PGR2_PLR1_SU4_TLDS1_VW4_WG32_2_1_WGM19
    SolutionIndex: 23
    SolutionNameMin: Cijk_Ailk_Bljk_BBS_BH_SA_AH_MT32x32x64_MI32x32x16x1_SN_1LDSB0_GRVW8_LPB8_MIWT1_1_PGR1_PLR5_SU4_TLDS1_VW8_WG32_2_1_WGM19
    SolutionIndex: 24
    SolutionNameMin: Cijk_Ailk_Bljk_BBS_BH_SA_AH_MT32x32x64_MI32x32x16x1_SN_1LDSB0_GRVW8_LPB8_MIWT1_1_PGR2_PLR5_SU8_TLDS1_VW4_WG32_2_1_WGM19
    SolutionIndex: 25
    SolutionNameMin: Cijk_Ailk_Bljk_BBS_BH_SA_AH_MT32x32x16_MI32x32x16x1_SN_1LDSB0_AFC0_GRVW8_GSU2_LPB8_MIWT1_1_PGR2_PLR1_SU4_SRVW0_TLDS1_VW8_WG32_2_1_WGM12
    SolutionIndex: 26
    SolutionNameMin: Cijk_Ailk_Bljk_BBS_BH_SA_AH_MT32x32x32_MI32x32x16x1_SN_1LDSB0_AFC0_GRVW8_GSU2_LPB8_MIWT1_1_PGR2_PLR3_SU4_SRVW0_TLDS1_VW8_WG32_2_1_WGM19
    SolutionIndex: 27
    SolutionNameMin: Cijk_Ailk_Bljk_BBS_BH_SA_AH_MT32x32x32_MI32x32x16x1_SN_1LDSB0_AFC0_GRVW8_GSU2_LPB8_MIWT1_1_PGR2_PLR3_SU8_SRVW0_TLDS1_VW8_WG32_2_1_WGM18
    SolutionIndex: 28
    SolutionNameMin: Cijk_Ailk_Bljk_BBS_BH_SA_AH_MT32x32x64_MI32x32x16x1_SN_1LDSB0_AFC0_GRVW8_GSU2_LPB8_MIWT1_1_PGR1_PLR1_SU8_SRVW0_TLDS1_VW4_WG32_2_1_WGM19
    SolutionIndex: 29
    SolutionNameMin: Cijk_Ailk_Bljk_BBS_BH_SA_AH_MT32x32x64_MI32x32x16x1_SN_1LDSB0_AFC0_GRVW8_GSU2_LPB8_MIWT1_1_PGR1_PLR5_SU4_SRVW0_TLDS1_VW4_WG32_2_1_WGM12
    SolutionIndex: 30
    SolutionNameMin: Cijk_Ailk_Bljk_BBS_BH_SA_AH_MT32x32x16_MI32x32x16x1_SN_1LDSB0_AFC1_GRVW8_GSU1_LPB8_MIWT1_1_PGR2_PLR1_SU8_SRVW0_TLDS0_VW8_WG32_2_1_WGM12
    SolutionIndex: 31
    SolutionNameMin: Cijk_Ailk_Bljk_BBS_BH_SA_AH_MT32x32x32_MI32x32x16x1_SN_1LDSB0_AFC1_GRVW4_GSU1_LPB8_MIWT1_1_PGR1_PLR3_SU8_SRVW0_TLDS1_VW4_WG32_2_1_WGM19
    SolutionIndex: 32
    SolutionNameMin: Cijk_Ailk_Bljk_BBS_BH_SA_AH_MT32x32x32_MI32x32x16x1_SN_1LDSB0_AFC1_GRVW8_GSU1_LPB8_MIWT1_1_PGR2_PLR1_SU8_SRVW8_TLDS1_VW8_WG32_2_1_WGM12
    SolutionIndex: 33
    SolutionNameMin: Cijk_Ailk_Bljk_BBS_BH_SA_AH_MT32x32x64_MI32x32x16x1_SN_1LDSB0_AFC1_GRVW8_GSU1_LPB8_MIWT1_1_PGR1_PLR5_SU4_SRVW0_TLDS1_VW4_WG32_2_1_WGM19
    SolutionIndex: 34
    SolutionNameMin: Cijk_Ailk_Bljk_BBS_BH_SA_AH_MT32x32x32_MI32x32x16x1_SN_1LDSB0_AFC1_GRVW8_GSU1_LPB8_MIWT1_1_PGR2_PLR3_SU8_SRVW8_TLDS1_VW4_WG32_2_1_WGM12
    SolutionIndex: 35
    SolutionNameMin: Cijk_Ailk_Bljk_BBS_BH_SA_AH_MT32x32x64_MI32x32x16x1_SN_1LDSB0_AFC1_GRVW8_GSU1_LPB8_MIWT1_1_PGR1_PLR1_SU4_SRVW0_TLDS1_VW4_WG32_2_1_WGM19
    SolutionIndex: 36
    SolutionNameMin: Cijk_Ailk_Bljk_BBS_BH_SA_AH_MT32x32x32_MI32x32x16x1_SN_1LDSB0_AFC1_GRVW8_GSU1_LPB8_MIWT1_1_PGR1_PLR1_SU4_SRVW8_TLDS1_VW8_WG32_2_1_WGM18
    SolutionIndex: 37
    SolutionNameMin: Cijk_Ailk_Bljk_BBS_BH_SA_AH_MT32x32x32_MI32x32x16x1_SN_1LDSB0_AFC1_GRVW8_GSU1_LPB8_MIWT1_1_PGR2_PLR3_SU8_SRVW0_TLDS1_VW8_WG32_2_1_WGM18
    SolutionIndex: 38
    SolutionNameMin: Cijk_Ailk_Bljk_BBS_BH_SA_AH_MT32x32x64_MI32x32x16x1_SN_1LDSB0_AFC1_GRVW8_GSU1_LPB8_MIWT1_1_PGR1_PLR1_SU4_SRVW8_TLDS1_VW4_WG32_2_1_WGM12
    SolutionIndex: 39
    SolutionNameMin: Cijk_Ailk_Bljk_BBS_BH_SA_AH_MT32x32x32_MI32x32x16x1_SN_1LDSB0_AFC1_GRVW4_GSU1_LPB8_MIWT1_1_PGR1_PLR3_SU4_SRVW0_TLDS1_VW4_WG32_2_1_WGM19
    SolutionIndex: 40
    SolutionNameMin: Cijk_Ailk_Bljk_BBS_BH_SA_AH_MT32x32x64_MI32x32x16x1_SN_1LDSB0_AFC1_GRVW8_GSU1_LPB8_MIWT1_1_PGR1_PLR1_SU4_SRVW8_TLDS1_VW8_WG32_2_1_WGM19
    SolutionIndex: 41
    SolutionNameMin: Cijk_Ailk_Bljk_BBS_BH_SA_AH_MT32x32x32_MI32x32x16x1_SN_1LDSB0_AFC1_GRVW8_GSU1_LPB8_MIWT1_1_PGR2_PLR1_SU8_SRVW0_TLDS1_VW4_WG32_2_1_WGM18
    SolutionIndex: 42
    SolutionNameMin: Cijk_Ailk_Bljk_BBS_BH_SA_AH_MT32x32x64_MI32x32x16x1_SN_1LDSB0_AFC1_GRVW8_GSU1_LPB8_MIWT1_1_PGR1_PLR1_SU8_SRVW0_TLDS1_VW8_WG32_2_1_WGM18
    SolutionIndex: 43
    SolutionNameMin: Cijk_Ailk_Bljk_BBS_BH_SA_AH_MT32x32x16_MI32x32x16x1_SN_1LDSB0_AFC1_GRVW8_GSU1_LPB8_MIWT1_1_PGR2_PLR1_SU8_SRVW0_TLDS1_VW4_WG32_2_1_WGM19
    SolutionIndex: 44
    SolutionNameMin: Cijk_Ailk_Bljk_BBS_BH_SA_AH_MT32x32x32_MI32x32x16x1_SN_1LDSB0_AFC1_GRVW8_GSU1_LPB8_MIWT1_1_PGR1_PLR3_SU8_SRVW0_TLDS1_VW8_WG32_2_1_WGM8
    SolutionIndex: 45
    SolutionNameMin: Cijk_Ailk_Bljk_BBS_BH_SA_AH_MT32x32x32_MI32x32x16x1_SN_1LDSB0_AFC1_GRVW8_GSU1_LPB8_MIWT1_1_PGR2_PLR1_SU8_SRVW0_TLDS1_VW8_WG32_2_1_WGM18
    SolutionIndex: 46
    SolutionNameMin: Cijk_Ailk_Bljk_BBS_BH_SA_AH_MT32x32x16_MI32x32x16x1_SN_1LDSB0_AFC1_GRVW8_GSU1_LPB8_MIWT1_1_PGR2_PLR1_SU4_SRVW0_TLDS1_VW8_WG32_2_1_WGM8
    SolutionIndex: 47
    SolutionNameMin: Cijk_Ailk_Bljk_BBS_BH_SA_AH_MT32x32x16_MI32x32x16x1_SN_1LDSB0_AFC1_GRVW8_GSU1_LPB8_MIWT1_1_PGR2_PLR1_SU8_SRVW0_TLDS1_VW8_WG32_2_1_WGM18
    SolutionIndex: 48
    SolutionNameMin: Cijk_Ailk_Bljk_BBS_BH_SA_AH_MT32x32x32_MI32x32x16x1_SN_1LDSB0_AFC1_GRVW8_GSU1_LPB8_MIWT1_1_PGR2_PLR1_SU8_SRVW8_TLDS1_VW4_WG32_2_1_WGM18
    SolutionIndex: 49
    SolutionNameMin: Cijk_Ailk_Bljk_BBS_BH_SA_AH_MT32x32x32_MI32x32x16x1_SN_1LDSB0_AFC1_GRVW8_GSU1_LPB8_MIWT1_1_PGR2_PLR3_SU8_SRVW0_TLDS1_VW4_WG32_2_1_WGM12
    SolutionIndex: 50
    SolutionNameMin: Cijk_Ailk_Bljk_BBS_BH_SA_AH_MT32x32x64_MI32x32x16x1_SN_1LDSB0_AFC1_GRVW8_GSU1_LPB8_MIWT1_1_PGR2_PLR5_SU8_SRVW0_TLDS1_VW4_WG32_2_1_WGM8
    SolutionIndex: 51
    SolutionNameMin: Cijk_Ailk_Bljk_BBS_BH_SA_AH_MT32x32x64_MI32x32x16x1_SN_1LDSB0_AFC1_GRVW8_GSU1_LPB8_MIWT1_1_PGR2_PLR1_SU4_SRVW8_TLDS1_VW8_WG32_2_1_WGM19
    SolutionIndex: 52
    SolutionNameMin: Cijk_Ailk_Bljk_BBS_BH_SA_AH_MT32x32x16_MI32x32x16x1_SN_1LDSB0_AFC1_GRVW8_GSU1_LPB8_MIWT1_1_PGR1_PLR1_SU8_SRVW0_TLDS1_VW8_WG32_2_1_WGM8
    SolutionIndex: 53
    SolutionNameMin: Cijk_Ailk_Bljk_BBS_BH_SA_AH_MT32x32x32_MI32x32x16x1_SN_1LDSB0_AFC1_GRVW4_GSU1_LPB8_MIWT1_1_PGR1_PLR3_SU8_SRVW0_TLDS1_VW8_WG32_2_1_WGM18
    SolutionIndex: 54
    SolutionNameMin: Cijk_Ailk_Bljk_BBS_BH_SA_AH_MT32x32x32_MI32x32x16x1_SN_1LDSB0_AFC1_GRVW8_GSU1_LPB8_MIWT1_1_PGR1_PLR1_SU8_SRVW0_TLDS1_VW8_WG32_2_1_WGM19
    SolutionIndex: 55
    SolutionNameMin: Cijk_Ailk_Bljk_BBS_BH_SA_AH_MT32x32x16_MI32x32x16x1_SN_1LDSB0_AFC1_GRVW8_GSU1_LPB8_MIWT1_1_PGR1_PLR1_SU4_SRVW0_TLDS1_VW4_WG32_2_1_WGM12
    SolutionIndex: 56
    SolutionNameMin: Cijk_Ailk_Bljk_BBS_BH_SA_AH_MT32x32x32_MI32x32x16x1_SN_1LDSB0_AFC1_GRVW8_GSU1_LPB8_MIWT1_1_PGR1_PLR1_SU8_SRVW0_TLDS1_VW8_WG32_2_1_WGM8
    SolutionIndex: 57
    SolutionNameMin: Cijk_Ailk_Bljk_BBS_BH_SA_AH_MT32x32x32_MI32x32x16x1_SN_1LDSB0_AFC0_GRVW8_GSU2_LPB8_MIWT1_1_PGR1_PLR1_SU8_SRVW0_TLDS1_VW8_WG32_2_1_WGM12
    SolutionIndex: 58
    SolutionNameMin: Cijk_Ailk_Bljk_BBS_BH_SA_AH_MT32x32x32_MI32x32x16x1_SN_1LDSB0_AFC1_GRVW4_GSU1_LPB8_MIWT1_1_PGR2_PLR1_SU8_SRVW0_TLDS1_VW4_WG32_2_1_WGM18
    SolutionIndex: 59
    SolutionNameMin: Cijk_Ailk_Bljk_BBS_BH_SA_AH_MT32x32x32_MI32x32x16x1_SN_1LDSB0_AFC1_GRVW8_GSU1_LPB8_MIWT1_1_PGR2_PLR1_SU8_SRVW0_TLDS1_VW4_WG32_2_1_WGM12
    SolutionIndex: 60
    SolutionNameMin: Cijk_Ailk_Bljk_BBS_BH_SA_AH_MT32x32x32_MI32x32x16x1_SN_1LDSB0_AFC1_GRVW4_GSU1_LPB8_MIWT1_1_PGR2_PLR1_SU4_SRVW0_TLDS1_VW4_WG32_2_1_WGM8
    SolutionIndex: 61
    SolutionNameMin: Cijk_Ailk_Bljk_BBS_BH_SA_AH_MT32x32x32_MI32x32x16x1_SN_1LDSB0_AFC0_GRVW8_GSU2_LPB8_MIWT1_1_PGR1_PLR1_SU8_SRVW0_TLDS1_VW4_WG32_2_1_WGM19
- - - [15, 15, 1, 16]
    - [2, 0.0]
  - - [15, 15, 1, 32]
    - [13, 0.0]
  - - [15, 15, 1, 64]
    - [14, 0.0]
  - - [15, 15, 1, 96]
    - [5, 0.0]
  - - [15, 15, 1, 128]
    - [4, 0.0]
  - - [15, 15, 1, 136]
    - [3, 0.0]
  - - [15, 15, 1, 256]
    - [5, 0.0]
  - - [15, 15, 1, 264]
    - [4, 0.0]
  - - [15, 15, 1, 528]
    - [15, 0.001]
  - - [15, 15, 1, 544]
    - [5, 0.001]
  - - [15, 15, 1, 576]
    - [24, 0.001]
  - - [15, 15, 1, 608]
    - [21, 0.001]
  - - [15, 15, 1, 640]
    - [17, 0.001]
  - - [15, 15, 1, 768]
    - [19, 0.001]
  - - [15, 15, 1, 776]
    - [21, 0.001]
  - - [32, 32, 1, 16]
    - [2, 0.0]
  - - [32, 32, 1, 32]
    - [0, 0.0]
  - - [32, 32, 1, 64]
    - [14, 0.001]
  - - [32, 32, 1, 96]
    - [11, 0.001]
  - - [32, 32, 1, 128]
    - [16, 0.001]
  - - [32, 32, 1, 136]
    - [18, 0.001]
  - - [32, 32, 1, 256]
    - [5, 0.003]
  - - [32, 32, 1, 264]
    - [25, 0.003]
  - - [32, 32, 1, 528]
    - [26, 0.005]
  - - [32, 32, 1, 544]
    - [27, 0.005]
  - - [32, 32, 1, 576]
    - [22, 0.005]
  - - [32, 32, 1, 608]
    - [12, 0.005]
  - - [32, 32, 1, 640]
    - [28, 0.006]
  - - [32, 32, 1, 768]
    - [29, 0.007]
  - - [32, 32, 1, 776]
    - [18, 0.006]
  - - [256, 256, 1, 16]
    - [30, 0.012]
  - - [256, 256, 1, 24]
    - [31, 0.017]
  - - [256, 256, 1, 32]
    - [32, 0.023]
  - - [256, 256, 1, 64]
    - [23, 0.046]
  - - [256, 256, 1, 96]
    - [1, 0.065]
  - - [256, 256, 1, 128]
    - [33, 0.086]
  - - [256, 256, 1, 136]
    - [9, 0.084]
  - - [256, 256, 1, 256]
    - [34, 0.149]
  - - [256, 256, 1, 264]
    - [35, 0.146]
  - - [256, 256, 1, 280]
    - [36, 0.148]
  - - [256, 256, 1, 296]
    - [37, 0.164]
  - - [256, 256, 1, 528]
    - [38, 0.261]
  - - [256, 256, 1, 544]
    - [39, 0.274]
  - - [256, 256, 1, 576]
    - [40, 0.304]
  - - [256, 256, 1, 608]
    - [41, 0.318]
  - - [256, 256, 1, 640]
    - [33, 0.337]
  - - [256, 256, 1, 768]
    - [33, 0.383]
  - - [256, 256, 1, 776]
    - [41, 0.347]
  - - [256, 256, 1, 792]
    - [42, 0.35]
  - - [256, 256, 1, 808]
    - [8, 0.356]
  - - [255, 255, 1, 16]
    - [43, 0.009]
  - - [255, 255, 1, 32]
    - [6, 0.017]
  - - [255, 255, 1, 64]
    - [44, 0.034]
  - - [255, 255, 1, 96]
    - [45, 0.048]
  - - [255, 255, 1, 128]
    - [46, 0.065]
  - - [255, 255, 1, 136]
    - [7, 0.063]
  - - [255, 255, 1, 256]
    - [20, 0.119]
  - - [255, 255, 1, 264]
    - [47, 0.116]
  - - [255, 255, 1, 528]
    - [48, 0.203]
  - - [255, 255, 1, 544]
    - [49, 0.226]
  - - [255, 255, 1, 576]
    - [10, 0.24]
  - - [255, 255, 1, 608]
    - [37, 0.249]
  - - [255, 255, 1, 640]
    - [50, 0.261]
  - - [255, 255, 1, 768]
    - [45, 0.292]
  - - [255, 255, 1, 776]
    - [51, 0.276]
  - - [264, 264, 1, 16]
    - [52, 0.011]
  - - [264, 264, 1, 32]
    - [53, 0.022]
  - - [264, 264, 1, 64]
    - [54, 0.042]
  - - [264, 264, 1, 96]
    - [55, 0.06]
  - - [264, 264, 1, 128]
    - [47, 0.079]
  - - [264, 264, 1, 136]
    - [56, 0.076]
  - - [264, 264, 1, 256]
    - [35, 0.146]
  - - [264, 264, 1, 264]
    - [44, 0.14]
  - - [264, 264, 1, 528]
    - [57, 0.235]
  - - [264, 264, 1, 544]
    - [58, 0.262]
  - - [264, 264, 1, 576]
    - [37, 0.283]
  - - [264, 264, 1, 608]
    - [59, 0.274]
  - - [264, 264, 1, 640]
    - [60, 0.292]
  - - [264, 264, 1, 768]
    - [61, 0.347]
  - - [264, 264, 1, 776]
    - [57, 0.347]
- null
- null
- DeviceEfficiency
