library/src/hcc_detail/rocsparselt/src/spmm/Tensile/Logic/aquavanjaram/gfx940/aquavanjaram_Cijk_Alik_Bljk_BBS_BH_Bias_SPB_AS.yaml
- {MinimumRequiredVersion: 4.33.0}
- aquavanjaram
- gfx940
- [Device 0049, Device 0050]
    SolutionIndex: 0
    SolutionNameMin: Cijk_Alik_Bljk_BBS_BH_Bias_SPB_AS_MT32x32x32_MI32x32x1_SN_LDSB0_AFC1_AFEM8_GRVWA4_GSU1_LPA8_LPB8_LPM0_MIWT1_1_PLR1_SU0_SUS0_SVW1_TLDS1_VWA1_VWB1_WG32_2_1
    SolutionIndex: 1
    SolutionNameMin: Cijk_Alik_Bljk_BBS_BH_Bias_SPB_AS_MT32x32x32_MI32x32x1_SN_LDSB0_AFC1_AFEM8_GRVWA8_GSU1_LPA8_LPB8_LPM0_MIWT1_1_PLR1_SU0_SUS0_SVW1_TLDS1_VWA1_VWB1_WG32_2_1
    SolutionIndex: 2
    SolutionNameMin: Cijk_Alik_Bljk_BBS_BH_Bias_SPB_AS_MT32x32x32_MI32x32x1_SN_LDSB0_AFC1_AFEM1_GRVWA8_GSU1_LPA8_LPB8_LPM0_MIWT1_1_PLR1_SU4_SUS256_SVW1_TLDS1_VWA1_VWB1_WG32_2_1
    SolutionIndex: 3
    SolutionNameMin: Cijk_Alik_Bljk_BBS_BH_Bias_SPB_AS_MT32x32x32_MI32x32x1_SN_LDSB0_AFC0_AFEM1_GRVWA4_GSU2_LPA0_LPB0_LPM0_MIWT1_1_PLR1_SU0_SUS0_SVW1_TLDS0_VWA1_VWB1_WG32_2_1
    SolutionIndex: 4
    SolutionNameMin: Cijk_Alik_Bljk_BBS_BH_Bias_SPB_AS_MT32x32x32_MI32x32x1_SN_LDSB0_AFC0_AFEM8_GRVWA8_GSU2_LPA8_LPB8_LPM0_MIWT1_1_PLR1_SU0_SUS0_SVW1_TLDS1_VWA1_VWB1_WG32_2_1
    SolutionIndex: 5
    SolutionNameMin: Cijk_Alik_Bljk_BBS_BH_Bias_SPB_AS_MT32x32x32_MI32x32x1_SN_LDSB0_AFC0_AFEM1_GRVWA8_GSU2_LPA8_LPB8_LPM0_MIWT1_1_PLR1_SU4_SUS256_SVW1_TLDS1_VWA1_VWB1_WG32_2_1
    SolutionIndex: 6
    SolutionNameMin: Cijk_Alik_Bljk_BBS_BH_Bias_SPB_AS_MT128x128x32_MI32x32x1_SN_LDSB1_AFC1_AFEM8_GRVWA4_GSU1_LPA8_LPB8_LPM0_MIWT2_2_PLR1_SU0_SUS0_SVW2_TLDS1_VWA2_VWB1_WG64_4_1
    SolutionIndex: 7
    SolutionNameMin: Cijk_Alik_Bljk_BBS_BH_Bias_SPB_AS_MT128x128x32_MI32x32x1_SN_LDSB1_AFC1_AFEM8_GRVWA8_GSU1_LPA8_LPB8_LPM0_MIWT2_2_PLR1_SU0_SUS0_SVW2_TLDS1_VWA2_VWB1_WG64_4_1
    SolutionIndex: 8
    SolutionNameMin: Cijk_Alik_Bljk_BBS_BH_Bias_SPB_AS_MT32x32x64_MI32x32x1_SN_LDSB0_AFC1_AFEM1_GRVWA4_GSU1_LPA8_LPB8_LPM0_MIWT1_1_PLR1_SU0_SUS0_SVW1_TLDS1_VWA1_VWB1_WG32_2_1
    SolutionIndex: 9
    SolutionNameMin: Cijk_Alik_Bljk_BBS_BH_Bias_SPB_AS_MT32x32x64_MI32x32x1_SN_LDSB0_AFC1_AFEM1_GRVWA8_GSU1_LPA8_LPB8_LPM0_MIWT1_1_PLR1_SU0_SUS0_SVW1_TLDS1_VWA1_VWB1_WG32_2_1
    SolutionIndex: 10
    SolutionNameMin: Cijk_Alik_Bljk_BBS_BH_Bias_SPB_AS_MT32x32x64_MI32x32x1_SN_LDSB0_AFC1_AFEM1_GRVWA4_GSU1_LPA8_LPB8_LPM0_MIWT1_1_PLR3_SU0_SUS0_SVW1_TLDS1_VWA1_VWB1_WG32_2_1
    SolutionIndex: 11
    SolutionNameMin: Cijk_Alik_Bljk_BBS_BH_Bias_SPB_AS_MT32x32x64_MI32x32x1_SN_LDSB0_AFC1_AFEM8_GRVWA8_GSU1_LPA8_LPB8_LPM0_MIWT1_1_PLR1_SU0_SUS0_SVW1_TLDS1_VWA1_VWB1_WG32_2_1
    SolutionIndex: 12
    SolutionNameMin: Cijk_Alik_Bljk_BBS_BH_Bias_SPB_AS_MT32x32x64_MI32x32x1_SN_LDSB0_AFC1_AFEM1_GRVWA4_GSU1_LPA8_LPB8_LPM0_MIWT1_1_PLR3_SU4_SUS256_SVW1_TLDS1_VWA1_VWB1_WG32_2_1
    SolutionIndex: 13
    SolutionNameMin: Cijk_Alik_Bljk_BBS_BH_Bias_SPB_AS_MT32x32x64_MI32x32x1_SN_LDSB0_AFC1_AFEM8_GRVWA4_GSU1_LPA8_LPB8_LPM0_MIWT1_1_PLR1_SU4_SUS256_SVW1_TLDS1_VWA1_VWB1_WG32_2_1
    SolutionIndex: 14
    SolutionNameMin: Cijk_Alik_Bljk_BBS_BH_Bias_SPB_AS_MT32x32x64_MI32x32x1_SN_LDSB0_AFC1_AFEM8_GRVWA8_GSU1_LPA8_LPB8_LPM0_MIWT1_1_PLR1_SU4_SUS256_SVW1_TLDS1_VWA1_VWB1_WG32_2_1
    SolutionIndex: 15
    SolutionNameMin: Cijk_Alik_Bljk_BBS_BH_Bias_SPB_AS_MT32x32x64_MI32x32x1_SN_LDSB0_AFC1_AFEM8_GRVWA8_GSU1_LPA8_LPB8_LPM0_MIWT1_1_PLR3_SU4_SUS256_SVW1_TLDS1_VWA1_VWB1_WG32_2_1
    SolutionIndex: 16
    SolutionNameMin: Cijk_Alik_Bljk_BBS_BH_Bias_SPB_AS_MT32x32x64_MI32x32x1_SN_LDSB0_AFC0_AFEM1_GRVWA4_GSU2_LPA8_LPB8_LPM0_MIWT1_1_PLR1_SU0_SUS0_SVW1_TLDS1_VWA1_VWB1_WG32_2_1
    SolutionIndex: 17
    SolutionNameMin: Cijk_Alik_Bljk_BBS_BH_Bias_SPB_AS_MT32x32x64_MI32x32x1_SN_LDSB0_AFC0_AFEM1_GRVWA8_GSU2_LPA8_LPB8_LPM0_MIWT1_1_PLR1_SU0_SUS0_SVW1_TLDS1_VWA1_VWB1_WG32_2_1
    SolutionIndex: 18
    SolutionNameMin: Cijk_Alik_Bljk_BBS_BH_Bias_SPB_AS_MT128x128x64_MI32x32x1_SN_LDSB1_AFC1_AFEM1_GRVWA4_GSU1_LPA0_LPB0_LPM0_MIWT2_2_PLR1_SU0_SUS0_SVW2_TLDS0_VWA2_VWB1_WG64_4_1
- - - [15, 15, 1, 16, 15, 15, 16, 16]
    - [16, 0.0]
  - - [15, 15, 1, 32, 15, 15, 32, 32]
    - [5, 0.0]
  - - [15, 15, 1, 64, 15, 15, 64, 64]
    - [16, 0.0]
  - - [15, 15, 1, 96, 15, 15, 96, 96]
    - [17, 0.0]
  - - [15, 15, 1, 128, 15, 15, 128, 128]
    - [17, 0.0]
  - - [15, 15, 1, 136, 15, 15, 136, 136]
    - [16, 0.0]
  - - [15, 15, 1, 256, 15, 15, 256, 256]
    - [17, 0.0]
  - - [15, 15, 1, 264, 15, 15, 264, 264]
    - [16, 0.0]
  - - [16, 16, 1, 16, 16, 16, 16, 16]
    - [3, 0.0]
  - - [16, 16, 1, 32, 16, 16, 32, 32]
    - [4, 0.0]
  - - [16, 16, 1, 64, 16, 16, 64, 64]
    - [4, 0.0]
  - - [16, 16, 1, 96, 16, 16, 96, 96]
    - [4, 0.0]
  - - [16, 16, 1, 128, 16, 16, 128, 128]
    - [16, 0.0]
  - - [16, 16, 1, 136, 16, 16, 136, 136]
    - [4, 0.0]
  - - [16, 16, 1, 256, 16, 16, 256, 256]
    - [4, 0.0]
  - - [16, 16, 1, 264, 16, 16, 264, 264]
    - [4, 0.0]
  - - [256, 256, 1, 16, 256, 256, 16, 16]
    - [10, 0.006]
  - - [256, 256, 1, 24, 256, 256, 24, 24]
    - [0, 0.008]
  - - [256, 256, 1, 32, 256, 256, 32, 32]
    - [2, 0.011]
  - - [256, 256, 1, 64, 256, 256, 64, 64]
    - [6, 0.018]
  - - [256, 256, 1, 96, 256, 256, 96, 96]
    - [8, 0.029]
  - - [256, 256, 1, 128, 256, 256, 128, 128]
    - [12, 0.043]
  - - [256, 256, 1, 136, 256, 256, 136, 136]
    - [7, 0.034]
  - - [256, 256, 1, 256, 256, 256, 256, 256]
    - [11, 0.084]
  - - [384, 384, 1, 16, 384, 384, 16, 16]
    - [18, 0.007]
  - - [384, 384, 1, 24, 384, 384, 24, 24]
    - [1, 0.017]
  - - [384, 384, 1, 32, 384, 384, 32, 32]
    - [2, 0.022]
  - - [384, 384, 1, 64, 384, 384, 64, 64]
    - [13, 0.04]
  - - [384, 384, 1, 96, 384, 384, 96, 96]
    - [14, 0.053]
  - - [384, 384, 1, 128, 384, 384, 128, 128]
    - [10, 0.093]
  - - [384, 384, 1, 136, 384, 384, 136, 136]
    - [15, 0.076]
  - - [384, 384, 1, 256, 384, 384, 256, 256]
    - [9, 0.154]
- null
- null
- DeviceEfficiency
- null
- Euclidean
