library/src/hcc_detail/rocsparselt/src/spmm/Tensile/Logic/aquavanjaram/gfx940/aquavanjaram_Cijk_Alik_Bljk_HHS_BH_Bias_SA_AH.yaml
- {MinimumRequiredVersion: 4.33.0}
- aquavanjaram
- gfx940
- [Device 0049, Device 0050]
    SolutionIndex: 0
    SolutionNameMin: Cijk_Alik_Bljk_HHS_BH_Bias_SA_AH_MT32x32x32_MI32x32x16x1_SN_1LDSB0_AFC1_DTVSM0_GSU1_LPA4_LPB8_LPM1_MIWT1_1_SU0_SUS0_TLDS1_WG32_2_1
    SolutionIndex: 1
    SolutionNameMin: Cijk_Alik_Bljk_HHS_BH_Bias_SA_AH_MT32x32x32_MI32x32x16x1_SN_1LDSB0_AFC1_DTVSM1_GSU1_LPA0_LPB0_LPMn1_MIWT1_1_SU0_SUS0_TLDS0_WG32_2_1
    SolutionIndex: 2
    SolutionNameMin: Cijk_Alik_Bljk_HHS_BH_Bias_SA_AH_MT32x32x32_MI32x32x16x1_SN_1LDSB0_AFC1_DTVSM1_GSU1_LPA0_LPB0_LPMn1_MIWT1_1_SU4_SUS256_TLDS0_WG32_2_1
    SolutionIndex: 3
    SolutionNameMin: Cijk_Alik_Bljk_HHS_BH_Bias_SA_AH_MT32x32x32_MI32x32x16x1_SN_1LDSB0_AFC1_DTVSM1_GSU1_LPA4_LPB8_LPMn1_MIWT1_1_SU4_SUS256_TLDS1_WG32_2_1
    SolutionIndex: 4
    SolutionNameMin: Cijk_Alik_Bljk_HHS_BH_Bias_SA_AH_MT128x128x32_MI32x32x16x1_SN_1LDSB0_AFC1_DTVSM0_GSU1_LPA4_LPB8_LPM1_MIWT2_2_SU0_SUS0_TLDS1_WG64_4_1
    SolutionIndex: 5
    SolutionNameMin: Cijk_Alik_Bljk_HHS_BH_Bias_SA_AH_MT128x128x32_MI32x32x16x1_SN_1LDSB0_AFC0_DTVSM0_GSU2_LPA0_LPB0_LPM1_MIWT2_2_SU0_SUS0_TLDS0_WG64_4_1
    SolutionIndex: 6
    SolutionNameMin: Cijk_Alik_Bljk_HHS_BH_Bias_SA_AH_MT32x32x64_MI32x32x16x1_SN_1LDSB0_AFC1_DTVSM0_GSU1_LPA4_LPB8_LPM1_MIWT1_1_SU0_SUS0_TLDS1_WG32_2_1
    SolutionIndex: 7
    SolutionNameMin: Cijk_Alik_Bljk_HHS_BH_Bias_SA_AH_MT32x32x64_MI32x32x16x1_SN_1LDSB0_AFC1_DTVSM1_GSU1_LPA0_LPB0_LPMn1_MIWT1_1_SU0_SUS0_TLDS0_WG32_2_1
    SolutionIndex: 8
    SolutionNameMin: Cijk_Alik_Bljk_HHS_BH_Bias_SA_AH_MT32x32x64_MI32x32x16x1_SN_1LDSB0_AFC1_DTVSM1_GSU1_LPA4_LPB8_LPMn1_MIWT1_1_SU0_SUS0_TLDS1_WG32_2_1
    SolutionIndex: 9
    SolutionNameMin: Cijk_Alik_Bljk_HHS_BH_Bias_SA_AH_MT32x32x64_MI32x32x16x1_SN_1LDSB0_AFC1_DTVSM1_GSU1_LPA4_LPB8_LPMn1_MIWT1_1_SU4_SUS256_TLDS1_WG32_2_1
    SolutionIndex: 10
    SolutionNameMin: Cijk_Alik_Bljk_HHS_BH_Bias_SA_AH_MT32x32x64_MI32x32x16x1_SN_1LDSB0_AFC0_DTVSM1_GSU2_LPA4_LPB8_LPMn1_MIWT1_1_SU4_SUS256_TLDS1_WG32_2_1
- - - [15, 15, 1, 16, 15, 15, 16, 16]
    - [9, 0.534918]
  - - [15, 15, 1, 32, 15, 15, 32, 32]
    - [10, 1.05102]
  - - [15, 15, 1, 64, 15, 15, 64, 64]
    - [8, 2.88722]
  - - [15, 15, 1, 96, 15, 15, 96, 96]
    - [2, 3.51248]
  - - [15, 15, 1, 128, 15, 15, 128, 128]
    - [10, 3.76397]
  - - [15, 15, 1, 136, 15, 15, 136, 136]
    - [8, 5.515]
  - - [15, 15, 1, 256, 15, 15, 256, 256]
    - [8, 10.2336]
  - - [15, 15, 1, 264, 15, 15, 264, 264]
    - [2, 8.8518]
  - - [256, 256, 1, 16, 256, 256, 16, 16]
    - [1, 161.072]
  - - [256, 256, 1, 24, 256, 256, 24, 24]
    - [4, 14.9283]
  - - [256, 256, 1, 32, 256, 256, 32, 32]
    - [6, 19.9197]
  - - [256, 256, 1, 64, 256, 256, 64, 64]
    - [7, 39.8467]
  - - [256, 256, 1, 96, 256, 256, 96, 96]
    - [3, 59.9526]
  - - [256, 256, 1, 128, 256, 256, 128, 128]
    - [4, 79.5725]
  - - [256, 256, 1, 136, 256, 256, 136, 136]
    - [0, 84.8682]
  - - [256, 256, 1, 256, 256, 256, 256, 256]
    - [5, 771.26]
- null
- null
- DeviceEfficiency
