library/src/hcc_detail/rocsparselt/src/spmm/Tensile/Logic/aquavanjaram/gfx940/aquavanjaram_Cijk_Alik_Bljk_I8I8S_BH_Bias_SA_AH.yaml
- {MinimumRequiredVersion: 4.33.0}
- aquavanjaram
- gfx940
- [Device 0049, Device 0050]
    SolutionIndex: 0
    SolutionNameMin: Cijk_Alik_Bljk_I8I8S_BH_Bias_SA_AH_MT32x32x64_MI32x32x32x1_SN_AFC1_DTVSM0_GSU1_LPA8_LPB16_LPM2_MIWT1_1_SU0_SUS0_TLDS1_WG32_2_1
    SolutionIndex: 1
    SolutionNameMin: Cijk_Alik_Bljk_I8I8S_BH_Bias_SA_AH_MT32x32x64_MI32x32x32x1_SN_AFC1_DTVSM1_GSU1_LPA8_LPB16_LPMn1_MIWT1_1_SU0_SUS0_TLDS1_WG32_2_1
    SolutionIndex: 2
    SolutionNameMin: Cijk_Alik_Bljk_I8I8S_BH_Bias_SA_AH_MT32x32x64_MI32x32x32x1_SN_AFC1_DTVSM0_GSU1_LPA8_LPB16_LPM2_MIWT1_1_SU4_SUS256_TLDS1_WG32_2_1
    SolutionIndex: 3
    SolutionNameMin: Cijk_Alik_Bljk_I8I8S_BH_Bias_SA_AH_MT32x32x64_MI32x32x32x1_SN_AFC1_DTVSM1_GSU1_LPA8_LPB16_LPMn1_MIWT1_1_SU4_SUS256_TLDS1_WG32_2_1
    SolutionIndex: 4
    SolutionNameMin: Cijk_Alik_Bljk_I8I8S_BH_Bias_SA_AH_MT32x32x64_MI32x32x32x1_SN_AFC0_DTVSM0_GSU2_LPA8_LPB16_LPM2_MIWT1_1_SU0_SUS0_TLDS1_WG32_2_1
    SolutionIndex: 5
    SolutionNameMin: Cijk_Alik_Bljk_I8I8S_BH_Bias_SA_AH_MT32x32x64_MI32x32x32x1_SN_AFC0_DTVSM1_GSU2_LPA8_LPB16_LPMn1_MIWT1_1_SU0_SUS0_TLDS1_WG32_2_1
    SolutionIndex: 6
    SolutionNameMin: Cijk_Alik_Bljk_I8I8S_BH_Bias_SA_AH_MT32x32x64_MI32x32x32x1_SN_AFC0_DTVSM0_GSU2_LPA8_LPB16_LPM2_MIWT1_1_SU4_SUS256_TLDS1_WG32_2_1
- - - [15, 15, 1, 16, 15, 15, 16, 16]
    - [6, 0.489696]
  - - [15, 15, 1, 32, 15, 15, 32, 32]
    - [5, 0.883165]
  - - [15, 15, 1, 64, 15, 15, 64, 64]
    - [6, 2.30418]
  - - [15, 15, 1, 96, 15, 15, 96, 96]
    - [4, 2.57357]
  - - [15, 15, 1, 128, 15, 15, 128, 128]
    - [3, 5.52995]
  - - [15, 15, 1, 136, 15, 15, 136, 136]
    - [1, 4.86525]
  - - [15, 15, 1, 256, 15, 15, 256, 256]
    - [3, 10.4947]
  - - [15, 15, 1, 264, 15, 15, 264, 264]
    - [3, 9.41363]
  - - [256, 256, 1, 16, 256, 256, 16, 16]
    - [0, 139.596]
  - - [256, 256, 1, 24, 256, 256, 24, 24]
    - [1, 234.406]
  - - [256, 256, 1, 32, 256, 256, 32, 32]
    - [1, 321.181]
  - - [256, 256, 1, 64, 256, 256, 64, 64]
    - [1, 717.098]
  - - [256, 256, 1, 96, 256, 256, 96, 96]
    - [0, 889.818]
  - - [256, 256, 1, 128, 256, 256, 128, 128]
    - [2, 1265.25]
  - - [256, 256, 1, 136, 256, 256, 136, 136]
    - [3, 1143.85]
  - - [256, 256, 1, 256, 256, 256, 256, 256]
    - [5, 2175.47]
- null
- null
- DeviceEfficiency
