library/src/hcc_detail/rocsparselt/src/spmm/Tensile/Logic/aquavanjaram/gfx940/aquavanjaram_Cijk_Alik_Bjlk_BBS_BH_SA_AH.yaml
- {MinimumRequiredVersion: 4.33.0}
- aquavanjaram
- gfx940
- [Device 0049, Device 0050]
    SolutionIndex: 0
    SolutionNameMin: Cijk_Alik_Bjlk_BBS_BH_SA_AH_MT32x32x16_MI32x32x16x1_SN_1LDSB0_GRVW4_LPA8_MIWT1_1_PGR2_PLR1_SU8_TLDS0_VW8_WG32_2_1_WGM12
    SolutionIndex: 1
    SolutionNameMin: Cijk_Alik_Bjlk_BBS_BH_SA_AH_MT32x32x16_MI32x32x16x1_SN_1LDSB0_GRVW8_LPA8_MIWT1_1_PGR1_PLR1_SU8_TLDS1_VW8_WG32_2_1_WGM19
    SolutionIndex: 2
    SolutionNameMin: Cijk_Alik_Bjlk_BBS_BH_SA_AH_MT32x32x16_MI32x32x16x1_SN_1LDSB0_GRVW4_LPA4_MIWT1_1_PGR2_PLR1_SU8_TLDS1_VW8_WG32_2_1_WGM19
    SolutionIndex: 3
    SolutionNameMin: Cijk_Alik_Bjlk_BBS_BH_SA_AH_MT32x32x32_MI32x32x16x1_SN_1LDSB0_GRVW8_LPA8_MIWT1_1_PGR2_PLR1_SU8_TLDS1_VW4_WG32_2_1_WGM18
    SolutionIndex: 4
    SolutionNameMin: Cijk_Alik_Bjlk_BBS_BH_SA_AH_MT32x32x32_MI32x32x16x1_SN_1LDSB0_GRVW8_LPA8_MIWT1_1_PGR1_PLR3_SU8_TLDS1_VW8_WG32_2_1_WGM18
    SolutionIndex: 5
    SolutionNameMin: Cijk_Alik_Bjlk_BBS_BH_SA_AH_MT32x32x32_MI32x32x16x1_SN_1LDSB0_GRVW8_LPA8_MIWT1_1_PGR1_PLR1_SU4_TLDS1_VW8_WG32_2_1_WGM19
    SolutionIndex: 6
    SolutionNameMin: Cijk_Alik_Bjlk_BBS_BH_SA_AH_MT32x32x32_MI32x32x16x1_SN_1LDSB0_GRVW8_LPA4_MIWT1_1_PGR2_PLR1_SU4_TLDS0_VW4_WG32_2_1_WGM19
    SolutionIndex: 7
    SolutionNameMin: Cijk_Alik_Bjlk_BBS_BH_SA_AH_MT32x32x32_MI32x32x16x1_SN_1LDSB0_GRVW8_LPA8_MIWT1_1_PGR2_PLR1_SU4_TLDS1_VW8_WG32_2_1_WGM19
    SolutionIndex: 8
    SolutionNameMin: Cijk_Alik_Bjlk_BBS_BH_SA_AH_MT32x32x32_MI32x32x16x1_SN_1LDSB0_GRVW8_LPA8_MIWT1_1_PGR1_PLR3_SU4_TLDS1_VW8_WG32_2_1_WGM19
    SolutionIndex: 9
    SolutionNameMin: Cijk_Alik_Bjlk_BBS_BH_SA_AH_MT32x32x32_MI32x32x16x1_SN_1LDSB0_GRVW8_LPA8_MIWT1_1_PGR2_PLR3_SU4_TLDS1_VW4_WG32_2_1_WGM19
    SolutionIndex: 10
    SolutionNameMin: Cijk_Alik_Bjlk_BBS_BH_SA_AH_MT32x32x32_MI32x32x16x1_SN_1LDSB0_GRVW8_LPA8_MIWT1_1_PGR2_PLR1_SU8_TLDS1_VW4_WG32_2_1_WGM19
    SolutionIndex: 11
    SolutionNameMin: Cijk_Alik_Bjlk_BBS_BH_SA_AH_MT32x32x64_MI32x32x16x1_SN_1LDSB0_GRVW8_LPA8_MIWT1_1_PGR1_PLR1_SU4_TLDS1_VW8_WG32_2_1_WGM12
    SolutionIndex: 12
    SolutionNameMin: Cijk_Alik_Bjlk_BBS_BH_SA_AH_MT32x32x64_MI32x32x16x1_SN_1LDSB0_GRVW8_LPA8_MIWT1_1_PGR2_PLR5_SU4_TLDS1_VW4_WG32_2_1_WGM12
    SolutionIndex: 13
    SolutionNameMin: Cijk_Alik_Bjlk_BBS_BH_SA_AH_MT32x32x64_MI32x32x16x1_SN_1LDSB0_GRVW8_LPA8_MIWT1_1_PGR2_PLR1_SU4_TLDS1_VW4_WG32_2_1_WGM18
    SolutionIndex: 14
    SolutionNameMin: Cijk_Alik_Bjlk_BBS_BH_SA_AH_MT32x32x64_MI32x32x16x1_SN_1LDSB0_GRVW8_LPA8_MIWT1_1_PGR1_PLR5_SU4_TLDS1_VW8_WG32_2_1_WGM18
    SolutionIndex: 15
    SolutionNameMin: Cijk_Alik_Bjlk_BBS_BH_SA_AH_MT32x32x64_MI32x32x16x1_SN_1LDSB0_GRVW8_LPA8_MIWT1_1_PGR2_PLR5_SU8_TLDS1_VW8_WG32_2_1_WGM18
    SolutionIndex: 16
    SolutionNameMin: Cijk_Alik_Bjlk_BBS_BH_SA_AH_MT32x32x64_MI32x32x16x1_SN_1LDSB0_GRVW8_LPA8_MIWT1_1_PGR1_PLR1_SU4_TLDS1_VW4_WG32_2_1_WGM19
    SolutionIndex: 17
    SolutionNameMin: Cijk_Alik_Bjlk_BBS_BH_SA_AH_MT32x32x64_MI32x32x16x1_SN_1LDSB0_GRVW8_LPA8_MIWT1_1_PGR1_PLR5_SU4_TLDS1_VW4_WG32_2_1_WGM19
    SolutionIndex: 18
    SolutionNameMin: Cijk_Alik_Bjlk_BBS_BH_SA_AH_MT32x32x64_MI32x32x16x1_SN_1LDSB0_AFC0_GRVW8_GSU2_LPA8_MIWT1_1_PGR2_PLR5_SU8_SRVW0_TLDS1_VW8_WG32_2_1_WGM12
    SolutionIndex: 19
    SolutionNameMin: Cijk_Alik_Bjlk_BBS_BH_SA_AH_MT32x32x32_MI32x32x16x1_SN_1LDSB0_AFC0_GRVW8_GSU2_LPA8_MIWT1_1_PGR1_PLR1_SU4_SRVW0_TLDS1_VW4_WG32_2_1_WGM12
    SolutionIndex: 20
    SolutionNameMin: Cijk_Alik_Bjlk_BBS_BH_SA_AH_MT32x32x64_MI32x32x16x1_SN_1LDSB0_AFC1_GRVW8_GSU1_LPA8_MIWT1_1_PGR1_PLR5_SU4_SRVW8_TLDS1_VW4_WG32_2_1_WGM12
    SolutionIndex: 21
    SolutionNameMin: Cijk_Alik_Bjlk_BBS_BH_SA_AH_MT32x32x32_MI32x32x16x1_SN_1LDSB0_AFC0_GRVW8_GSU2_LPA8_MIWT1_1_PGR2_PLR3_SU8_SRVW0_TLDS1_VW8_WG32_2_1_WGM18
    SolutionIndex: 22
    SolutionNameMin: Cijk_Alik_Bjlk_BBS_BH_SA_AH_MT32x32x32_MI32x32x16x1_SN_1LDSB0_AFC0_GRVW8_GSU2_LPA8_MIWT1_1_PGR2_PLR1_SU8_SRVW0_TLDS1_VW8_WG32_2_1_WGM18
    SolutionIndex: 23
    SolutionNameMin: Cijk_Alik_Bjlk_BBS_BH_SA_AH_MT32x32x32_MI32x32x16x1_SN_1LDSB0_AFC1_GRVW8_GSU1_LPA8_MIWT1_1_PGR1_PLR3_SU8_SRVW8_TLDS0_VW8_WG32_2_1_WGM19
    SolutionIndex: 24
    SolutionNameMin: Cijk_Alik_Bjlk_BBS_BH_SA_AH_MT32x32x32_MI32x32x16x1_SN_1LDSB0_AFC1_GRVW8_GSU1_LPA8_MIWT1_1_PGR1_PLR1_SU4_SRVW0_TLDS1_VW4_WG32_2_1_WGM18
    SolutionIndex: 25
    SolutionNameMin: Cijk_Alik_Bjlk_BBS_BH_SA_AH_MT32x32x64_MI32x32x16x1_SN_1LDSB0_AFC1_GRVW8_GSU1_LPA8_MIWT1_1_PGR1_PLR1_SU8_SRVW0_TLDS1_VW8_WG32_2_1_WGM19
    SolutionIndex: 26
    SolutionNameMin: Cijk_Alik_Bjlk_BBS_BH_SA_AH_MT32x32x32_MI32x32x16x1_SN_1LDSB0_AFC1_GRVW8_GSU1_LPA8_MIWT1_1_PGR2_PLR3_SU8_SRVW0_TLDS1_VW4_WG32_2_1_WGM19
    SolutionIndex: 27
    SolutionNameMin: Cijk_Alik_Bjlk_BBS_BH_SA_AH_MT32x32x16_MI32x32x16x1_SN_1LDSB0_AFC1_GRVW4_GSU1_LPA4_MIWT1_1_PGR2_PLR1_SU4_SRVW0_TLDS1_VW8_WG32_2_1_WGM19
    SolutionIndex: 28
    SolutionNameMin: Cijk_Alik_Bjlk_BBS_BH_SA_AH_MT32x32x32_MI32x32x16x1_SN_1LDSB0_AFC1_GRVW8_GSU1_LPA8_MIWT1_1_PGR2_PLR1_SU4_SRVW0_TLDS1_VW8_WG32_2_1_WGM19
    SolutionIndex: 29
    SolutionNameMin: Cijk_Alik_Bjlk_BBS_BH_SA_AH_MT32x32x32_MI32x32x16x1_SN_1LDSB0_AFC1_GRVW8_GSU1_LPA8_MIWT1_1_PGR2_PLR3_SU4_SRVW0_TLDS1_VW4_WG32_2_1_WGM19
    SolutionIndex: 30
    SolutionNameMin: Cijk_Alik_Bjlk_BBS_BH_SA_AH_MT32x32x32_MI32x32x16x1_SN_1LDSB0_AFC1_GRVW8_GSU1_LPA8_MIWT1_1_PGR1_PLR1_SU4_SRVW0_TLDS1_VW8_WG32_2_1_WGM12
    SolutionIndex: 31
    SolutionNameMin: Cijk_Alik_Bjlk_BBS_BH_SA_AH_MT32x32x32_MI32x32x16x1_SN_1LDSB0_AFC1_GRVW8_GSU1_LPA8_MIWT1_1_PGR2_PLR3_SU8_SRVW0_TLDS1_VW8_WG32_2_1_WGM19
    SolutionIndex: 32
    SolutionNameMin: Cijk_Alik_Bjlk_BBS_BH_SA_AH_MT32x32x32_MI32x32x16x1_SN_1LDSB0_AFC1_GRVW8_GSU1_LPA8_MIWT1_1_PGR2_PLR1_SU4_SRVW0_TLDS1_VW8_WG32_2_1_WGM18
    SolutionIndex: 33
    SolutionNameMin: Cijk_Alik_Bjlk_BBS_BH_SA_AH_MT32x32x64_MI32x32x16x1_SN_1LDSB0_AFC1_GRVW8_GSU1_LPA8_MIWT1_1_PGR1_PLR1_SU8_SRVW0_TLDS1_VW8_WG32_2_1_WGM18
    SolutionIndex: 34
    SolutionNameMin: Cijk_Alik_Bjlk_BBS_BH_SA_AH_MT32x32x32_MI32x32x16x1_SN_1LDSB0_AFC1_GRVW8_GSU1_LPA8_MIWT1_1_PGR2_PLR3_SU8_SRVW8_TLDS1_VW8_WG32_2_1_WGM19
    SolutionIndex: 35
    SolutionNameMin: Cijk_Alik_Bjlk_BBS_BH_SA_AH_MT32x32x64_MI32x32x16x1_SN_1LDSB0_AFC1_GRVW8_GSU1_LPA8_MIWT1_1_PGR1_PLR5_SU8_SRVW0_TLDS1_VW8_WG32_2_1_WGM18
    SolutionIndex: 36
    SolutionNameMin: Cijk_Alik_Bjlk_BBS_BH_SA_AH_MT32x32x64_MI32x32x16x1_SN_1LDSB0_AFC1_GRVW8_GSU1_LPA8_MIWT1_1_PGR1_PLR5_SU4_SRVW8_TLDS1_VW8_WG32_2_1_WGM12
    SolutionIndex: 37
    SolutionNameMin: Cijk_Alik_Bjlk_BBS_BH_SA_AH_MT32x32x32_MI32x32x16x1_SN_1LDSB0_AFC1_GRVW8_GSU1_LPA8_MIWT1_1_PGR2_PLR1_SU4_SRVW8_TLDS1_VW4_WG32_2_1_WGM18
    SolutionIndex: 38
    SolutionNameMin: Cijk_Alik_Bjlk_BBS_BH_SA_AH_MT32x32x64_MI32x32x16x1_SN_1LDSB0_AFC1_GRVW8_GSU1_LPA8_MIWT1_1_PGR2_PLR5_SU4_SRVW0_TLDS1_VW8_WG32_2_1_WGM19
    SolutionIndex: 39
    SolutionNameMin: Cijk_Alik_Bjlk_BBS_BH_SA_AH_MT32x32x32_MI32x32x16x1_SN_1LDSB0_AFC1_GRVW8_GSU1_LPA8_MIWT1_1_PGR2_PLR3_SU8_SRVW0_TLDS1_VW8_WG32_2_1_WGM12
    SolutionIndex: 40
    SolutionNameMin: Cijk_Alik_Bjlk_BBS_BH_SA_AH_MT32x32x32_MI32x32x16x1_SN_1LDSB0_AFC1_GRVW8_GSU1_LPA8_MIWT1_1_PGR2_PLR1_SU4_SRVW0_TLDS1_VW4_WG32_2_1_WGM19
    SolutionIndex: 41
    SolutionNameMin: Cijk_Alik_Bjlk_BBS_BH_SA_AH_MT32x32x16_MI32x32x16x1_SN_1LDSB0_AFC1_GRVW8_GSU1_LPA8_MIWT1_1_PGR1_PLR1_SU8_SRVW0_TLDS1_VW8_WG32_2_1_WGM19
    SolutionIndex: 42
    SolutionNameMin: Cijk_Alik_Bjlk_BBS_BH_SA_AH_MT32x32x32_MI32x32x16x1_SN_1LDSB0_AFC1_GRVW8_GSU1_LPA8_MIWT1_1_PGR1_PLR1_SU8_SRVW0_TLDS1_VW4_WG32_2_1_WGM19
    SolutionIndex: 43
    SolutionNameMin: Cijk_Alik_Bjlk_BBS_BH_SA_AH_MT32x32x32_MI32x32x16x1_SN_1LDSB0_AFC1_GRVW8_GSU1_LPA8_MIWT1_1_PGR1_PLR1_SU8_SRVW0_TLDS1_VW8_WG32_2_1_WGM12
    SolutionIndex: 44
    SolutionNameMin: Cijk_Alik_Bjlk_BBS_BH_SA_AH_MT32x32x32_MI32x32x16x1_SN_1LDSB0_AFC1_GRVW8_GSU1_LPA8_MIWT1_1_PGR2_PLR1_SU8_SRVW8_TLDS1_VW8_WG32_2_1_WGM19
    SolutionIndex: 45
    SolutionNameMin: Cijk_Alik_Bjlk_BBS_BH_SA_AH_MT32x32x32_MI32x32x16x1_SN_1LDSB0_AFC1_GRVW8_GSU1_LPA8_MIWT1_1_PGR2_PLR1_SU4_SRVW0_TLDS1_VW8_WG32_2_1_WGM12
    SolutionIndex: 46
    SolutionNameMin: Cijk_Alik_Bjlk_BBS_BH_SA_AH_MT32x32x64_MI32x32x16x1_SN_1LDSB0_AFC1_GRVW8_GSU1_LPA8_MIWT1_1_PGR2_PLR1_SU8_SRVW0_TLDS1_VW8_WG32_2_1_WGM19
    SolutionIndex: 47
    SolutionNameMin: Cijk_Alik_Bjlk_BBS_BH_SA_AH_MT32x32x32_MI32x32x16x1_SN_1LDSB0_AFC1_GRVW8_GSU1_LPA8_MIWT1_1_PGR2_PLR3_SU4_SRVW0_TLDS1_VW4_WG32_2_1_WGM12
    SolutionIndex: 48
    SolutionNameMin: Cijk_Alik_Bjlk_BBS_BH_SA_AH_MT32x32x16_MI32x32x16x1_SN_1LDSB0_AFC1_GRVW8_GSU1_LPA8_MIWT1_1_PGR1_PLR1_SU8_SRVW0_TLDS1_VW8_WG32_2_1_WGM18
    SolutionIndex: 49
    SolutionNameMin: Cijk_Alik_Bjlk_BBS_BH_SA_AH_MT32x32x32_MI32x32x16x1_SN_1LDSB0_AFC1_GRVW8_GSU1_LPA8_MIWT1_1_PGR2_PLR1_SU8_SRVW0_TLDS1_VW8_WG32_2_1_WGM12
    SolutionIndex: 50
    SolutionNameMin: Cijk_Alik_Bjlk_BBS_BH_SA_AH_MT32x32x64_MI32x32x16x1_SN_1LDSB0_AFC1_GRVW8_GSU1_LPA8_MIWT1_1_PGR1_PLR5_SU8_SRVW0_TLDS0_VW8_WG32_2_1_WGM19
    SolutionIndex: 51
    SolutionNameMin: Cijk_Alik_Bjlk_BBS_BH_SA_AH_MT32x32x32_MI32x32x16x1_SN_1LDSB0_AFC1_GRVW4_GSU1_LPA4_MIWT1_1_PGR1_PLR3_SU8_SRVW0_TLDS1_VW4_WG32_2_1_WGM18
    SolutionIndex: 52
    SolutionNameMin: Cijk_Alik_Bjlk_BBS_BH_SA_AH_MT32x32x32_MI32x32x16x1_SN_1LDSB0_AFC1_GRVW4_GSU1_LPA4_MIWT1_1_PGR1_PLR1_SU4_SRVW0_TLDS1_VW4_WG32_2_1_WGM19
    SolutionIndex: 53
    SolutionNameMin: Cijk_Alik_Bjlk_BBS_BH_SA_AH_MT32x32x32_MI32x32x16x1_SN_1LDSB0_AFC1_GRVW8_GSU1_LPA8_MIWT1_1_PGR1_PLR3_SU8_SRVW0_TLDS1_VW4_WG32_2_1_WGM19
    SolutionIndex: 54
    SolutionNameMin: Cijk_Alik_Bjlk_BBS_BH_SA_AH_MT32x32x64_MI32x32x16x1_SN_1LDSB0_AFC1_GRVW8_GSU1_LPA8_MIWT1_1_PGR1_PLR1_SU8_SRVW0_TLDS1_VW4_WG32_2_1_WGM12
    SolutionIndex: 55
    SolutionNameMin: Cijk_Alik_Bjlk_BBS_BH_SA_AH_MT32x32x64_MI32x32x16x1_SN_1LDSB0_AFC1_GRVW8_GSU1_LPA8_MIWT1_1_PGR2_PLR1_SU4_SRVW0_TLDS1_VW4_WG32_2_1_WGM18
    SolutionIndex: 56
    SolutionNameMin: Cijk_Alik_Bjlk_BBS_BH_SA_AH_MT32x32x32_MI32x32x16x1_SN_1LDSB0_AFC1_GRVW8_GSU1_LPA8_MIWT1_1_PGR2_PLR1_SU8_SRVW0_TLDS1_VW4_WG32_2_1_WGM18
- - - [15, 15, 1, 16]
    - [0, 0.0]
  - - [15, 15, 1, 32]
    - [10, 0.0]
  - - [15, 15, 1, 64]
    - [16, 0.0]
  - - [15, 15, 1, 96]
    - [5, 0.0]
  - - [15, 15, 1, 128]
    - [14, 0.0]
  - - [15, 15, 1, 136]
    - [16, 0.0]
  - - [15, 15, 1, 256]
    - [18, 0.001]
  - - [15, 15, 1, 264]
    - [19, 0.001]
  - - [15, 15, 1, 528]
    - [13, 0.001]
  - - [15, 15, 1, 544]
    - [7, 0.001]
  - - [15, 15, 1, 576]
    - [12, 0.001]
  - - [15, 15, 1, 608]
    - [7, 0.001]
  - - [15, 15, 1, 640]
    - [12, 0.001]
  - - [15, 15, 1, 768]
    - [15, 0.001]
  - - [15, 15, 1, 776]
    - [13, 0.001]
  - - [32, 32, 1, 16]
    - [2, 0.0]
  - - [32, 32, 1, 32]
    - [6, 0.0]
  - - [32, 32, 1, 64]
    - [11, 0.001]
  - - [32, 32, 1, 96]
    - [4, 0.001]
  - - [32, 32, 1, 128]
    - [4, 0.001]
  - - [32, 32, 1, 136]
    - [8, 0.001]
  - - [32, 32, 1, 256]
    - [20, 0.003]
  - - [32, 32, 1, 264]
    - [9, 0.002]
  - - [32, 32, 1, 528]
    - [13, 0.004]
  - - [32, 32, 1, 544]
    - [21, 0.005]
  - - [32, 32, 1, 576]
    - [12, 0.005]
  - - [32, 32, 1, 608]
    - [9, 0.005]
  - - [32, 32, 1, 640]
    - [22, 0.006]
  - - [32, 32, 1, 768]
    - [22, 0.007]
  - - [32, 32, 1, 776]
    - [21, 0.006]
  - - [256, 256, 1, 16]
    - [1, 0.013]
  - - [256, 256, 1, 24]
    - [23, 0.016]
  - - [256, 256, 1, 32]
    - [24, 0.025]
  - - [256, 256, 1, 64]
    - [25, 0.048]
  - - [256, 256, 1, 96]
    - [26, 0.068]
  - - [256, 256, 1, 128]
    - [8, 0.091]
  - - [256, 256, 1, 136]
    - [27, 0.086]
  - - [256, 256, 1, 256]
    - [28, 0.156]
  - - [256, 256, 1, 264]
    - [29, 0.149]
  - - [256, 256, 1, 280]
    - [29, 0.155]
  - - [256, 256, 1, 296]
    - [30, 0.165]
  - - [256, 256, 1, 528]
    - [31, 0.253]
  - - [256, 256, 1, 544]
    - [32, 0.283]
  - - [256, 256, 1, 576]
    - [33, 0.299]
  - - [256, 256, 1, 608]
    - [34, 0.297]
  - - [256, 256, 1, 640]
    - [35, 0.323]
  - - [256, 256, 1, 768]
    - [36, 0.365]
  - - [256, 256, 1, 776]
    - [37, 0.333]
  - - [256, 256, 1, 792]
    - [38, 0.343]
  - - [256, 256, 1, 808]
    - [10, 0.349]
  - - [255, 255, 1, 16]
    - [39, 0.009]
  - - [255, 255, 1, 32]
    - [40, 0.019]
  - - [255, 255, 1, 64]
    - [41, 0.036]
  - - [255, 255, 1, 96]
    - [42, 0.051]
  - - [255, 255, 1, 128]
    - [39, 0.067]
  - - [255, 255, 1, 136]
    - [43, 0.067]
  - - [255, 255, 1, 256]
    - [31, 0.125]
  - - [255, 255, 1, 264]
    - [39, 0.119]
  - - [255, 255, 1, 528]
    - [3, 0.209]
  - - [255, 255, 1, 544]
    - [44, 0.217]
  - - [255, 255, 1, 576]
    - [28, 0.234]
  - - [255, 255, 1, 608]
    - [45, 0.237]
  - - [255, 255, 1, 640]
    - [35, 0.25]
  - - [255, 255, 1, 768]
    - [46, 0.288]
  - - [255, 255, 1, 776]
    - [47, 0.282]
  - - [264, 264, 1, 16]
    - [48, 0.011]
  - - [264, 264, 1, 32]
    - [49, 0.022]
  - - [264, 264, 1, 64]
    - [50, 0.041]
  - - [264, 264, 1, 96]
    - [51, 0.06]
  - - [264, 264, 1, 128]
    - [52, 0.077]
  - - [264, 264, 1, 136]
    - [43, 0.078]
  - - [264, 264, 1, 256]
    - [35, 0.139]
  - - [264, 264, 1, 264]
    - [53, 0.141]
  - - [264, 264, 1, 528]
    - [32, 0.244]
  - - [264, 264, 1, 544]
    - [47, 0.266]
  - - [264, 264, 1, 576]
    - [17, 0.254]
  - - [264, 264, 1, 608]
    - [45, 0.287]
  - - [264, 264, 1, 640]
    - [54, 0.298]
  - - [264, 264, 1, 768]
    - [55, 0.349]
  - - [264, 264, 1, 776]
    - [56, 0.31]
- null
- null
- DeviceEfficiency
