library/src/hcc_detail/rocsparselt/src/spmm/Tensile/Logic/aquavanjaram/gfx940/aquavanjaram_Cijk_Ailk_Bjlk_BBS_BH_Bias_SA_AS.yaml
- {MinimumRequiredVersion: 4.33.0}
- aquavanjaram
- gfx940
- [Device 0049, Device 0050]
    SolutionIndex: 0
    SolutionNameMin: Cijk_Ailk_Bjlk_BBS_BH_Bias_SA_AS_MT32x32x32_MI32x32x1_SN_LDSB0_AFC1_AFEM8_DTVSM0_GRVWA4_GSU1_LPM1_MIWT1_1_PLR1_SU0_SUS0_SVW4_VWA1_VWB1_WG32_2_1
    SolutionIndex: 1
    SolutionNameMin: Cijk_Ailk_Bjlk_BBS_BH_Bias_SA_AS_MT32x32x32_MI32x32x1_SN_LDSB0_AFC1_AFEM8_DTVSM0_GRVWA8_GSU1_LPM2_MIWT1_1_PLR1_SU0_SUS0_SVW4_VWA1_VWB1_WG32_2_1
    SolutionIndex: 2
    SolutionNameMin: Cijk_Ailk_Bjlk_BBS_BH_Bias_SA_AS_MT32x32x32_MI32x32x1_SN_LDSB0_AFC1_AFEM8_DTVSM1_GRVWA4_GSU1_LPMn1_MIWT1_1_PLR1_SU0_SUS0_SVW4_VWA1_VWB1_WG32_2_1
    SolutionIndex: 3
    SolutionNameMin: Cijk_Ailk_Bjlk_BBS_BH_Bias_SA_AS_MT32x32x32_MI32x32x1_SN_LDSB0_AFC1_AFEM8_DTVSM1_GRVWA8_GSU1_LPMn1_MIWT1_1_PLR1_SU0_SUS0_SVW4_VWA1_VWB1_WG32_2_1
    SolutionIndex: 4
    SolutionNameMin: Cijk_Ailk_Bjlk_BBS_BH_Bias_SA_AS_MT32x32x32_MI32x32x1_SN_LDSB0_AFC1_AFEM8_DTVSM0_GRVWA4_GSU1_LPM1_MIWT1_1_PLR1_SU4_SUS256_SVW4_VWA1_VWB1_WG32_2_1
    SolutionIndex: 5
    SolutionNameMin: Cijk_Ailk_Bjlk_BBS_BH_Bias_SA_AS_MT32x32x32_MI32x32x1_SN_LDSB0_AFC1_AFEM8_DTVSM1_GRVWA8_GSU1_LPMn1_MIWT1_1_PLR1_SU4_SUS256_SVW4_VWA1_VWB1_WG32_2_1
    SolutionIndex: 6
    SolutionNameMin: Cijk_Ailk_Bjlk_BBS_BH_Bias_SA_AS_MT32x32x32_MI32x32x1_SN_LDSB0_AFC0_AFEM8_DTVSM1_GRVWA8_GSU2_LPMn1_MIWT1_1_PLR1_SU0_SUS0_SVW4_VWA1_VWB1_WG32_2_1
    SolutionIndex: 7
    SolutionNameMin: Cijk_Ailk_Bjlk_BBS_BH_Bias_SA_AS_MT256x256x32_MI32x32x1_SN_LDSB0_AFC1_AFEM8_DTVSM0_GRVWA4_GSU1_LPM1_MIWT2_4_PLR1_SU0_SUS0_SVW8_VWA2_VWB2_WG128_4_1
    SolutionIndex: 8
    SolutionNameMin: Cijk_Ailk_Bjlk_BBS_BH_Bias_SA_AS_MT32x32x64_MI32x32x1_SN_LDSB0_AFC1_AFEM1_DTVSM1_GRVWA8_GSU1_LPMn1_MIWT1_1_PLR1_SU0_SUS0_SVW4_VWA1_VWB1_WG32_2_1
    SolutionIndex: 9
    SolutionNameMin: Cijk_Ailk_Bjlk_BBS_BH_Bias_SA_AS_MT32x32x64_MI32x32x1_SN_LDSB0_AFC1_AFEM1_DTVSM1_GRVWA4_GSU1_LPMn1_MIWT1_1_PLR3_SU0_SUS0_SVW4_VWA1_VWB1_WG32_2_1
    SolutionIndex: 10
    SolutionNameMin: Cijk_Ailk_Bjlk_BBS_BH_Bias_SA_AS_MT32x32x64_MI32x32x1_SN_LDSB0_AFC1_AFEM1_DTVSM1_GRVWA8_GSU1_LPMn1_MIWT1_1_PLR3_SU0_SUS0_SVW4_VWA1_VWB1_WG32_2_1
    SolutionIndex: 11
    SolutionNameMin: Cijk_Ailk_Bjlk_BBS_BH_Bias_SA_AS_MT32x32x64_MI32x32x1_SN_LDSB0_AFC1_AFEM8_DTVSM0_GRVWA8_GSU1_LPM2_MIWT1_1_PLR1_SU0_SUS0_SVW4_VWA1_VWB1_WG32_2_1
    SolutionIndex: 12
    SolutionNameMin: Cijk_Ailk_Bjlk_BBS_BH_Bias_SA_AS_MT32x32x64_MI32x32x1_SN_LDSB0_AFC1_AFEM8_DTVSM0_GRVWA4_GSU1_LPM1_MIWT1_1_PLR3_SU0_SUS0_SVW4_VWA1_VWB1_WG32_2_1
    SolutionIndex: 13
    SolutionNameMin: Cijk_Ailk_Bjlk_BBS_BH_Bias_SA_AS_MT32x32x64_MI32x32x1_SN_LDSB0_AFC1_AFEM8_DTVSM1_GRVWA4_GSU1_LPMn1_MIWT1_1_PLR3_SU0_SUS0_SVW4_VWA1_VWB1_WG32_2_1
    SolutionIndex: 14
    SolutionNameMin: Cijk_Ailk_Bjlk_BBS_BH_Bias_SA_AS_MT32x32x64_MI32x32x1_SN_LDSB0_AFC1_AFEM1_DTVSM1_GRVWA8_GSU1_LPMn1_MIWT1_1_PLR3_SU4_SUS256_SVW4_VWA1_VWB1_WG32_2_1
    SolutionIndex: 15
    SolutionNameMin: Cijk_Ailk_Bjlk_BBS_BH_Bias_SA_AS_MT32x32x64_MI32x32x1_SN_LDSB0_AFC1_AFEM8_DTVSM0_GRVWA4_GSU1_LPM1_MIWT1_1_PLR3_SU4_SUS256_SVW4_VWA1_VWB1_WG32_2_1
    SolutionIndex: 16
    SolutionNameMin: Cijk_Ailk_Bjlk_BBS_BH_Bias_SA_AS_MT32x32x64_MI32x32x1_SN_LDSB0_AFC1_AFEM8_DTVSM1_GRVWA4_GSU1_LPMn1_MIWT1_1_PLR3_SU4_SUS256_SVW4_VWA1_VWB1_WG32_2_1
    SolutionIndex: 17
    SolutionNameMin: Cijk_Ailk_Bjlk_BBS_BH_Bias_SA_AS_MT32x32x64_MI32x32x1_SN_LDSB0_AFC0_AFEM8_DTVSM1_GRVWA8_GSU2_LPMn1_MIWT1_1_PLR3_SU0_SUS0_SVW4_VWA1_VWB1_WG32_2_1
- - - [16, 16, 1, 16, 16, 16, 16, 16]
    - [0, 0.375092]
  - - [16, 16, 1, 32, 16, 16, 16, 16]
    - [4, 0.803137]
  - - [16, 16, 1, 64, 16, 16, 16, 16]
    - [11, 1.56038]
  - - [16, 16, 1, 96, 16, 16, 16, 16]
    - [5, 2.1445]
  - - [16, 16, 1, 128, 16, 16, 16, 16]
    - [16, 2.80068]
  - - [16, 16, 1, 136, 16, 16, 16, 16]
    - [17, 2.79871]
  - - [16, 16, 1, 256, 16, 16, 16, 16]
    - [6, 5.1522]
  - - [16, 16, 1, 264, 16, 16, 16, 16]
    - [6, 4.96211]
  - - [256, 256, 1, 16, 256, 256, 256, 256]
    - [12, 75.3287]
  - - [256, 256, 1, 24, 256, 256, 256, 256]
    - [3, 112.027]
  - - [256, 256, 1, 32, 256, 256, 256, 256]
    - [10, 152.631]
  - - [256, 256, 1, 64, 256, 256, 256, 256]
    - [8, 313.008]
  - - [256, 256, 1, 96, 256, 256, 256, 256]
    - [14, 402.769]
  - - [256, 256, 1, 128, 256, 256, 256, 256]
    - [11, 581.734]
  - - [256, 256, 1, 136, 256, 256, 256, 256]
    - [2, 563.394]
  - - [256, 256, 1, 256, 256, 256, 256, 256]
    - [1, 1055.17]
  - - [384, 384, 1, 16, 384, 384, 384, 384]
    - [9, 138.946]
  - - [384, 384, 1, 24, 384, 384, 384, 384]
    - [2, 201.995]
  - - [384, 384, 1, 32, 384, 384, 384, 384]
    - [2, 326.772]
  - - [384, 384, 1, 64, 384, 384, 384, 384]
    - [15, 549.312]
  - - [384, 384, 1, 96, 384, 384, 384, 384]
    - [13, 837.62]
  - - [384, 384, 1, 128, 384, 384, 384, 384]
    - [7, 586.16]
  - - [384, 384, 1, 136, 384, 384, 384, 384]
    - [8, 1077.01]
  - - [384, 384, 1, 256, 384, 384, 384, 384]
    - [3, 2076.33]
- null
- null
- DeviceEfficiency
