library/src/hcc_detail/rocsparselt/src/spmm/Tensile/Logic/aquavanjaram/gfx940/aquavanjaram_Cijk_Ailk_Bjlk_I8I8S_BH_SA_AH.yaml
- {MinimumRequiredVersion: 4.33.0}
- aquavanjaram
- gfx940
- [Device 0049, Device 0050]
    SolutionIndex: 0
    SolutionNameMin: Cijk_Ailk_Bjlk_I8I8S_BH_SA_AH_MT32x32x32_MI32x32x32x1_SN_1LDSB0_GRVW8_MIWT1_1_PGR2_PLR1_SU4_WG32_2_1_WGM12
    SolutionIndex: 1
    SolutionNameMin: Cijk_Ailk_Bjlk_I8I8S_BH_SA_AH_MT32x32x32_MI32x32x32x1_SN_1LDSB0_GRVW16_MIWT1_1_PGR2_PLR1_SU8_WG32_2_1_WGM12
    SolutionIndex: 2
    SolutionNameMin: Cijk_Ailk_Bjlk_I8I8S_BH_SA_AH_MT32x32x32_MI32x32x32x1_SN_1LDSB0_GRVW8_MIWT1_1_PGR2_PLR1_SU4_WG32_2_1_WGM18
    SolutionIndex: 3
    SolutionNameMin: Cijk_Ailk_Bjlk_I8I8S_BH_SA_AH_MT32x32x32_MI32x32x32x1_SN_1LDSB0_GRVW8_MIWT1_1_PGR1_PLR1_SU4_WG32_2_1_WGM19
    SolutionIndex: 4
    SolutionNameMin: Cijk_Ailk_Bjlk_I8I8S_BH_SA_AH_MT32x32x32_MI32x32x32x1_SN_1LDSB0_GRVW16_MIWT1_1_PGR2_PLR1_SU4_WG32_2_1_WGM19
    SolutionIndex: 5
    SolutionNameMin: Cijk_Ailk_Bjlk_I8I8S_BH_SA_AH_MT32x32x32_MI32x32x32x1_SN_1LDSB0_GRVW16_MIWT1_1_PGR1_PLR1_SU8_WG32_2_1_WGM19
    SolutionIndex: 6
    SolutionNameMin: Cijk_Ailk_Bjlk_I8I8S_BH_SA_AH_MT32x32x32_MI32x32x32x1_SN_1LDSB0_GRVW8_MIWT1_1_PGR2_PLR1_SU8_WG32_2_1_WGM19
    SolutionIndex: 7
    SolutionNameMin: Cijk_Ailk_Bjlk_I8I8S_BH_SA_AH_MT32x32x64_MI32x32x32x1_SN_1LDSB0_GRVW8_MIWT1_1_PGR2_PLR1_SU4_WG32_2_1_WGM12
    SolutionIndex: 8
    SolutionNameMin: Cijk_Ailk_Bjlk_I8I8S_BH_SA_AH_MT32x32x64_MI32x32x32x1_SN_1LDSB0_GRVW16_MIWT1_1_PGR2_PLR1_SU4_WG32_2_1_WGM12
    SolutionIndex: 9
    SolutionNameMin: Cijk_Ailk_Bjlk_I8I8S_BH_SA_AH_MT32x32x64_MI32x32x32x1_SN_1LDSB0_GRVW8_MIWT1_1_PGR2_PLR3_SU8_WG32_2_1_WGM12
    SolutionIndex: 10
    SolutionNameMin: Cijk_Ailk_Bjlk_I8I8S_BH_SA_AH_MT32x32x64_MI32x32x32x1_SN_1LDSB0_GRVW16_MIWT1_1_PGR2_PLR3_SU4_WG32_2_1_WGM18
    SolutionIndex: 11
    SolutionNameMin: Cijk_Ailk_Bjlk_I8I8S_BH_SA_AH_MT32x32x64_MI32x32x32x1_SN_1LDSB0_GRVW16_MIWT1_1_PGR2_PLR1_SU4_WG32_2_1_WGM19
    SolutionIndex: 12
    SolutionNameMin: Cijk_Ailk_Bjlk_I8I8S_BH_SA_AH_MT32x32x64_MI32x32x32x1_SN_1LDSB0_GRVW8_MIWT1_1_PGR1_PLR3_SU8_WG32_2_1_WGM19
    SolutionIndex: 13
    SolutionNameMin: Cijk_Ailk_Bjlk_I8I8S_BH_SA_AH_MT32x32x32_MI32x32x32x1_SN_1LDSB0_GRVW8_MIWT1_1_PGR2_PLR1_SU8_SRVW0_WG32_2_1_WGM12
    SolutionIndex: 14
    SolutionNameMin: Cijk_Ailk_Bjlk_I8I8S_BH_SA_AH_MT32x32x32_MI32x32x32x1_SN_1LDSB0_GRVW8_MIWT1_1_PGR1_PLR1_SU8_SRVW0_WG32_2_1_WGM18
    SolutionIndex: 15
    SolutionNameMin: Cijk_Ailk_Bjlk_I8I8S_BH_SA_AH_MT32x32x128_MI32x32x32x1_SN_1LDSB0_GRVW16_MIWT1_1_PGR1_PLR1_SU8_SRVW0_WG32_2_1_WGM12
    SolutionIndex: 16
    SolutionNameMin: Cijk_Ailk_Bjlk_I8I8S_BH_SA_AH_MT32x32x32_MI32x32x32x1_SN_1LDSB0_GRVW8_MIWT1_1_PGR2_PLR1_SU4_SRVW0_WG32_2_1_WGM19
    SolutionIndex: 17
    SolutionNameMin: Cijk_Ailk_Bjlk_I8I8S_BH_SA_AH_MT32x32x32_MI32x32x32x1_SN_1LDSB0_GRVW16_MIWT1_1_PGR2_PLR1_SU8_SRVW0_WG32_2_1_WGM19
    SolutionIndex: 18
    SolutionNameMin: Cijk_Ailk_Bjlk_I8I8S_BH_SA_AH_MT32x32x32_MI32x32x32x1_SN_1LDSB0_GRVW16_MIWT1_1_PGR1_PLR1_SU4_SRVW0_WG32_2_1_WGM12
    SolutionIndex: 19
    SolutionNameMin: Cijk_Ailk_Bjlk_I8I8S_BH_SA_AH_MT32x32x64_MI32x32x32x1_SN_1LDSB0_GRVW8_MIWT1_1_PGR2_PLR3_SU8_SRVW0_WG32_2_1_WGM18
    SolutionIndex: 20
    SolutionNameMin: Cijk_Ailk_Bjlk_I8I8S_BH_SA_AH_MT32x32x64_MI32x32x32x1_SN_1LDSB0_GRVW8_MIWT1_1_PGR1_PLR3_SU4_SRVW0_WG32_2_1_WGM19
    SolutionIndex: 21
    SolutionNameMin: Cijk_Ailk_Bjlk_I8I8S_BH_SA_AH_MT32x32x32_MI32x32x32x1_SN_1LDSB0_GRVW16_MIWT1_1_PGR1_PLR1_SU8_SRVW0_WG32_2_1_WGM18
    SolutionIndex: 22
    SolutionNameMin: Cijk_Ailk_Bjlk_I8I8S_BH_SA_AH_MT32x32x128_MI32x32x32x1_SN_1LDSB0_GRVW16_MIWT1_1_PGR1_PLR1_SU8_SRVW0_WG32_2_1_WGM19
    SolutionIndex: 23
    SolutionNameMin: Cijk_Ailk_Bjlk_I8I8S_BH_SA_AH_MT32x32x64_MI32x32x32x1_SN_1LDSB0_GRVW8_MIWT1_1_PGR1_PLR1_SU8_SRVW0_WG32_2_1_WGM18
    SolutionIndex: 24
    SolutionNameMin: Cijk_Ailk_Bjlk_I8I8S_BH_SA_AH_MT32x32x64_MI32x32x32x1_SN_1LDSB0_GRVW16_MIWT1_1_PGR2_PLR3_SU4_SRVW0_WG32_2_1_WGM19
- - - [15, 15, 1, 16]
    - [6, 0.0]
  - - [15, 15, 1, 32]
    - [6, 0.0]
  - - [15, 15, 1, 64]
    - [12, 0.0]
  - - [15, 15, 1, 96]
    - [0, 0.0]
  - - [15, 15, 1, 128]
    - [9, 0.0]
  - - [15, 15, 1, 136]
    - [6, 0.0]
  - - [15, 15, 1, 256]
    - [6, 0.0]
  - - [15, 15, 1, 264]
    - [0, 0.0]
  - - [15, 15, 1, 528]
    - [0, 0.0]
  - - [15, 15, 1, 544]
    - [0, 0.0]
  - - [15, 15, 1, 576]
    - [9, 0.0]
  - - [15, 15, 1, 608]
    - [0, 0.0]
  - - [15, 15, 1, 640]
    - [9, 0.0]
  - - [15, 15, 1, 768]
    - [13, 0.001]
  - - [15, 15, 1, 776]
    - [9, 0.0]
  - - [32, 32, 1, 16]
    - [5, 0.0]
  - - [32, 32, 1, 32]
    - [4, 0.0]
  - - [32, 32, 1, 64]
    - [11, 0.0]
  - - [32, 32, 1, 96]
    - [13, 0.001]
  - - [32, 32, 1, 128]
    - [7, 0.001]
  - - [32, 32, 1, 136]
    - [3, 0.001]
  - - [32, 32, 1, 256]
    - [8, 0.001]
  - - [32, 32, 1, 264]
    - [4, 0.001]
  - - [32, 32, 1, 528]
    - [4, 0.002]
  - - [32, 32, 1, 544]
    - [4, 0.002]
  - - [32, 32, 1, 576]
    - [8, 0.002]
  - - [32, 32, 1, 608]
    - [2, 0.002]
  - - [32, 32, 1, 640]
    - [13, 0.003]
  - - [32, 32, 1, 768]
    - [8, 0.003]
  - - [32, 32, 1, 776]
    - [13, 0.003]
  - - [256, 256, 1, 16]
    - [1, 0.005]
  - - [256, 256, 1, 24]
    - [2, 0.008]
  - - [256, 256, 1, 32]
    - [3, 0.012]
  - - [256, 256, 1, 64]
    - [10, 0.023]
  - - [256, 256, 1, 96]
    - [14, 0.031]
  - - [256, 256, 1, 128]
    - [15, 0.041]
  - - [256, 256, 1, 136]
    - [3, 0.037]
  - - [256, 256, 1, 256]
    - [14, 0.074]
  - - [256, 256, 1, 264]
    - [16, 0.067]
  - - [256, 256, 1, 280]
    - [14, 0.07]
  - - [256, 256, 1, 296]
    - [17, 0.074]
  - - [256, 256, 1, 528]
    - [4, 0.118]
  - - [256, 256, 1, 544]
    - [16, 0.131]
  - - [256, 256, 1, 576]
    - [17, 0.137]
  - - [256, 256, 1, 608]
    - [16, 0.143]
  - - [256, 256, 1, 640]
    - [16, 0.149]
  - - [256, 256, 1, 768]
    - [16, 0.171]
  - - [256, 256, 1, 776]
    - [16, 0.158]
  - - [256, 256, 1, 792]
    - [17, 0.16]
  - - [256, 256, 1, 808]
    - [16, 0.163]
  - - [255, 255, 1, 16]
    - [4, 0.004]
  - - [255, 255, 1, 32]
    - [18, 0.01]
  - - [255, 255, 1, 64]
    - [19, 0.018]
  - - [255, 255, 1, 96]
    - [16, 0.026]
  - - [255, 255, 1, 128]
    - [14, 0.034]
  - - [255, 255, 1, 136]
    - [17, 0.031]
  - - [255, 255, 1, 256]
    - [16, 0.061]
  - - [255, 255, 1, 264]
    - [17, 0.057]
  - - [255, 255, 1, 528]
    - [16, 0.102]
  - - [255, 255, 1, 544]
    - [16, 0.114]
  - - [255, 255, 1, 576]
    - [17, 0.121]
  - - [255, 255, 1, 608]
    - [17, 0.126]
  - - [255, 255, 1, 640]
    - [17, 0.132]
  - - [255, 255, 1, 768]
    - [17, 0.149]
  - - [255, 255, 1, 776]
    - [16, 0.137]
  - - [264, 264, 1, 16]
    - [17, 0.005]
  - - [264, 264, 1, 32]
    - [16, 0.01]
  - - [264, 264, 1, 64]
    - [20, 0.02]
  - - [264, 264, 1, 96]
    - [21, 0.027]
  - - [264, 264, 1, 128]
    - [22, 0.037]
  - - [264, 264, 1, 136]
    - [23, 0.034]
  - - [264, 264, 1, 256]
    - [17, 0.066]
  - - [264, 264, 1, 264]
    - [17, 0.063]
  - - [264, 264, 1, 528]
    - [17, 0.112]
  - - [264, 264, 1, 544]
    - [16, 0.126]
  - - [264, 264, 1, 576]
    - [16, 0.132]
  - - [264, 264, 1, 608]
    - [16, 0.136]
  - - [264, 264, 1, 640]
    - [16, 0.141]
  - - [264, 264, 1, 768]
    - [24, 0.158]
  - - [264, 264, 1, 776]
    - [17, 0.15]
- null
- null
- DeviceEfficiency
