library/src/hcc_detail/rocsparselt/src/spmm/Tensile/Logic/aquavanjaram/gfx940/aquavanjaram_Cijk_Ailk_Bljk_I8I8S_BH_SA_AH.yaml
- {MinimumRequiredVersion: 4.33.0}
- aquavanjaram
- gfx940
- [Device 0049, Device 0050]
    SolutionIndex: 0
    SolutionNameMin: Cijk_Ailk_Bljk_I8I8S_BH_SA_AH_MT32x32x32_MI32x32x32x1_SN_1LDSB0_GRVW8_LPB16_MIWT1_1_PGR1_PLR1_SU4_TLDS1_WG32_2_1_WGM12
    SolutionIndex: 1
    SolutionNameMin: Cijk_Ailk_Bljk_I8I8S_BH_SA_AH_MT32x32x32_MI32x32x32x1_SN_1LDSB0_GRVW8_LPB16_MIWT1_1_PGR2_PLR1_SU4_TLDS1_WG32_2_1_WGM12
    SolutionIndex: 2
    SolutionNameMin: Cijk_Ailk_Bljk_I8I8S_BH_SA_AH_MT32x32x32_MI32x32x32x1_SN_1LDSB0_GRVW16_LPB16_MIWT1_1_PGR2_PLR1_SU4_TLDS1_WG32_2_1_WGM12
    SolutionIndex: 3
    SolutionNameMin: Cijk_Ailk_Bljk_I8I8S_BH_SA_AH_MT32x32x32_MI32x32x32x1_SN_1LDSB0_GRVW8_LPB16_MIWT1_1_PGR1_PLR1_SU8_TLDS1_WG32_2_1_WGM12
    SolutionIndex: 4
    SolutionNameMin: Cijk_Ailk_Bljk_I8I8S_BH_SA_AH_MT32x32x32_MI32x32x32x1_SN_1LDSB0_GRVW8_LPB2_MIWT1_1_PGR2_PLR1_SU8_TLDS0_WG32_2_1_WGM12
    SolutionIndex: 5
    SolutionNameMin: Cijk_Ailk_Bljk_I8I8S_BH_SA_AH_MT32x32x32_MI32x32x32x1_SN_1LDSB0_GRVW16_LPB16_MIWT1_1_PGR1_PLR1_SU4_TLDS1_WG32_2_1_WGM18
    SolutionIndex: 6
    SolutionNameMin: Cijk_Ailk_Bljk_I8I8S_BH_SA_AH_MT32x32x32_MI32x32x32x1_SN_1LDSB0_GRVW8_LPB16_MIWT1_1_PGR1_PLR1_SU8_TLDS1_WG32_2_1_WGM18
    SolutionIndex: 7
    SolutionNameMin: Cijk_Ailk_Bljk_I8I8S_BH_SA_AH_MT32x32x32_MI32x32x32x1_SN_1LDSB0_GRVW16_LPB16_MIWT1_1_PGR1_PLR1_SU8_TLDS1_WG32_2_1_WGM18
    SolutionIndex: 8
    SolutionNameMin: Cijk_Ailk_Bljk_I8I8S_BH_SA_AH_MT32x32x32_MI32x32x32x1_SN_1LDSB0_GRVW16_LPB16_MIWT1_1_PGR2_PLR1_SU8_TLDS1_WG32_2_1_WGM18
    SolutionIndex: 9
    SolutionNameMin: Cijk_Ailk_Bljk_I8I8S_BH_SA_AH_MT32x32x32_MI32x32x32x1_SN_1LDSB0_GRVW8_LPB16_MIWT1_1_PGR1_PLR1_SU8_TLDS1_WG32_2_1_WGM19
    SolutionIndex: 10
    SolutionNameMin: Cijk_Ailk_Bljk_I8I8S_BH_SA_AH_MT32x32x32_MI32x32x32x1_SN_1LDSB0_GRVW16_LPB16_MIWT1_1_PGR1_PLR1_SU8_TLDS1_WG32_2_1_WGM19
    SolutionIndex: 11
    SolutionNameMin: Cijk_Ailk_Bljk_I8I8S_BH_SA_AH_MT32x32x32_MI32x32x32x1_SN_1LDSB0_GRVW8_LPB16_MIWT1_1_PGR2_PLR1_SU8_TLDS1_WG32_2_1_WGM19
    SolutionIndex: 12
    SolutionNameMin: Cijk_Ailk_Bljk_I8I8S_BH_SA_AH_MT32x32x32_MI32x32x32x1_SN_1LDSB0_GRVW16_LPB16_MIWT1_1_PGR2_PLR1_SU8_TLDS1_WG32_2_1_WGM19
    SolutionIndex: 13
    SolutionNameMin: Cijk_Ailk_Bljk_I8I8S_BH_SA_AH_MT32x32x64_MI32x32x32x1_SN_1LDSB0_GRVW16_LPB16_MIWT1_1_PGR2_PLR1_SU4_TLDS1_WG32_2_1_WGM12
    SolutionIndex: 14
    SolutionNameMin: Cijk_Ailk_Bljk_I8I8S_BH_SA_AH_MT32x32x64_MI32x32x32x1_SN_1LDSB0_GRVW16_LPB16_MIWT1_1_PGR1_PLR1_SU8_TLDS1_WG32_2_1_WGM12
    SolutionIndex: 15
    SolutionNameMin: Cijk_Ailk_Bljk_I8I8S_BH_SA_AH_MT32x32x64_MI32x32x32x1_SN_1LDSB0_GRVW16_LPB16_MIWT1_1_PGR2_PLR1_SU4_TLDS1_WG32_2_1_WGM18
    SolutionIndex: 16
    SolutionNameMin: Cijk_Ailk_Bljk_I8I8S_BH_SA_AH_MT32x32x64_MI32x32x32x1_SN_1LDSB0_GRVW16_LPB16_MIWT1_1_PGR2_PLR3_SU4_TLDS1_WG32_2_1_WGM18
    SolutionIndex: 17
    SolutionNameMin: Cijk_Ailk_Bljk_I8I8S_BH_SA_AH_MT32x32x64_MI32x32x32x1_SN_1LDSB0_GRVW16_LPB16_MIWT1_1_PGR2_PLR1_SU8_TLDS1_WG32_2_1_WGM18
    SolutionIndex: 18
    SolutionNameMin: Cijk_Ailk_Bljk_I8I8S_BH_SA_AH_MT32x32x64_MI32x32x32x1_SN_1LDSB0_GRVW16_LPB16_MIWT1_1_PGR1_PLR1_SU4_TLDS1_WG32_2_1_WGM19
    SolutionIndex: 19
    SolutionNameMin: Cijk_Ailk_Bljk_I8I8S_BH_SA_AH_MT32x32x64_MI32x32x32x1_SN_1LDSB0_GRVW16_LPB16_MIWT1_1_PGR1_PLR1_SU8_TLDS1_WG32_2_1_WGM19
    SolutionIndex: 20
    SolutionNameMin: Cijk_Ailk_Bljk_I8I8S_BH_SA_AH_MT32x32x64_MI32x32x32x1_SN_1LDSB0_GRVW8_LPB16_MIWT1_1_PGR2_PLR3_SU8_TLDS1_WG32_2_1_WGM19
    SolutionIndex: 21
    SolutionNameMin: Cijk_Ailk_Bljk_I8I8S_BH_SA_AH_MT32x32x128_MI32x32x32x1_SN_1LDSB0_GRVW16_LPB16_MIWT1_1_PGR2_PLR1_SU4_TLDS1_WG32_2_1_WGM12
    SolutionIndex: 22
    SolutionNameMin: Cijk_Ailk_Bljk_I8I8S_BH_SA_AH_MT32x32x128_MI32x32x32x1_SN_1LDSB0_GRVW16_LPB16_MIWT1_1_PGR2_PLR1_SU8_TLDS1_WG32_2_1_WGM12
    SolutionIndex: 23
    SolutionNameMin: Cijk_Ailk_Bljk_I8I8S_BH_SA_AH_MT32x32x64_MI32x32x32x1_SN_1LDSB0_GRVW16_LPB16_MIWT1_1_PGR2_PLR3_SU4_SRVW0_TLDS1_WG32_2_1_WGM19
    SolutionIndex: 24
    SolutionNameMin: Cijk_Ailk_Bljk_I8I8S_BH_SA_AH_MT32x32x32_MI32x32x32x1_SN_1LDSB0_GRVW16_LPB16_MIWT1_1_PGR2_PLR1_SU8_SRVW0_TLDS1_WG32_2_1_WGM18
    SolutionIndex: 25
    SolutionNameMin: Cijk_Ailk_Bljk_I8I8S_BH_SA_AH_MT32x32x64_MI32x32x32x1_SN_1LDSB0_GRVW16_LPB16_MIWT1_1_PGR1_PLR3_SU4_SRVW0_TLDS1_WG32_2_1_WGM18
    SolutionIndex: 26
    SolutionNameMin: Cijk_Ailk_Bljk_I8I8S_BH_SA_AH_MT32x32x128_MI32x32x32x1_SN_1LDSB0_GRVW16_LPB16_MIWT1_1_PGR1_PLR5_SU8_SRVW0_TLDS1_WG32_2_1_WGM12
    SolutionIndex: 27
    SolutionNameMin: Cijk_Ailk_Bljk_I8I8S_BH_SA_AH_MT32x32x32_MI32x32x32x1_SN_1LDSB0_GRVW16_LPB16_MIWT1_1_PGR2_PLR1_SU8_SRVW0_TLDS1_WG32_2_1_WGM19
    SolutionIndex: 28
    SolutionNameMin: Cijk_Ailk_Bljk_I8I8S_BH_SA_AH_MT32x32x32_MI32x32x32x1_SN_1LDSB0_GRVW16_LPB16_MIWT1_1_PGR2_PLR1_SU4_SRVW0_TLDS1_WG32_2_1_WGM19
    SolutionIndex: 29
    SolutionNameMin: Cijk_Ailk_Bljk_I8I8S_BH_SA_AH_MT32x32x64_MI32x32x32x1_SN_1LDSB0_GRVW16_LPB16_MIWT1_1_PGR1_PLR1_SU8_SRVW0_TLDS1_WG32_2_1_WGM12
    SolutionIndex: 30
    SolutionNameMin: Cijk_Ailk_Bljk_I8I8S_BH_SA_AH_MT32x32x64_MI32x32x32x1_SN_1LDSB0_GRVW16_LPB16_MIWT1_1_PGR1_PLR1_SU8_SRVW0_TLDS1_WG32_2_1_WGM18
    SolutionIndex: 31
    SolutionNameMin: Cijk_Ailk_Bljk_I8I8S_BH_SA_AH_MT32x32x64_MI32x32x32x1_SN_1LDSB0_GRVW16_LPB16_MIWT1_1_PGR2_PLR1_SU8_SRVW0_TLDS1_WG32_2_1_WGM19
    SolutionIndex: 32
    SolutionNameMin: Cijk_Ailk_Bljk_I8I8S_BH_SA_AH_MT32x32x32_MI32x32x32x1_SN_1LDSB0_GRVW8_LPB16_MIWT1_1_PGR1_PLR1_SU4_SRVW0_TLDS1_WG32_2_1_WGM19
    SolutionIndex: 33
    SolutionNameMin: Cijk_Ailk_Bljk_I8I8S_BH_SA_AH_MT32x32x64_MI32x32x32x1_SN_1LDSB0_GRVW8_LPB16_MIWT1_1_PGR1_PLR3_SU4_SRVW0_TLDS1_WG32_2_1_WGM12
    SolutionIndex: 34
    SolutionNameMin: Cijk_Ailk_Bljk_I8I8S_BH_SA_AH_MT32x32x32_MI32x32x32x1_SN_1LDSB0_GRVW16_LPB16_MIWT1_1_PGR1_PLR1_SU8_SRVW0_TLDS1_WG32_2_1_WGM18
    SolutionIndex: 35
    SolutionNameMin: Cijk_Ailk_Bljk_I8I8S_BH_SA_AH_MT32x32x64_MI32x32x32x1_SN_1LDSB0_GRVW16_LPB16_MIWT1_1_PGR2_PLR1_SU4_SRVW0_TLDS1_WG32_2_1_WGM18
    SolutionIndex: 36
    SolutionNameMin: Cijk_Ailk_Bljk_I8I8S_BH_SA_AH_MT32x32x64_MI32x32x32x1_SN_1LDSB0_GRVW8_LPB16_MIWT1_1_PGR1_PLR3_SU8_SRVW0_TLDS1_WG32_2_1_WGM18
- - - [15, 15, 1, 16]
    - [6, 0.0]
  - - [15, 15, 1, 32]
    - [0, 0.0]
  - - [15, 15, 1, 64]
    - [19, 0.0]
  - - [15, 15, 1, 96]
    - [6, 0.0]
  - - [15, 15, 1, 128]
    - [19, 0.0]
  - - [15, 15, 1, 136]
    - [2, 0.0]
  - - [15, 15, 1, 256]
    - [18, 0.0]
  - - [15, 15, 1, 264]
    - [14, 0.0]
  - - [15, 15, 1, 528]
    - [13, 0.0]
  - - [15, 15, 1, 544]
    - [20, 0.0]
  - - [15, 15, 1, 576]
    - [17, 0.0]
  - - [15, 15, 1, 608]
    - [11, 0.0]
  - - [15, 15, 1, 640]
    - [23, 0.001]
  - - [15, 15, 1, 768]
    - [13, 0.001]
  - - [15, 15, 1, 776]
    - [15, 0.001]
  - - [32, 32, 1, 16]
    - [2, 0.0]
  - - [32, 32, 1, 32]
    - [2, 0.0]
  - - [32, 32, 1, 64]
    - [14, 0.0]
  - - [32, 32, 1, 96]
    - [10, 0.001]
  - - [32, 32, 1, 128]
    - [22, 0.001]
  - - [32, 32, 1, 136]
    - [0, 0.001]
  - - [32, 32, 1, 256]
    - [21, 0.001]
  - - [32, 32, 1, 264]
    - [12, 0.001]
  - - [32, 32, 1, 528]
    - [13, 0.002]
  - - [32, 32, 1, 544]
    - [12, 0.002]
  - - [32, 32, 1, 576]
    - [16, 0.003]
  - - [32, 32, 1, 608]
    - [24, 0.003]
  - - [32, 32, 1, 640]
    - [13, 0.003]
  - - [32, 32, 1, 768]
    - [21, 0.003]
  - - [32, 32, 1, 776]
    - [17, 0.003]
  - - [256, 256, 1, 16]
    - [5, 0.005]
  - - [256, 256, 1, 24]
    - [8, 0.008]
  - - [256, 256, 1, 32]
    - [7, 0.012]
  - - [256, 256, 1, 64]
    - [25, 0.024]
  - - [256, 256, 1, 96]
    - [3, 0.033]
  - - [256, 256, 1, 128]
    - [26, 0.044]
  - - [256, 256, 1, 136]
    - [5, 0.041]
  - - [256, 256, 1, 256]
    - [27, 0.082]
  - - [256, 256, 1, 264]
    - [9, 0.074]
  - - [256, 256, 1, 280]
    - [1, 0.078]
  - - [256, 256, 1, 296]
    - [28, 0.083]
  - - [256, 256, 1, 528]
    - [27, 0.135]
  - - [256, 256, 1, 544]
    - [27, 0.15]
  - - [256, 256, 1, 576]
    - [29, 0.165]
  - - [256, 256, 1, 608]
    - [27, 0.167]
  - - [256, 256, 1, 640]
    - [30, 0.18]
  - - [256, 256, 1, 768]
    - [31, 0.206]
  - - [256, 256, 1, 776]
    - [28, 0.183]
  - - [256, 256, 1, 792]
    - [27, 0.188]
  - - [256, 256, 1, 808]
    - [28, 0.191]
  - - [255, 255, 1, 16]
    - [4, 0.004]
  - - [255, 255, 1, 32]
    - [32, 0.01]
  - - [255, 255, 1, 64]
    - [33, 0.019]
  - - [255, 255, 1, 96]
    - [34, 0.027]
  - - [255, 255, 1, 128]
    - [34, 0.036]
  - - [255, 255, 1, 136]
    - [27, 0.034]
  - - [255, 255, 1, 256]
    - [28, 0.069]
  - - [255, 255, 1, 264]
    - [32, 0.061]
  - - [255, 255, 1, 528]
    - [27, 0.116]
  - - [255, 255, 1, 544]
    - [28, 0.129]
  - - [255, 255, 1, 576]
    - [35, 0.135]
  - - [255, 255, 1, 608]
    - [28, 0.143]
  - - [255, 255, 1, 640]
    - [28, 0.152]
  - - [255, 255, 1, 768]
    - [35, 0.172]
  - - [255, 255, 1, 776]
    - [27, 0.152]
  - - [264, 264, 1, 16]
    - [28, 0.005]
  - - [264, 264, 1, 32]
    - [27, 0.011]
  - - [264, 264, 1, 64]
    - [36, 0.021]
  - - [264, 264, 1, 96]
    - [27, 0.031]
  - - [264, 264, 1, 128]
    - [27, 0.04]
  - - [264, 264, 1, 136]
    - [27, 0.038]
  - - [264, 264, 1, 256]
    - [27, 0.075]
  - - [264, 264, 1, 264]
    - [27, 0.07]
  - - [264, 264, 1, 528]
    - [28, 0.128]
  - - [264, 264, 1, 544]
    - [27, 0.143]
  - - [264, 264, 1, 576]
    - [27, 0.151]
  - - [264, 264, 1, 608]
    - [27, 0.156]
  - - [264, 264, 1, 640]
    - [27, 0.165]
  - - [264, 264, 1, 768]
    - [31, 0.19]
  - - [264, 264, 1, 776]
    - [28, 0.171]
- null
- null
- DeviceEfficiency
